topic_id,date,topic_order,title,section_type
2016-01-26-T-001,2016-01-26,1,Public Accounts Committee and Estimates Committee,OS
2016-01-26-T-002,2016-01-26,2,Central Provident Fund (Amendment) Bill,BI
2016-01-26-T-003,2016-01-26,3,Pioneer Generation Fund (Amendment) Bill,BI
2016-01-26-T-004,2016-01-26,4,Women's Charter (Amendment) Bill,BI
2016-01-26-T-005,2016-01-26,5,Debate on President's Address,OS
2016-01-26-T-006,2016-01-26,6,Adjournment of Debate,OS
2016-01-26-T-007,2016-01-26,7,Adjournment,OS
