Date,Topic_CID,Order,Title,Subtitle,Section_Type,Question_Count
2022-02-14,2022-02-14-T-001,1,Impact of Agreement to Realign Flight Information Region Boundary between Singapore and Jakarta,,OA,
2022-02-14,2022-02-14-T-002,2,Enhancing Security of Digital Banking Following Recent Scams,,OA,
2022-02-14,2022-02-14-T-003,3,Update on Internal Investigations into Police Officers Involved in Parti Liyani v PP 2020 SGHC 187 Case,,OA,
2022-02-14,2022-02-14-T-004,4,Support for Children with Special Needs and Their Caregivers,,OA,
2022-02-14,2022-02-14-T-005,5,Clarification by Minister for Home Affairs,,OS,
2022-02-14,2022-02-14-T-006,6,Training of Bus Captains in Inclusive Service Delivery to Assist Commuters with Special Needs,,OA,
2022-02-14,2022-02-14-T-007,7,Update on Temporary Electricity Contracting Support Scheme and Impact of Exit of Electricity Retailers on SMEs and Support Available,,OA,
2022-02-14,2022-02-14-T-008,8,"Jobs Created by New Investments Brought in by EDB in Last Three Years, their Profile and Preparedness of Local Workforce for this Growth ",,OA,
2022-02-14,2022-02-14-T-009,9,Breakdown on Financial Aid Per Capita Provided to Students in Tertiary Institutions,,OA,
2022-02-14,2022-02-14-T-010,10,The Agreements under the Expanded Framework between Singapore and Indonesia,Statement by Senior Minister and Coordinating Minister for National Security,OS,
2022-02-14,2022-02-14-T-011,11,The Agreement on the Realignment of the Boundary between the Jakarta and the Singapore Flight Information Regions,Statement by the Minister for Transport,OS,
2022-02-14,2022-02-14-T-012,12,Financial Services and Markets Bill,,BI,
2022-02-14,2022-02-14-T-013,13,Gambling Regulatory Authority of Singapore Bill,,BI,
2022-02-14,2022-02-14-T-014,14,Gambling Control Bill,,BI,
2022-02-14,2022-02-14-T-015,15,COVID-19 (Temporary Measures) (Amendment) Bill,,BI,
2022-02-14,2022-02-14-T-016,16,Economic Expansion Incentives (Relief From Income Tax) (Amendment) Bill,,BP,
2022-02-14,2022-02-14-T-017,17,Hijacking of Aircraft and Protection of Aircraft and International Airports (Amendment) Bill,,BP,
2022-02-14,2022-02-14-T-018,18,Administration of Muslim Law (Amendment) Bill ,,BP,
2022-02-14,2022-02-14-T-019,19,Adjournment,,OS,
2022-02-14,2022-02-14-T-020,20,Rethinking Preventive Health to Generate Better Outcomes,,OS,
2022-02-14,2022-02-14-T-021,21,Data on Prevalence of No-medical Leave Incentives and Penalties Across Industries and Safeguards to Ensure Sick Employees Are Not Disincentivised to Take Necessary Medical Leave,,WANA,
2022-02-14,2022-02-14-T-022,22,Impact on Affordability of Insurance Premiums from NTUC Income's Conversion from Insurance Co-operative to Corporate Entity,,WANA,
2022-02-14,2022-02-14-T-023,23,Considerations in Extending Formula One Singapore Grand Prix for Another Seven Years and Expected Overall Benefits to Singapore,,WANA,
2022-02-14,2022-02-14-T-024,24,Number of Fights Amongst Migrant Workers in Dormitories in Last Two Years and Measures and Protocols in Place to Maintain Law and Order,,WANA,
2022-02-14,2022-02-14-T-025,25,Average Weekly Number of Commuters between Singapore and Batam or Bintan Before COVID-19 Pandemic and Risk Mitigation Measures to Manage Transmission Risks When Travel Restrictions Are Lifted,,WANA,
2022-02-14,2022-02-14-T-026,26,"Measures to Address Residents' Complaints of Slippery and Wet Drop-off Points, Walkways and Lift Lobbies in HDB BTO Estates",,WANA,
2022-02-14,2022-02-14-T-027,27,Study on Potential Impact of Work-from-home Legislation over Past Two Years on Employers and Employees,,WANA,
2022-02-14,2022-02-14-T-028,28,Local Efforts to Coordinate and Oversee Relief and Fundraising Initiatives to Help Malaysians Affected by Recent Floods,,WANA,
2022-02-14,2022-02-14-T-029,29,Medical Leave Given to Public Healthcare Workers Contracting COVID-19 and Measures in Place to Ensure Healthcare System Not Compromised,,WANA,
2022-02-14,2022-02-14-T-030,30,Reported Cases of Sexual Harassment at Workplace in Past Five Years,,WANA,
2022-02-14,2022-02-14-T-031,31,Reasons for Recent Record High Premiums of Motorcycle COEs and Measures to Help Those Impacted and Dependent on Motorcycles for Livelihoods,,WANA,
2022-02-14,2022-02-14-T-032,32,Measures in Place to Prevent Discriminatory Practice in Rental Market of HDB Flats to Minorities,,WANA,
2022-02-14,2022-02-14-T-033,33,Number of Health Risk Warnings Issued with Breakdown of Cases Since Revision of Healthcare Protocols from 11 October 2021,,WANA,
2022-02-14,2022-02-14-T-034,34,Estimated Maintenance Costs of Features and Landscaping During Design of Common Property in BTO Estates,,WANA,
2022-02-14,2022-02-14-T-035,35,Availability of COVID-19 Healthcare Award or Similar Award Scheme for Cleaning Staff in Non-healthcare Settings to Recognise Contribution to National Effort Against Pandemic,,WANA,
2022-02-14,2022-02-14-T-036,36,Consideration for Students Affected by School Closures and Transferred to Other Schools,,WANA,
2022-02-14,2022-02-14-T-037,37,Approval Process for Subsidised Home Broadband Internet Connectivity for Low-income Households from 2020 to 2021,,WANA,
2022-02-14,2022-02-14-T-038,38,Control Systems in Place to Ensure Proper Oversight and Governance of Public Service Officers from Hybrid Modes of Working,,WANA,
2022-02-14,2022-02-14-T-039,39,Update on Assessment of Novavax Vaccine,,WANA,
2022-02-14,2022-02-14-T-040,40,Number of Requests for Exemption from Vaccination Differentiated Safe Management Measures (VDS) at Workplace and Existence of VDS as Subsidiary Legislation,,WANA,
2022-02-14,2022-02-14-T-041,41,Target Criteria Before COVID-19 Restrictions Are Lifted and Normal Dining and Socialising Allowed,,WANA,
2022-02-14,2022-02-14-T-042,42,Reasons for Allowing Groups of Five Unvaccinated Persons to Gather,,WANA,
2022-02-14,2022-02-14-T-043,43,Number of Infant Care Applications and Successful Placement Rates in 2021,,WANA,
2022-02-14,2022-02-14-T-044,44,Business Costs for Point-to-point Sector for Passenger Transport in Past Two Years,,WANA,
2022-02-14,2022-02-14-T-045,45,Current Number and Percentage of Civil Servants Deemed Unable to Work from Home Based on Job Functions and Eligibility for Flexible Work Arrangements,,WANA,
2022-02-14,2022-02-14-T-046,46,Enforcement of Special Covenant 2(1)(a) Memorandum of Lease to HDB's Lease Agreement to Prevent Persistent Smoking Near Balconies or Windows Despite Advisories and Mediation Efforts,,WANA,
2022-02-14,2022-02-14-T-047,47,Incentivising Bus Operators to Offer Cheaper and More Flexible Options to Encourage Students to Take School Buses,,WANA,
2022-02-14,2022-02-14-T-048,48,Number of Sound Pollution Complaints in HDB Estates over Past Two Years and Studies on How to Manage Them Via Better Design and Construction Materials for New HDB Estates,,WANA,
2022-02-14,2022-02-14-T-049,49,Requirement for Online Service Providers to Insert Advisories on Severe Penalty for Posts Relating to Illegal Drugs and Their Trafficking into Singapore,,WANA,
2022-02-14,2022-02-14-T-050,50,Plans beyond COVID-19 Pandemic to Recruit Singaporeans for Jobs in Healthcare and Other Related Sectors,,WANA,
2022-02-14,2022-02-14-T-051,51,"Number and Percentage of SingapoRediscover Vouchers Redeemed, Donated, Unused and Lapsed at End 2021 and Impact of Scheme on Tourism Sector vis-a-vis Initial Target Set to Justify Creation",,WANA,
2022-02-14,2022-02-14-T-052,52,Reasonable Staff-to-client Ratio for Social Service Agencies under Guidelines for MSF-funded Programmes,,WANA,
2022-02-14,2022-02-14-T-053,53,Impact of New Trends Such As Work and Study from Home on Design of Future Building Developments,,WANA,
2022-02-14,2022-02-14-T-054,54,Further Steps to Rein in Escalating Prices of HDB Resale Flats,,WANA,
2022-02-14,2022-02-14-T-055,55,Rationale for Calibration of Vaccinated Travel Lane Quotas by Country and Setting Separate Sales Caps and Quotas for VTL (Land) and VTL (Air),,WANA,
2022-02-14,2022-02-14-T-056,56,Design Standards in Place to Ensure Future-ready Carparks Can Support Electric Vehicles and Plans for Insurance for Building Protection Against Explosions,,WANA,
2022-02-14,2022-02-14-T-057,57,Framework to Deal with Medical Ethical Issues from Recent Developments on Transplant of Animal Organs in Humans,,WANA,
2022-02-14,2022-02-14-T-058,58,Use of Styrofoam in Making of Aeration Holes in Open Car Park Lots,,WANA,
2022-02-14,2022-02-14-T-059,59,SMS Phishing Scams on Bank Account Holders and How Rapid Digitalisations in Financial Sector Could be Achieved without Compromising Security Against Potential Frauds and Scams,,WA,
2022-02-14,2022-02-14-T-060,60,Update on Lamppost-as-a-Platform Project,,WA,
2022-02-14,2022-02-14-T-061,61,Update on Status of CPIB Investigation into Singaporeans Involved in Keppel Offshore & Marine Corruption Case and Actions Taken,,WA,
2022-02-14,2022-02-14-T-062,62,Plans to Render Humanitarian or Financial Aid to Neighbouring Countries Affected by Recent Floods or Natural Disasters and Measures to Mitigate Environmental or Economic Effects,,WA,
2022-02-14,2022-02-14-T-063,63,Statistics and Profile of Missing Persons in Past Three Years and Preventive Measures in Place,,WA,
2022-02-14,2022-02-14-T-064,64,Statistics on Number of Personal Mobility Device-related Fires in Last Three Years and Measures in Place,,WA,
2022-02-14,2022-02-14-T-065,65,Usage and Effectiveness of ScamShield in Blocking Scam Calls and Making App Available to Android Users,,WA,
2022-02-14,2022-02-14-T-066,66,Cost of Legal Technology Platform Initiative and Target Take-up Rate Amongst Lawyers,,WA,
2022-02-14,2022-02-14-T-067,67,Annual Applications Received for Legal Aid and Success Rate of Applicants,,WA,
2022-02-14,2022-02-14-T-068,68,Tiered Electricity Pricing for Residential Households to Encourage More Efficient Energy Usage,,WA,
2022-02-14,2022-02-14-T-069,69,"Travel Agency Licences Revoked for Failure to Meet Minimum $10,000 Financial Asset Requirement under Regulation 9 of Travel Agents Regulations 2017",,WA,
2022-02-14,2022-02-14-T-070,70,Supply of Natural Gas from Indonesia to Singapore,,WA,
2022-02-14,2022-02-14-T-071,71,Measures to Secure Submarine Infrastructure Built for Import of Renewable Energy from Indonesia to Singapore,,WA,
2022-02-14,2022-02-14-T-072,72,Projected Annual Government Expenditure on Subsidy for Hosting Formula One Singapore Grand Prix from 2022 to 2028,,WA,
2022-02-14,2022-02-14-T-073,73,Assessment of Resilience of Startups in Singapore during COVID-19 Pandemic and Their Prospects Going Forward,,WA,
2022-02-14,2022-02-14-T-074,74,"Number of Singaporeans and Permanent Residents Currently Working Overseas in Innovation and Technology Hubs in US, Europe and Asia",,WA,
2022-02-14,2022-02-14-T-075,75,"Plans for Installation of LED Rear Lamps on Vehicles, Similar to Case Now for LED Head Lamps",,WA,
2022-02-14,2022-02-14-T-076,76,Enforcement Checks on Qualification and Certification of Technicians Performing Maintenance and Repair Works in Vehicle Workshops,,WA,
2022-02-14,2022-02-14-T-077,77,Deepening and Widening Changi Airport's Strength in Cargo and Airfreight Handling,,WA,
2022-02-14,2022-02-14-T-078,78,Progress of Travel Bubble for Singapore and Bintan,,WA,
2022-02-14,2022-02-14-T-079,79,Benchmarks for Resumption of Operations at Changi Airport Terminal 2 and Plans for Adequate Supporting Manpower,,WA,
2022-02-14,2022-02-14-T-080,80,Aviation Safety Concerns Arising from Push for 5G Technologies and Mitigation Measures in Place to Ensure Safety in Singapore's Airspace,,WA,
2022-02-14,2022-02-14-T-081,81,Implications of Realignment of Flight Information Region Boundary between Singapore and Indonesia,,WA,
2022-02-14,2022-02-14-T-082,82,COVID-19 Self-test Kits Distributed and Sustainable Options to Mitigate Environmental Impact,,WA,
2022-02-14,2022-02-14-T-083,83,Plans for Stricter and Swifter Contingency Protocols to Disperse Crowds to Avoid Spontaneous Potential Superspreader Events,,WA,
2022-02-14,2022-02-14-T-084,84,Available Places in Special Education Schools for Students with Autism and Other Disabilities and Average Waiting Time for Enrolment,,WA,
2022-02-14,2022-02-14-T-085,85,Payments under Jobs Support Scheme Made in 2020 and 2021 to Profitable Companies,,WA,
2022-02-14,2022-02-14-T-086,86,Highest Income Tax Rate for Each Year from 1991 to 2013,,WA,
2022-02-14,2022-02-14-T-087,87,"Annual Breakdown Amounts of Additional Buyer's Stamp Duty Collected from Singaporeans Buying Second, Third and Subsequent Residential Properties Respectively over Last Five Years",,WA,
2022-02-14,2022-02-14-T-088,88,Number of Maintenance Enforcement Applications Filed in Family Justice Courts over Past Three Years and Profile of Applicants,,WA,
2022-02-14,2022-02-14-T-089,89,Additional Funding Received by Social Service Agencies to Cope with COVID-19 Pandemic in Past Two Years,,WA,
2022-02-14,2022-02-14-T-090,90,Measures to Prevent Duplication of Food Given Out by Charities to Reduce Manpower Wastage and Ensure Consistency in Distribution Quantities,,WA,
2022-02-14,2022-02-14-T-091,91,Steps Taken to Raise Public Awareness to Get Swift Medical Intervention to Reduce Stroke Risk and Prevent Lifelong Disability,,WA,
2022-02-14,2022-02-14-T-092,92,Increasing Current Annual Withdrawal Limit for Outpatient Flexi-MediSave in View of Rising Outpatient Healthcare Costs,,WA,
2022-02-14,2022-02-14-T-093,93,Including Atrial Fibrillation as Chronic Condition under Chronic Disease Management Programme for Use of MediSave,,WA,
2022-02-14,2022-02-14-T-094,94,Review of Five-person Dining-in Limit to Allow Families with Three or More Children to Dine with Grandparents for Meals at Restaurants,,WA,
2022-02-14,2022-02-14-T-095,95,Proportion of Omicron Cases Comprising B2.A Sub-variant as of January 2022 and Assessment of Its Threat vis-a-vis B1.A Sub-variant,,WA,
2022-02-14,2022-02-14-T-096,96,Voluntary Enrolment of Persons Born Before 1980 into CareShield Life Scheme to-Date and Their Profile and Premium Payable,,WA,
2022-02-14,2022-02-14-T-097,97,Projected Annual Healthcare Spending for Next Decade,,WA,
2022-02-14,2022-02-14-T-098,98,Measures to Alleviate Healthcare Manpower Crunch from Recent Surge of COVID-19 Omicron Variant Cases and Resignation Rates of Healthcare Workers in 2021,,WA,
2022-02-14,2022-02-14-T-099,99,Safeguards or Checks to Ensure Junior Doctors Not Pressured to Under-report Working Hours and Estimates on Rate of Such Under-reporting,,WA,
2022-02-14,2022-02-14-T-100,100,Number of Migrant Workers Enrolled into COVID-19 Clinical Trials Since Start of Pandemic and Measures to Ensure Appropriate Informed Consent Obtained Without Duress,,WA,
2022-02-14,2022-02-14-T-101,101,Singaporeans with Ongoing Follow-up at Restructured Hospitals or National Specialty Centre Outpatient Clinics and Their Travelling Time for Such Appointments,,WA,
2022-02-14,2022-02-14-T-102,102,Number of Persons with Caring Responsibilities Approaching Agency for Integrated Care for Assistance and Types of Help Provided in Last Five Years,,WA,
2022-02-14,2022-02-14-T-103,103,"Annual Prevalence of Obesity for Children Aged Below 18 over Past Five Years, Their Profile and Assessed Effectiveness of Preventive Measures",,WA,
2022-02-14,2022-02-14-T-104,104,Anticipated Respective Budgets Required for Each of Next Five Years for Expansion of Seniors' Mobility & Enabling Fund and Assistive Technology Fund,,WA,
2022-02-14,2022-02-14-T-105,105,Plans to Support SPH Media Trust in Digital Transformation,,WA,
2022-02-14,2022-02-14-T-106,106,Public Agencies and Legislation Governing Use of CCTVs Installed on Private Residential Properties to Ensure Privacy of Neighbouring Land Occupants Is Safeguarded,,WA,
2022-02-14,2022-02-14-T-107,107,Number of Divorcees Not Qualified for HDB Rental Flats Because of Their Income and Yet Unable to Afford HDB Flat in Open Market,,WA,
2022-02-14,2022-02-14-T-108,108,Take-up Rate of Volunteer Leave by Public Service Employees and Private Sector Companies Offering Such Leave and Their Take-up Rate,,WA,
2022-02-14,2022-02-14-T-109,109,Increase in Percentage of Self-employed Persons in Resident Workforce during COVID-19 Pandemic and Policies in Place to Better Protect Their Job Security,,WA,
2022-02-14,2022-02-14-T-110,110,Forecast of Onset of Negative Local Workforce Growth and Likelihood of It Stagnating,,WA,
2022-02-14,2022-02-14-T-111,111,Percentages of Migrant Workers Living in Dormitories Infected with COVID-19 in 2021 and Their Respective Medical Outcomes,,WA,
