Date,Topic_CID,Order,Title,Subtitle,Section_Type,Question_Count
2023-07-05,2023-07-05-T-001,1,Local Students from International Baccalaureate Diploma and Integrated Programmes Admitted to Nursing Diploma or Degree Courses,,OA,
2023-07-05,2023-07-05-T-002,2,Help for Homeowners to Assess if Their Homes Meet Requirement for Residual Current Circuit Breaker,,OA,
2023-07-05,2023-07-05-T-003,3,"Notice to Government for Grab Holdings' Recent Decision to Cut 1,000 Jobs",,OA,
2023-07-05,2023-07-05-T-004,4,Penalties for Offences Related to Illegal Dumping of Toxic Substances into Public Sewers,,OA,
2023-07-05,2023-07-05-T-005,5,Maintenance of Centralised Cooling System Unit in Flats in Tengah,,OA,
2023-07-05,2023-07-05-T-006,6,Implementation of Guidelines in National Guide for Early Childhood Educators on Outdoor Learning,,OA,
2023-07-05,2023-07-05-T-007,7,Likelihood of Severe Transboundary Haze Affecting Singapore in 2023 and Preventive Measures,,OA,
2023-07-05,2023-07-05-T-008,8,Update on New Tourism Development in Jurong Lake District,,OA,
2023-07-05,2023-07-05-T-009,9,Projected Need for Informal Caregivers in Next 10 to 20 Years ,,OA,
2023-07-05,2023-07-05-T-010,10,"Singapore's Performance for PM2.5, PM10, Sulphur Dioxide, Ozone, Nitrogen Dioxide and Carbon Monoxide Emissions",,OA,
2023-07-05,2023-07-05-T-011,11,Viability of Singapore Post’s Domestic Post and Parcel Business,,OA,
2023-07-05,2023-07-05-T-012,12,Update on Enhancements to Single Room Shared Facilities Initiative,,OA,
2023-07-05,2023-07-05-T-013,13,Results from Measures to Reduce Waiting Time for Admissions to Public Hospitals,,OA,
2023-07-05,2023-07-05-T-014,14,Mandating Caregiving Leave for Private Sector Companies,,OA,
2023-07-05,2023-07-05-T-015,15,Online Criminal Harms Bill,,BP,
2023-07-05,2023-07-05-T-016,16,Statement by Leader of the House,,OS,
2023-07-05,2023-07-05-T-017,17,Group Representation Constituencies,Motion,OS,
2023-07-05,2023-07-05-T-018,18,Exempted Business,Business Motion,OS,
2023-07-05,2023-07-05-T-019,19,Group Representation Constituencies,,OS,
2023-07-05,2023-07-05-T-020,20,Transportation of Workers on Back of Lorries,,OS,
2023-07-05,2023-07-05-T-021,21,Update on Zika Situation and Whether Project Wolbachia Can Be Used to Combat Zika,,WANA,
2023-07-05,2023-07-05-T-022,22,Rationale for Allowing Use of Only Single-deck Beds in Migrant Worker Dormitories,,WANA,
2023-07-05,2023-07-05-T-023,23,Status of Discussions for Potential Johor-Singapore Economic Region,,WANA,
2023-07-05,2023-07-05-T-024,24,Trend for Annual Deaths Attributable to Second-hand Smoke,,WANA,
2023-07-05,2023-07-05-T-025,25,Target Green Plot Ratio for BTO Projects,,WANA,
2023-07-05,2023-07-05-T-026,26,Review of Past Cases Given Recent Advisory on Malware-related Unauthorised Bank Transactions,,WANA,
2023-07-05,2023-07-05-T-027,27,Volume of Duty-unpaid Cigarettes Seized and Individuals Charged for Related Offences,,WANA,
2023-07-05,2023-07-05-T-028,28,Rebuilding Local Football Ecosystem following Singapore National Football Team's Poor Results at SEA Games 2023,,WANA,
2023-07-05,2023-07-05-T-029,29,ASEAN's Assessment of China's Recent Declaration of Support for Myanmar's Junta,,WANA,
2023-07-05,2023-07-05-T-030,30,Reviews on Impact of Baby Support Grant and Increases in Amounts for Baby Bonus Scheme,,WANA,
2023-07-05,2023-07-05-T-031,31,Inclusion of Other Relatives under Sponsorship Scheme for Seniors with No Children or Siblings to Hire Migrant Domestic Workers,,WANA,
2023-07-05,2023-07-05-T-032,32,Government Agencies' Expenditure on Management Consultancy Services,,WANA,
2023-07-05,2023-07-05-T-033,33,Probe into Recent Disruptions of DBS' Digital Bank and Physical ATM Services and Preventive Measures Implemented,,WANA,
2023-07-05,2023-07-05-T-034,34,Evaluating Prevailing Societal Values towards Single Unwed Parents and Adjusting Provision of Children-related Tax Reliefs for These Parents,,WANA,
2023-07-05,2023-07-05-T-035,35,Non-Singaporean Tamil Language Teachers Employed in Schools and Language Centres,,WANA,
2023-07-05,2023-07-05-T-036,36,Reviewing Background Screening Companies Responsible for Verifying Qualifications of Employment Pass Applicants,,WANA,
2023-07-05,2023-07-05-T-037,37,Total Value of Unauthorised Credit Card Charges in Last Five Years,,WANA,
2023-07-05,2023-07-05-T-038,38,Rise in Resident Employment in First Quarter 2023,,WANA,
2023-07-05,2023-07-05-T-039,39,Financial Institutions Investigated for Breaching Anti-money Laundering and Anti-terrorism Financing Rules,,WANA,
2023-07-05,2023-07-05-T-040,40,Annual State Costs for Provision of Ministerial Security at 26 and 31 Ridout Road,,WA,
2023-07-05,2023-07-05-T-041,41,"Returns for Dynamic, Balanced and Stable Funds under Saver Premium Fund",,WA,
2023-07-05,2023-07-05-T-042,42,ASEAN's Most Recent Humanitarian Needs Assessment for Rohingya Refugees,,WA,
2023-07-05,2023-07-05-T-043,43,Authorisations Sought and Granted for Statement to be Recorded in Absence of Appropriate Adult,,WA,
2023-07-05,2023-07-05-T-044,44,"Returns for Dynamic, Balanced and Stable Funds under Home Affairs Uniformed Services INVEST Fund",,WA,
2023-07-05,2023-07-05-T-045,45,Persons Refusing Conveyance via SCDF Ambulances to Hospitals,,WA,
2023-07-05,2023-07-05-T-046,46,Singapore's Adoption of IMO 2020,,WA,
2023-07-05,2023-07-05-T-047,47,Studies on Costs of Air Pollution from All Domestic Sources,,WA,
2023-07-05,2023-07-05-T-048,48,Non-Singaporeans from High-income Countries Studying and Receiving Tuition Grants in Local Universities,,WA,
2023-07-05,2023-07-05-T-049,49,Take-up Rate among Parents for Voluntary Workshops Dealing with Child Mental Health Issues,,WA,
2023-07-05,2023-07-05-T-050,50,"Foreign Students Taking GCE ""A"" and ""O"" Levels in Singapore Schools",,WA,
2023-07-05,2023-07-05-T-051,51,Feasibility of Hospital-provided Accommodation at Concessionary Rates for Healthcare Workers,,WA,
2023-07-05,2023-07-05-T-052,52,Waiting Time for Appointments for Mental Health Treatment at Public Healthcare Institutions,,WA,
2023-07-05,2023-07-05-T-053,53,Subsidies for Continuous Glucose Monitoring under Chronic Disease Management Programme,,WA,
2023-07-05,2023-07-05-T-054,54,NParks' Review of Cat Management Framework,,WA,
2023-07-05,2023-07-05-T-055,55,HDB Flats with Outstanding Mortgage Loans,,WA,
2023-07-05,2023-07-05-T-056,56,Update on HDB's Collaboration with Evonik Industries on High-performance Insulation Material for Roof Panels,,WA,
2023-07-05,2023-07-05-T-057,57,Audition Requirement to Renew Busking Licences,,WA,
2023-07-05,2023-07-05-T-058,58,Median and Average CPF Account Balances and Principal Amount Withdrawn for Residential Properties by Age Decile,,WA,
2023-07-05,2023-07-05-T-059,59,Requirement for Employment Claims Tribunal to Issue Public Written Judgments by Default,,WA,
2023-07-05,2023-07-05-T-060,60,Employees Making Restitution for Damage or Loss of Property Caused at Workplace by External Individuals,,WA,
