speech_id,topic_id,speech_order,member_name,text
2013-11-12-T-019-S-00515,2013-11-12-T-019,515,Foo Mee Har,"I urge MOM to vigorously pursue the optimal balance to meet the needs of employers and also employees. Non-workmen's salary threshold for overtime payment should grow quickly to align with that of workmen, at $4,500 a month, so that there is no need to distinguish between workmen and non-workmen when paying for overtime."
2013-11-12-T-019-S-00516,2013-11-12-T-019,516,Foo Mee Har,"Separately, Madam, we should remember that PMEs enjoy no such protection to claim overtime pay. All that the current Bill seeks to amend is section 88 of the EA, so that PMEs who work on public holidays are provided a day off-in-lieu or an extra day's salary at the basic rate of pay. From the perspective of many PMEs, this provision appears rather ungenerous, as public holidays offer those few precious moments in a year when Singaporeans celebrate our cultures, traditions and religions with family and friends. It rather raises the question  should a premium not be attached to the compensation given for PMEs who are required to work on a public holiday?"
2013-11-12-T-019-S-00517,2013-11-12-T-019,517,Foo Mee Har,"Mdm Speaker, employers have argued that provisions for overtime pay should not apply to PMEs as their performance evaluation should be based purely on work outcomes rather than on the time expended. The employers have also argued that the types of work that PMEs are doing are too diverse to apply strict standards to and, therefore, employers should be given more latitude in administering them. These arguments, I agree, are fair. But to accept them is also to accept that, since PMEs' performance are based on outcomes, employers should be far more supportive of work-life balance, instead of expecting PMEs to clock in face-time in the office in the traditional manner, when there are so many more ways to get work done."
2013-11-12-T-019-S-00518,2013-11-12-T-019,518,Foo Mee Har,"Madam, my relentless advocacy for flexi-work stems from observations of missed opportunities in the workforce and under-utilised human resources, especially amongst women and older workers. Most women juggle family and work commitments, and too many are forced to make the stark and painful choice between full-time work in a conventional setting or none at all, since there are few alternatives available to them. Many who stop work to care for an infant or an elderly parent, never return to the workforce. As one of the world's most wired countries, Singapore has all the technological advances to encourage flexi-work and work-from-home amongst our citizens. All that is needed is the will to make it happen, and I believe the Government should play an active role."
2013-11-12-T-019-S-00519,2013-11-12-T-019,519,Foo Mee Har,"I urge the Government to do more to help employers understand the critical role they play, and the advantage they gain, in offering flexi-work arrangements along the very same argument that employers have put forward  that is PMEs' performance should be judged on outcomes rather than face-time in the office. Therefore, in support of families with young children, I would like to suggest that MOM consider empowering employees, through provisions in future Employment Act (EA) amendments, both male and female employees, with children below the age of 12, with the right to request for flexi-work arrangements and to have those requests considered seriously by their employers."
2013-11-12-T-019-S-00520,2013-11-12-T-019,520,Foo Mee Har,"Mdm Speaker, MOM has also indicated that they will look into protection for employees in non-traditional work arrangements, such as contract workers and self-employed persons, in Phase 2 of their EA review."
2013-11-12-T-019-S-00521,2013-11-12-T-019,521,Foo Mee Har,"Contract hiring is on the rise in Singapore. In 2012, 192,000 or 11.5% of resident employees were on term contracts. Balancing contract and permanent employment is an opportunity for employers to ride the peaks and troughs of their business cycles, and offers companies the needed flexibility to stay competitive and respond to volatile business environment. Many companies have leveraged a contract workforce as an integral part of their operations."
2013-11-12-T-019-S-00522,2013-11-12-T-019,522,Foo Mee Har,"Contract work also happens to be a mode of employment that Singaporean workers favour due to its flexible nature. A recent survey by Hays showed that out of 200 Singapore workers surveyed, 80% said they favoured contract jobs."
2013-11-12-T-019-S-00523,2013-11-12-T-019,523,Foo Mee Har,"Yet contract workers face far less protection than other workers. Given the trend in employment practices, I urge MOM to consider requiring employers to offer contract workers some basic benefits after a period of employment, and definitely upon renewal of their contract. Currently, contract workers only qualify for certain benefits, such as annual sick leave, if they work continuously for three months. Unscrupulous employers intending to circumvent the EA obligations may coerce contract workers into accepting contracts of three months or less, and then extend these short-term contracts indefinitely, all the while leaving the worker exposed. This practice must be stopped. The renewal of a contractor's term usually indicates that he/she has been found to be suitable for the job and, therefore, the employer should be obliged to extend basic benefits to the contractor upon renewal of the contract."
2013-11-12-T-019-S-00524,2013-11-12-T-019,524,Foo Mee Har,"Furthermore, employers should not be allowed to disguise a ""permanent"" job as a ""contract"" position in an attempt to avoid the cost of legal entitlements due to ""permanent"" employees. Such ""sham"" contracting should not be condoned. I know of people working on a contract basis for years in companies where, apart from their employment status, their responsibilities are indistinguishable from permanent employees. Will MOM consider a provision that allows contract workers to enjoy the same benefits as permanent employees if they have worked on the same job for a specified length of time? Such a provision will discourage employers from manipulating the employment status to avoid EA obligations, at the expense of the worker."
2013-11-12-T-019-S-00525,2013-11-12-T-019,525,Foo Mee Har,"Madam, I support the Bill and I look forward to Phase 2 of the EA amendments to hopefully incorporate the points I raised today."
2013-11-12-T-019-S-00526,2013-11-12-T-019,526,Speaker,Acting Minister.
2013-11-12-T-019-S-00527,2013-11-12-T-019,527,Tan Chuan-Jin,"Mdm Speaker, I would like to thank the various Members for their views and their broad support for the proposed changes to the Employment Act (EA). I will now address some of the issues raised by the Members."
2013-11-12-T-019-S-00528,2013-11-12-T-019,528,Tan Chuan-Jin,"Assoc Prof Eugene Tan asked how the salary thresholds were arrived at. For non-workmen, the increase from $2,000 to $2,500 corresponds to the general increase in median salaries since the EA was last reviewed in 2009. For PMEs, we covered those earnings up to $4,500 for salary protection in 2011, and the tripartite partners, in their negotiation, agreed that it was too soon to revise its threshold."
2013-11-12-T-019-S-00529,2013-11-12-T-019,529,Tan Chuan-Jin,"Assoc Prof Tan also talked about extending Part IV of the EA to PMEs. I mentioned earlier that Part IV protection is generally accorded to more vulnerable workers and many of the time-based provisions, for example, hours of work, rest days and so on, are less relevant to PMEs due to the nature of the work. I have also explained why the tripartite partners felt it was not unreasonable for employers to ask for qualifying period for PMEs before they can seek redress for unfair dismissal. Other jurisdictions, such as Australia and the UK, also impose such conditions for PMEs. There is no qualifying period for employees to seek redress for dismissals without notice."
2013-11-12-T-019-S-00530,2013-11-12-T-019,530,Tan Chuan-Jin,"Mr Patrick Tay sought clarification on whether the notice of termination can be in electronic form. We take the view that employer and employee may agree to accept notice via electronic means, such as e-mail, as long as the information is accessible and usable for subsequent reference."
2013-11-12-T-019-S-00531,2013-11-12-T-019,531,Tan Chuan-Jin,"Mr Patrick Tay also asked for clearer articulation for the definition of ""cosmetic"" treatment. As mentioned earlier, the assessment of whether a treatment is cosmetic or not will be based on the opinion of the medical practitioner. We are studying how we can provide greater clarity to doctors when operationalising this."
2013-11-12-T-019-S-00532,2013-11-12-T-019,532,Tan Chuan-Jin,"Mr Tay also sought clarification on the computation of overtime (OT) pay. Indeed, OT should be payable beyond the contractual working hours. However, employers are given flexibility on the rate of OT pay if the contractual hours are below the statutory limit of 44 hours, after which a minimum of 1.5 times rate must apply. We think that this flexibility is important or else employers may consider offering shorter contractual working hours, to the detriment of workers. Ms Foo Mee Har did say that Singaporeans work one of the longest hours already. As for the computation, there is a prescribed baseline formula which employers can refer to."
2013-11-12-T-019-S-00533,2013-11-12-T-019,533,Tan Chuan-Jin,"Ms Foo Mee Har and Mr Gerald Giam also talked about compensation for PMEs required to work on public holidays. Given the nature of PME jobs, our intent remains to give employers the additional option of giving time-off in-lieu, instead of just keeping to the current rules, which allow the employer and employee to agree to substitute any other day for the public holiday or pay an extra day's salary. The duration of the time-off in-lieu can be mutually agreed between the employer and the PME to enhance the flexibility. Only where there is no agreement does the law clarify that it should be four hours if the PME works on that holiday for less than half a day, or a full day if the PME works for more than half a day."
2013-11-12-T-019-S-00534,2013-11-12-T-019,534,Tan Chuan-Jin,"As we safeguard the interests of workers, we also cannot forget that at the same time we also need to balance this with employers' needs, as Dr Chia Shi-Lu and Mr Dhinakaran, a businessman himself, noted. Drastic moves that hinder business operations could actually inadvertently affect the employability of the very workers that we are looking to help."
2013-11-12-T-019-S-00535,2013-11-12-T-019,535,Tan Chuan-Jin,"The payslip issue which I elaborated earlier was one such example of trying to maintain that fine balance. We agree, in principle, that payslip is the correct way to go and that is where we intend to go too. But what we recognise also is the difficulty that some small businesses face."
2013-11-12-T-019-S-00536,2013-11-12-T-019,536,Tan Chuan-Jin,Another is the employment conditions imposed by employers that Ms Mary Liew raised; or also the exclusion of allowances from employee entitlements that Mr Patrick Tay mentioned. All these add up to the balance that we need to look at when we deal with these issues.
2013-11-12-T-019-S-00537,2013-11-12-T-019,537,Tan Chuan-Jin,"There are many reasons why employers introduce employment conditions or clauses to protect the commercial interests of their companies. Where clauses are unreasonable or not aligned with the EA or other employment legislation, our laws will take precedence, nullifying those clauses, which means that employers do not have a free reign in terms of what they set in their clauses. Similarly, employers structure compensation packages to meet specific needs. We are, therefore, careful not to make a one-size-fits-all pronouncement that will inadvertently introduce labour rigidities. We will continue to work with tripartite partners to prevent abuse in a targeted fashion."
2013-11-12-T-019-S-00538,2013-11-12-T-019,538,Tan Chuan-Jin,"Mr Zainal Sapari has proposed mandating more protection for our low-wage workers, such as greater medical benefits, greater compensation for work on rest days and shorter qualifying period for sick leave entitlements. I fully understand and appreciate where Mr Zainal Sapari is coming from. Vulnerable workers do deserve our special attention not just in terms of the workplace but across in the many different dimensions for which we have many different assistance programmes that are available. But we also need to be mindful that if we begin to impose too many conditions, we also do run the risk that, inadvertently, we might tip the balance and affect their employability itself. Then we end up hurting the very people that we are trying to protect. So, while the concerns are valid and we continue to look at this base of protection to see how we can expand it, we have to continue to watch carefully because we do not want to end up hurting the very groups themselves; being mindful that the workspace and in terms of the Employment Act is one dimension. For them, it is a multi-dimensional issue in terms of addressing the concerns and needs of these Singaporeans which are valid."
2013-11-12-T-019-S-00539,2013-11-12-T-019,539,Tan Chuan-Jin,"The tripartite partners must continue to watch this space diligently and to debate this to make sure that we look after the workers. At the same time, the Government, on a whole-of-Government perspective, must look at this holistically to make sure that the different schemes are available to address the different needs for the different contexts. Overall, I believe that the current proposals maintain a reasonable and a good balance. We will continue to watch that and continue to evolve that space together with our partners."
2013-11-12-T-019-S-00540,2013-11-12-T-019,540,Tan Chuan-Jin,"But legislative changes, as I have mentioned, are clearly not the only means we have to assist our low-wage workers. This multi-faceted approach on the employment front revolves around one key thing, which I strongly believe is that work is really the best form of welfare. It is about the ability to continue to create good jobs and to raise employment standards. Creating good jobs means that we also need to make sure that the economy remains competitive, that employers have a viable business model that can go on because, in turn, that will also create opportunities for our people."
2013-11-12-T-019-S-00541,2013-11-12-T-019,541,Tan Chuan-Jin,"We also need to look at short-term expenditure and longer-term retirement needs. These will include Workfare Income Supplement, and sector-specific initiatives to raise the employment standards and benefits for low-wage workers, especially in the cleaning and security industries."
2013-11-12-T-019-S-00542,2013-11-12-T-019,542,Tan Chuan-Jin,"It is really multi-faceted. While we look at a specific Act today, there are also other corresponding efforts that are trying to uplift the workers in the specific area of concern. We have also been raising awareness of compliance with the Employment and CPF Acts, as discussed earlier under the WorkRight campaign and to ensure that the rights of vulnerable workers are protected. Those are fundamental because they ensure that the various schemes that are available can actually reach the very people that we are trying to help."
2013-11-12-T-019-S-00543,2013-11-12-T-019,543,Tan Chuan-Jin,"Beyond MOM, like I said, there are many different assistance schemes that are available in terms of housing, healthcare and education. For example, the Community Health Assist Scheme (CHAS) allows Singaporeans from lower- and even middle-income households the convenience of seeking subsidised care at private GPs and dental clinics near their homes."
2013-11-12-T-019-S-00544,2013-11-12-T-019,544,Tan Chuan-Jin,"I do applaud and recognise our partner NTUC's efforts to widen the outreach and make assistance more accessible through the U Care Centre. That is an important development and we strongly support that. With our tripartite partners, we will continue to review and enhance the ways we extend targeted assistance and support to low-wage workers as we strive towards a more progressive and inclusive society."
2013-11-12-T-019-S-00545,2013-11-12-T-019,545,Tan Chuan-Jin,"In terms of enforcement, Mr Gerald Giam asked for the rationale for the enhanced investigatory powers. While there is a need for employment inspectors to have such powers to secure the immediate cooperation of suspects to facilitate investigations, in cases of failure to pay salary which our Ministry considers as one of the most serious offences, similar powers are already accorded to employment inspectors under the EFMA. All employment inspectors will have to be adequately trained to execute arrest and search of suspects. MOM will exercise the new power of arrest judiciously."
2013-11-12-T-019-S-00546,2013-11-12-T-019,546,Tan Chuan-Jin,"Members have made other useful suggestions pertaining to the Industrial Relations Act and the second phase of the EA review. One such area is mechanisms to resolve employment disputes which Mr Zainal Sapari and Mr Hri Kumar talked about. MOM and the tripartite partners are actively looking into this. I have talked about this briefly before, and I will be giving more information on this probably in the first half of next year."
2013-11-12-T-019-S-00547,2013-11-12-T-019,547,Tan Chuan-Jin,"Mr Zainal Sapari also called for greater accountability on service buyers for outsourced workers; while Ms Mary Liew, Ms Foo Mee Har and Mr Patrick Tay proposed improved protection for contract workers. All these will be addressed. They are important issues. It takes some time to address because for contract workers, there is really a wide range of different contexts in which contract workers operate and all these will be addressed in the next phase of the Employment Act review by next year."
2013-11-12-T-019-S-00548,2013-11-12-T-019,548,Tan Chuan-Jin,"Ms Mary Liew and Dr Chia Shi-Lu suggested mandatory eldercare leave. I agree in principle that it is important to encourage support for elderly parents. However, as Ms Liew also noted, the Government has recently taken significant steps with a series of family-related leave schemes as part of the Marriage and Parenthood package. We are mindful that we should allow businesses to adjust and we do not have plans to legislate any family leave schemes at this present stage."
2013-11-12-T-019-S-00549,2013-11-12-T-019,549,Tan Chuan-Jin,"As for Dr Chia's suggestion of a national code of employment conduct, he would be pleased to know that the tripartite partners have come out with Guidelines on Best Work-Life Practices to encourage companies to grant non-statutory leave to employees for family-related issues."
2013-11-12-T-019-S-00550,2013-11-12-T-019,550,Tan Chuan-Jin,"Ms Foo called for greater support for flexible work arrangements and I echo that. This involves quite fundamental shifts in terms of the cultural and mindset shifts in our workplaces and especially with the mindsets of employers. I would suggest among employees themselves, I think a lot of it is also brought upon by our own desire not to seemingly lose out and frankly a lot of it just revolves round bad habits that are in the workplace, both from the employer's perspective and even ourselves as employees."
2013-11-12-T-019-S-00551,2013-11-12-T-019,551,Tan Chuan-Jin,"I do not think legislation itself will solve the more fundamental issue. Indeed, we are trying to press ahead to encourage companies to implement work-life strategies, to find different schemes to incentivise companies to move along those lines as part of the effort to attract and retain talent through various schemes. We also see the response from many younger Singaporeans today, and companies have to pay attention to this. I believe the market will soon have to begin to adjust as well. It is really in the interest of companies to do so in this tight labour market."
2013-11-12-T-019-S-00552,2013-11-12-T-019,552,Tan Chuan-Jin,"Like Mr Patrick Tay, Mr Gerald Giam and Ms Foo Mee Har, I also agree that the evolution of work arrangements does make it increasingly difficult to draw a line between the workmen and non-workmen. I have mentioned this before as well. We do need to work towards removing this distinction in a practical way in the medium term."
2013-11-12-T-019-S-00553,2013-11-12-T-019,553,Tan Chuan-Jin,Ms Lee Li Lian asked for the rationale for the CDCA amendment. This is to make clear that parents who both have an older Singaporean child and a younger non-citizen child should not claim leave under both the EA and CDCA.
2013-11-12-T-019-S-00554,2013-11-12-T-019,554,Tan Chuan-Jin,Many of you have raised a range of issues; many of them technical and very specific in nature. My Ministry's officials will be quite happy to work with you to provide and our tripartite partners to issue clarifications as appropriate.
2013-11-12-T-019-S-00555,2013-11-12-T-019,555,Tan Chuan-Jin,"I would like to conclude by supporting Assoc Prof Tan's call for shared effort to build a more inclusive society. Overall, I believe that this Bill supports our journey forward to develop progressive workplaces for our people. A lot of us spend a lot of time at the workplace and I think it is also appropriate that these workplaces need to be great workplaces. They need to be progressive workplaces."
2013-11-12-T-019-S-00556,2013-11-12-T-019,556,Tan Chuan-Jin,"Madam, to sum up, this Bill is about better protection for more workers but still at the same time giving employers the flexibility to continue to be able to sustain their business to remain competitive so that they can continue to provide good jobs and opportunities for Singaporeans. Once again, I would like to thank all our stakeholders, including many Members of the House for all their suggestions and inputs for the support of this Bill."
2013-11-12-T-019-S-00557,2013-11-12-T-019,557,Gerald Giam Yean Song,"Madam, I have two clarifications for the Minister. First, regarding the deductions. How does the Ministry monitor employers, especially employers of low-wage workers to ensure that the deductions are not excessive and unreasonable? Second, regarding the prosecution and the fines, if an employer is prosecuted, how will the Ministry ensure that the employer actually ends up not just paying the fine but also pays the worker?"
2013-11-12-T-019-S-00558,2013-11-12-T-019,558,Tan Chuan-Jin,"Mdm Speaker, with regard to the deductions, it is an area of concern which is why we moved some of the changes here. Deductions for accommodation and amenities and services – one of the questions that was raised by Mr Giam earlier – should be factored at the actual cost and be accepted by the employee. Deduction for amenities and services is not common. Employers need to apply to the Commissioner before deducting for amenities and services. So, there are checks in place, but I do fully recognise that there are concerns about the imbalances in the relationship between employers and employees. So, should we find that deductions are excessive, we do encourage workers or those who are aware of these cases to flag it up to MOM so that we can go in and look at it in detail."
2013-11-12-T-019-S-00559,2013-11-12-T-019,559,Tan Chuan-Jin,"With regard to the second question, I would refer Members to my earlier response in the way we enforce non-payment or late payment of CPF. The priority really is to make sure that the entitled monies are provided to the people. That is the first priority, and we find that, in most cases, employers begin to move once we go in. We then move on to the prosecutory stage."
2013-11-12-T-019-S-00560,2013-11-12-T-019,560,Tan Chuan-Jin,"That is the way we approach it. We find that, by and large, employers do respond. Where they do not respond, that is when we bring in the full letter of the law in order to punish the companies. But we will at the same time make sure as far as possible to extract the monies to be made payable to the people. There will be circumstances where, perhaps, not so much because of the recalcitrants but because of closure of the companies and so on, in those extreme cases, there will be challenges in recovering the monies. But, in most cases, we are able to recover the monies."
2013-11-12-T-019-S-00561,2013-11-12-T-019,561,Foo Mee Har,"I would like to ask the Acting Minister in order to effect the positive change needed against long hours of work, and given the minimum protection on overtime that we currently have in our laws, both at the non-workmen level and definitely at the PME level, how would we motivate employers to re-engineer the work processes so that people do not have to work excessive hours? What would be the mechanism going forward for us to rethink about this critical issue of excessive hours that people put in if employers are not subject to either compensation and, therefore, cost? What would be the motivation for them to critically think about changing the ways of working?"
2013-11-12-T-019-S-00562,2013-11-12-T-019,562,Tan Chuan-Jin,"Mdm Speaker, work-life balance is something that I am particularly concerned about. We have a 44-hour work week. It translates to about nine hours a day. We do want to make sure that as far as our workmen are concerned, the appropriate limits are put in place, the OT is in place. That part is being addressed."
