speech_id,topic_id,speech_order,member_name,text
2013-11-12-T-015-S-00175,2013-11-12-T-015,175,Dr Muhammad Faishal Ibrahim,"In most of the cases, we will look into it and we will be proactive. But in some cases, where things are very unique and localised, only the community would know better. There have been many communities which have come forward to work with us and I am very happy that we can see more and more communities stepping up, and, as such, the effect is that we will have safer roads for fellow Singaporeans and other road users."
2013-11-12-T-015-S-00176,2013-11-12-T-015,176,Dr Muhammad Faishal Ibrahim,"With regard to the second point, I am also pleased to share with the hon Member that LTA has worked very closely with the community and we have seen positive development, as mentioned by the hon Member. Beyond that, we are also looking at how we can improve the infrastructure, the engineering work with regards to safety. So, I am pleased to share with the Member that we will implement four bus-friendly humps along Tampines Avenue 9. We also have plans to reduce the speed limit along a section of Tampines Avenue 9 where we are thinking of reducing it from 60 km per hour to 50 km per hour. We are working with other agencies to see how we can do the necessary gazetting to make the effect."
2013-11-12-T-016-S-00177,2013-11-12-T-016,177,Hri Kumar Nair,"asked the Minister for National Development (a) whether there are cases of Singaporeans who have acquired new or resale flats without enjoying any advantage under the Ethnic Integration Policy (EIP) but are made subject to EIP when selling the same; and (b) if so, whether the Ministry will waive the application of EIP quotas for such sales."
2013-11-12-T-016-S-00178,2013-11-12-T-016,178,Desmond Lee,"<span style=""color  rgb(51, 51, 51);""> </span>"
2013-11-12-T-016-S-00179,2013-11-12-T-016,179,Desmond Lee,"The EIP limits are consistently applied across all ethnic groups in Singapore. There may, indeed, be cases where some buyers or sellers are inconvenienced by the EIP at the time of purchase or sale. However, we are unable to exercise any waiver, or we would compromise the objective of the EIP."
2013-11-12-T-016-S-00180,2013-11-12-T-016,180,Desmond Lee,"Currently, only a few HDB neighbourhoods are affected by the EIP limits. For these neighbourhoods, flat sellers are still able to secure buyers from the eligible ethnic groups, given the large volume of resale transactions."
2013-11-12-T-016-S-00181,2013-11-12-T-016,181,Hri Kumar Nair,"Thank you, Mdm Speaker, supplementary questions. I thank the Minister of State for the answer. I should say that I fully support the objectives of the EIP programme. I think it is right. I just have two questions. First, a question of clarification  would I be right to say that new flats are allotted to Singaporeans after the EIP quotas are already taken into account. So, in other words, if a person of a minority race receives a flat under the BTO allocation system, is it because his quota has already been taken into account in the allocation?"
2013-11-12-T-016-S-00182,2013-11-12-T-016,182,Hri Kumar Nair,"The second question is really one to narrow the exception I alluded to. Can the Ministry at least consider an exception where a minority seller has to sell on account of arrears or on account of order of court, or in other words, where he is forced to sell the flat? In those circumstances, will the Ministry consider waiving the EIP requirement?"
2013-11-12-T-016-S-00183,2013-11-12-T-016,183,Desmond Lee,"Madam, on the hon Member's first question, yes, the EIP quotas are applied when the BTOs are put up for balloting. As for the second point about forced sales or where an individual is required to sell, the Ministry would look at it on a case-by-case basis. It is only in very exceptional circumstances that we will consider a waiver of the EIP. So, I hope that addresses the concerns."
2013-11-12-T-017-S-00184,2013-11-12-T-017,184,Sylvia Lim,asked the Minister for Health in view of a subsidiary of the multinational pharmaceutical company Ranbaxy Laboratories Ltd being found guilty of data fraud by the US Food and Drug Administration in May 2013 (a) whether the Health Sciences Authority (HSA) has done a review of all data submitted to it by Ranbaxy; and (b) how HSA ensures Singapore's supply of generic drugs from overseas is safe for use.
2013-11-12-T-017-S-00185,2013-11-12-T-017,185,Amy Khor Lean Suan,"<span style=""color  rgb(51, 51, 51);""> </span>"
2013-11-12-T-017-S-00186,2013-11-12-T-017,186,Amy Khor Lean Suan,"With regard to the data submitted by Ranbaxy for registration of their products, all data submitted was reviewed by HSA."
2013-11-12-T-017-S-00187,2013-11-12-T-017,187,Amy Khor Lean Suan,"HSA takes a two-pronged approach in ensuring that medicinal products meet the required standards  pre-market review based on data submitted by the company and post-market sampling and testing to ensure compliance. All drugs are subject to post-market surveillance checks to ensure continued compliance with the required standards of quality, safety and efficacy. Such checks include targeted sampling and testing, in conjunction with a safety monitoring system, which enable HSA to detect local and global signals related to drug safety."
2013-11-12-T-017-S-00188,2013-11-12-T-017,188,Amy Khor Lean Suan,"In the case of Ranbaxy's products, the US FDA's ruling in 2013 originated from the findings of the audit that FDA conducted at two of Ranbaxy's manufacturing sites in 2008, which raised concerns that the manufacturing processes deviated from US manufacturing standards at these two sites. In November 2008, these two sites were jointly audited by the World Health Organization and five other international regulatory agencies."
2013-11-12-T-017-S-00189,2013-11-12-T-017,189,Amy Khor Lean Suan,"HSA participated in one of the two joint site audits. Findings observed during the joint audits were addressed by Ranbaxy and the two audit teams concluded subsequently that the two sites were in compliance with international GMP standards. GMP certificates were then issued by WHO and the European Medicine Agency to these two sites in 2009. Since then, the various regulatory authorities have conducted regular audits at these sites. HSA has maintained close communication with these agencies to track closely the results of these audit findings of the Ranbaxy sites concerned."
2013-11-12-T-017-S-00190,2013-11-12-T-017,190,Amy Khor Lean Suan,"Currently, there are 15 products manufactured by the two reported Ranbaxy sites that are marketed in Singapore. HSA has been conducting regular targeted sampling and testing of these products under the Product Quality Sampling programme, and the test results have confirmed that the products comply with approved quality specifications. To date, our adverse events database —"
2013-11-12-T-017-S-00191,2013-11-12-T-017,191,Speaker,"Senior Minister of State, could you please wind up your speech?"
2013-11-12-T-017-S-00192,2013-11-12-T-017,192,Amy Khor Lean Suan,"To date, our adverse events database has also not indicated any safety signals associated with Ranbaxy's products."
2013-11-12-T-017-S-00193,2013-11-12-T-017,193,Amy Khor Lean Suan,"The last line, Mdm Speaker. HSA will continue to monitor Ranbaxy products to ensure that they meet safety, quality and efficacy requirements. Thank you, Mdm Speaker."
2013-11-12-T-017-S-00194,2013-11-12-T-017,194,Speaker,Order. End of Question Time.
2013-11-12-T-017-S-00195,2013-11-12-T-017,195,Speaker,"[Pursuant to Standing Order No 22(3), Written Answers to Question Nos 21-22, 24-25, 28-31 and 33-36 on the Order Paper are reproduced in the Appendix (Pg xxx). Question Nos 20, 23, 26-27, 32 and 37 have been postponed to the next available sitting of Parliament.]"
2013-11-12-T-018-S-00196,2013-11-12-T-018,196,,"[(proc text) Resumption of Debate on Question (11 November 2013), ""That the Bill be now read a Second time."" – [Mr Tan Chuan-Jin] (proc text)]"
2013-11-12-T-018-S-00197,2013-11-12-T-018,197,,[(proc text) Question again proposed. (proc text)]
2013-11-12-T-018-S-00198,2013-11-12-T-018,198,Laurence Lien,"Mdm Speaker, thank you for allowing me to speak. I would like to express my support for the Bill, which strengthens the Act, particularly in increasing the enforcement powers of CPF Board and in providing stiffer penalties to target errant employers."
2013-11-12-T-018-S-00199,2013-11-12-T-018,199,Laurence Lien,CPF is critical in funding the retirement needs for most Singaporeans. A 2012 study was commissioned by MOM to show that new workers' CPF would be adequate for a comfortable retirement.
2013-11-12-T-018-S-00200,2013-11-12-T-018,200,Laurence Lien,"However, the issue of the adequacy of CPF for retirement would not go away. The MOM study focused on analysing the 30th, 50th and 70th percentile of young workers. We know that CPF alone may not be sufficient for many outside this range of workers. And within this range, there would be people who drop out of the workforce for significant periods of time, like stay-at-home mothers."
2013-11-12-T-018-S-00201,2013-11-12-T-018,201,Laurence Lien,"Then, there are the older workers. For the cohort that turned 55 in 2012, only 48.7% of active CPF members attained the full Minimum Sum. This number excludes inactive CPF members."
2013-11-12-T-018-S-00202,2013-11-12-T-018,202,Laurence Lien,"Apart from these numbers, what is also important is how people feel on the ground. Many Singaporeans seem to feel that their total retirement savings, not just the CPF, is inadequate. For example, in a 2013 HSBC study on ""The Future of Retirement"", over half or 56% of the Singapore respondents felt that their financial preparations for a comfortable retirement were inadequate."
2013-11-12-T-018-S-00203,2013-11-12-T-018,203,Laurence Lien,The reasons for this predicament are numerous and complex and this is not the appropriate occasion to explore all of them. I would just focus on some limited aspects of whether enough is going into the CPF accounts of Singaporeans in the first place.
2013-11-12-T-018-S-00204,2013-11-12-T-018,204,Laurence Lien,"First, let me affirm the good that is being done and ask for an update. The Government restored the contribution rate of low-wage workers from January 2014 and enhanced the Workfare Income Supplement scheme. These are welcomed and I hope the lowering of contribution rates for the low-income does not happen again."
2013-11-12-T-018-S-00205,2013-11-12-T-018,205,Laurence Lien,"MOM and CPF Board also launched the WorkRight campaign to educate workers about their employment rights and increased enforcement efforts to ensure that employers make CPF contributions for their employees. CPF Board has announced that it is increasing the number of enforcement inspections from 500 in 2012 to 5,000 by 2014. My question is  how effective have these increased inspections been, for example, in terms of finding more errant offenders?"
2013-11-12-T-018-S-00206,2013-11-12-T-018,206,Laurence Lien,"In CPF Board's 2012 Annual Report, it says that ""the enforcement efforts of the CPF Board resulted in the recovery of $293 million in CPF contributions from 39,790 employers, benefiting more than 200,000 employees"". This means out of 128,000 or so employers who paid CPF contributions as at end of 2012, enforcement efforts were targeted at one in four of them."
2013-11-12-T-018-S-00207,2013-11-12-T-018,207,Laurence Lien,"This seems very high and does not square with the 0.57% average default rate for employers who failed to pay CPF contributions on time in 2012. Two hundred thousand is about one in nine active CPF members – again, not a small number. Perhaps, the Minister could explain this."
2013-11-12-T-018-S-00208,2013-11-12-T-018,208,Laurence Lien,"Under the ""I Know My Employment Rights, I Do It Right"" publicity campaign, I would also like to know whether it has resulted in more employees stepping forward to lodge complaints against their errant employers."
2013-11-12-T-018-S-00209,2013-11-12-T-018,209,Laurence Lien,"Secondly, let me highlight the measures that I support in the Bill before us. I support the increase in the maximum fines and the introduction of a term of imprisonment for offences under the Act for which no penalty is provided. These penalties are in line with the penalties for offences of a similar nature under the Employment Act. CPF payments are really no different from wage payments, as Dr Chia mentioned yesterday. And it is unacceptable for employers to withhold CPF contributions for their employees. In line with this, I also support the expansion of the scope of inspectors' powers to conduct their investigations."
2013-11-12-T-018-S-00210,2013-11-12-T-018,210,Laurence Lien,"However, I would like to sound a note of caution  it is important to distinguish between wilful behaviours and negligent or ignorant actions. As an employer in a small outfit, I know how difficult it is to know what is the right amount of CPF to pay. There are so many rules and rates to look at. This includes different rules and rates for different ages, income levels and nationalities, salary components, types of contracts and so on. And the contribution rate changes by the Government are not infrequent, and with staff turnover, it is very easy to make unintended mistakes, especially for small organisations with limited HR resources."
2013-11-12-T-018-S-00211,2013-11-12-T-018,211,Laurence Lien,"Hence, my third point is to make some suggestions. May I suggest that the CPF Act differentiate between the act of wilful withholding and the act of negligence or honest mistakes on the part of employers? I think a jail term is entirely appropriate for the former – for this group, I would even suggest heavier penalties than those proposed – but less so for the latter. May I also suggest that beyond educating employers on their roles, that CPF Board reviews its processes such that it is easier for employers to file the right returns?"
2013-11-12-T-018-S-00212,2013-11-12-T-018,212,Laurence Lien,"In addition, I would like to take the opportunity to raise the issue of CPF not covering contributions of self-employed persons to their Ordinary and Special Accounts. I think the retirement adequacy of these Singaporeans is just as important as those of other Singaporeans. And it should not be because of political expediency or administrative ease that we choose to exclude them."
2013-11-12-T-018-S-00213,2013-11-12-T-018,213,Laurence Lien,"For example, in Hong Kong, self-employed persons are required to join the Mandatory Provident Fund scheme. There is no difference in the treatment of self-employed and employed persons, except that self-employed persons can opt to make their contributions monthly or annually. I would propose that the Ministry review the treatment of these persons with the view to increasing their contributions and extending this to informal workers, too."
2013-11-12-T-018-S-00214,2013-11-12-T-018,214,Laurence Lien,"Madam, I would also propose that the Ministry review the retirement adequacy of persons who do not participate in economic activity for large proportions of their working-age periods. And this would include homemakers, caregivers and people who cannot work, for example, people with disabilities and mental illness. Overall, I think the Government needs to move beyond analysing the retirement adequacy of the modal worker who is an active CPF member all his or her working life, to focusing on the retirement adequacy of every Singaporean. With this, I support the Bill."
2013-11-12-T-018-S-00215,2013-11-12-T-018,215,Png Eng Huat,"Madam, I have three issues to raise on the Central Provident (Amendment) Bill. First, I want to talk about the enhanced enforcement introduced under the Repeal and Re-enactment of section 61 of the Act. The CPF holds the hard-earned money of every working Singaporean. We depend on it for our housing, healthcare, retirement needs and more. It is thus imperative that the Government should do more to protect working Singaporeans from being short-changed by errant employers, by sending a clear signal to these companies that non-payment, under-payment and even late payment of our CPF contributions are not acceptable, and repeat offenders will be taken to task."
2013-11-12-T-018-S-00216,2013-11-12-T-018,216,Png Eng Huat,"It is good to know that the penalties for general offences for non-, under- or late payment of CPF contributions are finally brought in line with the Employment Act. There should be no distinction between the two components of a worker's wage. Salaries and CPF contributions must be equally protected under the law. The introduction of a jail term and a minimum fine would certainly send a clear message that CPF contributions are non-negotiable."
2013-11-12-T-018-S-00217,2013-11-12-T-018,217,Png Eng Huat,"Although there is a rise in the number of CPF arrears cases, I note that the amount of money recovered, excluding late payments, remains relatively constant despite the rise in the number of companies and employees involved each year from 2010 to 2012."
2013-11-12-T-018-S-00218,2013-11-12-T-018,218,Png Eng Huat,"In 2011, there was a jump of 42% from the previous year in the number of companies involved in under-payment or non-payment of CPF contributions, and a corresponding spike of 67% in the number of workers affected. But the amount recovered by the Board was unchanged at $9.5 million a year for 2010 and 2011. In 2012, the number of errant employers involved under the same offence went up by 8% from the previous year, and the number of workers affected increased by 10%. But the amount recovered actually came down slightly to $9.4 million."
2013-11-12-T-018-S-00219,2013-11-12-T-018,219,Png Eng Huat,"These numbers are interesting as one would expect the amount of arrears recovered to go up proportionally with the number of offenders and affected workers. The two arrears cases cited by CPF in its press release in the last two years involved low-wage workers being owed CPF contributions for years and their arrears were substantial. The case cited by the Minister in his Manpower blog in May this year is also quite similar and the amount recovered for the worker alone was $26,000."
2013-11-12-T-018-S-00220,2013-11-12-T-018,220,Png Eng Huat,"Are these cases common or outlier? If these cases are common, it certainly did not reflect in the amount of CPF arrears recovered despite an annual increase in the number of companies and employees involved and the stepped up effort by both MOM and CPF Board to bring about greater compliance with the CPF and Employment Acts over the past three years."
2013-11-12-T-018-S-00221,2013-11-12-T-018,221,Png Eng Huat,"If these cases cited are outlier, what are the common cases of non-compliance? Are we seeing more new entrant low-wage workers being disadvantaged? Are we seeing more part-time or contract workers being short-changed? I hope the Ministry can shed more light on this. I also urge the Ministry to share more examples of employers and their errant practices with the public so that workers in industries where violations are rampant can better understand their employment rights and get the necessary assistance."
2013-11-12-T-018-S-00222,2013-11-12-T-018,222,Png Eng Huat,"It was also reported that the number of inspections was increased 10-fold, from 500 inspections in 2012 to 5,000 this year. The Minister has shared that 800 inspections were already carried out from January to April 2013. Can the Minister share why there is such a drastic spike in enforcement action? How many of the inspections were driven by complaints? And what can the Ministry do to remove the fear and protect workers who decide to come forward or whistle-blow?"
2013-11-12-T-018-S-00223,2013-11-12-T-018,223,Png Eng Huat,"It was reported that the key component of WorkRight, its confidentiality and the identity of anyone who files a complaint are kept strictly confidential. Has the assurance given rise to more complaints and enforcement action in 2013?"
2013-11-12-T-018-S-00224,2013-11-12-T-018,224,Png Eng Huat,"Second, the Bill seeks to expand the scope of inspectors' power of obtaining information, documents or records in the course of an inspection. I would like to ask the Minister about the safeguards put in place to prevent inspectors from going overboard in carrying their duties, now that they are armed with extended powers. What would constitute reasonable cause for an inspector to exercise the power conferred under the new section 5 subsection (3A)?"
2013-11-12-T-018-S-00225,2013-11-12-T-018,225,Png Eng Huat,"Third, I welcome the increase in withdrawal frequency for the CPF members above the age of 55 but I am of the opinion that there is no need to empower the Board to assess such application for withdrawal."
2013-11-12-T-018-S-00226,2013-11-12-T-018,226,Png Eng Huat,"The amendment to section 15 subsection (4) specifically deals with members who have already set aside the Minimum Sum, so retirement adequacy is no longer an issue to these members. A member should be allowed to withdraw his CPF savings at any time if the need arises. What is the purpose of controlling the condition and frequency of withdrawal of a member's CPF savings beyond the Minimum Sum after age 55?"
2013-11-12-T-018-S-00227,2013-11-12-T-018,227,Png Eng Huat,We spend a lifetime building our CPF retirement fund. We certainly do not want to spend the remaining years of our life quibbling with the Government of the day on how to spend the rest of our hard-earned money after setting aside the Minimum Sum at age 55. Allowing the Board such broad power to impose conditions and restrictions on the withdrawal frequency of a member's CPF account beyond what is legislated for retirement and medical use just does not sound right.
2013-11-12-T-018-S-00228,2013-11-12-T-018,228,Png Eng Huat,"I seek clarification from the Minister that the previous condition for further withdrawals from CPF by any member upon setting aside the Minimum Sum after age 55 will remain unchanged, that is, a member being unemployed for a period of six months immediately preceding his application for the withdrawal. This is because the explanatory statement accompanying the CPF (Amendment) Bill is not clear on this. I also seek clarification from the Minister that the new section 15(4) will make the withdrawal of a member's CPF savings beyond the Minimum Sum easier and not harder going forward."
2013-11-12-T-018-S-00229,2013-11-12-T-018,229,Png Eng Huat,One last point. I call upon the Ministry to relook into the Withdrawal Limit and the Valuation Limit affecting some CPF members. The Minister has said that the number of CPF members who have reached their Valuation Limit and must use cash to service their housing loan is at less than half a percent of members who are using CPF savings for their housing loan. The question then is  why would the Government want to impose so much anxiety and hardship on a small group of HDB flat dwellers?
2013-11-12-T-018-S-00230,2013-11-12-T-018,230,Png Eng Huat,"The Minister has also said in Parliament that the Valuation Limit and Withdrawal Limit continue to serve an important purpose in ensuring that CPF members purchase a property they can afford. I am sure affordability was not an issue at that point in time when some of these members purchased their HDB flat, but life is never certain."
2013-11-12-T-018-S-00231,2013-11-12-T-018,231,Png Eng Huat,"I hope the Minister can look into this and, in the interim, exercise as much flexibility as possible to allow CPF members who have difficulties in servicing their housing loan in cash, due to the Valuation Limit, to continue to draw down on their CPF savings for housing loan repayment."
2013-11-12-T-018-S-00232,2013-11-12-T-018,232,Png Eng Huat,"In conclusion, it is vital for the Government to ensure that the publicity of their WorkRight initiative be sustained until such time when vulnerable groups like low-wage workers can fully comprehend their employment rights under the law and responsible employment practices can be a way of life in our society."
2013-11-12-T-018-S-00233,2013-11-12-T-018,233,Gan Thiam Poh,"Mdm Speaker, I welcome the CPF (Amendment) Act to allow the increased withdrawal frequency for members above the age of 55 years old."
2013-11-12-T-018-S-00234,2013-11-12-T-018,234,Gan Thiam Poh,"The CPF Act is amended to provide the Board with the flexibility to allow members to make more than one withdrawal per year, empowering the Board to assess each case on its own merits. Let me continue in Mandarin."
2013-11-12-T-018-S-00235,2013-11-12-T-018,235,Gan Thiam Poh,"(In Mandarin)  [Please refer to  Vernacular Speech on Pg xxxx.] Mdm Speaker, I hope this CPF (Amendment) Bill can help the Government handle the challenges faced by the members effectively and flexibly. For example, some residents hope the Government can allow them to continue to use their CPF savings to pay for their monthly mortgage."
2013-11-12-T-018-S-00236,2013-11-12-T-018,236,Gan Thiam Poh,"The current regulation stipulates that members must meet the Minimum Sum requirement in their Retirement and MediSave accounts when they reach 55. Although members can pledge their properties, which help to meet half of the Minimum Sum requirement, some members are still unable to meet the requirement due to unfortunate circumstances, especially the low-income and contract workers, as well as self-employed persons."
