speech_id,topic_id,speech_order,member_name,text
2013-07-09-T-015-S-00208,2013-07-09-T-015,208,Amy Khor Lean Suan,"In 2009, SCDF embarked on a public-private partnership to engage private ambulance operators to add capacity to SCDF emergency ambulance service. These ambulances have to meet SCDF's standards for ambulance design, equipping and their staff have to meet the requisite medical skills certifications as part of the contract to operate with the SCDF EAS."
2013-07-09-T-015-S-00209,2013-07-09-T-015,209,Amy Khor Lean Suan,"As the ambulance sector develops, there is a need to upgrade the capabilities of ambulance personnel. A key component in the Pre-hospital Emergency Care (PEC) Transformation Plan, jointly developed by MOH and MHA, is the professional development of ambulance personnel, including paramedics, emergency medical technicians (EMTs), and medical transporters/drivers. This plan will cover the development of professional standards, competencies and related training of these personnel."
2013-07-09-T-015-S-00210,2013-07-09-T-015,210,Amy Khor Lean Suan,"ITE and the Singapore Armed Forces Medical Training Institute already offer essential training programmes for the paramedic trainees. MOH and MHA are also working on a framework for continuing education to enhance the skills and training of paramedics in the areas of cardiac emergencies, trauma, paediatrics and the management of other time-sensitive emergency conditions. To raise the standards of other ambulance personnel working closely with the paramedics, MOH and MHA have partnered WDA to develop a Pre-Hospital Medical Care Track, administered by SingHealth's Alice Lee Institute of Advanced Nursing, for EMTs and Medical Transporters in Singapore."
2013-07-09-T-015-S-00211,2013-07-09-T-015,211,Lee Bee Wah,"One supplementary question, please. Besides working on the skills of these paramedics, are there any guidelines on the charges of these ambulances or paramedic officers, especially those from the private sector?"
2013-07-09-T-015-S-00212,2013-07-09-T-015,212,Amy Khor Lean Suan,"I thank the Member for the supplementary question and for the opportunity to clarify regarding the ambulance charges. If the call is made to the telephone link 995 Emergency Ambulance Service that is operated by SCDF and it is ascertained by the doctor at the medical institution at the emergency department that it is an emergency case, there is no charge. If it is ascertained that it is non-emergency, there is a charge of $198."
2013-07-09-T-015-S-00213,2013-07-09-T-015,213,Amy Khor Lean Suan,The ambulance service provider is divided into the 995 telephone link service by SCDF and there are also private operators that operate essentially non-emergency patient transport service. There are also some that operate emergency services.
2013-07-09-T-015-S-00214,2013-07-09-T-015,214,Amy Khor Lean Suan,"There is a set of guidelines for private ambulance service that MOH has stipulated but these are primarily to ensure or safeguard patients' safety. The charges are not regulated but it is actually listed or put up on the SCDF website. The advice will be that if you want to use private ambulance services, please check the website so you make an informed decision. The private ambulance operator is supposed to tell you what the charges are before you take up the service."
2013-07-09-T-016-S-00215,2013-07-09-T-016,215,Lam Pin Min,– The following question stood in the name of
2013-07-09-T-016-S-00216,2013-07-09-T-016,216,Lam Pin Min,"18 To ask the Minister for Health (a) whether there is an emergency response plan to handle the possible emergence of a Middle East respiratory syndrome (MERS) outbreak in Singapore, especially during this haze period and its impact on the stockpile of N95 masks; and (b) whether the Ministry has any precautionary measures for Singaporeans performing the Haj in Mecca."
2013-07-09-T-016-S-00217,2013-07-09-T-016,217,Lee Bee Wah,"Question No 18, please."
2013-07-09-T-016-S-00218,2013-07-09-T-016,218,Dr Muhammad Faishal Ibrahim,"Mdm Speaker, MOH continues to closely monitor the global Middle East respiratory syndrome coronavirus (MERS) situation. As at 7 July, WHO has reported a total of 80 cases of MERS worldwide, with 44 deaths. These cases have been reported in Jordan, Qatar, Saudi Arabia, the United Arab Emirates, UK, France, Tunisia and Italy. Cases in the UK, France, Italy and Tunisia were detected after returning from the Middle East. Person-to-person transmission has been documented amongst close contacts, but there is yet no evidence of sustained community transmission. Overall, MOH's current assessment is that the risk of serious public health impact to Singapore due to an imported case of the MERS infection remains low."
2013-07-09-T-016-S-00219,2013-07-09-T-016,219,Dr Muhammad Faishal Ibrahim,"MOH has put in place various precautionary measures to prevent and cope with possible emergence of MERS infection in Singapore. Firstly, Health Advisory posters have been put up at the airport to alert inbound and outbound travellers to the Middle East of the MERS situation, while Health Advisory notices are also issued to travellers on flights from the Middle East. Persons who have been in the affected areas are advised to seek medical attention if they become unwell with fever and cough, and to inform their doctors of their travel history."
2013-07-09-T-016-S-00220,2013-07-09-T-016,220,Dr Muhammad Faishal Ibrahim,"Secondly, our doctors and hospitals remain vigilant to the threat of MERS in symptomatic travellers returning from affected areas. As of 5 July, a total of 51 suspected cases have been investigated locally since January 2013 and all have been tested negative for MERS. All suspected and confirmed cases will be isolated. MOH will conduct contact tracing when appropriate and all close contacts of confirmed cases will be quarantined."
2013-07-09-T-016-S-00221,2013-07-09-T-016,221,Dr Muhammad Faishal Ibrahim,"Thirdly, we have also stepped up our operational readiness in the event of an imported case. For example, we have put on standby the Home Team NS (HTNS) Pasir Ris chalets as possible quarantine housing from 17 June this year. MOH is also in contact with the WHO and our overseas counterparts and will monitor the situation closely."
2013-07-09-T-016-S-00222,2013-07-09-T-016,222,Dr Muhammad Faishal Ibrahim,"With the recent haze situation, we have drawn down from our national stockpile of N95 masks to augment the supply to the public. We are now in the process of replenishing the national stockpile so that we will be fully stocked should there be an outbreak of MERS in Singapore as soon as possible. In the meantime, hospitals have retained sufficient stocks of N95 masks to ensure that they would be able to safely care for patients suspected of having the MERS infection."
2013-07-09-T-016-S-00223,2013-07-09-T-016,223,Dr Muhammad Faishal Ibrahim,"Precautionary measures are in place for Haj and Umrah pilgrims. MOH works closely with MUIS and has issued health advisories to pilgrims travelling to Saudi Arabia. All pilgrims are advised to avoid close contact with persons suffering from acute respiratory infections and to adopt good food safety and hygiene practices to reduce the risk of being infected. All pilgrims are required to go for a medical check and will receive recommended vaccinations, including an influenza vaccination, prior to their trip. There are also briefings organised for the pilgrims by MUIS as part of the pre-trip medical advice and preparations, including the health advice from MOH."
2013-07-09-T-016-S-00224,2013-07-09-T-016,224,Dr Muhammad Faishal Ibrahim,"As MOH had done for the Haj last year, we will monitor the health status of all Haj pilgrims through the accompanying medical team from Singapore. In addition, MOH has established links and contacts with the Haj medical team as well as travel agents so that we can be alerted early to possible suspect MERS cases amongst our pilgrims."
2013-07-09-T-016-S-00225,2013-07-09-T-016,225,Dr Muhammad Faishal Ibrahim,MOH will continue to assess the MERS situation. Our priority remains to ensure that there are robust and well-established measures to protect and care for the health of Singaporeans.
2013-07-09-T-017-S-00226,2013-07-09-T-017,226,Sylvia Lim,"asked the Minister for Communications and Information what is the justification for the change in policy, arising from the Code of Practice for Info-Communication Facilities in Buildings 2013, requiring Town Councils to henceforth provide use of common property, such as rooftops of HDB blocks, to telecommunication companies without charging for use or access."
2013-07-09-T-017-S-00227,2013-07-09-T-017,227,Dr Yaacob Ibrahim,"Madam, there has been a growing dependence on mobile telephone services by businesses and consumers. With increasing expectations from end-users for better mobile coverage, IDA enhanced the quality of service standards imposed on mobile operators for both in-building and outdoor mobile coverage. Accordingly, IDA reviewed the Code of Practice for Info-Communication Facilities in Buildings. This was to ensure that building developments would be equipped with the minimum space and facilities necessary for mobile operators to deploy equipment required for better mobile coverage. The requirement to provide this minimum amount of mobile deployment space at no charge to the mobile operators was meant to facilitate the quick deployment of mobile equipment, so that end-users could benefit faster from the improved mobile coverage."
2013-07-09-T-017-S-00228,2013-07-09-T-017,228,Dr Yaacob Ibrahim,"To balance the needs of all parties, building owners and developers have been accorded flexibility to determine the location of the mobile deployment space, whether on roof-tops or in car parks, for example. Furthermore, this space need not be set aside upfront, but only upon request of a mobile operator. Existing lease agreements for space purposed for the provision of mobile coverage within the developments will also be allowed to continue until their expiry. As such, developments that currently lease space to the mobile operators would only need to comply with the new mobile deployment space requirements after the expiry of these existing agreements."
2013-07-09-T-017-S-00229,2013-07-09-T-017,229,Dr Yaacob Ibrahim,"Mdm Speaker, these changes are applied consistently to all buildings, including those in the private sector, as well as to Government-owned buildings. I would also like to point out that in the case of deployment of mobile equipment on HDB premises managed by Town Councils, the most direct and immediate beneficiaries of improved mobile coverage are the residents themselves."
2013-07-09-T-017-S-00230,2013-07-09-T-017,230,Dr Yaacob Ibrahim,"These new requirements have also taken into account industry feedback via two rounds of public consultation. Both public consultations saw no objections from most respondents, who understood and acknowledged the need to facilitate the better mobile coverage within building developments for the benefit of end-users."
2013-07-09-T-017-S-00231,2013-07-09-T-017,231,Sylvia Lim,"Madam, supplementary questions for the Minister. We would like to facilitate IDA's rationale of improving coverage for mobile users, including our residents. Does the Minister agree that the coverage would probably be better from the rooftop as compared to a lower lying space?"
2013-07-09-T-017-S-00232,2013-07-09-T-017,232,Sylvia Lim,"Secondly, we have done some checking on the frequency of access requests by these mobile operators at our Town Council for the first six months of this year and it works out to about 74 requests a month. So, it is a significant number of requests and there is a certain cost incurred by the Town Council to provide access to the rooftop because it is supposed to be a secured space and so on. I think the Minister understands that. So, I wonder whether the Minister would agree that this change in the COPIF would pass some burden to the Town Council, taking it away from a profit-making entity like the telcos. Would he consider reviewing at least this aspect, where access is given, could there be some arrangement where we could have a reasonable charge or get reimbursed for the cost incurred?"
2013-07-09-T-017-S-00233,2013-07-09-T-017,233,Dr Yaacob Ibrahim,"In terms of the location, this is about in-building coverage. So, it does not have to be on the rooftop. It could be in the car parks or basement. But we leave it to the MTOs to decide where exactly is the best location, in consultation with the building owner. We do not have a preference. What COPIF does is to specify a minimum space in which the building owners would have to give to the MTOs. Anything beyond that, they have to agree on a commercial basis."
2013-07-09-T-017-S-00234,2013-07-09-T-017,234,Dr Yaacob Ibrahim,"I do not quite understand why there are so many checks in Aljunied Town Council – 74 requests. I am quite curious which MTO, but we will check on that. But on the issue of access, as mentioned by the Member, clearly we understand why it is important for us to give access to the MTOs so that they can go in if there are rectification and maintenance work that needs to be done. But notwithstanding this, we have to consider the issue of access charge, given the feedback that we have received from the previous meeting the IDA had with the Town Councils. So, we are prepared to look at this again."
2013-07-09-T-018-S-00235,2013-07-09-T-018,235,Muhamad Faisal Bin Abdul Manap,asked the Minister for Communications and Information and Minister-in-charge of Muslim Affairs (a) if he can provide details on the annual amount of Government funding received by the Community Leaders Forum (CLF) from 2010-2012; and (b) whether the inclusion of Malay members from a political party as resource persons has infused in this community initiative a partisan element.
2013-07-09-T-018-S-00236,2013-07-09-T-018,236,Dr Yaacob Ibrahim,"Madam, the Community Leaders Forum (CLF) was set up in 2003 to harness the expertise and experience of policy makers, community leaders and partners to address issues affecting the Malay/Muslim community. It aims to engage the Malay/Muslim community on how resources can be best used to meet its needs."
2013-07-09-T-018-S-00237,2013-07-09-T-018,237,Dr Yaacob Ibrahim,"Projects under the CLF are funded by Mendaki's Malay/Muslim Community Development Fund (MMCDF), which consists of donations and Government matching grant in broadly equal proportions. From 2010 to 2012, Mendaki invested approximately $4.8 million in CLF projects."
2013-07-09-T-018-S-00238,2013-07-09-T-018,238,Dr Yaacob Ibrahim,"The work of the CLF is extensive and requires participation, support and leadership at many levels. I chair the CLF Steering Committee, while other PAP Malay Members of Parliament serve as Resource Persons or Co-Chairmen to advise the four CLF networks of Education, Youth, Family and Employability."
2013-07-09-T-018-S-00239,2013-07-09-T-018,239,Dr Yaacob Ibrahim,"Madam, Government Members of Parliament who serve on platforms that receive Government support are clear about their role, which is to help achieve the social, cultural or educational goals of these bodies and not to exploit them for political ends. We are no different in the CLF. We serve with the goal of helping CLF achieve its objectives more effectively and ensure progress of the Malay/Muslim community."
2013-07-09-T-019-S-00240,2013-07-09-T-019,240,Alex Yam,asked the Minister for National Development (a) how many buildings in the Central Business District and main shopping belt have direct pedestrian linkages either above or underground; (b) what have been the challenges of getting business owners to agree to link their buildings; and (c) whether the Ministry will consider changing legislation to make such pedestrian linkages compulsory.
2013-07-09-T-019-S-00241,2013-07-09-T-019,241,Lee Yi Shyan,"Mdm Speaker, over 40 buildings within the Central Business District, Marina Bay and the Orchard Road to the City Hall shopping belt are connected by underground pedestrian links. Another 28 buildings are connected by elevated links. Notable pedestrian links include those at the buildings around Orchard MRT and commercial areas at Tanjong Pagar, City Hall and Raffles Place. In Marina Bay, all buildings are required to have basement level links to the adjacent buildings."
2013-07-09-T-019-S-00242,2013-07-09-T-019,242,Lee Yi Shyan,An extensive network of all-weather pedestrian links is necessary for our city to be well-connected and pedestrian-friendly. Pedestrian links also support the use of public transport. We are realising more pedestrian links in the following ways.
2013-07-09-T-019-S-00243,2013-07-09-T-019,243,Lee Yi Shyan,"First, where relevant, URA will stipulate requirements for pedestrian links for new sites launched under the Government Land Sales programme or private buildings undergoing redevelopment."
2013-07-09-T-019-S-00244,2013-07-09-T-019,244,Lee Yi Shyan,"Second, LTA will develop pedestrian links as new MRT stations are built and these links will be joined up with adjacent buildings where possible."
2013-07-09-T-019-S-00245,2013-07-09-T-019,245,Lee Yi Shyan,"Third, URA administers a cash grant incentive scheme to encourage owners to develop underground pedestrian links between existing buildings. So, this is a retrofitting programme. The take-up for the URA cash grant incentive scheme has been slow partly because it has just been revised in August 2012. Apart from the cost of constructing the links, which the scheme seeks to address, owners may prefer to retrofit their buildings to incorporate the links only when the buildings are being redeveloped. Some owners may also be concerned about disruption to businesses during the construction period, loss of lettable commercial space to accommodate these links, and potential diversions of customers to adjacent buildings."
2013-07-09-T-019-S-00246,2013-07-09-T-019,246,Lee Yi Shyan,There is currently no legislation for the Government to require owners to link up existing buildings.
2013-07-09-T-019-S-00247,2013-07-09-T-019,247,Alex Yam,"Madam, I thank the Senior Minister of State for his response. I have four quick supplementary questions. Firstly, is the Ministry satisfied with the current rate of adoption based on the Master Plan? Secondly, I quote an interesting example that made it to the press – The Straits Times, January 2010, called ""A Bridge Too Short"". Iluma at Bugis had a bridge that did not link. There was about a 2-metre gap. But, surprisingly, when Bugis Junction bought over Iluma, magically the bridge joined up. Is there something that the Ministry can do, since it is encouraging new projects to take on these so that they are not a loss?"
2013-07-09-T-019-S-00248,2013-07-09-T-019,248,Alex Yam,"Thirdly, will the GFA exemptions that are currently provided for elevated pedestrian walkways for places like Jurong Gateway and the cash grants be made more attractive so that more business owners may want to come onboard on the scheme? Lastly, in response to part (c) of my parliamentary question, will the Ministry therefore consider introducing legislation to make this a compulsory part of development?"
2013-07-09-T-019-S-00249,2013-07-09-T-019,249,Lee Yi Shyan,"I thank the Member for his various suggestions. The co-funding programme has just been revised about a year ago and it is our intention to work closely with the various property owners to introduce the rebuilding of the pedestrian links, it will take a while for the links to be established over time."
2013-07-09-T-019-S-00250,2013-07-09-T-019,250,Lee Yi Shyan,"The Member mentioned the example of Iluma and also Jurong Gateway. Sometimes, the GFA exemptions are being used because we need to provide space for some of the common mechanical and electrical ventilation systems. So, where it is appropriate, URA will consider giving these. But for other redevelopment and new developments, when the property owners are submitting their plans for approval, URA would require them to build those links, including covering any 2- or 3-metre gaps that may be there. We are, at this stage, not considering legislation as yet because we think a better way is still to work closely with the building owners to hasten the building of the links."
2013-07-09-T-020-S-00251,2013-07-09-T-020,251,Irene Ng Phek Hoong,"asked the Minister for National Development (a) what are the development plans for Pulau Ubin and how will they affect residents living on the island; and (b) why did HDB's Land Clearance Section send residents there a letter with the header ""Clearance Scheme  Clearance of Structures Previously Acquired for Development of Adventure Park on Pulau Ubin""."
2013-07-09-T-020-S-00252,2013-07-09-T-020,252,Lina Chiam,asked the Minister for National Development with regard to HDB's recent notice to the 22 households on Pulau Ubin (a) what are the reasons for serving this notice since the Ministry has no plans to evict them; (b) what resettlement benefits are they entitled to; (c) what will happen to these households if they cannot afford to pay the rent after obtaining a Temporary Occupation Licence; and (d) what future plans does the Ministry have for this plot of land.
2013-07-09-T-020-S-00253,2013-07-09-T-020,253,Mohamad Maliki Bin Osman,"Mdm Speaker, may I take Question Nos 22 and 23 together, please?"
2013-07-09-T-020-S-00254,2013-07-09-T-020,254,Speaker,"Yes, please."
2013-07-09-T-020-S-00255,2013-07-09-T-020,255,Mohamad Maliki Bin Osman,There is currently no development plan for Pulau Ubin. Our intention is to keep Pulau Ubin in its rustic state for as long as possible and as an outdoor playground for Singaporeans.
2013-07-09-T-020-S-00256,2013-07-09-T-020,256,Mohamad Maliki Bin Osman,Both SLA and HDB have clarified that the letter sent to the 22 households on Pulau Ubin in March 2013 was meant to notify them of a census survey to determine their eligibility for resettlement benefits arising from the land acquisition exercises in 1987 and 1993. The letter was not an eviction notice.
2013-07-09-T-020-S-00257,2013-07-09-T-020,257,Mohamad Maliki Bin Osman,SLA and HDB acknowledged that the letter could have been more carefully worded and the language updated to reflect the eventual development on Pulau Ubin. They had already apologised for the anxiety caused to the affected residents.
2013-07-09-T-020-S-00258,2013-07-09-T-020,258,Mohamad Maliki Bin Osman,"While the affected land owners were all compensated for the land acquired by the Government earlier in 1987 and 1993, not all the households had claimed the resettlement benefits. Furthermore, as these households have been staying on state land since the acquisition exercise without a Temporary Occupation Licence (TOL), SLA is taking this opportunity to regularise the TOL for these households, which is a requirement for them to remain on state land."
2013-07-09-T-020-S-00259,2013-07-09-T-020,259,Mohamad Maliki Bin Osman,The resettlement benefits that some of these affected Pulau Ubin residents are eligible for include an ex-gratia amount payable to the house owners and tenants for their houses and improvements made to their surroundings; priority allocation of HDB flats for those who wish to relocate to mainland Singapore; and a transport allowance for the relocation.
2013-07-09-T-020-S-00260,2013-07-09-T-020,260,Mohamad Maliki Bin Osman,"To help those residents who decide to remain on Pulau Ubin and not relocate to the mainland, SLA will not be charging them the full TOL fees immediately, but phasing it in over five years. This means that the residents only need to pay the full TOL fees from the sixth year onwards. Most of these households will only need to pay less than $20 per month in the first year and less than $120 per month in the sixth year."
2013-07-09-T-020-S-00261,2013-07-09-T-020,261,Mohamad Maliki Bin Osman,"For residents who face financial difficulties in paying the rent, SLA will be facilitating the assessment for them to receive financial assistance from the Government."
2013-07-09-T-020-S-00262,2013-07-09-T-020,262,Faizah Jamal,"Madam, I have three questions to clarify. Firstly, I know some of these people personally, having gone to Pulau Ubin in the last 30 years, both for leisure as well as in my role as an environment educator and nature guide. Some of these residents have told me that not only do they not understand English but they are not literate. Some of them have never gone to school. And they came back only to find this letter in English and, naturally, they were concerned. So, my first question is  moving forward, could the Ministry give some assurance to these residents that, in future, any sort of clarifications be made in a language and dialect that they can understand, and also to speak to them personally perhaps if need be?"
2013-07-09-T-020-S-00263,2013-07-09-T-020,263,Faizah Jamal,"Secondly, I am heartened to know that Pulau Ubin will be kept in its rustic state as far as possible. One resident who has been living there for the fourth generation is Kamariah Abdullah. She has done great work in her house which is a really beautiful Malay house in its natural state and has encouraged people to come and stay and enjoy what we call the ""kampung"" spirit. So, what I would like to ask the Ministry is whether the Ministry has any plans to encourage people like Kamariah Abdullah to stay and rejuvenate this whole life, the ""kampung"" spirit and encourage people to go. And in addition, to support her financially or in some other ways to continue this kind of existence for the betterment, not just of Singaporeans and future generations, but also tourists who come to the island."
