speech_id,topic_id,speech_order,member_name,text
2014-03-05-T-001-S-00001,2014-03-05-T-001,1,R Dhinakaran,– The following question stood in the name of
2014-03-05-T-001-S-00002,2014-03-05-T-001,2,R Dhinakaran,"1 To ask the Acting Minister for Manpower (a) whether the Progressive Wage Model will be rolled out to other sectors besides the cleaning and security industries; and (b) if so, which sectors will these be and when it will be rolled out."
2014-03-05-T-001-S-00003,2014-03-05-T-001,3,Foo Mee Har West Coast,Question No 1.
2014-03-05-T-001-S-00004,2014-03-05-T-001,4,Hawazi Daipi,"<span style=""color  rgb(51, 51, 51);"">  </span>"
2014-03-05-T-001-S-00005,2014-03-05-T-001,5,Hawazi Daipi,We will share more details on Government's approach for progressive wage models in sectors beyond cleaning and security at MOM's Committee of Supply debates later this week.
2014-03-05-T-001-S-00006,2014-03-05-T-001,6,Speaker,Order. End of Question Time.
2014-03-05-T-002-S-00007,2014-03-05-T-002,7,,"[(proc text) ""to repeal and re-enact with amendments the Geographical Indications Act (Chapter 117B of the 1999 Revised Edition) to provide for the protection of geographical indications in relation to goods, and for matters connected therewith, and to make related amendments to certain other written laws"", (proc text)]"
2014-03-05-T-002-S-00008,2014-03-05-T-002,8,,"[(proc text) presented by	the Senior Minister of State for Law (Ms Indranee Rajah); read the First time; to be read a Second time on the next available Sitting of Parliament, and to be printed. (proc text)]"
2014-03-05-T-003-S-00009,2014-03-05-T-003,9,,"[(proc text) Resolved, (proc text)]"
2014-03-05-T-003-S-00010,2014-03-05-T-003,10,,"[(proc text) That notwithstanding the Standing Orders, the proceedings on the Estimates of Expenditure for FY 2014/2015 be taken till 8.00 pm on the days allotted to the Committee of Supply on the Estimates for FY 2014/2015. – [Mr Gan Kim Yong]. (proc text)]"
2014-03-05-T-004-S-00011,2014-03-05-T-004,11,,"[(proc text) Order read for Resumption of Debate on Question [21 February 2014], (proc text)]"
2014-03-05-T-004-S-00012,2014-03-05-T-004,12,,"[(proc text) ""That Parliament approves the financial policy of the Government for the financial year 1 April 2014 to 31 March 2015."" – [Deputy Prime Minister and Minister for Finance]. (proc text)]"
2014-03-05-T-004-S-00013,2014-03-05-T-004,13,,[(proc text) Question again proposed. (proc text)]
2014-03-05-T-004-S-00014,2014-03-05-T-004,14,Faizah Jamal,"Mdm Speaker, it has been said that a mature society desires a lot more than to save itself physically and economically. A mature society, in the words of Thomas Berry, ""experiences the world, not as a useful collection of objects, but as the sacred communion of subjects""."
2014-03-05-T-004-S-00015,2014-03-05-T-004,15,Faizah Jamal,"In the two years that I have been a Member of this House, I have called for policies that think with the heart and not the head. I believe that this year's Budget had sought to do just that."
2014-03-05-T-004-S-00016,2014-03-05-T-004,16,Faizah Jamal,"Mdm Speaker, I join my colleagues in this House in supporting the Budget and applauding Deputy Prime Minister Tharman and the Government for acknowledging, honouring and rewarding our esteemed Pioneer Generation for their contributions in building this country though the special feature in this year's Budget, the Pioneer Generation Package (PGP)."
2014-03-05-T-004-S-00017,2014-03-05-T-004,17,Faizah Jamal,"I also welcome the fact that Budget 2014 took pains to focus on building a fair and equitable society. It underscores that while we all have different gifts and talent, and have different starting points in life, social mobility is what we aim for. I am also heartened by the move away from cheap-sourcing, which has the consequence of demeaning the work of certain groups of people, stripping them of their dignity and making the relationship a purely transactional one."
2014-03-05-T-004-S-00018,2014-03-05-T-004,18,Faizah Jamal,"Madam, there is just one concern that I have with the Pioneer Generation Package, which is that it may unwittingly give the impression that we reward our Pioneer Generation when they are sick and not so much on what I consider the preferred basis – that we take care of our elderly regardless."
2014-03-05-T-004-S-00019,2014-03-05-T-004,19,Faizah Jamal,"Mdm Speaker, in the two years that I have been in the House and now, participating in my third and last Budget debate, raising issues specifically on what has been and still are considered non-mainstream issues – that of the environment – and sometimes, feeling like that strange character in the book by Dr Seuss called The Lorax, speaking for the trees and those that have no tongue, it has always been my inclination to question fundamentals and the philosophy behind policies by asking these three questions  does it educate; does it engage; does it empower?"
2014-03-05-T-004-S-00020,2014-03-05-T-004,20,Faizah Jamal,"So, it is in this spirit of educate, engage and empower that I speak on the Budget. Much has been said about how prudent fiscal policies and productivity are the keys for Singapore to continue to thrive in this globalised world."
2014-03-05-T-004-S-00021,2014-03-05-T-004,21,Faizah Jamal,Much is also made of how and why our record of productivity has not been a sterling one in the last few years.
2014-03-05-T-004-S-00022,2014-03-05-T-004,22,Faizah Jamal,"As I listen to the concerns raised by some of my colleagues in this House that Singaporeans are said to have low self-esteem, lack motivation and pride in their work, reluctant to go beyond the call of duty, not taking ownership for the cleanliness of their living spaces and leaving it instead to the legions of foreign cleaners, I pause to ask why. And I would like to offer some views to overcome these attitudes and how that productivity can be enhanced in a way that is empowering and sustainable for the highest good of all concerned."
2014-03-05-T-004-S-00023,2014-03-05-T-004,23,Faizah Jamal,"Along with the first ""E"" of educate are my concerns on healthcare."
2014-03-05-T-004-S-00024,2014-03-05-T-004,24,Faizah Jamal,"Mdm Speaker, among the many issues relating to healthcare, recently some Members of this House had raised the bed crunch issue in our hospitals and were given the assurance by MOH that such needs will be adequately met. There have also been several calls to make medical cost affordable through the various schemes. In the Pioneer Generation Package itself, there is substantial financial support for our senior citizens for their medical needs."
2014-03-05-T-004-S-00025,2014-03-05-T-004,25,Faizah Jamal,"With due respect, Mdm Speaker, this is not healthcare. This is sick care."
2014-03-05-T-004-S-00026,2014-03-05-T-004,26,Faizah Jamal,"Mdm Speaker, in my Budget speech last year, I had made reference to a report in The Straits Times of the increasing suicide rates among older people. Late last year, I filed a Parliamentary Question (PQ) on the rise of suicide rates among the youths. Very recently, I have been very disturbed by the rise in the number of animal abusers which has prompted the Minister for Law to promise more severe punishment for the guilty. Many of us are also familiar with videos taken by ordinary citizens of road rage and road bullies, as well as fights in our trains in full public view."
2014-03-05-T-004-S-00027,2014-03-05-T-004,27,Faizah Jamal,It would seem as if we are a society wrought with pent-up emotions.
2014-03-05-T-004-S-00028,2014-03-05-T-004,28,Faizah Jamal,"Have we not questioned enough the underlying reasons on such pent-up emotions? When we increase the severity of punishments for animal abusers, do we also recognise that underlying those disruptive acts are unresolved emotional issues that make it easy for someone to take it out on others deemed weaker than they, whether be it an animal, a child, a spouse or the elderly?"
2014-03-05-T-004-S-00029,2014-03-05-T-004,29,Faizah Jamal,"When the elderly are driven to suicide, could the loss of familiar places, spaces and faces, and the bewildering change around them have something to do with it? Have we considered that all these may well be symptomatic of a society that has emotional issues which are not given the chance to react in a safe non-judgemental way?"
2014-03-05-T-004-S-00030,2014-03-05-T-004,30,Faizah Jamal,"Could all these pent-up emotions be one reason why we are not productive at work and at home, not motivated and have such low self-esteem, as mentioned by some Members in the House?"
2014-03-05-T-004-S-00031,2014-03-05-T-004,31,Faizah Jamal,"Mdm Speaker, for a very long time, it has been widely known that a physical ailment is really a result of an emotional imbalance, as a result of suppressed emotions. Science is only beginning to recognise that in fact there is a mind-body connection between how we think, what we feel, and our physical thesis."
2014-03-05-T-004-S-00032,2014-03-05-T-004,32,Faizah Jamal,"It is interesting to me that on Monday's The Straits Times, there was a report on the increasing popularity on what is termed ""mindfulness techniques"" in the private sector as people turn away from pills and pharmaceuticals towards a non-chemical based way of dealing with stress."
2014-03-05-T-004-S-00033,2014-03-05-T-004,33,Faizah Jamal,"It is also interesting to me that in a school in North Thailand, students are taught relaxation techniques, resulting in a more composed outlook towards life. It is clear today that an emotionally-centred society is a healthier society, and I would venture to add, a more productive one."
2014-03-05-T-004-S-00034,2014-03-05-T-004,34,Faizah Jamal,"At this point, I declare my interest as a facilitator of self empowerment workshops, supporting people as they navigate their way through emotional challenges. It is when people are given the space and skills to express and release their emotions, and channel them constructively that real personal transformation happens. Often, for such people, they no longer see themselves as victims, but rather as empowered people able to make life-affirming choices."
2014-03-05-T-004-S-00035,2014-03-05-T-004,35,Faizah Jamal,"I would argue, therefore, that beyond exercise, diet and discouraging smoking, our Healthy Lifestyle campaign should provide these lifeskills because real healthcare is about dealing with the underlying causes, and not just the symptoms through the provision of pharmaceutical and hospital services."
2014-03-05-T-004-S-00036,2014-03-05-T-004,36,Faizah Jamal,"I, therefore, call for the kind of healthcare that places as much, if not more, emphasis on the lifeskills that support Singaporeans manage their emotional challenges beyond the physical rewards and the extra sick beds."
2014-03-05-T-004-S-00037,2014-03-05-T-004,37,Faizah Jamal,"Now, onto the second ""E"" of ""engage""."
2014-03-05-T-004-S-00038,2014-03-05-T-004,38,Faizah Jamal,"Mdm Speaker, in my maiden speech in 2012, I had given anecdotal evidence of how my 19-year old students felt a sense of awe and wonder when they discovered that in the nature reserves of this tiny red dot we called home, is also home to a whole range of wildlife some of which cannot be found elsewhere in the world."
2014-03-05-T-004-S-00039,2014-03-05-T-004,39,Faizah Jamal,"For some of my students, this was a defining moment in their lives – what I call a ""National Geographic"" moment. For many of them, this experience led to a feeling of a sense of place, identity and pride in their country. For others, it gave them a sense of repose, peace and calm."
2014-03-05-T-004-S-00040,2014-03-05-T-004,40,Faizah Jamal,"Could this exposure to our national spaces be one way in which we restore and regenerate the sense of pride in ourselves and our country, leading to more interest, care and concern to look after ourselves and our public spaces – both built and natural?"
2014-03-05-T-004-S-00041,2014-03-05-T-004,41,Faizah Jamal,Could the common effects of our nature spaces lead people to want to do better at work and with their families?
2014-03-05-T-004-S-00042,2014-03-05-T-004,42,Faizah Jamal,"In response to the Government's proposal to the land used plan to build an MRT line cutting through the nature reserves, enthusiastic young people calling themselves such diverse names as ""Toddycats"", ""Naked Hermit Crabs"", ""Green Beans SOTA"" have joined forces with veterans of the environment scene, like Nature Society, to offer walks in our forest for their friends, families and public in a bid to show Singaporeans just how much treasure there is in our natural world."
2014-03-05-T-004-S-00043,2014-03-05-T-004,43,Faizah Jamal,"Apart from giving rise to a whole generation of aware and conscious young people – eager to volunteer, share their passion, and proud of what their country can offer – I know many of these young people have also chosen studies and careers in the environment field so that what was once a hobby, is now a paid vocation."
2014-03-05-T-004-S-00044,2014-03-05-T-004,44,Faizah Jamal,"There is no better way to produce a more productive society than young people who, in the words of Joseph Campbell, ""had followed their bliss"". We can thank our wild spaces for that."
2014-03-05-T-004-S-00045,2014-03-05-T-004,45,Faizah Jamal,"Further, the fact that registrations for public walks filled up really quickly shows how Singaporeans feel about the need to reconnect with nature, and how much they value these places."
2014-03-05-T-004-S-00046,2014-03-05-T-004,46,Faizah Jamal,"Mdm Speaker, in my maiden speech, I had also asked that we do not focus overly on the built economy without, at the same, accounting for the loss of what is called ""natural capital"" defined as land, water, air, living organisms, and all that provide us with eco-system, goods and services imperative for our survival and well-being."
2014-03-05-T-004-S-00047,2014-03-05-T-004,47,Faizah Jamal,"Mdm Speaker, Deputy Prime Minister Tharman had used the word ""transforming our economy, changing how we grow"". I would argue that taking into account our natural capital would go a long way in changing how we grow in a fuller sense of that word."
2014-03-05-T-004-S-00048,2014-03-05-T-004,48,Faizah Jamal,"Yet, in the name of development, more of such places, which have been around longer than even the pioneers of our Pioneer Generation, have been taken away or, in the case of the Chek Jawa on Pulau Ubin, in danger of being chipped away."
2014-03-05-T-004-S-00049,2014-03-05-T-004,49,Faizah Jamal,"Late last year, a commercial sports enterprise was allowed to encroach upon our nature reserves for a night time high-impact sports activity even though the custodian of our nature reserves knows that night times are downtimes for the animals in our forests, which for the most part are nocturnal and highly sensitive to human presence."
2014-03-05-T-004-S-00050,2014-03-05-T-004,50,Faizah Jamal,"We have allowed private housing to be built right at the edge of our nature reserves. And when the natural world in the form of long-tailed macaques come a-calling into these private spaces, we indignantly call this as an intrusion into our space, warranting a culling of 500 of these animals last year, as clarified by AVA in the PQ I filed just last month."
2014-03-05-T-004-S-00051,2014-03-05-T-004,51,Faizah Jamal,"Mdm Speaker, this percentage in effect makes up a hefty 25% of the entire macaque population."
2014-03-05-T-004-S-00052,2014-03-05-T-004,52,Faizah Jamal,This is part of the natural world I am talking about – the natural capital that is not reflected in our Budget.
2014-03-05-T-004-S-00053,2014-03-05-T-004,53,Faizah Jamal,How should we be account for the loss if future generations may no longer get to see these animals in the wild?
2014-03-05-T-004-S-00054,2014-03-05-T-004,54,Faizah Jamal,"Mdm Speaker, I call for a national nature conservation policy that emphasises the sanctity and inviolability of our nature reserves."
2014-03-05-T-004-S-00055,2014-03-05-T-004,55,Faizah Jamal,"We laud our Pioneer Generation for having been prudent in the stewardship of our national resources. Should we not, by the same token, be prudent in our stewardship of our natural resources?"
2014-03-05-T-004-S-00056,2014-03-05-T-004,56,Faizah Jamal,"Fifty years from now, can we look at our grandchildren in the eye and explain to them why there are no more natural and wild spaces in Singapore? Fifty years from now in this House, will our children and our grandchildren be able to say that they are as proud of us as we are of our Pioneer Generation?"
2014-03-05-T-004-S-00057,2014-03-05-T-004,57,Faizah Jamal,"I quote the words of poet Drew Dellinger. He said,"
2014-03-05-T-004-S-00058,2014-03-05-T-004,58,Faizah Jamal,"""It is 3.23 in the morning,"
2014-03-05-T-004-S-00059,2014-03-05-T-004,59,Faizah Jamal,"and my great, great grandchildren will not let me sleep."
2014-03-05-T-004-S-00060,2014-03-05-T-004,60,Faizah Jamal,"My great, great grandchildren ask me in my dreams,"
2014-03-05-T-004-S-00061,2014-03-05-T-004,61,Faizah Jamal,"‘What did you do,"
2014-03-05-T-004-S-00062,2014-03-05-T-004,62,Faizah Jamal,"once you knew?'"""
2014-03-05-T-004-S-00063,2014-03-05-T-004,63,Faizah Jamal,"I, therefore, call for a future Budget that reflects the balance with the natural assets not just with our fiscal assets. After all, in the end, the only Budget that we need to balance is that with Mother Earth."
2014-03-05-T-004-S-00064,2014-03-05-T-004,64,Faizah Jamal,"Now, for the last ""E"" – of ""empower""."
2014-03-05-T-004-S-00065,2014-03-05-T-004,65,Faizah Jamal,"Mdm Speaker, when I was asked by the Nature Society to put my hat in the ring, and later I accepted the call to be nominated, amongst one of the things I committed to do is to call for a transparent, open and consultative form of governance to call for more public accountability on the part of the Government, where civil society is seen to be an asset, not a hindrance, in my belief that this will result in an educated, aware and empowered citizenry which will bode well for the country as a whole."
2014-03-05-T-004-S-00066,2014-03-05-T-004,66,Faizah Jamal,"Last Saturday, I was able to manifest my wish to share with my fellow environment advocates, the vital role that Parliament plays and how it is a powerful channel for environment advocacy. I believe that by understanding the parliamentary process, including the Budget debates, we get to be more aware and conscious citizens, empowered not only about our rights but also recognising our obligations and better able to engage with policy makers."
2014-03-05-T-004-S-00067,2014-03-05-T-004,67,Faizah Jamal,"At the end of that session, it is gratifying to know that participants found a new sense of empowerment with what they have learned – the desire to know more about the parliamentary process and how they can do more to engage with the people whom they voted into office."
2014-03-05-T-004-S-00068,2014-03-05-T-004,68,Faizah Jamal,"In line with my call questioning fundamentals, for transparency and for an empowered citizenry, I am now making a call that the Budget process itself be more transparent, more open."
2014-03-05-T-004-S-00069,2014-03-05-T-004,69,Faizah Jamal,"Mdm Speaker, Dr Noeleen Heyzer, a Singaporean who is an Under Secretary at the United Nations said, ""Budgeting is no longer an exclusive exercise reserved only for ministries of finance but rather, a process that entails aligning national development plans and goals and human rights commitments with Budget policies in a transparent and coherent manner."""
2014-03-05-T-004-S-00070,2014-03-05-T-004,70,Faizah Jamal,"Typically, MOF offers pre-Budget public consultations in November, which then last till January, through its website and the REACH portal. However, considering that in a typical Budget cycle, Cabinet approves the consolidated Budget in late January and announce to the public in late February, I would like to ask how meaningful and how substantial is the public feedback and how is it really reflected in the Budget?"
2014-03-05-T-004-S-00071,2014-03-05-T-004,71,Faizah Jamal,"An international advocacy group called the International Budget Partnership that tracks 125 countries, ranks countries on budget transparency based on whether government provides the public with timely access to comprehensive information contained in 80 key documents. It turns out that Singapore is not included in the list of countries, and so we do not know what Singapore's international standing is."
2014-03-05-T-004-S-00072,2014-03-05-T-004,72,Faizah Jamal,"Some countries, for example, New Zealand, have a practice of releasing a pre-Budget Statement at least one month before the Budget is introduced in Parliament for more time for analysis and debate."
2014-03-05-T-004-S-00073,2014-03-05-T-004,73,Faizah Jamal,"Mdm Speaker, as part of my call for transparency, I had called for a compulsory environment impact assessment which is open to public scrutiny and study."
2014-03-05-T-004-S-00074,2014-03-05-T-004,74,Faizah Jamal,That opportunity to repeat this call came with the Population White Paper and Land Use Plan when the proposal to put a train line cutting through our nature reserve drew strenuous objections by nature activists like myself.
2014-03-05-T-004-S-00075,2014-03-05-T-004,75,Faizah Jamal,"Much to the credit of LTA, in an unprecedented consultation with nature groups lasting eight months – ably led by Senior Minister of State Josephine Teo – what used to be an unmentionable word in Government agency parlance, the dreaded word, ""EIA"" is now in the consciousness of at least one Government agency, LTA."
2014-03-05-T-004-S-00076,2014-03-05-T-004,76,Faizah Jamal,"More than that, and I am sure Senior Minister of State Josephine Teo would agree with me, is the fact that the openness, the transparency and the discourse between the parties had enabled both sides to understand each other much better. Imagine what that can do for greater productivity. Such consultations bode very well for public-people engagement in the future."
2014-03-05-T-004-S-00077,2014-03-05-T-004,77,Faizah Jamal,"Mdm Speaker, from my experience at last Saturday's session, explaining the parliamentary process to environment advocates, I realised what an asset it is to have an informed citizenry – discussions are more robust, more substantial and ultimately more empowering."
2014-03-05-T-004-S-00078,2014-03-05-T-004,78,Faizah Jamal,A Budget process is likewise a powerful channel for engagement between people and the public.
2014-03-05-T-004-S-00079,2014-03-05-T-004,79,Faizah Jamal,"In fact, no less than the Office of the Auditor-General itself stated in its 2011 Public Accountability Publication that ""The citizens of Singapore are the ultimate owners of our nation's financial resources. It is important that they understand and support the process and the systems that ensure public accountability""."
2014-03-05-T-004-S-00080,2014-03-05-T-004,80,Faizah Jamal,I look forward to seeing this call for greater openness come to fruition in the near future.
2014-03-05-T-004-S-00081,2014-03-05-T-004,81,Faizah Jamal,"To end, Mdm Speaker, in my work both in and outside the House, I have found how powerful it is when people engage in real conversations, face-to-face dialogue, seeking only to educate, to engage and to empower. That, to my mind, is the real meaning, the full meaning of Deputy Prime Minister Tharman's words, ""Quality Growth for Singapore""."
2014-03-05-T-004-S-00082,2014-03-05-T-004,82,Ang Wei Neng,"Mdm Speaker, please allow me to speak in Mandarin first."
2014-03-05-T-004-S-00083,2014-03-05-T-004,83,Ang Wei Neng,"(In Mandarin)  [Please refer to  Vernacular Speech on Pg xxxx.] This year's Budget, especially the Pioneer Generation Package (PGP), was applauded by all the Members who have spoken. In my view, there are three main reasons why this unprecedented PGP received such strong support. Firstly, the $9 billion package could be funded totally by the 2014 Budget without burdening our future generations. Secondly, the Package is able to cover a major part of the Pioneer Generation's medical expenses for their entire life span, which is a big relief to them. Thirdly, the inclusiveness of the Package is a surprise to many. The Package covers the Pioneer Generation, regardless of whether you are a millionaire or a pauper."
2014-03-05-T-004-S-00084,2014-03-05-T-004,84,Ang Wei Neng,"Soon after the announcement of the Package, a few Members and many Singaporeans started to ask, ""Can we have other packages similar to the Pioneer Generation Package?"" The second generation of pioneers may say, ""While it is difficult to start a business, it is harder to keep it going; therefore, we also deserve a package for the generation who keep things going"". In the end, how many packages can we afford?"
2014-03-05-T-004-S-00085,2014-03-05-T-004,85,Ang Wei Neng,"There is a need to manage people's expectations after we implement the PGP. Otherwise, we will fall into the same trap as Greece and Italy where the governments are having deep financial troubles. So, how do we manage the people's expectations? I want to lay out three principles as a basis for further consideration."
2014-03-05-T-004-S-00086,2014-03-05-T-004,86,Ang Wei Neng,"Firstly, we need to be prudent and use our Budget surplus to pay for any new packages, similar to the PGP. We should not spend the money of our future generations. In this way, Singaporeans can better appreciate the importance of economic growth and see the need to transform our economy so that we can enjoy sustainable growth."
