speech_id,topic_id,speech_order,member_name,text
2014-03-05-T-007-S-00439,2014-03-05-T-007,439,Grace Fu Hai Yien,"We have been taking steps to address these challenges. We remain committed to having Singaporeans as the core of our workforce. We will continue to support local enterprises and ensure that Singaporeans are considered fairly for jobs. We are working with employers to provide opportunities for Singaporeans to upgrade, and to create inclusive and progressive work environments through measures, such as WorkPro. The Fair Consideration Framework introduced recently will also help ensure that Singaporeans are considered fairly for jobs. We have made the commitment to keep the ethnic proportion within our citizen population stable. So, in reply to Mr Manap, in 2030, the Malay citizen proportion will remain similar to what we are having now."
2014-03-05-T-007-S-00440,2014-03-05-T-007,440,Grace Fu Hai Yien,"The National Integration Council has worked with partners in our schools, workplaces and the community to promote greater mutual understanding and respect among our people. We have reached out to improve the quality of interactions between Singaporeans, new immigrants and foreigners. The Council also supports ground-up initiatives from community, civic groups and individuals, leveraging on a wide variety of platforms, including sports and the arts."
2014-03-05-T-007-S-00441,2014-03-05-T-007,441,Grace Fu Hai Yien,"A silver lining from the Little India riot is that we have employers who are now more focused on integrating or introducing workers to the practices and social norms in Singapore. I have a resident who is a Project Manager at a construction site and he tells me that now, every day, besides safety briefings, he will also spend some time to advise his workers to observe social norms, such as not littering, spitting and loitering at void decks. I think that examples like these show that our employers are also doing their part, and we encourage more of them to pay attention on integration initiatives."
2014-03-05-T-007-S-00442,2014-03-05-T-007,442,Grace Fu Hai Yien,"In debating the Population White Paper here in Parliament last year, the Government committed to ensuring that the benefits of our policies flow to Singaporeans. We have seen Singaporean wages grow as job opportunities are created, and also improvements in the way we support and care for our people, including in important areas, such as healthcare and education, as well as increased support for low- and middle-income households."
2014-03-05-T-007-S-00443,2014-03-05-T-007,443,Grace Fu Hai Yien,"We also committed to resolving the current infrastructure strains, and planning and investing in infrastructure ahead of demand. We have coordinated efforts to build new infrastructure at a faster pace, and are on track to provide more accessible public facilities, green spaces and higher transport connectivity. Mr Inderjit Singh asked what has changed in terms of the way we plan. I think in terms of our long-term planning, such as the URA Master Plan, the planning process remains the same. But I would say that our population growth is now being watched closely and regularly at a very senior level, to make sure that we keep within the planning parameters. So, that is the assurance that we would like to give to Members of this House, that we are looking at how to moderate the growth of our population and we are taking concrete steps in that direction."
2014-03-05-T-007-S-00444,2014-03-05-T-007,444,Grace Fu Hai Yien,"This transformational journey will take time and is not without its challenges. As the pace of population growth slows, we must strike a delicate balance between concerns over the inflow of foreigners, and Singaporeans' social, economic and infrastructure needs. We have and will continue to plan ahead to balance the trade-offs. This is a journey we can all work together to achieve, to build a shared future and a place we can proudly call home."
2014-03-05-T-007-S-00445,2014-03-05-T-007,445,Lina Chiam,"Madam, there is a trend of banks refocusing their traditional deposit business as insurance businesses. Two of our local banks own huge insurance businesses, which they cross-sell at times. In some cases, the business model involves turning cash deposits into insurance-related plans. This means more fees and commissions for the financial institution."
2014-03-05-T-007-S-00446,2014-03-05-T-007,446,Lina Chiam,A traditional fund or account pays interest. An alternative policy can pay cash-back. The difference is significant. Are advisers equipped to share the differences? A plan can be exposed to investment risks. A savings account is mainly exposed to the bank's credit risk.
2014-03-05-T-007-S-00447,2014-03-05-T-007,447,Lina Chiam,A second trend we observed is that bank counter staff who might not be qualified financial advisers are in charge of sales KPIs.
2014-03-05-T-007-S-00448,2014-03-05-T-007,448,Lina Chiam,We urge MAS to study these trends and increase regulatory oversight to combat future weaknesses in financial advisory standards.
2014-03-05-T-007-S-00449,2014-03-05-T-007,449,Foo Mee Har,"Madam, MAS reported that the average outstanding unsecured debt owed by individuals seeking credit counselling has increased, and the number of individual bankruptcy orders made has also been trending up. So far, the Government has relied on regulations, such as the capping of unsecured borrowings by any individual at four times or four months' income per lender, to safeguard over borrowing."
2014-03-05-T-007-S-00450,2014-03-05-T-007,450,Foo Mee Har,"However, an individual could still chalk up insurmountable debts by borrowing from multiple banks, each at this capped limit. A typical individual with four credit cards, two personal loans from multiple banks could potentially chalk up borrowings of up to 24 months' of his or her income. ""Hard core revolvers"" commonly borrow from one lender to pay another, constantly revolving just to keep afloat."
2014-03-05-T-007-S-00451,2014-03-05-T-007,451,Foo Mee Har,"The MAS has announced that, effective June 2015, it will impose a borrowing limit of 12 months' income for an individual's aggregated unsecured debt, across banks. It is a significant and welcome step to help individuals manage their total indebtedness."
2014-03-05-T-007-S-00452,2014-03-05-T-007,452,Foo Mee Har,"However, I would like to ask the Minister how many people have already chalked up debts exceeding the 12 months' income limit. I am concerned about the fate of these individuals when, come June 2015, the banks are given access to data about their total outstanding loans, for the first time. And if all the banks decide to act suddenly and simultaneously take action on credit lines ahead of the June 2015 deadline, it may lead to a devastating credit crunch and a wave of bankruptcies, with heartbreaking consequences for the families of many borrowers."
2014-03-05-T-007-S-00453,2014-03-05-T-007,453,Foo Mee Har,"So, I urge the Government to set up an industry taskforce to oversee and coordinate actions across banks to prevent a hard landing. To help those who have already chalked up debts well beyond their 12 months' income limit, MAS should consider setting up an Inter Bank Debt Relief Programme to restructure loans, help individuals bring down their debts over time, and to give them an opportunity to ""reset"" their lives. Credit Counselling Singapore can play a key role to help heavily-indebted individuals recover from serious debt problems by providing credit management information, credit counselling and, where applicable, put up a debt repayment plan."
2014-03-05-T-007-S-00454,2014-03-05-T-007,454,Foo Mee Har,"Madam, some individuals who are unable to borrow from banks after reaching their aggregated debt limit at 12 months' income limit, will now consider borrowing from moneylenders, where the aggregated debt limit will not apply. Moneylenders typically charge higher rates and tougher terms. The banking and moneylending sectors currently operate under separate frameworks. So, I urge the Government to consider prescribing one aggregated total borrowing limit that will apply to lending in both sectors."
2014-03-05-T-007-S-00455,2014-03-05-T-007,455,Foo Mee Har,"A centralised credit bureau which captures all borrowings from banks and moneylenders, should be set up to enable lenders to make complete assessments of an individual's borrowing capacity, a practice already in place in Hong Kong."
2014-03-05-T-007-S-00456,2014-03-05-T-007,456,Foo Mee Har,"We should consider instituting a set of Responsible Financing guidelines which lenders must use to help educate borrowers. They should be obliged to advise individuals on the full implication of their borrowing decisions, when the borrower is being marketed to, and when the loan contract is being signed."
2014-03-05-T-007-S-00457,2014-03-05-T-007,457,Foo Mee Har,"Madam, ultimately, the individual must take personal responsibility for their own finances. I hope the Government will step up the provision of financial education to help individuals understand how to use credit responsibly."
2014-03-05-T-007-S-00458,2014-03-05-T-007,458,Tan Su Shan,"Madam, allow me to declare my pecuniary interest as a banker. The Government's finances are in good shape and I hope they remain in good shape even as and when revenue falls short of expenditure. The debt at the household level though remains high. As Ms Foo Mee Har said, household debt remains high. And Forbes magazine carried an article accusing us of having an unsustainably high household debt level. This is due to high home ownership for Singaporeans, especially in HDB homes."
2014-03-05-T-007-S-00459,2014-03-05-T-007,459,Tan Su Shan,"Whilst it is true that household debt has increased, and it is now 77% of GDP, the good thing is household net worth and household savings have been rising, too. MAS has had to rely on macro-prudential policies, like the TDSR and ABSD, to control loan growth and this serves as a form of tightening. But the question I want to ask is  are our monetary policy and low interest rates responsible? After all, our interest rates followed that of western economies where unemployment is high and they have loose monetary policies."
2014-03-05-T-007-S-00460,2014-03-05-T-007,460,Tan Su Shan,"Yet, we live in Asia where central banks are tightening and liquidity is being drained. China is particularly relevant, especially now, with their increased financial deregulation and a more open financial market. China has recently changed their foreign exchange (FX) forward slope as well. So, China is a mega economy that has tightened monetary policy and increased cross-border trade settlement funded through Asia."
2014-03-05-T-007-S-00461,2014-03-05-T-007,461,Tan Su Shan,"Singapore, as a leading financial centre, plays a key role in such flows. And these flows are here to stay. Capital flows to such size exerts strong pressure on liquidity and interest rates. This collision of low interest rate policy in the West and higher ones in the East are at our doorstep. Is it time to relook at our policy of controlling FX instead of interest rates?"
2014-03-05-T-007-S-00462,2014-03-05-T-007,462,Tan Su Shan,"In the past, many economists have said that due to the openness of our economy, using FX as a lever is more potent than using interest rates."
2014-03-05-T-007-S-00463,2014-03-05-T-007,463,Tan Su Shan,But what if rates remain low? Rates in the West may remain low for a while longer. Bain and Co published a piece of research saying that the world has too much money and rates will remain low till 2020. There are 10 times more capital than GDP in the world today. That is $600 trillion versus $63 trillion in global GDP. That means a lot of capital chasing not a lot of growth.
2014-03-05-T-007-S-00464,2014-03-05-T-007,464,Tan Su Shan,"If low interest rates persist, we will have to rely on more ad hoc macro-prudential policies to rein in excess loan growth and, if we do, the risk is, money here may drain off to find better returns elsewhere."
2014-03-05-T-007-S-00465,2014-03-05-T-007,465,Tan Su Shan,"This trend may lead to the real cost of money rising, despite the low official interest rates. If a liquidity premium were to arise, then the real cost of borrowing for all will be affected. This makes doing business here unpredictable and costly. More importantly, it is the magnitude of interest rate changes that pose a greater risk. These elements are out of our control. For example, the Fed hiked interest rates by a massive 425 basis points in two years, between 2004 and 2006. Rapid increases in interest rates give little time to homeowners and businesses to adjust. The macro-prudential measures introduced may then become a double whammy for all."
2014-03-05-T-007-S-00466,2014-03-05-T-007,466,Tan Su Shan,"The issue at hand is that the withdrawal of liquidity and the concurrent higher costs of capital in Singapore will adversely affect important areas of the economy. The property market, stock market, auto dealership and domestic retail are amongst the most vulnerable. Hence, there is a need for heightened vigilance by the authorities to pre-empt the risks ahead and to ensure timely unwinding of these macro-prudential policies to address any downside risks. These adjustments will have to incorporate structural developments and also account for any adjustments to China's monetary policy stance so that we can set right macro-prudential policies for Singapore."
2014-03-05-T-007-S-00467,2014-03-05-T-007,467,Lawrence Wong,"Mdm Chair, let me first address the macro-issues that were just raised by Ms Tan Su Shan. I agree with her that there are strong external forces that can impact our economy and we have to stay very vigilant. Given the current uncertainties and volatile environment, it is very difficult to predict how the external environment will change. I think if you ask the economists what the future would be like, you will get different views. Ms Tan cited forecast from a Bain and Co report of a world flushed with money till 2020. But there are also many economists who predict that the days of low interest rates and cheap capital are over."
2014-03-05-T-007-S-00468,2014-03-05-T-007,468,Lawrence Wong,"Economists are well-known for their inability to agree on many things. But one thing that economists do agree upon is that in a world of open capital flows, a country can either choose to manage its exchange rate or interest rate but not both. In Singapore, because of our small and open economy, we have chosen to focus on the exchange rate as the monetary policy tool to keep inflation in check. And this exchange rate-centred framework has served Singapore very well over the three decades since we started."
2014-03-05-T-007-S-00469,2014-03-05-T-007,469,Lawrence Wong,"The consequence is that our domestic interest rates will move in tandem with global rates. And as Ms Tan has highlighted, such low interest rates are, indeed, one of the factors supporting the growth of domestic credit, including to the property sector."
2014-03-05-T-007-S-00470,2014-03-05-T-007,470,Lawrence Wong,"Given this environment, Ms Tan asked whether we ought to review and even change our monetary policy approach, to move away from our exchange rate-centred framework and switch to interest rates. In fact, this is something that MAS has studied very carefully. MAS regularly reviews its monetary policy approach, and it does not take the status quo, what it does today, as a given. And MAS' studies show that our current system has been effective and, more importantly, that a switch to a regime of managing interest rates can be highly destabilising. And there are several reasons for this."
2014-03-05-T-007-S-00471,2014-03-05-T-007,471,Lawrence Wong,"First, the exchange rate continues to play an important role in household and business decisions, as Singapore's high degree of openness has not diminished. In fact, the policy of keeping the Sing dollar on an appreciation path since April 2010 has dampened consumer inflation by an average of 2.3 percentage points per year over the past four years. Taking a specific example, the stronger Sing dollar has actually kept food inflation at an average of 2.3% over the same period, which is significantly lower than the 5.2% in the ASEAN-4 and 3.7% in the NIE-3 economies. So, that is one reason."
2014-03-05-T-007-S-00472,2014-03-05-T-007,472,Lawrence Wong,"Second, given our open economy, setting domestic interest rates above global rates will attract even more capital inflows to Singapore, especially with our strong macro-economic fundamentals. This could inadvertently fuel asset price inflation. There are also potentially unpredictable costs associated with a shift in the monetary policy framework, which would affect the domestic financial system and the broader economy."
2014-03-05-T-007-S-00473,2014-03-05-T-007,473,Lawrence Wong,"What MAS has chosen to do is to rein in the demand for property and mitigate the risks posed by low interest rates through a series of macro-prudential measures, while keeping our exchange rate-centred monetary policy focused on anchoring inflation expectations."
2014-03-05-T-007-S-00474,2014-03-05-T-007,474,Lawrence Wong,"The effects of these measures have been encouraging. The property market is stabilising. Private residential property prices increased by just over 1% last year and, in fact, recorded a small sequential decline in the fourth quarter. There has been a clear moderation in transaction volumes. Mortgage loan growth slowed to 8.6% in January 2014, down from 16.2% a year earlier. On the whole, household balance sheets are sound, although some over-stretched households may come under pressure when interest rates rise. And that is a point that Ms Foo Mee Har highlighted, which is why besides property purchases, to encourage financial prudence, MAS has recently enhanced the rules for credit cards and unsecured credit, as Ms Foo also highlighted."
2014-03-05-T-007-S-00475,2014-03-05-T-007,475,Lawrence Wong,"In designing these rules, MAS has been very conscious of the need to facilitate orderly deleveraging so as not to cause a hard landing or credit crunch and drive borrowers to unlicensed sources of credit. This is why the aggregate limit on unsecured borrowing from financial institutions has been set at a fairly generous level of 12 months and it will take effect from June 2015. In fact, this rule was announced with an 18-month lead time. And all this should provide sufficient transition time and also flexibility for most borrowers."
2014-03-05-T-007-S-00476,2014-03-05-T-007,476,Lawrence Wong,"For those who have already exceeded the borrowing limit, Ms Foo was worried about a sudden credit crush in June next year. I would like to assure her that MAS has anticipated this and put in place measures to avoid such a situation. Over the last few years, from 2008 to 2012, there were about 6,000 individuals who were counselled by Credit Counselling Singapore who had debts exceeding their annual income. Such individuals will be given additional time – till 2019 – before the aggregate limit takes effect. Furthermore, they will not be forced to make immediate repayment of their existing loans, as the limit is designed to prevent accumulation of additional debt. I should also clarify that the lending limits do not extend to education and business loans, which are not consumption-based."
2014-03-05-T-007-S-00477,2014-03-05-T-007,477,Lawrence Wong,"I agree with Ms Foo that individuals may need help to restructure and bring their debts down over time. So, MAS has been working with industry partners, such as financial institutions, Credit Counselling Singapore, MoneySENSE and the credit bureaus, to facilitate this transition. MAS has also adjusted the relevant rules to facilitate the transfer of a borrower's debt from one financial institution to another to enable re-financing and re-structuring across financial institutions. And this was something that Ms Foo also suggested."
2014-03-05-T-007-S-00478,2014-03-05-T-007,478,Lawrence Wong,"To encourage responsible lending, the Association of Banks in Singapore has issued Codes of Practice relating to credit cards and unsecured lending on the relevant information that should be communicated to their customers. In addition, MoneySENSE will continue to step up its education efforts through a variety of media channels."
2014-03-05-T-007-S-00479,2014-03-05-T-007,479,Lawrence Wong,"Ms Foo also asked about borrowing from moneylenders and having a common centralised Credit Bureau. I agree with her that information on non-bank credit channels is useful in having a more complete assessment of an individual's borrowing capacity. This is why MAS has been working closely with MinLaw to align the rules governing the grant of credit by financial institutions as well as moneylenders. For example, for housing loans, the Total Debt Servicing Ratio (TDSR) framework already takes into account all credit facilities extended by both financial institutions as well as moneylenders. And going forward, MinLaw is looking to put in place a mechanism to limit the total amount that individuals can borrow across all moneylenders. MAS and MinLaw are also exploring how relevant data can be captured in the credit bureaus. The Government will study the data and monitor the effects of the recent measures to assess the need for further measures."
2014-03-05-T-007-S-00480,2014-03-05-T-007,480,Lawrence Wong,"Let me now turn to a point that Ms Lina Chiam highlighted on the role of financial advisers and the need for regulatory oversight. Financial advisers do play an important role in helping Singaporeans plan and meet their insurance and financial planning needs. The industry is regulated under the Financial Advisers Act and I would like to assure the Member that MAS does keep a close watch over the business conduct standards of financial advisory (FA) firms and their representatives, and that includes representatives in the banks."
2014-03-05-T-007-S-00481,2014-03-05-T-007,481,Lawrence Wong,MAS uses various tools to supervise the financial advisory industry. It carries out regular risk assessments of financial advisory firms. It conducts onsite inspections to assess the adequacy of their risk management systems and the level of compliance with regulatory standards and industry guidelines. It also commissions periodic mystery shopping exercises to assess the quality of advice and the adequacy of information disclosure provided by FA firms and their representatives.
2014-03-05-T-007-S-00482,2014-03-05-T-007,482,Lawrence Wong,"And where laws or regulations have been breached, MAS has taken appropriate disciplinary actions. These include issuing reprimands, imposing composition fines, and prohibiting persons who have committed serious offences from working in the industry for a specified period."
2014-03-05-T-007-S-00483,2014-03-05-T-007,483,Lawrence Wong,"In recent years, MAS has continued to strengthen regulatory requirements in the financial advisory industry to better safeguard the interests of consumers and this process will continue. Let me cite a few examples."
2014-03-05-T-007-S-00484,2014-03-05-T-007,484,Lawrence Wong,"Mdm Chair, let me wrap up by going back to the broader picture. Looking ahead, we are prepared for a scenario of higher global interest rates, which is a scenario that Ms Tan also highlighted. Should there be a tightening of monetary policies abroad, this will be commensurate with the restoration of a more ""normal"" state of the world economy. As global growth returns to trend and inflation pressures gradually pick up, interest rates abroad and in Singapore will eventually rise."
2014-03-05-T-007-S-00485,2014-03-05-T-007,485,Lawrence Wong,"And in some way, this is not necessarily a bad outcome for Singapore. What is critical is how the US Federal Reserve does its tapering of asset purchases. Last year, uncertainty over the timing and pace of tapering resulted in sharp corrections in financial markets. Since then, financial markets have been more discriminating and capital outflows have largely been from emerging economies with weak macroeconomic fundamentals."
2014-03-05-T-007-S-00486,2014-03-05-T-007,486,Lawrence Wong,"Nevertheless, we must be prepared for further bouts of financial market volatility and capital outflows from emerging economies. I would like to assure Members that MAS and the relevant Government agencies are closely monitoring the impact of changes in global monetary conditions on the Singapore economy and property market. Overall, Singapore is well-placed to weather external shocks. Our fundamentals remain sound  a balance of payments surplus, sound public finances, stable banking sector and a credible exchange rate system. These are advantages most countries do not have. As our underlying economic and financial conditions evolve, external situation evolves, the Government will continue to adjust its policy measures as necessary to ensure overall macroeconomic and financial stability."
2014-03-05-T-007-S-00487,2014-03-05-T-007,487,,We have a bit of time for clarifications. Does anyone wish to ask any question? Ms Foo.
2014-03-05-T-007-S-00488,2014-03-05-T-007,488,Foo Mee Har,"I had asked during my speech whether the Minister could share with us the number of people, the percentage of people whom the Government has estimated, who have debts exceeding the 12-month income limit. Would the Minister share that number, if that is available, so that we have a sense of how big is that population, that has already gone over the limit?"
