speech_id,topic_id,speech_order,member_name,text
2014-11-03-T-001-S-00001,2014-11-03-T-001,1,Lily Neo,"asked the Minister for Health with more Ebola cases spreading and the first case of human-to-human transmission of the Ebola virus outside of Africa, whether the Ministry has further plans to step up efforts to counter and contain any spread of the virus within the country."
2014-11-03-T-001-S-00002,2014-11-03-T-001,2,Chia Shi-Lu,"asked the Minister for Health in view of the worsening Ebola outbreak in West Africa and its spread to other countries, whether the Ministry will consider imposing a travel ban on the affected nations in Africa until the epidemic is brought under better control."
2014-11-03-T-001-S-00003,2014-11-03-T-001,3,Gerald Giam Yean Song,"asked the Minister for Health (a) whether the current Ebola screening measures at Changi Airport are effective in detecting the virus given that its symptoms may appear up to 21 days after exposure to Ebola and that it is difficult to verify travellers' self-declarations of their exposure to Ebola; (b) whether there are plans to use rapid diagnostic test kits to diagnose Ebola; and (c) what lessons have been learnt from the cases of Ebola transmission in Texas, US and Spain to prevent the same mistakes from occurring in Singapore should an Ebola-infected traveller get through our border checkpoints."
2014-11-03-T-001-S-00004,2014-11-03-T-001,4,Gerald Giam Yean Song,asked the Minister for Health (a) what is the quantum and nature of assistance that Singapore has provided to countries in West and Central Africa to combat the spread of Ebola and treat patients infected with the virus; and (b) what further assistance Singapore plans to provide to the affected countries should the Ebola situation worsen.
2014-11-03-T-001-S-00005,2014-11-03-T-001,5,Lam Pin Min,"Mdm Speaker, may I have your permission to take Question Nos 1 to 4 together?"
2014-11-03-T-001-S-00006,2014-11-03-T-001,6,Speaker,"Yes, please."
2014-11-03-T-001-S-00007,2014-11-03-T-001,7,Lam Pin Min,"As of 31 October 2014, the World Health Organization (WHO) reported a total of 13,567 cases of Ebola, including 4,951 deaths. There continues to be widespread and intense transmission of Ebola in Guinea, Liberia and Sierra Leone. Nigeria, Senegal, Spain, the US and Mali have reported imported cases, some with limited transmission. WHO has since declared Nigeria and Senegal to be free of Ebola. In addition, a separate Ebola outbreak is ongoing in the remote areas of the Democratic Republic of the Congo (DRC) involving 66 cases and 49 deaths. No new cases of Ebola have been reported in DRC since 4 October. WHO has stated that DRC will be declared free of Ebola on 21 November, if there are no further cases."
2014-11-03-T-001-S-00008,2014-11-03-T-001,8,Lam Pin Min,"Since 7 August 2014, MOH has instituted several border control measures. Travellers are provided with a Health Advisory on Ebola through the deployment of Health Advisory Posters and the distribution of Health Advisory Notices (HANs) to nationals from Ebola-affected African countries at all air, land and sea checkpoints, as well as other travellers who self-declare their history of travel to Ebola-affected countries. The Advisory tells them about Ebola symptoms and advises them to seek medical attention immediately and inform the medical staff of their travel history if they develop such symptoms."
2014-11-03-T-001-S-00009,2014-11-03-T-001,9,Lam Pin Min,"MOH has stepped up screening measures against Ebola at our checkpoints. Nationals and travellers from countries with significant or potentially significant Ebola transmission – currently seen in Guinea, Liberia, Sierra Leone, DRC and Mali – arriving at our air checkpoints will be directed to a screening station where they will be screened for fever, requested to complete a Health Declaration Card which will include their contact details in Singapore and assessed for the risk of exposure to Ebola through a questionnaire."
2014-11-03-T-001-S-00010,2014-11-03-T-001,10,Lam Pin Min,"Travellers who are found to have a fever will be sent to Tan Tock Seng Hospital (TTSH) for further assessment and testing. Those who are well but assessed to have a risk of exposure to Ebola will be kept under phone surveillance or quarantined for up to 21 days, depending on the nature of their potential exposure. Screening of travellers from countries with significant Ebola transmission is also conducted at land and sea checkpoints using Health Declaration Cards and questionnaire assessment."
2014-11-03-T-001-S-00011,2014-11-03-T-001,11,Lam Pin Min,"The border health measures are part of a multi-layer defence against Ebola. While they alone will not be able to identify persons who are still in the incubation period and are not symptomatic or are not truthful in answering the screening questionnaire, they complement our overall efforts in looking out for travellers who may have Ebola infection."
2014-11-03-T-001-S-00012,2014-11-03-T-001,12,Lam Pin Min,"MOH is concerned by the widespread and intense community transmission of Ebola in West Africa. As such, MOH is working with MFA, MHA, the Immigration & Checkpoints Authority (ICA) and the Civil Aviation Authority of Singapore (CAAS) to impose temporary visa requirements for nationals from Guinea, Liberia and Sierra Leone for entry into Singapore, starting from 5 November. This move will allow for better oversight and control of entry of nationals from these countries and facilitate possible contact tracing. MOH will continue to monitor the Ebola situation closely and calibrate our preparedness measures."
2014-11-03-T-001-S-00013,2014-11-03-T-001,13,Lam Pin Min,"To keep our healthcare institutions in a high state of vigilance, we have given regular updates to all hospitals, polyclinics and primary care doctors on the Ebola situation. We have also provided them with guidance and protocols on the criteria for identifying suspected Ebola cases, how to refer such cases for further assessment and the subsequent management of suspected and confirmed cases of Ebola. MOH has also conducted preparedness exercises and visited our public hospitals to ensure that they are well-prepared and adequately resourced to manage cases of Ebola."
2014-11-03-T-001-S-00014,2014-11-03-T-001,14,Lam Pin Min,"Suspected and confirmed cases of Ebola will be centrally managed in TTSH, which has been designated as the national disease outbreak centre. Meanwhile, Ebola virus testing will be centrally conducted by the National Public Health Laboratory's designated testing facilities at Defence Science Organisation (DSO) National Laboratories."
2014-11-03-T-001-S-00015,2014-11-03-T-001,15,Lam Pin Min,"Currently, testing for the Ebola virus is done using the polymerase chain reaction (PCR) method. This is the most sensitive method and the mainstay of diagnosis in all reference laboratories. Rapid diagnostic test kits to diagnose Ebola are being developed and tested but none has yet been approved for use. MOH will evaluate the performance of such rapid kits to determine their suitability for use in our environment when they become available."
2014-11-03-T-001-S-00016,2014-11-03-T-001,16,Lam Pin Min,"The standard treatment for Ebola is supportive therapy. While there are experimental treatments and vaccines being developed and tested, none has been proven to be clinically safe or effective. MOH will continue to monitor developments in these areas."
2014-11-03-T-001-S-00017,2014-11-03-T-001,17,Lam Pin Min,"Of the five Ebola cases that were diagnosed in Spain and the US, three involved healthcare workers who had provided care to patients who were infected with Ebola in West Africa. Investigations of these cases suggested possible breaches in infection control measures, such as improper removal of Personal Protective Equipment (PPE)."
2014-11-03-T-001-S-00018,2014-11-03-T-001,18,Lam Pin Min,"Although our hospitals and healthcare workers have been trained on the proper use of PPE, we have not been complacent. Our hospitals have been reminded on the need for strict infection control measures and adherence to stringent protocols when managing suspected and confirmed cases of Ebola. Even with proper equipment, protocols and training, human error can occur, as was observed in the cases of secondary transmission in Spain and the US. MOH will continue to work with the National Infection Prevention and Control Committee (NIPC) and other experts to review our guidelines and protocols to ensure a high degree of competency and preparedness in our hospitals."
2014-11-03-T-001-S-00019,2014-11-03-T-001,19,Lam Pin Min,"In response to appeals for aid, Singapore has contributed an aid package consisting of medicines, medical supplies and personal protective equipment to WHO. In addition, Singapore also contributed US$150,000 in cash to the WHO to support the WHO Ebola Response Roadmap. Singapore will continue to work with WHO on how to further assist in the global effort against the Ebola outbreak in Africa based on our capability and available resources, including the possibility of seconding one of our experts to assist WHO Headquarters in Geneva in their relief effort."
2014-11-03-T-001-S-00020,2014-11-03-T-001,20,Lily Neo,"Mdm Speaker, three supplementary questions, please. May I ask the Minister of State whether MOH can step up information dissemination on the Ebola virus, especially on its epidemiology scientific data which had been available for almost four decades? Does the Minister of State agree that the better informed the healthcare workers and the population are, the better will be the success on the control of the Ebola virus, especially on awareness and prevention and early detection treatment? Therefore, will the Minister of State adopt and promote actively on the policy of choosing facts over fear for everyone? May I also ask the Minister of State how adequate is our protocol to vigorously train healthcare workers to handle Ebola patients and, lastly, what are the contingency plans for contact-tracing and the control of the spread of the Ebola virus here?"
2014-11-03-T-001-S-00021,2014-11-03-T-001,21,Lam Pin Min,I would like to thank the Member for the many supplementary questions.
2014-11-03-T-001-S-00022,2014-11-03-T-001,22,Lam Pin Min,"First, I would like to reassure the Member as well as Members of the House that MOH takes the training of our healthcare workers in the handling of Ebola very seriously. We have done regular audits and checks on the training as well as the preparedness of our healthcare workers, especially those in the frontline, for example, in the Emergency Department. We make sure they adopt and practise the right protocols and procedures that have been stipulated by the National Infection Prevention and Control Committee."
2014-11-03-T-001-S-00023,2014-11-03-T-001,23,Lam Pin Min,"At the same time, we do send circulars to all our healthcare professionals, including private general practitioners, to update them on the situation of Ebola in affected countries, as well as the measures that we are taking in Singapore. In that aspect, I would like to re-assure the Member that we are doing all we can to prevent a possible imported case to Singapore."
2014-11-03-T-001-S-00024,2014-11-03-T-001,24,Lam Pin Min,"Nonetheless, we understand that it is impossible to prevent subsequent cases that may appear on our doorstep. The important thing is that we have to be well-prepared for that eventuality."
2014-11-03-T-001-S-00025,2014-11-03-T-001,25,Lam Pin Min,"With regard to the possibility of fear-mongering among the people, it is important that MOH continue to update the public on the epidemiology, the situation in West Africa and also to educate people that Ebola, although it is a fatal disease, is not easily spread from one person to another person because of the way that the disease is. It is spread through close contact with people who are infected with the disease and it is not through the respiratory route."
2014-11-03-T-001-S-00026,2014-11-03-T-001,26,Lam Pin Min,"I thank the Member for those supplementary questions. We will continue to monitor the situation very closely and to step up our preparedness as well as necessary measures, as and when necessary."
2014-11-03-T-001-S-00027,2014-11-03-T-001,27,Chia Shi-Lu,"Mdm Speaker, I would like to thank the Minister of State for his reply. I am sure the Minister of State would agree that the greatest threat to us now would be the import of an Ebola case. I am heartened by the announcement that there are some new visa requirements. Two supplementary questions from me."
2014-11-03-T-001-S-00028,2014-11-03-T-001,28,Chia Shi-Lu,"First, with regard to the just-announced visa requirements, I know it is a bit early, but I would like the Minister of State to comment on what he feels is the efficacy of such a move and whether a more comprehensive travel ban might be a better move. Maybe a total travel ban from the affected countries, at least until the so-called backbone of the epidemic has been broken."
2014-11-03-T-001-S-00029,2014-11-03-T-001,29,Chia Shi-Lu,My second supplementary question refers to whether or not there is any consideration for a travel ban for Singaporean nationals travelling to affected countries for non-essential reasons.
2014-11-03-T-001-S-00030,2014-11-03-T-001,30,Lam Pin Min,"I would like to thank Dr Chia for the supplementary questions. That is a very relevant question, with regard to the imposition of a travel ban. I would like to highlight to Members of the House that the decision to impose travel restrictions cannot be taken lightly. It is based on certain principles  (a) the extent of the epidemic in the affected countries, that is, whether there has been widespread and intense community transmission as seen in the three West African countries; (b) the state of the healthcare and public health infrastructure in those affected countries; (c) the ability of the affected country to contain further spread; and last but not least (d) the recommendations from the World Health Organization, as well as expert inputs from our local agencies, including the National Infection Prevention and Control Committee."
2014-11-03-T-001-S-00031,2014-11-03-T-001,31,Lam Pin Min,"Imposing a visa requirement, which we are doing from 5 November, will allow us to have better oversight of these travellers entering Singapore. We will be able to collect information, such as local contact details, local sponsor as well as their exact dates of travel, and this will facilitate the process of contact tracing, should the need later arise."
2014-11-03-T-001-S-00032,2014-11-03-T-001,32,Lam Pin Min,"In addition, it will also allow Singapore to inform the applicants at the point of visa issuance about our Ebola health advisory and the actions that they should take should they develop symptoms while enroute to and during their stay in Singapore. So, currently, we will not be imposing any travel ban on the affected countries in West Africa and this is also in line with WHO’s recommendation that there should not be any travel ban imposed on these countries. However, I understand that the situation is very dynamic and we will continue to review our measures as the Ebola situation evolves."
2014-11-03-T-001-S-00033,2014-11-03-T-001,33,Gerald Giam Yean Song,"Thank you, Madam. One area of risk is the transmission that could take place onboard the planes that are bound for Singapore. My question is  do the authorities work with airports and public health authorities in other countries to ensure that passengers who board Singapore-bound planes are screened for infectious diseases, including Ebola?"
2014-11-03-T-001-S-00034,2014-11-03-T-001,34,Gerald Giam Yean Song,"I understand that the US Department of Transportation has a rule which permits airlines to deny boarding to air travellers with contagious diseases, and this rule also applies to flights by foreign airlines into the US. Does Singapore have such a regulation? At the minimum, does Singapore Airlines screen its passengers before its flights to Singapore?"
2014-11-03-T-001-S-00035,2014-11-03-T-001,35,Lam Pin Min,"I would like to thank the Member for the supplementary questions. From what I understand, we do share information with other civil aviation authorities from the different countries on some of the protocols and measures they have taken. In fact, even in the affected countries in West Africa, they do have exit screening of travellers out of the country to make sure that they are asymptomatic before they are allowed to board the plane."
2014-11-03-T-001-S-00036,2014-11-03-T-001,36,Lam Pin Min,"What is important is that Singapore has actually taken a more discriminate, stratified kind of approach to monitor the health of arrivals from affected West African countries. We divide them into both symptomatic as well as asymptomatic travellers. If they are found to be symptomatic when they arrive in Singapore, then they will be managed accordingly by being brought to TTSH for further assessment. But if they are asymptomatic, then we will have to probe further with regard to the risk of exposure."
2014-11-03-T-001-S-00037,2014-11-03-T-001,37,Lam Pin Min,"If they have high-risk exposure, meaning they have been managing patients who are affected by the Ebola virus without any personal protection, then they will be put on very close surveillance, either being quarantined in Government quarantine facilities or even in home quarantine. But if the exposure is assessed to be low-risk, then we will put them on phone surveillance for 21 days to make sure that they are asymptomatic during this period before they are allowed to continue with their unrestricted activities."
2014-11-03-T-002-S-00038,2014-11-03-T-002,38,Alex Yam,asked 	 the Minister for Defence (a) whether the SAF will consider joining the broad coalition currently combating ISIS in Syria and Iraq; and (b) in what ways will the SAF contribute towards this effort.
2014-11-03-T-002-S-00039,2014-11-03-T-002,39,Ng Eng Hen,"Madam, the threat of jihadist terrorism is transnational. It extends across continents and beyond the confines of territorial borders. Singapore, as an international hub, is particularly exposed to this threat. Members of the public are well aware that in 2001, the Internal Security Department (ISD) disrupted a terrorist plot by Al-Qaeda (AQ) to mount suicide bombings in Singapore. This was with the help of the Jemaah Islamiyah (JI) terrorist network. This clearly showed that terrorist groups that are based in countries far away can pose a direct security threat to Singapore here."
2014-11-03-T-002-S-00040,2014-11-03-T-002,40,Ng Eng Hen,"In the last decade, Singapore responded to the terrorist threat from AQ and JI by dealing with it squarely, explaining to all Singaporeans what is at stake. We strengthened our social, psychological and physical defences at home and joined other countries to deal with forces in Iraq and Afghanistan which were the sources of radicalisation and terror. As a result, both AQ and JI are weaker today. However, this terrorism threat is a long-term one and new groups like the Islamic State in Iraq and Syria (ISIS) will emerge, even as existing ones falter. When they do, we must not lose focus or heart. In dealing with the threat from ISIS, we must continue with the approach that has served Singapore well and protected us thus far."
2014-11-03-T-002-S-00041,2014-11-03-T-002,41,Ng Eng Hen,"Like AQ and JI, ISIS is a terrorist organisation that poses a direct security threat to Singapore, our region and the rest of the world. ISIS was, in fact, AQ in Iraq before it splintered to become an independent organisation. Deputy Prime Minister Teo has provided extensive details of the threat from ISIS in his replies to Members' questions in this House in July and October. I do not intend to repeat his points but, with the Speaker's permission, will circulate relevant portions of his previous replies for Members' reference."
2014-11-03-T-002-S-00042,2014-11-03-T-002,42,Speaker,"Yes, please. ["
2014-11-03-T-002-S-00043,2014-11-03-T-002,43,Ng Eng Hen,"Approximately 350 Southeast Asians, including from Indonesia, Malaysia and Singapore, are reportedly in Iraq and Syria – 350 Southeast Asians. Many of them have joined ISIS and may return to threaten our security here, as the Commander of the Indonesian National Armed Forces warned recently."
2014-11-03-T-002-S-00044,2014-11-03-T-002,44,Ng Eng Hen,"The threats to our region are, indeed, real. Some Malaysians and Indonesians are fighting for ISIS and have formed a militant group called Majmu'ah Al Arkhabily or ""Group from the Archipelago"" from the Islamic State in Iraq and Syria, in other words, an archipelagic group here. This group adds to the threat from existing terrorist networks, such as JI."
2014-11-03-T-002-S-00045,2014-11-03-T-002,45,Ng Eng Hen,"Leaders of organised militant groups in this region, such as Abu Bakar Bashir in Indonesia, have also pledged allegiance to ISIS and declared their similar intent to establish an Islamic State in Southeast Asia. In Malaysia, the authorities arrested militants in April this year and these militants were inspired by ISIS and had planned to attack pubs, a disco and a brewery in Malaysia."
2014-11-03-T-002-S-00046,2014-11-03-T-002,46,Ng Eng Hen,"ISIS, AQ, JI and their supporters target Singapore, Indonesia and Malaysia because they have three goals in common. First, the political aim to overthrow legitimate governments and establish an Islamic caliphate through violence and brutality, including against innocent civilians. Second, using twisted religious beliefs to mislead and radicalise followers to commit atrocities, even suicide attacks, for their political goals. And, lastly, ISIS, like AQ, has ambitions to extend and entrench its terror network beyond its region."
2014-11-03-T-002-S-00047,2014-11-03-T-002,47,Ng Eng Hen,"For ISIS, two additional factors are of concern. ISIS can potentially sustain its efforts for a protracted period from the rich oil resources in occupied territories. ISIS has also embarked on an effective recruitment strategy, including the sophisticated use of the Internet and social media, to attract jihadists from around the world to join its efforts and to extend its linkages to other religious militant groups. An estimated 10,000 to 20,000 foreigners have been reported to be in Iraq and Syria."
2014-11-03-T-002-S-00048,2014-11-03-T-002,48,Ng Eng Hen,"As we did before against AQ and JI, Singapore must resolutely oppose the spread of terrorism in order to safeguard our security here. It is in Singapore’s interest to support the multinational efforts against ISIS. ISIS exports terrorism to our region, whether by sending foreign terrorists to carry out terrorist operations or by radicalising regional elements who engage in violence in Iraq, Syria and, subsequently, their home countries. If this terrorism threat is allowed to grow and spread, innocent civilians here and elsewhere could be endangered and killed. By contributing to the international effort to tackle the threat at source, we are contributing directly to our own security."
2014-11-03-T-002-S-00049,2014-11-03-T-002,49,Ng Eng Hen,"This is why Singapore took a clear public stand against ISIS at the 10th Asia-Europe Meeting in October this year and at the UN General Assembly in September 2014 respectively. The Prime Minister and the Minister for Foreign Affairs have said that Singapore strongly condemns ISIS’ terrorist actions and welcomes the formation of a broad multinational coalition to combat the threat from ISIS. Singapore has supported UN Security Council Resolution 2170, which condemns, in the strongest terms, the terrorist acts and violent ideologies of extremist groups and urges UN member states to combat terrorism. Singapore also co-sponsored UN Security Council Resolution 2178, which went one step further by requiring all nations to make it a serious, prosecutable crime for their nationals to join extremist groups, such as ISIS. Singapore has undertaken counter-terrorism cooperation with international partners to prevent the movement of known foreign terrorist fighters and to stem the flow of financing to ISIS."
2014-11-03-T-002-S-00050,2014-11-03-T-002,50,Ng Eng Hen,"This is also why the Singapore Armed Forces (SAF) has participated in multinational coalition efforts against religious extremists who pose a terrorist threat to Singapore and Singaporeans. We did it in Afghanistan against AQ and the Taliban. The SAF will continue to participate in such efforts to stop the radicalising influence of terror groups that can harm our citizens here. Thus, the SAF will contribute assets and personnel to Operation Inherent Resolve, the US-led multinational coalition to combat ISIS. We will join 33 other countries, including Saudi Arabia, the UAE, Bahrain, Qatar, Jordan, Japan, South Korea, Great Britain, France and Canada, that have provided military support or humanitarian aid to the coalition."
2014-11-03-T-002-S-00051,2014-11-03-T-002,51,Ng Eng Hen,"The SAF will offer contributions within our means that are sustainable and useful to the efforts to combat ISIS. These will include SAF liaison and planning officers to the US Central Command and the Combined Joint Task Force HQ, a KC-135R tanker aircraft for air-to-air refuelling and an Imagery Analysis Team. These assets proved effective in our previous contributions and were appreciated by our international partners there. However, for the efforts against ISIS, there will be no combat troops on the ground in Iraq and Syria. Instead, SAF soldiers will operate from surrounding countries, together with other coalition forces."
