speech_id,topic_id,speech_order,member_name,text
2014-03-05-T-008-S-00659,2014-03-05-T-008,659,Lim Biow Chuan,"I thank the Minister for the clarification. I just wanted to share with the Minister that I understand perfectly where he is coming from. But I think the dilemma that the Government has is that the man in the street feels that we are in the business of licensing illegal moneylenders and, therefore, it is a concern for all of us. So, I feel that it is my duty as a parliamentarian to raise this to the Minister's attention."
2014-03-05-T-008-S-00660,2014-03-05-T-008,660,,"Mr Hri Kumar, do you wish to withdraw your amendment?"
2014-03-05-T-008-S-00661,2014-03-05-T-008,661,Hri Kumar Nair,"Madam, despite the fact that the Minister has pushed my questions to some other Ministries, I would like to thank the Minister and Senior Minister of State for answering the questions and with substantial interests. With that, I beg leave to withdraw my amendment."
2014-03-05-T-008-S-00662,2014-03-05-T-008,662,Hri Kumar Nair,"[(proc text) Amendment, by leave, withdrawn. (proc text)]"
2014-03-05-T-008-S-00663,2014-03-05-T-008,663,Hri Kumar Nair,"[(proc text) The sum of $253,196,400 for Head R ordered to stand part of the Main Estimates. (proc text)]"
2014-03-05-T-008-S-00664,2014-03-05-T-008,664,Hri Kumar Nair,"[(proc text) The sum of $572,831,100 for Head R ordered to stand part of the Development Estimates. (proc text)]"
2014-03-05-T-009-S-00665,2014-03-05-T-009,665,Lim Wee Kiak,"Mdm Chair, I beg to move, ""That the total sum to be allocated for Head N of the Estimates be reduced by $100""."
2014-03-05-T-009-S-00666,2014-03-05-T-009,666,Lim Wee Kiak,"The global and regional geopolitical situation is rapidly changing with increasing emphasis and shift to the fast growing and rising economies of Asia. As the global trade winds shift, small open economy nations like Singapore will bear the brunt of these shifting forces."
2014-03-05-T-009-S-00667,2014-03-05-T-009,667,Lim Wee Kiak,"Political think-tanks have described the Sino-American relationship as the most important and the most influential in determining and maintaining global peace and harmony. The rise of China both in economic might and military modernisation will change and challenge the current status quo. Since post World War II, the American presence in Asia Pacific is not challenged and has played a stabilising force and role in our region. All these are beginning to change with a rising China exerting her rights and extending her military might."
2014-03-05-T-009-S-00668,2014-03-05-T-009,668,Lim Wee Kiak,Singapore has always been very close to both China and America and has enjoyed very good and unique relationships with both. We have always steered very carefully to safeguard our interests and our close relationships.
2014-03-05-T-009-S-00669,2014-03-05-T-009,669,Lim Wee Kiak,"In the event of a conflict or tension that is raised between two countries, how will Singapore fare? Can MFA provide an update on the key developments in our external geopolitical environment, in view of a rising China and rising tides, and provide an assessment on how this will affect our foreign policies over the past year?"
2014-03-05-T-009-S-00670,2014-03-05-T-009,670,Lim Wee Kiak,"Next, on relationship with our immediate neighbour, Malaysia. Our relationship with Malaysia has been described as very good as many of the bilateral issues confronting us in the Points of Agreement (POA) were resolved and currently are being implemented. Our recent talks of more linkages including high speed rail linking Kuala Lumpur and Singapore and extending our MRT to Johor are all in the works. Can MFA give an update on the status of our cooperation with Malaysia on all these projects as well as the projects in Iskandar, Malaysia?"
2014-03-05-T-009-S-00671,2014-03-05-T-009,671,Lim Wee Kiak,There have been very sharp exchanges between Singapore and Indonesia over the naming of the Indonesian navy ship KRI Usman Harun. What are the lessons learnt from this particular incident? And how can Singapore strike a balance between cooperation and defending our interests in relationships with our immediate neighbours?
2014-03-05-T-009-S-00672,2014-03-05-T-009,672,Lim Wee Kiak,"Indonesian President Susilo Bambang Yudhoyono will be stepping down this year. Do we expect the outcomes of this year's presidential election to affect our bilateral relationship? If so, how would it change? It is also a timely reminder of our relationship with Indonesia every time the haze appears in Singapore again. The PSI has risen to moderate level yesterday. As at this moment, it is 27. It is still in the good range."
2014-03-05-T-009-S-00673,2014-03-05-T-009,673,,(
2014-03-05-T-009-S-00674,2014-03-05-T-009,674,,Can MFA provide an update on Singapore's cooperation with Indonesia on the transboundary haze pollution issue as well as ASEAN's efforts to tackle it? I understand the Indonesia is close to ratifying the agreement. I would like to know if MFA has any further update on that.
2014-03-05-T-009-S-00675,2014-03-05-T-009,675,,"As for the state of relationship with other Southeast Asian neighbours, apart from Indonesia and Malaysia, what is our current relationship with Thailand, especially with the current political turmoil that is going on? And how does the current domestic situation in Thailand affect our bilateral relationship?"
2014-03-05-T-009-S-00676,2014-03-05-T-009,676,,"ASEAN nations have pledged to work towards a more united and harmonious ASEAN in the ASEAN Vision 2020 as well as the Cha-am Hua Hin Declaration on the roadmap of ASEAN Community 2015. The need to continue making progress on the implementation of the three Community Blueprints and the Master Plan on ASEAN Connectivity was emphasised. What progress has been made and how far have we advanced, in terms of realising ASEAN 2015 plan? Can MFA give an update on ASEAN 2015 plan as it is only next year and also ASEAN 2020 Vision? Are we on target for the stated goals in the plan and the vision? What are the challenges confronting ASEAN to achieving them?"
2014-03-05-T-009-S-00677,2014-03-05-T-009,677,,"What is Singapore's focus on ASEAN as we progress towards the 2015 Community goals, and how will this Community help our economy to grow? In what way does the existing regional architecture enable us to engage the major powers leveraging on ASEAN? What are ASEAN's plans after it has achieved its 2015 Community goals?"
2014-03-05-T-009-S-00678,2014-03-05-T-009,678,Irene Ng Phek Hoong,"Singapore cannot escape the vulnerabilities of being a small state – it is often subject to pressure by bigger countries. But as it has proved since independence, it can stand up for its own interests. It has established a record of firmly setting and following its own agenda. It has pursued a rational and consistent approach in foreign relations."
2014-03-05-T-009-S-00679,2014-03-05-T-009,679,Irene Ng Phek Hoong,"This has been tested many times, including recently. One was Indonesia's naming of its warship KRI Usman Harun, which showed its complete insensitivity to our feelings. It is important that we continue to stand firm on this issue."
2014-03-05-T-009-S-00680,2014-03-05-T-009,680,Irene Ng Phek Hoong,"With Indonesia, there is also the recurrent issue of transboundary haze pollution. We need to work with Indonesia to resolve this haze problem."
2014-03-05-T-009-S-00681,2014-03-05-T-009,681,Irene Ng Phek Hoong,A constant challenge is how Singapore can strike a balance between working with our neighbouring countries to form areas of common interest as well as standing up for our rights especially when we feel we are being pressured. And this challenge extends to Malaysia. The Malaysian media recently reported that Johor wants to review the price of raw water sold to Singapore. But I thought the issue has long been settled with the water agreement. What are the implications of this move?
2014-03-05-T-009-S-00682,2014-03-05-T-009,682,Irene Ng Phek Hoong,"We can expect such pressures from time to time, but thankfully with our own sources of water, it no longer gives unnecessary hostages to fortune. But we must stand firm."
2014-03-05-T-009-S-00683,2014-03-05-T-009,683,Irene Ng Phek Hoong,"The most important challenge of the future is the rise of new centres of power, particularly China. This geopolitical shift will have major repercussions on relations between the big powers and their allies and also with our neighbouring countries. And small states like Singapore are not immune to the pressures."
2014-03-05-T-009-S-00684,2014-03-05-T-009,684,Irene Ng Phek Hoong,"At this historic juncture, Singapore has to stay nimble and seek to bring to bear its soft-power resources to influence the course of events, through regional cooperation and dialogue for peace and stability in this region. Its soft power draws mainly from its economic strength and its ability to find ways to add value and be useful and relevant to the world."
2014-03-05-T-009-S-00685,2014-03-05-T-009,685,Irene Ng Phek Hoong,It is crucial for MFA to have resources to flex its muscles in support of its ideas and to have a top-notch professional diplomatic corps at its bidding.
2014-03-05-T-009-S-00686,2014-03-05-T-009,686,Irene Ng Phek Hoong,"I would like to ask the Minister for an assessment of our relations with our neighbours and of key geopolitical developments, how our foreign policies have evolved in response and how we are building the capacity of our Foreign Service to pursue Singapore's long-term interest in an increasingly complex and dynamic environment."
2014-03-05-T-009-S-00687,2014-03-05-T-009,687,Alex Yam,The poet Robert Frost in his 1914 poem Mending Walls uttered the immortal lines
2014-03-05-T-009-S-00688,2014-03-05-T-009,688,Alex Yam,"""I let my neighbor know beyond the hill;"
2014-03-05-T-009-S-00689,2014-03-05-T-009,689,Alex Yam,And on a day we will walk the line together;
2014-03-05-T-009-S-00690,2014-03-05-T-009,690,Alex Yam,"And to each the boulders that have fallen to each."""
2014-03-05-T-009-S-00691,2014-03-05-T-009,691,Alex Yam,"The poem quotes an oft repeated adage that ""good fences make good neighbours"". Over the last few years, we have built good relations with many of our neighbours and mending our fences, especially with our northern neighbour. Relations have improved and the personal connection between Prime Minister Lee and Prime Minister Razak has perhaps played a significant role as well."
2014-03-05-T-009-S-00692,2014-03-05-T-009,692,Alex Yam,"It is perhaps opportune at this point for us to take stock of where we are in our relationship with Malaysia and the rest of our ASEAN neighbours. What has gone right for us? What should we continue to maintain? But as the narrator also said, ""I built a wall but I wish to ask."""
2014-03-05-T-009-S-00693,2014-03-05-T-009,693,Alex Yam,"Are we simply mending a cosmetic fence? From conversations with many, there is a sense of foreboding in our relations with many of our neighbours. For Malaysia, for example, investments in Iskandar, overstretching ourselves in terms of our overall investments and, of course, the recent talk of the rising water prices. What safeguards do we have to ensure that we continue to have good relations with all our neighbours and	that our relationship continues to grow warmer and not hotter?"
2014-03-05-T-009-S-00694,2014-03-05-T-009,694,Intan Azura Mokhtar,"Being a small state, Singapore can be affected by developments in the region and among our close neighbours. Indonesia will be having the general election as well as Presidential election soon, and President Susilo Bambang Yudhoyono would be stepping down this year, as required by the Constitution. Of late, we have observed strong Indonesian nationalistic sentiments that have shaped incidents on various fronts, one of which is the naming of a navy vessel."
2014-03-05-T-009-S-00695,2014-03-05-T-009,695,Intan Azura Mokhtar,"Just like Dr Lim Wee Kiak, I would also like to ask if we expect the outcomes of the 2014 Indonesian elections to affect our bilateral relations with Indonesia. In addition, with the current dry spell, there are concerns that haze would be back with a vengeance. While the proposed Transboundary Haze Pollution Bill is a welcomed move, can the Ministry provide an update on Singapore's cooperation with Indonesia on this?"
2014-03-05-T-009-S-00696,2014-03-05-T-009,696,Ong Teng Koon,"ASEAN was founded in 1967 and we were one of the founding members then. It has since grown to include a regional grouping of 10-member countries, including Brunei, Cambodia, Laos and Myanmar."
2014-03-05-T-009-S-00697,2014-03-05-T-009,697,Ong Teng Koon,"Vietnam, Myanmar, Cambodia and Laos have a combined population of more than 170 million people. This represents a big market where our businesses have keen interests to access. Many businesses have also voiced their intentions to regionalise and export their knowledge and know-how to these countries. They feel that the young populations, energetic attitudes and growing middle class offer good business opportunities. The basis for economic cooperation is always good diplomatic relations. Would the Minister give an update on Singapore's efforts to augment our diplomatic relations with these countries, and if there are areas in security and defence for mutual cooperation?"
2014-03-05-T-009-S-00698,2014-03-05-T-009,698,Ong Teng Koon,"Thailand is a founding member of ASEAN. Our two countries have extensive government-to-government, business-to-business and people-to-people links. Thailand remains a favoured tourism destination for many Singaporeans. However, there are some challenges facing Thailand's domestic political situation. How would Thailand's domestic situation impact on our bilateral relations?"
2014-03-05-T-009-S-00699,2014-03-05-T-009,699,Alex Yam,"In introducing the ASEAN Economic Community (AEC), it is written that it shall be the goal of regional economic integration for ASEAN by 2015. AEC envisages a single market and production base, a highly competitive economic region, a region of equitable economic development and a region fully integrated into the global economy."
2014-03-05-T-009-S-00700,2014-03-05-T-009,700,Alex Yam,"When I was in university, my international relations professor once referred to international affairs jargon as ""broad enough to be generally acceptable but deep enough to be utterly unintelligible."""
2014-03-05-T-009-S-00701,2014-03-05-T-009,701,Alex Yam,"Perhaps that be true of the vision for AEC2015 as well. We are now just a year away from 2015. The region is still facing its fair share of political turmoil, so therefore how engaged are we in this process and what is the reality of achieving the aims of AEC2015 and its goals?"
2014-03-05-T-009-S-00702,2014-03-05-T-009,702,Alex Yam,"Perhaps, more importantly, from the example of the EU's integration and the troubles of recent bailouts for the EU region, what are the true benefits for our own economy and are there any sacrifices that we may have to make?"
2014-03-05-T-009-S-00703,2014-03-05-T-009,703,Alex Yam,"ASEAN continues to feature broadly in the world economy as a competitive region to do business in. The markets of many ASEAN members continue to boom and rightly so. But the problems of integration are manifold, how much more the plethora of issues for us to achieve economic integration. Therefore, can we continue to hold together ASEAN for the long term and do we have ASEAN 2015 in sight?"
2014-03-05-T-009-S-00704,2014-03-05-T-009,704,,"Ms Ellen Lee, you may take your three cuts together."
2014-03-05-T-009-S-00705,2014-03-05-T-009,705,Ellen Lee,"Mr Chairman, ASEAN's 2015 Community Goal is an ambitious one spanning diverse realms such as ASEAN GDP, ASEAN living conditions, ASEAN as favourite Foreign Direct Investment (FDI) destination and ASEAN trade in goods and services. Good progress has been made in these realms although economic recovery worldwide is slow."
2014-03-05-T-009-S-00706,2014-03-05-T-009,706,Ellen Lee,"As we approach 2015, what is Singapore's focus going to be and how will the ASEAN Community help our economy to grow, particularly when growth is expected to be slow compared with the past few years? In what way does the existing regional architecture enable us to engage the major powers who wield considerable economic power and political influence on the region's affairs?"
2014-03-05-T-009-S-00707,2014-03-05-T-009,707,Ellen Lee,"The world views ASEAN as having done well. In a world of lacklustre economic growth, especially in EU, growth in ASEAN countries has been the envy of people in the West. ASEAN citizens are growing more affluent despite large income gaps between the haves and the have-nots, more educated and widely travelled. There is a great deal of Foreign Direct Investment and, on the whole, people in ASEAN are young, energetic and hungry for growth. That good progress has been made in achieving ASEAN's 2015 Community Goal is clear. We should now focus on whether ASEAN has plans beyond 2015. What are the implications of these plans for Singapore?"
2014-03-05-T-009-S-00708,2014-03-05-T-009,708,Ellen Lee,"On regional developments, China's rapid economic and military growth have been assessed to be a challenge to America's undisputed leadership in the post-war. The rising tensions between these two nations have been manifested not just in the increased frequency of military exercises in the region reported by the media but also by their respective allies' responses as both nations' top ranking officials go around the world to gain support for their respective stands. Singapore has been consistent in its stand that we want to be friends with all countries and that we respect every nation's right to determine its own fate. It is necessary that we remain alert to changes in our external environment in order not to be taken by surprise when adverse changes occur."
2014-03-05-T-009-S-00709,2014-03-05-T-009,709,Ellen Lee,What is MFA's assessment of the current state of affairs? Is war likely as commentators rush to offer their views on this worrying prospect? How will ASEAN be affected?
2014-03-05-T-009-S-00710,2014-03-05-T-009,710,David Ong,"Mr Chairman, tension has been mounting in the Northeast region as China and Japan who have long historical disputes over the Diaoyu islands have since made move to give up their military forces there. Japan's Prime Minister's visit to Yasukuni Shrine last December sparked outrage in both China and Korea. Things have not improved since. This festering tension and ongoing bitter exchanges are unsettling for the region and show no sign of abating. It may take on a sustained cycle of tension. The trilateral relationship between China, Japan and South Korea is currently at a low point."
2014-03-05-T-009-S-00711,2014-03-05-T-009,711,David Ong,"The recent developments in North Korea and the latter show of force by test firing four ballistic missiles are again raising tension in the Peninsula. What is MFA's assessment of the political risk in Northeast Asia this year, given the recent escalation of tensions between the Northeast Asian countries?"
2014-03-05-T-009-S-00712,2014-03-05-T-009,712,Ong Teng Koon,"For many years, although competing claims in various parts of the South China Sea have existed, they were peaceful. Recent developments, however, are indicating an escalation of tensions."
2014-03-05-T-009-S-00713,2014-03-05-T-009,713,Ong Teng Koon,The latest incident involved the Chinese Navy being accused of firing water cannons at Philippine fishermen to enforce China's fishing ban. Chinese media has also reported that the Chinese Navy sailed to James Shoal and conducted an oath taking ceremony vowing to safeguard China's sovereignty and maritime interests.
2014-03-05-T-009-S-00714,2014-03-05-T-009,714,Ong Teng Koon,"There are also other states making a claim for parts of South China Sea and they include Malaysia, Brunei and Vietnam."
2014-03-05-T-009-S-00715,2014-03-05-T-009,715,Ong Teng Koon,"We need the sea lanes to be free of conflict for trade to flow. Any conflict in the South China Sea is of little advantage to us. Notwithstanding our size, what is Singapore's position on the South China Sea even though we are not a claimant state? Secondly, what can be done to address these issues?"
2014-03-05-T-009-S-00716,2014-03-05-T-009,716,David Ong,"Thank you, Chairman. Singapore has been granted permanent observer status in the Arctic Council which gives countries the right to listen in all meetings and propose and finance policies. The Arctic region is gaining clout as global warming opens up new trade routes and intensifies competition for oil and gas estimated at 15% and 30% respectively of undiscovered reserves. What steps is Singapore taking to advance our interest in this northern region, such as freedom of navigation and the opening of new routes that may have implications for Singapore as a seaport?"
2014-03-05-T-009-S-00717,2014-03-05-T-009,717,,"Mr Alex Yam, you can take your cuts together."
2014-03-05-T-009-S-00718,2014-03-05-T-009,718,Alex Yam,"Mr Lee Kuan Yew once said in 2009 that ""Small countries have little power to alter the region, let alone the world. But a small country must seek a maximum number of friends, while maintaining the freedom to be itself as a sovereign and independent nation."""
2014-03-05-T-009-S-00719,2014-03-05-T-009,719,Alex Yam,"Through our short 50 years of history, the one thing that has stood out most often is our size and our size. Why two sizes you may ask? Well, we are after all a small nation, our geographical spread of just over 700 square kilometres equates to less than half of Delhi. But our size and our influence internationally is disproportionate to our physical size."
2014-03-05-T-009-S-00720,2014-03-05-T-009,720,Alex Yam,"Our turbulent beginnings have perhaps shaped our psyche and we have made it a point to practise good diplomacy to maintain good relations with as many of our neighbours as possible. While the focus of many during this COS has been on big power relations in the early part of other parliamentary colleagues' speeches, Singapore's standing in the world has also been because of our relations with other key partners further afield."
2014-03-05-T-009-S-00721,2014-03-05-T-009,721,Alex Yam,"In just 10 years, our trade with Japan, Korea and the EU has grown tremendously. For example, with the EU, it rose over the last 10 years from $18.02 billion to $45.64 billion in terms of exports alone. While trade alone cannot underscore the importance of bilateral relations, it is certainly a key cornerstone."
2014-03-05-T-009-S-00722,2014-03-05-T-009,722,Alex Yam,"The economist Jim O'Neill has in the recent decade coined the terms BRICS and MINT, referring to the emerging economies of Brazil, Russia, India, China and South Africa, as well as the new growth economies of Mexico, Indonesia, Nigeria and Turkey. We, too, have had long years of relationships with many of these countries. How do we plan to capitalise on these ties and to further strengthen our bilateral relations with these economies who may well be key partners for the future?"
2014-03-05-T-009-S-00723,2014-03-05-T-009,723,Alex Yam,"Of course, diplomacy is not without its pitfalls and the diplomacy of small states is often buffeted by the changing tides of big power dynamics. Recent tensions between Russia and EU over Ukraine are a case in point. Amidst a world of fast changing international relations, are we, as a small nation, prepared to catch those sails at the right moment and not be swept away?"
2014-03-05-T-009-S-00724,2014-03-05-T-009,724,Alex Yam,"Therefore, our membership of key international fora, such as the United Nations and Arctic Council, are important ones. Of growing interest as well are our relations with the Middle East, Africa and Latin America. As mentioned earlier, some of the states in these regions will have the potential to play key roles in the future. Yet again, the unstable geopolitical climate of these regions does not make it easy for us. Therefore, how do we ensure that our interests are best represented in these regions as well?"
2014-03-05-T-009-S-00725,2014-03-05-T-009,725,Alex Yam,"I hope that as the world continues to evolve politically and diplomatically, Singapore is well placed to continue to play a role well above our physical limitations."
2014-03-05-T-009-S-00726,2014-03-05-T-009,726,Gerald Giam Yean Song,"Sir, international development is a form of foreign aid that seeks to improve the lives of people in developing countries, while at the same time furthering a country's foreign policy goals. It does not traditionally play a very visible role in our foreign relation strategies, apart from technical assistance programmes that we provide to developing countries. This is unlike most developed countries that have dedicated international development agencies and, sometimes, even a Cabinet Minister-in-charge."
2014-03-05-T-009-S-00727,2014-03-05-T-009,727,Gerald Giam Yean Song,"In 2013, Singapore contributed $26.7 million in Overseas Development Assistance (ODA), which includes technical assistance programmes, scholarships and tuition grants to foreign students. Can the Minister share what other forms of ODA Singapore contributes to which are not captured in this amount?"
