speech_id,topic_id,speech_order,member_name,text
2014-11-03-T-014-S-00215,2014-11-03-T-014,215,David Ong,"We have, for many years, achieved Budgetary Account balances, with some exceptions, mostly in surpluses. However, it is a known fact that with many rebates, close to 70% of Singaporeans do not pay income tax. Our Government's revenue has for some years now been dependent on indirect tax for income. Thus far, we have been fortunate to achieve fiscal surpluses. But, as more pressure builds up on providing social support, as well as the need for maintenance and replacement of existing infrastructures, our people need to be assured that the Government would not take the route of increasing direct income tax or other indirect taxes to raise revenue to fund demand for similar generous social measures."
2014-11-03-T-014-S-00216,2014-11-03-T-014,216,David Ong,"Mdm Speaker, the PG Package and its many wonderful provisions reminded me of the traditional Chinese delicacy of 盆菜. This dish takes hours and hours of preparation, served in a large earthen pot. At every layer, it is stuffed with delicious delicacies. But, for the country, this is both a source of celebration and concern. Concern because, even in the face of one of the worst global financial meltdowns in 2009, we had had to utilise $4 billion of our country's reserves."
2014-11-03-T-014-S-00217,2014-11-03-T-014,217,David Ong,"This year alone, we are introducing various social programmes costing many billions. Moreover, the funding of the PG Fund is drawn from our Net Investment Returns of our reserves, and the source of the latter is dependent on prudence, governance and strong economic growth. Although the approach is one of prudent fiscal spending, for a small economy like Singapore, we are highly susceptible to shifting global external conditions beyond our control. The question is whether Singapore can continue to enjoy the trade winds of good investment yields from its reserves."
2014-11-03-T-014-S-00218,2014-11-03-T-014,218,David Ong,"Mdm Speaker, we need to avoid well-intended good policy marred by poor execution. In this regard, we have introduced many measures that go to the heart of easing the living of all Singaporeans as much as possible, sparing no effort or funds. Many members of the Pioneer Generation may have little or no education, are monolingual and ignorant of current affairs. Thus, it would be a shame if people do not understand how they can benefit from all the goodness and benefits of the PG Package."
2014-11-03-T-014-S-00219,2014-11-03-T-014,219,David Ong,I must add that the Government has embarked on an aggressive and comprehensive outreach and communication plan to reach out to as many of our PG seniors and the public as possible. It is good to do a stock-take and see how effective this has been and what more can be done.
2014-11-03-T-014-S-00220,2014-11-03-T-014,220,David Ong,"Mdm Speaker, the PG Package has been a popular policy with the recipients. This is evident as more than 100,000 of the PG members have started using their cards in just over two months. On the ground, during my interactions with my residents, many are appreciative and commented that the PG Package benefits are good. During my MPS, I have received appeals from seniors to be included even though they missed the qualifying criteria."
2014-11-03-T-014-S-00221,2014-11-03-T-014,221,David Ong,"Many argued that they, too, have contributed to the building of Singapore. Some naturalised citizens, too, want to be included on grounds that they have been in Singapore for longer than their citizenship status. Although clauses 13 through 15 addressed the issue of who qualifies, as well as the appeal process, I hope for more transparency in the deliberation of the appeal. On what grounds would exceptions be made on these appeals?"
2014-11-03-T-014-S-00222,2014-11-03-T-014,222,David Ong,"Mdm Speaker, the crux of the issue is for members of the Pioneer Generation who need help to be able to receive them as quickly and seamlessly as possible. This is the basic issue that we have to address. The Government had spared no effort and resources in trying to get the message of the PG Package down to the recipients. We, therefore, owe it to ourselves, as well as the Pioneer Generation Singaporeans, to avoid hiccups and delays in the delivery, such as subsidies in medicine and premiums for MediShield Life. With this, I support the Pioneer Generation Fund Bill."
2014-11-03-T-014-S-00223,2014-11-03-T-014,223,Chia Yong Yong,"Mdm Speaker, I speak in support of the Pioneer Generation Fund Bill. I also declare my interest  I am the President of SPD, a voluntary welfare organisation which falls within the definition of ""healthcare provider"" under the Bill, and a board member of SG Enable."
2014-11-03-T-014-S-00224,2014-11-03-T-014,224,Chia Yong Yong,"Madam, the principle of honouring our Pioneers and caring for this special group in their senior years is right and laudable. The healthcare-related needs of seniors intensify with age. It is, therefore, good and timely that greater attention is paid to such needs. An important component would, naturally, be financial assistance."
2014-11-03-T-014-S-00225,2014-11-03-T-014,225,Chia Yong Yong,"It is heartening that the healthcare-related schemes announced to-date by the Government under the PG Package do not require means-testing. By such, the PG Fund is rendered more accessible to Pioneers."
2014-11-03-T-014-S-00226,2014-11-03-T-014,226,Chia Yong Yong,"In this context, it is noted that clause 3 of the Bill states the purpose of the Act as ""to recognise and honour the participation and sacrifice of Singapore's Pioneers in the development of Singapore by providing to them who are now elderly and are or may be in need of financial relief, assistance or other support to meet their healthcare costs, and other costs of living in Singapore."" The Explanatory Statement to the Bill is similarly worded."
2014-11-03-T-014-S-00227,2014-11-03-T-014,227,Chia Yong Yong,"Madam, I would like to draw the attention of the House to the phrase ""and are/or may be in need of financial relief"". This phrase suggests that for a scheme to qualify for funding under the PG Fund, the disbursement of monies or provision of benefits to any Pioneer must be subject to means-testing or differentiation on the ground of financial need. If so, a scheme that benefits Pioneers without the requirement for means-testing would not qualify for funding under the PG Fund. That would be inconsistent with the declared intentions that the announced healthcare-related schemes should be drawn from the PG Fund because the current announced schemes do not require means-testing."
2014-11-03-T-014-S-00228,2014-11-03-T-014,228,Chia Yong Yong,"To address the foregoing concern, as well as concerns as to whether a Pioneer participated and made sacrifices in the development of Singapore, the language in clause 3 may be amended by replacing ""them who are now elderly and are or may be in need of"" with simply ""Pioneers"". This would remove doubts as to whether the PG Package healthcare-related schemes, as announced, are eligible for funding under the PG Fund and would also grant the Government greater flexibility in designing and qualifying future schemes under the PG Fund. I do recognise that there are other possible interpretations of clause 3. But I would suggest that we should make a plain reading plain."
2014-11-03-T-014-S-00229,2014-11-03-T-014,229,Chia Yong Yong,"Madam, I support the provision under section 13(3)(c), which provides that a verification application for an individual under mental incapacity may be made by a donee under a lasting power of attorney. I would request that in the drafting of the regulations, a verification application may also be made by a Court-appointed deputy."
2014-11-03-T-014-S-00230,2014-11-03-T-014,230,Chia Yong Yong,"In relation to section 18 of the Bill, Parliament may also wish to consider the need to reserve a power or discretion to exclude or restrict any Pioneer or class of Pioneers from receiving benefits under the Act where it is expedient in the public interest, particularly in view of the stated purpose of the Act. This power or discretion may be incorporated into section 18(2)."
2014-11-03-T-014-S-00231,2014-11-03-T-014,231,Chia Yong Yong,"Madam, allow me to now move on to some practical issues."
2014-11-03-T-014-S-00232,2014-11-03-T-014,232,Chia Yong Yong,"In as much as the intention is to make the PG Fund accessible to Pioneers, we need to take a holistic approach between schemes under the PG Package and other existing schemes. We should make accessibility to all these schemes as seamless and painless as possible. For example, whilst one common Functional Assessment Report is utilised for schemes administered by AIC, Sg Enable, SNTC and HDB, the form of the report states that it is, I quote, ""NOT valid for claims under ElderShield and the Interim Disability Assistance Programme for the Elderly (IDAPE)"". With due respect, I fail to see a compelling reason, notwithstanding that ElderShield and IDAPE are administered by insurers, to subject the elderly to different functional assessment exercises for a similar assessment outcome. Would the Government consider rationalising the Functional Assessment Report requirements?"
2014-11-03-T-014-S-00233,2014-11-03-T-014,233,Chia Yong Yong,"We should bear in mind the challenges enroute to obtaining such assessment reports. There are transport and other logistical challenges, such as how to go, who to accompany; there are cost constraints, such as taxi fare, caregiver to take leave, sometimes no-pay leave, payment for costs of assessment and certification; waiting time to obtain appointments, waiting time at the relevant clinics. It can be very debilitating for the patient and caregiver. Let us not make our Pioneers whom we wish to honour and their caregivers who are already under tremendous stress, undergo multiple assessments unnecessarily."
2014-11-03-T-014-S-00234,2014-11-03-T-014,234,Chia Yong Yong,"On a similar note, I would, therefore, request the Minister also to clarify if there would be requirements for periodic reassessment after an initial functional assessment has concluded that a disability is permanent or likely to be permanent."
2014-11-03-T-014-S-00235,2014-11-03-T-014,235,Chia Yong Yong,"In relation to PioneerDAS, the FAQs state that the sums disbursed under PioneerDAS may be used to pay for any expenses, at the discretion of the Pioneer. The Pioneer may also nominate a caregiver who is at least 18 years old to receive the payments. I have two concerns, which apply to all disbursements under the PG Fund. The first is that the Pioneer may be vulnerable and subject to undue influence. The second is that the minimum age of a caregiver who may be nominated to receive the payments should be raised to above 18 years. The minimum age would be an arbitrary number, I agree, but the relevant authorities would be in a good position to assess what an appropriate uniform minimum age would be, with discretion granted to the various scheme administrators to make exceptions as the circumstances may warrant. Pioneers should also be strongly encouraged to nominate suppliers and service providers to receive the relevant funds received from the PG Fund. This would reduce the risks of dissipation, which may otherwise leave the Pioneer deprived of the funds."
2014-11-03-T-014-S-00236,2014-11-03-T-014,236,Chia Yong Yong,"Under PioneerDAS, the FAQs also state that if a Pioneer passes away, the caregiver is required to submit a death certificate. Potentially, disbursements can continue to be made for as long as the death certificate is not submitted. Instead of relying on the diligence or good faith of the caregiver and the claw-back provisions, the registration of the death of a Pioneer could be immediately uploaded onto the scheme administrator's system through the Registry of Births and Deaths."
2014-11-03-T-014-S-00237,2014-11-03-T-014,237,Chia Yong Yong,"The FAQs also state that the Pioneer and his caregiver may nominate different bank accounts for different schemes. So, you could have a Pioneer with different bank accounts for PioneerDAS, ElderShield, IDAPE and the Foreign Domestic Worker Grant. We are concerned that the potential number of bank accounts would result in greater difficulty for the Pioneer to monitor and track transaction trails. I would, therefore, also urge the Government to rationalise payments into a single account, regardless of whether the schemes are administered by the public, voluntary or private sectors."
2014-11-03-T-014-S-00238,2014-11-03-T-014,238,Chia Yong Yong,"Having said the above, I would also like to urge my fellow Singaporeans to recognise that the responsibility should not be the Government's alone. It must be a family and community effort. Honouring our Pioneers does not lie in dispensing funds alone. It lies in according them respect and dignity. They should not be viewed as a burden to our community, but as valuable members of our community and, where applicable, as role models and mentors for the younger generation."
2014-11-03-T-014-S-00239,2014-11-03-T-014,239,Chia Yong Yong,It is as frightful to be aged and lonely as it is to be aged and poor. The role of the family is something which no Government or VWO can assume. Loneliness is not a condition that the Government or a VWO can relieve. Love is not something that the Government or a VWO can give.
2014-11-03-T-014-S-00240,2014-11-03-T-014,240,Chia Yong Yong,"As we consider, debate upon and execute various Government schemes for Pioneers, I urge each Singaporean to examine our roles in relation to the Pioneers, seniors, people with different or special needs and others within our families and community."
2014-11-03-T-014-S-00241,2014-11-03-T-014,241,Chia Yong Yong,"We, who have seniors in our families, are we willing to assume responsibility for them? We, who have seniors in our neighbourhood, are we willing to be neighbours to them? We, who are employers, are we willing to engage and employ our seniors on fair terms? Are we willing to redesign the work scope and workspace to accommodate their needs whilst tapping on their experience? We see our seniors taking public transport, working in public places. Should we be kind and gracious to them? Do we even notice them? Or do we think that someone else will?"
2014-11-03-T-014-S-00242,2014-11-03-T-014,242,Chia Yong Yong,"It is not a scheme or package that makes a country kind and gracious. Yes, that sets the tone. But it is every individual – you and I. Singaporeans. The young today will be aged one day. The able-bodied will slowly suffer functional disabilities. It is not someone else’s problem. It is our problem. We are the ones who determine the type of community we live in and the type of community we will live in in the future. The Government has set the tone for us in this Bill. The question now is  what will we, the common folk, do?"
2014-11-03-T-014-S-00243,2014-11-03-T-014,243,Chia Yong Yong,"Our Pioneers merit special treatment. They made extraordinary sacrifices to build families under unfavourable conditions. Born before 1949, there was barely any real opportunity to secure any education or home. They grew up among the ravages of unemployment and socio-economic disadvantages in the 1950s and 1960s. CPF was started only in 1955. Neither was there a real opportunity to build up savings with their meagre salaries."
2014-11-03-T-014-S-00244,2014-11-03-T-014,244,Chia Yong Yong,"The true benefits of economic progress were enjoyed by the younger generations born after them. Our healthcare system has prolonged their life expectancies. Our education has made it hard for them to participate in the labour force. Even our modestly-priced public housing in the initial years was beyond the reach of many low-skilled workers. Some have been displaced from their agricultural livelihoods to make way for public housing, industrialisation and infrastructure. In other words, they were displaced to make way for our future."
2014-11-03-T-014-S-00245,2014-11-03-T-014,245,Chia Yong Yong,"This Fund is but a token of appreciation to recognise their past. We, their children, benefited from our economic progress built on their past and their sacrifices. We must work together with the State to galvanise more efforts to provide the seniors and the Pioneers with a dignified twilight."
2014-11-03-T-014-S-00246,2014-11-03-T-014,246,Chia Yong Yong,"Mdm Speaker, on that note, I support the Pioneer Generation Fund Bill."
2014-11-03-T-014-S-00247,2014-11-03-T-014,247,Speaker,Senior Minister of State Josephine Teo.
2014-11-03-T-014-S-00248,2014-11-03-T-014,248,Josephine Teo,"Mdm Speaker, I thank the Members, Assoc Prof Fatimah Lateef, Mr David Ong and Ms Chia Yong Yong, for their support of the Pioneer Generation Fund Bill. As I speak, I am trying to look through my reading glasses. I am beginning to experience what it is like to cope with seniority. So, what Ms Chia, in particular, says about the challenges that our seniors, our Pioneers faced, I cannot say I relate to completely but I am beginning to experience it and it resonates with me."
2014-11-03-T-014-S-00249,2014-11-03-T-014,249,Josephine Teo,"I would like, Mdm Speaker, to respond to each of the Members' points. In order to organise this, I will respond to Assoc Prof Fatimah's points first, then Mr David Ong's and Ms Chia's, if that is permitted."
2014-11-03-T-014-S-00250,2014-11-03-T-014,250,Josephine Teo,"So, let me start with Assoc Prof Fatimah who had a question on how certain groups of Pioneers, such as those who are currently incarcerated or those who are in nursing homes, can benefit from the Pioneer Generation benefits."
2014-11-03-T-014-S-00251,2014-11-03-T-014,251,Josephine Teo,"Pioneers who are incarcerated already receive medical care provided by the Singapore Prison Service and, so, do not require subsidies for outpatient treatment while in prison. However, they will still receive the Medisave top-ups and receive premium subsidies for MediShield Life when it is implemented."
2014-11-03-T-014-S-00252,2014-11-03-T-014,252,Josephine Teo,"Pioneers in nursing homes are eligible for the same benefits as all other Pioneers, on top of the Government subsidies that they may receive for long-term care. Like other Pioneers, they can get the Medisave top-ups and the subsidies for outpatient treatment, which are useful if and when they are referred to the specialist outpatient clinics for treatment. Those with moderate to severe functional disability will benefit from the Pioneer Generation Disability Assistance Scheme (PioneerDAS), which I introduced earlier, which can be used to support the cost of long-term care."
2014-11-03-T-014-S-00253,2014-11-03-T-014,253,Josephine Teo,"We have also reached out to our nursing home providers to inform them how to facilitate their patients' applications for PioneerDAS. And when MediShield Life is implemented, they will also receive special subsidies for Pioneers and have insurance coverage in case they are hospitalised."
2014-11-03-T-014-S-00254,2014-11-03-T-014,254,Josephine Teo,"Assoc Prof Fatimah is right to point out that Pioneer benefits do not apply to all clinics and settings and has asked whether we need to clearly define the term ""healthcare provider"" under section 2 of the Bill. The list of healthcare providers that disperse Pioneer Generation benefits will be gazetted under section 19 of the Bill. We also intend to put up this list of healthcare providers online so that members of the public can check against this list."
2014-11-03-T-014-S-00255,2014-11-03-T-014,255,Josephine Teo,"The important point is how Pioneers can more easily identify the healthcare providers where Pioneer benefits are available. In this regard, I am pleased to share with Members that, in fact, the CHAS GPs and subsidised SOCs have all been provided collaterals, such as standees, and encouraged to display these collaterals prominently so that Pioneers can see clearly that benefits are available to them. I think something visual, big and prominently located is easier for the Pioneers to identify. So, that is what we will continue to encourage the healthcare providers to do."
2014-11-03-T-014-S-00256,2014-11-03-T-014,256,Josephine Teo,"The PG Fund has been sized so that it is sufficient to cover the projected costs of the entire package. So, there is really no need for individuals and organisations to donate to the Fund. We encourage them instead to donate directly to charities or platforms, such as the SG50 Care and Share Movement. The impact of the donations will be doubled with the matching grants from the Government. This will provide additional resource support for the good work of our community organisations which directly help the vulnerable elderly. Monies in the PG Fund will be invested with the Government, which will pay a fixed return to the Fund annually. This is the same for other funds, such as the Goods and Services Tax Voucher Fund."
2014-11-03-T-014-S-00257,2014-11-03-T-014,257,Josephine Teo,"Assoc Prof Fatimah also asked whether there is a maximum claim limit under the package. As Members are aware, there are existing rules on how much a Member can withdraw from his CPF Medisave Account or how much he can claim via MediShield Life. The same rules apply to Pioneers. However, there is no cap to the number of years a Pioneer may claim the PG Package benefits because the Government is committed to providing them to all Pioneers for as long as they live."
2014-11-03-T-014-S-00258,2014-11-03-T-014,258,Josephine Teo,"Moving on to Mr Ong's points, he raised four main ones."
2014-11-03-T-014-S-00259,2014-11-03-T-014,259,Josephine Teo,"First, he emphasised the need to ensure that the PG Fund is well-governed. Let me assure Members that the Fund is subject to the same stringent governance structure already in place for other similar funds. It will be audited annually and its financial statement will be presented to Parliament every year."
2014-11-03-T-014-S-00260,2014-11-03-T-014,260,Josephine Teo,"Second, Mr Ong highlighted the concern of indiscriminate pricing of medicine and treatments by healthcare providers, especially where there are subsidies which are very attractive. Madam, I believe that the vast majority of doctors are conscientious and take it upon themselves to always act in the best interests of their patients. Nonetheless, MOH closely monitors the claims submitted by the CHAS GPs and will not hesitate to call on clinics to account for exceptional claims. Let me add, too, that, as patients, we have to be careful to avoid asserting undue pressure on doctors by seeking treatment or medication excessively."
2014-11-03-T-014-S-00261,2014-11-03-T-014,261,Josephine Teo,"Third, Mr Ong is right to remind us that there could be unexpected or external factors that may lead to accelerated depletion of the Fund. We have, therefore, included a buffer for inflation and also taken into account utilisation due to the ageing demographics of Pioneers when sizing the Fund. But his broader point about the need to contain healthcare cost increases is an important one and there are three key strategies, as mentioned by Deputy Prime Minister Tharman during his Budget round-up speech earlier this year."
2014-11-03-T-014-S-00262,2014-11-03-T-014,262,Josephine Teo,"First, we must rebalance the structure of our healthcare system to shift from an over-concentration of treatment in acute hospitals even when treatments can be effectively delivered through primary care or step-down care providers."
2014-11-03-T-014-S-00263,2014-11-03-T-014,263,Josephine Teo,"Second, we must ensure that we have the right incentives for healthcare providers, doctors and individuals and we must avoid over-prescription by ensuring that treatments are clinically necessary and cost-effective."
2014-11-03-T-014-S-00264,2014-11-03-T-014,264,Josephine Teo,"Third, all of us must take responsibility for maintaining healthy lifestyles and utilise healthcare services prudently. This is a long-term effort and we will all need to do our part to control healthcare costs."
2014-11-03-T-014-S-00265,2014-11-03-T-014,265,Josephine Teo,"Finally, Mr Ong asked about the Appeals Panel criteria. For citizenship-related appeals, the Panel has been considering the relevant factors of each case. These factors include whether the appellant had been in Singapore in the early years of Independence, demonstrated clear efforts to sink roots in Singapore and had obtained Singapore citizenship shortly after the 1986 cut-off date."
2014-11-03-T-014-S-00266,2014-11-03-T-014,266,Josephine Teo,"On age-related appeals, the Panel had deliberated on the matter extensively and it was a very difficult debate. It recognised that, for any age criterion, there will be those who marginally fall short of the criterion. Some appeals pointed out that they actually missed out the 31 December 1949 criterion by a mere few hours. So, the Panel has decided that, as difficult as it is, it was not feasible or fair to allow age-related appeals without extending the new age criterion and to all Singaporeans. In other words, shift the line completely. It is decided that it is not feasible to do so and, so, the Bill reflects these decisions accordingly."
