speech_id,topic_id,speech_order,member_name,text
2016-08-16-T-015-S-01028,2016-08-16-T-015,1028,Ganesh Rajaram,"Now, imagine what would have happened if we were deprived of watching this ""live"". We would have missed seeing a Singaporean beat the world's best swimmer and greatest Olympian of all time, missed seeing him touch the wall for a new Olympic record, missed seeing him receive the Gold medal, missed seeing our flag flying high, ahead of others, at the world's greatest sporting games, and missed hearing our National Anthem being played for the first time in Olympic history."
2016-08-16-T-015-S-01029,2016-08-16-T-015,1029,Ganesh Rajaram,"It is extremely puzzling to me that a deal to broadcast the Olympics in Singapore could not be reached over almost a three-year period, and this was achieved only at the eleventh hour. Many of us watched Joseph's dad, Colin Schooling's emotional interview right after watching his son win the Olympic Gold on ""live"" TV. As did hundreds of thousands of Singaporeans all across the island, the raw pride and joy were heard and felt across the island, not just among Singaporeans, but by many others, too, who live and work in Singapore."
2016-08-16-T-015-S-01030,2016-08-16-T-015,1030,Ganesh Rajaram,"So, why were we just hours away from not having access to a ""live"" telecast, in a country that positions itself to the world as a modern, connected city, a ""Smart Nation""? High content costs were cited as the main reason. ""It's a commercial decision"", some said. As someone who works in the industry and who has had the experience of being both a buyer and a seller of such content and rights, I would like to very politely disagree with the reasoning put out, and the manner and approach to securing the 2016 Rio Olympics television rights."
2016-08-16-T-015-S-01031,2016-08-16-T-015,1031,Ganesh Rajaram,"Content costs, particularly sports rights, are expensive and have been for a while now. This is a global trend, and one that is not unique to Singapore. But the Rio Olympics, or any Olympics for that matter, carry a significance beyond a commercial price point. Its value lies in that cloud of pride and joy that still hovers over the island. We felt it in this House even yesterday. This is a sense of unity and spirit of invincibility of superhero proportions – that you can do anything if you work hard enough and persevere; that you could be the only person in the world to outswim your childhood hero and the most bemedalled Olympian in history. Why else do we really spend millions on world-class sporting facilities? Why bother funding sporting associations, sportsmen and sportswomen? Why do we hire the best coaches and sporting administrators in the world?"
2016-08-16-T-015-S-01032,2016-08-16-T-015,1032,Ganesh Rajaram,"If we say that we support Team Singapore, and that we have built world-class facilities in support of our sporting dream, does this not extend to creating access to their moment of reckoning and glory for Singaporeans to support and celebrate? What if we had missed out on arguably Singapore's most significant 50 seconds of sporting history as it unfolded? So, when there was almost a three-year impasse between the negotiating parties, why did the MDA not step in in the interest of the nation?"
2016-08-16-T-015-S-01033,2016-08-16-T-015,1033,Ganesh Rajaram,"Singapore broadcasters have spent hundreds of millions of dollars so that we can watch Manchester United on TV, weekend, week-out. The rights to watch the Rio Olympics was a miniscule fraction of that amount for Singapore's fathers, mothers, brothers and sisters to watch their family members – the nation's best sportsmen and women on the world stage. Perhaps, we can learn from our immediate neighbours, Malaysia, and how they approached securing the rights for the Olympics."
2016-08-16-T-015-S-01034,2016-08-16-T-015,1034,Ganesh Rajaram,"RTM, Malaysia's national free-to-air broadcaster; ASTRO, Malaysia's biggest cable broadcaster; and Telekom Malaysia – not just a telco but they also run an Internet platform – all came together to create a TV pool. Each of these parties paid an equal one-third share of the costs. I am told that even with the split, it would be difficult for them to recoup their investment. But it was done in the spirit of national interest and they secured the rights in good time to be able to publish schedules in advance, as well as sell sponsorship and airtime around the Olympics to help recoup part of the cost."
2016-08-16-T-015-S-01035,2016-08-16-T-015,1035,Ganesh Rajaram,"But after what happened with the TV rights for the Rio Olympics in Singapore, it is obvious that this cannot be left to chance. If Singapore broadcasters will not work together in the spirit of national interest, then this Bill must include safeguards to ensure that this never happens again. It is the very least the Government can do to honour the years of sacrifices made by our national sportsmen and women, and their families."
2016-08-16-T-015-S-01036,2016-08-16-T-015,1036,Ganesh Rajaram,"In fact, a strong case can be made for the Olympic Games' telecast rights in Singapore to be funded by the IMDA as part of the public service broadcast funds that are disbursed annually. The Olympics will certainly generate far more ratings and viewership numbers than most of our current public service broadcast programmes. And, more importantly, create a sense of unity and national pride that is not tangible, and these values more than qualify as being of public service."
2016-08-16-T-015-S-01037,2016-08-16-T-015,1037,Ganesh Rajaram,"The next summer Olympic Games in 2020 will be held in Tokyo, in four years' time. With Tokyo just an hour ahead of us, most of the events will be telecast during our prime time, making it even more accessible to a bigger audience in Singapore. Having witnessed the impact of the Rio Olympics on Singaporeans of all walks of life, I would urge the IMDA to secure these rights as soon as possible."
2016-08-16-T-015-S-01038,2016-08-16-T-015,1038,Ganesh Rajaram,"Sir, that brings me to an issue that I have raised before – transparency in public service-funded initiatives. Our national free-to-air broadcaster, Mediacorp, today outsources 40% of public service-funded projects to independent production companies in the private sector. There is also the contestable funding initiative that is open to all platforms in Singapore as long as they make available their content to the public for free."
2016-08-16-T-015-S-01039,2016-08-16-T-015,1039,Ganesh Rajaram,"In a recent dialogue session with independent producers, some of the feedback centred on inconsistencies in commissioning policies, particularly with cable operator StarHub. There have also been calls from the industry for several years now, asking for more transparency with regard to the quantum and projects. There is much expectation that with the establishment of the IMDA, the agency can now finally make public, projects that are commissioned under the Public Service Broadcast Framework, as well as the contestable fund initiative. This should include details like genres, durations and production budgets."
2016-08-16-T-015-S-01040,2016-08-16-T-015,1040,Ganesh Rajaram,"This is a move in the right direction and will create more transparency and trust between broadcasters and production entities, and build a more balanced and robust competitive environment that can only be good for the marketplace. It will definitely put paid to nagging rumours about broadcasters and their perceived favouring of inhouse producers vis-Ã-vis independent production entities. With more players entering the market because of digital platforms, transparency and openness are essential to creating more quality content and a more market-friendly Government positioning."
2016-08-16-T-015-S-01041,2016-08-16-T-015,1041,Ganesh Rajaram,"This brings me to my final point on the high value freelance community in the media industry, and the role the IMDA can play to regulate and foster growth. The media manpower sector has an extremely large pool of freelance talents. There are thousands of freelances employed in the media sector with most companies employing them, as many of our SMEs are not capable of carrying big overheads. These talents span the gamut of the media sector, from film and video, broadcasting, publishing, online media to games."
2016-08-16-T-015-S-01042,2016-08-16-T-015,1042,Ganesh Rajaram,"Beyond supporting local platforms, the freelance community is also very involved in big-scale regional and global productions, such as Amazing Race Asia and Masterchef Asia, as well as several feature films. We expect to see this pool grow as many of the new generation of media practitioners prefer to work on their own schedules on a project-by-project basis."
2016-08-16-T-015-S-01043,2016-08-16-T-015,1043,Ganesh Rajaram,"The MDA and the WDA have made much progress in working with the freelance community. Programmes, such as the Attach and Train programme which subsidises employers to pay 70% of freelancers' pay for six months, have helped provide some stability to the community."
2016-08-16-T-015-S-01044,2016-08-16-T-015,1044,Ganesh Rajaram,"There are still, however, serious issues confronting the community, such as insurance coverage for freelancers. I am heartened to hear that a few of my colleagues in this House have been working tirelessly with the freelance community, as well as agencies like MDA, WDA and the NTUC to find viable solutions."
2016-08-16-T-015-S-01045,2016-08-16-T-015,1045,Ganesh Rajaram,"Sir, there is a pressing need for these issues to be fast-tracked and to be dealt with in a holistic manner. I would like to suggest that the IMDA facilitate the setting up of a guild that would champion the interests of the freelance community. Singapore is too small, in my view, to have separate bodies representing writers or producers or camera crew. A media freelancers' guild would address issues, such as insurance, talent standards, payment, pipelines and structure. These have all been the bane of the freelance community for many years now, and the IMDA has to urgently help find solutions. Resolution of these issues would also help Singapore as a regional and global production hub, as international productions need a vibrant and quality freelance community to help support their projects."
2016-08-16-T-015-S-01046,2016-08-16-T-015,1046,Ganesh Rajaram,"Sir, in summary, the establishment of the IMDA is a timely move and will help Singapore better address the many challenges that convergence throws up. However, it is also an opportune time to relook and address some of the issues that have been around for a while now, as I have stated in my speech."
2016-08-16-T-015-S-01047,2016-08-16-T-015,1047,Ganesh Rajaram,"I would like to end my speech, Sir, by reaffirming my support for this Bill. Thank you."
2016-08-16-T-015-S-01048,2016-08-16-T-015,1048,Louis Ng Kok Kwang,"Sir, I welcome this move to better regulate the infocomm media sector, spur growth in the sector and, ultimately, create a globally-competitive infocomm media ecosystem for Singapore."
2016-08-16-T-015-S-01049,2016-08-16-T-015,1049,Louis Ng Kok Kwang,"I am particularly keen on IMDA's mandate to strengthen safeguards for consumers, highlighted in clause 61, as ordinary users are exposed to greater risks with the increasing use of infocomm platforms."
2016-08-16-T-015-S-01050,2016-08-16-T-015,1050,Louis Ng Kok Kwang,"I recall 15 years ago, when ACRES was first started, we bought a 56k dial-up modem and struggled to get connected to the Internet. Little did I anticipate that 15 years later, I can use a smartphone to take HD videos and, within seconds, send it to anyone anywhere in the world. Indeed, it is an understatement that the Internet has transformed our lives for the better."
2016-08-16-T-015-S-01051,2016-08-16-T-015,1051,Louis Ng Kok Kwang,"However, technology is a double-edged sword and I hope that while the agency promotes the use of the Internet and e-commerce, it can be accompanied by an equal measure of education on the risks they present. It should inform consumers on the rise in phishing and malware attacks."
2016-08-16-T-015-S-01052,2016-08-16-T-015,1052,Louis Ng Kok Kwang,"A case emerged in June this year involving a phishing email which pretended to be sent from DBS. When the attached zip file was opened, the malware it contains would immediately infect the customer's computer or device and steal its login and authorisation details."
2016-08-16-T-015-S-01053,2016-08-16-T-015,1053,Louis Ng Kok Kwang,"For many Singaporeans, they may fall prey to this tactic. I have heard many stories from my residents who have been misled by fraudsters to share sensitive personal data or unwittingly clicked on links which downloaded malware. With the pervasive use of data, I welcome efforts to continue promoting and regulating data protection through the Personal Data Protection Commission."
2016-08-16-T-015-S-01054,2016-08-16-T-015,1054,Louis Ng Kok Kwang,"In this regard, could the Minister clarify what further efforts will be put in place by the new agency with regard to the protection of personal data? Will the Minister step up outreach efforts to the public, and provide details on the methods it will employ?"
2016-08-16-T-015-S-01055,2016-08-16-T-015,1055,Louis Ng Kok Kwang,"Lastly, some of the functions of the agency include facilitating an adequate range of media services that serve the interest of the general public, ensuring that media services are provided at a high standard in all respects, particularly in respect of the quality, balance and range of subject matter of their content and ensuring that the content of media services is not against public interest, public order or national harmony, and does not offend against good taste or decency. In essence, the Authority will decide on behalf of the public amongst others, the range, quality and content of media services."
2016-08-16-T-015-S-01056,2016-08-16-T-015,1056,Louis Ng Kok Kwang,"Can the Minister clarify how the Authority will make these decisions and whether more public consultations can be conducted to ensure we better understand the interest of the general public? Sir, these concerns notwithstanding, I stand in support of the Bill."
2016-08-16-T-015-S-01057,2016-08-16-T-015,1057,Dr Yaacob Ibrahim,"Sir, let me thank all the hon Members who have spoken in support of the Bill and for their questions and comments."
2016-08-16-T-015-S-01058,2016-08-16-T-015,1058,Dr Yaacob Ibrahim,"First, Mr Darryl David asked about the dual role of IMDA in terms of infocomm media industry development and regulation. Sir, regulation and industry development are often two sides of the same coin. There can be significant synergies when a single organisation undertakes both regulation and industry development roles, as many of the policy trade-offs and discussions can take place concurrently."
2016-08-16-T-015-S-01059,2016-08-16-T-015,1059,Dr Yaacob Ibrahim,"Today, IDA and MDA are both regulators and developers of the infocomm and media sectors respectively, and we have found that this approach works well, and allows us to achieve an appropriate balance between development and regulation. We do in fact have a process in place for appointing diverse representatives from the industry, so that their perspectives are incorporated into decisions, while at the same time being mindful of potential conflicts of interest. A good example is Mr Ganesh Rajaram himself who is from the private sector sitting on the MDA board. So we remain open to the representatives that we will seek to sit on our boards so that our boards can be dynamic and timely in terms of their response."
2016-08-16-T-015-S-01060,2016-08-16-T-015,1060,Dr Yaacob Ibrahim,"Mr Zaqy Mohamad has asked for further elaboration and examples of how IMDA will develop the infocomm media industry. IDA and MDA are already working together to look into possible initiatives that will build on IDA's and MDA's strengths, and that will benefit the infocomm media industry as a whole."
2016-08-16-T-015-S-01061,2016-08-16-T-015,1061,Dr Yaacob Ibrahim,"Mr Darryl David asked about our approach to Pokemon Go and other cutting-edge mobile apps. I think we would be quite circumspect about expanding IMDA's regulatory ambit without being clear about our real concerns, and whether there are other levers to manage these disamenities or undesirable outcomes. So the advisory from the Police is about the right response at this point in time."
2016-08-16-T-015-S-01062,2016-08-16-T-015,1062,Dr Yaacob Ibrahim,"We must be mindful about not unnecessarily dampening the spirit of innovation that is so critical to the development of innovative products and services in this sector. The integration of IDA Labs, the Games Solution Centre and Creators' Space that I mentioned in my earlier speech is precisely intended to help develop exciting new ideas, such as the next Pokemon Go. There are many more projects in the pipeline. IDA's iSPRINT is today a very successful programme that helps SMEs raise their productivity through investments in infocomm. We can extend iSPRINT to the media SMEs to help them use infocomm technologies to raise productivity and grow faster. We will share more details of these efforts in the coming months."
2016-08-16-T-015-S-01063,2016-08-16-T-015,1063,Dr Yaacob Ibrahim,"I echo Mr Ganesh Rajaram's comments that freelancers are very important in the media industry. That is why MDA has been with the Association of Independent Producers (AIPRO) to encourage the adoption of industry best practices, such as including freelancers' insurance as a qualifying cost item in all PSB-funded productions in MDA's master agreement with Mediacorp. Moving forward, IMDA will also look into ways to support freelancers better, including his suggestion of setting up a freelancers guild."
2016-08-16-T-015-S-01064,2016-08-16-T-015,1064,Dr Yaacob Ibrahim,"Besides developing talent, amidst changing media consumption habits, we must continue to have good quality local programmes for Singaporeans to enjoy, build strong capabilities in the production of these local content, and develop effective channels that stay relevant. The IMDA will continue to encourage this through the Public Service Broadcasting (PSB). PSB funds do not just fund Mediacorp programmes, but also support the growth of the independent media sector through outsourcing."
2016-08-16-T-015-S-01065,2016-08-16-T-015,1065,Dr Yaacob Ibrahim,"Mr Ganesh Rajaram commented on the importance of transparency in PSB funding. Sir, MDA has in place today a framework to ensure that the PSB funds are well spent. We conduct regular audits of PSB funding expenditure to ensure that the funding agreements are adhered to, and that proper processes and internal controls are in place. Since 2013, we have set aside some PSB funding for independent producers. The PSB Contestable Fund Scheme (PCFS) which was mentioned by Mr Ganesh Rajaram is also open to all local production companies to enable the commissioning and the development of innovative content with public service value."
2016-08-16-T-015-S-01066,2016-08-16-T-015,1066,Dr Yaacob Ibrahim,"Mr Zaqy Mohamad asked how IMDA will encourage infocomm media professionals to develop their skills and competencies. Sir, I announced the new TechSkills Accelerator (TeSA) at this year's Committee of Supply to develop the infocomm manpower capabilities. Through TeSA, which is an initiative under SkillsFuture, we can better plan, coordinate and enable the development of ICT professionals. We have made it a point to partner major employers for TeSA, because employers must buy into our efforts to build a strong Singaporean core. There has been considerable progress since my announcement of TeSA in April this year. In fact, earlier this month, IDA launched an industry consultation for its first draft of the ICT Skills Framework under TeSA. IDA has also been engaging key industry players at the senior management level and they have expressed strong support for TeSA."
2016-08-16-T-015-S-01067,2016-08-16-T-015,1067,Dr Yaacob Ibrahim,"Besides TeSA, IMDA will also launch several exciting projects to nurture a generation of digital natives in time to come. For example, the existing ICT Learning Roadmap will be augmented to include key media domains, such as storytelling, into an Infocomm Media Learning Roadmap. This roadmap will encourage Singaporeans to develop skills that are valuable in today's digital age."
2016-08-16-T-015-S-01068,2016-08-16-T-015,1068,Dr Yaacob Ibrahim,"IMDA will also be developing the Media Skills Framework for key job roles, which include current and emerging skills maps that indicate competencies for each occupational level and career progression pathways. This will help to encourage employers to hire talent based on skills and competencies, rather than academic qualifications."
2016-08-16-T-015-S-01069,2016-08-16-T-015,1069,Dr Yaacob Ibrahim,"On this point, I thank Mr Darryl David for his suggestion to look into harmonising degree and non-degree employment practices for infocomm media professionals. We will work closely with the relevant agencies such as MOM and MOE, as was suggested."
2016-08-16-T-015-S-01070,2016-08-16-T-015,1070,Dr Yaacob Ibrahim,"Sir, I also like to thank Mr Zaqy Mohamad, Mr Ganesh Rajaram, Mr Louis Ng and Mr Kok Heng Leun for their questions and comments about arts and content regulation, including content classification policy. Our regulatory framework in this area has always been guided by three fundamental principles  protect the young while providing more choices for adults; reflect community values and support racial and religious harmony; and safeguard national and public interest."
2016-08-16-T-015-S-01071,2016-08-16-T-015,1071,Dr Yaacob Ibrahim,"These principles still remain relevant in a rapidly changing media landscape. IMDA will continue to regulate content, while ensuring that guidelines are in line with community values and social norms. The relevant regulatory provisions will be found in subject-specific legislations such as the Broadcasting Act, the Films Act, the Undesirable Publications Act and the Public Entertainments and Meetings Act."
2016-08-16-T-015-S-01072,2016-08-16-T-015,1072,Dr Yaacob Ibrahim,"I would like to make a few points on suggestions raised by the Nominated Member Mr Kok Heng Leun. I wish to assure Mr Kok that IMDA will continue to take seriously its role in promoting creativity and content creation as has been done by MDA thus far. As a content regulator, MDA will take into account community values before deciding on the classification, in order to strike a balance between the artistic merits of the performance and broader social norms. In so doing, IMDA will be as transparent as possible."
2016-08-16-T-015-S-01073,2016-08-16-T-015,1073,Dr Yaacob Ibrahim,"For the Les Miserables example raised, I have already given my written response to the Nominated Member Mr Kok's Parliamentary Question. In short, MDA reviewed the feedback and established that the organiser had failed to inform MDA of a particular scene that had an impact on the classification rating. This was conveyed to the organiser, who decided to remove the scene on its own volition."
2016-08-16-T-015-S-01074,2016-08-16-T-015,1074,Dr Yaacob Ibrahim,"MDA also strives to inform organisers of its decision early, once all the supporting information and materials are received and processed. In a small number of cases, more time may be needed to assess the content due to its sensitive or controversial nature. In the photography exhibition ""I Know Why The Rebel Sings"", MDA informed the organiser of its concerns as soon as MDA determined, after consultation, that the exhibition contained photographs of members from a terrorist-linked organisation who had committed acts of violence to further their cause, such as suicide bombing. MDA then conveyed clearly to the organiser that Singapore takes a firm stand against extremism, and would not allow photographs that undermine public order or national interest or security to be displayed."
2016-08-16-T-015-S-01075,2016-08-16-T-015,1075,Dr Yaacob Ibrahim,"Mr Louis Ng shared his concerns on the protection of personal data. We recognise that many companies collect and hold personal data, and it is important that they put in place measures to protect their customers' personal data. The PDPC has undertaken many outreach activities to promote awareness of personal data protection in Singapore. The PDPC has also released a number of advisory guidelines, such as on securing personal data on electronic medium, so that companies have practical tips and resources to help them adopt better ICT security measures."
2016-08-16-T-015-S-01076,2016-08-16-T-015,1076,Dr Yaacob Ibrahim,"Moving ahead, the PDPC will update their existing guidelines and also issue new guidelines and resources to help our companies, so that they can put in place better measures to protect their customers' personal data. Mr Ng also raised an important point about instances of Singaporeans falling prey to phishing and malware attacks. Raising awareness of cybersecurity, and heightening Singaporeans' vigilance against online cybercrime is something that all of us have to work together to achieve. IMDA will play a role as part of its outreach efforts, alongside partners such as the Cyber Security Agency of Singapore, schools, and our law enforcement agencies."
2016-08-16-T-015-S-01077,2016-08-16-T-015,1077,Dr Yaacob Ibrahim,"Finally, I thank Mr Zaqy Mohamad and Mr Ganesh Rajaram for commenting on the process of securing coverage of major sporting events – the Olympic Games being the topical case in point."
