speech_id,topic_id,speech_order,member_name,text
2016-08-16-T-001-S-00001,2016-08-16-T-001,1,Chia Shi-Lu,"asked	 the Acting Minister for Education (Higher Education and Skills) in light of increasing incidents of sexually offensive and ""sexualised"" activities during orientation activities at the National University of Singapore over the last decade (a) what are the regulations in place to protect students in our tertiary institutions from physical abuse and harassment; (b) whether these regulations are standardised across our polytechnics and universities; (c) what checks and enforcement are in place to ensure that the regulations are adhered to; (d) how many students or staff have been found guilty and have had to face disciplinary action and how were they punished; and (e) whether any civil or criminal suits had been filed as a result."
2016-08-16-T-001-S-00002,2016-08-16-T-001,2,Zaqy Mohamad,asked	 the Acting Minister for Education (Higher Education and Skills) (a) whether the Ministry has a code of conduct to prohibit sexually inappropriate or degrading activities in institutions of higher learning and schools; (b) what measures have been taken to ensure adequate oversight by university staff on students organising such activities; (c) how many complaints has the Ministry received in the past five years and what actions have been implemented to prevent recurrence; and (d) why safeguards have not been put in place to prevent the recent incident in the National University of Singapore.
2016-08-16-T-001-S-00003,2016-08-16-T-001,3,Cheng Li Hui,asked	 the Acting Minister for Education (Higher Education and Skills) in light of the reports of sexual harassment and abuse during orientation activities at the National University of Singapore (a) whether the Ministry has been monitoring this situation in all our tertiary institutions and keeping track of the number and nature of incidents reported; and (b) whether resources have been provided to our institutions to ensure the safety of our students.
2016-08-16-T-001-S-00004,2016-08-16-T-001,4,Gan Thiam Poh,asked	 the Acting Minister for Education (Higher Education and Skills) with regard to the incidents of sexual harassment and physical abuse during orientation activities at the National University of Singapore (a) what are the existing guidelines for orientation activities and whether students/staff have been properly advised and guided; (b) how many complaints on such lewd orientation activities has each of our tertiary institutions received annually in the last 10 years; (c) what measures have been taken by the respective institutions to prevent such abuses by the students or staff who organised the orientation; and (d) how many students or staff have repeatedly been found to be responsible for such orientation activities.
2016-08-16-T-001-S-00005,2016-08-16-T-001,5,Chia Shi-Lu,Question No 1.
2016-08-16-T-001-S-00006,2016-08-16-T-001,6,Desmond Lee,"Mdm Speaker, I am informed that the Acting Minister for Education (Higher Education and Skills) is on his way into this House and he seeks Mdm Speaker's indulgence to allow him to respond when he returns to the Chamber."
2016-08-16-T-001-S-00007,2016-08-16-T-001,7,Speaker,You are seeking approval for the questions to be responded to later?
2016-08-16-T-001-S-00008,2016-08-16-T-001,8,Desmond Lee,"Mdm Speaker, he has informed me that he would like to request for him to respond to Question Nos 1 to 4 on the Order Paper, after some of the questions there after have been responded to, as he is on his way to the Chamber. So, seeking your indulgence, Madam."
2016-08-16-T-001-S-00009,2016-08-16-T-001,9,Speaker,"Deputy Leader, let me draw your attention to Standing Order 22(4), which states, ""If a Minister, Parliamentary Secretary or other Member, who is to answer a question, is absent, the question shall, if he then be present, be taken after all other questions appearing on the Order Paper have been disposed of."""
2016-08-16-T-001-S-00010,2016-08-16-T-001,10,Speaker,"This basically means that he can only respond to the questions after Question No 61 has been disposed of. This is not possible within today's Sitting. Is there any other Member present who can answer these questions? [Please refer to the ""Written Answers to Oral Answers Not Answered by 3.00 pm"" section for the answers to Question Nos 1-4]"
2016-08-16-T-001-S-00011,2016-08-16-T-001,11,Speaker,"If not, I will have to move on to Question No 5."
2016-08-16-T-001-S-00012,2016-08-16-T-001,12,Charles Chong,Question No 5.
2016-08-16-T-002-S-00013,2016-08-16-T-002,13,Charles Chong,"asked	 the Minister for National Development what measures the Ministry intends to take to better safeguard public monies and residents' service and conservancy payments to Town Councils and to recover any improper past payments made by Aljunied-Hougang Town Council (AHTC), especially in light of the July 2016 KPMG report on AHTC's financial controls and systems."
2016-08-16-T-002-S-00014,2016-08-16-T-002,14,Desmond Lee,"In its July 2016 report, KPMG reported a total of 185 control failures in AHTC. This comprises 115 identified by AHTC's statutory auditors and the Auditor-General's Office (AGO) in previous audits, and an additional 70 control failures uncovered by KPMG. KPMG concluded that AHTC's control failures were ""pervasive, cutting across the key areas of governance, financial control, financial reporting, procurement and records management over the course of five years""."
2016-08-16-T-002-S-00015,2016-08-16-T-002,15,Desmond Lee,"To recap, AHTC had received qualified financial statements from its own independent auditors for four consecutive financial years since FY2011. AHTC's auditors were unable to determine the accuracy of the Town Council's various balances, expenses and receivables, including those relating to their Service & Conservancy Charges (S&CC). There were also other audit observations, including late Sinking Fund transfers, incorrect usage of Sinking Funds, as well as inadequate disclosure and segregation of duties over related party transactions."
2016-08-16-T-002-S-00016,2016-08-16-T-002,16,Desmond Lee,"When AGO undertook a special audit on the Town Council in 2014, it similarly found lapses in the Town Council's management of Sinking Funds, governance of related party transactions, management of S&CC arrears, internal controls and procurement, as well as inadequacies in their record management and accounting system."
2016-08-16-T-002-S-00017,2016-08-16-T-002,17,Desmond Lee,"When AGO's Report was debated in Parliament in February last year, the Town Council's then-Chairman and her fellow Town Councillors assured us that they had ""already taken concrete steps to address and remedy many of the issues."""
2016-08-16-T-002-S-00018,2016-08-16-T-002,18,Desmond Lee,"More than a year has passed but the Town Council appears to have made little progress. KPMG had noted in its July 2016 report that only a few of the remediation steps that AHTC had said they would do, had been completed. While AHTC had indicated that they aimed to complete the remediation works in 15 months, that is, starting from July 2016, KPMG estimates that at the current rate of progress, the remediation process will take at least 18 months."
2016-08-16-T-002-S-00019,2016-08-16-T-002,19,Desmond Lee,"Instead of completing the remediation plans expeditiously, what we have seen from the Town Council in this past one and a half years is a series of actions that have only slowed down, prolonged and frustrated the whole process."
2016-08-16-T-002-S-00020,2016-08-16-T-002,20,Desmond Lee,"First, the Town Council attempted to avoid having one of the Big Four firms appointed as its independent accountant."
2016-08-16-T-002-S-00021,2016-08-16-T-002,21,Desmond Lee,"The Town Council also rejected the joint appointment of accountant with Pasir Ris-Punggol Town Council (PRPTC) to review AHTC's past payments in relation to Punggol East (PE), and when PRPTC appointed its own accountant, the Town Council refused to grant access to documents or to attend the coordination meetings called by HDB with all parties to try to resolve the impasse. This pattern of behaviour is all the more worrying when set against what KPMG had stated in its July 2016 report, that the remediation of the control failures will require that the Town Councillors engage to ""reset the tone at the top of AHTC, emphasising competence and accountability""."
2016-08-16-T-002-S-00022,2016-08-16-T-002,22,Desmond Lee,"Apart from AHTC's slow progress in remedying the control failures, MND is also concerned with various systemic control failures that KPMG's latest report has highlighted, including"
2016-08-16-T-002-S-00023,2016-08-16-T-002,23,Desmond Lee,"First, the extensive use of manual journal entries that bypassed AHTC's accounts payable module, for payments totalling more than $60 million. KPMG has flagged this as ""highly irregular"" and ""makes effective oversight of payments by the Finance Department practically impossible""."
2016-08-16-T-002-S-00024,2016-08-16-T-002,24,Desmond Lee,"Second, temporary clearing accounts which were not investigated or cleared, containing transactions amounting to over $648,000 in total."
2016-08-16-T-002-S-00025,2016-08-16-T-002,25,Desmond Lee,"Third, the use of dummy codes which might not update payee records in the Accounting System, for transactions amounting to over $270,000 in total."
2016-08-16-T-002-S-00026,2016-08-16-T-002,26,Desmond Lee,"These control failures continue to paint a serious state of affairs in AHTC and are a cause for concern. KPMG noted that these control failures could conceal duplicate, fictitious or fraudulent payments, which could have been made without being detected."
2016-08-16-T-002-S-00027,2016-08-16-T-002,27,Desmond Lee,"As ordered by the Court of Appeal, KPMG is currently reviewing the past payments made by the Town Council to ascertain whether any were improperly made, and therefore ought to be recovered. The findings are due on 31 August 2016, the end of this month."
2016-08-16-T-002-S-00028,2016-08-16-T-002,28,Desmond Lee,"MND asked AHTC to cooperate fully with the accountants to carry out a thorough and robust review of the past payments. The matter has dragged on for many years, with multiple court hearings and not much actual progress made. For four Financial Years consecutively, AHTC has not had accounts that passed accountants' muster. This is accurately summed up by the Auditor-General in his report that ""there was no assurance that the accounts are accurate or reliable, or that public funds had been properly spent, accounted for or managed""."
2016-08-16-T-002-S-00029,2016-08-16-T-002,29,Desmond Lee,"Residents of Aljunied, Hougang and also Punggol East need to be assured as to whether or not there were any improper past payments that ought to be recovered. The Singaporean public also needs to know as public monies and grants are at stake."
2016-08-16-T-002-S-00030,2016-08-16-T-002,30,Desmond Lee,"MND and HDB will be studying the accountants' subsequent findings carefully, and will take the necessary and appropriate actions to ensure that residents' interest are safeguarded and that any improper past payments are duly recovered."
2016-08-16-T-002-S-00031,2016-08-16-T-002,31,Charles Chong,"Mdm Speaker, supplementary questions. The Minister for National Development had said that MND will be reviewing the Town Councils Act. Can the Senior Minister of State tell us when this review will be completed, and if MND would consider including it in the Act penalties for wilful acts of concealment or non-cooperation with MND, HDB or other agencies which result in MND, HDB or other agencies being unable to detect or assess financial transactions which may be of public interest, or of non-compliance with the Act?"
2016-08-16-T-002-S-00032,2016-08-16-T-002,32,Charles Chong,"Will the Minister also consider including in the Town Councils Act provisions to enable MND, HDB or other agencies to compel Town Councils and their contractors to provide records in the event of non-cooperation by Town Councils or their agents in connection with investigations into the affairs of Town Councils?"
2016-08-16-T-002-S-00033,2016-08-16-T-002,33,Desmond Lee,"Madam, I thank the Member for his questions. The Town Councils Act review is on-going and we aim to complete the review by the year. As the then Minister for National Development Mr Khaw Boon Wan had articulated, I believe at the opening of the parliamentary debate of the Auditor-General's report, he said that the Town Council Act review ought to focus on three areas, principally  first, it would make clear that Town Councils are subordinate to and must comply with public authorities charged with public duties; second, to strengthen the Town Councils' corporate governance and financial accountability framework; and third, to strength MND's regulatory oversight and the powers to obtain information, and to conduct investigations, as well as to look at the overall penalty framework. In that sense, we will look at the Member's suggestions in the course of this review. I think I have addressed his questions."
2016-08-16-T-002-S-00034,2016-08-16-T-002,34,Zainal Sapari,"Given that MND is doing a review of the Town Councils Act, would MND consider setting a reasonable timeframe and deadline for the preparation and submission of audited financial statements or distribution of assets and liabilities after each political boundary change?"
2016-08-16-T-002-S-00035,2016-08-16-T-002,35,Desmond Lee,"Mdm Speaker, this is an area that we will look at in the course of the Town Councils Act review. In particular, we will further look at the hand-over process. We understand that when boundaries change, especially across political lines, delays in submission of accounts and documents may impact the financial audits of the receiving Town Council. This is certainly something that we need to look at in the course of this review."
2016-08-16-T-002-S-00036,2016-08-16-T-002,36,Pritam Singh,"Can the Senior Minister of State confirm if the joint appointment of accountants was required by the Court of Appeals in CA114 of 2015, or the HDB had included it as a prayer to the Court of Appeal at any point in time."
2016-08-16-T-002-S-00037,2016-08-16-T-002,37,Desmond Lee,"Madam, the Court of Appeal order was against the Aljunied-Hougang-Punggol East Town Council, as the Member would be aware, along with the former Chairman because they were involved in the proceedings. This Aljunied-Hougang-Punggol East Town Council (AHPETC) no longer exists in its previous form as a legal entity. Instead, because of the intervening General Elections, Punggol East was carved out and handed over to Pasir Ris-Punggol Town Council (PRPTC) and became part of that entity."
2016-08-16-T-002-S-00038,2016-08-16-T-002,38,Desmond Lee,"So, based on the Town Councils declaration order, we are advised that this means that all the rights, obligations and liabilities of Punggol East then flow on to its successor organisation. In that sense, the accounts that relate to AHPETC are in relation to now what would be AHTC, which is one successor, and PRPTC which is the other successor in respect of the Punggol East portion. So, that makes sense. The orders then need to be applied to all the entities for which the issues of AGO and all the Foo Kon Tan reports, and indeed the nub of the discussion in Parliament, they all relate to the former AHPETC. In that sense, both were required to comply with the Court order, which was initially at AHPETC."
2016-08-16-T-002-S-00039,2016-08-16-T-002,39,Desmond Lee,We are given to understand that PRPTC wanted to discuss the issue of appointment because they wanted to have some coordination and efficiency because essentially they are looking not just at Punggol East or AHTC but looking at the whole previous entity and how they inter-relate. I think that makes sense. We are also given to understand that there was an attempt to then appoint a joint accountant but without success.
2016-08-16-T-002-S-00040,2016-08-16-T-002,40,Desmond Lee,"In order to assist in Members' understanding of the question that the Member asked, allow me to take this House and Members through what we understand had happened. Following the Court of Appeal judgment, AGC, on behalf of HDB, had written to AHTC and Pasir Ris-Punggol Town Council (PRPTC) on 4 December 2015. AGC had highlighted the importance of appointing accountants that could competently execute the duties envisaged by the Court of Appeal's orders, given the complexity of the work entailed. HDB suggested that the accountant be from the Big Four accounting firms. And to avoid duplication of effort, competing access to documents and incurring of costs, HDB also asked both Town Councils to consider making a joint appointment of accountants. And that is the genesis of the Member's question."
2016-08-16-T-002-S-00041,2016-08-16-T-002,41,Desmond Lee,"On 4 December 2015, AHTC, however, nominated Business Assurance, while Pasir Ris-Punggol Town Council sought to jointly appoint PwC with AHTC on 15 December 2015. When asked to reconsider its nomination, AHTC had applied to the Court of Appeal for directions on the issue of appointment. AHTC also did not respond to HDB's subsequent queries on Business Assurance's experience and expertise, for example, their years of experience in the relevant areas of audit and the latest Practice Monitoring Programme (PMP) inspection results."
2016-08-16-T-002-S-00042,2016-08-16-T-002,42,Desmond Lee,"The Court of Appeal later directed AHTC to file an affidavit to respond to HDB's queries by 11 January 2016. On the day of the deadline, AHTC had filed the response but instead of answering HDB's questions on Business Assurance's experience and competence, AHTC said that Business Assurance had withdrawn due to ""intense media scrutiny"", that since Business Assurance had withdrawn, it was no longer necessary to provide the information on Business Assurance and that the Town Council had nominated a new firm, MRI Moores Rowland instead."
2016-08-16-T-002-S-00043,2016-08-16-T-002,43,Desmond Lee,"On the night of 19 January 2016, the night before the next Court of Appeal hearing, AHTC wrote to the Court to state that MRI Moores Rowland had also withdrawn on 17 January 2016. So, this was 19 January; the date they had withdrawn was on 17 January. But no reasons were given. The latest development was also not mentioned in AHTC's two affidavits by the Chairman, I believe, on 18 January 2016. At the Court of Appeal hearing on 20 January 2016, it emerged that Business Assurance withdrew because it did not want to reveal its PMP inspection findings. This led the Court of Appeal to raise concerns about whether the Court had been apprised of all the facts in a candid and forthright manner and whether the Town Council had in place a system to ensure due diligence in selecting candidates to do this work."
2016-08-16-T-002-S-00044,2016-08-16-T-002,44,Desmond Lee,The Court of Appeal eventually heard evidence on 22 January 2016 that both of AHTC's nominated firms of accountants each had a member who had failed ACRA's PMP inspection.
2016-08-16-T-002-S-00045,2016-08-16-T-002,45,Desmond Lee,"Agreeing that AHTC's nomination approach suggested a lack of rigour and basic due diligence, the Court of Appeal then directed AHTC to appoint one of the Big Four firms as the matter was of public interest and involved public funds."
2016-08-16-T-002-S-00046,2016-08-16-T-002,46,Desmond Lee,"That is where I come from, as background, to the response to the Member's question. On 1 March 2016, AHTC then announced that they have appointed KPMG LLP with HDB's consent ‒ HDB consented because it is one of the Big Four ‒ to perform the task ordered by the Court of Appeal."
2016-08-16-T-002-S-00047,2016-08-16-T-002,47,Desmond Lee,"After KPMG's appointment was announced by AHTC, PRPTC informed HDB on 3 March 2016 that it wished to appoint KPMG jointly with AHTC, but later updated HDB that AHTC was not agreeable. It was in this context that HDB agreed to PRPTC's appointment of a different set of accountants, namely, PwC to carry out its Court of Appeal orders. To ensure that the reviews were carried out efficiently and effectively, HDB invited both Town Councils and both sets of auditors to a meeting in June to discuss the implementation details, such as scope and timeline, but AHTC twice declined to attend as it did not agree that PRPTC was bound by the Court of Appeal order, precisely what the Member has asked earlier in relation to Punggol East. AHTC also did not give PRPTC access to the documents of Punggol East and requested that HDB seek clarification from the Court of Appeal first."
2016-08-16-T-002-S-00048,2016-08-16-T-002,48,Desmond Lee,"On 8 July 2016, the Court of Appeal ruled that PRPTC, on behalf of Punggol East, had an interest in the outcome of the work carried out by KPMG and because the issue of joint appointment, as the Member had alluded to, was already moot by then, the Court of Appeal directed that the two accountants communicate directly with each other to provide each other access as may reasonably be required to safeguard each other's interests."
2016-08-16-T-002-S-00049,2016-08-16-T-002,49,Speaker,"Yes, Ms Sylvia Lim."
2016-08-16-T-002-S-00050,2016-08-16-T-002,50,Sylvia Lim,"Thank you, Madam. Madam, if I could make some clarifications on what the Senior Minister of State has just said and also ask him a few supplementary questions."
2016-08-16-T-002-S-00051,2016-08-16-T-002,51,Sylvia Lim,"The first clarification to make is that the Senior Minister of State mentioned in his answer earlier that AHTC had been reluctant to appoint a Big Four firm but based on his answer, I think he will confirm that the requirement to appoint a Big Four firm was only clarified in January this year when the Court of Appeal subsequently explained further its view on the matter, on which accounting firm it felt was suitable."
2016-08-16-T-002-S-00052,2016-08-16-T-002,52,Sylvia Lim,"Secondly, the issue of whether Pasir Ris-Punggol Town Council is required to comply with the judgment, I think he would be aware that at the recent hearing, the Court of Appeal declined to answer that question and, in fact, we are going to court again this Thursday for some further clarification. So, that matter is really in one sense, in a way, sub judice as well. And at the last hearing, Pasir Ris-Punggol Town Council did not attend, so we were not able to move further on that matter."
2016-08-16-T-002-S-00053,2016-08-16-T-002,53,Sylvia Lim,"Next, I would just like to clarify also Mr Charles Chong's question to the Minister. I am not sure whether Mr Charles Chong is accusing AHTC of wilful concealment of any documents. If he is, we utterly reject that."
2016-08-16-T-002-S-00054,2016-08-16-T-002,54,Sylvia Lim,"Now, supplementary question for the Senior Minister of State. I understand that the Ministry annually requires Town Councils to submit not just their financial statements but also their management letters issued by the auditors to each Town Council. We appreciate all this attention on us and how bad we are. But in order for us to get a proper perspective, is MND saying that the auditors of the other Town Councils have not picked up control failures in the other Town Councils since MND is receiving these annual management letters as the regulatory Ministry. Certainly, would —"
2016-08-16-T-002-S-00055,2016-08-16-T-002,55,Speaker,"Ms Lim, please keep your clarifications short."
2016-08-16-T-002-S-00056,2016-08-16-T-002,56,Sylvia Lim,"Yes. Two more questions, Madam."
2016-08-16-T-002-S-00057,2016-08-16-T-002,57,Sylvia Lim,"Secondly, would MND be prepared to share the findings regarding the other Town Councils with us or with the public so that we can better benchmark ourselves and perhaps adopt some of the best practices that may be available in the other Town Councils?"
2016-08-16-T-002-S-00058,2016-08-16-T-002,58,Sylvia Lim,"Last of all, Madam, it was interesting to me that when KPMG issued their first report in April 2016, and shortly after that in May, the Senior Minister of State himself actually sent a circular to all Town Council Chairmen attaching some slides and saying that Town Councils might want to use these slides to brief their Town Councillors on their roles and responsibilities, especially the key committees involved in finance and governance. This email came out of the blue. I have not seen such an email for the years that I had been —"
2016-08-16-T-002-S-00059,2016-08-16-T-002,59,Speaker,"Your clarification, Ms Lim?"
2016-08-16-T-002-S-00060,2016-08-16-T-002,60,Sylvia Lim,"So, I would like to ask the Senior Minister of State whether this email was actually prompted by the KPMG report and a concern by the Ministry that perhaps other Town Councils also need to get themselves better organised."
2016-08-16-T-002-S-00061,2016-08-16-T-002,61,Desmond Lee,"I thank the Member for her questions. On the second question, the email which sent some slides, basically, it flows from the concerns that have arisen with regard to the AHTC and AHPETC issues. We wanted to send out information to make sure that all Town Councillors, not just AHTC, were on the same footing and would have this information, especially since we are on a new term, after the GE."
