speech_id,topic_id,speech_order,member_name,text
2016-04-12-T-001-S-00001,2016-04-12-T-001,1,,[(proc text) Order read for consideration in Committee of Supply [5th Allotted Day]. (proc text)]
2016-04-12-T-002-S-00002,2016-04-12-T-002,2,,"[(proc text) Resumption of Debate on Question [11 April 2016], (proc text)]"
2016-04-12-T-002-S-00003,2016-04-12-T-002,3,,"[(proc text) ""That the total sum to be allocated for Head W of the Estimates be reduced by $100."" – [Mr Sitoh Yih Pin]. (proc text)]"
2016-04-12-T-002-S-00004,2016-04-12-T-002,4,,[(proc text) Question again proposed. (proc text)]
2016-04-12-T-002-S-00005,2016-04-12-T-002,5,Khaw Boon Wan,"Mdm Chair, let me first express my deepest condolences to the families of Mr Nasrulhudin Najumudin and Mr Muhammad Asyraf Ahmad Buhari. They lost their lives while working for SMRT on 22 March 2016. The thoughts and prayers of the entire transport family are with their families."
2016-04-12-T-002-S-00006,2016-04-12-T-002,6,Khaw Boon Wan,"The tragedy was a massive blow to all of us. SMRT has completed its internal investigation and its findings are being reviewed by independent experts. LTA is conducting its own investigation. Statutory investigations by the Police and the Ministry of Manpower (MOM) are on-going. There will be a Coroner's Inquiry in due course. Within the legal constraints, I will share what I can."
2016-04-12-T-002-S-00007,2016-04-12-T-002,7,Khaw Boon Wan,"Our priorities are to establish the cause of the incident and prevent a recurrence. The investigations will ascertain whether the problem was inadequate safety procedures, or if there were human lapses in the execution of such procedures. If the investigations reveal human errors, those responsible will be held to account."
2016-04-12-T-002-S-00008,2016-04-12-T-002,8,Khaw Boon Wan,"Workplace safety is the responsibility of the operator. When an industrial accident happens, MOM will usually issue a stop-work order and only allow work to resume when investigations are completed. But rail operations and maintenance have to go on. So, even as investigations are on-going, MOM, in consultation with LTA, found it prudent to issue interim safety orders to SMRT to ensure the safety of railway workers and commuters. LTA has shared the same instructions with SBST for compliance."
2016-04-12-T-002-S-00009,2016-04-12-T-002,9,Khaw Boon Wan,"In addition, SMRT has set up a safety review committee with experts drawn from international transport operators. I have directed LTA to also work with SMRT to thoroughly review its safety-related procedures. Our common objective is to prevent such an accident from occurring again."
2016-04-12-T-002-S-00010,2016-04-12-T-002,10,Khaw Boon Wan,"Mdm Chair, transport not only affects our productivity but also our living environment, social fabric and our quality of life. It is dynamic, constantly evolving as it shapes our life and, in turn, we re-shape it to make our life better. I appreciate the comments of Mr Sitoh Yih Pin and Mr Zaqy Mohamad on the future of transport in Singapore."
2016-04-12-T-002-S-00011,2016-04-12-T-002,11,Khaw Boon Wan,"Let me share my take on this subject. I see four major drivers behind our transport's continuing evolution. First, emergence of new technology, such as driverless vehicles, with wide implications on many existing jobs. Second, introduction of new business models, such as the sharing economy and its current manifestation through Uber and Grab, which benefit commuters but are disrupting the incumbents. Third, continuing greying of our population and the need to ensure that our city is silver-friendly while promoting active ageing to add healthy years to our life. Fourth  greater urgency to protect our environment through reducing our carbon footprint."
2016-04-12-T-002-S-00012,2016-04-12-T-002,12,Khaw Boon Wan,"These driving forces are already changing our transport sector in significant ways. We do not yet know how exactly the future will pan out but we can be sure that transport in, say, 2030 will be very different from today."
2016-04-12-T-002-S-00013,2016-04-12-T-002,13,Khaw Boon Wan,"We use ""a car-lite Singapore"" to describe this future, but we know it is inadequate to characterise it as just about roads and cars. Transport 2030 is much more; it is also about active mobility, high quality first-and-last-mile connectivity, smart and on-demand point-to-point transport options, greater pedestrianisation, more opportunities to appreciate on foot our rich city heritage and greenery, and very much more."
2016-04-12-T-002-S-00014,2016-04-12-T-002,14,Khaw Boon Wan,"It will be an exciting future. Singapore's transformation in the past 50 years has given us a solid foundation to make a quantum leap forward. Changes will be incremental but, over 15 years, we shall collectively experience a quantum leap. Actually, 2030 is not far off. Our SG50 babies will only be in Secondary school by then."
2016-04-12-T-002-S-00015,2016-04-12-T-002,15,Khaw Boon Wan,"Unlike our generation, learning to drive may well be a thing of the past, let alone owning four wheels. The Japanese have already begun to observe their young's loss of interest in cars. They even coined a Japanese phrase for this phenomenon  ""kuruma banare"", meaning ""demotorisation""."
2016-04-12-T-002-S-00016,2016-04-12-T-002,16,Khaw Boon Wan,"Indeed, why is there a need to own a car when you can easily summon up a driverless pod with a few strokes on your mobilephone? Private cars will likely start to go the way of horse carriages, if not in 15 years, definitely in 20 or 25 years' time. So, I agree with Mr Sitoh and Mr Zaqy Mohamad that we need to prepare Singapore, Singaporeans and our industries for this brave new world. We need to start making adjustments and mental preparations now."
2016-04-12-T-002-S-00017,2016-04-12-T-002,17,Khaw Boon Wan,"Over the current term of Government, the Ministry of Transport (MOT) will progressively put forward the legislative and policy pieces to prepare us for this exciting transformation. We need to discuss what to do and which to do first. For this first Committee of Supply of mine as Minister for Transport, I wish to cover three areas."
2016-04-12-T-002-S-00018,2016-04-12-T-002,18,Khaw Boon Wan,"First, how to enhance accessibility for commuters in particular, how to make it hassle-free for commuters to move from their homes to the nearest train station or bus stop? We crystallise this as First-and-Last-Mile Connectivity. We have taken some initial steps but these are not enough. Our First-and-Last-Mile Connectivity must make a quantum leap, to be among the best in the world."
2016-04-12-T-002-S-00019,2016-04-12-T-002,19,Khaw Boon Wan,"Currently, many other cities, like Amsterdam and Copenhagen, do a better job than us. We must close the gap and be better, particularly because we live in the tropics with hotter and wetter weather. Senior Minister of State Josephine Teo will outline our approach on First-and-Last-Mile Connectivity and, within that framework, she will respond to the recent recommendations of Parliamentary Secretary Muhammad Faishal Ibrahim's Active Mobility Advisory Panel (AMAP)."
2016-04-12-T-002-S-00020,2016-04-12-T-002,20,Khaw Boon Wan,"Second, how to enhance point-to-point transport options for commuters? The sharing economy and, in particular, new business models like Grab and Uber, are benefiting commuters globally. But they are disrupting existing business models of taxi-operators, with impact on taxi-drivers, Uber, in particular, is causing havoc in many cities. Many countries have taken the wrong turn by banning Uber. We should not obstruct innovation, especially when it benefits commuters. We should be mindful of the disruption to incumbents and help incumbents make the correct adjustments. We should seek to achieve win-win for both the disrupters and the incumbents, with commuter welfare as the underpinning principle. It can be done. Later, Senior Minister of State Ng Chee Meng will outline our approach to this development."
2016-04-12-T-002-S-00021,2016-04-12-T-002,21,Khaw Boon Wan,"Third, how to achieve excellence in public transport, especially in rail? This is a crucial piece if we are to become car-lite. As pointed out by Mr Sitoh and Mr Zaqy Mohamad, our current car-dominant transport model is not sustainable, given our land constraints. It needs to be replaced by one that has, as its foundation, an excellent public transport system which is reliable, convenient and smart."
2016-04-12-T-002-S-00022,2016-04-12-T-002,22,Khaw Boon Wan,"Central to this vision is a reliable rail network. This has been one of my top priorities. I heard Mr Dennis Tan's comments on train faults and breakdowns. Our train workers are doubling their efforts. I meet them regularly, above-ground and underground. They, too, want our MRT to be the best. They are putting in their best. I thank them and I cheer them on. Please give them your support, too. We certainly should not unwittingly demoralise them."
2016-04-12-T-002-S-00023,2016-04-12-T-002,23,Khaw Boon Wan,"Six months into the job, my sense is that we are making some improvements. Last year, trains on the MRT network travelled an average of 133,000 train-km between delays of more than five minutes. This is what we call ""mean kilometre before failure"" (MKBF), a common reliability measure widely used globally. The figure of 133,000 km is way below Hong Kong Mass Transit Railway's MKBF of 300,000 km. But it is a significant improvement of about 40% from 2014 of 93,000 km. So, in two years, we have improved from 93,000 km to 133,000 km. But 133,000 km is still below Hong Kong's 300,000 km. We want to catch up with Hong Kong and we will. We target 200,000 km this year. Performance so far has given us optimism."
2016-04-12-T-002-S-00024,2016-04-12-T-002,24,Khaw Boon Wan,"Yes, our MRT did experience disruptions exceeding 30 minutes, on 14 occasions last year. This was more than Hong Kong's 12 disruptions in a year. Not as good and we are also working hard on this. I monitor this closely and I have some progress to report. The Downtown Line (DTL) has crossed 171 days of continuous service without any major disruption  171 days, almost half a year, without any major incident. This is not a trivial achievement. For us in this trade, we know how difficult it is to achieve such a target. Half a year."
2016-04-12-T-002-S-00025,2016-04-12-T-002,25,Khaw Boon Wan,"The other MRT lines are working hard to catch up. The North-South Line (NSL) has crossed the 93-day mark. This is our oldest line, nearly 30 years of age and, if there is no incident in the next seven days, NSL will cross the 100 days' mark next week. If they succeed, their success will be especially inspiring for our team, given its age."
2016-04-12-T-002-S-00026,2016-04-12-T-002,26,Khaw Boon Wan,"Young or old, each time a line crosses a significant milestone, I visit the maintenance staff to thank them personally and to cheer them on; go for the next milestone. Even when they fail to cross a milestone, like the North East Line (NEL) which experienced a disruption two months ago, on the very day when they were about to cross the 100-day mark, I visited them to tell them that we appreciated their efforts, regardless. We lick our wounds, reset the clock, we press on, we work even harder. Today, NEL has crossed the 68-day mark and I look forward to welcoming them to the ""100-day Club"" next month."
2016-04-12-T-002-S-00027,2016-04-12-T-002,27,Khaw Boon Wan,"What is our strategy to improve rail reliability? First, the operators are ramping up their engineering and maintenance resources. We are moving towards preventive maintenance – that is, we monitor the conditions of the assets and do the necessary maintenance before any issues arise. This requires the operators to deploy condition monitoring tools on the trains and on the tracks."
2016-04-12-T-002-S-00028,2016-04-12-T-002,28,Khaw Boon Wan,"Some have already been deployed – the linear variable differential transformer (LVDT) to monitor the condition of the third rail, as well as the wheel impact load detector (WILD) to monitor the train wheels. This year, we expect to deploy even more sensors – a catenary eye system (CES) using infra-red to monitor the power system for NEL, and a rolling stock condition monitoring system (RSCMS) to collect information regarding the train systems on NSL and East-West Line(EWL). These are all very costly investments, but they are necessary."
2016-04-12-T-002-S-00029,2016-04-12-T-002,29,Khaw Boon Wan,"Second, we are investing about a billion dollars in hardware replacement and upgrading. We are aggressively renewing the infrastructure of our rail network. Within two years, we would have completely replaced the sleepers and the third rail on NSL and EWL, and also upgraded their signalling system."
2016-04-12-T-002-S-00030,2016-04-12-T-002,30,Khaw Boon Wan,"Third, we are forging a closer team, between LTA the designer and the train operators. We address each incident as a collective responsibility – no finger pointing, share openly and solve the problems speedily. We are tightening regulations and stepping up audits on the maintenance processes, augmenting resources where necessary to get the job done."
2016-04-12-T-002-S-00031,2016-04-12-T-002,31,Khaw Boon Wan,"Fourth, we are learning from the best. LTA has set up technical advisory panels, such as for our power systems, and has overseas operators on the panels to share their expertise and experience. We are learning and benefiting from their insights. We are grateful for their generosity in sharing and advising us."
2016-04-12-T-002-S-00032,2016-04-12-T-002,32,Khaw Boon Wan,"Fifth, we are reskilling and up-skilling our engineering and maintenance crew. We need a quantum leap both in the numbers and in the capabilities of our rail industry, both to up our existing maintenance standards and to cope with a rapidly expanding network. I am glad to see the Chartered Rail Engineers Scheme gaining momentum. We are setting up the Singapore Rail Academy to quicken this process. The Academy will work with the rail operators and the Institutes of Higher Learning to deepen rail engineering capabilities through training, as well as for accreditation and certification of training programmes and competencies."
2016-04-12-T-002-S-00033,2016-04-12-T-002,33,Khaw Boon Wan,"In due course, we hope the Academy will also conduct R&D to contribute to the design of new systems which are easier to build, maintain and operate. Prof Cham Tao Soon has come forward, volunteered his service to spearhead this initiative. He and Mr Tan Gee Paw have been a valuable help to us. They know engineering and they are risking their reputation built up over decades of excellent work in the Civil Service. They are doing national service for the larger good. I am grateful to them and to many other seasoned engineers who have come forward to volunteer their services. We all want an MRT system which all Singaporeans can be proud of."
2016-04-12-T-002-S-00034,2016-04-12-T-002,34,Khaw Boon Wan,"Even as we work hard to improve reliability, we are, in parallel, working to expand the rail capacity. Actually, the right order of things is to stabilise the system first, before expanding it. But we also have to address peak period crowding and improve connectivity. That is why we are, in parallel, adding new trains to all lines, shortening headways on NSL and EWL, extending EWL westward, DTL eastward, NEL northward, not to mention building the new Thomson-East Coast Line, while planning the new Jurong Region Line and Cross-Island Line."
2016-04-12-T-002-S-00035,2016-04-12-T-002,35,Khaw Boon Wan,"I hope Members appreciate the severe pressure on the shoulders and the stress on our engineers. I can see it in their faces, though they never voice it. They are an honest, hardworking and resilient lot; they take their responsibilities seriously and stoically. These are tough guys, but I think some tender loving care from Singaporeans would be very much appreciated."
2016-04-12-T-002-S-00036,2016-04-12-T-002,36,Khaw Boon Wan,"Before I leave this subject, let me add three more points. First, expanding capacity can impact reliability. Adding more trains and running them more frequently exert a heavy load on the power system during peak hours. While the additional load is within the original design capacity of the existing system, we are severely reducing the design buffer. As engineers, we know the importance of a comfortable buffer, to deal with unforeseen events, for instance, a sudden surge in demand on the rail network. I think Mr Sitoh alluded to this yesterday when he said, ""Are we biting off more than we can chew?"" I think we are, but what to do?"
2016-04-12-T-002-S-00037,2016-04-12-T-002,37,Khaw Boon Wan,"The solution is to upgrade the power system and build new substations. And this is what we are doing. But such an extensive upgrade on a live system will take a few years to complete. Meanwhile, we are taking a risk that it may cause more disruptions. We are deploying condition monitoring tools and techniques to help mitigate such risks, but we know the risks cannot be fully eliminated. So, please be forgiving should you experience a disruption during this very critical transition period."
2016-04-12-T-002-S-00038,2016-04-12-T-002,38,Khaw Boon Wan,"Second, I want to reiterate an earlier observation. We are stepping up maintenance, we are doing major replacement works and we are expanding the system capacity. Normally, these activities should be done sequentially and in that order, but we are not. We are doing all three simultaneously. All these are happening on the ground, on a live rail system, with a small window of only three engineering hours a day. Ideally, we should provide longer continuous engineering hours and this means shorter revenue service hours. I hope commuters will allow us to open some of the MRT lines a bit later in the morning, or close them a bit earlier at night. An extra hour or two per day will make a lot of difference to our engineering and maintenance staff and help them perform better. We can run some buses to provide an alternative."
2016-04-12-T-002-S-00039,2016-04-12-T-002,39,Khaw Boon Wan,"Third, we will be changing the signalling system of the NSL and EWL. This is a major engineering task. Experts from London Underground and the Taipei Metro shared with us their past experience in re-signalling which was not at all pleasant. It took them many months to get it right, with many delays and disruptions."
2016-04-12-T-002-S-00040,2016-04-12-T-002,40,Khaw Boon Wan,"For example, London Underground went through two years of public unhappiness! This subject is now adding to what is keeping us awake at night. As Members may know, we will be changing the signalling system of NSL this year, followed by the EWL next year. We will do our best to try to achieve a flawless execution and we are keeping our fingers crossed. I seek Singaporeans' understanding and moral support."
2016-04-12-T-002-S-00041,2016-04-12-T-002,41,Khaw Boon Wan,"The rail network is the backbone of our public transport system. We have invested more than $30 billion over the last 15 years and we will be investing even more in the next 15. Besides new lines, we are upgrading existing lines, as described earlier. These works cover trains, tracks, signalling systems and also MRT stations. For example, work will start later this year to upgrade 17 MRT stations, including Er Dr Lee Bee Wah's Khatib station. Following the upgrade, Er Dr Lee's residents will have more standing room and more elderly-friendly seats at the platform. We will also look at expanding bicycle parking. LTA will also look into her other suggestions as we continue refreshing our older stations."
2016-04-12-T-002-S-00042,2016-04-12-T-002,42,Khaw Boon Wan,"Besides trains, our rail network must be complemented by a good and reliable bus network. We have made significant progress in recent years to increase capacity, improve reliability and enhance service levels. We have introduced new bus services and all bus services will run at shorter intervals. Transition to the bus contracting model is also progressing smoothly. LTA will be calling the third tender package very soon."
2016-04-12-T-002-S-00043,2016-04-12-T-002,43,Khaw Boon Wan,"Under the Bus Service Enhancement Programme (BSEP), we have added 800 buses, and will add another 200 by the end of next year. But as noted by Mr Melvin Yong, we also need a few thousand more bus captains to join the industry. He made several suggestions. Senior Minister of State Josephine Teo chairs the Public Transport Tripartite Committee (PTTC), which seeks to professionalise the bus industry, so as to attract more Singaporeans into the sector. The Committee will share details of their efforts in the next few months."
2016-04-12-T-002-S-00044,2016-04-12-T-002,44,Khaw Boon Wan,"Mr Ong Teng Koon asked about the use of electric buses. It is a promising idea, though the current economics still do not make it viable. But I share his optimism that technological progress and especially in bus battery, will make electric buses viable in due course. Therefore, we are closely watching this development. Another promising idea is self-driving vehicles, as noted by Mr Png Eng Huat. Self-driving technology is not yet ready for mass deployment and may be 10-15 years away, depending on the pace of public acceptance. But it is just a matter of time before such vehicles can be deployed on public roads, whether for private or public transport."
2016-04-12-T-002-S-00045,2016-04-12-T-002,45,Khaw Boon Wan,"As I outlined earlier, a fleet of self-driving vehicles plying the neighbourhood will greatly enhance our first-and-last mile connectivity. We are doing several trials and want Singapore to be amongst the leaders in such concepts. Yesterday, Mr Zaqy Mohamad mentioned nuTonomy. It is making a ""big bet on Singapore"", according to its COO. They hope to see Singapore amongst the world's first to commercially deploy self-driving vehicles. If they or their rivals succeed, it will impact existing taxi drivers. That is why we need to help incumbents prepare to cope with these changes."
2016-04-12-T-002-S-00046,2016-04-12-T-002,46,Khaw Boon Wan,"Mdm Chair, when Founding Prime Minister, Mr Lee Kuan Yew officiated the opening of the MRT system in 1988, he said, ""We only have a limited amount of land on which to house our people, build factories, hospitals, roads, schools and train the SAF. Therefore, we decided to give top priority to investments in public transport and to put private transport in second place. This means that we must put the MRT to optimal use and the bus services must dovetail and complement the MRT. We must also keep improving the bus and taxi services and keep the growth of cars to moderate levels."" This principle has guided our transport strategy ever since."
2016-04-12-T-002-S-00047,2016-04-12-T-002,47,Khaw Boon Wan,"At SG51, it is even clearer that a car-dominant model cannot underpin Singapore's next phase of development. We need to facilitate new transport technology, change mind-sets and go car-lite. Our public transport must make a quantum leap. We will, therefore, be relentless in pursuing rail excellence, improving our bus service and instituting a future-friendly regulatory and policy framework. We must allow various forms of point-to-point mobility to flourish in Singapore."
2016-04-12-T-002-S-00048,2016-04-12-T-002,48,Khaw Boon Wan,"At the same time, we must rethink and adjust existing car and car parking policies. We already house one million vehicles. Our vehicle population is nearing its peak. Many other cities are making adjustments. London, Paris and many Japanese cities have introduced car-free days and reduced car parking norms. These are measures to help reset their motorists' attitude towards cars. We should gradually adjust, too."
2016-04-12-T-002-S-00049,2016-04-12-T-002,49,Khaw Boon Wan,"In addition, we want Singaporeans to come to cherish public transport as an indispensable part of their daily lives. The recent Bus Carnival was attended by 140,000 Singaporeans. LTA will continue to forge among Singaporeans this sense of ownership and pride in our public buses. And I will make sure that this pride extends to our MRT, too. We cannot achieve this overnight. We need some more time but we will get there, during this term of Government. Of this, I am confident."
2016-04-12-T-002-S-00050,2016-04-12-T-002,50,Lim Biow Chuan,"Mdm Chair, can I cover both cuts?"
2016-04-12-T-002-S-00051,2016-04-12-T-002,51,,"Yes, you have two cuts. Please take them together."
2016-04-12-T-002-S-00052,2016-04-12-T-002,52,Lim Biow Chuan,"To promote a car-lite Singapore, the Government should provide better public transport for residents so that they can get to office and back home without the need to drive."
2016-04-12-T-002-S-00053,2016-04-12-T-002,53,Lim Biow Chuan,"Currently, despite the high costs of driving to work, many people still grit their teeth, bear the ERP charges and bear the expensive parking charges because they have limited options of getting to office and back home."
2016-04-12-T-002-S-00054,2016-04-12-T-002,54,Lim Biow Chuan,"One option is to provide better connectivity from the private estates to the nearest MRT stations. Within my constituency, I have many residents living in the condominiums at Meyer, Amber, Haig Road and Tanjong Rhu. Many of them drive to work daily. If they have a better option of a bus service to the nearest MRT station, I am confident that many of these drivers will leave their cars behind and take public transport to work."
