speech_id,topic_id,speech_order,member_name,text
2016-08-16-T-011-S-00361,2016-08-16-T-011,361,Ong Ye Kung,"From the first phase, broadly from the 1950s to the 1970s, we were learning to survive. The key imperatives were to impart basic employability skills, raise levels of literacy and numeracy, and stem high unemployment rates. The Adult Education Board, or better known as Lembaga to many Singaporeans, was formed in 1960 to train our adult workforce. Singapore Polytechnic and Ngee Ann Polytechnic were also established during this period."
2016-08-16-T-011-S-00362,2016-08-16-T-011,362,Ong Ye Kung,"In the 1980s, we were moving up the value chain, contending for choice investments and learning to compete. Many key elements of the supporting infrastructure for lifelong learning were born during this period. For example, the Skills Development Fund (SDF) was established in 1979 to support workforce skills upgrading. The Vocational and Industrial Training Board (VITB), which evolved into the present-day ITE, was also founded then in 1979. The German, French and Japan-Singapore Institutes, set up with the help of MNCs, were combined to form Nanyang Polytechnic."
2016-08-16-T-011-S-00363,2016-08-16-T-011,363,Ong Ye Kung,"By the turn of the century, Singapore's economy had already achieved significant breadth as well as depth. So, we entered the third phase, which is learning for life. The public education and training landscape evolved into one of many pathways that an individual may choose to pursue. We established more institutions, such as the Republic Polytechnic and the Singapore Institute of Technology. Existing institutions started to roll out various programmes, part-time, full-time, pre- and post-employment training, across many industry sectors and career stages."
2016-08-16-T-011-S-00364,2016-08-16-T-011,364,Ong Ye Kung,"At the same time, the Government established the Singapore Workforce Development Agency (WDA) in 2003 and helped to accelerate a shift from an employer-centric skills adult training system, to one that placed greater focus on the individual."
2016-08-16-T-011-S-00365,2016-08-16-T-011,365,Ong Ye Kung,"WDA worked with private training providers to set up Continuing Education and Training Centres, or CET Centres, which offered subsidised training directly to workers. Such supply-side interventions meant that training subsidies were made directly available to individuals, with or without their employers' sponsorship. The learning for life phase is therefore most notable for empowering individuals, and encouraging each one of us to pursue our interests and what we are best at."
2016-08-16-T-011-S-00366,2016-08-16-T-011,366,Ong Ye Kung,"Madam, I recount this historical process because they laid the foundations for SkillsFuture today, in three ways. First, we have developed a high-quality education and training landscape, anchored by strong institutions, both in the public and private domain. Second, we have started to draw tighter linkages between work and training, by encouraging the participation of employers in skills development and ensuring the relevance of skills training programmes. Third, we have also started the shift towards greater individual ownership and empowerment."
2016-08-16-T-011-S-00367,2016-08-16-T-011,367,Ong Ye Kung,"So, the launch of SkillsFuture in 2014 is a continuation of this evolution process. But SkillsFuture is more than just schemes and programmes to drive higher productivity and mastery, and it is certainly not just the $500 Credit; it is also about societal mindsets, and the way we value and recognise people of different talents, beyond traditional definitions of success."
2016-08-16-T-011-S-00368,2016-08-16-T-011,368,Ong Ye Kung,"As its very name suggests, SSG's mission is to take SkillsFuture forward in the long term, by"
2016-08-16-T-011-S-00369,2016-08-16-T-011,369,Ong Ye Kung,"(a) first, developing an integrated, high-quality and responsive education and training system;"
2016-08-16-T-011-S-00370,2016-08-16-T-011,370,Ong Ye Kung,"(b) second, strengthening a culture of lifelong learning and pursuit of skills mastery; and"
2016-08-16-T-011-S-00371,2016-08-16-T-011,371,Ong Ye Kung,"(c) third, fostering employer recognition and ownership of skills."
2016-08-16-T-011-S-00372,2016-08-16-T-011,372,Ong Ye Kung,"We are restructuring WDA into SSG and WSG, with SSG being part of the MOE family. This is not for administrative or bureaucratic neatness but is to draw better synergies between the work of MOE and SSG. To do so, in the immediate term, SSG will focus on five key priorities"
2016-08-16-T-011-S-00373,2016-08-16-T-011,373,Ong Ye Kung,"First, we will better leverage post-Secondary education institutions, in other words, Autonomous Universities, Polytechnics and ITEs to deliver training and development for adult workers."
2016-08-16-T-011-S-00374,2016-08-16-T-011,374,Ong Ye Kung,"Under SkillsFuture, these institutions will expand their range of programmes to support skills deepening for adult learners, by offering more bite-sized and industry-relevant courses. These can be delivered through centres or units within those institutions dedicated to adult training and lifelong learning."
2016-08-16-T-011-S-00375,2016-08-16-T-011,375,Ong Ye Kung,"As a Statutory Board under MOE, SSG will coordinate and increase the range and quality of these skills-based training programmes offered by both the PSEIs and private training providers."
2016-08-16-T-011-S-00376,2016-08-16-T-011,376,Ong Ye Kung,"The second priority is to integrate work and study for a responsive skills training ecosystem. This is something that is already in progress. For instance, WDA currently champions the SkillsFuture Earn-and-Learn Programme, in which fresh Polytechnic and ITE graduates undergo on-the-job and classroom training to deepen their skills."
2016-08-16-T-011-S-00377,2016-08-16-T-011,377,Ong Ye Kung,"Looking ahead, SSG will work in tandem with the PSEIs to increase the scale and scope of implementation of the Earn-and-Learn Programme and facilitate more extensive workplace training, and pilot the cooperative model of education at the university level."
2016-08-16-T-011-S-00378,2016-08-16-T-011,378,Ong Ye Kung,"Today, MOE is expanding and enhancing its education and career counselling services in schools and institutes of higher learning. WDA has over the years built up capacity to advise workers on career options, training pathways and assist them on their job search. This is an area that requires more work as there is a greater interest amongst adult workers now to go for training because of SkillsFuture Credit. Under this new structure, all these resources from WDA today will be grouped under SSG."
2016-08-16-T-011-S-00379,2016-08-16-T-011,379,Ong Ye Kung,"And so the third priority is that as work and study grow to form more of a seamless continuum, there can be greater coordination between SSG and the education and career counsellors in education institutions to help all learners, students as well as workers, to discover their strengths and interests, chart their learning pathways and their careers."
2016-08-16-T-011-S-00380,2016-08-16-T-011,380,Ong Ye Kung,"The fourth priority is to expand skills-based progression pathways by facilitating the inter-operability of qualifications. As far as possible, what you learn under one qualification system can be recognised by other qualification systems. This will better ensure that every training achievement is a step forward, in a system where there are no dead ends."
2016-08-16-T-011-S-00381,2016-08-16-T-011,381,Ong Ye Kung,"For example, graduates from Singapore Polytechnic's Earn-and-Learn Programme leading to an Advanced Diploma in Applied Food Science will now be able to progress to SIT's Bachelor of Food Technology with Honours, with exemption from the 28-week work portion of the Integrated Work Study Programme. In the coming months and years, SSG will drive the advancement of such arrangements, and bring about inter-operability of qualifications across the education and training landscape, at a systemic level."
2016-08-16-T-011-S-00382,2016-08-16-T-011,382,Ong Ye Kung,"The fifth priority of SSG will be to harmonise the accreditation and quality assurance systems of WDA and the Council for Private Education (CPE) today. Today, WDA and CPE are separate Statutory Boards that run different quality assurance and regulatory frameworks for adult training and private education sectors respectively. With the establishment of SSG, the regulation of private education sector will now come under SSG. The considerations for regulating adult training and private education are somewhat different, but we can rationalise and streamline wherever we can to reduce duplication and for better efficiency."
2016-08-16-T-011-S-00383,2016-08-16-T-011,383,Ong Ye Kung,"As a first step, SSG will cross-recognise registration and accreditation requirements for selected training providers that are currently subject to both WDA's and CPE's requirements. These changes can take effect by the time SSG is formed."
2016-08-16-T-011-S-00384,2016-08-16-T-011,384,Ong Ye Kung,"Mdm Speaker, I will now turn to the Bill and outline the key Parts and the clauses."
2016-08-16-T-011-S-00385,2016-08-16-T-011,385,Ong Ye Kung,"Part Two establishes the SSG Agency and details the powers and functions of the SSG. Clause 5 under Part Two outlines the functions of SSG. In the performance of its functions, SSG will address the current, emerging and future workforce skills requirements, ensure a responsive system of education and training, and look into increasing workforce productivity and Singapore's international competitiveness. I will now describe in detail some of the key functions of SSG."
2016-08-16-T-011-S-00386,2016-08-16-T-011,386,Ong Ye Kung,"First, SSG will facilitate skills acquisition and lifelong learning through planning and developing policies, programmes, and services that provide or support the provision of adult and further education; promoting a national approach to such education and general enthusiasm for lifelong learning; undertaking research relating to such education; and identifying the key skills and competencies needed by the Singapore workforce."
2016-08-16-T-011-S-00387,2016-08-16-T-011,387,Ong Ye Kung,"Second, SSG will facilitate the improvement of quality of courses in adult education or further education provided in Singapore. This can include accrediting or facilitating accreditation of providers of adult or further education."
2016-08-16-T-011-S-00388,2016-08-16-T-011,388,Ong Ye Kung,"Third, SSG will foster and ensure the collaboration between SSG and the Workforce Singapore Agency where there are areas of synergies. This SSG function will be enabled by a specific clause in the Bill on cooperation and collaboration with the WSG. The same clause is also mirrored in the Singapore Workforce Development Agency (Amendment) Bill that has been passed."
2016-08-16-T-011-S-00389,2016-08-16-T-011,389,Ong Ye Kung,"Clause 6 describes the powers accorded to SSG to allow it to carry out the stated functions, which I have just described. Other general powers of Statutory Boards, such as the power to enter into agreements and enact financial decisions and so on, are also included."
2016-08-16-T-011-S-00390,2016-08-16-T-011,390,Ong Ye Kung,"I will now deal with Part Three to Six of the Bill, which set out the corporate structure and governance of SSG, and the personnel and financial provisions."
2016-08-16-T-011-S-00391,2016-08-16-T-011,391,Ong Ye Kung,"Part Three provides for the appointment of the Chairperson, Deputy Chairperson and other members of the governance board of the SSG, their tenure, remuneration, conditions for qualification, as well as conflict of interest disclosure requirements."
2016-08-16-T-011-S-00392,2016-08-16-T-011,392,Ong Ye Kung,"Part Four sets out the procedures for meetings of the governing board. Clauses 34 to 36 under this Part provide for the appointment of committees for purposes which are better regulated and managed by committees. The SSG can delegate the performance or exercise of any of its functions or powers to such committees, amongst others."
2016-08-16-T-011-S-00393,2016-08-16-T-011,393,Ong Ye Kung,"Part Five covers personnel matters including the appointment of the Chief Executive, the treatment of employees as public servants for the purposes of the Penal Code, the need for preservation of secrecy, and the protection from personal liability for performing, in good faith and with reasonable care, functions under this Bill."
2016-08-16-T-011-S-00394,2016-08-16-T-011,394,Ong Ye Kung,"Part Six of the Bill provides for financial provisions of the SSG and contains the standard provisions found in the Acts of other Statutory Boards. SSG will have to prepare annual estimates of income and expenditure for each financial year, with separate estimates for the Skills Development Fund, which will come under the charge of SSG."
2016-08-16-T-011-S-00395,2016-08-16-T-011,395,Ong Ye Kung,Part Seven deals with the administration and enforcement powers of SSG. The powers are largely similar to those provided for the performance of functions under WDA today.
2016-08-16-T-011-S-00396,2016-08-16-T-011,396,Ong Ye Kung,"Part Eight of the Bill concerns the transfer of undertakings from CPE and relevant parts of WDA to SSG. Specifically, Clause 66 defines and provides for the transfer of relevant assets and liabilities of CPE and relevant parts of WDA to SSG."
2016-08-16-T-011-S-00397,2016-08-16-T-011,397,Ong Ye Kung,"Finally, Part Nine deals with consequential and related amendments to other Acts. This includes the setting up of a Committee for Private Education under SSG to undertake its powers and functions under the Private Education Act."
2016-08-16-T-011-S-00398,2016-08-16-T-011,398,Ong Ye Kung,"As the administration of the Skills Development Fund will now come under SSG, consequential amendments are being made to the Skills Development Levy Act. This is done through clause 74. With the establishment of SSG, there could be overlaps between the stated functions of SSG and the ITE today, as well as between SSG and the Standards, Productivity and Innovation Board (SPRING). Clause 76 makes consequential amendments to the ITE Act to simplify and remove this duplication. Clause 77 does likewise for SPRING."
2016-08-16-T-011-S-00399,2016-08-16-T-011,399,Ong Ye Kung,"Mdm Speaker, in conclusion, this Bill provides for a new organisational structure within the Government to further the efforts of SkillsFuture. This will ensure a responsive and industry-relevant system of education and training, in which every person is a lifelong learner in the pursuit of skills mastery. Mdm Speaker, I beg to move."
2016-08-16-T-011-S-00400,2016-08-16-T-011,400,Ong Ye Kung,Question proposed.
2016-08-16-T-011-S-00401,2016-08-16-T-011,401,Denise Phua Lay Peng,"Madam, this Bill seeks to set up a Statutory Board, SkillsFuture Singapore Agency, or SSG, to focus and coordinate the operations pertaining to the national SkillsFuture movement."
2016-08-16-T-011-S-00402,2016-08-16-T-011,402,Denise Phua Lay Peng,"As I studied this Bill which I understand is meant to be operational in nature, I cannot help but feel that there is nothing very exciting mentioned on either skills or the future. It belies the significance of the SkillsFuture as a national movement to provide Singaporeans with the opportunities to develop their fullest potential throughout life, regardless of their starting point. The SkillsFuture website promises that a variety of resources will be deployed to help Singaporeans own a better future with skills mastery and lifelong learning. I therefore hope that when the Bill is passed, the tone of the Act is merely an understatement of the exciting mission and breakthroughs that SSG is expected to deliver."
2016-08-16-T-011-S-00403,2016-08-16-T-011,403,Denise Phua Lay Peng,Kudos to the many supporters of the SkillsFuture team and the many agencies behind it. So much has indeed happened since the SkillsFuture movement was launched two years ago. Let me name a few. Of course everybody knows the $500 SkillsFuture Credit; Education and Career Guidance (ECG) at schools; Earn and Learn Programmes for ITE and Polytechnic students; Enhanced Internships; Individual Learning Portfolio which is coming out in 2017; Study Awards; Mentoring Scheme and Sectoral Manpower Plans.
2016-08-16-T-011-S-00404,2016-08-16-T-011,404,Denise Phua Lay Peng,"While all the pieces make sense each time they are presented, I fear the day when we cannot see the forest for the trees. As a member of the former SkillsFuture Council and now the combined Council for Skills, Innovation and Productivity, I have sat through enough meetings led by Chairman Deputy Prime Minister Tharman to ""double confirm"" that the intent of the SkillsFuture movement is to future-proof the skills of Singaporeans and Singapore businesses."
2016-08-16-T-011-S-00405,2016-08-16-T-011,405,Denise Phua Lay Peng,"The Minister himself, no less, said people often mistake SkillsFuture for a funding scheme, training programme or an organisation. He said it is not any of those. Rather, it is ""everything we do to create a future that is different and better than today, in the way we look at work and careers, and the way we develop ourselves and our next generation""."
2016-08-16-T-011-S-00406,2016-08-16-T-011,406,Denise Phua Lay Peng,"SkillsFuture is not simply about tapping on the $500 Credit to attend a big menu courses at our Community Centres. As they say, ""Don't use, so wasted!"" or in Mandarin,""不用白不用"". It is not simply an active ageing programme. It is not just a scheme to persuade one to either not sign up for University or to sign up later."
2016-08-16-T-011-S-00407,2016-08-16-T-011,407,Denise Phua Lay Peng,"It is not about reviving the Training, Consulting or Mentoring industries. It is not just about doing up Sectoral Human Resource Manpower Plans to see how we can attract more talents for each selected industry sector. It is not just about doing the same thing that we have to do anyway and then branding it as SkillsFuture – what I would term ""old wine in new wine skin""."
2016-08-16-T-011-S-00408,2016-08-16-T-011,408,Denise Phua Lay Peng,"SkillsFuture has to be more than all that I have mentioned. And the new SSG Agency established with the passing of this Bill, must live up to its name – focus on Skills and Future! All members of the Agency must envision the future of the industry, of our nation and future-proof the skills of our Singaporeans."
2016-08-16-T-011-S-00409,2016-08-16-T-011,409,Denise Phua Lay Peng,"As it scrutinises the current and potential initiatives, SSG must administer the acid test of whether all these ideas will help Singaporeans future-proof themselves and maximise their potential."
2016-08-16-T-011-S-00410,2016-08-16-T-011,410,Denise Phua Lay Peng,"We must strive towards the day when less and less of our people and businesses are surprised when they find that their jobs or those of their loved ones become irrelevant or, worse, suddenly disappear, disrupted by business models or technologies or the sharing economy-revolution that we did not see coming; or did not do anything about even if we knew they were coming."
2016-08-16-T-011-S-00411,2016-08-16-T-011,411,Denise Phua Lay Peng,"The new SSG agency is, therefore, our bastion of hope to secure our future; to ensure that the major remains the major and not lose focus that we are trying to build a future for our people."
2016-08-16-T-011-S-00412,2016-08-16-T-011,412,Denise Phua Lay Peng,"For the Bill to live up to its name, there are three areas I would urge the Minister to consider"
2016-08-16-T-011-S-00413,2016-08-16-T-011,413,Denise Phua Lay Peng,"(1) to build strong expertise in the three critical pillars of Content, Pedagogy and Assessment;"
2016-08-16-T-011-S-00414,2016-08-16-T-011,414,Denise Phua Lay Peng,"(2) to become the Uber for current service gaps in some post-education spaces, for example, I will talk about a Special Education Academy in special education space; and"
2016-08-16-T-011-S-00415,2016-08-16-T-011,415,Denise Phua Lay Peng,(3) to be bold enough to Create and Chase Our Own Rainbow.
2016-08-16-T-011-S-00416,2016-08-16-T-011,416,Denise Phua Lay Peng,"First, on building strong expertise in the three critical pillars of Content, Pedagogy and Assessment. Content or What to Learn."
2016-08-16-T-011-S-00417,2016-08-16-T-011,417,Denise Phua Lay Peng,"Madam, futurists have predicted that more than 50% of jobs will disappear by 2030, replaced by new jobs requiring new skills and new competencies. For content, we must build a 21st Century Curriculum that provides access by individuals and businesses to new literacy subjects ‒ more than just English and Mathematics and so forth ‒ to add on, such as basic coding for some of us, or basic e-commerce for some of our businesses."
2016-08-16-T-011-S-00418,2016-08-16-T-011,418,Denise Phua Lay Peng,"It is not business as usual. We need to consult. We need to abandon the traditional mindset of discarding or hijacking ideas that are ""not invented here"". There is no way that career educators used to working within the confines of school buildings or systems or classrooms can hold the monopoly of ideas. SSG must try to research, invest and build bandwidth in ""sunrise"" new industries. Not an easy task but very necessary."
2016-08-16-T-011-S-00419,2016-08-16-T-011,419,Denise Phua Lay Peng,"Next, on SSG's expertise on Pedagogy or How to Deliver Learning. Over the years, I have spoken at length on how e-learning platforms and blended learning platforms are the future of the day. I spoke on how our students, many of whom are digital natives, cannot be left to learn only as far as their adult teachers can or will learn. I spoke on how best education resources and best practices must be made available online and otherwise so that more learners can access them, to level the playing field. I spoke about the potential of an open architecture to which content developers can contribute, where content can be curated and transformed into modules that can be distributed to more learners."
2016-08-16-T-011-S-00420,2016-08-16-T-011,420,Denise Phua Lay Peng,"I am not the only one thinking about this. At the school level, the MOE has promised an e-learning space. At the tertiary level, I have observed different IHLs trying out different Learning Management Systems; some of them re-inventing the wheels of locating, negotiating the best platforms. I believe it is the role of the Government and, in this case, the SSG agency, to consolidate and share these learnings in pedagogy as I fear that by the time we think we are ready, the game is over and our investments hitherto would have been wasted."
2016-08-16-T-011-S-00421,2016-08-16-T-011,421,Denise Phua Lay Peng,"Building SSG's expertise on Assessment or How to Test if One Has Learnt or Mastered a Skill. Madam, there is a strong need to add to the repertoire of assessment modes, the currently popular ones being standard written tests and project work. Madam, we Singaporeans are known for our ingenuity in finding ways to ace examinations, especially written tests. But because post-Secondary education institutions are a close link to the industry, how we assess and report on results will become the proxy by which employers evaluate the candidates they seek to employ. The SSG agency should work closely with industry to enlarge the assessment and selection toolkit so that there is more focus on skills, aptitude and not just standard academic results."
2016-08-16-T-011-S-00422,2016-08-16-T-011,422,Denise Phua Lay Peng,"Next, for the Minister's consideration, to become the Uber for certain service gaps in the post-Secondary education space, such as in special education. At this point, Madam, I want to remind the Ministry about the scope of this Bill, on whom this Bill is meant for. It is not a Bill just to future-proof those who can study in the existing post-Secondary education institutions. It is for all Singaporeans. Singapore is a nation. It is not a business entity. It is not Singapore Inc. We do not leave behind those who are at risk. We do not throw the crumbs while the rest of us feast and continue to learn what others do not. Every one of us deserves to maximise our potential, whatever level that potential is deemed to be."
2016-08-16-T-011-S-00423,2016-08-16-T-011,423,Denise Phua Lay Peng,"Our Singapore brand of lifelong learning must be inclusive. It must include those of us who learn and contribute differently. I am thus a little bit disappointed to see no mention of persons with special needs or their educational needs in the Bill. The cliff-effect of learners, especially those who graduate from special schools, is real. The cost of not helping them to continue learning and to renew their skills is high as they may otherwise seek higher cost social services, such as day activity centres, because they are no more relevant to the workforce. There is also an upside in that a number of adults with special needs may be able to take on jobs in our very tight labour market. But even those with special needs who found jobs earlier, will find that without continual customised training and support, they will soon lose their jobs."
2016-08-16-T-011-S-00424,2016-08-16-T-011,424,Denise Phua Lay Peng,"The current efforts by SG Enable need more boosting and scale. SkillsFuture for this group of Singaporeans is necessary but may have to innovatively take on a different complexion, with strong collaboration between the SSG and other relevant Government agencies, the VWOs and the private sector."
