speech_id,topic_id,speech_order,member_name,text
2016-04-12-T-004-S-00876,2016-04-12-T-004,876,Tan Chuan-Jin,"Unfortunately, today, we are more likely to divorce each other than before. We also have more working mothers. We have a more diverse architecture in life choices even as parenting becomes a constant battle of school stresses and social media temptations and distractions. Against these social facts, what cards do we have to play? We are only as strong as the values we hold dear. And they are  that everyone − rich or poor − should have the same shot at success. That we value individual effort and strong families. And last, that we are all in this together  Equal Opportunities. Strong Families. United Country."
2016-04-12-T-004-S-00877,2016-04-12-T-004,877,Tan Chuan-Jin,"These are enduring values which my Ministry will seek to uphold in our work for this term of Government. And in terms of how we intend to carry out our work, I hope to go upstream where we can. We want to proactively and positively shape the environment and to prevent problems from developing where possible. We conceive of our work in three ways − firstly, a strong start; secondly, a network for the vulnerable; and, lastly, a collective effort towards improving social welfare."
2016-04-12-T-004-S-00878,2016-04-12-T-004,878,Tan Chuan-Jin,"Firstly, a strong start  building our home for family and a good start for our children. Clearly, Singapore is our home for family. Strong families are, and must remain, the basic building blocks of our society. Strong marriages form the foundation for strong families. We do want to create a pro-family environment, which supports couples' decision to settle down, have children and enjoy family life. We will strengthen marriages and families so that family members maintain strong ties with one another and with the community."
2016-04-12-T-004-S-00879,2016-04-12-T-004,879,Tan Chuan-Jin,"For each of our families and our society, children are our future. With strong families and good support from society, our children can have a good start in life. For children who have less, we will give them an extra leg-up so that they, too, have the opportunity to live life to the fullest."
2016-04-12-T-004-S-00880,2016-04-12-T-004,880,Tan Chuan-Jin,"Secondly, it is about caring for the vulnerable. We have increased support for vulnerable groups. We have helped persons with disabilities to lead more independent lives and realise their potential. But, clearly, the work is not done. We will build stronger safety nets to identify and support the more vulnerable in our society. We will improve our systems and measures. We will calibrate our assistance so that those in greater need receive more. We will work with different Ministries to deliver more coordinated help to those with varied needs."
2016-04-12-T-004-S-00881,2016-04-12-T-004,881,Tan Chuan-Jin,"My Parliamentary Secretary will speak on how we will help the low-income, the vulnerable seniors and youths-at-risk. He will also outline how we will continue to support and empower persons with disabilities."
2016-04-12-T-004-S-00882,2016-04-12-T-004,882,Tan Chuan-Jin,"Thirdly, it is also very much about enabling Caring Communities. Building an inclusive society with a strong sense of ""we"", as opposed to ""me"", is very much our collective aspirations. This came across strongly during Our Singapore Conversations and even in the present ongoing SGFuture series of dialogues. To be a truly inclusive society, we need more than strong Government safety nets. We need a wider community which has the heart and the will to play a part in improving the lives of those among us who are weaker, have less or have fallen on hard times."
2016-04-12-T-004-S-00883,2016-04-12-T-004,883,Tan Chuan-Jin,"So, one of MSF's priorities is also to enable and empower caring communities where individuals, businesses and VWOs can come together, work together, to build a Singapore where everyone plays a role to make sure that no Singaporean is left behind. When we talk about an inclusive society, it is not just about including those who need help or who need the support. It is about all of us being included in that whole journey. The positive outcomes of such actions are not, and I repeat, are not limited to the beneficiaries. The change also occurs for those who give of their time, energy and resources. Helping others brings out our humanity as individuals and strengthens our common identity as Singaporeans."
2016-04-12-T-004-S-00884,2016-04-12-T-004,884,Tan Chuan-Jin,"For this first speech, let me share some of our upcoming work in building our home for family and to provide a good start for our children."
2016-04-12-T-004-S-00885,2016-04-12-T-004,885,Tan Chuan-Jin,"Our families are what make life meaningful for us. They are our pillar of support in good and bad times. Strong family bonds need to be nurtured and forged through the quality and quantity of time spent together. We all know that when both parents are involved at home and with their children's lives, marital relationships are stronger. Children thrive when parental relationships are positive, when they are loved by their parents, grandparents and other family members. Ageing parents also thrive when their adult children, their siblings and other family members are supportive."
2016-04-12-T-004-S-00886,2016-04-12-T-004,886,Tan Chuan-Jin,"In the coming years, my Ministry will continue to strengthen these fundamental family relationships. Where relationships are intact, we work towards reinforcing them further. Where relationships have problems, we try to help repair and preserve them. Where they have invariably broken down, as it tends to happen sometimes, we will try to minimise the negative impact. Central to our work here are the interest of the children and their development."
2016-04-12-T-004-S-00887,2016-04-12-T-004,887,Tan Chuan-Jin,"Let me talk briefly about strengthening marriages. My Ministry supports and provides marriage preparation programmes and counselling through our network of partners. We equip couples with skills, such as communications and conflict management, to prepare them for the ups and downs of marriage life."
2016-04-12-T-004-S-00888,2016-04-12-T-004,888,Tan Chuan-Jin,"Since December 2014, MSF has worked with community partners to offer the Prevention and Relationship Enhancement Programme (PREP) at the Registry of Marriage and in the community. The response has been positive. Nine in 10 participants told us the programme has been helpful in enhancing their marriage."
2016-04-12-T-004-S-00889,2016-04-12-T-004,889,Tan Chuan-Jin,We also work with the Families for Life Council on bonding activities for families to promote family time among extended families and on the Marriage Convention which also provides useful tips for couples to enrich their marriage.
2016-04-12-T-004-S-00890,2016-04-12-T-004,890,Tan Chuan-Jin,"For couples who may face more stresses in their marriage life, we have put in place many other targeted programmes, like those for couples who married young and those for marriages involving a foreign spouse. We do encourage Members in this House to encourage others to take on-board all this range of programmes."
2016-04-12-T-004-S-00891,2016-04-12-T-004,891,Tan Chuan-Jin,"Let me talk about supporting new parents. We all know, as new parents, we will face anxiety and stress. Will we be able to handle the sleepless nights when baby comes? Will our home be ready? Who will take care of our little one when we are out at work? What are the major expenses involved in raising a child? These are very valid and practical questions that I think all of us have asked. I remember asking them myself when I first became a parent."
2016-04-12-T-004-S-00892,2016-04-12-T-004,892,Tan Chuan-Jin,"Today, we have a suite of support measures covering various life stages – from getting married to having and raising children and providing support for working parents. I, for one, do not believe that couples have children just because of campaigns or to benefit from the grants and schemes. But I do believe that our policies, collectively, can help create a conducive environment and climate to support couples who do want to become parents, who do want to settle down and who do want to have more children."
2016-04-12-T-004-S-00893,2016-04-12-T-004,893,Tan Chuan-Jin,"Going forward, we want to do more to facilitate early bonding between parents and newborns. We also want to give new parents greater support and encourage more to get into the habit of saving for their children's future. You may already have heard about plans to enhance paternity leave. The Minister for Finance has also announced the new CDA First Step. These initiatives are part of our support for marriage and parenthood. And I will leave it to Senior Minister of State Josephine Teo to give you details of these and other initiatives during NPTD's Committee of Supply."
2016-04-12-T-004-S-00894,2016-04-12-T-004,894,Tan Chuan-Jin,"As a parent myself, I know that parenting is more challenging today. In this age when social media and the Internet bring outside influences straight to our young children in a very unfiltered fashion, we need to be even more vigilant and play a more active role to ensure that our children are exposed to the right values. This is where we, as parents, must play our part."
2016-04-12-T-004-S-00895,2016-04-12-T-004,895,Tan Chuan-Jin,"To help parents, we have implemented two parenting programmes in schools – the Positive Parenting Programme and the Signposts programme. They are meant to help parents become more competent in parenting, reduce parenting stress and to help them manage difficult behaviour in children. We have rolled out these programmes to 50 schools since 2014, benefiting 2,000 families. We will expand the outreach of these parenting programmes to 120 schools this year and up to 175 schools by 2018."
2016-04-12-T-004-S-00896,2016-04-12-T-004,896,Tan Chuan-Jin,"A local study in 2010 found that first-time fathers who were more involved in caring for the young infants, adjusted better to fatherhood. Yet, in many families, as Mr Seah Kian Peng pointed out, mothers continue to carry the greater responsibility in child-raising."
2016-04-12-T-004-S-00897,2016-04-12-T-004,897,Tan Chuan-Jin,"We need to encourage fathers to step forward, but I think times are also beginning to change and I see fathers getting more hands-on. Naturally, we see fathers carrying their babies, feeding them and, especially in the libraries, you see them reading to their children. A 2016 MSF survey of mothers with infants found that close to three in four mothers agreed that fathers are as good as them in caring for children. So, fathers, do be encouraged! The children are quite safe with you, so do step forward."
2016-04-12-T-004-S-00898,2016-04-12-T-004,898,Tan Chuan-Jin,"In 2009, my Ministry started the Dads for Life movement. The Centre for Fathering is now driving the effort, with our support, to expand outreach to the community, schools and workplaces. Dads for Life ambassadors are also reaching out to childcare centres and Primary schools to encourage fathers to be more active dads through a strong network of father support groups. The response has been very positive."
2016-04-12-T-004-S-00899,2016-04-12-T-004,899,Tan Chuan-Jin,"A 2013 MSF survey showed that six in 10 men polled responded that their job kept them from spending more time with their families. In recent years, we have introduced paternity and shared parental leave to give fathers more time with their children right from birth. Fathers are also eligible for childcare leave which applies to older children, too. We encourage fathers to take this up."
2016-04-12-T-004-S-00900,2016-04-12-T-004,900,Tan Chuan-Jin,"But we need supportive employers. We have talked about this in previous Committees of Supply. And with most of us being working parents, Mr Christopher de Souza and Ms Thanaletchimi were right to point out that the workplace needs to be pro-family as well. Today, the Work-Life Grant co-funds lactation facilities in offices. It also incentivises employers to provide flexible work arrangements, which are sought after by men, too, as shown by a 2014 survey conducted by The Straits Times and the Employer Alliance. I call on employers to embrace these measures to support fathers and mothers as well."
2016-04-12-T-004-S-00901,2016-04-12-T-004,901,Tan Chuan-Jin,"Let me talk about personal commitment. We can pass all the policies, initiatives and incentives but, ultimately, we need to walk that last step. While we are committed to working with the community and employers to support active fathering, the final step has to be taken by the fathers themselves."
2016-04-12-T-004-S-00902,2016-04-12-T-004,902,Tan Chuan-Jin,"Many of you would agree with me that time is precious. As a father myself, I find that time is fleeting. It is not quite sufficient. Sometimes, I will pop into their rooms to chat with them before they sleep. Where we can, we play board games or, sometimes, sit in front of the computer to share our favourite Jimmy Fallon episodes or Saturday Night Live. This is not very strategic but I think we have a great time together just joking and laughing and I think whatever we can do, let us just take the effort to try to be there and to be present. For fathers, particularly, our presence is a lot more critical than we realise in terms of the long-term impact on our children."
2016-04-12-T-004-S-00903,2016-04-12-T-004,903,Tan Chuan-Jin,"As we support active parenting, it is also important for us to help parents provide a good start for their children. The early years, we all know, are when our children develop language competencies, habits and socio-emotional skills that provide the foundation for their future."
2016-04-12-T-004-S-00904,2016-04-12-T-004,904,Tan Chuan-Jin,Let me talk a little about what we did in the whole early childhood sector. What we want is for parents to have access to affordable and good quality early childhood services. We have made significant investments to level up the early childhood sector.
2016-04-12-T-004-S-00905,2016-04-12-T-004,905,Tan Chuan-Jin,"Mr Gan Thiam Poh asked about our progress and our next steps. In 2013, under our five-year Childcare Master Plan, we set a target to add 20,000 more childcare places, to have one place for every two children by 2017. We have already surpassed this target. Today, we have over 125,000 childcare places, an increase of over 30,000 places, compared to three years ago."
2016-04-12-T-004-S-00906,2016-04-12-T-004,906,Tan Chuan-Jin,"I am very aware that demand remains high in certain estates with concentrations of parents with young children, a point which Ms Sun Xueling has raised. I would like to assure Members that meeting the needs of these parents is and will continue to be an important priority."
2016-04-12-T-004-S-00907,2016-04-12-T-004,907,Tan Chuan-Jin,"Just to share, childcare places in Punggol and Sengkang have increased by more than 60% in just the last three years, to 13,000 places today. Five large childcare centres will be completed this year, adding another 2,000 places in high demand estates like Punggol, Sengkang, Jurong West, Woodlands and Yishun. Altogether, by 2017, about 10,000 more childcare places will be added in Singapore, of which about a third will be in Punggol and Sengkang."
2016-04-12-T-004-S-00908,2016-04-12-T-004,908,Tan Chuan-Jin,"But as we expand capacity, it is important for us to assure parents that their children are well-looked after. First, there are now more centres certified by the Early Childhood Development Agency (ECDA) under the Singapore Preschool Accreditation Framework (SPARK). This helps parents choose a quality preschool for their child. One in four preschools are SPARK-qualified today. We expect more to come on board."
2016-04-12-T-004-S-00909,2016-04-12-T-004,909,Tan Chuan-Jin,"Second, we will introduce a new Early Childhood Development Centres Act later this year. This Act will regulate kindergartens and childcare centres under the same framework to ensure higher and more consistent standards across the sector."
2016-04-12-T-004-S-00910,2016-04-12-T-004,910,Tan Chuan-Jin,"ECDA has consulted parents and the sector extensively. Overall, there has been strong support to better safeguard our children's interests and to raise the quality of services rendered. ECDA has received many useful feedback and suggestions and we will take them into consideration."
2016-04-12-T-004-S-00911,2016-04-12-T-004,911,Tan Chuan-Jin,"Committed and passionate educators, clearly, are the foundation of our early childhood sector. We agree with Ms Tin Pei Ling and Ms Sun Xueling that we need sufficient manpower to support our ramp-up in childcare capacity. This remains one of our major priorities."
2016-04-12-T-004-S-00912,2016-04-12-T-004,912,Tan Chuan-Jin,"To attract more educators, we have introduced training awards and scholarships for ITE and Polytechnic diploma students. We have also enhanced professional conversion programmes for mid-career entrants. A new Place-and-Train Programme for educarers was introduced last year."
2016-04-12-T-004-S-00913,2016-04-12-T-004,913,Tan Chuan-Jin,"We have expanded continuing professional development opportunities to develop and retain educators in the sector and this is an important effort. Late last year, I launched the Professional Development Programme to help teachers deepen their competencies and to take on larger job roles. Over 100 teachers are in the first batch and I expect many more to benefit in future runs."
2016-04-12-T-004-S-00914,2016-04-12-T-004,914,Tan Chuan-Jin,We are also building a pipeline of preschool teachers to support children with mild development needs. Ngee Ann Polytechnic will offer a Specialist Diploma in Early Childhood Learning Support from April this year.
2016-04-12-T-004-S-00915,2016-04-12-T-004,915,Tan Chuan-Jin,"The manpower situation for this sector will remain tight. I would like to thank Members for their many suggestions. ECDA will continue to study how to make it easier for those with the passion to work with young children to join the sector, while continuing to assure parents that the safety and welfare of our children are looked after."
2016-04-12-T-004-S-00916,2016-04-12-T-004,916,Tan Chuan-Jin,"Let me talk a bit about affordability, which is an important consideration for many parents. We do want to ensure preschool remains affordable to families, a point raised by Members Mr Desmond Choo and Mr Muhamad Faisal Manap. To achieve this, we have done two things. Firstly, we have implemented the Anchor Operator and the Partner Operator schemes. Today, over 40% of Singaporean children are enrolled in childcare centres under these schemes. This is a significant increase from 20% in 2012. And in the next few years, we will reach 50%. The schemes have helped to moderate fee increases. Similarly, kindergartens run by MOE and Anchor Operators are also widely accessible, comprising about half of all kindergartens."
2016-04-12-T-004-S-00917,2016-04-12-T-004,917,Tan Chuan-Jin,"Secondly, we have enhanced means-tested childcare and kindergarten subsidies in recent years, benefiting 44,000 children last year, which is more than the 17,000 in 2012. After subsidies, a median income family could pay about $350 per month for childcare, while lower-income families who attend centres run by Anchor Operators could pay as little as $3 per month. For kindergartens, our means-tested KiFAS subsidies are targeted at these operators to support lower- and middle-income parents with the cost."
2016-04-12-T-004-S-00918,2016-04-12-T-004,918,Tan Chuan-Jin,"Beyond these broad-based measures, it is important to do more for vulnerable children. There is a small group of parents who do need support to give their children a good start. There are many reasons why families and parents may end up in those situations."
2016-04-12-T-004-S-00919,2016-04-12-T-004,919,Tan Chuan-Jin,"We all know that a strong parent-child relationship is key in the development of the child. But when the relationship has broken down and the child has to be temporarily separated from the parent, we must do what we can to rebuild and to reunify the relationship."
2016-04-12-T-004-S-00920,2016-04-12-T-004,920,Tan Chuan-Jin,"Let me talk about children affected by divorce. I will explain how we translate this principle into practice. When a marriage breaks down, children, more often than not, become the vulnerable party. It is especially important for parents to improve their parenting capacity and skills to prevent the parent-child relationship from breaking down and to take active steps to improve it. The parent-to-parent relationship has broken down. But we should not see the parent-child relationship break down. We all know that in acrimonious divorces, sometimes, the children get dragged into the battle."
2016-04-12-T-004-S-00921,2016-04-12-T-004,921,Tan Chuan-Jin,"With the amendment of the Women's Charter in February this year, divorcing parents, with minor children, who are not able to agree on all matters of the divorce will have to attend a mandatory parenting programme before they can file for divorce. This will help them make an informed decision on divorce matters. Hopefully they may even reconsider divorce itself. But if they were to proceed, hopefully, they proceed in an informed fashion so that they can work on a sustainable co-parenting plan, post-separation. This programme is one of the many divorce support programmes offered by the four MSF-appointed Divorce Support Specialist Agencies."
2016-04-12-T-004-S-00922,2016-04-12-T-004,922,Tan Chuan-Jin,"Let me talk about vulnerable children who grow up in weak family circumstances. Mr Leon Perera talks about social mobility and it is important to measure it and to spur policy innovation. We agree that it is important. Indeed, Singapore is a very good example of how social mobility has benefited many of us. I think for many of us in this House, our grandparents were not rich. Our parents had a difficult time. Yet, within a generation and a generation and a half, many of us in Singapore have been uplifted. It is not something that we ought to take for granted because, as society matures, as the economy matures, it does become more difficult and, in every society, Singapore included, there will be families and individuals who will find themselves in difficult circumstances."
2016-04-12-T-004-S-00923,2016-04-12-T-004,923,Tan Chuan-Jin,"We have been monitoring our social mobility indicators. And there are many. We track housing, education and income. By and large, while there are different definitions and ways of looking at it, we have done relatively well. The most recent publication by MOF in 2015 shows that mobility for Singapore's lower income children is higher than in Denmark and almost twice as high as in the United States. Among Singaporean children who start off with parents in the bottom 20th percentile, 14% of them end up in the top 20% of their peers. For the US, UK and Denmark, the shares are 8%, 9% and 12% respectively. The same study, which is an update of their study in 2012, also found that our mobility has remained fairly stable."
2016-04-12-T-004-S-00924,2016-04-12-T-004,924,Tan Chuan-Jin,"While the findings are encouraging, what is more important is we need to understand what have we got right, what are the areas that we need to continue to improve and how do we sustain this. As I have mentioned, as we mature as an economy, as a society, it will become more difficult. Some children, possibly because of complex family circumstances, already lag behind developmentally even in their early years."
2016-04-12-T-004-S-00925,2016-04-12-T-004,925,Tan Chuan-Jin,"Mr Leon Perera talks about stories which his friends shared. I can share with you more stories because we do see individuals, children, who have somehow not broken free from the cycle in which the parents find themselves in. We must break that cycle. In order to help these children, we must go upstream and provide additional support. Dr Lily Neo and Mr Ang Hin Kee have illustrated some of the circumstances that these families face. I think many of us in this House would have encountered individuals who face those difficulties."
2016-04-12-T-004-S-00926,2016-04-12-T-004,926,Tan Chuan-Jin,"Today, we have a range of services to promote the health and learning needs of young children. They include immunisation, health checks, Development Support Programme and the Focused Language Assistance in Reading (FLAiR), which supports language and literacy development in preschools."
2016-04-12-T-004-S-00927,2016-04-12-T-004,927,Tan Chuan-Jin,"We will build on these existing efforts and pilot a new system of support called KidSTART. This new initiative will proactively identify low-income and vulnerable children aged six and below, to provide them with early access to health, learning and developmental support and monitor their progress during their early years."
2016-04-12-T-004-S-00928,2016-04-12-T-004,928,Tan Chuan-Jin,"This is not meant to be a discrete programme; it is meant to be a holistic approach to intervening in these earlier years. These children face multiple challenges. Their parents may be unable to provide a supportive environment for a host of reasons. For example, they could be young, unwed or incarcerated. There could be a combination of all these various factors, coupled with limited or no extended family support. These families would benefit and they do need additional help. I am heartened to hear that many Members are supportive of this initiative."
