speech_id,topic_id,speech_order,member_name,text
2016-08-16-T-012-S-00704,2016-08-16-T-012,704,Muhamad Faisal Bin Abdul Manap,"I welcome the move to make labour laws more inclusive and efficient. However, I would like to make some suggestions to further enhance this Bill, so that it can be more inclusive."
2016-08-16-T-012-S-00705,2016-08-16-T-012,705,Muhamad Faisal Bin Abdul Manap,"The first thing that I would like to touch on is related to costs. I am quite concerned that the cost incurred to use the ECT's services becomes an obstacle that causes workers, especially low-wage workers, to become reluctant to step forward and make their claims. The issue of cost should not become an impediment for anyone who wishes to obtain any legal service. Hence, with the implementation of the ECT, I would like to request that the Ministry reduce the costs that will be incurred and provide waivers for low wage workers."
2016-08-16-T-012-S-00706,2016-08-16-T-012,706,Muhamad Faisal Bin Abdul Manap,"In the Ministry's Consultation Paper, it was stated under Paragraph 8 that the ECT was implemented only as an ""expeditious mechanism to deal with salary-related claims"". Therefore, it does not include other aspects like job dismissals that were conducted unfairly or due to discrimination."
2016-08-16-T-012-S-00707,2016-08-16-T-012,707,Muhamad Faisal Bin Abdul Manap,"Here, Madam, I hope that the ECT can also include claims made by workers that are related to, firstly, issues of discrimination due to age, disability, religion, race, gender, and secondly,dismissals that were conducted unfairly. It cannot be denied that issues of discrimination and unfair dismissals still occur in Singapore. For instance, in 2013, the then-Acting Minister for Manpower, Mr Tan Chuan Jin, said that between 2007 to 2013, MOM received on average 70 cases from female workers every year, whereby 70% of them were expectant mothers who felt that they were dimissed unfairly. Therefore, Madam, I believe that the ECT can become more encompassing, and therefore bring about more benefits and become more meaningful to workers, if claims related to issues of discrimination and unfair dismissals can be included in this Bill."
2016-08-16-T-012-S-00708,2016-08-16-T-012,708,Muhamad Faisal Bin Abdul Manap,"(In English)  Madam, in conclusion on the basis of this four proposals I have shared earlier in enhancing the working of this Bill, I support the setting up of the Employment Claims Tribunal. Thank you, Madam."
2016-08-16-T-012-S-00709,2016-08-16-T-012,709,Zainal Sapari,"The Labour Movement welcomes the Ministry's effort in establishing the Employment Claims Tribunal (ECT) to provide a more accessible system that can resolve salary-related claims more affordably and quickly for more employees compared to the current Labour Court. That said, there are some clarifications and suggestions that I would to make from the perspective of low-wage workers and vulnerable workers that the Ministry could look into."
2016-08-16-T-012-S-00710,2016-08-16-T-012,710,Zainal Sapari,"First, I would like to urge the Ministry to allow ECT to look into both salary and CPF claims to make it easier for workers to file salary claims related grievances. Currently, separate claims have to be filed to CPF board for their owed CPF payments. This is taxing on their time, resources and morale. Since most salary claims are very likely to include CPF payments, making it possible to file both these claims will provide them with better assurance and more efficient work processes."
2016-08-16-T-012-S-00711,2016-08-16-T-012,711,Zainal Sapari,"Second, I would like the Ministry to clarify section 22 subsection 2(a) in the Employment Claims Act. More specifically, how do we define when claims are deemed frivolous and vexatious and what are the considerations involved? In helping workers with salary grievances, U-Care Centre (UCC) has helped low-wage workers with claims as low as $50. Would these cases count as vexatious or frivolous?"
2016-08-16-T-012-S-00712,2016-08-16-T-012,712,Zainal Sapari,"Third, I would like to propose that the first mediation session be held at least 14 days after it is referred to the approved mediator. In section 4 for Conduct of Mediation Sessions, the Bill currently does not stipulate a time frame as a guideline for mediation cases to be resolved which I believe can open a loophole for exploitation."
2016-08-16-T-012-S-00713,2016-08-16-T-012,713,Zainal Sapari,"Fourth, I would like to seek clarification and confirmation that the Act would allow for another person such as next of kin, unionists, UCC consultants and others to make the claim on behalf of the affected employee especially for workers who may not be intellectually sound but may still be able to stay able to stay gainfully employed."
2016-08-16-T-012-S-00714,2016-08-16-T-012,714,Zainal Sapari,UCC had come across salary grievances cases involving workers with intellectual disability. I believe that having a provision to allow representation for workers with some disability can be beneficial to these groups of people who may otherwise not be able to capitalise on the ECT's role in resolving salary disputes.
2016-08-16-T-012-S-00715,2016-08-16-T-012,715,Zainal Sapari,"Likewise as an extension, I would like to confirm provisions under sections 18 and 19 with regards to the representation of the employees who are non-union members during ECT. There will be claimants who may not have the capacity and knowledge which may hinder their capabilities to fully represent themselves adequately during mediation or tribunals. Hence, I would like to seek clarification whether the act would allow non-union members making the claim to have officers from NTUC Help Centres such as U Care Centre to follow through on such cases of salary dispute."
2016-08-16-T-012-S-00716,2016-08-16-T-012,716,Zainal Sapari,"Fifth, I would also like to propose that administrative fees be waived for valid cases involving low-wage workers who are already affected by non-payment of salaries when they file claims. Workers who earn $2,000 and below should be given a waiver so as to not create such financial strain upon themselves as they are claiming what should have been rightfully theirs to begin with."
2016-08-16-T-012-S-00717,2016-08-16-T-012,717,Zainal Sapari,"Last, I would like to make some operational suggestions that may ensure that the ECT can benefit as many Singaporeans who need their services. In UCC's experience in dealing with low-wage workers, there are three factors that have been extremely beneficial for these workers. These three factors cover working hours, claim forms drafted in the various vernacular languages, and ramping up outreach and publicity efforts."
2016-08-16-T-012-S-00718,2016-08-16-T-012,718,Zainal Sapari,I would like to propose the ECT should operate at least one weekday evening and on Saturdays as well as these would be the off-work hours for these low-wage workers and hence enabling them to come down to make their claims.
2016-08-16-T-012-S-00719,2016-08-16-T-012,719,Zainal Sapari,"Second, claims forms should also be in vernacular languages; and the claimant should also to be given an option to request for officers who can speak in their preferred language or dialect."
2016-08-16-T-012-S-00720,2016-08-16-T-012,720,Zainal Sapari,"Third, I would like to urge the Ministry to ramp up outreach efforts to educate and inform workers on ECT. The Ministry should look into embarking on strong publicity efforts on educating workers, especially the low-wage, vulnerable workers, on the newly-formed tribunal."
2016-08-16-T-012-S-00721,2016-08-16-T-012,721,Zainal Sapari,"At this juncture, I also call for the Ministry to continue giving support for centres that assist employees with workplace advisory like NTUC U Care Centre, Centre for Domestic Employees (CDE) that could render assistance to our maids, UPME Centre and Migrant Workers' Centre (MWC). Such help centres can play an instrumental role in creating greater awareness about the Employment Claims Tribunal. Mdm Speaker, please allow me to continue in Malay."
2016-08-16-T-012-S-00722,2016-08-16-T-012,722,Zainal Sapari,"(In Malay)  [Please refer to  Vernacular Speech.] The current Bill is timely for several reasons. Firstly, it ensures an inclusive coverage of Singaporean workers who fall outside the wage limits set in the Employment Act. Secondly, it allow workers to save costs of engaging counsel to pursue salary-related claims based on their contracts. Lastly, its complements and supports unionism and I also strongly urge that Unions are allowed to represent their respective members in the claims process."
2016-08-16-T-012-S-00723,2016-08-16-T-012,723,Zainal Sapari,"(In English)  Mdm Speaker, please allow me to conclude in English. Notwithstanding the clarifications and suggestions that I have made to improve the work processes and accessibility of ECT to workers in seeking redress for salary dispute, I fully support the Bill."
2016-08-16-T-012-S-00724,2016-08-16-T-012,724,K Thanaletchimi,"Mdm Speaker, I rise in support of the Bill. The working people of Singapore regardless of nationalities, types of job, union membership, age or gender requires a channel for fair and just hearing and judgment that calls for social justice. It is indeed timely that our workers be provided for an inclusive, accessible, expeditious and fair trial for employment claim matters for any specified employment dispute concerning the recovery of salary, re-employment dispute, for any specified employment dispute where an employment relationship ceased. In this way, workers in non-unionised industry sectors will largely benefit from this tribunal. However I have few clarifications to raise and hope the Minister will provide further clarity."
2016-08-16-T-012-S-00725,2016-08-16-T-012,725,K Thanaletchimi,"In order to allow for mediation process as first line of amicable settlement, the mediation proceeding is seen to be set as a precursor before one proceeds to Employment Claims Tribunal at the discretion of the Commissioner. The mediation process must be encouraged and supported for a win-win outcome. There are presently various different mediation routes to cater for various distinct class of workers as mentioned earlier by the Minister. MOM's mediation service for employees covered under the Employment Act - that is one. Number two is Tripartite Mediation Framework (TMF) covered under the Industrial Relations Act for employees who are union members working in non-unionised companies. And third is the MOM's conciliation service for unions and unionised companies as per provision under the Industrial Relations Act."
2016-08-16-T-012-S-00726,2016-08-16-T-012,726,K Thanaletchimi,"However, the Bill could have been made clearer as to how mediation through Tripartite Mediation Framework should proceed on Employment Claims Tribunal. Allow me to elaborate. Section 5(1)c states that a claimant ""cannot be represented by an agent, whether paid or otherwise"" in the ECT mediation process; and section 34(1)(d) states that ""the Minister may make regulations to exempt any person or class or persons from all or any of the provisions of this Act, either generally or in a particular case""."
2016-08-16-T-012-S-00727,2016-08-16-T-012,727,K Thanaletchimi,"The question I would like to ask the Minister is – will all cases be referred to the ECT mediation process, regardless of whether the claimant is a Union member or not? If yes, will all unions then have to go through exemption ordered by the Minister in order to represent our members at mediation stage?"
2016-08-16-T-012-S-00728,2016-08-16-T-012,728,K Thanaletchimi,"In terms of representation at the tribunal under section 18, section 34(1)(d) does not apply, that is Minister may not order for exemption to allow for union representation at the tribunal. However, earlier, Minister did mention that unions can represent members at the tribunal. However, the Bill does not state this clearly, so I hope there is more clarity to this."
2016-08-16-T-012-S-00729,2016-08-16-T-012,729,K Thanaletchimi,"Claim limits. According to section 12(7), there are set limits on the claims but the exact amount is silent in the Bill. Section 14 states that ""a claim cannot be divided and pursued in separate proceedings before a tribunal if the only reason for doing so is to bring the total amount alleged to be payable in each of those proceedings within the jurisdiction of a tribunal"", while section 15 gives claimants the option to abandon the part of the claim that exceeds the set limit so that they can be eligible for hearing at the tribunal."
2016-08-16-T-012-S-00730,2016-08-16-T-012,730,K Thanaletchimi,"The question is – how was the limit set and why was there a limit in the first place? If the limit is not specified in the Bill, does it mean that it can be varied? How will the limits be made known? Can the claimant file for separate proceedings if he or she has multiple claims of different form? For example, if claimant has already filed for a case on his overtime (OT) pay for a few thousand dollars, will he be able to file for another hearing for his bonus payment? I hope this can be done."
2016-08-16-T-012-S-00731,2016-08-16-T-012,731,K Thanaletchimi,What happens if there is a deadlock during the ECT proceedings or parties disagree with the decision of the tribunal? Is appeal to High Court through section 23 the only available route? Can a union member at the advice of the Union proceed further to IAC instead?
2016-08-16-T-012-S-00732,2016-08-16-T-012,732,K Thanaletchimi,"The tribunal magistrates that are specialised in this process. Do they have any experience on labour matters? If not, will this be a concern and how will it be addressed?"
2016-08-16-T-012-S-00733,2016-08-16-T-012,733,K Thanaletchimi,"Time bar of employer's claims. In most cases of employees making claims, there is a time bar to the extent of their claims whereas in the case of employers making recovery of overpayments there is no similar time bar imposed. Does this time bar apply to both employers and employees making similar claims, for example short payment or over payment of overtime pay?"
2016-08-16-T-012-S-00734,2016-08-16-T-012,734,K Thanaletchimi,"What happens if ECT ordered company to pay, up to the three months' pay, but thereafter company refuses, how should the claimant proceed? Under the administration of Justice Bill which was passed last night, this would be an act of contempt of court. Will the company be liable and subject to penalty or will the tribunal demand for the payment to be made good by the employer such as in the form of instalment payment or payment recovered by Writ of Seizure and Sale of Asset?"
2016-08-16-T-012-S-00735,2016-08-16-T-012,735,K Thanaletchimi,"The other clarifications I would like to make is that will the Employment Claims Tribunal address claims under the Employment of Foreign Manpower Act? If not, why not? The Regulations at section 34 of the Bill leaves this question open."
2016-08-16-T-012-S-00736,2016-08-16-T-012,736,K Thanaletchimi,"As much of the evidence that employees need to prove their claim would often be in the hands of employers, can the tribunal draw an adverse inference where the employer is not forthcoming with that information so as to facilitate access to evidence?"
2016-08-16-T-012-S-00737,2016-08-16-T-012,737,K Thanaletchimi,"Section 10 of the Bill seems to be silent on the contents of the record of the tribunal and whether parties are entitled to a copy of this record. It seems a stark contrast to section 13(2) of the Small Claims Tribunals Act, where another court under the same cluster which the Employment Claims Tribunal will be in, which expressly fleshes out the above. Is there a reason for this? Should the Bill go even further than section 13(2) of the Small Claims Tribunal Act and require written reasons for decisions?"
2016-08-16-T-012-S-00738,2016-08-16-T-012,738,K Thanaletchimi,"Can non-monetary claims such as unfair dismissal, discrimination be included within the ambit of the Employment Claims Tribunal in future or are the alternative avenues at present sufficient? Madam, with these clarifications raised, I still strongly support the Bill."
2016-08-16-T-012-S-00739,2016-08-16-T-012,739,Daniel Goh Pei Siong,"Mdm Speaker, the setting up of the Employment Claims Tribunal is long overdue. This Bill is a welcome relief for workers. I am sure there will be many refinements down the road to ensure that workers get paid their rightful salaries. For now, I have a few issues that I would like to put to the Minister to address."
2016-08-16-T-012-S-00740,2016-08-16-T-012,740,Daniel Goh Pei Siong,"First, the most important feature of the Employment Claims Tribunal is that it covers workers not covered under the Employment Act, especially Professionals, Managers and Executives who earn more than $4,500 a month. The setting up of the Tribunal finally recognises that compelling PMEs to file their claims with the civil courts can be lengthy and costly, thus discouraging PMEs from pursuing their just compensation and creating the unintended consequences of protecting unscrupulous employers."
2016-08-16-T-012-S-00741,2016-08-16-T-012,741,Daniel Goh Pei Siong,"However, the obstacles faced by PMEs might return in another form with the Tribunal. This is the limit on claims amount. It was stated in the Ministry of Manpower's public consultation exercise that claims amount would be capped at $20,000 per claim, or $30,000, if claimants go through the Tripartite Mediation Framework or MOM conciliation. I would like to clarify with the Minister if this, indeed, would be the case."
2016-08-16-T-012-S-00742,2016-08-16-T-012,742,Daniel Goh Pei Siong,"If so, what is the purpose of differentiating the claims limit between the two types of claimants, and why give a higher allowance to claimants going through the Tripartite Mediation Framework or MOM conciliation when these claimants have more alternative avenues to resolve their salary-related issues? Secondly, is not the $20,000 cap too low for PMEs, this being less than five months of salary for those earning $4,500 a month?"
2016-08-16-T-012-S-00743,2016-08-16-T-012,743,Daniel Goh Pei Siong,"Clause 12, subsection 8, gives the Government the flexibility to prescribe different classes of employees and employers and different claim limits for different classes of claimants and different circumstances. Rather than to prescribe different classes in terms of whether they go directly to the Tribunal or through the Tripartite Mediation Framework, I believe the logical thing to do, given the differentiated employment market, is to prescribe different classes of claimants according to their salary range and set the different claim limits accordingly to ensure inclusive coverage of PMEs."
2016-08-16-T-012-S-00744,2016-08-16-T-012,744,Daniel Goh Pei Siong,"Better still, to ensure fairness to all workers, would the Minister consider a more dynamic claims limit that is pegged to six months of the claimant's last drawn salary or $30,000, whichever is higher? The claims limit should not be pegged to the claims limit of the Small Claims Tribunal. Employment claims are by nature, by complexion and by quantum dissimilar to small commercial claims. It is very important that we send a signal to employers and employees alike that employment claims are not small claims."
2016-08-16-T-012-S-00745,2016-08-16-T-012,745,Daniel Goh Pei Siong,"The second issue is the time limit to submit a mediation request. Clause 3, subsection 2, sets out two different timings for claimants, six months after the last day of employment for disputes where an employment relationship has ended or one year after the occurrence of the dispute for other disputes, presumably where the employment relationship has not ended. This seems anomalous, as I would expect the majority of cases to fall under the former category where the employment relationship has ended."
2016-08-16-T-012-S-00746,2016-08-16-T-012,746,Daniel Goh Pei Siong,"The six-month timing is, therefore, potentially disadvantageous to the majority of claimants and also add an extra burden to workers who find themselves in the unfortunate situation of becoming unemployed and in an acrimonious salary dispute with their former employers. I believe the Government can be more liberal and understanding of the situation faced by unemployed workers by extending the timing from six months to one year. This will also equalise the timings among the different specified employment disputes under clause 3, subsection 2, making it fair for all workers."
2016-08-16-T-012-S-00747,2016-08-16-T-012,747,Daniel Goh Pei Siong,"The third issue is the question of representation before the Tribunal. Clause 5 specifies that claimants must act in person and cannot be represented by an advocate and solicitor or by an agent, paid or otherwise. On the other hand, an officer or full-time employee could represent employers for the dispute. There is a potential imbalance here that would disadvantage claimants. Companies could send their in-house lawyers or professional human resource professionals at no cost to them. In such a situation, PMEs would also be disadvantaged, not to mention rank-and-file workers and foreign workers hampered by language differences and lack of knowledge. Discretionary powers should be given to the Tribunal to allow claimants representation by advocates or agents when it is apparent that the claimants are at a disadvantage."
2016-08-16-T-012-S-00748,2016-08-16-T-012,748,Daniel Goh Pei Siong,"The fourth issue is the question of enforcement. Clause 22, subsection 11, states that a claims order made by the Tribunal might be enforced in the same manner as that made by a District Court. The Minister for Manpower said in his reply to a Parliamentary Question in May 2015 that the Ministry cleared 1,630 cases of salary disputes in 2014, but one-third of workers did not receive the full payment on the pretext that the companies who owed them salaries were facing financial difficulties. When the Ministry investigated further, 80% of the employers who did not make full payment were discovered to be able to make the full payment."
2016-08-16-T-012-S-00749,2016-08-16-T-012,749,Daniel Goh Pei Siong,"It is apparent from this that enforcement of the claim orders could be a major problem going forward, and active enforcement on the part of the Ministry is the only way to minimise the problem. The Minister said in his 2015 reply that the Ministry is looking into enhancing the protection for workers in this regard more holistically. Could we get an update on how the Ministry intends to do this to minimise non-compliance with claim orders?"
2016-08-16-T-012-S-00750,2016-08-16-T-012,750,Daniel Goh Pei Siong,"Lastly, concerning the public consultation on the Bill that closed on 23 March this year, the summary of key comments received and the Ministry's responses was not published on the REACH website or the Ministry's website as promised. Would the Minister inform the House what are some of the key concerns the public had with the Bill and the Ministry's responses to them? Would the Minister also please cause the summary of responses to be published online?"
2016-08-16-T-012-S-00751,2016-08-16-T-012,751,Daniel Goh Pei Siong,"Notwithstanding the above issues, this setting up of the Employment Claims Tribunal is a good beginning. Mr Deputy Speaker, Sir, I support the Bill."
2016-08-16-T-012-S-00752,2016-08-16-T-012,752,Randolph Tan,"Thank you, Mr Deputy Speaker, Sir. The Bill before us today will affect all major segments of the workforce, with very few minor exceptions, especially the fastest-growing group of PMETs. Since 2008, PMETs have made up a majority of the resident workforce. This is true in all three major sectors, even construction, which saw its PMET proportion just exceed 50% in 2015. It comes as no surprise, therefore, that PMETs are also increasingly represented among the unemployed and those laid off."
2016-08-16-T-012-S-00753,2016-08-16-T-012,753,Randolph Tan,"These changes took place very quickly. In 1990, the proportion of PMETs in the resident workforce was just half the 2015 figure; the proportion in manufacturing just a third of the 60% it has climbed by 2015. Through such rapid changes, the economy continued to maintain very low levels of unemployment."
2016-08-16-T-012-S-00754,2016-08-16-T-012,754,Randolph Tan,"Policymakers have been alert to the challenges arising from the rapidly changing composition of the workforce. The MOM, in particular, has not held back and instead, delved deep into the underlying problems, with initiatives, such as the Professional Conversion Programmes beginning in 2007, and the Career Support Programme in October 2015 as well. As the Minister for Manpower revealed at this year's COS debate, his Ministry's approach in implementing these initiatives has become increasingly direct and oriented to the individual jobseeker's needs."
2016-08-16-T-012-S-00755,2016-08-16-T-012,755,Randolph Tan,But jobs do not appear out of thin air. A labour market framework that facilitates jobs creation is needed. The recognition of this overall framework for employment has to evolve to match the needs arising from these changes. And this is exactly what the Bill today signifies ‒ an advance in our labour market framework.
2016-08-16-T-012-S-00756,2016-08-16-T-012,756,Randolph Tan,"In January 2015, Parliament passed the Industrial Relations Amendment Bill to extend union representation to PMETs. In August 2015, Parliament voted overwhelmingly on an amendment to the Employment Act which obliged employers to ensure that each employee is provided with properly written or electronic records of individual employment terms and salary payments and deductions."
