speech_id,topic_id,speech_order,member_name,text
2016-04-12-T-002-S-00232,2016-04-12-T-002,232,Ng Chee Meng,"Mr Leon Perera asked about the next-generation ERP system. As LTA had announced, the system is being developed and will be implemented from 2020. This new system will open up many opportunities to improve our transport system, beyond congestion management. There is, of course, potential to offer added-value services to motorists, such as using it to replace the paper coupon usage for roadside parking, getting more accurate and real-time traffic information, providing such real-time information to motorists and also including enhancements to the Off-Peak Car schemes."
2016-04-12-T-002-S-00233,2016-04-12-T-002,233,Ng Chee Meng,"Mr Perera also raised concerns about privacy under the next-generation ERP. LTA takes this issue very seriously. For the purposes of traffic management, only aggregated data will be used by LTA and we will also ensure that the appropriate data security technologies and controls are put in place for all data use. MHA has already addressed the ERP 2.0 for security uses and I will not go further into that. Mr Perera has made some good suggestions that MOT will also take on board to study as we look at the renewal of the ERP system."
2016-04-12-T-002-S-00234,2016-04-12-T-002,234,Ng Chee Meng,"Mr Muhamad Faisal Abdul Manap shared his concern regarding COEs for motorcycles and suggested different forms to make the Cat D motorcycle COE framework better. Mr Henry Kwek suggested riding on the introduction of the next-generation ERP system to consider increasing COE quotas for motorcycles, on the basis that ,being smaller in size, they contribute less to congestion."
2016-04-12-T-002-S-00235,2016-04-12-T-002,235,Ng Chee Meng,"First, I would like to point out that the lesser contribution of motorcycles to congestion is already accounted for in the lower ERP rates they pay, compared to other vehicle types. In addition, owners of motorcycles enjoy several concessions, such as lower taxes, compared to car owners."
2016-04-12-T-002-S-00236,2016-04-12-T-002,236,Ng Chee Meng,"On the specific suggestion of allowing Cat D owners to have unlimited shorter-term renewal, currently, COE tenures are all fixed at 10 years for all categories and, as a concession, vehicle owners are allowed a five-year renewal on the condition that they deregister their vehicle thereafter."
2016-04-12-T-002-S-00237,2016-04-12-T-002,237,Ng Chee Meng,"Allowing repeated short-term renewals for motorcycles, however attractive, favours the incumbent owners and delays timely deregistration, and this reduces the quota for potential new buyers of motorcycles. It can also lead to older and potentially more pollutive motorcycles remaining on our roads. This is a phenomenon that we actually see today, where older motorcycles are kept on the roads for a long time, polluting the air. While these suggestions are on the table, we will continue to study this and see how we can make the Cat D framework better."
2016-04-12-T-002-S-00238,2016-04-12-T-002,238,Ng Chee Meng,"But, ultimately, the COE system is designed to help control Singapore's vehicle population, given the land constraints. As Minister Khaw has explained, there is very limited room for us to grow the overall vehicle population, whether it is for cars or motorcycles. We should, therefore, be very cautious about increasing the COE supply in one form or another. Instead, we should be encouraging Singaporeans to move towards public transport. Having said that, I do know that COE is a hot topic and LTA does regularly review the COE framework to keep the system updated."
2016-04-12-T-002-S-00239,2016-04-12-T-002,239,Ng Chee Meng,"Assoc Prof Daniel Goh suggested levying a COE surcharge on multiple COEs registered to a household. Indeed, he pointed out that this is not a new suggestion. MOT has consulted the public extensively in 2013 on this issue and the outcome of the discussion was that this form of surcharge or the form of proposal given by Assoc Prof Daniel Goh would be very easy to circumvent. It would also inadvertently penalise households that are larger. LTA had, therefore, decided not to implement such a measure back in 2013 after extensive consultation. All the considerations and findings had been shared and discussed with Singaporeans."
2016-04-12-T-002-S-00240,2016-04-12-T-002,240,Ng Chee Meng,"Mr Ang Wei Neng and Mr Yee Chia Hsing have offered suggestions to address the trend of Cat E COEs being used mainly to register Cat B cars. The Cat E provides flexibility in the COE system by allowing the vehicle mix to evolve in response to market demand. While most of the Cat E COEs in recent years have gone to Cat B, this has not been the case always. For instance, Cat E COEs were routinely used to register Cat C vehicles between the years 2008 and 2010, when Cat C COE prices exceeded that of Cats A and B COE prices. We also saw this in recent COE bidding exercises just this year."
2016-04-12-T-002-S-00241,2016-04-12-T-002,241,Ng Chee Meng,"Nonetheless, to maintain a more stable supply of COEs in each category, we had lowered the Cat E contribution rate from 25% previously to 20% back in 2012 and further to 15% in 2013 and to 10% in February last year. We are not keen on lowering the contribution rate to zero as it is still helpful to keep some fluidity within the system, so that COEs can still move across different categories to meet demand. Again, the COE system, as I have said, is one area that LTA monitors closely and we will continue to study this area with all the suggestions that are given."
2016-04-12-T-002-S-00242,2016-04-12-T-002,242,Ng Chee Meng,"On the impact of the Early Turnover Scheme (ETS) on Cat C quotas and premiums, while the ETS reduces the quota available for bidding, it also reduces the actual demand for new Cat C COEs. This is because when an ETS-eligible vehicle is deregistered, that COE can be used to register a new vehicle within a one-month period. This means that the owner of the ETS-eligible vehicle would already have a COE obtained in this manner and would not need to bid for a fresh COE for his or her new vehicle. In fact, what we have observed is that Cat C COE prices have seen a slight downward trend generally since the introduction of the ETS in April 2013."
2016-04-12-T-002-S-00243,2016-04-12-T-002,243,Ng Chee Meng,"Mr Ang Wei Neng also asked if we should consider smoothening the supply of Cats A and B COE quotas in the coming year. We have studied this issue extensively. It is really difficult to determine the optimal amount of quota supply to hold back and determine the right time to release the withheld quota back into the system. The risks of inadvertently causing even more volatility in COE premiums are very real. In any case, even our projections were not right on target. Recently, many more car owners have decided to renew their COEs and this has tempered the previously expected increases in Cats A and B COE supply by more than 10% in the last two quarters. Hence, we feel that it is better that we leave it to the market to determine the supply of quotas."
2016-04-12-T-002-S-00244,2016-04-12-T-002,244,Ng Chee Meng,"To conclude, a car-lite Singapore does not mean a carless Singapore. Car-lite is about creating an eco-system of transport options in the form of good quality public transport, first-and-last-mile options and point-to-point services like taxis and chauffeured services, so that Singaporeans feel that their commuting needs can be met without owning a car."
2016-04-12-T-002-S-00245,2016-04-12-T-002,245,Ng Chee Meng,"Importantly, it also requires a change in mindset, lifestyle and culture to one of sustainable, smart and green mobility. As Minister Khaw and Senior Minister of State Josephine Teo have stated, we have started the journey and, together, we ask Singaporeans to come along this journey with all of us to make our transportation system better and greener for the future."
2016-04-12-T-002-S-00246,2016-04-12-T-002,246,Zaqy Mohamad,"Mdm Chair, Singapore's status as a major trade and business hub in Asia is heavily dependent on our air and sea connectivity for us to provide easy access to people, goods and capital. In line with this, the Government's announcements to build Terminal 5, a third runway at Changi Airport, as well as a new port in Tuas, are designed to build our capacity as an air and maritime hub in Southeast Asia. Can the Ministry elaborate on what are the new capabilities that will be developed as part of these developments that can benefit and differentiate Singapore as a maritime and air hub and for businesses to look forward to?"
2016-04-12-T-002-S-00247,2016-04-12-T-002,247,Zaqy Mohamad,"Last year, Singapore also saw the sale of its national liner, NOL, to a foreign entity. With the sale of NOL, what are some of MOT's plans to ensure that we do not lose container volumes and that the sale would not adversely impact our logistics sector, in particular, in the mid to long term, where the new entity's private sector interest may change due to competitive or business priorities? How does the sale of NOL impact our position as a strategic maritime hub, given that a foreign entity now has better access to our strategic port facilities?"
2016-04-12-T-002-S-00248,2016-04-12-T-002,248,Zaqy Mohamad,"The redevelopment of our strategic plan and maritime capabilities would enhance our economic and transport standing in the region. But it is also important that these developments provide for meaningful business and jobs for Singaporeans. What are the expected new jobs and business opportunities that these hubs will bring to Singapore and what are the Ministry's manpower development plans to provide these enhanced sectors with a Singaporean Core? How can we get young Singaporeans also excited about the prospects of working in these transport hubs, given that these are not typical professions that our young look forward to? I think there is that scope to make it sexier."
2016-04-12-T-002-S-00249,2016-04-12-T-002,249,Ang Hin Kee,"Mdm Chair, air travel is now made more affordable due to the popularity of low-cost carriers or the so-called budget airlines. Through interactions with the budget airline staff in my capacity as an advisor to one of the airline house unions, I understand that the operating mode of low-cost carriers can potentially generate high levels of stress and fatigue amongst the flight crew."
2016-04-12-T-002-S-00250,2016-04-12-T-002,250,Ang Hin Kee,"Budget airlines typically keep costs down by deploying the flight, cabin crew and aircraft in the most economically efficient manner. Furthermore, these low-cost carriers may get more red-eye flights, as well as less favourable arrival and departure timings, with short turn-around flights as well."
2016-04-12-T-002-S-00251,2016-04-12-T-002,251,Ang Hin Kee,"By that, it may mean that the pilots have tight rosters and operate at or near maximum flight and duty time limits. As for the cabin crew, they may have to work extra hard to turn-around the plane within shorter timelines."
2016-04-12-T-002-S-00252,2016-04-12-T-002,252,Ang Hin Kee,"Staff should have sufficient rest periods during duty time to perform at an optimal level, so that neither service delivery nor the well-being of crew is compromised. With hectic working hours, safety and welfare conditions of the airline crew should be looked into."
2016-04-12-T-002-S-00253,2016-04-12-T-002,253,Ang Hin Kee,"Currently, there is little data or research done in this area. Will the Ministry consider embarking on a study to understand the needs, challenges and stress faced by the crew in budget airlines, as well as full-service airlines?"
2016-04-12-T-002-S-00254,2016-04-12-T-002,254,,Senior Minister of State Josephine Teo.
2016-04-12-T-002-S-00255,2016-04-12-T-002,255,Josephine Teo,"Mdm Chair, I thank Mr Zaqy Mohamad for his interest in strengthening Singapore's position as a global aviation and maritime hub. Together, the direct economic contribution of these two sectors amounts to 13% of our GDP. Their indirect contribution is much larger. For example, our financial services, tourism, manufacturing and logistics sectors are considerably enhanced because of our position as aviation and maritime hubs."
2016-04-12-T-002-S-00256,2016-04-12-T-002,256,Josephine Teo,"Let me start by providing an update on aviation. Our air hub now provides good jobs to some 55,000 people. The dedication and pride of these staff have made Changi Airport the most-awarded airport worldwide for passenger experience. As a result, passenger traffic has continued to grow. Thanks in part to a rebound in tourist arrivals from key markets, such as China, Thailand and Australia, a record 55.4 million passengers flowed through Changi in 2015. Airfreight volumes, which have been lacklustre everywhere, still managed a 0.5% growth."
2016-04-12-T-002-S-00257,2016-04-12-T-002,257,Josephine Teo,"We continue to be optimistic about Changi's prospects. Air travel in the Asia Pacific is projected to double over the next two decades. We have also put in place policies to ensure that Changi remains a leading air hub and continues to provide good global connectivity for our people and businesses. If Asia grows as projected, passenger traffic through Changi can also be expected to grow at between 3% and 4% annually over the next two decades."
2016-04-12-T-002-S-00258,2016-04-12-T-002,258,Josephine Teo,"A key plank of our strategy to ride this growth momentum is to expand Changi Airport. Terminal 4 is on track to open in the second half of 2017 and Jewel Changi Airport in 2019. Works to operationalise a three-runway system are also going well, with Changi Airport Group (CAG) having awarded the first construction contract in October 2015. We expect the three-runway system to be operational in the early 2020s."
2016-04-12-T-002-S-00259,2016-04-12-T-002,259,Josephine Teo,"The centrepiece in positioning Changi Airport for the future is Terminal 5. Since finalising its concept plan in 2014, we have been engaging the aviation community to develop a robust and flexible design that will stand the test of time. This is a mammoth task, as Members will know by now, that when T5 is fully developed, it will, in fact, be bigger than Terminals 1, 2 and 3 combined. So, you take Terminals 1, 2 and 3 today, put them together and imagine what Terminal 5 is going to be like. With Terminals 1, 2 and 3 today, if you just add them up, it is 66 million passengers. After Jewel Changi Airport, actually Terminal 1 should be able to handle a little bit more. So, that is the scale that we are talking about."
2016-04-12-T-002-S-00260,2016-04-12-T-002,260,Josephine Teo,"Terminal 5 will open in the late 2020s and be operational till about 2050 before a major upgrade is due. It will have to last us much longer than that, but around 2050, that is when you can have a major upgrade. The architects for the design have a heavy responsibility; they will be appointed within the next one to two years."
2016-04-12-T-002-S-00261,2016-04-12-T-002,261,Josephine Teo,"As was the case when we moved our airport from Paya Lebar to Changi, the expansion of our air hub will create many good jobs for Singaporeans and business opportunities for our companies, in areas ranging from airport management to aircraft maintenance."
2016-04-12-T-002-S-00262,2016-04-12-T-002,262,Josephine Teo,"But we are also mindful that with our manpower constraints, quantum improvements in productivity are needed. Efficiency-enhancing innovations must be incorporated into the new facilities at Changi as well as existing ones. These efforts will be complemented by programmes to attract Singaporeans to take up aviation careers and continuously upgrade their skills. The bottom line is this  for our air hub, we must always be ready to take advantage of improved technologies as they become available."
2016-04-12-T-002-S-00263,2016-04-12-T-002,263,Josephine Teo,"One aspect of aviation which requires constant and careful attention is safety. Most of us do not have to think too much about it and that is only because many other people in aviation spend a great deal of time and resources to make sure that we get to fly safely. Therefore, I am glad that Mr Ang Hin Kee has asked about rest, welfare, training and other needs of low-cost carrier crew, because it is, ultimately, about safety."
2016-04-12-T-002-S-00264,2016-04-12-T-002,264,Josephine Teo,"All Singapore carriers, both full-service and low-cost carriers, are required to meet the same safety standards for fatigue management and crew training and competency promulgated by the Civil Aviation Authority of Singapore (CAAS). These standards are based on scientific research and studies and consistent with the requirements of the International Civil Aviation Organization (ICAO). You have to set the standards and what are the standards based on? You have got to do studies. And you have to leverage on other studies that are present, or do your own studies. Most of our airlines have done their own studies."
2016-04-12-T-002-S-00265,2016-04-12-T-002,265,Josephine Teo,"In particular, there are mandatory rest periods between duty periods to ensure that the crew have sufficient rest. All airlines are also required to have structured training and competency frameworks and ensure that their crew maintain currency in their operational duties. Tests are conducted annually to ensure that crew members have the necessary competencies."
2016-04-12-T-002-S-00266,2016-04-12-T-002,266,Josephine Teo,"Rules aside, it is penny-wise and pound-foolish for anyone involved in aviation to take chances with safety. It has very much to do with culture. That is why in the Singapore air hub, we instil and reinforce a safety culture through stringent independent audits and regular exercises."
2016-04-12-T-002-S-00267,2016-04-12-T-002,267,Josephine Teo,"Another area where safety matters a great deal is in air traffic management (ATM). As Members know, CAAS manages the airspace known as the Singapore Flight Information Region (FIR). The Singapore FIR, which was assigned by ICAO in 1946, has seen air traffic grow by leaps and bounds."
2016-04-12-T-002-S-00268,2016-04-12-T-002,268,Josephine Teo,"Last year, it handled some 650,000 flights, which are 50% more than 10 years ago. Six hundred and fifty thousand flights that our Singapore FIR manages, flying through our skies. But of this number, around 40% were over-flights, meaning that they neither landed at nor departed from Changi; they are just over-flights. They are part of the air connectivity of other countries. By 2025, it is projected that more than a million flights will fly through the Singapore FIR annually."
2016-04-12-T-002-S-00269,2016-04-12-T-002,269,Josephine Teo,"Given the importance of the Singapore FIR to the international aviation community – it is not just for us, it is for the international aviation community – Singapore takes its responsibility as the FIR manager very seriously. To ensure the highest levels of safety and efficiency and to prepare for the growth in regional air traffic, CAAS invests heavily to enhance our ATM capabilities."
2016-04-12-T-002-S-00270,2016-04-12-T-002,270,Josephine Teo,"For example, our pool of air traffic controllers has expanded and will grow further from 380 today to 600 within the next five years. Our state-of-the-art ATM system – the third-generation Long Range Radar and Display System (LORADS III) – is one of the most advanced in the world. We continually incorporate advanced technologies, such as Automatic Dependent Surveillance-Broadcast (ADS-B), which allows CAAS to extend tracking of aircraft beyond radar coverage. This, in turn, allows us to provide better ATM services to more aircraft to fly safely within a block of airspace. From 2018, we expect to also use satellite technology to track aircraft."
2016-04-12-T-002-S-00271,2016-04-12-T-002,271,Josephine Teo,"With a firm eye on the future, CAAS is commissioning significant research and development efforts in ATM. It has embarked on an initiative to develop Singapore as a Centre of Excellence for ATM by setting aside $200 million to fund research and development projects. Within Southeast Asia, this is the only cluster of research and development focusing on ATM. In less than three years, the initiative has built up a pool of more than 50 researchers and funded more than 20 projects."
2016-04-12-T-002-S-00272,2016-04-12-T-002,272,Josephine Teo,"The investment has started to bear fruit. For example, CAAS is working with its counterparts in Thailand and Hong Kong to develop a concept to better manage air routes with heavy traffic. Typically, air traffic controllers worry about getting departing flights out on time, but not whether there could be bunching when these flights arrive at their destinations. So, as an air traffic controller, if you have a job to get a flight out, your job is to make sure it gets out on time. But you never really worried about what happens when it arrives at the destination airport and if there could be bunching."
2016-04-12-T-002-S-00273,2016-04-12-T-002,273,Josephine Teo,This collaboration will allow air traffic controllers at both the departure and arrival airports to share information and adjust the departure times of flights to avoid bunching at both ends. This is especially helpful for busy routes which will get more congested as regional air traffic grows; it will minimise delays and optimise capacity usage at each airport – and we know airport capacity is very expensive. The concept is now undergoing operational trials. We intend to pair up with more airports so we can manage the growing air traffic in our region more efficiently.
2016-04-12-T-002-S-00274,2016-04-12-T-002,274,Josephine Teo,"As all fair-minded users of our air navigation services can attest, CAAS air traffic controllers conduct their operations professionally and objectively, in accordance with international standards and best practices. With the help of technology and research insights, our controllers will raise their game and uphold the trust and confidence of the international aviation community using the Singapore FIR."
2016-04-12-T-002-S-00275,2016-04-12-T-002,275,Josephine Teo,"On this note, let me reiterate that FIR boundaries are designated by ICAO based on technical and safety considerations to ensure air traffic safety and efficiency. Inevitably, FIRs cross national airspace boundaries and air traffic controllers are expected to consistently and professionally handle aircraft movements in their designated FIRs, irrespective of who owns the airlines, where the flights originate from or are headed."
2016-04-12-T-002-S-00276,2016-04-12-T-002,276,Josephine Teo,"If FIR boundaries were based on state boundaries alone, we would see fragmentation of regional airspaces. This means breaking them up into smaller pieces with more parties managing the airspaces, more complexity, multiple points of coordination and, certainly, more safety risks."
2016-04-12-T-002-S-00277,2016-04-12-T-002,277,Josephine Teo,"In fact, fragmentation of regional airspaces runs counter to calls by the international aviation community, particularly the airlines which have to operate the flights, for more seamlessly-integrated airspaces. Europe is taking the lead on this move, with the Single European Sky vision being one such example."
2016-04-12-T-002-S-00278,2016-04-12-T-002,278,Josephine Teo,"Indeed, with air traffic in ASEAN projected to grow strongly, it is all the more important that airspaces in our region be more integrated, not less. We need to enable more aircraft to fly safely and efficiently within the same volume of airspace. If we cannot do so, we will fail to capture the opportunities that aviation connectivity provides to all our economies."
2016-04-12-T-002-S-00279,2016-04-12-T-002,279,Josephine Teo,"It was, therefore, far-sighted that ASEAN Leaders called for the implementation of a Seamless ASEAN Sky when they met last year. Singapore is committed to this worthy goal."
2016-04-12-T-002-S-00280,2016-04-12-T-002,280,Josephine Teo,"Mdm Chair, let me now move on to the maritime sector. The shipping industry, which anchors our maritime sector, has been in difficult waters for several years now. For the first time since the 2009 Global Financial Crisis, PSA saw container volumes decline last year. Charter rates for offshore and dry bulk carriers have come under intense pressure due to weakened demand."
2016-04-12-T-002-S-00281,2016-04-12-T-002,281,Josephine Teo,"Nevertheless, the medium- to longer-term outlook is positive. Over the years, we have made significant gains in building up various aspects of our International Maritime Centre. It is today more multi-faceted and vibrant than before, with activities ranging from maritime insurance to LNG bunkering. Moreover, the maritime community here is resilient and adaptable."
2016-04-12-T-002-S-00282,2016-04-12-T-002,282,Josephine Teo,"Employment levels in the maritime sector have also remained stable at around 170,000. With Government support, we believe that recovery in shipping will return and broad-based growth momentum will pick up again."
2016-04-12-T-002-S-00283,2016-04-12-T-002,283,Josephine Teo,"To lend a helping hand to shippers, the Maritime and Port Authority of Singapore (MPA) enhanced the port dues concession to offshore support vessels in November last year. Last week, MPA extended the concession to dry bulk carriers. MPA has also granted an additional 10% port dues concession to container vessels calling at Singapore."
