speech_id,topic_id,speech_order,member_name,text
2018-05-16-T-003-S-00278,2018-05-16-T-003,278,Low Yen Ling,"Singapore has always been a place of promise and possibilities, attracting many ashore. And today, we continue to create new opportunities for Singaporeans from all walks of life. President Halimah’s Address has set out our vision towards developing a vibrant economy that invests in the skills and talents of our people. We aspire to be a caring and inclusive nation at the workplace too. We envisage a Singapore where young graduates, older workers and women have ample opportunities to discover their potential and have a fulfilling work life."
2018-05-16-T-003-S-00279,2018-05-16-T-003,279,Low Yen Ling,"Last Sunday was Mother’s Day and my family celebrated it with a simple meal with my 67-year-old mother. She has always been our pillar of strength, and despite her age, she insists on working because it keeps her going. She had worked throughout her life, dancing a delicate balance between family commitments and her job when we were younger and later caring for my ageing grandmother."
2018-05-16-T-003-S-00280,2018-05-16-T-003,280,Low Yen Ling,"Like her and like many mothers, we want the best for our family, and at the same time, we strive to give our all at home and at work. Thankfully, Singaporean women today are better positioned to juggle between the worlds of home and work as we are starting from a higher vantage point than before."
2018-05-16-T-003-S-00281,2018-05-16-T-003,281,Low Yen Ling,"Over the years, Singaporean women have made strides in education and at work. Last year, more women than men graduated with a first degree from our local universities. We had about 8,200 female graduates, compared to 7,700 males."
2018-05-16-T-003-S-00282,2018-05-16-T-003,282,Low Yen Ling,"Close to 40% of those who graduated from science, technology, engineering and mathematics (STEM) courses in our homegrown universities comprise of women. More than a third of our STEM polytechnic graduates are also female. More women are now in the workforce. Our female employment rate has grown from 64% in 2007 to 72% in 2017. In terms of women in full-time employment, we are now ranked sixth when compared with the OECD nations."
2018-05-16-T-003-S-00283,2018-05-16-T-003,283,Low Yen Ling,"With meritocracy and better education, our women are inching up the gender pay gap. In 2017, women in our resident workforce, in general, earned 9% less than men. This places us in the company of the top 10 OECD countries, and ahead of countries like Australia, Germany, the UK and the US. Median incomes of women in occupations like accountants, securities and finance brokers were higher than men."
2018-05-16-T-003-S-00284,2018-05-16-T-003,284,Low Yen Ling,"However, we still have some way to go. I agree with Miss Cheryl Chan, Ms Thanaletchimi and Ms Tin Pei Ling that there is more to be done to encourage women to remain in the workforce."
2018-05-16-T-003-S-00285,2018-05-16-T-003,285,Low Yen Ling,"While our full-time employment rate for women is ranked highly compared to the other OECD countries, our part-time employment rate is not. We want to close this gap as much as possible because employers as well as female employees stand to gain from Flexible Work Arrangements (FWAs). Companies that offer FWAs do better in attracting and retaining the best talents. In addition, a survey in 2016 found that majority of such companies reported higher employee staff morale and improved productivity. Women who have the options of FWAs do not need to choose between full-time work and zero-time work, and they are able to stay in touch with the marketplace with their skills and with their experience."
2018-05-16-T-003-S-00286,2018-05-16-T-003,286,,"Instead of having our women opt out of work, we want to empower our women with choices to opt in, and stay in the workforce. With the right support, women can have the chance to fulfil both our family and also our career aspirations."
2018-05-16-T-003-S-00287,2018-05-16-T-003,287,,"However, we also know that it is not easy for all companies to offer FWAs due to specific work conditions or rigid working hours. Several Members of Parliament including Miss Cheryl Chan, Dr Intan and Ms Thanaletchimi spoke passionately in the House on this topic with ideas to legislate FWAs or other family-support leave entitlements. These suggestions are not new, and we know that laws alone do not change social behaviours and mindsets. Our approach is a practical one, combining legislation and promotional efforts. In addition, advances in technology and communication can also help to facilitate FWAs."
2018-05-16-T-003-S-00288,2018-05-16-T-003,288,,"MOM is strongly committed to growing the number of companies with FWAs. Firstly, we are enhancing the WorkPro Work-Life Grant with $30 million to encourage and help more employers provide FWAs. The grant also provides additional support for job-sharing arrangements, in recognition that it is harder for employers to provide this type of FWA."
2018-05-16-T-003-S-00289,2018-05-16-T-003,289,,"Secondly, we will encourage more employers to adopt the Tripartite Standard on FWAs which sets the benchmark for organisations and employees to achieve more flexible work options. To date, more than 500 employers, with about 300,000 employees, have adopted this Standard. These employers have publicly pledged to offer FWAs and each of them will appoint a senior management member to champion FWAs in their organisation. They are committed to exploring alternative arrangements with their employees should there be difficulties in forming FWAs in their company."
2018-05-16-T-003-S-00290,2018-05-16-T-003,290,,"At MOM, we want to encourage employers who have not pledged their support to do so. With effect from 5 May 2018, companies can now sign up onto the Tripartite Standards through the Jobs Bank. Previously, they can only do so through the Tripartite Alliance for Fair and Progressive Employment Practices (TAFEP) website. With one more additional platform, it is really now a lot easier for our companies to adopt the Standards."
2018-05-16-T-003-S-00291,2018-05-16-T-003,291,,"Thirdly, MOM will continue to promote FWAs as part and parcel of the modern work life. In today’s age of technology and Internet of Things (IoT), managers, supervisors and co-workers can no longer equate face-to-face time and physical presence at work with an employee’s capability. So, Mr Speaker, Sir, we really need a mindset change that respects, a mindset change that provides and a mindset change that supports choices and supports flexibility at work. This cultural shift will also mean that someone who puts up a request for part-time work or puts up a request for flexible work will not be deemed as a lesser employee."
2018-05-16-T-003-S-00292,2018-05-16-T-003,292,,"Together with our tripartite partners, we will press on to deepen and also widen our efforts to support Singaporean women at work by making FWAs more pervasive and also across the board. Women will have more power to make choices for ourselves and our families, and also the freedom to belong to the workplace as long as we wish to."
2018-05-16-T-003-S-00293,2018-05-16-T-003,293,,"Mr Speaker, Sir, allow me to say something about age-inclusive workforce and society. I want to thank Mr Ng Chee Meng and Mr Heng Chee How for their heartfelt and insightful thoughts on how we can help older Singaporeans stay employable and also adaptable and continue to be valuable contributors to our workplace and to our society."
2018-05-16-T-003-S-00294,2018-05-16-T-003,294,,"This resonates with what the fourth-generation leaders envision for an inclusive and caring Singapore workforce. Throughout the years, we have made progress in supporting our older workers’ choice to work. In the last decade, the employment rate of residents aged 55 years old to 64 years old has grown from 56% in 2007 to 67% in 2017. This places  Singapore in the ninth place when compared to the OECD countries, and"
2018-05-16-T-003-S-00295,2018-05-16-T-003,295,,"Since re-employment laws were introduced in 2012, over 98% of private sector local employees who wished to continue working at 62 years old, were offered re-employment. The vast majority of those who accepted re-employment in the same job did not experience any cut in basic wages."
2018-05-16-T-003-S-00296,2018-05-16-T-003,296,,"Sixty seven-years-old Ms Margaret Tan is one of our older workers who has been with Mandarin Oriental Hotel for the past 14 years. As a Senior Guest Service Manager, she leads a team of over 80 staff. She is a keen learner; she earned two specialist diplomas in the last two years. When she was 65 years old, she embarked on a specialist diploma and within two years, she earned two specialist diplomas. The first one is in Leadership and People, the other one in Service Excellence."
2018-05-16-T-003-S-00297,2018-05-16-T-003,297,,"As Mr Heng Chee How pointed out, it takes two hands to clap. We need willing and far-sighted employers, as well as able and also active older employees to join hands and make our workplace age inclusive."
2018-05-16-T-003-S-00298,2018-05-16-T-003,298,,"Like Mandarin Oriental Hotel, employers that embrace progressive workplace practices which prioritise a person’s abilities over his or her age, they really stand to gain from the deep experience, they stand to gain from the reliability and they stand to gain from the loyalty that our mature workers will bring with them. Older Singaporeans who are ready to adapt and keep on learning, like Ms Margaret Tan, make it attractive for employers to see their potential and view them as valuable assets."
2018-05-16-T-003-S-00299,2018-05-16-T-003,299,,"I agree with Mr Ng Chee Meng, Mr Heng Chee How and also Dr Chia Shi-Lu that ageism has absolutely no place in our society or even workplace. MOM will focus on resources to support companies to unlock the potential of our older workers. We will do so in three ways."
2018-05-16-T-003-S-00300,2018-05-16-T-003,300,,"Firstly, we will continue to provide funding support to employers to redesign their workplace and make the jobs of older workers easier, safer and smarter. Secondly, we will enable and encourage employers to publicly commit to making their workplaces more age-friendly. Thirdly, we will push for more age-inclusive behaviour and move towards eradicating ageism."
2018-05-16-T-003-S-00301,2018-05-16-T-003,301,,"Mr Speaker, Sir, for a nation with no natural resources, every citizen, young or old, is an important asset. In President Halimah’s words, and I quote, this “small, multi-cultural city state…must survive and thrive on the wits and will of its people.”"
2018-05-16-T-003-S-00302,2018-05-16-T-003,302,,"I believe our young Singaporeans have the potential to keep this red dot going strong. We have invested in their education, knowledge and skills, and will continue to give them the edge to hold their own when they start their careers."
2018-05-16-T-003-S-00303,2018-05-16-T-003,303,,"90% of those from the autonomous universities and polytechnics, and 85% for ITE graduates. According to the 2016 Graduate Employment Survey, a good majority of new graduates in full-time permanent employment are also employed in jobs related to their fields of study and that is 81% from autonomous universities and 72% for polytechnic graduates. In addition, the gross median salary of Post-Secondary Education Institution (PSEI) graduates surveyed approximately six months after their final exams is also on an upward trend."
2018-05-16-T-003-S-00304,2018-05-16-T-003,304,,"fast-paced and changing world, they need to be well-armed with information and also knowledge to navigate upcoming trends and future-proof themselves for what is ahead. The rise of the gig economy and also disruptions to traditional occupations throw up a diversity of work options that graduates did not use to have. With these in mind, we have deepened our work on these fronts."
2018-05-16-T-003-S-00305,2018-05-16-T-003,305,,"Firstly, information. We have extended the annual snapshot of employment outcomes for fresh graduates on what is known as the Graduate Employment Survey, to cover all private education institutions with full-time employment programmes. This allows our graduates to make better informed decisions on their choice to work or to further their studies."
2018-05-16-T-003-S-00306,2018-05-16-T-003,306,,"Secondly, career guidance. MOM keeps a pulse on the career trends and aspirations of students from our universities, polytechnics and ITE. We work closely with MOE to guide the students in their career and education choices. A structured education and career guidance (ECG) curriculum and access to ECG-trained counsellors, teachers and lecturers help our students discover their strengths and their career interests."
2018-05-16-T-003-S-00307,2018-05-16-T-003,307,,"In addition, tools such as the MySkillsFuture portal as well as internships, learning journeys, mentorships and career talks – all these form an immersive experience to help our young graduates gain a better understanding of the industries they are trained for."
2018-05-16-T-003-S-00308,2018-05-16-T-003,308,,"Thirdly, job search. We will boost the job search skills of graduating students and enhance their lifelong learning career planning with a new Career Starter Programme. Offered by the Workforce Singapore (WSG) in collaboration with our autonomous universities, polytechnics and ITEs, this new initiative will also offer job search-related training workshops, industry engagement opportunities, virtual and physical career fairs, job referrals and also post-placement support. More details will be shared at a later date."
2018-05-16-T-003-S-00309,2018-05-16-T-003,309,,"Mr Deputy Speaker, Sir, our young graduates benefit from a good education system in Singapore. Please allow me to respond to some of Mr Png Eng Huat's points that he raised earlier. I want to assure him that all schools are subject to the same level of funding for capital expenditure, such as infrastructure, IT and operating costs such as manpower and repairs. All schools can also receive additional funding for special programmes such as electives, overseas trips for experiential learning."
2018-05-16-T-003-S-00310,2018-05-16-T-003,310,,"However, there is differential funding for building of facilities. For standard facilities such as indoor hall or basketball courts, Government schools will be funded 100% while the Government-aided and independent schools have to raise funds to co-fund some of these facilities. So, this is actually contrary to what Mr Png has mentioned earlier."
2018-05-16-T-003-S-00311,2018-05-16-T-003,311,,"I must also add that MOE does not fund non-standard facilities such as tennis courts. We approve the building of non-standard facilities on a case-by-case basis, provided there is significant education value to our students. And these schools will have to raise funds to fully pay for these facilities. Mr Deputy Speaker, Sir, allow me to say few words in Mandarin."
2018-05-16-T-003-S-00312,2018-05-16-T-003,312,,"(In Mandarin)  [Please refer to  Vernacular Speech.] Singapore has been and must continue to be a nation full of opportunities for Singaporeans from all walks of life. MOM’s ambition is for all Singaporeans who are able and willing to work, regardless of gender, age or background, to be able to continue doing so. Helping all our workers, whether men or women, young or old, achieve their work and life aspirations requires change from everyone involved."
2018-05-16-T-003-S-00313,2018-05-16-T-003,313,,"First of all, our workers must adopt a mindset change to embrace new technologies, be open to change and upskill themselves to remain competitive. If workers are willing to stay relevant by upskilling and reskilling themselves, their productivity and efficiency will be able to keep up with times. I believe, by doing so, workplace ageism and sexism will be eradicated slowly."
2018-05-16-T-003-S-00314,2018-05-16-T-003,314,,"Secondly, our employers must change to take the larger view that progressive human resources (HR) practices will benefit the company by attracting and retaining talents and cultivating more committed employees. In this area, MOM will focus our resources on supporting companies to provide FWAs to help our women fulfil both their career and family aspirations."
2018-05-16-T-003-S-00315,2018-05-16-T-003,315,,"Thirdly, the whole society must also change their prejudice and support the culture of inclusivity, and embrace diversity in our workforce. For our young people, we need to support them to leverage their strengths, and choose career and education pathways that will give them the greatest competitive advantage."
2018-05-16-T-003-S-00316,2018-05-16-T-003,316,,"Achievement and success can come in many forms. This is consistent with MOE’s philosophy of ""Many pathways, New Opportunities"". We believe that as long as Singaporeans leverage on their strengths and pursue excellence in fields that they are passionate in, they will find success."
2018-05-16-T-003-S-00317,2018-05-16-T-003,317,,"I have just joined MOM and I look forward to working with the employers, employees and the community to develop a more inclusive workforce. I also hope that Singaporeans from all walks of life can explore together how we can promote a more progressive, enlightened and inclusive workplace culture."
2018-05-16-T-003-S-00318,2018-05-16-T-003,318,,"(In English)  Mr Deputy Speaker, amid an uncertain external environment, we can hold fast to our foundation of meritocracy and also inclusion, as well as joint aspirations for success. Together, we can forge opportunities for all in the workforce, including women, the young as well as the old."
2018-05-16-T-003-S-00319,2018-05-16-T-003,319,,"With a receptive mindset, our workers can embrace learning and new trends, and adapt to stay relevant throughout changing times. Employers who invest in progressive work practices with foresight and with courage will attract the best talents and they are able to move their organisations forward. So, really, we need all of society, everyone, to support a culture of inclusion at the workplace with kindness, with understanding and with openness."
2018-05-16-T-003-S-00320,2018-05-16-T-003,320,,"We are our nation's best resources. We may be small but when we come together, we are bigger than the sums of all our dreams and all our hopes. So, we can afford to be bold, because with inclusiveness, we become stronger. We have started on the road to progress. So, let us not set limits on ourselves, but together, let us blaze the future for a Singapore Unlimited. I support the Motion."
2018-05-16-T-003-S-00321,2018-05-16-T-003,321,,4.36 pm
2018-05-16-T-003-S-00322,2018-05-16-T-003,322,Darryl David,"Mr Deputy Speaker, Sir, I rise in support of the Motion of Thanks to the President. In her speech on how the Government can build a strong partnership with people to co-create the Singapore of the future, President Halimah Yacob emphasised the need of the fourth-generation leaders to work with Singaporeans to build a vibrant Singapore that is full of opportunities, and to create a cohesive and inclusive society that caters to the needs of different societal segments."
2018-05-16-T-003-S-00323,2018-05-16-T-003,323,Darryl David,"Mdm President also spoke about the importance of making Singapore a great place to have children, and to enable people with differences to lead full and active lives."
2018-05-16-T-003-S-00324,2018-05-16-T-003,324,Darryl David,"It is with this in mind that I would like to focus my speech on catering to the divergent and differentiated learning needs of a particular segment of children and how the Government could enhance education options for these children, specifically those who are of primary-school going age. I would also like to declare my interest as Chief Executive Officer (CEO) of a private education organisation."
2018-05-16-T-003-S-00325,2018-05-16-T-003,325,Darryl David,"Singapore has a well-regarded education system that is both recognised and admired worldwide. Bodies, such as OECD consistently rate our education system as one of the best in the world and, as we were reminded by the Education Minister in his speech, our students have achieved remarkable Programme for International Student Assessment (PISA) results."
2018-05-16-T-003-S-00326,2018-05-16-T-003,326,Darryl David,"The primary school system that we have built is well-suited to cater to mainstream learners who are able to function and learn in what is predominantly an examination-based academic environment. In such a system, students who were able to perform well in summative-assessments, such as tests and examinations would do well, thus culminating in what most parents will agree is the mother-of-all-summative-assessments, the PSLE."
2018-05-16-T-003-S-00327,2018-05-16-T-003,327,Darryl David,"I do not intend to comment on the PSLE in this speech. I believe that this has been commented on before and will indeed continue to be debated for some time in this Chamber at the future. Indeed, I have to commend MOE for trying to lessen the examination-based academic aspect of the PSLE by providing for schemes like the Direct School Admission (DSA) to allow students to enrol in secondary schools using other criteria apart from their PSLE score. The replacement of the T-score with wider achievement levels in 2021 is also a positive step in the right direction."
2018-05-16-T-003-S-00328,2018-05-16-T-003,328,Darryl David,"My point is that while the majority of neurotypical students in mainstream MOE primary schools tend to function well in this system, there are also those neurodivergent students with differentiated learning needs who would perhaps perform better in an environment and system that is different from the typical mainstream MOE primary schools."
2018-05-16-T-003-S-00329,2018-05-16-T-003,329,Darryl David,"I am not referring to students with clear special learning needs that are already enrolled in Special Education (SPED) schools, such as those operated by Association for Persons with Special Needs (APSN), the Movement for the Intellectually Disabled of Singapore (MINDS), the Asian Women’s Welfare Association (AWWA) and other volunteer welfare organisations (VWOs) and non-governmental organisation (NGOs). SPED school students often have moderate to serious physical and/or intellectual challenges that will make it difficult for them to make it in the mainstream education system, and it is good that MOE and the Ministry of Social and Family Development (MSF) have worked with these organisations to provide options and opportunities for these students to form the foundation for independent and meaningful lives and careers."
2018-05-16-T-003-S-00330,2018-05-16-T-003,330,Darryl David,"In 2004, MOE partnered with the Autism Resource Centre to set up Pathlight School. The aim was to create the first autism-focused school in Singapore that offered Singapore's mainstream academic curriculum together with life readiness skills and to cater primarily to students with autism and related disorders. These students are cognitively able to access mainstream academic curriculum but require additional support, such as smaller class sizes, special accommodations and teaching staff trained in autism."
2018-05-16-T-003-S-00331,2018-05-16-T-003,331,Darryl David,"Pathlight has since grown from strength to strength, thanks in no small part to the vision and tireless work of a lady that I have tremendous respect for – my hon Parliamentary colleague, Ms Denise Phua. And I am confident that Ms Phua and her team will continue to ""light the path"" for many children and young adults on the autism spectrum in the future."
2018-05-16-T-003-S-00332,2018-05-16-T-003,332,Darryl David,"The neurodivergent children I am hoping that MOE can provide enhanced educational options for are those primary school students who have neuroatypical conditions that are not so severe or challenging that would require them to enrol in SPEDs or Pathlight but are presently finding it challenging to cope with these conditions in mainstream primary schools. Indeed, these students are not just able to merely grasp the mainstream primary school academic curriculum, many of them are even able to excel in it."
2018-05-16-T-003-S-00333,2018-05-16-T-003,333,Darryl David,"Consider the case of 10-year-old Primary 4 student Xavier Wong, who was featured in The Straits Times on 10 May this year. Xavier, who is able to solve mathematics problems that are two years ahead of his level and has an IQ that places him in the top 2% of the population, was diagnosed with mild attention deficit hyperactivity disorder (ADHD), and his behaviour has, at times, proven to be disruptive to his classmates and teachers."
2018-05-16-T-003-S-00334,2018-05-16-T-003,334,Darryl David,"Mr Deputy Speaker, Sir, there are many children like Xavier with Attention Deficit Hyperactivity Disorder, Attention Deficit Disorder, Sensory Processing Disorder, Dyslexia, Dyspraxia, Aspergers, Autism and other neuroatypical conditions who find aspects of mainstream primary school challenging."
2018-05-16-T-003-S-00335,2018-05-16-T-003,335,Darryl David,"MOE has, in recent years, worked very closely with educational and developmental psychologists to offer early detection and interventions for children with special learning needs and has also offered support programmes in mainstream schools for students with dyslexia, mild autism, and ADHD."
