speech_id,topic_id,speech_order,member_name,text
2018-05-17-T-001-S-00001,2018-05-17-T-001,1,Speaker,"Order. I wish to inform hon Members that under the provisions of Standing Order No 102, I have on 16 May 2018 nominated the following Members to fill vacancies in the respective Standing Select Committees"
2018-05-17-T-001-S-00002,2018-05-17-T-001,2,Speaker,(a) Mr Pritam Singh to be a Member of the Committee of Selection in place of Mr Low Thia Khiang; and
2018-05-17-T-001-S-00003,2018-05-17-T-001,3,Speaker,(b) Assoc Prof Daniel Goh Pei Siong to be a Member of the Estimates Committee in place of Mr Pritam Singh.
2018-05-17-T-001-S-00004,2018-05-17-T-001,4,Speaker,Order. Introduction of Government Bills.
2018-05-17-T-002-S-00005,2018-05-17-T-002,5,,"""to amend the Deposit Insurance and Policy Owners' Protection Schemes Act (Chapter 77B of the 2012 Revised Edition) and to make a related amendment to the Insurance Act (Chapter 142 of the 2002 Revised Edition)"","
2018-05-17-T-002-S-00006,2018-05-17-T-002,6,Ong Ye Kung,"; read the First time; to be read a Second time on the next available Sitting of Parliament, and to be printed."
2018-05-17-T-003-S-00007,2018-05-17-T-003,7,,"""to amend the Tokyo Convention Act (Chapter 327 of the 1985 Revised Edition) and to make related amendments to certain other Acts"","
2018-05-17-T-003-S-00008,2018-05-17-T-003,8,Lam Pin Min,"on behalf of the Minister for Transport; read the First time; to be read a Second time on the next available Sitting of Parliament, and to be printed."
2018-05-17-T-004-S-00009,2018-05-17-T-004,9,,"""to amend the Small Claims Tribunals Act (Chapter 308 of the 1998 Revised Edition) and to make consequential amendments to certain other Acts"","
2018-05-17-T-004-S-00010,2018-05-17-T-004,10,Indranee Rajah,"; read the First time; to be read a Second time on the next available Sitting of Parliament, and to be printed."
2018-05-17-T-005-S-00011,2018-05-17-T-005,11,,"""to amend the Copyright Act (Chapter 63 of the 2006 Revised Edition), the Geographical Indications Act 2014 (Act 19 of 2014), the Registered Designs Act (Chapter 266 of the 2005 Revised Edition) and the Trade Marks Act (Chapter 332 of the 2005 Revised Edition), to enhance border enforcement measures for intellectual property rights, and to make related amendments to certain other Acts"","
2018-05-17-T-005-S-00012,2018-05-17-T-005,12,Indranee Rajah,"; read the First time; to be read a Second time on the next available Sitting of Parliament, and to be printed."
2018-05-17-T-006-S-00013,2018-05-17-T-006,13,,"""to amend the Singapore Tourism (Cess Collection) Act (Chapter 305C of the 1997 Revised Edition)"","
2018-05-17-T-006-S-00014,2018-05-17-T-006,14,Chee Hong Tat,"on behalf of the Minister for Trade and Industry; read the First time; to be read a Second time on the next available Sitting of Parliament, and to be printed. recommendation of President signified;"
2018-05-17-T-007-S-00015,2018-05-17-T-007,15,,"""to amend the Customs Act (Chapter 70 of the 2004 Revised Edition) and to make a related amendment to the Road Traffic Act (Chapter 276 of the 2004 Revised Edition)"","
2018-05-17-T-007-S-00016,2018-05-17-T-007,16,Indranee Rajah,"; read the First time; to be read a Second time on the next available Sitting of Parliament, and to be printed."
2018-05-17-T-008-S-00017,2018-05-17-T-008,17,,"[(proc text) Resolved, ""That, notwithstanding the Standing Orders, a Ministerial Statement by the Minister for Defence be taken before the resumption of debate on President’s Address at this day’s Sitting"". – [Ms Grace Fu Hai Yien.] (proc text)]"
2018-05-17-T-009-S-00018,2018-05-17-T-009,18,Ng Eng Hen,"Speaker, Sir, first, let me thank the Leader and Members of this House for allowing me to make this Statement on National Service (NS) training deaths in the midst of the debate on the President's Address. I have requested to do so to address the concerns of Members here and the public over this matter. And I think we are right to be concerned as every NS death should be treated with utmost seriousness, whether it is in Parliament, the Singapore Armed Forces (SAF) or the Home Team."
2018-05-17-T-009-S-00019,2018-05-17-T-009,19,Ng Eng Hen,"Any death among SAF soldiers or Home Team personnel is grievous. These are our security forces who serve this nation with loyalty, commitment and pride. They keep us safe, they defend our island home, often in challenging and dangerous circumstances knowing the risks to themselves. Especially painful is when young National Servicemen who are serving their full-time NS, die. All of us feel it acutely. This House offers our deepest condolences to the families of 3SG Gavin Chan, CFC Dave Lee and, from the Singapore Civil Defence Force (SCDF), CPL Kok Yuen Chin. We know that no words can replace their loss. We grieve together with them even as we honour the memory of their precious sons who served and sacrificed for our country. The SAF and Home Team will continue to assist their families as best as we can."
2018-05-17-T-009-S-00020,2018-05-17-T-009,20,Ng Eng Hen,"Commanders on the ground fully recognise this heavy responsibility of keeping every son of Singapore safe during their NS training, whether it is in the two years that they come full-time for intensive training, or each time that they are called after that. We must strive hard for zero training deaths because any death is one too many. And I believe it can be done, even as National Servicemen train realistically and effectively to protect us and defend Singapore."
2018-05-17-T-009-S-00021,2018-05-17-T-009,21,Ng Eng Hen,"But achieving zero fatalities can only be achieved with constant vigilance, no lesser. Because on any given day, thousands of National Servicemen run around in challenging conditions, they move vehicles on air, land and sea, in Singapore and overseas. In the SAF, modern military platforms travel at high speeds and our exercise tempos are very quick. Our Terrexes can move at 100 kilometre per hour. Our armoured vehicles can move at 70 kilometre per hour."
2018-05-17-T-009-S-00022,2018-05-17-T-009,22,Ng Eng Hen,"All of us recognise the higher risks in military training because even for mass civilian activities, whether it is marathons, swims or cycling events, fatalities occur. We read about them and they occur for a variety of innocent reasons. But we must design our safety systems and enforce them so that training deaths within the SAF can be eliminated. It is a difficult goal to achieve, to get it right every time, whenever a platoon or company that goes out on exercise, whether it is day or night. But we must constantly improve the rigour of our safety systems to reach that goal because, if we do not, it may mean another precious son lost to a family."
2018-05-17-T-009-S-00023,2018-05-17-T-009,23,Ng Eng Hen,"Members in the House – Mr Dennis Tan1, Mr Henry Kwek2, Mr Vikram Nair3 and Mr Ganesh Rajaram4 – have filed questions on two recent NS deaths within the SAF and on general matters related to training safety. I propose to address their queries in this Statement. Here, I want to beg the House's indulgence and patience. I will give details as much as we know."
2018-05-17-T-009-S-00024,2018-05-17-T-009,24,Ng Eng Hen,"In September last year, 3SG Gavin Chan died when the Bionix vehicle he commanded rolled over. And in April this year, CFC Dave Lee died from complications of a heat stroke. Both were serving their full-time NS  3SG Chan had served for one year and eight months; CFC Lee for four months."
2018-05-17-T-009-S-00025,2018-05-17-T-009,25,Ng Eng Hen,"We treat each training related death with utmost seriousness. We deal with it at the highest level within the SAF and MINDEF. The Armed Forces Council (AFC) convenes an independent Committee of Inquiry (COI) to examine thoroughly the circumstances leading to the incident. It is a four-member team chaired by a senior civil servant from outside MINDEF and includes a senior doctor from the public sector. The COI has full powers. It can access all relevant information, access any personnel, haul them up to investigate the circumstances leading to death and they will determine events or persons that contributed to the event, to the death and make recommendations to rectify any lapses found."
2018-05-17-T-009-S-00026,2018-05-17-T-009,26,Ng Eng Hen,"Separately from the SAF and MINDEF, the Police conducts parallel investigations and the Coroner may decide to hold a public inquiry."
2018-05-17-T-009-S-00027,2018-05-17-T-009,27,Ng Eng Hen,"Let me first share the detailed findings for the late 3SG Chan for which all investigative processes have been completed, including those by the Queensland authorities because the incident occurred in Shoalwater Bay and, therefore, governed under the laws of Australia. Speaker, with your permission, I would now like to ask the Clerk to distribute the report from the Queensland coroner."
2018-05-17-T-009-S-00028,2018-05-17-T-009,28,Speaker,"Yes, please. ["
2018-05-17-T-009-S-00029,2018-05-17-T-009,29,Ng Eng Hen,"This report from the coroner was provided to 3SG Chan's parents. 3SG Chan's parents have given us permission for it to be distributed to Members of this House, except for the post-mortem findings which are redacted out of respect for the privacy of 3SG Chan and his family."
2018-05-17-T-009-S-00030,2018-05-17-T-009,30,Ng Eng Hen,"The Queensland coroner’s report provides the circumstances leading to the death of 3SG Chan as a result of multiple injuries sustained from motor vehicle trauma. I will read excerpts, which Members can follow in the distributed report."
2018-05-17-T-009-S-00031,2018-05-17-T-009,31,Ng Eng Hen,"“On 15 September 2017, Sergeant Chan, who was participating in 'Exercise Wallaby', an annual unilateral training exercise conducted by the Singapore Armed Forces at Shoalwater Bay Training Area in Queensland died after the infantry vehicle (known as the Bionix) he was commanding rolled and he suffered significant injuries."
2018-05-17-T-009-S-00032,2018-05-17-T-009,32,Ng Eng Hen,"The police conducted an investigation into the circumstances of the incident. The police found no defect with the infantry fighting vehicle. The police found from scene evidence and witness information, that its path forward was halted due to an obstruction. Sergeant Chan, who was commander of the vehicle, gave orders for the driver to reverse slowly down the hill. The commander who was stationed in the turret, with his upper body clear of the vehicle structure, was giving instructions to the driver directing him to reverse and where to reverse. All confirmed that the driver was continuing to reverse slowly, and in accordance with the commander’s instructions, when the vehicle traversed over a flat granite rock for about 4 metres before the vehicle became stuck on a large boulder, holding up the vehicle undercarriage. The commander instructed the driver to turn the steering wheel in an attempt to gain traction when suddenly the vehicle dropped down over the rock rolling sideways before coming to rest further down the slope. Sergeant Chan was ejected from the vehicle and suffered significant injuries. Life support was commenced at the scene before he was airlifted to hospital where he was later pronounced deceased."
2018-05-17-T-009-S-00033,2018-05-17-T-009,33,Ng Eng Hen,"The police investigation established that there was no defect with the vehicle, and there was no suggestion that the driver was doing anything other than reversing very slowly, and at the specific direction of Sergeant Chan. The police considered that it was likely that the incident occurred because of the commander’s decision to reverse on a slightly different path down the hill and that his choice to be positioned with part of his body outside the vehicle exposed him to greater risk of injury. The Singapore Armed Forces recommendation is only the head and shoulders be outside the turret of the vehicle during operations. The police considered it was a very unfortunate incident whilst deployed in difficult terrain in ‘black out’ conditions. It was noted by the police that the driver was driving in compliance with SAF policy at the time of the incident, and under the specific instruction from Sergeant Chan.”"
2018-05-17-T-009-S-00034,2018-05-17-T-009,34,Ng Eng Hen,"These are the findings of the Queensland authorities. The Committee of Inquiry here, appointed by the Armed Forces Council, corroborated from their own investigation the findings by the Queensland authorities. The COI further determined that Sergeant Chan and his platoon mates were sufficiently trained and qualified to participate in the exercise. They had no mental and physical conditions that could have affected their fitness to participate. The medical and safety coverage provided was found to be timely, adequate and proper."
2018-05-17-T-009-S-00035,2018-05-17-T-009,35,Ng Eng Hen,"In addition, the COI conducted interviews with SAF soldiers at the exercise to piece together the chronology of events that led to the Bionix overturning. The mishap occurred during night training for Bionix units. For Members' information, Armour units do this regularly, because they have to become proficient to fight at night or under conditions of poor visibility. That is something that they must learn to do."
2018-05-17-T-009-S-00036,2018-05-17-T-009,36,Ng Eng Hen,"Safety lapses were identified by the COI. First, the night vision device (NVD) of 3SG Chan’s vehicle was not working. They have issued a night vision device which allows them to see in darkness, but it was not working. It is needed if armoured vehicles are to move at night. Without the night vision device, armoured vehicles can move but only with the driver's hatch open and headlights switched on for better visibility. That is in the training safety regulations. However, according to the driver, Sergeant Chan felt that the headlights “would give away their position to the enemy” and decided to continue training without headlights."
2018-05-17-T-009-S-00037,2018-05-17-T-009,37,Ng Eng Hen,"Accounts from his platoon mates to the COI attest to Sergeant Chan's strong motivation and high standards of performance during training. Sergeant Chan was zealous in his training and probably wanted to complete the night mission assigned to their armour unit. Unfortunately, in the darkness, the vehicle entered an area with a steep incline and boulders. At that point, Sergeant Chan stopped the vehicle, dismounted to assess the surroundings and found that a boulder was blocking the vehicle. He re-mounted the Bionix, sitting on the top edge of the vehicle commander hatch and told the driver to open his hatch and switch on the vehicle’s headlights so that they could reverse away from this area. Unfortunately, as they were doing so, the vehicle overturned on the steep embankment. The three other soldiers in that Bionix did not suffer any injuries. The COI concluded that Sergeant Chan’s injuries resulted from him being thrown out of the vehicle as it overturned, causing his demise."
2018-05-17-T-009-S-00038,2018-05-17-T-009,38,Ng Eng Hen,"The Queensland coroners’ report agreed that this was the cause of this event. The report said, “…in the circumstances I find that Sergeant Chan died when he was ejected from the vehicle which he was directing. It is unfortunate that he took the decision to position himself with a significant portion of his body outside the vehicle.” The coroner's report continues, “…the incident is none other than a very unfortunate accident due to the nature of the difficult terrain and the operation then being performed.”"
2018-05-17-T-009-S-00039,2018-05-17-T-009,39,Ng Eng Hen,"Arising from their investigations, the Queensland police found no basis to charge any person. The COI also found no negligence, foul play or misconduct, but recommended that the SAF review its training safety regulations on the position of the Armoured Fighting Vehicle Commander, so that the vehicle commander is able to execute the overturning drill, which means that he is able to drop quickly into the vehicle. If he cannot do this, because you are much better protected inside the vehicle than out, the vehicle must stop. The COI also recommended stronger compliance and checks on night vision devices (NVDs) and to enforce the wearing seatbelt rule for passengers when the vehicle is moving."
2018-05-17-T-009-S-00040,2018-05-17-T-009,40,Ng Eng Hen,"The SAF has followed up and also implemented additional training for armoured vehicle commanders on uneven terrain. Training safety regulations (TSRs) have been tightened to limit exposure of the body of the vehicle commander to waist level when executing certain operational tasks. The SAF has also implemented drills for day-to-night and night-to-day transitions and this includes NVDs and other night fighting equipment on the checklist which need to be in working order. Wearing seatbelts is enforced, with disciplinary actions taken against those who have not done so."
2018-05-17-T-009-S-00041,2018-05-17-T-009,41,Ng Eng Hen,Sergeant Chan’s death was classified as a training-related incident and compensation offered to the family. Sergeant Chan’s parents accepted the honours of a military funeral. The Armour formation paid their last respects to a dedicated commander whom they are proud to call one of their own. Sergeant Chan was a good soldier.
2018-05-17-T-009-S-00042,2018-05-17-T-009,42,Ng Eng Hen,"Let me now turn to CFC Dave Lee. To investigate Corporal Lee's death, all the processes that I have described for Sergeant Chan, the COI, police investigations and Coroner's inquiry are yet to be completed. His death was about two weeks ago. I will only share information from our own internal investigations. When Members have clarifications later – and I encourage you to ask for clarifications – I will share what we have, with some caveats, that the COI and the independent Coroner's inquiry, if held, and the Police investigations will have to come to their own facts."
2018-05-17-T-009-S-00043,2018-05-17-T-009,43,Ng Eng Hen,"On 18 April this year, Corporal Lee displayed signs of heat injury after completing an eight-kilometre fast march in Bedok Camp. An SAF medic attended to Corporal Lee to bring down his core temperature and he was evacuated to the camp's Medical Centre where body-cooling measures and treatment were instituted by the SAF medical team there. He was taken to Changi General Hospital (CGH) and warded in the Intensive Care Unit (ICU). Unfortunately, Corporal Lee's condition deteriorated and he passed away on 30 April 2018 at CGH, about 12 days after his admission."
2018-05-17-T-009-S-00044,2018-05-17-T-009,44,Ng Eng Hen,"Following the incident, the Army declared a safety timeout for all training and also specifically reviewed training that posed risks of heat injuries. During the timeout, commanders were reminded of the importance of safety measures which include hydration regimes, temperature-taking regimes, management of the work-rest cycle – I will explain what this means – and identification of personnel who could be at greater risk of heat injuries. These are currently in place; these are preventive safety measures against heat injuries."
2018-05-17-T-009-S-00045,2018-05-17-T-009,45,Ng Eng Hen,"Commanders and soldiers are reminded to look out for signs and symptoms of heat injury during training. In the event of heat injury, we have on-site cooling measures which include the removal of clothes and application of ice or water to the affected serviceman. The SAF medical centres have customised-built evaporative body-cooling units for heat injuries. Our commanders, soldiers, regulars, Full-time National Servicemen (NSFs) and Operationally Ready National Servicemen (NSmen) know from their own experience that it is the consistent practice for these processes and precautions to be carried out."
2018-05-17-T-009-S-00046,2018-05-17-T-009,46,Ng Eng Hen,"We must press on to achieve zero fatalities from heat injuries. The SAF is currently evaluating the use of individual wearable devices to monitor a soldier’s condition real-time. MINDEF will also commission an External Medical Panel, as we did in 2010, to review the SAF's policies and measures for the management of heat injuries and recommend improvements. This panel should consider further steps, especially when recorded temperatures in Singapore over the last two decades have gone up, increasing the risk of heat injuries."
2018-05-17-T-009-S-00047,2018-05-17-T-009,47,Ng Eng Hen,"As these two cases show, after every training-related death, independent and impartial investigative processes will determine the key facts, arrive at appropriate conclusions and we will take corrective measures to prevent mistakes from being repeated. This includes punishing those who contributed to the death through reckless and negligent acts."
2018-05-17-T-009-S-00048,2018-05-17-T-009,48,Ng Eng Hen,"SAF servicemen can be charged and punished in the civilian criminal Courts, even if their acts were committed within the SAF, as part of their duty. I have said so in this House previously but these examples bear repeating for their salutary warnings. In 2012, an SAF vehicle overturned during an exercise and it caused the death of a soldier. The Conducting Officer who appointed a serviceman to drive the military vehicle even though the Conducting Officer knew that the serviceman did not have a military driving licence was convicted in the criminal Courts and sentenced to six months' imprisonment. The officer was found to have committed a rash act and attempted to pervert the course of justice. In 2005, the Supervising Officer, Conducting Officer and instructors who were involved in the death of a trainee who was submerged in water during a Combat Survival Training course were sentenced to six to 12 months' imprisonment."
2018-05-17-T-009-S-00049,2018-05-17-T-009,49,Ng Eng Hen,"In all cases, prosecutions of SAF servicemen in criminal Courts are based on independent Police investigations and when the Attorney-General's Chambers (AGC) decides that there are sufficient grounds to prosecute. It will be the criminal Courts that determine the level of culpability and commensurate punishments. Separately, the Coroner may hold an inquiry to determine the causes of death and contributory factors. The SAF fully accepts these judicial processes and, indeed, deems them necessary to achieve and maintain a zero-fatality training safety system."
2018-05-17-T-009-S-00050,2018-05-17-T-009,50,Ng Eng Hen,"I know that there are accusations against the commanders of Corporal Lee, but we should let the independent COI and Police investigations fully investigate the circumstances to establish the facts. We will deal with any wrong-doing thoroughly. Those that deserved to be punished will be punished. If any persons are found to have been negligent or culpable, they will be punished according to the law, both in civilian and military Courts."
2018-05-17-T-009-S-00051,2018-05-17-T-009,51,Ng Eng Hen,"But we must be careful not to discourage or unfairly punish commanders who are executing their responsibilities dutifully, because many commanders are National Servicemen, too, who take seriously this mission we in society have imposed on them – to train capable fighting units able to defend Singapore against all threats. And he is serious about his duty and he wants to build a fighting unit. We must be careful that we do not discourage them or punish them unfairly."
2018-05-17-T-009-S-00052,2018-05-17-T-009,52,Ng Eng Hen,"Indeed, we have many positive examples of commanders who risk their own safety to protect trainees. In 2013, NSF commander Lieutenant Kamalasivam pulled a recruit down to take cover in the grenade-throwing bay. The recruit was new. He held the grenade, took out the safety pin and released the grenade lever. Lieutenant Kamalasivam's first instinct was to pull the recruit down and cover himself over him. Thankfully, both suffered minor injuries which they recovered from."
2018-05-17-T-009-S-00053,2018-05-17-T-009,53,Ng Eng Hen,"Even if there was no ill-intent, are NSF commanders trained adequately and do they have the maturity to exercise good judgement and consciousness regarding training safety? This is what Nominated Member Ganesh Rajaram asked."
2018-05-17-T-009-S-00054,2018-05-17-T-009,54,Ng Eng Hen,"All commanders undergo safety training both in the Specialist Cadet School (SCS) and Officer Cadet School (OCS). In addition, we have Unit Safety Officers and these are ex-regulars who have held senior appointments, who support the safe conduct of exercises. These Unit Safety Officers do not just have book learning; they have actual experience conducting and taking part in training and operations. But Unit Safety Officers cannot be everywhere all the time. So, for instance, for Exercise Wallaby, we sent 4,000 to 5,000 men down to Shoalwater Bay to train."
2018-05-17-T-009-S-00055,2018-05-17-T-009,55,Ng Eng Hen,"A strong safety culture and a zero-fatality training system can only be achieved if every soldier has that ingrained concern for the well-being of himself and his peers. On the ground, it is the creed of the commanders to take care of their men. If you do not know how to take care of your men and if it is shown that you do not know how to take care of the men, we will remove your command position, we will remove your rank. Commanders are taught to encourage their men and buddies to flag out when they do not feel well. Individual soldiers are advised to highlight risky behaviour and safety breaches and they can report them to their superiors without fear of reprisal. There is a 24-hour training safety hotline for commanders and soldiers to report safety incidents and near-misses. So, not only when something happens, but a near-miss, report it."
