speech_id,topic_id,speech_order,member_name,text
2018-05-16-T-003-S-00217,2018-05-16-T-003,217,Lee Hsien Loong,"Political parties do not have a fixed lifespan – a time to live and a time to die, as Ecclesiastes puts it. How long a political party continues in government – or in opposition for that matter, because parties come and go in the opposition too – depends on whether it can renew itself, continue to serve the people, continue to bring progress to the nation. If the PAP can keep on successfully doing that, we can stay in government. But if we ever fail, we deserve to lose. So, my message to all PAP Members of Parliament is ""work hard, serve the people, hold the ground, and win the elections""."
2018-05-16-T-003-S-00218,2018-05-16-T-003,218,Lee Hsien Loong,"This does not mean the Government will shy away from difficult problems. A government must govern. And if Ministers are not prepared to govern, then give it up. Because that is your duty; that is what you are here for. And governing means that from time to time you have to do difficult things when they become necessary. Leadership means you have to explain, persuade, and convince people that you know what you are doing, and that you are doing it for a good reason, and it is a right thing to do. That is the way to maintain people's trust, and trust is crucial."
2018-05-16-T-003-S-00219,2018-05-16-T-003,219,Lee Hsien Loong,"Take taxes. In the recent Malaysian election, one hot issue was their GST. The previous government had introduced the new tax three years ago, and it had caused great unhappiness in Malaysia. After Pakatan Harapan won the election, Dr Mahathir announced that his new government would abolish the GST."
2018-05-16-T-003-S-00220,2018-05-16-T-003,220,Lee Hsien Loong,"Why did this happen? It was not the economic merits or demerits of the GST. From the economic point of view, the GST is better than the Sales Tax that it replaced. But politically, Malaysians linked the GST with other complaints they had with the previous government, and they rejected the explanations and the persuasions, and they say, ""No. I do not accept this. Out with it."""
2018-05-16-T-003-S-00221,2018-05-16-T-003,221,Lee Hsien Loong,"Does that mean no government should ever raise taxes? Alas, that is not the real world."
2018-05-16-T-003-S-00222,2018-05-16-T-003,222,Lee Hsien Loong,"From time to time the country will need to spend more – on healthcare, defence, education, or something else – and if revenues are not enough, it will have no choice but to raise taxes. Then, the government must convince the population that it is raising taxes for a good reason, for the right reason. And whether the voters accept that will depend not just on the arguments, but also crucially on whether they trust the government. Because with arguments, for every right argument, we can produce five doubtful ones which look quite plausible. And during elections, there is no shortage of producers of such arguments and people can get confused."
2018-05-16-T-003-S-00223,2018-05-16-T-003,223,Lee Hsien Loong,"Finally, they have to decide whom do they trust; what is their track record; do you want to put your future, your fate, or your children's future in the hands of this team and believe that they have your best interest at heart. And if they do, you vote for them, and you will take all things which need to be done as one bundle. Finally, voters have to trust the government to do the right thing on their behalf, even when it is painful."
2018-05-16-T-003-S-00224,2018-05-16-T-003,224,Lee Hsien Loong,"I think this is the right lesson to learn. Without trust, the government cannot govern. It would not dare to do painful but necessary things. And politics becomes the art of pandering – a bidding war between the parties – who can give more, who can offer more? You say you reduce the tax; I say I abolish the tax. And then, you say, ""I will give you a hongbao"" on top of that. And how to pay – well, we can think about that after the elections. And the country goes downhill."
2018-05-16-T-003-S-00225,2018-05-16-T-003,225,Lee Hsien Loong,"The 4G Ministers understand this. They have been working together, learning to complement one another's strengths and weaknesses, making decisions as a team and taking collective responsibility for these decisions."
2018-05-16-T-003-S-00226,2018-05-16-T-003,226,Lee Hsien Loong,"To me, this working together is as important, if not more important, than the question of who should be the next Prime Minister. Because for the next Prime Minister, I know there is more than one qualified candidate. We are fortunate that this is so, because it provides strength and depth to the team. Now, it is about the team coming to a consensus on the best option."
2018-05-16-T-003-S-00227,2018-05-16-T-003,227,Lee Hsien Loong,"But to work together as a team, that is not a choice because there is no other option. Whoever becomes the next Prime Minister, the team has to work closely together for him to succeed. If they cannot or do not do so, then the next Prime Minister will fail, whoever he is."
2018-05-16-T-003-S-00228,2018-05-16-T-003,228,Lee Hsien Loong,"Even in the best of times, and certainly in times of severe crises, Mr Lee Kuan Yew did not run the country by himself. Neither did Mr Goh Chok Tong, nor myself. One year, Mr Lee received the Freedom of the City of London, in 1982. It was a grand occasion – he dressed up; he made a speech. He said  ""I feel like a conductor at a concert bowing to applause, but unable to turn around and invite the accomplished musicians in his orchestra to rise and receive the ovation for the music they have played. For running a government is not unlike running an orchestra, and no Prime Minister ever achieves much without an able team of players."""
2018-05-16-T-003-S-00229,2018-05-16-T-003,229,Lee Hsien Loong,I think I can speak for Mr Goh Chok Tong when I say that we both feel the same way.
2018-05-16-T-003-S-00230,2018-05-16-T-003,230,Lee Hsien Loong,"All three of us were not sole leaders, but primus inter pares – that means, first among equals. But the emphasis is we are equals, but we are just the first among equals; first among equals with our colleagues. We take their views, we take them seriously, we benefit from their advice and their abilities and their skills. We have fierce arguments as to what to do but we are on a team together, with strong enough bonds that we can deal with issues together and there is leadership, but it is unforced. It has to be unforced leadership. The team accepts, respects and knows that it has an important role to play. They are not there just to carry out orders."
2018-05-16-T-003-S-00231,2018-05-16-T-003,231,Lee Hsien Loong,"We were all fortunate – Singapore was fortunate – that the Prime Ministers had such stalwart colleagues. Mr Lee had a core team of very strong Ministers supporting him – Goh Keng Swee, S Rajaratnam, Lim Kim San, Hon Sui Sen, and Othman Wok. Emeritus Senior Minister (ESM) Goh had a talented team too – Ong Teng Cheong, Tony Tan, Wong Kan Seng, S Jayakumar, S Dhanabalan, Abdullah Tarmugi, and George Yeo, just to name a few. If anything, ESM Goh's team was even more comprehensive than Mr Lee's. And when I took over as Prime Minister, I inherited ESM Goh's strong team and Mr Goh himself stayed on, and we added talent to the team. Now, he has stepped down, I rely on my own core team, which now also includes several of the 4G Ministers. So, the next Prime Minister must have, and will have, his own stalwart colleagues too – his generation, and I hope, also younger ones."
2018-05-16-T-003-S-00232,2018-05-16-T-003,232,Lee Hsien Loong,"I know everyone is anxious to know who the next Prime Minister will be. Well, the leader must command the respect and loyalty of his whole team. He must enjoy the support and confidence of the broad mass of Singaporeans. And these things take time; they cannot be forced. I do not believe we are ready to settle on a choice yet, nor is it helpful to treat this either as a horse race, or a campaign to lobby support for one or the other candidate. This is a team game. We want a strong, cohesive team so that Team Singapore is the winner."
2018-05-16-T-003-S-00233,2018-05-16-T-003,233,Lee Hsien Loong,"I have just reshuffled the Cabinet, have moved some Ministers to new portfolios, I have expanded the responsibilities of others. The 4G Ministers now helm two-thirds of the Ministries. They have a major say in policies and the direction to take Singapore. Let us give them the time and space to do their own work, to work together in their new roles and to get better known by the public."
2018-05-16-T-003-S-00234,2018-05-16-T-003,234,Lee Hsien Loong,"I am confident that in the fullness of time, we will see a clear outcome and a leader will emerge from the process. Certainly, I expect this to happen before the next General Election."
2018-05-16-T-003-S-00235,2018-05-16-T-003,235,Lee Hsien Loong,"For these 14 years as Prime Minister, I have been working with the 4G team, guiding them, assessing them, preparing them to take over the reins. When Mr Heng Swee Keat rounded up the Budget debate this year, I was happy to hear him describe the Budget as one that not only meets the needs of today's generation, but also accounts for the needs of future generations."
2018-05-16-T-003-S-00236,2018-05-16-T-003,236,Lee Hsien Loong,"It showed that the 4G Ministers understood that their deepest responsibility is to be a steward of Singapore. What does it mean – ""steward""? The Government is certainly not the owner of Singapore, but neither it is just the manager of Singapore. It is the steward. It is responsible for taking good care of the country, for holding it in trust, building it up and handing it on in due time to future generations."
2018-05-16-T-003-S-00237,2018-05-16-T-003,237,Lee Hsien Loong,"The Government must keep faith with past generations who gifted this country to us. It has to be responsible to the present generation who continue to build on what we have inherited. But above all, it must consider future generations, whose lives and whose futures depend on us; the present generation depends on us thinking of their interests, acting on their behalf, making wise and far-sighted decisions to cause Singapore to endure and to flourish for many more years."
2018-05-16-T-003-S-00238,2018-05-16-T-003,238,Lee Hsien Loong,"I am confident that when the time comes for me to hand over to a new Prime Minister, Singapore will be put into the hands of good stewards."
2018-05-16-T-003-S-00239,2018-05-16-T-003,239,Lee Hsien Loong,"We have built something truly special here in Singapore. Countries near and far look to Singapore as a model of governance and development. People want to live here, do business here. Even the US and the Democratic People’s Republic of Korea (DPRK) are planning to hold their meeting here!"
2018-05-16-T-003-S-00240,2018-05-16-T-003,240,Lee Hsien Loong,"In many other countries, political leaders plan only up to the next election or the next crisis. But in Singapore, we are able to think beyond the immediate, beyond ourselves. We care about our community, our country and our future."
2018-05-16-T-003-S-00241,2018-05-16-T-003,241,Lee Hsien Loong,"Our religious leaders visit temples, churches and mosques together. They give their blessings on one another's milestone celebrations. Our neighbours and friends invite us over for makan during Chinese New Year, Deepavali or Hari Raya. Our youths travel and experience the world. They come back eager to apply what they have seen and learnt around the world back home. Our grandparents and parents bring us up and nurture us. They are living examples of how by working hard, we can build better lives for ourselves and our children."
2018-05-16-T-003-S-00242,2018-05-16-T-003,242,Lee Hsien Loong,"So, we are all living the Singapore Story, keeping it alive. We must sustain and pass on this shared vision of prospering together, progressing together. That way, we will make this little red dot shine bright in the world as well as in our hearts for many, many years to come. [Applause]"
2018-05-16-T-003-S-00243,2018-05-16-T-003,243,Lee Hsien Loong,4.00 pm
2018-05-16-T-003-S-00244,2018-05-16-T-003,244,Low Thia Khiang,"Mr Speaker, Sir, I would like to seek a clarification from the Prime Minister. Given that the 4G leadership, especially the three frontrunners for the next Prime Minister, largely come from the Singapore Armed Forces (SAF) or the Civil Service, is it not a sign that there is now a political elite class in Singapore?"
2018-05-16-T-003-S-00245,2018-05-16-T-003,245,Lee Hsien Loong,"Mr Speaker, Sir, this is an example of the way not to think about the problem. When you look at the person, you ask  ""Is he making a contribution, what are his strengths and weaknesses, what are his contributions, does he or does he not measure up?"" You do not ask ""Where did he come from? Who are his parents?"" Is it bad to come from the Civil Service or the SAF? No. Is it necessary to come from there? No. Is it good to have people from a wide range? Yes. And we do have a wide range."
2018-05-16-T-003-S-00246,2018-05-16-T-003,246,Lee Hsien Loong,"He talked about three frontrunners. I do not know how many people are running. I just said it is not a horse race. It is a team. I have people from the private sector, I have doctors, I have lawyers, I have brought in new people from the backbenchers, some of whom are also from the private sector with business experience."
2018-05-16-T-003-S-00247,2018-05-16-T-003,247,Lee Hsien Loong,"So, we are looking for people, wherever we can find them, to bring in to form a Singapore Team. And the stronger this team is, the harder I make Mr Low's job. And I cannot help it because of my objective. I just want the best team for Singapore. [Applause]"
2018-05-16-T-003-S-00248,2018-05-16-T-003,248,Lee Hsien Loong,4.02 pm
2018-05-16-T-003-S-00249,2018-05-16-T-003,249,Azmoon Ahmad,"Good afternoon. I think I will have a tough job today. First and foremost, this is the speech after the Prime Minister; secondly, with all the Ministers in front of me, even much tougher now. Anyway, I have to do the job. Mr Speaker, Sir, please allow me to deliver the first part of my speech in Malay."
2018-05-16-T-003-S-00250,2018-05-16-T-003,250,Azmoon Ahmad,(In Malay)  [Please refer to  Vernacular Speech.] Hon Speaker and my fellow hon Parliamentary colleagues.
2018-05-16-T-003-S-00251,2018-05-16-T-003,251,Azmoon Ahmad,"As we prepare to face an uncertain future, we should always remind ourselves that we need to move forward as one people and one nation and ensure that no one is forgotten or left behind. In our search for success to achieve prosperity and stability, let us not forget those who may struggle in this race of life."
2018-05-16-T-003-S-00252,2018-05-16-T-003,252,Azmoon Ahmad,"I am quite concerned with our highly competitive life – whereby ""success"" is measured solely from one’s economic status or the position that one achieves in one’s career – to the extent that sometimes, we forget how to be a society with a heart."
2018-05-16-T-003-S-00253,2018-05-16-T-003,253,Azmoon Ahmad,"Mr Speaker, my worry is that we will forget to be gracious and courteous, to be friendly, generous, humble, and empathise with one another, to the point that we are only focused on achieving what we deem to be ""success"" in our eyes."
2018-05-16-T-003-S-00254,2018-05-16-T-003,254,Azmoon Ahmad,"In my view, success should also be measured based on, and by including, the things that we can do to help those in need so that we succeed together, and help the whole society progress together, regardless of race and religion, so that no one is left behind or forgotten."
2018-05-16-T-003-S-00255,2018-05-16-T-003,255,Azmoon Ahmad,"The global situation remains volatile, uncertain, complex and ambiguous, or what is known as a VUCA world, so it is important that we continue to learn and re-learn, so that we can be resilient. Disruptions and economic changes, whether globally or locally, are clearly becoming more frequent, and this requires adaptability. I am confident that those who are able to adapt can survive, ending in success and progress."
2018-05-16-T-003-S-00256,2018-05-16-T-003,256,Azmoon Ahmad,"The need to adapt is not limited to any particular community, and no one is exempted. Instead, every member of society needs to adapt and change with the circumstances. This includes our Malay community."
2018-05-16-T-003-S-00257,2018-05-16-T-003,257,Azmoon Ahmad,"In general, based on official figures, evidence and anecdotes, we can see more and more Malays who have achieved the pinnacle of success. We are presented with many success stories about the community. There are more Malays in leadership positions, as well as holding key appointments in various organisations and companies – in both the public and private sectors. However, as I mentioned earlier, we need to measure success holistically, by looking at how far the whole society has progressed together, with no one forgotten or left behind."
2018-05-16-T-003-S-00258,2018-05-16-T-003,258,Azmoon Ahmad,"Mr Speaker, this means that while we celebrate those at the pinnacle of success, we should not forget those who may have to struggle in their daily lives."
2018-05-16-T-003-S-00259,2018-05-16-T-003,259,Azmoon Ahmad,"Since the Malay community is a small community, this means that the ""gotong royong"" spirit of helping one another can be easily implemented and expanded. Therefore, I would like to call on those who are successful in life to step forward and give back to society. Let us all help not only those in need, but also the whole society."
2018-05-16-T-003-S-00260,2018-05-16-T-003,260,Azmoon Ahmad,"Helping someone does not necessarily mean giving financial help solely. In fact, help can be rendered in many forms, for instance, spending some time to help out or contribute ideas to organisations that need it. There are many Malay bodies that are constantly looking out for capable members of the community to serve in their board of administrators and work together in community service projects that are co-organised."
2018-05-16-T-003-S-00261,2018-05-16-T-003,261,Azmoon Ahmad,"The expertise of someone with a successful career can be used to benefit society through sharing sessions and exchanging of intellectual ideas. For example, our youths can benefit from people with rich experience who become mentors to those who need it."
2018-05-16-T-003-S-00262,2018-05-16-T-003,262,Azmoon Ahmad,"Mr Speaker, I would like to appeal to those who have succeeded, let us together ignite the spirit of helping one another – take the first step, and introduce yourself to society and the organisations; contribute as much as possible and help the community in any way you can."
2018-05-16-T-003-S-00263,2018-05-16-T-003,263,Azmoon Ahmad,"Furthermore, in order to answer the President’s call that we become an exceptional nation and society, we must be bold enough to challenge ourselves in terms of the current way of running things. It is impossible for us to become an exceptional society if we do not change our ways. Change must come first if we wish to achieve progress and success."
2018-05-16-T-003-S-00264,2018-05-16-T-003,264,Azmoon Ahmad,"Although our community has progressed and achieved success in many areas, we are still hampered by social issues. Obviously, this is a problem that we are not proud of. I admit that many efforts have been launched and implemented. However, the outcomes are less than satisfactory to me."
2018-05-16-T-003-S-00265,2018-05-16-T-003,265,Azmoon Ahmad,"Let us all step forward as one bold community and review all the current platforms like the Community Leaders Forum (CLF), so that it stays relevant and functions as our community’s launchpad that can fulfil our aspirations and meet the challenges in the coming years and decades."
2018-05-16-T-003-S-00266,2018-05-16-T-003,266,Azmoon Ahmad,"Let us unite as a society with a heart and be able to work together so that our community can progress and prosper, in line with the nation’s objectives."
2018-05-16-T-003-S-00267,2018-05-16-T-003,267,Azmoon Ahmad,"Mr Speaker, as the Malay proverb goes, ""We carry the load together, whether it’s heavy or light"", so let us build one nation together and make our community exceptional."
2018-05-16-T-003-S-00268,2018-05-16-T-003,268,Azmoon Ahmad,"(In English) Mr Speaker, please allow me to continue my speech in English."
2018-05-16-T-003-S-00269,2018-05-16-T-003,269,Azmoon Ahmad,"In the President’s Address, President Halimah reminded us of the need to continue progressing and to build an exceptional nation. In the Address, her Excellency encouraged us to consider taking bold steps to challenge the status quo, if it can lead us to reach the pinnacle of ""extraordinary"". Encouraging the 4G leaders to explore and to do what is necessary to make Singapore an exceptional place, I am heartened. Not only should we achieve economically, but also achieving as a gracious society, and society with a heart. However, the volatile, uncertain, complex and ambiguous (VUCA) world that we live in now means that challenges abound for all of us. Each challenge means differently to each of us. Some of us may thrive, while some may falter. My fear is that in our zealousness to face and overcome these challenges head on, we may forget the ones who are struggling and falling behind and eventually forget how to be a society with a heart."
2018-05-16-T-003-S-00270,2018-05-16-T-003,270,Azmoon Ahmad,"Mr Speaker, Sir, the truth is, I believe success should also include and be measured by what you do to help others to succeed too, and help the whole society progress together, with no one left behind. When the future is uncertain, the most vulnerable tend to be at a higher risk of needing financial and social help. But, surely, those who are better off will feel a certain amount of anxiety as well. When that happens, does it mean they will tighten their purse strings and keep their wealth for a rainy day instead of helping others who are in dire need of help? I hope not. I hope that we, as a society, will do our part in helping others overcome the challenges associated with a VUCA world, be it through volunteer work, donations or some other ways. Only when we keep a look out for each other and ensure we advance towards the future together, can we then claim to be a society with a heart."
2018-05-16-T-003-S-00271,2018-05-16-T-003,271,Azmoon Ahmad,"There are many facets in building a society with a heart. Apart from encouraging Singaporeans to be kinder, more empathetic and generous, the Government too has a responsibility to ensure all segments of Singaporeans are well taken care of and division does not happen."
2018-05-16-T-003-S-00272,2018-05-16-T-003,272,Azmoon Ahmad,"Mr Speaker, Sir, when we speak of division or divide, we often focus on the socioeconomic divide but we rarely discuss the potential of an inter-generational divide. We owe our thriving city to our parents, grandparents and the generations before them who helped mould Singapore into the country it is now. However, enough time has passed that some of us may have forgotten their contributions and take them for granted, leading to inter-generational conflict. As we have all been made aware, a rise in taxes in the near future to support an ageing population may be expected. But while Singaporeans have so far accepted tax increments to help fund subsidies for vulnerable groups, including the elderly, unhappiness may arise among other groups if this were to continue in the long run. Our younger citizens may demand a reduction in older citizens’ benefits or expect similar benefits for themselves in the future, leading to inter-generational conflict."
2018-05-16-T-003-S-00273,2018-05-16-T-003,273,Azmoon Ahmad,"A rising number of seniors may also want to remain in their last jobs or aspire to better jobs while the next generation is eager to take over positions at the top. This could heighten job market anxieties among the young, particularly if special provisions are made for older employees to retain their jobs for a longer period."
2018-05-16-T-003-S-00274,2018-05-16-T-003,274,Azmoon Ahmad,"While these scenarios are likely and can possibly cause conflict between generations, I believe our Government, and especially the 4G leaders, shall have the wisdom to ensure the needs of all Singaporeans are satisfactorily met and not at the expense of others. But we must remind ourselves that again, success can be truly measured by how we advance and progress together as a whole, and this sometimes entails making small sacrifices to ensure those in need are not neglected."
2018-05-16-T-003-S-00275,2018-05-16-T-003,275,Azmoon Ahmad,"Mr Speaker, Sir, the future is fraught with uncertainty, and this has caused some degree of anxiety among all Singaporeans. However, I am certain that if we band together and lend support to one another, we can emerge stronger through the adversities and challenges. Let us work together and achieve the exceptional nation we want to become. Mr Speaker, Sir, with that, I support the Motion."
2018-05-16-T-003-S-00276,2018-05-16-T-003,276,Azmoon Ahmad,4.16 pm
2018-05-16-T-003-S-00277,2018-05-16-T-003,277,Low Yen Ling,"Mr Speaker, Sir, I thank the President for her Address to this House."
