speech_id,topic_id,speech_order,member_name,text
2018-05-17-T-010-S-00318,2018-05-17-T-010,318,Teo Ho Pin,"Sir, as for the community, the Town Council can play a more active role to make common areas barrier-free and provide more amenities to encourage active and healthy lifestyle among our residents, especially seniors. Popular amenities for seniors include fitness gym, multi-purpose court, walking track and community garden. The Town Council can also provide better connectivity within the town by building more footpaths, cycling paths and covered linkways. This will encourage more residents to walk and cycle, thus, enhancing their health and well-being."
2018-05-17-T-010-S-00319,2018-05-17-T-010,319,Teo Ho Pin,"Sir, to make Singapore more elderly-friendly, we must ensure that our built environment is 100% seamless and barrier free. At present, many buildings and places do not have barrier-free access. Our public transport system is also not fully integrated to provide seamless travel for all seniors and wheelchair-bound commuters."
2018-05-17-T-010-S-00320,2018-05-17-T-010,320,Teo Ho Pin,"Sir, the Government must invest more in building the infrastructure to support an ageing population. We need a whole-of-Government approach at the Ministerial level to enhance the barrier-free connectivity of our built environment as many Government agencies are facing many barriers presently."
2018-05-17-T-010-S-00321,2018-05-17-T-010,321,Teo Ho Pin,"Third, providing sporting facilities for Singaporeans. Sir, swimming is ranked as the top three most popular sports among Singaporeans. Swimming is a low impact and wholesome exercise suitable for all age groups, especially the seniors. With an ageing population, many seniors are experiencing knee and joint problems and, thus, have reduced or stopped physical exercises. This trend is unhealthy. Furthermore, many seniors are not keen to take up swimming due to the hot and wet weather conditions in Singapore."
2018-05-17-T-010-S-00322,2018-05-17-T-010,322,Teo Ho Pin,"To overcome these challenges, I would propose that Singapore Sports Council build shelter with skylight for all public pools. Sheltered swimming pools will provide a more conducive environment for seniors to enjoy swimming and water sports in our public pools. It will also increase the usage of our public pools at all times during the opening hours, including adverse weather conditions and days."
2018-05-17-T-010-S-00323,2018-05-17-T-010,323,Teo Ho Pin,"Transforming our built environment for retail and recreation. Sir, online shopping has affected the brick-and-mortar retail shops badly. Many retailers are struggling to survive and continue to face rising business costs due to labour shortage and high rental cost. The high turnover of retail shops has resulted in much wastage of resources and disruption of services to consumers. We need to take bold measures to revamp the retail industry in Singapore. I wish to propose three ideas to support the retail industry transformation in Singapore."
2018-05-17-T-010-S-00324,2018-05-17-T-010,324,Teo Ho Pin,"First, regroup retail outlets and shopping centres to form mega shopping hubs so as to provide better experiences for shoppers. Sir, we need to review our planning guidelines to facilitate the grouping of shopping centres and retail outlets to form either large shopping districts, such as Shinjuku, or specialised shopping areas, such as Akihabara, in Japan. In this regard, I would urge the Government to review the development plans for Tampines, Jurong East and Woodlands regional centres to transform them into mega shopping hubs."
2018-05-17-T-010-S-00325,2018-05-17-T-010,325,Teo Ho Pin,"Second, build underground shopping malls with factory outlets to connect various MRT stations outside the city centre. These underground shopping malls can be located at residential areas and parks so that people can walk, shop, eat and relax in the parks. For example, we can build an underground shopping mall connecting Ang Mo Kio to Bishan Park and Thomson area. These underground shopping malls can also become evacuation or bomb shelters in times of emergency."
2018-05-17-T-010-S-00326,2018-05-17-T-010,326,Teo Ho Pin,"Third, transform our HDB neighbourhood centres into shopping malls and markets selling fresh produce and products. Last year, Bukit Panjang transformed its Bangkit neighbourhood centre into an art street selling a wide range of products and services. The transformation has attracted many more shoppers to the neighbourhood centre and provided much vibrancy to the town. Residents can now enjoy shopping in a barrier-free and weather-proof shopping environment."
2018-05-17-T-010-S-00327,2018-05-17-T-010,327,Teo Ho Pin,"Sir, the built environment of our country is the physical foundation of a world-class city. We need to align the built environment transformation to support the industry transformation so as to provide better jobs for Singaporeans, a better living environment for Singaporeans and a better quality of life for Singaporeans."
2018-05-17-T-010-S-00328,2018-05-17-T-010,328,Teo Ho Pin,"But Sir, we cannot rely on foreign talent alone to transform our built environment, we need to nurture Singaporeans to be world-class built environment professionals. We need to train more Singaporeans to be world-class project managers, facilities managers, architects, engineers and quantity surveyors to build and maintain our world-class city."
2018-05-17-T-010-S-00329,2018-05-17-T-010,329,Teo Ho Pin,"Sir, I urge the 4G leaders to pay more attention to the built environment and give due recognition to the professionals who build our physical environment for Singaporeans to pursue their dreams and aspirations. Sir, the transformation of our built environment is an excellent way to prepare Singapore for the challenges of the future. However, the method in which we plan for such a transformation has to be purposeful. A vision of a built environment which is bold and creative while remaining grounded in reality will be of great value to current and future generations of Singaporeans. Together, we can make Singapore a world-class city."
2018-05-17-T-010-S-00330,2018-05-17-T-010,330,Chee Hong Tat,"Mr Deputy Speaker, I support the Motion. Sir, we must and we will pursue economic growth. We must grow so that Singaporeans can have good jobs and opportunities. We must grow so that we have the resources to build our home, to take care of one another and to protect ourselves. We must grow for our children, to give them a better future."
2018-05-17-T-010-S-00331,2018-05-17-T-010,331,Chee Hong Tat,"Singapore is now a more mature economy. Our workforce will not increase as quickly as before. In GDP terms, we will not grow as fast as before."
2018-05-17-T-010-S-00332,2018-05-17-T-010,332,Chee Hong Tat,"But growth is much more than just GDP. We can grow in many more dimensions. Earlier this week, Minister Chan Chun Sing painted the vision of Singapore Unlimited. We can grow in productivity, so that our companies and workers do things smarter, faster and better than others. We can grow in skills, so that if you want to get difficult things done reliably and creatively, you will get it done through Singaporean workers and Singaporean companies. We can grow in innovation, so that if companies want to create products and services to serve the fastest growing area in the world, which is Asia, they will come to Singapore to turn their ideas into reality."
2018-05-17-T-010-S-00333,2018-05-17-T-010,333,Chee Hong Tat,"To grow, we must do three things. First, we must be pro-business in our rules and regulations. Second, we must be pro-Singapore  believe that our local companies and workers can compete with the very best. And, third, we must be pro-talent so that our people can have the best opportunities in Singapore."
2018-05-17-T-010-S-00334,2018-05-17-T-010,334,Chee Hong Tat,"Sir, the Government’s role is not to pick winners or to think that we know how to run companies better than our entrepreneurs, that we know more about business operations than our workers on the ground. We do not. Our focus is to set good rules and regulations, to protect our consumers and to foster a pro-business, pro-worker environment. We do not take this responsibility lightly. Because poorly designed or outdated rules can have unintended consequences. Where possible, we want to allow market forces to work efficiently, so that enterprises can compete fairly and achieve the best outcomes for society and consumers."
2018-05-17-T-010-S-00335,2018-05-17-T-010,335,Chee Hong Tat,"And we know we have to regularly review our rules because technology and business models change. When rules are set smartly, fairly and in a pro-business manner, our people and our companies benefit. This nimbleness sets us apart from other countries. Companies want to set up shop in Singapore because they know that here, they can operate in a trusted and reliable environment which is dynamic and connected with the world. They can pioneer a new business idea in Singapore, prove that it works and then export it around the world."
2018-05-17-T-010-S-00336,2018-05-17-T-010,336,Chee Hong Tat,Our Government agencies are fully on board. We will do the following.
2018-05-17-T-010-S-00337,2018-05-17-T-010,337,Chee Hong Tat,"First, we will proactively seek feedback from businesses to make it a part of our DNA and our instincts to be pro-enterprise; to continuously improve our rules and licensing framework, speed up processes and facilitate new business ideas."
2018-05-17-T-010-S-00338,2018-05-17-T-010,338,Chee Hong Tat,"One example is how AVA and SCDF worked with the Singapore Manufacturing Federation to enhance regulations for cold stores. Previously, fire prevention compartment walls in cold stores posed hygiene concerns as they could attract pests. Based on industry feedback, the agencies worked with SMF to allow an alternative insulation material which will retard the spread of fire without posing hygiene risks. It is a win-win outcome, which helped companies save several thousands of dollars per year for each cold store. It also demonstrated how Government agencies can work with industry partners to adopt pro-business approaches without affecting regulatory objectives."
2018-05-17-T-010-S-00339,2018-05-17-T-010,339,Chee Hong Tat,"Second, we will cut red tape and simplify our licensing regime to reduce compliance costs for businesses. The Pro-Enterprise Panel (PEP) is currently working with the Association of Catering Professionals Singapore to do a deep dive into the regulatory requirements for the food sector. The food industry is not the biggest sector in our economy, but we chose to start with this as a pilot because we believe the regulatory improvements can benefit many of our SMEs and workers."
2018-05-17-T-010-S-00340,2018-05-17-T-010,340,Chee Hong Tat,"Currently, companies can have up to 14 regulatory touchpoints with different Government agencies before they can set up a food shop. We asked ourselves, is it really necessary to have 14 touchpoints? I believe we can do better. The PEP is working with the Smart Nation and Digital Government Office and GovTech on this review. We have set for ourselves an ambitious target to streamline the 14 forms into one form and to correspondingly reduce the time taken and licence fees which companies have to pay to start a food business. I do not know if this pilot will succeed but we will try."
2018-05-17-T-010-S-00341,2018-05-17-T-010,341,Chee Hong Tat,"As Minister Ong Ye Kung advised us when we embarked on the review, “Think big, start small, act fast.” We will begin with this pilot, learn from the experience and extend the concept to other sectors subsequently. I believe these moves can have a positive impact on businesses by reducing regulatory costs and speeding up the application processes. They also help to shape a more positive pro-enterprise culture amongst our Government agencies."
2018-05-17-T-010-S-00342,2018-05-17-T-010,342,Chee Hong Tat,"Third, we will encourage experimentation via mechanisms, such as regulatory sandboxes. The Monetary Authority of Singapore (MAS) has introduced a regulatory sandbox framework for the financial technology or fintech industry. This encourages stakeholders to experiment within a well-defined “safe” space. Other agencies like the Ministry of Health and Energy Market Authority have also started their own regulatory sandboxes for telemedicine and the energy sector."
2018-05-17-T-010-S-00343,2018-05-17-T-010,343,Chee Hong Tat,"There is some risk when we embark on rules review and implement regulatory sandboxes. Some of the pilots could fail and some of the new rules may not work well. But we have to try, as remaining status quo and playing it safe is simply not tenable when we have to compete with other cities in the world for ideas, investments and talent. In such an environment, the most dangerous strategy is to make no bold moves. What is important is to learn from the failure and have the resilience to bounce back and try again."
2018-05-17-T-010-S-00344,2018-05-17-T-010,344,Chee Hong Tat,"Being pro-business in our rules is much more than the economy. It is about shaping our social norms and our social compact. It is about supporting risk-taking and overcoming our fear of failure. In the process of trying something new, we learn and become more resilient and more resourceful. Such changes can have a significant and lasting impact on our societal culture and the kind of society we want Singapore to be."
2018-05-17-T-010-S-00345,2018-05-17-T-010,345,Chee Hong Tat,"Recently, I met the three Singaporean students who started Binjai Brew – Rahul, Abilash and Heetesh. They are engineering students at the Nanyang Technological University (NTU) and spent a year together at UC Berkeley for their overseas attachment. Rahul did an internship with a brewery in Richmond, California, and that was when they picked up the interest and knowledge to brew their own beer. The three young men experimented with different brewing techniques. They adopted an engineering approach, building their own fridge to control the temperature settings, measuring the results of different recipes and brewing methods. After some months of trial and error, they produced good quality beer which they then shared with their friends at NTU, not just one variety but seven different types of beer. I have tried their beer; it is very good."
2018-05-17-T-010-S-00346,2018-05-17-T-010,346,Chee Hong Tat,"Unfortunately, they were not able to continue with their brewing on campus. The students told me that NTU has been very supportive and encouraging and offered to help them to continue while complying with the law. The PEP Secretariat and I have also offered our help. We met the three students over dinner and had a good discussion on how our current licensing regime could be reviewed to lower the barriers of entry for micro-brewers to test out new products during an initial trial period, before applying a more rigorous set of rules when they subsequently scale up their production and sales. My colleagues and I are looking into this proposal and we will discuss with the regulatory agencies. Again, I do not know if we can successfully implement this regulatory change but we will give it a shot."
2018-05-17-T-010-S-00347,2018-05-17-T-010,347,Chee Hong Tat,"I told Rahul, Abilash and Heetesh that I admire their enterprising spirit, their willingness to take risks and try something different and their dedication in applying their engineering training to perfect the recipes and brewing techniques. These attributes will be valuable for them in future, whichever career path they choose. I hope more of our young people can have similar opportunities to pursue their passion and have support from their families and society to take a less trodden path."
2018-05-17-T-010-S-00348,2018-05-17-T-010,348,Chee Hong Tat,"Next, we must believe in our enterprises and our people. Singapore companies and workers can compete with the very best in the world and come out on top. To thrive and grow, Singapore companies know they have to sell to the world. To develop products and services for the rest of the world, they have to prove their viability in Singapore. We must give them the opportunities and help them to succeed."
2018-05-17-T-010-S-00349,2018-05-17-T-010,349,Chee Hong Tat,"The Government will give fair consideration to Singapore companies when we procure products and services, to seek out creative and innovative ideas from our companies; to partner them in our Government projects; to enable them to build up a track record to compete overseas."
2018-05-17-T-010-S-00350,2018-05-17-T-010,350,Chee Hong Tat,"For example, the Health Promotion Board appointed Activate Interactive, a local SME, to develop the Healthy 365 mobile app and provide the step trackers for the first season of National Steps Challenge. All 100,000 trackers were taken up by our enthusiastic participants. Activate built on this success to spin off another company, Actxa, to venture into the wearables industry. Actxa is now able to hold a place in the wearables market among well-entrenched competitors, such as Apple and Garmin, and it is developing new innovative products and expanding into overseas markets."
2018-05-17-T-010-S-00351,2018-05-17-T-010,351,Chee Hong Tat,"We have many good local companies run by talented Singaporeans. I met Syafiq Yussoff last month. He is the founder and CEO of Riverwood, a home-grown logistics company. Syafiq dropped out of school when he young as he had to support his family. But he never stopped learning. While working as a personal trainer, he picked up useful business lessons and ideas from his clients. He then started Riverwood, armed with only two vans and four employees. Through hard work, taking calculated risks and learning from initial mistakes, Syafiq has grown his company to where it is today, with more than 60 vehicles and over 100 workers. More than 80% of his employees are Singaporeans."
2018-05-17-T-010-S-00352,2018-05-17-T-010,352,Chee Hong Tat,"Syafiq also impressed me with his drive to constantly innovate and grow his business. Riverwood has applied technology and productivity measures extensively to boost its competitiveness. Last year, Amazon picked Riverwood as the vendor to deliver their products in Singapore. Syafiq is now looking at supplying halal food products to Japan. I asked him why Japan, the country does not have a large Muslim population. He explained that the Japanese are interested in halal food products to serve the growing market of Muslim tourists and also to prepare for Tokyo Olympics in 2020. So, there is an opportunity for a company like Riverwood to enter the market and apply their logistics capabilities and the trusted Singapore brand name to ensure process integrity and quality assurance for halal food products."
2018-05-17-T-010-S-00353,2018-05-17-T-010,353,Chee Hong Tat,"Third, we must have the best talent in Singapore. Sir, the Government has rolled out several initiatives over the past few years to calibrate the total number of foreign workers in Singapore and safeguard the well-being of Singapore workers. These include training and skills-upgrading for our workers under programmes, such as SkillsFuture, Professional Conversion Programme and Adapt and Grow."
2018-05-17-T-010-S-00354,2018-05-17-T-010,354,Chee Hong Tat,We also implemented the Fair Consideration Framework (FCF) and the Tripartite Standard on the Employment of Term Contract Employees. Companies with unfair hiring practices know they will run into problems and troubles with the authorities. About 150 companies have improved their HR practices and moved out of the watch-list. This shows that a differentiated approach is effective in sending the correct signals to companies and incentivising them to adopt good practices that benefit Singapore and Singaporean workers.
2018-05-17-T-010-S-00355,2018-05-17-T-010,355,Chee Hong Tat,"Mr Deputy Speaker, to be pro-Singapore worker is not just about having safeguards. And it is certainly not about building walls and closing our doors to new immigrants and global talent. With Singapore’s ageing population, such an approach will only hurt the country and our people. To be pro-Singapore worker, I believe the more effective way is to grow our economy, help our companies to do well, so that they can provide better jobs, better pay and better life for our workers."
2018-05-17-T-010-S-00356,2018-05-17-T-010,356,Chee Hong Tat,Singapore produces many talented people through our world-class education system. Singaporeans are held in high regard for our work ethic and reliability. Our workers are highly skilled and trustworthy and we have the ability to work in a diverse environment with people from different cultures and backgrounds.
2018-05-17-T-010-S-00357,2018-05-17-T-010,357,Chee Hong Tat,"The made-in-Singapore Dyson motor is a good example of how our people are collaborating with the best talent in the world. Dyson, a British company which manufactures household appliances like vacuum cleaners, uses its advanced manufacturing facility in Singapore to produce almost all the digital motors for their appliances sold throughout the world. Yvonne Tan, who is Dyson’s research and development engineering manager, has overseen the production of more than 20 million digital motors since joining the company in 2015."
2018-05-17-T-010-S-00358,2018-05-17-T-010,358,Chee Hong Tat,We also have Singaporeans holding senior positions in our multinational corporations (MNCs). Linus Lee heads Twitter’s data science team in Singapore. Clarence Chew led Decathlon’s entry into Southeast Asia and Australia.
2018-05-17-T-010-S-00359,2018-05-17-T-010,359,Chee Hong Tat,"Interacting with our students gives me confidence that our society and our education system have produced many young people with the resilience, resourcefulness and gumption to compete with the best in the world. I recently attended the graduation ceremony at Ngee Ann Polytechnic (NP) where I met Emmett Goh and Lynette Lau."
2018-05-17-T-010-S-00360,2018-05-17-T-010,360,Chee Hong Tat,"Emmett did well at ITE and earned a place at NP. He won the Tay Eng Soon Gold Medal at the recent graduation ceremony. But it was not all rosy for him from the start. He was once arrested for getting into a fight with schoolmates when he was 16. After that incident, he decided to turn his life around. During his time at NP, he did a six-month internship at Metta Nairobi, an entrepreneur’s club that brings startup communities together in Kenya. Emmett has many dreams he wants to pursue, including joining a private equity firm, running an exotic resort and becoming an inspirational speaker."
2018-05-17-T-010-S-00361,2018-05-17-T-010,361,Chee Hong Tat,"Lynette’s story is equally impressive. During her time with NP, she did a six-month internship with Grab Indonesia where she travelled across 10 cities to conduct market research for its business expansion. She successfully devised a new method to reduce the backlog of driver sign-ups and increase their productivity. She even picked up Bahasa Indonesia during her internship. Lynette is now running a startup, Pixcels, which provides photobook services and she aspires to own a successful business one day."
2018-05-17-T-010-S-00362,2018-05-17-T-010,362,Chee Hong Tat,"To maximise the potential of our people, Singapore’s economy must have the capacity to generate good jobs and provide our people access to the best opportunities, the best networks and the best ideas. We cannot rely on MNCs alone to achieve this, but neither should we look inward and only focus on local SMEs. I agree with Mr Liang Eng Hwa that the two need to go hand in hand. MNCs benefit from a strong base of SMEs and SMEs can grow and build new capabilities by working with MNCs. We need an economy with strong companies, whether they are local offices of MNCs, large local enterprises or SMEs."
2018-05-17-T-010-S-00363,2018-05-17-T-010,363,Chee Hong Tat,"To grow our economy, we have to develop Singaporean talent and also attract talent to our shores so that we can compete with other top-tier cities in the world. Ministers Chan Chun Sing and Heng Swee Keat have spoken about this. It is not just about growing our economic capital, but also our intellectual capital. This is why Silicon Valley remains the ""centre of the tech universe"". Nearly three-quarters of its skilled workers are foreign born. More than 40% of US companies in the 2017 Fortune 500 list were founded by someone who is foreign-born or has parents who are immigrants. Similarly, many of our startups in Singapore have co-founders who are foreign-born. Some have now become Singaporeans, adding to Team Singapore."
2018-05-17-T-010-S-00364,2018-05-17-T-010,364,Chee Hong Tat,"Besides bringing talent into Singapore, we should also think of ways to tap on the large talent pool in our region. We want to grow a group of regional talent who are familiar with Singapore and whom our companies can work with, both in Singapore and when they expand overseas, not only bringing the region into Singapore but also bringing Singapore into the region. Enhancing such connectivity will provide more win-win opportunities and help our companies to succeed when they expand overseas, when they operate in Singapore. Ultimately, what we want is to strengthen Singapore to benefit Singaporeans."
