speech_id,topic_id,speech_order,member_name,text
2018-05-17-T-010-S-00421,2018-05-17-T-010,421,Lawrence Wong,"There is no such thing as status quo; we are either improving or we are declining and going backwards. And there are countless examples of cities that once were centres of economic activity, but are no longer relevant today. At the same time, many emerging cities are working hard to leap-frog the competition and get to the top. So, the choice for Singapore is simple  adapt or perish."
2018-05-17-T-010-S-00422,2018-05-17-T-010,422,Lawrence Wong,"We see that from our own history. Over the last 700 years, Singapore's fortune had waxed and waned. The ancient seaport of Singapura thrived in the late 13th century. In fact, it was described in the Malay annals as the first great Malay trading port. But by the 15th century, the port had declined and the city had been depopulated. Then, the arrival of the British in 1819 set Singapore on a different trajectory, which is why we are commemorating the bicentennial next year. Post-Independence, we have succeeded against tough odds and moved from third world to first. So, what is next for our city?"
2018-05-17-T-010-S-00423,2018-05-17-T-010,423,Lawrence Wong,"In answering that question, I think we have to also reflect on our fundamental purpose. And as Mr Gan Thiam Poh said yesterday, Singapore's raison d’etre has been and will continue to be that of a trading hub serving the region and the world."
2018-05-17-T-010-S-00424,2018-05-17-T-010,424,Lawrence Wong,"But in today's world, it is not just about trading in goods. It is also about the flow of people, talent, finance and other services. It is about being at the centre of action, the centre of research, knowledge-based and innovation activities across Asia and the world."
2018-05-17-T-010-S-00425,2018-05-17-T-010,425,Lawrence Wong,"And that is why, in his Budget speech this year, Minister Heng Swee Keat talked about anchoring Singapore as a Global-Asian node of innovation and enterprise."
2018-05-17-T-010-S-00426,2018-05-17-T-010,426,Lawrence Wong,We are taking bold and decisive steps to realise this vision. We are all familiar with the plans for the new Changi Terminal 5 and Tuas Megaport. These are not just individual projects; they are the catalysts to transform major parts of our island.
2018-05-17-T-010-S-00427,2018-05-17-T-010,427,Lawrence Wong,"In the east, we are reviewing how the entire area around the expanded Changi Airport can be renewed and put to better use. For example, we can develop new industries, especially those related to the aviation sector. And these activities can also benefit from linkages with the nearby Changi Business Park and SUTD."
2018-05-17-T-010-S-00428,2018-05-17-T-010,428,Lawrence Wong,"Likewise, in the west, we are looking at new industry clusters that can be located next to the port and leverage on synergies with the port. These will also be connected to broader developments in the west, including the Jurong Innovation District and Jurong Lake District."
2018-05-17-T-010-S-00429,2018-05-17-T-010,429,Lawrence Wong,"In the north, we are stitching together multiple developments, from Woodlands to Sembawang and Seletar, as well as the upcoming Punggol Digital District. So, it is an entire northern corridor, which can anchor new businesses and investments."
2018-05-17-T-010-S-00430,2018-05-17-T-010,430,Lawrence Wong,The point is that we are not just doing more of the same. Each new development will be better than the one before. Each new project will push the boundary and pilot innovative solutions to make our city more attractive and further enhance our quality of life. And this is what we have been doing all the while.
2018-05-17-T-010-S-00431,2018-05-17-T-010,431,Lawrence Wong,"Look at what we have done in our HDB towns. Our newest town is Punggol. The blueprint was launched in 1996 and then we had to slow down due to the financial crisis. But we improved and upgraded the plan, relaunched it in 2007. Now, Punggol it is almost complete and it is a beautiful waterfront town where new flats are very popular with young couples."
2018-05-17-T-010-S-00432,2018-05-17-T-010,432,Lawrence Wong,"The next town is Tengah. It is a forest town which we have designed and the first batch of flats will be sold in November this year. We will improve on what we have done in Punggol so that Tengah will be even better, with new concepts of urban living, like smart home solutions, eco-friendly features and even autonomous vehicles (AVs) to provide shuttle services around the estate."
2018-05-17-T-010-S-00433,2018-05-17-T-010,433,Lawrence Wong,"And besides launching Tengah, we are now already looking at the next new site and, that is, Paya Lebar, after the air base relocates to Changi. The site is bigger than Ang Mo Kio or Bishan. So, there are huge opportunities for further urban innovation for a better quality of life for Singaporeans."
2018-05-17-T-010-S-00434,2018-05-17-T-010,434,Lawrence Wong,"In the same way, we have been constantly developing and improving our city centre. We started by renewing our CBD in the 1970s to create more office space. Then, we extended the CBD to Marina Bay. We started reclaiming the land in the 1970s. We launched the masterplan for Marina Bay in 1983 and, over the subsequent years and decades, worked hard at conceiving and developing the Marina Bay that we have today."
2018-05-17-T-010-S-00435,2018-05-17-T-010,435,Lawrence Wong,"Next, we will extend the city further to the Greater Southern Waterfront, after the ports move to Tuas. The space is three times the size of Marina Bay. But we want the impact to be much more than three times of Marina Bay. This is a completely blank canvas for all of us to dream of exciting new possibilities for the future and to make these dreams come true."
2018-05-17-T-010-S-00436,2018-05-17-T-010,436,Lawrence Wong,"So, when we say that we are not done building Singapore, it is not a slogan. It is a single-minded commitment and mission to keep building and improving our city. And I can confidently say that, over the coming years and decades, Singapore will be undergoing its most extensive transformation yet. What is our goal? To make Singapore one of the great cities of the world. A truly outstanding city to live, work and play, the kind that people talk about and return to over and over again. A city where everyone belongs; where all of us are proud to call home."
2018-05-17-T-010-S-00437,2018-05-17-T-010,437,Lawrence Wong,"An outstanding city is not just economically vibrant but it also needs to be socially inclusive; a place that embraces diversity, where different groups mix easily and have equal opportunities to participate. Unfortunately, if you look around us, it is not always the case in many cities. Often, the downtown area looks good, but other areas in the city are left to deteriorate, resulting in urban slums. From time to time, you will see segregation of neighbourhoods  between rich and poor; between ethnic groups; between young and old."
2018-05-17-T-010-S-00438,2018-05-17-T-010,438,Lawrence Wong,"We have worked very hard to avoid these problems in Singapore. Every HDB town has a balanced mix of residents across different ethnic groups and backgrounds. Every town has a mix of public-private developments, as well as different HDB flat types catering to diverse needs. Every town has common spaces where residents of different backgrounds get together, socialise and forge shared memories together. We have neighbourhood shops and hawker centres. We have playgrounds and fields where the children grow up and play. And, personally, growing up in Marine Parade, I still have very fond memories of the dragon playground downstairs next to my block and the children from all around that block coming down to play together. All of us may not know one another very well. From different backgrounds, it does not matter, we all get together to play. The void decks used to always be animated with activities; it will be a real treat for us to see a magic show and then there will be potluck and the parents will cook and we all eat together. And this special quality of HDB living, I am sure all of you can attest to is still alive and well today."
2018-05-17-T-010-S-00439,2018-05-17-T-010,439,Lawrence Wong,"We have done well in the last 50 years, but more still needs to be done. Our housing and urban plans must continue to push back against the growing pressures of inequality and social stratification. We cannot just leave things to chance, but we must deliberately plan for a more equal and inclusive society. And that is why we have been building more rental flats with newer, better designs, alongside the sold flats in various HDB towns. This means that families grow up in the same neighbourhood and the residents share the same common areas and facilities."
2018-05-17-T-010-S-00440,2018-05-17-T-010,440,Lawrence Wong,We are now going one step further to integrate rental and sold units within the same HDB block.
2018-05-17-T-010-S-00441,2018-05-17-T-010,441,Lawrence Wong,"We are also doing more to help families in our rental flats. Last year, almost 1,000 households moved out of rental flats to become homeowners. They are supported by significant housing grants as well as new programmes like the Fresh Start Housing Scheme. One thousand households from rental to homeownership. That is not bad but we must do even better than that."
2018-05-17-T-010-S-00442,2018-05-17-T-010,442,Lawrence Wong,"MND will be working with MSF, SSOs and the VWOs to see how best we can support the families, help them solve their issues holistically and get back on their feet."
2018-05-17-T-010-S-00443,2018-05-17-T-010,443,Lawrence Wong,"Besides looking out for rental families, we must also take care of the elderly, especially those who are living on their own in studio and 2-room flexi apartments. We do not want them to feel isolated and disengaged, as Members have highlighted just now. So, we are putting a lot more emphasis in the way we design our HDB flats and estates."
2018-05-17-T-010-S-00444,2018-05-17-T-010,444,Lawrence Wong,"This means more shared public spaces, like civic plazas and community gardens, for them to stay active. It means more community services and amenities, all under one roof, for convenient access."
2018-05-17-T-010-S-00445,2018-05-17-T-010,445,Lawrence Wong,"And a good example of what we have done is Kampung Admiralty which was officially opened over the weekend. Kampung Admiralty is just one small kampung with just over a hundred units, but we will plan for more “kampungs” in other HDB towns."
2018-05-17-T-010-S-00446,2018-05-17-T-010,446,Lawrence Wong,"Another aspect of inclusive development is to continually renew our buildings and infrastructure, because we do not want a situation where certain parts of Singapore are left to degrade and we end up with deteriorated neighbourhoods or towns, inhabited largely by lower-income or elderly residents. This is not just a Government matter. It is a shared responsibility. It requires the Town Councils to do proper maintenance and upkeeping of the estate. It requires residents to take care of the neighbourhood. But the Government has and will continue to do its part. All Members are familiar with the programmes we have put in place for estate renewal. You know them by the acronyms. We have the Selective En-bloc Redevelopment Scheme (SERS), Remaking our Heartlands (ROH), Neighbourhood Renewal Programme (NRP) and Home Improvement Programme (HIP)."
2018-05-17-T-010-S-00447,2018-05-17-T-010,447,Lawrence Wong,"All of these programmes are scoped carefully to ensure they are fiscally sustainable. SERS, as the name implies, is done only on a very selective basis. ROH is for town-wide enhancements; we have largely completed six towns and consultations are ongoing for three towns now. NRP which is for neighbourhood facilities, is ongoing for blocks built up to 1995. And HIP for enhancements or for retrofitting within the unit itself, is being completed for the flats that were built up to 1986. The selection of flats will be done as soon as possible so that we can complete this batch of HIP."
2018-05-17-T-010-S-00448,2018-05-17-T-010,448,Lawrence Wong,"Many Members have asked for extensions of these programmes. You would like to know when ROH can be done for your town; or when HIP can be extended to the newer flats. We do want to renew and rejuvenate our HDB towns in an orderly fashion. But as I have explained before, upgrading projects are expensive and span many years. So, we are studying this carefully to make sure that we have the resources to follow through on any future commitments."
2018-05-17-T-010-S-00449,2018-05-17-T-010,449,Lawrence Wong,"The need to maintain and renew our HDB towns is also linked to the issue of the end of lease. We have made clear from the outset that the HDB lease is 99 years. There is no doubt about that. Ninety-nine years is a long time – it covers two generations. The oldest HDB flat today is around 50 years and the vast majority have more than 60 years remaining. So, this is not an immediate issue at all. Yet, some have already called for automatic lease extensions or for HDB lease top-ups by private developers. It will be easy for me to give you a politically expedient answer now and try to wave away the problem. But there are serious trade-offs and ramifications to consider."
2018-05-17-T-010-S-00450,2018-05-17-T-010,450,Lawrence Wong,"Take the issue of lease extension. It sounds easy to do but it is not a straightforward matter. First, we should not assume everyone wants it. Second, as all of us who run Town Councils know, much more maintenance is needed for older flats. Imagine the flat beyond 99 years and how much more maintenance is needed and how costly it will be for residents."
2018-05-17-T-010-S-00451,2018-05-17-T-010,451,Lawrence Wong,"More importantly, despite our best efforts at planning, we are still severely constrained by space in Singapore. If there is no more land to recycle for future public housing, then what will happen to our children and grandchildren? How will they have access to subsidised housing in the future?"
2018-05-17-T-010-S-00452,2018-05-17-T-010,452,Lawrence Wong,"So, this is a complex issue and I am glad many Members who spoke about this recognise this. Several Members have offered suggestions, including Miss Cheryl Chan and Mr Alex Yam. Mr Leon Perera also spoke about this and I look forward to the Workers' Party's suggestions on this matter because he said that the Workers' Party is studying this matter very seriously and I look forward to receiving your suggestions as well. In fact, we welcome views on this matter from all parties and all Singaporeans. We recognise that it is a matter that Singaporeans care about and we want to listen to your views and feedback."
2018-05-17-T-010-S-00453,2018-05-17-T-010,453,Lawrence Wong,"Ultimately, the Government must grapple with these difficult questions, study the matter and do the responsible thing. Our duty is not just to the current generation who already own homes, but also to the future generations – those not yet voting and those not yet born, those whose lives and future depend on us making the right decisions now, on their behalf."
2018-05-17-T-010-S-00454,2018-05-17-T-010,454,Lawrence Wong,"At the end of the day, we want to ensure that every generation will be able to have an affordable and quality home in Singapore."
2018-05-17-T-010-S-00455,2018-05-17-T-010,455,Lawrence Wong,"We still have the time to do this work, as I have emphasised earlier but, for now, what is important is that we do not speculate, we do not spread misinformation which can impact the market. And this is critical. In fact, recently there was speculation that the Government would stop the use of CPF entirely for the purchase of HDB flats. It started from a media report highlighting a suggestion from an academic. He later clarified that the article did not fully reflect his views, yet, the information continued to circulate online and through WhatsApp groups. Just earlier this week, a resident came to me, showed me the phone with the screenshot of the article and said, ""Is the Government going to stop the use of CPF?"""
2018-05-17-T-010-S-00456,2018-05-17-T-010,456,Lawrence Wong,"So, let me be very clear about this. We are not stopping the use of CPF for HDB purchase. Even for older flats, CPF can still be used but under certain conditions to safeguard retirement adequacy of home-buyers."
2018-05-17-T-010-S-00457,2018-05-17-T-010,457,Lawrence Wong,"There has also been concern about the impact of lease expiry on HDB prices. But there is still value in older HDB flats – value which can be unlocked for retirement. We looked at real transaction data over the past year. An older 4-room flat with less than 60 years remaining would sell for around $300,000, median price; and a 5-room flat would sell for around $400,000. These are for non-mature estates. For flats in more popular locations, prices can be significantly higher – more than double the prices which I just mentioned earlier, more than double. So, a 4-room flat with less than 60 years remaining can sell for more than $600,000; a 5-room flat can sell for more than $800,000. Not pretend data, theoretical data; transaction data over the past year."
2018-05-17-T-010-S-00458,2018-05-17-T-010,458,Lawrence Wong,"So, the transacted price depends not just on length of remaining lease, clearly, but it also depends on many other attributes – factors like location, the storey height, the condition of the flat, these are all very relevant. Whatever the price you get from the sale of a flat today, the sales proceeds would be more than sufficient to purchase a smaller flat for retirement, for those who are interested in right-sizing. For example, if you sell a flat now, a 4- or 5-room, you can purchase a 2-room flexi flat from HDB with a 40-year lease for around $100,000; or a 3-room resale flat for around $250,000, depending on location. And people are doing that. I give you an actual example that happened recently."
2018-05-17-T-010-S-00459,2018-05-17-T-010,459,Lawrence Wong,"Mr Abdul Aziz Haji Hamdan, who is 67 years old, originally owned a 3-room flat in Marsiling with around 60 years of lease remaining. He decided to right-size to a Studio Apartment in Kampung Admiralty with a 30-year lease. He sold his 3-room flat for $250,000, purchased the Studio Apartment for just over $100,000. So, he has more than $140,000 in cash and CPF proceeds to supplement his retirement savings."
2018-05-17-T-010-S-00460,2018-05-17-T-010,460,Lawrence Wong,"For those who prefer to stay in the same place, there is also the Lease Buyback Scheme, where you can sell part of the remaining lease to HDB; or the option of renting out a bedroom."
2018-05-17-T-010-S-00461,2018-05-17-T-010,461,Lawrence Wong,"So, the monetisation schemes we have are in place and they are working; and we will continue to review and enhance these schemes and help our elderly unlock the value of their flats for retirement."
2018-05-17-T-010-S-00462,2018-05-17-T-010,462,Lawrence Wong,"Buying and selling a property can be a complex undertaking and it is easy to get carried away by market sentiments. Just not too long ago, there were people speculating in older HDB flats hoping to get SERS benefits and not explicitly saying that they were doing that. Now, the reverse has happened and there are people overly anxious about how much their older flats can fetch in the resale market."
2018-05-17-T-010-S-00463,2018-05-17-T-010,463,Lawrence Wong,"So, my advice to Singaporeans is this  do not buy or sell based on speculative information. Look at the facts and, if you are in the market for a home, do your homework carefully and choose something that fits your needs. We will make the resale market work better for potential buyers and sellers. In fact, I was reminded of this in a recent MPS. One resident came to me to seek help for more time to sell their flat because they could not get the price that they were looking for. Right after that, another resident came and said, ""I need a flat urgently, please give me a direct allocation of a flat from HDB"". I told her, ""I can't do that, you got to ballot, but if you want your flat so urgently, why don't you go to the resale market?"" And she immediately said, ""Resale market too expensive."""
2018-05-17-T-010-S-00464,2018-05-17-T-010,464,Lawrence Wong,"So, on the one hand, sellers find it hard to sell; on the other hand, buyers are saying that prices are still too high."
2018-05-17-T-010-S-00465,2018-05-17-T-010,465,Lawrence Wong,"So, we need to find better ways to match buyers and sellers in the HDB market. We started with the HDB Resale Portal, which has simplified and speeded up the resale transaction process and we will continue to do more. We will provide more information on the available flats in the market – be it new flats or resale flats – so that we can help buyers and sellers transact more smoothly and we can help Singaporeans make more informed housing decisions that best suit their needs."
2018-05-17-T-010-S-00466,2018-05-17-T-010,466,Lawrence Wong,"Besides the public housing market, we are also watching the private housing market. The property market, like any other asset market, will go through ups and downs. The Government cannot control or fix prices. But neither do we take a completely hands-off approach. We recognise that there may be over-borrowing in a very low interest rate environment and that sharp price changes that run ahead of fundamentals can be destabilising to the broader economy. So, we have put in place various measures over the years. We will continue to monitor market trends closely and make use of various policy levers to ensure a stable and sustainable property market."
2018-05-17-T-010-S-00467,2018-05-17-T-010,467,Lawrence Wong,"Mr Deputy Speaker, Sir, Singapore is a nation of homeowners. So, it is understandable why housing remains a top concern for all our people. My assurance is that the Government will continue to provide affordable and quality homes for all Singaporeans – both now and into the future. We will make sure that, in every town, we have a range of housing and amenities for all ages; more shared spaces for all to enjoy; and a place where every Singaporean feels that they belong."
2018-05-17-T-010-S-00468,2018-05-17-T-010,468,Lawrence Wong,"Besides being more innovative and inclusive, we also have to incorporate resilience in our urban development."
2018-05-17-T-010-S-00469,2018-05-17-T-010,469,Lawrence Wong,"What will happen to the world in the next 50 years? No one can predict. But we can be sure there will always be crises and threats and even black swan events. So, we have to build resilience into our city and urban systems. One big unknown is whether the planet can continue to sustain continued economic activities. If the world does not do enough to tackle climate change, Singapore will be at risk of coastal inundation due to sea level rises."
2018-05-17-T-010-S-00470,2018-05-17-T-010,470,Lawrence Wong,"So, we need to start making preparations now to strengthen Singapore’s resilience against climate change. One specific project we are doing is the polder development in Pulau Tekong. The dike system in the polder is designed to cater for sea-level rise and the dike can be raised and upgraded more easily compared to traditional reclamation. Concurrently, we are also studying how best to safeguard Singapore’s long-term coastal protection needs and we are undertaking detailed modelling and engineering studies for this purpose so that we can identify and recommend appropriate protection strategies. They may include use of dikes, pumps or other technologies, but the most important thing is to be prepared."
2018-05-17-T-010-S-00471,2018-05-17-T-010,471,Lawrence Wong,"So, this is just one example of how we are building resilience into our system and there are many more things that we will need to do to be a more resilient city."
2018-05-17-T-010-S-00472,2018-05-17-T-010,472,Lawrence Wong,"The urban transformation plans I have shared are significant in scale and require considerable fiscal resources. Mr Pritam Singh said earlier in the Debate that the current Government has more financial resources than previous generations of PAP leaders. But he forgot to mention that our fiscal commitments and spending are also at their highest ever levels. Singaporeans today are being provided with more services and support than before. For now, we are just able to meet all of our spending needs with current resources. But without additional revenues, how are we to meet the growing healthcare needs, as well as the many other proposals that various people, including the Workers' Party, have been asking for? And both Mr Pritam Singh and Mr Leon Perera have reiterated the call to change the rules on the use of reserves so that we can draw more from the reserves. Mr Leon Perera said that this was not just a technical issue, but a philosophical issue and I agree with him. But the rules were discussed at length, debated in this House thoroughly, so that we can find the right balance between present and future generations and we enshrine the rules in our Constitution. And this was done not too long ago."
2018-05-17-T-010-S-00473,2018-05-17-T-010,473,Lawrence Wong,"What does it say about us and our mindsets and attitude, if the minute we need the money, the first thing we do is to relax the rules? Surely, that will be ill-disciplined, imprudent and unwise."
