speech_id,topic_id,speech_order,member_name,text
2019-08-05-T-015-S-00276,2019-08-05-T-015,276,Seah Kian Peng,"A few supplementary questions for the Senior Minister of State. I think first, we recognise the advantages that PMDs bring to society and they can create jobs as well. I think by and large, we have no problems with many of the users who use PMDs responsibly. The problem, as we know, is always with a small group of PMD users who flout the rules and also retailers who flout the rules. So, my first supplementary question to Senior Minister of State concerns individual users who flout the rules, who do not know how to use it and endanger the lives, whether they use it on the roads or on the pathways. We know so many cases where there are injuries, near misses and it is very difficult, much as we like, in terms of enforcement, how do we report them. My residents have told me that even if they want to, they do not know how. The users zoom past them and there is no time to take a photo and all that. So, I think we need to – while the rules are there, the rules are no good if it is not enforced. So, can we think of ways where we either step up enforcement through technology, through more people, I am not sure how, I am sure the fraction – it is a small fraction of the number of people we have to do this enforcement compared to the number of users that are on the road. So that is my first question  how can we step up enforcement against irresponsible users, regardless whether they are using on the road or on the pathways until – because we cannot fix them as what Mr Lim has asked for."
2019-08-05-T-015-S-00277,2019-08-05-T-015,277,Seah Kian Peng,"Second question  I also echo the concern about retailers who are outrightly selling things which they should not. For them, I think stiffer action needs to be taken. There should not be any two ways about it and we should be firm, we should be hard and should send the right message across to both retailers and irresponsible users."
2019-08-05-T-015-S-00278,2019-08-05-T-015,278,Lam Pin Min,"I thank Mr Seah for those two supplementary questions. The first one is on the small group of irresponsible users. I totally agree with him that the majority of PMD users are responsible. Right now, we have 90,000 people who have registered PMDs in our database, and we know that only a small number of them are irresponsible. How can we then enhance our enforcement actions against this small group of people? Having said that, we do not want to ban the use of PMD just because of this small group of irresponsible users, while affecting the rest who are responsible."
2019-08-05-T-015-S-00279,2019-08-05-T-015,279,Lam Pin Min,"LTA has started what we call a ""crowdsourcing application"". I think Members would have read in the papers about the ""Report PMD/PAB Incident"" function within the MyTransport.SG application. This will allow any Singaporean to take a picture of any errant riders that they may encounter. I understand its limitation. We will review and monitor the reports that are received from this application. Whenever possible, we will take enforcement action against the errant rider. At the same time, we also understand that sometimes it may be difficult to identify the irresponsible user just through a picture taken using the app. But this will also give us good information on some of these areas that are potentially hotspots and then we can step up enforcement actions, whether physically or otherwise, at these places."
2019-08-05-T-015-S-00280,2019-08-05-T-015,280,Lam Pin Min,"I have also mentioned in my Ministerial Statement that we will be increasing the number of enforcement officers or AMEOs, up to about 200 by end of this year. And I believe, with more manpower, we will be able to do more. In fact, LTA has stepped up enforcement actions to the extent that almost on a daily basis, you will see that LTA has been putting up postings on its Facebook about some of these errant riders being summoned and some of these non-compliant devices being impounded. At the same time, we will also see how we can harness technology in our enforcement efforts, one of which I have explained in my Statement, which is piloting the use of mobile CCTVs at certain hotspots and see how we can use video analytics for the enforcement actions."
2019-08-05-T-015-S-00281,2019-08-05-T-015,281,Lam Pin Min,"As to the Member's second clarification on errant retailers, yes, indeed, I share the same sentiment that we should really get tough on some of these irresponsible retailers. Like I mentioned in my previous reply, we will not hesitate to take very stiff actions against some of these errant retailers."
2019-08-05-T-015-S-00282,2019-08-05-T-015,282,Lee Bee Wah,"First of all, I would like to thank the Senior Minister of State for including Khatib Centre as one of the five piloted sites for POZs. In fact, Khatib Centre has been POZed long before – until, until Active Mobility Act came into force. And I would like to ask the Senior Minister of State to work closely with the local Member of Parliament. I have a lot more POZs in Nee Soon South that I would like to work with MOT on. It is not just in Khatib Centre; covered linkways as well."
2019-08-05-T-015-S-00283,2019-08-05-T-015,283,Lee Bee Wah,I have three supplementary questions.
2019-08-05-T-015-S-00284,2019-08-05-T-015,284,Lee Bee Wah,"Just now, Senior of State mentioned that there are 90,000 PMDs registered so far. Out of the 90,000, how many are non-complying? From now until July, that is 11 months. If the number is huge, a lot of us will have nightmares. We would still have to worry about have to run in the middle of the night."
2019-08-05-T-015-S-00285,2019-08-05-T-015,285,Lee Bee Wah,"The second question, from 1 April, compulsory inspection before they can register PMD  is that a one-off inspection or will there be subsequent inspections? Because after that they can do modifications as well."
2019-08-05-T-015-S-00286,2019-08-05-T-015,286,Lee Bee Wah,"And the third question is that for those between 400 metres from MRT train stations, where you have covered linkways, those are the areas that normally, we received a lot of feedback of near accidents. So, I would like to ask the Senior Minister of State whether the infrastructure that he mentioned, the funding that he mentioned, will it be carried out for all the covered linkways between the 400 metres."
2019-08-05-T-015-S-00287,2019-08-05-T-015,287,Lee Bee Wah,"And I am glad to hear about using technology. Recently, I have a meeting with Singtel. In fact, they shared with me that they have the technology, they can give us data on who is the top violator, at what time it passed way, at what speed it went by. So, I hope that MOT can choose my area to be one of those piloted as well."
2019-08-05-T-015-S-00288,2019-08-05-T-015,288,Lam Pin Min,"First of all, let me just thank Er Dr Lee Bee Wah for supporting us in this effort. In fact, I must give credit to Er Dr Lee Bee Wah for the idea of POZs in town centres and neighbourhood centres. I visited Khatib Town Centre together with Er Dr Lee Bee Wah and she showed me some of the challenges on the ground. Through some of the feedback from Er Dr Lee as well as residents and other Town Council Chairmen and Advisors, we have, therefore, decided to implement and introduce these trials of POZs at the five selected town and neighbourhood centres. But, of course, if it proves to be very useful and if we receive very good feedback from Advisors as well as residents, we will implement the POZs island-wide to other town areas which Advisors have identified as potential hotspots."
2019-08-05-T-015-S-00289,2019-08-05-T-015,289,Lam Pin Min,"As to her clarification on the number of non-compliant PMDs, to date, we have 90,000 PMDs registered in our database, of which 10% have been declared to be UL2272-certified. So, we are looking at 90% of these devices that are non-compliant at this point in time. Therefore, it is one of the reasons why we have decided to bring forward the deadline for UL2272-certified devices to be used on the ground by only six months, rather than immediately. There is necessary for the retailers to have sufficient time to bring in the certified devices for the replacement."
2019-08-05-T-015-S-00290,2019-08-05-T-015,290,Lam Pin Min,"At the same time, we are also implementing this mandatory inspection regime from 1 April 2020. This will allow us, first of all, to verify that, indeed, some of this so-called self-declared certified PMDs are really certified to the UL2272 standard. Subsequently, what happens is that only PMDs that have been certified by our authorised inspection centres to be compliant, will be allowed to be registered."
2019-08-05-T-015-S-00291,2019-08-05-T-015,291,Lam Pin Min,"Whether this is going to be a one-off inspection or a periodic inspection, currently, we are discussing internally. If Members understand the lifespan of a PMD, it is probably going to just last about two to three years. If we do have a regular inspection regime, whether that is going to be, first of all, necessary; secondly, whether it is going to be cost-effective. Having said that, like I have shared, we are still discussing internally and if necessary, we may put this as a requirement."
2019-08-05-T-015-S-00292,2019-08-05-T-015,292,Lam Pin Min,"On the last clarification on the crowded covered linkways and whether we are able to use the $50 million fund that will be set up, the answer is yes. We will work with local Advisors to identify some of these hotspots and make the necessary infrastructure enhancements."
2019-08-05-T-015-S-00293,2019-08-05-T-015,293,Speaker,Mr Dennis Tan.
2019-08-05-T-015-S-00294,2019-08-05-T-015,294,Dennis Tan Lip Fong,"Thank you, Mr Speaker. First, I would like to ask the Senior Minister of State to answer my Parliamentary Question Nos 9 and 10. I have two supplementary questions. One relates to the issue of safe riding courses, would the Government consider making it compulsory for all users of PMD to attend safe riding courses? The Senior Minister of State mentioned that, at the moment, there are about over 90,000 e-scooters that have been registered and I wonder whether the Government has an estimation of how many e-scooters that have been imported and sold in Singapore that have not been registered so far. We can just well imagine that the figure is definitely greater than 90,000 and of all the e-scooters that have been used, surely, there are a lot of the e-scooters that have been used by more than one owner, that is, one scooter may be used by a few people in the family."
2019-08-05-T-015-S-00295,2019-08-05-T-015,295,Dennis Tan Lip Fong,"Secondly, still on the issue of public education, I think I have spoken about this in the past. I believe that to create a culture of safe riding, it will also involve putting the public information on the rules and on the etiquette to the users, that is, to PMD users, as well as to other park users or path users, who may not actively seek out such information, so they may not go to the LTA Facebook; they may not access certain areas where PMD users may, or go and sign up for safe riding courses. And this is clearly relevant. For example, a lot of elderly people, they may not access these Facebook sites for example and they are using the footpaths in our towns on an everyday basis. How do we ensure, for example, the simple etiquette that has always been talked about – that we should keep left, whether it is a PMD user, bicycle or pedestrian? How many persons actually consciously walk on a footpath or on a connector knowing that you keep left for safety —"
2019-08-05-T-015-S-00296,2019-08-05-T-015,296,Speaker,Please keep the question short.
2019-08-05-T-015-S-00297,2019-08-05-T-015,297,Dennis Tan Lip Fong,— and being considerate. Thank you.
2019-08-05-T-015-S-00298,2019-08-05-T-015,298,Lam Pin Min,"I would like to thank the Member for those very pertinent questions. Maybe just allow me to answer his Parliamentary Questions on PMD-sharing in private premises. Under the Parking Places Act, operators are required to obtain a licence to offer dockless PMD-sharing services if users of PMDs may end PMD rentals in a public space – meaning outside private premises. This is to prevent indiscriminate parking of shared devices."
2019-08-05-T-015-S-00299,2019-08-05-T-015,299,Lam Pin Min,"However, the licensing regime currently does not cover PMD-sharing operators who deploy their devices solely on private land. At present, PMDs belonging to commercial shared services, operating from private land are allowed to travel on public paths so long as the rental does not end in a public place. We are watching this very closely, especially for PMD-sharing operators who flout this rule, and we will take action against them."
2019-08-05-T-015-S-00300,2019-08-05-T-015,300,Lam Pin Min,"From 1 July 2019, it is an offence under the Active Mobility Act for companies to sell or lease non UL2272-certified PMDs for use on public paths. This even includes operators who offer PMD-sharing services from private premises. What this means is that, all rental PMDs must be UL2272-certified, with no exception."
2019-08-05-T-015-S-00301,2019-08-05-T-015,301,Lam Pin Min,Our licensing regime under the Parking Places Act requires PMD sharing licensees to procure as well as maintain third party liability insurance. This does not apply to those operating solely on private land.
2019-08-05-T-015-S-00302,2019-08-05-T-015,302,Lam Pin Min,I hope this answers the two Parliamentary Questions that the Member had filed.
2019-08-05-T-015-S-00303,2019-08-05-T-015,303,Lam Pin Min,"The Member also asked about whether we have any information on the number of devices that are not registered so far. Unfortunately, we do not have information even though registration has been mandatory since 1 July this year. As long as they are not registered, e-scooters cannot be used on public paths. I encourage owners of such unregistered devices either to quickly register them, or if not, they should dispose these devices in a safe and responsible manner."
2019-08-05-T-015-S-00304,2019-08-05-T-015,304,Lam Pin Min,"As to mandatory education on safe riding, we have also asked ourselves whether we should make it mandatory for all PMD users, but we concluded that at this point in time, it may not be necessary to do so. Instead, like I mentioned in my reply to Dr Teo, we encourage all riders to go through the Safe Riding Programme (SRP). We have even fully subsidised SRP for all users if they want to take part in this process, up to December 2019. We will continue to work with all the various interest groups to encourage people to take part in the SRP."
2019-08-05-T-015-S-00305,2019-08-05-T-015,305,Lam Pin Min,"We have also published a Code of Conduct for PMD users and this was actually suggested by the AMAP. This provides PMD users some guidelines on some of the things that they should do when riding a PMD responsibly. I also reckon that, sometimes, many of our elderly residents may not be aware of some of these rules and etiquette when using a public path. Therefore, we have also engaged the community to help us in this public education effort, through the Active Mobility Patrol (AMP) teams that are currently present in more than 60 constituencies. I also want to encourage constituencies which do not have an AMP to please sign up for the AMP. LTA will work closely with Members to educate PMD users as well as your residents on the safe use of PMDs and pathways."
2019-08-05-T-015-S-00306,2019-08-05-T-015,306,Murali Pillai,"Mr Speaker, Sir, I applaud the announcement by the hon Senior Minister of State Dr Lam to bring forward the amnesty period for the use of non-compliant PMDs from end 2020 to 1 July 2020. This is the concern I had in the Parliamentary Question that I filed for answer in today's session. I have three supplementary questions."
2019-08-05-T-015-S-00307,2019-08-05-T-015,307,Murali Pillai,"The first is in relation to the spike in the fire incidents. As Senior Minister of State Dr Lam mentioned, last year, we had 52 PMD related fires, and this year, from January to July, we already had 49 fires. As the Members of the House may recall, Dr Lam made an announcement in this House in September 2018 about the new standards. Following that, retailers of PMDs dumped prices from $600 to about $200 to $300. I believe, this may have resulted in people buying these non-compliant PMDs. I am not sure whether there is a correlation between this dumping and the higher incident of fires involving PMDs."
2019-08-05-T-015-S-00308,2019-08-05-T-015,308,Murali Pillai,"I am also concerned, whether or not these PMDs are fit for purpose. Even though you charged the PMDs properly, they could still be fire hazards. I wonder whether the Ministry could provide services to such PMD users to see whether their PMDs are fit for purpose."
2019-08-05-T-015-S-00309,2019-08-05-T-015,309,Murali Pillai,"The second question is in relation to the mandatory inspection date of 1 April 2020. Given that only 10% of PMDs are compliant now and given that the amnesty ends on the 1 July 2020, I would imagine that a good percentage of PMDs would fail the inspection, come 1 April 2020. What would be the status of such PMD users?"
2019-08-05-T-015-S-00310,2019-08-05-T-015,310,Murali Pillai,"Finally, given that there is still a high number of non-compliant PMDs after 1 July 2020, I wonder whether steps could be taken to prevent a secondary market of non-compliant PMDs in Singapore; perhaps we could consider providing value for scrapping such non-compliant PMDs."
2019-08-05-T-015-S-00311,2019-08-05-T-015,311,Lam Pin Min,"I would like to thank Mr Murali for those supplementary questions. Indeed, it is of a great concern to LTA and MOT, when we read of the statistics for PMD-related fires. Like he rightly mentioned, in 2018, we had 52 cases and just the first half of this year, we had 49 cases. But if you look at the same period comparing the first half of 2019 with the first half of 2018 , it is actually a three-fold increase."
2019-08-05-T-015-S-00312,2019-08-05-T-015,312,Lam Pin Min,"This can likely be attributed to the increase in the population of PMDs in Singapore. When we first started one or two years ago, our rough estimate was about maybe 20,000 to 30,000 devices in Singapore. This has increased to 90,000 since we implemented the mandatory registration requirement."
2019-08-05-T-015-S-00313,2019-08-05-T-015,313,Lam Pin Min,"As to the 90% of the non-compliant PMDs, we will, like I have mentioned before, encourage owners to quickly change out to the UL2272-certified PMDs as soon as possible. If not, then we will want to remind PMD owners on some of the safe practices when it comes to the charging of the non-UL2272 certified devices, which I had already elaborated earlier."
2019-08-05-T-015-S-00314,2019-08-05-T-015,314,Lam Pin Min,"Will there be a secondary market for non-compliant PMDs? I hope not, as least not in Singapore. The use of non-UL2272 certified devices on public paths will be illegal from 1 July 2020. If we do find anyone using such non-compliant devices, they will be taken to task."
2019-08-05-T-015-S-00315,2019-08-05-T-015,315,Daniel Goh Pei Siong,I thank the Senior Minister of State. I have three questions.
2019-08-05-T-015-S-00316,2019-08-05-T-015,316,Daniel Goh Pei Siong,The first is regarding the cost of the compulsory inspection. Would it be borne by the Government or the owners and would that be included in the fee for registration?
2019-08-05-T-015-S-00317,2019-08-05-T-015,317,Daniel Goh Pei Siong,"The second one is whether there is a de-registration procedure. After inspection, after, let us say, the battery's shelf life is gone and people are disposing of their PMDs, the PMDs might still be registered, but the PMDs are no longer in use. Another scenario, the PMDs might still continue to be used but modified with the registration. So, is there a de-registration process for PMDs?"
2019-08-05-T-015-S-00318,2019-08-05-T-015,318,Daniel Goh Pei Siong,"Thirdly, regarding the UL2271 batteries, my understanding is that in some reports, there is some confusion with regard to UL2271 batteries that they can be used to replace batteries to make PMDs UL2272-compliant, like people buying UL2272 devices but then replacing the batteries with UL2271 batteries because they are of a higher quality, are more powerful and what not. Is this allowed or would this make it non-compliant?"
2019-08-05-T-015-S-00319,2019-08-05-T-015,319,Lam Pin Min,"I would like to thank Mr Goh for those supplementary questions. With regard to the cost of the inspection as well as the subsequent fee for registration when owners replace their PMDs, LTA is working out the details and will make the announcement soon."
2019-08-05-T-015-S-00320,2019-08-05-T-015,320,Lam Pin Min,"As to deregistration, there is currently a process for PMD users to deregister their registered PMDs. And I would want to remind owners to do so because failure to deregister will not take away your responsibility of being the owner of the PMD device if it is being used illegally subsequently. So, there is currently a deregistration process in place. Please remember to deregister your PMD when you want to discard or stop using your PMD."
2019-08-05-T-015-S-00321,2019-08-05-T-015,321,Lam Pin Min,"As to the last clarification on UL2271 and UL2272, I will have to check exactly whether they are compatible in terms of the certification. My understanding is that the device is certified to the UL2272 standard based on the battery and circuitry of the PMD. Any illegal modification or change to a different type of battery will actually render the UL2272 certification void. But I need to verify if UL2271 is, indeed, a compatible one. But I would encourage PMD users, if you need to change batteries, please go to a reputable retailer to have it changed. Do not do it yourself or through some black market retailers. Go to reputable ones to ensure that the certification will not be rendered void."
2019-08-05-T-015-S-00322,2019-08-05-T-015,322,Foo Mee Har,"Mr Speaker, I have one supplementary question for the Senior Minister of State. Mr Speaker, on improving infrastructure to cope with the needs of PMD users, cyclists and pedestrians, I believe the Senior Minister of State mentioned just now about a pilot site in Ang Mo Kio where cycling tracks are signficantly being explored to be expanded. He actually mentioned that, if need be, a dedicated lane on the road would be set aside, if I heard him correctly. What I would like to ask the Senior Minister of State is whether the Government will consider, given the rising popularity of the use of PMDs and cycling, going back to the early years of Singapore where there was a dedicated cycling track on the road along with the vehicles but, obviously, doing it safely as part of the future LTA Transport Master Plan."
2019-08-05-T-015-S-00323,2019-08-05-T-015,323,Lam Pin Min,"I would like to thank Ms Foo for the question. When we mentioned dedicated lanes for cycling, it is separate from the road itself. From our feedback and experience, and looking at what some other countries have been doing, locating the dedicated cycling path next to the road has its pros and cons. There is always the danger where the fast-moving vehicles on the road may pose a danger to the cyclist or PMD user. What we mentioned in Ang Mo Kio is that we will try to reclaim part of these roads so that we can make it as a footpath or dedicated cycling path, which is physically separated from the road itself. This is to ensure the safety of the slow-moving PMD users and the cyclists, as well as pedestrians."
2019-08-05-T-015-S-00324,2019-08-05-T-015,324,Cheryl Chan Wei Ling,"Mr Speaker, I actually concur with the Member Mr Seah Kian Peng's comments earlier on enforcement. I just have two other supplementary questions for the Senior Minister of State."
2019-08-05-T-015-S-00325,2019-08-05-T-015,325,Cheryl Chan Wei Ling,"The first is whether we will consider mandating the licensing registration at the point of sale so that we are actually tackling both the retailers who have the onus or responsibility of sending the different products they are bringing in to Enterprise Singapore for that Safety Mark, but also to enable the users to know that what they are purchasing is of good quality or has already been certified."
2019-08-05-T-015-S-00326,2019-08-05-T-015,326,Cheryl Chan Wei Ling,"Next, with regard to the use of technology, it is always possible with technology that we can mount gadgets on the PMD sets for sale since we are also asking the users to pay a licensing or registration fee. The main thing is that with technology it can help to track the speed of the individual PMDs so that we do not have to triple or quadruple the number of enforcers on the ground. The issue is very similar to that of high-rise littering or even pigeon-feeding. There can never be enough enforcers on the ground to help out with all this enforcement. With that technology, they can automatically trigger if there is any violation on the part of the PMD users."
2019-08-05-T-015-S-00327,2019-08-05-T-015,327,Lam Pin Min,"Mr Speaker, indeed, some of these suggestions are very valid and good. Whether we want to mandate registration at the point of sale is something that we can look at. We are not saying that we will disallow the registration by the retailer on behalf of the buyer. It can be done. But I would also like to remind users to purchase UL2272-certified or compliant PMDs from reputable retailers. If you are going to buy PMDs online, then there is a risk that you may be purchasing something that has been falsely declared to be compliant but which actually may not be."
