speech_id,topic_id,speech_order,member_name,text
2019-08-05-T-023-S-00587,2019-08-05-T-023,587,Christopher de Souza,"The regulatory framework for fire safety devices is meant to ensure accountability. For instance, the compliant-fire-safety product needs to have a certificate which can only be validly issued to a Singapore citizen, a domicile of Singapore or a body corporate incorporated in Singapore. This makes sure that the law can be actively enforced, deterring	opportunistic	merchants	who	may	prey	on unsuspecting customers by providing subpar products but escape from law enforcement by remaining outside Singapore. Furthermore, the new Part V in clause 26 of this Bill ensures that the whole certification, supply, installation and sales process meets the standards required. The new section 32 deals with false test reports used for certification. The new section 32A deals with giving false information to the accredited certification body. New section 32B ensures that certification process is only done by those authorised. And new section 32C regulates the supply of regulated fire products, ensuring that people do not advertise non-certified products as certified ones. New section 32D deals with installing an uncertified fire product as well as the manner in which a certified fire product is installed, making sure its quality is not compromised when it is being installed. Some offences, such as new section 32D(4), even have an enhanced offence with a jail term if harm to a person results because of that negligent or reckless act."
2019-08-05-T-023-S-00588,2019-08-05-T-023,588,Christopher de Souza,"Sir, The Straits Times article entitled ""Stricter rules and factory checks for cladding on buildings"" dated 9 November, 2018, mentioned that, among other stricter standards, builders must conduct site testing for cladding. While the specific standard of conduct is not found in the Bill, the Bill requires certification and that installation be done not negligently and recklessly. Would the Minister elaborate on how and whether the processes required will be raised so as to prevent another unfortunate event, such as that in Grenfell Tower in the UK or CIT Building on Toh Guan Road? Would the Minister elaborate how the stringency of the tests will balance between time and cost efficiency while minimising the chances of a costly misstep?"
2019-08-05-T-023-S-00589,2019-08-05-T-023,589,Christopher de Souza,"Clause 17 of this Bill inserts Part IIIB of the Act which regulates alarm monitoring services. The new section 22M requires alarm monitoring services to take all reasonable steps to check if there is a fire before cancelling. This offence reflects the great responsibility and heavy reliance the occupants of the building have on the alarm monitoring service. If the person carelessly cancels the call, the results may be devastating. By regulating alarm monitoring services and requiring a minimum standard of conduct, this Bill increases the teamwork between all stakeholders."
2019-08-05-T-023-S-00590,2019-08-05-T-023,590,Christopher de Souza,"On the issue of resource allocation, how is the Ministry raising awareness of the MyResponder app which allows members of the public to respond or send pictures of a fire? Additionally, how effective are public education efforts on how to manage chute fires, on where to find water sources to put out a fire and on how to react when a fire is at the entrance of the unit? Given the usefulness of the fire extinguisher in the event of a fire blocking the only escape pathway out of a house, what is being done to increase the take-up rate for fire extinguishers?"
2019-08-05-T-023-S-00591,2019-08-05-T-023,591,Christopher de Souza,"In the recent months, the number of fires caused by Power-Assisted Bicycles (PABs) and Personal Mobility Devices (PMDs) have increased significantly. There were 54 reported such fires in the first six months of this year. That is equivalent to about 73% of the total number of cases last year and more than the total number of such cases in 2017. These fires, at least in residential premises, seem to have increased in severity. Thirty-one people were injured in 36 fires versus 11 people in 23 fires in the beginning of last year. These numbers do not include the fires in July that were also caused by PABs or PMDs based on investigations or preliminary investigations – 3 July in Tampines; 9 July in Upper Boon Keng Road; 14 July in Yishun; 18 July in Bukit Batok which cost someone’s life; 22 July in Ang Mo Kio where three units were destroyed; 27 July, again in Boon Lay Drive. About six fires reported in the media as of 28 July."
2019-08-05-T-023-S-00592,2019-08-05-T-023,592,Christopher de Souza,"The numbers seemed to have increased at a significant rate but, unlike chute fires which are the highest cause of fire, fires caused by PMDs are not easily fought by a layman. These	fires	caused	by	PMDs	often	need	firefighting resources and have robbed many a family of their home, property, pets and even a loved one. The potential numbers are astronomical. There were more than 85,000 electric scooters registered at the end of June. Some of these do not have meet the UL-2272 certification requirement. They are like possibly ticking time bombs, unpredictable as to when and where the next fire will happen."
2019-08-05-T-023-S-00593,2019-08-05-T-023,593,Christopher de Souza,Would the Ministry consider working closely with MOT to hasten the time-frame by which all PMDs must meet the fire safety requirement?
2019-08-05-T-023-S-00594,2019-08-05-T-023,594,Christopher de Souza,"At this juncture, I want to take this opportunity to put on record the stellar work of the SCDF officers. In Jalan Buroh, on 21 June, the SCDF battled for about six hours a fire the size of two football fields, involving an unprecedented number of highly flammable LPG cylinders, fighting hard to contain and to put it out. In Woodlands, on 9 April, SCDF officers forced entry into the unit, rescued a woman, a teenager and two children trapped in the kitchen area, evacuated residents of other flats and put out the raging fire. In the process, one of the SCDF firefighters was injured with burns. In the fire in Ang Mo Kio on 22 July, the SCDF rescued from the burning flat a mother and her young children who were huddled in a room, too afraid to get out after hearing the explosion of the PMD. In the early hours of 18 July in Bukit Batok, SCDF officers in the call of duty wore breathing apparatus, cut through the iron gate, prised open the wooden door, rescuing a man who lay unconscious on the floor and his wife from the burning flat. These are just some examples of the life-saving courageous work that our SCDF officers do. It is not easy, especially when situations do not pan out the way everyone hopes for, yet, these officers continue to be vigilant day in and day out, night in and night out, ready to put out the next fire, risking limb and possibly life, and saving lives. We appreciate the work that they do. And having worked in the GPC, we understand first-hand the good work that the SCDF officers do."
2019-08-05-T-023-S-00595,2019-08-05-T-023,595,Christopher de Souza,"In conclusion, Sir, fire safety is a team effort which is necessary to keep everyone in Singapore safe. It involves the people who design the building, the builders and those who install fire safety devices, those who distribute and manufacture the fire safety devices, those who provide alarm monitoring services, tenants who place items in the passageway or engage in activities that potentially create an unreasonable fire hazard. In all, because no man is an island, I hope that we live together responsibly in our island city, working hand in hand to minimise fire hazards. Therefore, Sir, I support the Bill."
2019-08-05-T-023-S-00596,2019-08-05-T-023,596,Lee Bee Wah,"Mr Speaker, Sir, as a densely populated country with many tall buildings, we must take fire safety very seriously. There are cases when fires occurred in HDB and commercial units and did not spread. That is due to the equipment of necessary fire safety features, strict regulations in our fire safety code on usage of construction material that restricts flammability and permeation of flames and, of course, the efficiency of SCDF in reacting to fire emergencies. I wish to take this opportunity to express my appreciation to the SCDF for their good work in keeping Singapore safe."
2019-08-05-T-023-S-00597,2019-08-05-T-023,597,Lee Bee Wah,"Older buildings without the necessary fire safety features remain at risk. The UK Grenfell fire disaster, while far from home, remains a stark reminder to developed countries of what could happen if building developers use inappropriate construction material and scrimp on fire safety features.  An entire building was demolished, scores of people died, survivors left homeless and in despair. The incident prompted questions and concerns from myself and my colleagues about whether this could happen in Singapore. Over the years, we talked about the need for greater vigilance against fires and, personally, I had advocated for the installation of safety features like smoke detectors in all public rental flats, a project which kick-started last year and is currently underway. SCDF also identified and ordered some buildings to remove external cladding that did not meet fire safety requirements. Today, I am glad to see the results of a comprehensive review that will bring about many enhancements to current fire safety policies. Everyone in the supply chain has a role to play and must be held responsible, not just the engineers, architects or the Registered Inspectors. Contractors, sub-contractors, material suppliers, testing labs – all need to carry out their work professionally and honestly. Those who fall short shall be taken to task by this Fire Safety Act."
2019-08-05-T-023-S-00598,2019-08-05-T-023,598,Lee Bee Wah,"As our buildings get older, extreme weather conditions and lack of maintenance could affect and even speed up the ageing process. It is imperative that safety checks are done regularly on these buildings. I am glad to note that SCDF will soon be able to appoint authorised third parties to conduct routine fire safety enforcement checks and building inspections."
2019-08-05-T-023-S-00599,2019-08-05-T-023,599,Lee Bee Wah,"Understandably, SCDF may not have the resources on top of their regular duties, and plan to outsource this operation. I note that these authorised third parties would comprise auxiliary police officers, retired SCDF and police officers as well as other public servants. I would like to ask how often will these routine checks be conducted. What criteria and benchmarks would SCDF use to determine whether selected candidates are suitable for the roles? Would SCDF also consider registered fire safety engineers from the private sector and, if so, would they be required to submit a tender for their proposed services? In some industries, the competition in fees is so fierce that the fees become ridiculously low. As a result, the quality of the checks suffers. I hope SCDF will not let this happen to the fire safety checking profession."
2019-08-05-T-023-S-00600,2019-08-05-T-023,600,Lee Bee Wah,"How often will these third-party operations be audited by the SCDF? With the requirement for body-worn cameras, will the footage be reviewed regularly? What are issues that SCDF foresees that would justify the need for body cameras? These inspections and reviews would cost time and resources, so who will pay for it? Will the Government shoulder the expenses or is it the building owner who has to pay for these inspections and rectifications?"
2019-08-05-T-023-S-00601,2019-08-05-T-023,601,Lee Bee Wah,SCDF has identified some 500 old buildings to undergo critical fire safety upgrades necessary for public safety. What is the timeframe given for the building owners to comply? And what if they fail to do so? What if they dispute the order and drag out the case? Would this then result in the occupants and visitors being exposed to a fire safety issue whenever they are in the building?
2019-08-05-T-023-S-00602,2019-08-05-T-023,602,Lee Bee Wah,"On the other hand, there may be some practical reasons causing failure to comply. Perhaps, the building owner may not have other plans for the property, or he or she could be away and the stand-in is unable to make the financial decisions. What will be done to speed up the process? Can the Minister share the projected timeline for the completion of fire safety upgrades in all these 500 or so buildings? Every single person has an important role to play in fire safety. Should they act irresponsibly and recklessly, thus putting the lives of other people in danger, they deserve a heavier punishment as a form of deterrence. I note that harsher penalties will apply to certain offences that compromise fire safety. But what about the people who practise dangerous PMD-charging habits and put themselves and their fellow occupants and neighbours in danger? We need to hold people accountable for practising unsafe charging practices, selling or buying not original and non-complying PMDs, batteries or chargers. This has been in the news lately and many of my residents are very concerned."
2019-08-05-T-023-S-00603,2019-08-05-T-023,603,Lee Bee Wah,"First half year, 49 fires, one death and it is still counting. I hope multi-agencies, SCDF, MOT, HDB and even MOE should come together and take bold and decisive action."
2019-08-05-T-023-S-00604,2019-08-05-T-023,604,Lee Bee Wah,"I am glad to hear from the Ministerial Statement just now that MOT will bring forward the compliance of UL2272 PMDs to 1 July next year, but this does not mean there will be no fire incidents."
2019-08-05-T-023-S-00605,2019-08-05-T-023,605,Lee Bee Wah,"We need to have more education such as the proper way of charging, use of original parts, non-leaking batteries, non-faulty chargers, and no illegal modifications, and so on. For those who buy or sell non-compliant PMDs or modify their PMDs, they deserve harsher punishment. There are also a lot of people who shop online. How is the Ministry going to regulate this?"
2019-08-05-T-023-S-00606,2019-08-05-T-023,606,Lee Bee Wah,"Many residents also ask  is there any place that buyers can send their PMDs for checking for compliance, just like Vicom checks for cars. Residents want to be law-abiding, but they do not know how to go about it."
2019-08-05-T-023-S-00607,2019-08-05-T-023,607,Lee Bee Wah,"For MOE, I hope you can include compulsory modules in school on safe riding, correct etiquette, and the right way of charging, and so on."
2019-08-05-T-023-S-00608,2019-08-05-T-023,608,Lee Bee Wah,"If we cannot tackle the current PMD problem satisfactorily, I would like to give a bold suggestion – ban PMDs totally, PMA excluded. Then step by step, issue licences to those who need them only after they have attended the compulsory courses, passed the exam, bought the third-party insurance."
2019-08-05-T-023-S-00609,2019-08-05-T-023,609,Lee Bee Wah,"Just by registering PMDs alone is not good enough. We need the riders to be licensed, and the licenses can be revoked if they cause serious injuries or death. These are the bold and decisive actions that I hope our multi-agencies can serious look into it. Sir, I support this Bill. In Chinese, please."
2019-08-05-T-023-S-00610,2019-08-05-T-023,610,Lee Bee Wah,"(In Mandarin)  [Please refer to  Vernacular Speech.] I appreciate that the authorities are paying close attention to the fire safety issue. To inspect more buildings, SCDF will train third-party fire inspectors. These inspectors will wear a body camera at work so that SCDF can evaluate whether their work is up to standard. These inspectors are mostly auxiliary police and retired Home Team personnel. Will SCDF hire fire safety engineers? Who will pay for the relevant expenses?"
2019-08-05-T-023-S-00611,2019-08-05-T-023,611,Lee Bee Wah,"There were 49 PMD-related fires in the first half of this year. I lived in the countryside when I was a kid. I remember that when villagers gathered together to chit-chat, their face would turn whenever the topic of tiger came up. Similarly today at coffee shops, when residents gather together to talk, their face would turn when the topic of PMD comes up. Some will get very angry. One resident said  “In the daytime when I walk on the pedestrian path, I always feel very intimidated. I will have to keep looking to the right and left so that I won’t be knocked down by PMDs. At night, I even have nightmares because I do not know when my neighbour’s PMD will catch fire”. This is the suffering that our residents have to endure ever since the PMDs are introduced into Singapore. I hope that all the Government agencies can work together to solve this problem."
2019-08-05-T-023-S-00612,2019-08-05-T-023,612,Lee Bee Wah,The fire safety standard should be implemented as soon as possible and best if it can be implemented right away. Penalty should also increase. We should also help PMD users to check if their PMDs are compliant to the standard and teach them the correct ways to charge their PMDs.
2019-08-05-T-023-S-00613,2019-08-05-T-023,613,Lee Bee Wah,"However, some people bought their PMDs online. How do we regulate that? If we cannot tackle the current safety problems brought about by riding a PMD or charging it, I would suggest we ban the PMDs temporarily. Of course, PMAs are excluded."
2019-08-05-T-023-S-00614,2019-08-05-T-023,614,Lee Bee Wah,"In the future, we should only issue licences to those who have attended the mandatory courses and passed the exams, bought third-party insurance, and whose PMDs are compliant to the fire safety standard. Otherwise, how can we ensure the safety of pedestrians and HDB residents? I hope that the relevant authorities can look into this matter seriously. I support this Bill."
2019-08-05-T-023-S-00615,2019-08-05-T-023,615,Sylvia Lim,"Mr Speaker, the fire safety culture in Singapore needs to be improved. There is a common occurrence of HDB bin chute fires, and electrical fires caused by overloading and charging e-scooters and batteries. The density of our high-rise environment makes fire safety critical. As such, I am supportive of the rationale of this Bill to give further authority to the SCDF to require fire safety enhancements to buildings, to regulate fire safety products and to enhance SCDF investigation powers."
2019-08-05-T-023-S-00616,2019-08-05-T-023,616,Sylvia Lim,"Nevertheless, I wish to make some observations and seek clarification on three issues  first, imposing fire safety upgrades on existing buildings; second, the handling of the recent cases concerning non-compliant claddings; and third, the proposed use of third-party officers as routine inspectors."
2019-08-05-T-023-S-00617,2019-08-05-T-023,617,Sylvia Lim,"First, fire safety upgrades on existing buildings."
2019-08-05-T-023-S-00618,2019-08-05-T-023,618,Sylvia Lim,"Under the proposed section 20A of the Act, the Commissioner of SCDF will be empowered to mandate building owners to install critical fire safety upgrades. This will effectively mean that buildings that were compliant with fire safety requirements at the time they were constructed, may have additional requirements imposed on them. In the MHA press release of 8 July, it was stated that in imposing these additional requirements on existing buildings, SCDF would adopt a judicious, risk-based approach in identifying buildings for fire safety upgrades. It was further stated that in deciding whether to impose such requirements, SCDF would consider the buildings’ fire risk profile and factors such as building age, purpose and the profile of its occupants. The Senior Parliamentary Secretary earlier also mentioned earlier that about 500 such buildings have been identified."
2019-08-05-T-023-S-00619,2019-08-05-T-023,619,Sylvia Lim,"Sir, I appreciate the need to have robust fire safety requirements to prevent loss of life and limb and why this additional power given to the Commissioner of SCDF is critical. I also understand the sentiments of Er Dr Lee Bee Wah on this matter just expressed. At the same time, I note that SCDF has mentioned that it would be judicious in its approach. There is indeed a need to assess each older building to determine whether the upgrades are critical for safety, or are good-to-haves which may be costly and have limited utility."
2019-08-05-T-023-S-00620,2019-08-05-T-023,620,Sylvia Lim,"Let me illustrate the point generally. About six years ago, a cluster of seven HUDC blocks in my ward at Serangoon North built in the 1980s underwent privatisation. In connection with this exercise, the residents were advised that they needed to do Additions and Alterations Works to bring the cluster up to the current requirements of the Fire Code. The residents then undertook the works, such as installing fire doors at every staircase landing and making enhancements to their lifts. These works caused ground frustration as they affected residents’ daily lives in terms of inconvenience, dust and lift shutdowns, and also involved expenditure. After the estate was privatised in 2014, discussions resumed to obtain approval for an en bloc sale of the estate. Within three years, the estate was sold en bloc to a developer. If you were to visit the site today, you will see that all the former blocks have been demolished. That leads to a reasonable question  to what end then were the fire safety enhancements made to the old blocks?"
2019-08-05-T-023-S-00621,2019-08-05-T-023,621,Sylvia Lim,"Moving forward, while the HUDC privatisation are over, there may be older buildings that are expected to be sold to developers or be otherwise redeveloped. Can MHA elaborate on the judicious risk-based approach that SCDF will undertake in deciding whether certain upgrades are critical?"
2019-08-05-T-023-S-00622,2019-08-05-T-023,622,Sylvia Lim,"Next, the recent cases of non-compliant cladding."
2019-08-05-T-023-S-00623,2019-08-05-T-023,623,Sylvia Lim,"The fatal fires at Toh Guan Road and London’s Grenfell Tower were a wake-up call. After the Grenfell Tower tragedy, I filed a Parliamentary Question asking what preliminary lessons could be learned. The Minister’s reply then was that the SCDF would study the investigation report of the London Fire Brigade when it was released, to see if changes to our fire regulations were needed. In addition, he touched on the existing regulatory regime for construction projects, where the registered Qualified Person (QP) was responsible for ensuring that building materials conformed to the prevailing Fire Code. Among the requirements were that all claddings used in buildings had to meet the stringent Class Zero industry standard. It was further stated that after the QP signed off, a Registered Inspector would have to inspect the building to ensure that all fire safety requirements had been met. It was only thereafter that SCDF would issue a Fire Safety Certificate, allowing the premises to be occupied."
2019-08-05-T-023-S-00624,2019-08-05-T-023,624,Sylvia Lim,"It was thus surprising that in the months thereafter, SCDF issued notices to owners of more than 40 buildings that their claddings were non-compliant with the Fire Code. I assume that many of these buildings would have been issued with Fire Safety Certificates by SCDF, indicating that they were compliant with requirements."
2019-08-05-T-023-S-00625,2019-08-05-T-023,625,Sylvia Lim,"Be that as it may, SCDF has since reviewed the regulatory regime and identified points of weakness that led to non-compliant materials being used. These gaps involved the upstream supply chain, from manufacture and storage to testing and supply; there were instances of materials of different gradings being mixed and stored in the same place without proper distinguishing marks. To address this, the Bill introduces the new Part V on regulated fire safety products to tighten those weaknesses in the supply chain."
2019-08-05-T-023-S-00626,2019-08-05-T-023,626,Sylvia Lim,"Regarding SCDF’s investigations into the cladding cases, I note that for the Toh Guan incident, the cladding supplier and its marketing manager have been charged in court with several counts of cheating and the case is pending before the Courts. Are SCDF investigations still ongoing into other cases of non-compliant cladding being supplied and used, and whether other offences were disclosed?"
2019-08-05-T-023-S-00627,2019-08-05-T-023,627,Sylvia Lim,"Sir, whatever happened upstream, the downstream purchasers of these materials may well have been unaware and acted innocently to complete the projects with the non-compliant materials. In cases where Fire Safety Certificates were issued by SCDF before occupation, these parties would also have relied on the certificates to assume they were compliant. SCDF subsequently cited these buildings for having non-compliant cladding, requiring replacement with compliant materials. Could the Ministry explain what role SCDF played in assisting or supporting these innocent parties during the rectification works?"
2019-08-05-T-023-S-00628,2019-08-05-T-023,628,Sylvia Lim,"Finally, third-party officers."
