speech_id,topic_id,speech_order,member_name,text
2019-09-03-T-001-S-00001,2019-09-03-T-001,1,Walter Theseira,asked the Deputy Prime Minister and Minister for Finance (a) to what extent the policy of using past reserves to fund land reclamation will be applied to finance the projected $100 billion cost of climate change protection measures announced by the Prime Minister; and (b) what are the roles of the President and Parliament in approving or overseeing the use of past reserves for land reclamation-related climate change protection measures.
2019-09-03-T-001-S-00002,2019-09-03-T-001,2,Lawrence Wong,"Mr Speaker, we will need a combination of funding methods to finance the various climate change adaptation measures. Smaller scale infrastructure like localised flood barriers for public assets like hospitals and bus depots can be funded from the budgets of Ministries. For long-lived major infrastructure such as sea walls, the Government will look at the option of borrowing to spread the cost across the generations which will benefit. Where the measures include land reclamation, the land reclamation costs can already be met from Past Reserves."
2019-09-03-T-001-S-00003,2019-09-03-T-001,3,Lawrence Wong,"Parliament debates and approves the Supply Bill every year. Under the Supply Bill, the Government seeks approval for development expenditure, which includes land reclamation costs. The land created through reclamation will be protected as part of Past Reserves. When such land is subsequently sold, the proceeds accrue fully to Past Reserves. The reclamation of land is in essence a conversion of Past Reserves from financial assets to state land. This use is not a draw on Past Reserves."
2019-09-03-T-001-S-00004,2019-09-03-T-001,4,Lawrence Wong,"The use of Past Reserves to fund reclamation costs is in accordance with the Reserves Protection Framework, which is agreed between the President and Government. The Government provides the President with a statement on land-related expenditures annually."
2019-09-03-T-001-S-00005,2019-09-03-T-001,5,Lawrence Wong,MOF will continue to study equitable and sustainable ways to finance the full suite of climate adaptation measures we need to protect our island.
2019-09-03-T-001-S-00006,2019-09-03-T-001,6,Walter Theseira,"Mr Speaker, I thank the Minister for that reply. I just wanted to clarify – my understanding would be that when the Supply Bill is passed each year as part of the Budget, the policy then will be that any land reclamation cost will be clearly listed in that year's budget. The cost of that will be taken from the Past Reserves and therefore, will not be required to come from current tax expenditure. In the future, when the value of that land will be realised, it will be passed back to Past Reserves. So, in other words, is the commitment then, that in all such cases, the cost of land reclamation will be coming from the Past Reserves without a drawdown or the requirement to raise taxes currently, or is it going to be flexible based on the Finance Minister at the time?"
2019-09-03-T-001-S-00007,2019-09-03-T-001,7,Lawrence Wong,"Mr Speaker, as I have said just now, the Reserves Protection Framework already allows the Government to use the Past Reserves for all land reclamation projects. That is already the case today. And that is the basis for which we operate currently."
2019-09-03-T-002-S-00008,2019-09-03-T-002,8,Christopher de Souza,"asked the Minister for Trade and Industry how Singapore-based SMEs, Regional HQs, MNCs, and the workforce can protect themselves from the side effects of a US-China trade standoff and how can capitalising on innovation help these organisations overcome such side effects."
2019-09-03-T-002-S-00009,2019-09-03-T-002,9,Chan Chun Sing,"Mr Speaker, Sir, let me answer the question in two parts. First, I will explain why the choice of words ""US-China"" and ""trade conflict"" is not exactly very precise. For the second part, I will answer what we need to do as a country and as companies."
2019-09-03-T-002-S-00010,2019-09-03-T-002,10,Chan Chun Sing,"Let me touch on the first part. Today, the challenges that we are facing on the external environment are not exactly limited to only the tensions between US and China. The uncertainties around the world have gone beyond US and China. They include the uncertainties with Brexit, Japan and Korea, Hong Kong and others. It has also affected the functioning of the World Trade Organization (WTO) system, of which the challenges to the continued functioning of the appellate body is a serious concern for all of us. So, it is not just about US and China."
2019-09-03-T-002-S-00011,2019-09-03-T-002,11,Chan Chun Sing,"The second part is that it is also not just about the trade war. The competition between US and China today has gone beyond trade to encompass technology and other issues. So, it is a more multifaceted challenge that we are dealing with."
2019-09-03-T-002-S-00012,2019-09-03-T-002,12,Chan Chun Sing,"With that as the backdrop, the question is, how do we as a country and as companies adapt and adjust our strategies amidst all these uncertainties?"
2019-09-03-T-002-S-00013,2019-09-03-T-002,13,Chan Chun Sing,"Let me touch on a three-pronged strategy that I think we need to adopt  diversification, innovation and investment, and training. Let me elaborate on diversification."
2019-09-03-T-002-S-00014,2019-09-03-T-002,14,Chan Chun Sing,"To manage the uncertainties ahead of us, which may take quite a while to settle down, we should continuously diversify our markets, our supply chains and our product mix."
2019-09-03-T-002-S-00015,2019-09-03-T-002,15,Chan Chun Sing,"For the diversification of the markets, we must always remember that there are still many parts of the world that are experiencing strong and positive growth. And this is the reason why MTI, with the economic agencies, will continue to diversify our portfolio of free trade agreements, both in terms of the number of free trade agreements and the quality of the free trade agreements, in order for our companies to access the markets around the world, especially those with strong and positive growth."
2019-09-03-T-002-S-00016,2019-09-03-T-002,16,Chan Chun Sing,"The second part of diversification has to do with supply chains. In this world of flux, supply chains might be disrupted because of economic and political reasons. This is why the economic agencies are working closely with all our companies to make sure that our sources of materials, labour and other factors of production will continuously stay robust and resilient amidst these shifting geopolitical tensions."
2019-09-03-T-002-S-00017,2019-09-03-T-002,17,Chan Chun Sing,"Last but not least, we must continue to diversify our product mix as an economy. We must make sure that no one particular sector dominates the economy to the extent that it causes us to be much more fragile than we need be."
2019-09-03-T-002-S-00018,2019-09-03-T-002,18,Chan Chun Sing,"This is how we have approached the situation over the last many years. And if we look at the numbers today, while some sectors like the electronics, precision engineering and wholesale trade and retail are down, there are also sectors like the information & communications sector, biomedical sector and professional services sector that are still up. So, that diversification of our economy and product mix actually helps us to stabilise the overall economic performance."
2019-09-03-T-002-S-00019,2019-09-03-T-002,19,Chan Chun Sing,"The second strategy that we need to adopt amidst all this flux is to make sure that we continue to innovate and invest. First, we must make sure that we continuously do better to translate our research outcomes into enterprises. We must complete the research, innovation and enterprise cycle – not a chain, but a cycle. We must build real capabilities beyond building capacities. We must compete on the basis of real capabilities, rather than just capacities. For countries that are much bigger than us, with much stronger and a more diverse resource base, they might compete on the basis of capacity. But for us, we compete on the basis of capability."
2019-09-03-T-002-S-00020,2019-09-03-T-002,20,Chan Chun Sing,"It is often said that many countries are competing on the low-mix, high-volume products. That is a lot to do with capacity. For us, if we are to be serious in competing with what we call the high-mix, low-volume products, then, research and innovation, intellectual property protection, and quality standards are all very important, and those play to our strengths."
2019-09-03-T-002-S-00021,2019-09-03-T-002,21,Chan Chun Sing,"The second thing that we need to invest much more in is the adoption and proliferation of our digital platforms, especially amongst the SMEs within our economy. These are not very difficult solution sets. They are available in the market and we are committed to working with our Trade Associations and Chambers (TACs) to make sure that we accelerate the pace of adoption. When we achieve critical mass, it will also bring about a virtuous cycle for us to reduce the price of adoption and allow businesses to do business with one another more easily."
2019-09-03-T-002-S-00022,2019-09-03-T-002,22,Chan Chun Sing,"Last but not least, with or without the current challenges amidst the global uncertainties, we must continuously look at our production system and processes. There is always room for us to innovate in such things, beyond the innovation of products. It is about the innovation in production systems and processes that can make us more productive."
2019-09-03-T-002-S-00023,2019-09-03-T-002,23,Chan Chun Sing,"The third prong of the strategy has to do with training. There are three sub-parts to the training strategy which I think we need to focus on. We have often talked about the training of the workers and that is well-known and we will continue to invest heavily in the training of our workers, especially in the acquisition of skills for the Industry 4.0 journey, digital platforms and so forth. This is an area where SSG, WSG, NTUC and the trade associations and chambers must work closely to bring the level of the skills of our workers up to speed with what is required by the markets."
2019-09-03-T-002-S-00024,2019-09-03-T-002,24,Chan Chun Sing,"Having said that, it is necessary but insufficient just to focus only on workers' training. We also need to focus more heavily on the training of the leadership teams in the respective companies. This is an area that I have discussed with the many TACs and we can do much more."
2019-09-03-T-002-S-00025,2019-09-03-T-002,25,Chan Chun Sing,"From my own experience in NTUC, before we even talk about the training of the workers, it is most important for us to open up the vision of the management team. For example, in the recent roll-out of the Scale-up Singapore initiative, we did not focus just on the workers' training. We focused on the training of the management team by getting the entire management team to come in, do their envisioning exercise, do their change management exercises together as a team, before we even talked about workers' training."
2019-09-03-T-002-S-00026,2019-09-03-T-002,26,Chan Chun Sing,"Last but not least, when it comes to training, we will have to do much more to better organise ourselves and our respective agencies, from the TACs to the overseas missions from EDB, and ESG and other economic agencies, so that we can combine the market knowledge that we have to help our enterprises to diversify their markets beyond Singapore."
2019-09-03-T-002-S-00027,2019-09-03-T-002,27,Chan Chun Sing,"So, Mr Speaker, Sir, in short, I think the current situation warrants us to take a close look at how we develop our companies and economies, and we must go beyond looking at just the US-China issues or looking at it as just a trade issue. There are various things that we must do regardless of whether it is US-China or whether it is a trade issue. Continue to diversify our markets, continue to diversify our supply chains and product mix. Continue to invest in innovation, and build real capabilities and not just capacities, and focus on the training, not just of the workers but of the management team. And focus on sharing market knowledge with all our available agencies."
2019-09-03-T-002-S-00028,2019-09-03-T-002,28,Christopher de Souza,"I thank the Minister for his comprehensive reply. I have two supplementary questions. The first is, will we see more regional trade pacts to overcome any side effects of the US-China trade standoff and Brexit, which the Minister alluded to in his response? Secondly, how about regional innovation pacts as a way to adapt to the evolving situation? And innovation being capability-focused, rather than capacity-focused, which was what the Minister alluded to in his reply."
2019-09-03-T-002-S-00029,2019-09-03-T-002,29,Chan Chun Sing,"Mr Speaker, Sir, let me touch on the regional trade pacts. Today, for Singapore, more than 90% of all our trade are already covered by the existing free trade agreements (FTAs). We will continue to expand our network of FTAs, both in terms of numbers and also in terms of the quality. But more important than that, beyond reducing the tariffs associated with the trade negotiations, we must increasingly focus on the lowering of what we call ""non-tariff barriers"". Because sometimes, the gains from lowering tariff barriers could be eroded by the imposition of new non-tariff barriers. This is a challenge, not just only for the region, but also worldwide. These include the standards for healthcare products, the standards for food, the standards of mutual recognition and so on. This is what we mean by non-tariff barriers."
2019-09-03-T-002-S-00030,2019-09-03-T-002,30,Chan Chun Sing,"Corollary to that, on Brexit, we are working with the UK administration to see how we can, post-Brexit, have a short-form agreement that will essentially continue the current arrangements that we have with the UK as part of the EU. So, that is under negotiation at this point in time."
2019-09-03-T-002-S-00031,2019-09-03-T-002,31,Chan Chun Sing,"On the Member's second question, yes, there are two parts to the regional innovation. Today, in ASEAN, we have a very lively start-up community. Today, I am very happy when I meet the young start-up entrepreneurs. They no longer see their role as serving only one particular market. In fact, most of the time, they see themselves as what they call an ""ASEAN company"". Grab is one such example. They started their operations with a vision to serve the entire region."
2019-09-03-T-002-S-00032,2019-09-03-T-002,32,Chan Chun Sing,"There is a very lively start-up scene in ASEAN, particularly in Singapore, Indonesia and Vietnam. Our opportunity is how we can work together to bring these different strengths together, to leverage on each other's strengths, so that we can have a 600 million market, as a hinterland, rather than depending on ourselves individually."
2019-09-03-T-002-S-00033,2019-09-03-T-002,33,Chan Chun Sing,"Having said that, beyond the start-up scene, it is also very important for us to enable the multinational corporations (MNCs) to innovate and develop their products across different markets to serve the region. These MNCs can be from within the region or from beyond the region. Regardless, our challenge is to make sure that we have the enabling environment, the business rules that allow them to innovate across borders and to make use of the talent from different parts of the region to come together to develop those new products and services to serve the market."
2019-09-03-T-002-S-00034,2019-09-03-T-002,34,Leon Perera,"Sir, I have two supplementary questions for the Minister. The Minister spoke about innovation capability among Singapore-based enterprises. Is the Minister satisfied with the current trend or direction of innovation capability among Singapore enterprises? Secondly, has MTI done any study that could point to any structural or any other impediments to developing and furthering innovation capability among Singapore-based enterprises?"
2019-09-03-T-002-S-00035,2019-09-03-T-002,35,Chan Chun Sing,"Mr Speaker, Sir, on the first question, whether we are satisfied with the progress of innovation. No Ministry, no agency, no country will ever say that they are happy with what they have. We always seek to do better. So, the more important question is, how can we do better? The biggest challenge for any research, innovation and enterprise cycle is this  how do we translate research into innovation and enterprise? Essentially, as Senior Minister Teo Chee Hean would say – how do you translate money into research outcome and translate research outcome back into money?"
2019-09-03-T-002-S-00036,2019-09-03-T-002,36,Chan Chun Sing,"What are the challenges? It is always very difficult to find in one person a scientist, an innovator and an entrepreneur. The challenge and the lesson we have learnt from other countries is to make sure that, while these may not all reside within one person, we must have an environment where both the entrepreneurs and the scientists are able to constantly mix with one another to generate those ideas for both businesses and for scientific research. It is this combination that is most important in any scientific community."
2019-09-03-T-002-S-00037,2019-09-03-T-002,37,Chan Chun Sing,"When I was studying in MIT, they have been able to achieve this eco-system very well. Within every class that you go to in business school, there are the scientists, the researchers, there are also the people who have a very keen sense of business to know what is possible. It is this mix that many places around the world are trying to emulate because that is how we can percolate the ideas and bring research outcomes into market opportunities. So, this is one area that everyone wants to do better in."
2019-09-03-T-002-S-00038,2019-09-03-T-002,38,Chan Chun Sing,"The second area that we will always strive to do better is to make sure that the funding eco-system provides that continuum of funding options for new enterprises from the start-up stage, all the way through until they perhaps one day get listed on the market. That chain is also something that across the entire globe, everyone is working very hard to make sure that new enterprises have those options to bring their business ideas to fruition."
2019-09-03-T-003-S-00039,2019-09-03-T-003,39,Saktiandi Supaat,"asked the Minister for Education with regard to giving our ITE and Polytechnic students more regional exposure under the Global Education Programme (a) whether there will be more funding resources to support overseas internship opportunities; (b) whether there is concrete and strategic support for regional interaction and exchanges in the cultural, arts and sports fields; and (c) how effective is the opportunity fund in supporting students from low-income families."
2019-09-03-T-003-S-00040,2019-09-03-T-003,40,Low Yen Ling,"Mr Speaker, Sir, the Global Education Programme at ITE offers students a wide range of opportunities for overseas exposure, including internships, student exchanges, community services and cultural enrichment. Our Polytechnics also have similar programmes. The Polytechnics and ITE fund these programmes with support from MOE and other Government agencies, providing subsidies for airfare, accommodation and other out-of-pocket costs that students incur. It is also common for Polytechnics and ITEs to tap on funds raised from donors."
2019-09-03-T-003-S-00041,2019-09-03-T-003,41,Low Yen Ling,"Singaporean students from lower income households can also tap on the MOE Opportunity Fund for additional assistance and funding. In 2018, about 3,500 Polytechnic and ITE students benefited from the Opportunity Fund for overseas exposure trips. This is an increase of about 33% from two years ago. In addition, MOE and other Government agencies also provide support and funding that encourage our students to venture into the region for longer overseas internships. These include the Enterprise Singapore's Young Talent Programme which will soon be subsumed under the upcoming Global Ready Talent Programme and MOE's Global Innovation Alliance Innovators Academy programme, which targets internships in overseas start-ups."
2019-09-03-T-003-S-00042,2019-09-03-T-003,42,Low Yen Ling,"As for culture, sports and arts, students do participate in overseas arts performances, friendly matches and other sports competitions with their counterparts in the region. The students typically take part in such activities as part of their co-curricular activities."
2019-09-03-T-003-S-00043,2019-09-03-T-003,43,Low Yen Ling,"The level of funding support has been adequate to help our Polytechnic and ITE students take up overseas exposure programmes. Today, about half of our Polytechnic students and more than a quarter of our ITE students have participated in overseas exposure trips. If the Member is aware of any particular case that needs help, please let us know and we will certainly follow up with the students or the students may want to approach the management of the ITE or Polytechnic."
2019-09-03-T-003-S-00044,2019-09-03-T-003,44,Saktiandi Supaat,"I thank the Senior Parliamentary Secretary for the answer. I have two supplementary questions. First is with regards to the Global Education Programme. The sub-component of it, oversees industrial attachment programmes in the region. Can the Senior Parliamentary Secretary share how many students so far have benefited from it as part of the total amount because it is also related to what Minister for Trade and Industry mentioned earlier. The industrial attachment programmes help to train not just the workers but our future workers through the students."
2019-09-03-T-003-S-00045,2019-09-03-T-003,45,Saktiandi Supaat,"Second, the Senior Parliamentary Secretary mentioned that funding resources are adequate at the moment. Are there plans to enhance funding for the Global Education Programme, for the ITEs and also for the Polytechnics, going forward?"
2019-09-03-T-003-S-00046,2019-09-03-T-003,46,Low Yen Ling,"Mr Speaker, Sir, I wish to thank the Member Mr Saktiandi Supaat for the two supplementary questions. Today, 40% of our Polytechnic and ITE students participate in overseas exposure programmes, compared to about 30% from six years ago. To the first question, in 2018, as far as Global Education Programme is concerned, ITE disbursed about $700,000 under the Global Education Programme in additional funding and assistance for needy students. This does not include the manpower and other costs of mounting the programme. About 4,000 students benefited under the Global Education Programme."
2019-09-03-T-003-S-00047,2019-09-03-T-003,47,Low Yen Ling,"The Member is right, there is an Overseas Industrial Attachment Programme, there is also the Overseas Student Exchange Programme and Overseas Service and Development Programme. So, the 4,000 students actually cover the three programmes."
2019-09-03-T-003-S-00048,2019-09-03-T-003,48,Low Yen Ling,"In terms of the funding, other than the Global Education Programme, I am happy to update Mr Supaat that there is also the Opportunity Fund that I briefly talked about. Perhaps, allow me to just elaborate. Between the year 2016 and 2018, each year, MOE disbursed through this Opportunity Fund Grant – it is a scheme to help our students from lower income households – an average of $2 million to ITE for the year 2016 to 2018. $2 million a year. And for the five Polytechnics, $5 million. The funding has been increased in 2019 – we have increased the funding to $3 million for the ITEs, from $2 million to $3 million. For the Polytechnics, from $5 million to $6 million. That is one change."
2019-09-03-T-003-S-00049,2019-09-03-T-003,49,Low Yen Ling,"Another interesting change is, previously when the Institutes of Higher Learning (IHLs) are administering the disbursement of the Opportunity Fund, there is a gross monthly household income criterion of $4,000. We have done away with that. We want ITEs and also the Polytechnics to have the flexibility to decide the subsidy level for the students and to tier the level of support based on the needs and also profile of the students."
2019-09-03-T-004-S-00050,2019-09-03-T-004,50,Jessica Tan Soon Neo,asked the Minister for Manpower (a) what programmes are in place to support companies in making work and the work environment age-friendly to enable companies to leverage on the competencies of their older employees and for older workers to do their best work; (b) what is the progress of companies establishing and adopting more age-friendly work practices; and (c) what is the progress of companies retraining their older workers to enable them to take on new opportunities within the organisation.
2019-09-03-T-004-S-00051,2019-09-03-T-004,51,Low Yen Ling,"Mr Speaker, Sir, the Government encourages companies to redesign workplaces and processes to create easier, safer and smarter jobs for older workers. Since the WorkPro Job Redesign Grant started six years ago in 2013, over 1,800 companies employing about 20,000 older workers have benefited from the grant and redesigned their jobs."
2019-09-03-T-004-S-00052,2019-09-03-T-004,52,Low Yen Ling,"Even without the grants, many progressive companies have implemented age-friendly practices. In 2018, about 12,000 companies, employing about 92% of the 331,000 local employees aged 50 and above, reported that they have done so. These age-friendly measures include job redesign, flexible work arrangements and well-being programmes."
