speech_id,topic_id,speech_order,member_name,text
2019-09-03-T-012-S-00228,2019-09-03-T-012,228,Indranee Rajah,"In addition, MAS officers continue to participate in panel discussions and seminars in New York and London to educate the local asset management community about the features of the VCC framework."
2019-09-03-T-012-S-00229,2019-09-03-T-012,229,Indranee Rajah,"To familiarise the industry with the VCC framework and to allow fund managers to provide feedback on the registration process for VCCs, MAS will be running a pilot programme for interested fund managers and service providers. These fund managers will be able to have their funds registered as VCCs on the day that the VCC framework is launched. The programme will commence later this month. Interested fund managers and service providers may approach MAS to find out more about participation."
2019-09-03-T-012-S-00230,2019-09-03-T-012,230,Indranee Rajah,"While there are currently no plans to introduce any modules relating to VCCs in the local tertiary curriculum, MAS will study whether this is necessary once the VCC framework is launched."
2019-09-03-T-012-S-00231,2019-09-03-T-012,231,Indranee Rajah,"Mr Tay also asked about the number of jobs created and the impact of the VCC framework to the Singapore economy. It is estimated that the VCC framework could create over 1,000 new jobs for service providers in the first two years of its introduction. We will monitor its impact to the Singapore economy once the framework is launched."
2019-09-03-T-012-S-00232,2019-09-03-T-012,232,Indranee Rajah,"I would add, however, that the introduction of the VCC is one important, but not the only, piece in our plan for Singapore to be the leading pan-Asian hub for fund domiciliation and management. The Government continues to work in tandem with the industry to refine our existing schemes and introduce new initiatives to foster the development of the asset management industry."
2019-09-03-T-012-S-00233,2019-09-03-T-012,233,Indranee Rajah,"Mr Speaker, let me conclude. I would like to reassure Mr Tay and all interested parties that the Government is putting in its best efforts to ensure that there is maximum take-up of the VCC structure once it is launched. The Government will continue to work with the industry to ensure that all players in the industry are fully apprised of this new structuring option and are equipped to take advantage of its features as well as the new business opportunities that it can provide. Mr Speaker, I beg to move."
2019-09-03-T-012-S-00234,2019-09-03-T-012,234,Indranee Rajah,"[(proc text) Question put, and agreed to. (proc text)]"
2019-09-03-T-012-S-00235,2019-09-03-T-012,235,Indranee Rajah,[(proc text) Bill accordingly read a Second time and committed to a Committee of the whole House. (proc text)]
2019-09-03-T-012-S-00236,2019-09-03-T-012,236,Indranee Rajah,[(proc text) The House immediately resolved itself into a Committee on the Bill. – [Ms Indranee Rajah]. (proc text)]
2019-09-03-T-012-S-00237,2019-09-03-T-012,237,Indranee Rajah,[(proc text) Bill considered in Committee; reported without amendment; read a Third time and passed. (proc text)]
2019-09-03-T-013-S-00238,2019-09-03-T-013,238,,[(proc text) Order for Second Reading read. (proc text)]
2019-09-03-T-013-S-00239,2019-09-03-T-013,239,Zaqy Mohamad,"With your permission, Mr Speaker, I have asked the Clerk to circulate a handout to illustrate the key changes to the Work Injury Compensation Act to all Members."
2019-09-03-T-013-S-00240,2019-09-03-T-013,240,Zaqy Mohamad,"Mr Speaker, Sir, on behalf of the Minister for Manpower, I beg to move, ""That the Bill be now read a Second time."""
2019-09-03-T-013-S-00241,2019-09-03-T-013,241,Zaqy Mohamad,"Sir, when an employee gets injured at work, he may claim damages under the common law, or claim compensation under the Work Injury Compensation Act, or WICA in short, but not both. Under the common law, the injured employee has to initiate legal actions and prove his employer's negligence to succeed. The WICA provides a cheaper and quicker alternative for an injured employee to claim work injury compensation."
2019-09-03-T-013-S-00242,2019-09-03-T-013,242,Zaqy Mohamad,"Under the WICA, the employee does not need to prove the employer's fault or negligence in order to be compensated. He will be compensated as long as the injury happened in the course of work. This is why we say WICA is a no fault regime. In exchange, the employer's amount of compensation is capped under the WICA."
2019-09-03-T-013-S-00243,2019-09-03-T-013,243,Zaqy Mohamad,"WICA has benefited many injured employees. Over the past three years, an average of about 15,000 work injury compensation claims were awarded, with a total payout close to $115 million per year for wage and lump sum compensation. All claimants, except five on average per year, were compensated by the deadline set by the Ministry. The common reason for non-payment was because the employer was uninsured and faced financial difficulties. In such situations, MOM will assist the injured employees using the Workers' Fund."
2019-09-03-T-013-S-00244,2019-09-03-T-013,244,Zaqy Mohamad,"WICA has served its role of compensating injured workers well, but can be improved further, in four main ways."
2019-09-03-T-013-S-00245,2019-09-03-T-013,245,Zaqy Mohamad,"First, the aims of MOM's work injury compensation regime should not be confined to compensation after injury has happened. It should also incentivise employers to prevent injuries from happening in the first place. Our Workplace Safety and Health 2028, or WSH2028, aspiration for Singapore is to be amongst the best in the world in workplace safety and health standards."
2019-09-03-T-013-S-00246,2019-09-03-T-013,246,Zaqy Mohamad,"Second, some WIC claims still take too long before payout is made. We will speed up and improve claims processing."
2019-09-03-T-013-S-00247,2019-09-03-T-013,247,Zaqy Mohamad,"Third, we will enhance insurance coverage and benefits for injured workers employees."
2019-09-03-T-013-S-00248,2019-09-03-T-013,248,Zaqy Mohamad,"Fourth, we will give greater assurance to employers so that the WICA provides a balanced package of safeguards for both employers and injured employees."
2019-09-03-T-013-S-00249,2019-09-03-T-013,249,Zaqy Mohamad,"These are substantial changes, so, the existing WICA will be repealed and replaced by a new Act, the Work Injury Compensation Act 2019."
2019-09-03-T-013-S-00250,2019-09-03-T-013,250,Zaqy Mohamad,"Let me explain how the new WICA will influence companies to prevent injuries. In the recommendations of the WSH2028 Tripartite Strategies Committee in April this year, they were convinced that the key in preventing injuries is aligning commercial interests of employers and insurers closer to preventing injuries. In short, we need to make good WSH good for business. More companies will then be self-motivated to prevent injuries. One of the features in the new WICA is designed to influence employers to be more proactive on prevention by making the business impact of injuries more significant, through its effect on premiums."
2019-09-03-T-013-S-00251,2019-09-03-T-013,251,Zaqy Mohamad,"Information transparency on claims history is essential in influencing employers to be safer. Today, there is no information sharing between insurers of their clients' past claims records. This has resulted in safer companies subsidising the less safe companies as there is little premium differentiation between these companies. The WSH2028 Tripartite Strategies Committee recommended that MOM facilitates the sharing of WIC claims data with insurers to sharpen the premium differentiation between safer and less safe companies."
2019-09-03-T-013-S-00252,2019-09-03-T-013,252,Zaqy Mohamad,"Clause 33 of the Bill will require insurers to share policy and claims information with the Commissioner. The relevant data will be made available to all designated insurers approved by the Commissioner. Furthermore, to facilitate more accurate premium pricing, all designated insurers will be able to verify their clients' declared aggregated workforce size and annual payroll through MOM's database. Clients' actual workforce size and payroll data will remain confidential and will not be disclosed to insurers. What the insurers will know is whether their clients' declarations are consistent or not consistent with MOM's records, within a certain margin of error."
2019-09-03-T-013-S-00253,2019-09-03-T-013,253,Zaqy Mohamad,"With greater information transparency, employers with good safety records should be able to enjoy lower premiums. More importantly, less safe employers who are faced with higher premiums will have greater commercial incentive to put in place measures to prevent their employees from getting injured in the first place."
2019-09-03-T-013-S-00254,2019-09-03-T-013,254,Zaqy Mohamad,"Next, we have proposed five amendments which aim to speed up and improve WIC claims processing."
2019-09-03-T-013-S-00255,2019-09-03-T-013,255,Zaqy Mohamad,"First, we will designate insurers to provide WIC insurance under clause 31. These designated insurers will be required to process insured WIC claims in accordance with clauses 36, 44 to 47."
2019-09-03-T-013-S-00256,2019-09-03-T-013,256,Zaqy Mohamad,"Today, insurers only process WIC claims for temporary incapacity, or TI. For fatal and permanent incapacity, or PI, these claims are processed by the Commissioner. In contrast, insurers are already processing the claims for all other types of insurance, such as life, medical and travel insurance, in Singapore. Other jurisdictions that also adopt the private WIC insurance model, such as certain states in the US and Australia, have also required WIC insurers to process all insured claims. Allowing insurers to process WIC claims can help to speed up claims processing as insurers, who are the payers, do not need to do duplicative work to verify the documents and evidence obtained by MOM on the claim. Under the current system, having the insurers check back with the employers, the workers and with MOM on the claim details can delay processing by up to six weeks."
2019-09-03-T-013-S-00257,2019-09-03-T-013,257,Zaqy Mohamad,"To ensure that the interests of all parties will continue to be protected under this new process, the Ministry will put in place a system of checks and balances. Clauses 31 to 34 allow the Commissioner to impose licensing conditions on designated WIC insurers. The Commissioner may conduct third party audits on insurers to make sure that they comply with the Commissioner’s conditions. Any insurer that fails to comply with the Commissioner's conditions may be subject to administrative financial penalties, or in more serious cases, have their WIC designation suspended or revoked."
2019-09-03-T-013-S-00258,2019-09-03-T-013,258,Zaqy Mohamad,"Under an insurer-processing regime, employees' and employers' interests will continue to be protected in four key ways"
2019-09-03-T-013-S-00259,2019-09-03-T-013,259,Zaqy Mohamad,"First, insurers have to comply with the Commissioner's protocol on claims admissibility. The grounds for liability for compensation under the new Bill remain the same as that in the existing Act. We will set out guidelines to ensure that insurers do not reject claims which are currently admissible."
2019-09-03-T-013-S-00260,2019-09-03-T-013,260,Zaqy Mohamad,"Second, insurers do not have discretion in determining the compensation amount as it is a fixed formula based on three factors  one, the doctor's assessment of the extent of incapacity; two, the worker’s remaining years of working life; and three, the worker's average monthly earnings, or AME."
2019-09-03-T-013-S-00261,2019-09-03-T-013,261,Zaqy Mohamad,"And third, in terms of processing, insurers have to meet the processing timelines set by the Commissioner to ensure that the injured employees continue to receive their compensation promptly."
2019-09-03-T-013-S-00262,2019-09-03-T-013,262,Zaqy Mohamad,"Finally, any parties that are aggrieved by the insurer's decision may raise an objection. Objections will continue to be adjudicated by the Commissioner."
2019-09-03-T-013-S-00263,2019-09-03-T-013,263,Zaqy Mohamad,"Another recommendation to speed up claims processing is to allow compensation to be based on the prevailing state of incapacity that is unlikely to change significantly after the date of assessment of the incapacity, termed ""current incapacity"" or CI. Today, about 80% of PI claims every year are resolved within six months. The remaining 20% take longer to resolve due to the time required for a PI assessment to be made. The PI percentage is one of the factors determining the amount of lump sum compensation. However, delay in settling the compensation means injured employees will receive their compensation later, employers of injured foreign employees will incur higher upkeep and maintenance expenses, as well as increased uncertainty for all parties involved."
2019-09-03-T-013-S-00264,2019-09-03-T-013,264,Zaqy Mohamad,We have consulted the WIC medical board members who advised that the extent of incapacity at six months after accident is a close approximation of the eventual state of the PI in most cases.
2019-09-03-T-013-S-00265,2019-09-03-T-013,265,Zaqy Mohamad,"Clause 15 of the Bill and the First Schedule to the Bill allow lump sum compensation to be computed based on the CI assessment that is made at least six months after the date of accident. This will help to expedite claims payout to the employee or their families for many long-drawn claims. The default expectation is for CI to be assessed as soon as possible after six months from the accident. Nonetheless, doctors will still have the professional discretion to assess for PI at a later date if they believe that the extent of incapacity will change further for more complex injuries."
2019-09-03-T-013-S-00266,2019-09-03-T-013,266,Zaqy Mohamad,Another cause of delay is disputes over AME. The Ministry receives about 360 AME disputes a year. Such disputes may delay claims processing up to one and a half months.
2019-09-03-T-013-S-00267,2019-09-03-T-013,267,Zaqy Mohamad,"Currently, the Commissioner uses documentary evidence such as pay slips to compute the employee's AME for purposes of WICA compensation. If the employee's pay slip is not available, the Commissioner can compute compensation based on a co-worker's pay slip. However, there are cases where there is no documentary evidence of the employee's or the co-workers' pay slip. Therefore, the First Schedule to the Bill will also empower the Commissioner to compute the employee's earnings based on a multiple of the employee's basic rate of pay, called the derived AME, if there is no other reliable evidence. The derived AME will be set at the higher end of industry norm. This is to ensure that employees are not disadvantaged due to the absence of reliable evidence to compute the actual AME."
2019-09-03-T-013-S-00268,2019-09-03-T-013,268,Zaqy Mohamad,"We also propose to streamline the claim process to provide for more hassle-free ""auto-claim"" for fatal and serious injuries. Currently, an employee or his representative needs to submit a WICA claim application for fatal or PI compensation."
2019-09-03-T-013-S-00269,2019-09-03-T-013,269,Zaqy Mohamad,"To speed up claims processing and reduce the risk of employees being misled or being ignorant of application procedures, clause 35 of the Bill provides that a claim is deemed to be made when the employer first receives notice of the accident. Insurers or the Commissioner will start to process the claims once there is a notice of accident, without the employee needing to submit a separate claims application. Under this regime, employees who do not wish to make a claim under WICA can still opt out at a later stage."
2019-09-03-T-013-S-00270,2019-09-03-T-013,270,Zaqy Mohamad,"Delays can be also caused by parties not cooperating with the Commissioner or the designated insurers in the claims process. To avoid such delays, we will make it an offence under clause 50 for parties who fail to comply with the Commissioner's direction to provide information or documents to the designated insurer or the Commissioner necessary for claims processing."
2019-09-03-T-013-S-00271,2019-09-03-T-013,271,Zaqy Mohamad,"If accidents do happen, we are also enhancing the protection and benefits for injured employees."
2019-09-03-T-013-S-00272,2019-09-03-T-013,272,Zaqy Mohamad,"Under current WICA, employers are required to compensate all their injured employees, regardless of their salaries, where they work, and the nature of work manual or non-manual. To help employers fulfil this obligation, employers are required to purchase insurance for all manual employees and non-manual employees (or NMEs) working in factories earning up to $1,600 a month."
2019-09-03-T-013-S-00273,2019-09-03-T-013,273,Zaqy Mohamad,The Minister will amend the WICA subsidiary legislation to align with the salary threshold for non-workmen under Part IV of the Employment Act to give added protection to these employees. This will be done in phases to allow employers time to adjust.
2019-09-03-T-013-S-00274,2019-09-03-T-013,274,Zaqy Mohamad,"In Phase 1, we will extend compulsory insurance to non-manual employees earning up to $2,100 a month regardless of where they work and we plan to do this in 2020."
2019-09-03-T-013-S-00275,2019-09-03-T-013,275,Zaqy Mohamad,"In Phase 2, we will further increase the monthly salary threshold to $2,600 a month. And we plan to do this in 2021."
2019-09-03-T-013-S-00276,2019-09-03-T-013,276,Zaqy Mohamad,"This expansion will require around 300,000 more employees to be covered by the compulsory insurance requirement. Nonetheless, we do not expect significant cost impact to businesses as MOM's Conditions of Employment survey indicates that close to 90% of employees are already covered by WIC insurance. Even though employers were not obligated to cover some of them but employees are covered 90% today. By doing so, these companies ensure that they could meet their WICA obligations in case of accident."
2019-09-03-T-013-S-00277,2019-09-03-T-013,277,Zaqy Mohamad,"The First Schedule to the Bill extends compensation to employees on light duties due to work injuries. This will put them on par with employees on medical leave due to work injuries. An employee injured at work could be given medical leave or light duties, depending on his fitness to work and availability of light duties. Employers would benefit from an employee who is fit enough to carry out light duties, as there would be shorter downtime from work and some restoration of productive capacity."
2019-09-03-T-013-S-00278,2019-09-03-T-013,278,Zaqy Mohamad,"However, an employee on light duties may be earning less than his usual salary. This is because he is likely to work at a lower intensity and duration, and will miss out on overtime pay or allowances that he would normally have received if he was not injured. The First Schedule requires employers to compensate the difference between what the employee earns on light duties, and his AME, which is what he normally earns, including overtime, bonuses and allowances. Compensation is payable only if the employee's actual wages, while he was on light duties, is less than what he would have received as his AME compensation under the WICA. This is to ensure that an employee who is on light duties due to a work injury, is not worse off than an injured employee on medical leave, because the one on medical leave would have been given compensation of AME."
2019-09-03-T-013-S-00279,2019-09-03-T-013,279,Zaqy Mohamad,"In addition, the WICA subsidiary legislation will require employers to report any instance of employees on medical leave or light duties due to a work injury. This is to address the concern that some irresponsible employers may try to avoid reporting work accidents by attempting to influence doctors to give fewer days of medical leave or light duties. We will simplify the reporting requirements for accidents with less than four days of medical leave or light duties to minimise the administrative burden on companies."
2019-09-03-T-013-S-00280,2019-09-03-T-013,280,Zaqy Mohamad,"Today, an injured employee's PI assessment is typically done by a doctor directed by the employer. However, MOM has received feedback, one from Member Louis Ng as well, that some errant employers may attempt to influence doctors to give inadequate medical leave or some doctors may be overly conservative and under-estimate the percentage of PI."
2019-09-03-T-013-S-00281,2019-09-03-T-013,281,Zaqy Mohamad,"To ensure there is proper and fair assessment of the extent of work injury sustained by the employee, clause 37 of the Bill which requires an employee to attend medical examination required by the employer has an exception which enables the Commissioner to allow employees to undergo medical examination by another doctor doing the PI assessment. This would be exercised, for example, if there are concerns and prima facie evidence that the quality of care and incapacity assessment by the employer's doctor may not be adequate or fair."
2019-09-03-T-013-S-00282,2019-09-03-T-013,282,Zaqy Mohamad,MOM will also update the WICA compensation limits in the First Schedule to the Bill to keep pace with wage growth and healthcare costs. This is a regular update which we do once every four years. It prevents the real value of compensation from being eroded by inflation.
2019-09-03-T-013-S-00283,2019-09-03-T-013,283,Zaqy Mohamad,"The compensation limits for death and PI will increase by about 10% to $225,000 and $289,000 respectively. This is to account for the growth in median gross monthly income since the last review. The compensation limit for medical expenses will be raised from the current $36,000 to $45,000, an increase of about 25%. This will ensure that the limit for medical expenses continues to cover more than 95% of all WICA claims medical expenses."
2019-09-03-T-013-S-00284,2019-09-03-T-013,284,Zaqy Mohamad,"While we work to make the WIC framework better for employees, it is equally important to ensure that the interests of the employers are also protected."
2019-09-03-T-013-S-00285,2019-09-03-T-013,285,Zaqy Mohamad,"Employers who buy insurance policies that do not adequately cover their WICA liabilities may not be able to obtain reimbursement for compensation paid. We have come across cases where construction companies bought WICA policies that do not cover accidents arising from working above a certain height, and certain activities such as digging and piling. But these are precisely the type of work where accidents are more likely to happen. To better safeguard employers' interests when buying WIC insurance policies, clause 26 of the Bill allows the Commissioner to prescribe a core set of standard terms for WICA-compliant policies to ensure that insurance policies cover employers' WICA liabilities adequately."
2019-09-03-T-013-S-00286,2019-09-03-T-013,286,Zaqy Mohamad,"We will also make insurers accountable for the policies they offer to employers. Clause 26 of the Bill requires any insurer who has sold to the employer a policy purporting to be a WICA-compliant policy, to compensate the injured employee according to the standard terms of a WICA-compliant policy. This is on top of it being an offence under clause 30 for insurers to sell policies purporting to be WICA-compliant, when they are not."
2019-09-03-T-013-S-00287,2019-09-03-T-013,287,Zaqy Mohamad,"Additionally, clause 30 makes it an offence for any insurers not approved by the Commissioner as a designated insurer to sell a WICA-compliant policy."
2019-09-03-T-013-S-00288,2019-09-03-T-013,288,Zaqy Mohamad,"Under the current WICA, the Commissioner can order the employee to refund the employer any medical leave wages paid if the employee withdraws his claim, if the accident was subsequently determined not to be work-related, or if it was a false claim. We will extend the refund to lump sum compensation and medical expenses. Clauses 16 and 54 of the Bill enable the Commissioner to order the claimant to refund the employer or insurer, if the employer or insurer had paid for the lump sum compensation or medical expenses due to error or false or misleading information. This is on top of it being an offence under clause 62 for any person to obtain compensation by providing false or misleading information."
2019-09-03-T-013-S-00289,2019-09-03-T-013,289,Zaqy Mohamad,"Sir, other than the four key areas highlighted above, we will be making other amendments to the Act."
2019-09-03-T-013-S-00290,2019-09-03-T-013,290,Zaqy Mohamad,"Under the current Act, parties have up to 14 days from the receipt of the notice of assessment to raise objections to the Commissioner. If no objection is raised within the 14-day timeline, the notice of assessment takes the effect of an order of compensation, and such orders cannot be appealed to the High Court."
2019-09-03-T-013-S-00291,2019-09-03-T-013,291,Zaqy Mohamad,"We will amend the Act to allow late objections with valid reasons. MOM had come across a case where the employee had given the completed objection form to the employer to submit to the Commissioner. However, the employer failed to submit the employee's objection form within the prescribed 14-day timeline due to administrative lapses. While the employer had appealed for the Commissioner to accept the late objection, current WICA does not allow for late objections irrespective of the reasons. Therefore, we have provided in clauses 46 and 49 of the Bill to allow the Commissioner to accept late objections if the late objection is due to error or fraud by another person."
