speech_id,topic_id,speech_order,member_name,text
2019-08-05-T-027-S-00871,2019-08-05-T-027,871,Baey Yam Keng,"NAC is currently in discussion with some venue owners and managers to explore different models, including Mr Ng’s suggestion for buskers to be allocated busking areas instead of sites. This will shape the busking experience on their premises with them. For example, NAC is in discussion with Singapore River One, the venue manager for Singapore River, to explore ways to enhance the busking experience along Boat Quay, Clarke Quay and Robertson Quay in a holistic manner. NAC is also working with *SCAPE, already a designated busking location in Orchard Road, to assess how current spaces can cater to a greater diversity of performances. NAC and *SCAPE intend to test new ideas to better support the aspirations of our buskers today, especially youth, such as through performance spaces that showcase budding youth talents. This, along with other ideas, are currently being considered as we work together with youths to co-create a master plan to develop the Somerset Belt into a vibrant youth district that supports their aspirations and interests."
2019-08-05-T-027-S-00872,2019-08-05-T-027,872,Baey Yam Keng,I encourage other venue owners and managers to contact NAC if they are similarly keen to re-imagine how busking can add to the vibrancy of their spaces.
2019-08-05-T-027-S-00873,2019-08-05-T-027,873,Baey Yam Keng,"It is heartening that individuals who are passionate about busking have already decided to come together, to take greater ownership of the busking scene in Singapore. Therefore, I welcome the initiative of Jonathon, Fadhil, Yong Kang, Benjamin, Firdaus and Marcus to register a Busking Association. NAC is already engaging the new Busking Association to co-create and co-develop a code of practice for our busking community. This seeks to encourage good busking etiquette among our buskers, as well as sensitivity to the different groups who use the public spaces where busking takes place. Mr Deputy Speaker, in Mandarin, please."
2019-08-05-T-027-S-00874,2019-08-05-T-027,874,Baey Yam Keng,"(In Mandarin)  [Please refer to  Vernacular Speech.] Mr Deputy Speaker, Mr Ng spoke about the passing of Singapore artist and busker Yu Xuan in March this year. Those familiar with Xinyao would remember Yu Xuan, Joi Chua and Cai Li Lian’s rendition of the popular local composition “Friendship Forever” (细水长流). Buskers like Yu Xuan add vibrancy to our public spaces when they showcase their talents. Moving forward, the National Arts Council will continue to work with various partners – buskers, venue owners and managers – to enhance the busking scheme. I strongly encourage the public to take note of and support our busking scene, so that it will continue to flourish for years to come, just like the song ""Friendship Forever""."
2019-08-05-T-027-S-00875,2019-08-05-T-027,875,Baey Yam Keng,"(In English)  In conclusion, I thank Mr Ng for his suggestions, initiatives and commitment to bring busking to the next level. We look forward to our continued partnership with him, the busking community and venue partners, as well as the support of the public, to achieve our shared vision for a vibrant and sustainable arts and culture scene in Singapore. Thank you, Mr Deputy Speaker."
2019-08-05-T-027-S-00876,2019-08-05-T-027,876,Baey Yam Keng,"[(proc text) Question put, and agreed to. (proc text)]"
2019-08-05-T-027-S-00877,2019-08-05-T-027,877,Baey Yam Keng,"[(proc text) Resolved, ""That Parliament do now adjourn."" (proc text)]"
2019-08-05-T-027-S-00878,2019-08-05-T-027,878,Baey Yam Keng,Adjourned accordingly at 7.29 pm.
2019-08-05-T-028-S-00879,2019-08-05-T-028,879,Lim Wee Kiak,asked the Minister for Trade and Industry (a) how many domestic households have currently installed solar panels for electricity production; (b) how much electricity is contributed to the national power grid by these domestic households; and (c) how much carbon emission has been reduced as a result.
2019-08-05-T-028-S-00880,2019-08-05-T-028,880,Lim Wee Kiak,asked the Minister for Trade and Industry (a) whether the Minister can provide an update on the blockchain-enabled digital platform that allows households with registered solar photovoltaic panels to sell renewable energy to businesses; and (b) whether there are plans to extend this to the open energy market.
2019-08-05-T-028-S-00881,2019-08-05-T-028,881,Chan Chun Sing,"There are about 950 private residential solar photovoltaic (PV) installations, and more than 1,400 installations on HDB rooftops islandwide, that are connected to the power grid. Together, they make up more than 80% of the total number of solar installations in Singapore."
2019-08-05-T-028-S-00882,2019-08-05-T-028,882,Chan Chun Sing,"These installations contribute about 0.16% of Singapore's electricity generation and reduce our carbon emissions by about 35 kilotonnes per year. This is equivalent to the emissions produced by the annual electricity consumption of almost 20,000 HDB 4-room households."
2019-08-05-T-028-S-00883,2019-08-05-T-028,883,Chan Chun Sing,"SP Group launched a blockchain-based platform called the Renewable Energy Certificate (REC) Marketplace in 2018. This REC Marketplace aims to enable the transaction of Renewable Energy Certificates, or ""green credits"", which are sold separately from the actual clean electricity generated. So far, various companies such as DBS and City Developments Limited have signed up to participate in the platform. We understand that the REC Marketplace is currently open to businesses only, but SP intends to extend the platform to residential consumers with solar PV panels at a later stage."
2019-08-05-T-028-S-00884,2019-08-05-T-028,884,Chan Chun Sing,"The Government has also implemented various initiatives to encourage the deployment of solar installations by households. We have simplified the process to enable households to sell their surplus electricity to the grid through SP Group as an intermediary. Households may also enter into commercial arrangements to sell their excess solar electricity to retailers, who can then on-sell the solar electricity to other consumers in the Open Electricity Market. In addition, HDB has awarded three tenders totalling 166 Megawatt Peak (MWp) of solar generation capacity, and will be awarding a fourth tender of 70 MWp shortly. These panels will be installed on over 4,500 HDB blocks, as well as on the roofs of other government buildings. By 2020, HDB aims to have 5,500 HDB blocks fitted with, or identified for solar installation."
2019-08-05-T-028-S-00885,2019-08-05-T-028,885,Chan Chun Sing,"Solar power is our most viable clean energy option, given our land constraints, urban density, and geographic and climatic conditions, which pose challenges in tapping on other alternative energy sources such as hydro, wind and geothermal energy. Hence, the Government will actively continue to work with all stakeholders, including households, to maximise solar energy adoption in Singapore."
2019-08-05-T-029-S-00886,2019-08-05-T-029,886,Lim Wee Kiak,asked the Prime Minister (a) if he will review the eligible voting age for Singaporeans under the Parliamentary Elections Act; (b) what is the consideration for retaining the current voting age; and (c) how many more voters will be eligible if the current voting age is changed to 18 years old.
2019-08-05-T-029-S-00887,2019-08-05-T-029,887,Chan Chun Sing,"We have adopted a graduated approach in setting the various legal ages at which a person can undertake different responsibilities in Singapore. A person’s rights and responsibilities gradually increase as one matures, until the common law age of majority of 21, when a person comes of age to make decisions as an adult and engages in activities that involve significant personal responsibility."
2019-08-05-T-029-S-00888,2019-08-05-T-029,888,Chan Chun Sing,"As has been explained in this House before, voting in elections involves making serious choices, which requires experience and maturity. Voters elect the President who exercises the custodial and veto powers under the Constitution. Voters also choose their Member of Parliament, and in so doing, decide on the group of individuals who will eventually form the Government."
2019-08-05-T-029-S-00889,2019-08-05-T-029,889,Chan Chun Sing,"If we were to lower the voting age to 18 years old today, some 130,000 youths would become eligible to vote. The Government currently does not plan to lower the voting age. Nevertheless, we recognise that many youths want a voice in national matters and wish to make a difference. We will continue to keep such channels and platforms open for youths to express their views, and contribute to nation building. For instance, MCCY has launched the SG Youth Action Plan to give youths a platform to articulate their vision for the country, and propose policy ideas and partnership projects to achieve this vision."
2019-08-05-T-030-S-00890,2019-08-05-T-030,890,Walter Theseira,"asked the Minister for Communications and Information for each of the last three years (a) how many total hours of programming aimed at young children are broadcast on free-to-air television channels in the typical week, broken down by the four official languages; (b) within this, what is the breakdown between educational and commercial entertainment programming; (c) what are some examples of educational programming; and (d) how is the provision and financing of such content aimed at children regulated or monitored."
2019-08-05-T-030-S-00891,2019-08-05-T-030,891,S Iswaran,"Over the last three years, free-to-air channels broadcasted about 90 hours of children's programmes per week. Of these, six hours were in Chinese, 78 hours in English, three hours in Malay and four hours in Tamil. Over the same time period, an average of more than 70% of children’s programmes per week were educational in nature."
2019-08-05-T-030-S-00892,2019-08-05-T-030,892,S Iswaran,Some examples of locally-produced educational programmes include
2019-08-05-T-030-S-00893,2019-08-05-T-030,893,S Iswaran,"Junction Tree  Singapore's first bilingual series for preschoolers, which uses vocabulary-based learning strategies and original songs to make mother tongue learning fun for young children. The programme was produced in consultation with educators and language experts;"
2019-08-05-T-030-S-00894,2019-08-05-T-030,894,S Iswaran,Shahrukh & Warsan  An International Emmy-nominated history-themed Malay drama series about two children travelling back to the days of Singapore's founding fathers; and
2019-08-05-T-030-S-00895,2019-08-05-T-030,895,S Iswaran,"Train Your Brain  A Mandarin, info-educational series that adopts an interactive approach and experiments to explore the way the brain works."
2019-08-05-T-030-S-00896,2019-08-05-T-030,896,S Iswaran,"Mediacorp has made children's free-to-air content accessible on Toggle. To better engage young viewers on this digital platform, Mediacorp has consolidated children's programmes across the four languages onto the Toggle Kids' page. Toggle offers a safe digital environment that parents can trust. Mediacorp has also improved the site such that children can navigate Toggle easily."
2019-08-05-T-030-S-00897,2019-08-05-T-030,897,S Iswaran,"Content on free-to-air TV channels are self-regulated by the broadcaster based on Codes issued by the Info-communications Media Development Authority (IMDA). The Content Code for Nationwide Managed Transmission Linear Television Services Code requires children's programmes on free-to-air channels to be wholesome and promote good social and moral values, and respect for law and order. For example, coarse language must not be used in children's programmes, and scenes depicting the consumption of liquor or tobacco products are also disallowed unless an educational point is being made."
2019-08-05-T-030-S-00898,2019-08-05-T-030,898,S Iswaran,"For children's programmes, sponsors are not permitted to incorporate their names into programme titles or segments, nor superimpose logos or signs into programmes."
2019-08-05-T-031-S-00899,2019-08-05-T-031,899,Murali Pillai,"asked the Prime Minister in relation to persons who are receiving pensions from corporatised bodies of Government departments or statutory boards, whether the Government intends to procure these corporatised bodies' agreement to correspondingly increase the persons' pensions so that there will be parity between them and Government pensioners who will be receiving the Singapore Allowance and increases in the monthly pensions as announced in Budget 2019."
2019-08-05-T-031-S-00900,2019-08-05-T-031,900,Chan Chun Sing,The pensions of Government pensioners who retired from the Civil Service are fixed based on their length of service and pensionable salary at the eve of their retirement. Government pensioners include pensionable officers who were transferred from the Civil Service to statutory boards and subsequently retired from the statutory boards.
2019-08-05-T-031-S-00901,2019-08-05-T-031,901,Chan Chun Sing,"The Government has given an ex-gratia Singapore Allowance since 1974 to help Government pensioners whose monthly pensions are below a gross monthly pension ceiling. The current Singapore Allowance quantum is $320 and the gross monthly pension ceiling is $1,250."
2019-08-05-T-031-S-00902,2019-08-05-T-031,902,Chan Chun Sing,"Corporatised entities are private firms. Retirees who continue to receive retirement benefits from private firms will follow the terms set out by these firms, which do not need to be the same as those provided to Government pensioners."
2019-08-05-T-031-S-00903,2019-08-05-T-031,903,Chan Chun Sing,"Retirees who receive retirement benefits from private firms may also be eligible for benefits, such as the Pioneer and Merdeka Generation Packages, that are given to all eligible Singaporeans. These benefits can help the elderly retirees cope with their expenses and would be paid out on top of any benefit their firms provide."
2019-08-05-T-032-S-00904,2019-08-05-T-032,904,Sylvia Lim,asked the Minister for Foreign Affairs whether he can explain the objectives and significance of the framework for co-operation across the Indo-Pacific region that was endorsed on 23 June 2019 at the ASEAN Summit in Bangkok.
2019-08-05-T-032-S-00905,2019-08-05-T-032,905,Vivian Balakrishnan,"Southeast Asia is no stranger to big power dynamics and proxy wars. We experienced them during the Cold War. However, today the strategic environment is more complex. The international system is much more interdependent. ASEAN Member States have deep connections to all the major powers. We will need clear-eyed realism and acute situational awareness to navigate in the rapidly changing geopolitical landscape."
2019-08-05-T-032-S-00906,2019-08-05-T-032,906,Vivian Balakrishnan,"As a group, ASEAN must maintain its strategic autonomy, and not allow Southeast Asia again to become an arena of great power rivalry. If ASEAN takes sides, or is forced to take sides, we will lose our independence of action, and end up making invidious choices which will be inimical to our interests in the long-run."
2019-08-05-T-032-S-00907,2019-08-05-T-032,907,Vivian Balakrishnan,"It is thus important for ASEAN to maintain our relevance and to uphold ASEAN Centrality in the regional architecture. Not just geographically, but also effectively in the role that ASEAN plays maintaining a stable region and engaging the major powers, so that they can participate in and contribute to the region’s security and prosperity. The current inclusive regional architecture seeks to achieve this. We have continuously refreshed and enhanced the alphabet soup of overlapping ASEAN-centric forums, such as the ASEAN Plus Three, East Asia Summit, ASEAN Defence Ministers’ Meeting-Plus, and ASEAN Regional Forum."
2019-08-05-T-032-S-00908,2019-08-05-T-032,908,Vivian Balakrishnan,We should continue to look for ways to strengthen the current ASEAN-led regional architecture. ASEAN’s external partners have put forth various formulations to articulate their respective visions of what they now call the Indo-Pacific region. ASEAN should not merely adopt one or other of these proposals in order to win favour with its author.
2019-08-05-T-032-S-00909,2019-08-05-T-032,909,Vivian Balakrishnan,The ASEAN Outlook on the Indo-Pacific was born out of the desire to formulate a coherent and cohesive response to these formulations. The ASEAN Foreign Ministers had a candid discussion on the draft of the Outlook at our Working Dinner on 21 June 2019 in the lead up to the ASEAN Summit.
2019-08-05-T-032-S-00910,2019-08-05-T-032,910,Vivian Balakrishnan,"The Outlook was adopted by the Leaders at the recent Summit. It will be a ""living document"", continually refined and updated to advance the existing, inclusive ASEAN-centric regional architecture as the strategic context evolves. It is underpinned by three principles  ASEAN Centrality and unity, economic development in the region, including through increasing connectivity, and upholding a rules-based order anchored on international law. All three principles are vital for Singapore’s own survival and prosperity as a small city-state."
2019-08-05-T-032-S-00911,2019-08-05-T-032,911,Vivian Balakrishnan,"The Outlook will not stop strategic forces from pulling individual ASEAN Member States in different directions. ASEAN unity – the pre-requisite for ASEAN Centrality – will be tested. Our inherent diversity will make internal coherence difficult, but ultimately more necessary too."
2019-08-05-T-033-S-00912,2019-08-05-T-033,912,Joan Pereira,"asked the Minister for Health whether there is currently a shortage of nurses in the public hospitals and, if so, what are the hospitals doing to address the shortage and ensure that the well-being of our patients is not compromised."
2019-08-05-T-033-S-00913,2019-08-05-T-033,913,Gan Kim Yong,"Nurses form the largest professional group in our healthcare workforce. Our overall registered nurse to population ratio of around 7.5 nurses per 1,000 population in 2018, is comparable to that in Hong Kong, Taiwan and South Korea."
2019-08-05-T-033-S-00914,2019-08-05-T-033,914,Gan Kim Yong,"Seven out of 10 of our practising nurses work in the public healthcare sector. In tandem with our expansion in public healthcare capacity, the number of nurses working in the public healthcare sector has increased from around 21,700 in 2013 to 25,600 in 2018."
2019-08-05-T-033-S-00915,2019-08-05-T-033,915,Gan Kim Yong,"To meet future demand for healthcare services in an aging population, we have expanded efforts to attract more Singaporeans to join nursing as well as to develop and retain serving nurses."
2019-08-05-T-033-S-00916,2019-08-05-T-033,916,Gan Kim Yong,"Some examples include (i) Raising the profile of nursing, such as through the Care to Go Beyond Campaign; (ii) Creating multiple pathways for mid-career professionals entering the profession, including professional conversion programmes; (iii) Raising the capacity and range of nursing training courses; (iv) Reviewing nurses’ remuneration to remain competitive; (v) And improving career recognition and progression."
2019-08-05-T-033-S-00917,2019-08-05-T-033,917,Gan Kim Yong,"To ensure that the nursing workforce is sustainable, we have also embarked on efforts to raise productivity. These include initiatives on automation, streamlining of nursing work, and shifting of care from hospitals into the community where appropriate."
2019-08-05-T-033-S-00918,2019-08-05-T-033,918,Gan Kim Yong,"The Ministry of Health will continue to regularly review our nursing manpower needs, taking into consideration demographic and disease trends. We will also continue to work with educational and training institutions and healthcare providers to ensure that we have a nursing workforce that can serve the needs of Singaporeans."
2019-08-05-T-034-S-00919,2019-08-05-T-034,919,Anthea Ong,"asked the Minister for Education (a) what is the Ministry's strategic plan for mental health education and its de-stigmatisation; (b) whether the Ministry has considered re-framing physical health education to total health education that includes mental and emotional health; (c) whether feedback on the mental and emotional health of students are regularly collated and parents informed accordingly; (d) whether co-curricular programmes are recommended to schools to normalise mental health and improve help-seeking behaviours and, if so, what are these programmes; and (e) whether the Ministry will consider partnering external organisations to provide training and support to students' families."
2019-08-05-T-034-S-00920,2019-08-05-T-034,920,Ong Ye Kung,"MOE adopts a holistic approach to supporting student well-being, covering physical health, social and emotional development and psychological support when necessary."
2019-08-05-T-034-S-00921,2019-08-05-T-034,921,Ong Ye Kung,"We strengthen students' mental health through lessons on Character and Citizenship, Form Teacher Guidance Period and Physical Education. We build character in students through experiential learning platforms such as Co-Curricular Activities, Values-in-Action programme and outdoor education."
2019-08-05-T-034-S-00922,2019-08-05-T-034,922,Ong Ye Kung,"Our schools teach students social and emotional competencies such as relationship management, stress management and help-seeking skills, which are then put into practice when students engage in various school activities. The curriculum was enhanced recently to raise greater awareness of common mental illnesses, normalise help-seeking behaviour, reduce stigmatisation, and promote peer support."
2019-08-05-T-034-S-00923,2019-08-05-T-034,923,Ong Ye Kung,"Teachers monitor the well-being of students and work closely with parents and school counsellors to render additional support to those who need it. Schools also work with partners such as the Ministry of Social and Family Development (MSF), mental health professionals and Family Service Centres to support students and their families within the community."
2019-08-05-T-035-S-00924,2019-08-05-T-035,924,Intan Azura Mokhtar,"asked the Minister for Education whether the Ministry will consider allowing SkillsFuture credits to be made available to young adults with special needs from the age of 18 years old, instead of only from 25 years old, in light of the limited post-secondary education or training options for young adults with special needs."
2019-08-05-T-035-S-00925,2019-08-05-T-035,925,Ong Ye Kung,"Singaporeans with special educational needs (SEN) require differentiated support to prepare for employment. For those with mild to moderate SEN, many are enrolled in mainstream schools and the institutes of higher learning. Students with more severe SEN would enrol in the Special Education or SPED schools, and some have obtained vocational certifications such as Workforce Skills Qualification and ITE Skills Certificate. For those who require additional help, the Government provides further support through the School-to-Work Transition Programme, which offers training and internships to help prepare students with SEN for the workplace."
2019-08-05-T-035-S-00926,2019-08-05-T-035,926,Ong Ye Kung,"Students with SEN can use their Post-Secondary Education Account (PSEA) to support their education and training needs, until they reach the age of 30. This is on top of the $500 SkillsFuture Credit which they will receive when they reach the age of 25. In 2017, MOE broadened the scope of PSEA to cover approved training courses offered by SG Enable for students aged 17 years and above. This provides additional support for SEN students when they undergo continuing training beyond their school years. We welcome further ideas and suggestions from members on how the PSEA and other schemes can be enhanced to achieve better outcomes for students with SEN."
2019-08-05-T-035-S-00927,2019-08-05-T-035,927,Ong Ye Kung,"Supporting young adults with special needs is a whole-of-society effort. I encourage employers to partner our SPED schools, post-secondary education institutions and SG Enable, to provide internships, training and employment opportunities. For example, SG Enable has been working with hotels to provide job-related training opportunities through the School-to-Work Transition Programme.  We hope more employers can come on board and join this meaningful initiative."
2019-08-05-T-036-S-00928,2019-08-05-T-036,928,Saktiandi Supaat,asked the Minister for Health (a) how many Merdeka Generation Singaporeans require permanent help with at least three of six Activities of Daily Living; and (b) whether the Ministry will consider a disability assistance scheme for the Merdeka Generation that is similar to that for Pioneer Generation Singaporeans.
2019-08-05-T-036-S-00929,2019-08-05-T-036,929,Gan Kim Yong,"We estimate that there are currently about 9,000 Merdeka Generation seniors who require permanent help with at least three out of six Activities of Daily Living."
2019-08-05-T-036-S-00930,2019-08-05-T-036,930,Gan Kim Yong,"MOH is rolling out CareShield Life, which is a long-term care insurance that provides peace of mind and protection against uncertainty of disability care in old age. CareShield Life will provide life time payouts in the event of severe disability."
2019-08-05-T-036-S-00931,2019-08-05-T-036,931,Gan Kim Yong,"The majority of Merdeka Generation seniors are still healthy and able-bodied today, and will be able to join CareShield Life from 2021. To encourage them to join CareShield Life, the Government will provide a $4,000 sign-on incentive under the Merdeka Generation Package. Lower to middle income policy holders will also be eligible for subsidies that help keep premiums affordable. Those who still face difficulty paying their premiums can apply for additional premium support."
