speech_id,topic_id,speech_order,member_name,text
2019-09-03-T-013-S-00447,2019-09-03-T-013,447,Arasu Duraisamy,"While the move to expand insurance compulsory insurance coverage to non-manual employees is welcome, the salary threshold with proposed amendments from $1,600 to $2,600 is still low. As automation and technology increasingly change the way we work, we are seeing more working people multi-tasking, taking up additional job roles and responsibilities. While they might be considered as non-manual workers, part of their job responsibilities will increasingly expand. Their day-to-day job might be office-based but the job roles and functions might require them to be around in an environment where the risk of injury is high. These employees might be drawing a salary beyond the stated amount of $2,600. So, may I suggest that more be done to encourage employers to buy insurance coverage for all employees."
2019-09-03-T-013-S-00448,2019-09-03-T-013,448,Arasu Duraisamy,"Secondly, how are workers under contract for service covered under WICA? Correct me if I am wrong but the answer is none. With the advent of the platform economy, we have a growing number of self-employed persons, estimated to be more than 200,000 in Singapore. With the increasing prevalence of contract for service and the gig economy, they will not fall under the ambit of WICA as service buyers who engage them will not have to take up a WICA-related insurance coverage for these self-employed persons. What recourse do these employees then have in the event of injuries sustained in the course of their employment?"
2019-09-03-T-013-S-00449,2019-09-03-T-013,449,Arasu Duraisamy,"IMDA, through the Tripartite Standards on Procurement of Service from media freelancers, provided details on insurance coverage for media freelancers to be covered by their companies if they are required to offer their service onsite or on locations specified by the companies. The work-related personal accident insurance covers against claims for death, total permanent disability and medical expenses. As such, the responsibility is on the freelancers to ensure that they are insured with personal accident insurance that will be paid by the buyer while the service buyers should be prepared to factor such insurance cost into their service fee."
2019-09-03-T-013-S-00450,2019-09-03-T-013,450,Arasu Duraisamy,"Will other Government Procurement Entities (GPEs) consider taking the lead to provide work injury insurance, especially for a significant GPE like MOE's schools, as this will help set the tone and shape responsible procurement practices where work injury insurance is the norm for responsible outsourcing."
2019-09-03-T-013-S-00451,2019-09-03-T-013,451,Arasu Duraisamy,"Mr Speaker, Sir, at this point I would also like to get an update on progress made by the Ministry and other Government agencies, besides IMDA, to provide insurance coverage and self-employed persons for work-related accidents for the many outsourced contracts they have."
2019-09-03-T-013-S-00452,2019-09-03-T-013,452,Arasu Duraisamy,"My third point of clarification is on mental illness brought about by work stress which is increasingly common in the workplace but it is not covered by the WICA amendments. As a unionist, I have come across members who have been diagnosed with depression. One such member initially wanted to resign from the company when diagnosed with depression but the company persuaded him not to do so and to continue his employment while undergoing treatment. He was granted sick leave for a year with medical review done every month. During this period, the company paid his basic salary and medical treatment. After more than a year of therapy and medication, there was no improvement to the member's condition. The company had to reluctantly terminate his employment. This member was fortunate as the company continued to pay his salary and medical treatment for a year, but what happens if an employer opts to terminate an employee with mental illness at the early on set of the condition. Can WICA can extend to cover the medical expenses and wages for such illnesses? After all, mental wellness is an area not very much talked about but it is an increasing trend in the workforce."
2019-09-03-T-013-S-00453,2019-09-03-T-013,453,Arasu Duraisamy,"On the amendment to provide for a differentiated WICA insurance premium based on employer's risk profile and claims history, it now gives more significant incentives to companies to ensure a safe and healthy workplace for its employees. Here the companies can partner the union to develop a safe and healthy culture in the company. One such example is PSA, the port operator."
2019-09-03-T-013-S-00454,2019-09-03-T-013,454,Arasu Duraisamy,"The Port's unions have a close partnership in working with PSA to raise safety standards at the workplace. Unions and management have worked closely together to improve workers' training and implement work procedures to create a safe work environment. As part of this close partnership, there are many channels for union leaders to provide feedback to management, in particular, the Health, Safety, Security Environment (HSSE) Council which comprises management and union representatives; and chaired by the top management executive – is a platform with regular meetings to jointly review safety and health performance, set safety and health directions, and provide feedback to management about workers' concern in safety related as well as health, security and environment related issues."
2019-09-03-T-013-S-00455,2019-09-03-T-013,455,Arasu Duraisamy,"To assimilate, HSSE in the work culture, PSA has also developed an in-house workshop programme called ""Starfish"". Union leaders are part of the first batch trained alongside PSA leaders and we have provided feedback to strengthen the course structure and material for the subsequent rollout to all our workers. Union leaders also play a vital role in rallying workers' support for safety related initiatives. For example, PSA taps on technologies such as video analytics and telematics to improve on-the-job behaviour and prevent accidents to the pre-emptive intervention programmes aimed at mentoring, coaching and training workers to improve their safety behaviour. This collective efforts have resulted in significant improvements in safety standards in PSA over the years and have helped in the reduction of costs."
2019-09-03-T-013-S-00456,2019-09-03-T-013,456,Arasu Duraisamy,"An injury is one too many and we are partnering management to cultivate a generative, safety culture. The Labour Movement aims to create a safe and conducive environment for every worker in Singapore."
2019-09-03-T-013-S-00457,2019-09-03-T-013,457,Arasu Duraisamy,"To conclude, Sir, the Labour Movement welcomes this additional amendments that brings benefits to the workers. We do hope that the Ministry can look at ways to cover every worker including workers with mental illness under the Act. We also call on our companies to work with the unions to promote safety and health at the workplace. As union leaders, we can and will be the ambassadors and catalysts at the workplace to promote health and safety at the workplace. After all, the well-being of our members is always our core business. I support the Bill."
2019-09-03-T-013-S-00458,2019-09-03-T-013,458,Chia Shi-Lu,"Mr Speaker, Sir, I would like to declare my interest as a doctor who looks into work injury cases. I stand in support of this Bill which will first, provide for affected employees to receive compensation for work injuries more expeditiously; second, ensure that the insurance policies meet minimum standards; and third, employers maintain full insurance coverage for their liabilities."
2019-09-03-T-013-S-00459,2019-09-03-T-013,459,Chia Shi-Lu,"First, I welcome the amendment to commence claims processing upon the Ministry's or the insurer's notification of fatal or serious injuries, thus removing the requirement for employees or their dependents to file compensation claim applications. This is an improvement from our current system, reducing time spent on paperwork by all parties, particularly the victims and their families during a very stressful and difficult time."
2019-09-03-T-013-S-00460,2019-09-03-T-013,460,Chia Shi-Lu,"I would just like to seek clarification on instances when claims assessment on injuries are delayed because employers are slow in paying for or guaranteeing the necessary medical examinations. Presently, they or insurance companies pay for clinic visits or hospital stays but not necessarily for outpatient tests, such as scans. Would the Minister elaborate on any changes or improvements, if any, for such cases that is provided for in this Bill?"
2019-09-03-T-013-S-00461,2019-09-03-T-013,461,Chia Shi-Lu,"Next, I have a question regarding the proposal to compensate employees placed on light duties due to work injuries. Where such light duties pay less, going forward, employees/employers will need to compensate them up to their average monthly earnings (AME). The intention of the Ministry is that these workers should not be worse off than those who are given medical leave. Currently, injured employees on medical leave are compensated with their AME. Under this Bill, compensation will be equal for both but I would like to ask if there are definitions of what injuries can be addressed with light duties versus medical leave."
2019-09-03-T-013-S-00462,2019-09-03-T-013,462,Chia Shi-Lu,"In addition, I would like to seek clarification on surveillance on reporting by employers. There may still be employers who do not report smaller injuries.  What measures are in place to minimise this problem? Employees are required under the WICA to inform their employers of any incidents as soon as possible. Is there a way whereby the employee reporting process informs both their employers and MOM simultaneously, possibly through a one-step reporting system at the health professionals' office for greater efficiency? Such a system will also ensure that employers do not have the opportunity to under-report."
2019-09-03-T-013-S-00463,2019-09-03-T-013,463,Chia Shi-Lu,"Finally, I would like to make a brief comparison with a few other developed nations for a sense of how we are aligned. I noticed that a key difference is that a number of these countries offer the option of pensions for workers who suffer permanent disabilities. Here in Singapore, workers can only claim a lump sum. Fixed amounts offer certainty for employers and insurers but may impose greater hardship on employers as we live longer. The disbursement of such a large sum of money all at once has the risks that it may all be spent too quickly or unwisely."
2019-09-03-T-013-S-00464,2019-09-03-T-013,464,Chia Shi-Lu,"For example, in the Federal Republic of Germany, under the statutory occupational accident insurance, such workers receive a pension until the age of 65, unless he or she begins receiving old-age pension earlier than that age. They can also opt for the pension to be paid out as a lump sum. Furthermore, in the event of death, any children they have who are under 18 years of age will receive an orphan's pension."
2019-09-03-T-013-S-00465,2019-09-03-T-013,465,Chia Shi-Lu,"Similarly, in Western Australia, in addition to a lump sum payment capped at AUD$232,000, there is a provision for a periodic child's allowance for dependent children."
2019-09-03-T-013-S-00466,2019-09-03-T-013,466,Chia Shi-Lu,"In the United Kingdom, on top of compensation from the compulsory Employers' Liability insurance bought by companies, affected employees can receive between £35.80 and £179 weekly under Industrial Injuries Disablement Benefit scheme, depending on the level of disablement."
2019-09-03-T-013-S-00467,2019-09-03-T-013,467,Chia Shi-Lu,"In the United States of America , there is no federal oversight nor minimum standard. Every state has its own workers compensation system and they vary widely. Some cap benefits for permanently disabled workers at 450 weeks while others allow benefits for life or until the worker reaches the age for Social Security benefits."
2019-09-03-T-013-S-00468,2019-09-03-T-013,468,Chia Shi-Lu,"And finally, in Japan, a worker may receive his Disability Pension Benefit either as a lump sum or as a pension."
2019-09-03-T-013-S-00469,2019-09-03-T-013,469,Chia Shi-Lu,"Hence, I would like to suggest that for workers who suffer permanent disabilities, the Ministry consider some form of pension arrangement as an option, as well as regular financial support, perhaps for their children up to the age of 18. Thank you and I support the Bill."
2019-09-03-T-013-S-00470,2019-09-03-T-013,470,Zainal Sapari,"Mr Speaker, I support the proposed amendments to the Work Injury Compensation Bill. Overall, the proposed amendments will essentially make the bill more worker-centric. I would like to focus my speech to share my perspective of this bill in relation to vulnerable low-wage and foreign workers."
2019-09-03-T-013-S-00471,2019-09-03-T-013,471,Zainal Sapari,"Extending compensation under WICA to include those on light duties due to work injury is a positive change towards covering the potential loss in workers' income because they may not be able to work overtime given the highly manual and strenuous nature of their work and hence, losing out on overtime pay or other incentive. For many low-wage workers, a sizeable portion of their pay package comprises of overtime payments, allowances and incentive payments while doing their regular work."
2019-09-03-T-013-S-00472,2019-09-03-T-013,472,Zainal Sapari,"More importantly, it also prevent the occurrence of possible abuse of the system where the injured vulnerable worker may be given medical leave for less than the stipulated four days as a way to get around the duty to report for WICA and the remaining recovery period is covered by light duties. Such circumventing measures may arise as company-approved medical practitioners may face the dilemma of balancing their financial interest against their ethical obligation when it comes to prescribing appropriate duration of medical leave for the workers."
2019-09-03-T-013-S-00473,2019-09-03-T-013,473,Zainal Sapari,"The Employment Act has been amended to make it mandatory for employers to issue pay slips. However, in WICA cases assisted by Migrant Workers' Centre involving many work permit holders, especially on the lower end of the skills profile, they continue to be paid in cash without the issuance of any records."
2019-09-03-T-013-S-00474,2019-09-03-T-013,474,Zainal Sapari,"Thus, NTUC welcomes the proposed amendment that allows MOM to order compensation based on a multiple of the worker's basic monthly salary or the Average Monthly Earnings (AME) based on at least 75% of cases of the industry norms. This will benefit the low wage and migrant worker sectors where the absence of pay slips tend to be more prevalent."
2019-09-03-T-013-S-00475,2019-09-03-T-013,475,Zainal Sapari,"NTUC also supports the move for initial compensation based on current incapacity or CI assessment at six months after the work accident to allow for a faster claim resolution for workers. In fact, this makes the WICA to be more worker-centric and responsive to the specific needs and situations for the migrant workers as it levels the playing ground for migrant worker claimants and evens up the odds in favour of workers."
2019-09-03-T-013-S-00476,2019-09-03-T-013,476,Zainal Sapari,"MWC had encountered cases involving injured foreign workers who were required to stay in Singapore for extended claims, but not allowed to work and inevitably, run into difficulty with upkeeping and maintaining themselves. There are good reasons to suspect that some employers or insurers may deliberately drag the cases because they are aware the migrant worker will run into hardship and put the employers or insurers at an advantage to negotiate a lower quantum which the worker has little choice but to accept; or even hold out on payment, against which the worker has no means, whether in terms of time or money, to enforce."
2019-09-03-T-013-S-00477,2019-09-03-T-013,477,Zainal Sapari,"Currently, all employers are required to have Compulsory Medical Insurance for their migrant workers but, most employers will only ensure minimum medical insurance coverage for their migrant workers to meet MOM's requirement. As our laws require the employers to be liable for the medical treatment for the foreign workers, some employers will incur huge medical expenses for their injured migrant workers if the WICA cases drag for too long, since, all foreigners are charged unsubsidised rates for treatment and hospital stay."
2019-09-03-T-013-S-00478,2019-09-03-T-013,478,Zainal Sapari,"As such, having a safety net provision for CI assessment at six months will benefit workers and employers as well because WICA is also meant to cover medical treatment cost for claimants, or at least help to defray the cost of treatment which for migrant workers are liable to borne by employers."
2019-09-03-T-013-S-00479,2019-09-03-T-013,479,Zainal Sapari,"Hence, the increased WICA coverage for treatment, together with expedited claims payouts will certainly help in cases where urgent medical treatment is needed by the worker but, the employer is unable to pay due to lack of medical insurance coverage or other cost issues."
2019-09-03-T-013-S-00480,2019-09-03-T-013,480,Zainal Sapari,Another issue arising from claims processing times is the situation where employers do not provide accommodation or maintenance for their claimant workers anymore or the worker himself wishes to leave his employer's hold given the breakdown in their relationship for whatever reasons. The migrant workers who decide to stay on pending the outcome of their injury claims are generally prohibited from working which may cause them a lot of financial hardship.
2019-09-03-T-013-S-00481,2019-09-03-T-013,481,Zainal Sapari,"A situation where the injured migrant workers opt to stay on their own and unable to work legally, to support their own maintenance and upkeep, is undesirable given the potential for them to moonlight illegally which will deny them of all the employment protections. Some may succumb to anti-social or even criminal behaviour in a bid to survive, which is detrimental to our society's well-being and safety."
2019-09-03-T-013-S-00482,2019-09-03-T-013,482,Zainal Sapari,"Thus, expediting the claim processing time will minimise the cost of their maintenance and upkeep and perhaps, lessen the likelihood of the migrant workers facing financial hardship and having to resort to undesirable actions that would be detrimental to themselves and our society."
2019-09-03-T-013-S-00483,2019-09-03-T-013,483,Zainal Sapari,"Given the changes made to WICA, there is a need to raise workers' awareness through outreach efforts especially among the vulnerable low-wage and migrant workers. Many vulnerable workers are still unaware of the basic provisions under WICA like how you can still claim under common law even after filing for WICA, but cannot do so in the reverse."
2019-09-03-T-013-S-00484,2019-09-03-T-013,484,Zainal Sapari,Some injured vulnerable workers may file injury claim under common law at the advice of overzealous lawyers without realising that they are signing away their rights to a WICA claim. They might also be unaware how WICA differs from legal suits under common law in its compensation quantum and other aspects like standards of proof and others.
2019-09-03-T-013-S-00485,2019-09-03-T-013,485,Zainal Sapari,"There must also be concerted efforts to change the mindset of employers to see WICA as an extension of the company's Work-Safety-Health worksite culture where employers are themselves briefed extensively in WSH and WICA laws and these aspects are refreshed regularly in worksite safety briefings and meetings. Such efforts will result in a general levelling up of the understanding of WSH and WICA for both employers and their workers and thus, minimising potential cause for misunderstanding and disputes."
2019-09-03-T-013-S-00486,2019-09-03-T-013,486,Zainal Sapari,"While the migrant workers will face a shorter waiting time for their claims processing and can return to their home country earlier, I would like to enquire on the channels that would be made available for workers to seek reassessment in event their injury condition deteriorates after the six-month mark. Ideally, such established channels must be guided by MOM and not by employers or insurance companies who might make it too onerous for workers seeking reassessment."
2019-09-03-T-013-S-00487,2019-09-03-T-013,487,Zainal Sapari,"Some occupation diseases or ODs can be undiagnosed for a prolonged period. For example, symptoms of asbestosis may only occur 20 years after exposure but, given WICA’s current one-year time bar, it would exclude such ODs with long latency periods. How can workers be compensated for such work-related injuries or diseases?"
2019-09-03-T-013-S-00488,2019-09-03-T-013,488,Zainal Sapari,"As our Government is also encouraging older workers to work, would the standard WICA insurance clauses be inclusive to ensure employers can buy insurance coverage for all their workers? Since older workers are sometimes prone to injuries due to slips and falls, some insurance companies may have exclusion clauses, in fine print, to exclude coverage for older workers."
2019-09-03-T-013-S-00489,2019-09-03-T-013,489,Zainal Sapari,"Under the proposed amendments, MOM-licensed insurers will assess and process all WIC claims as per stipulated MOM guidelines and time standards. This will lead to more expeditious claims processing but, with check and balances by MOM to ensure fairness to all parties."
2019-09-03-T-013-S-00490,2019-09-03-T-013,490,Zainal Sapari,"In the past, MOM processed the claims and was perceived to be guardian of fairness of the WICA claim. However, outsourcing this function to MOM-licensed insurers may lead to the judgement being questioned in terms of fairness as the insurance companies have a vested interest to keep compensation on the low side."
2019-09-03-T-013-S-00491,2019-09-03-T-013,491,Zainal Sapari,"In addition, insurance companies may also try to keep premiums low for their policies to be competitive but, at the expense of being unable to have sufficient financial standing to give our workers adequate and fair compensation. To mitigate this, NTUC welcomes the system of controls and penalties to accompany this legal innovation to ensure insurers remain on-side, fair and objective in their assessment."
2019-09-03-T-013-S-00492,2019-09-03-T-013,492,Zainal Sapari,"How effective this new licensing and enforcement regime will be, can only be re-assessed after the new system has been in place for some time. In the meantime, the unions and MWC will continue to get a better ground-sensing when we help our workers in the claims under WICA."
2019-09-03-T-013-S-00493,2019-09-03-T-013,493,Zainal Sapari,"Nevertheless, we urge the policy makers to review the application of the new insurer-processed system at appropriate junctures, so that further review and strengthening may continue to be made to it along the way to more effectively safeguard the rights and welfare of the key intended beneficiaries of the Act. Mr Speaker, in Malay."
2019-09-03-T-013-S-00494,2019-09-03-T-013,494,Zainal Sapari,(In Malay)  [Please refer to  Vernacular Speech.] NTUC supports the amendments to the Work Injury Compensation Act because it will provide better protection to workers who suffer injuries while working.
2019-09-03-T-013-S-00495,2019-09-03-T-013,495,Zainal Sapari,"The amendments propose a higher compensation limit and will include even more workers. In addition, the amendments also ensure a more stable insurance coverage with limited exclusions, which ensures that employers and workers can submit appeals to receive compensation for most types of injuries that commonly happen to workers."
2019-09-03-T-013-S-00496,2019-09-03-T-013,496,Zainal Sapari,"Although the responsibility for processing appeals for compensation under this Act is given to insurers appointed by MOM, these amendments will still allow workers to challenge the compensation amount that is given, if necessary."
2019-09-03-T-013-S-00497,2019-09-03-T-013,497,Zainal Sapari,"For employers, these amendments also help to reduce the cost of buying WICA insurance which will become more affordable provided they have a good safety record, whereby not many of their workers suffer injuries while working."
2019-09-03-T-013-S-00498,2019-09-03-T-013,498,Zainal Sapari,"WICA is a very useful Act for workers, but it is important that the Ministry take steps enhance workers' awareness towards this Act, especially for low wage workers. This will prevent irresponsible employers from taking advantage by cheating injured workers so that the workers do not submit appeals to obtain compensation through WICA, which affects the company's accident record."
2019-09-03-T-013-S-00499,2019-09-03-T-013,499,Zainal Sapari,(In English)  I believe that we are indeed making a big step in the right direction for our workers here in Singapore. The proposed amendments show that we understand the urgency of workplace compensations and the need to be fair and transparent to all parties involved.
2019-09-03-T-013-S-00500,2019-09-03-T-013,500,Jessica Tan Soon Neo,"Mr Speaker, I rise in support of the Bill. At this juncture, I also want to declare my interest as I work for an organisation that handles work injury assessments."
