speech_id,topic_id,speech_order,member_name,text
2020-11-02-T-036-S-00851,2020-11-02-T-036,851,Leong Mun Wai,"asked the Minister for Health (a) what is the number of imported COVID-19 cases who are non-citizens for the respective time periods of September 2020, between July and September 2020, and since 7 April 2020; and (b) what is the breakdown of these cases by country of origin."
2020-11-02-T-036-S-00852,2020-11-02-T-036,852,Gan Kim Yong,"There were 139 imported COVID-19 cases who are non-Singapore Citizens in the month of September 2020, 409 cases for the period from 1 July 2020 to 30 September 2020, and 575 cases for the period from 7 April 2020 to 31 October 2020."
2020-11-02-T-036-S-00853,2020-11-02-T-036,853,Gan Kim Yong,"The three countries with the highest numbers were India with 291 imported cases; Philippines with 111 imported cases; and Indonesia with 53 imported cases. We regularly review our border measures to manage the risk of COVID-19 importation. Pre-departure test requirement had been imposed for inbound travellers from India since 17 September, and for the Philippines and Indonesia since 20 October."
2020-11-02-T-037-S-00854,2020-11-02-T-037,854,Melvin Yong Yik Chye,asked the Minister for Communications and Information (a) what is the current number of game development companies operating in Singapore; and (b) what is the projected number of PMET positions that is needed to support the growing e-sports industry in Singapore.
2020-11-02-T-037-S-00855,2020-11-02-T-037,855,S Iswaran,"The games development and e-sports industry in Singapore is growing, in tandem with its rise globally, especially in the Asian region. In Singapore, there are about 190 games development and publishing companies,"
2020-11-02-T-037-S-00856,2020-11-02-T-037,856,S Iswaran,"There are diverse opportunities for PMET jobs in this industry, spanning job roles such as Software Programmer, Games Producer, Games Developer and Project Manager. Over the next two years, the industry will require about 2,700 info-communications and media professionals to support the games sector.2 To locally support the capability needs of this industry, the Government established DigiPen (Singapore) in 2017 as a specialised game school to teach students about digital animation and video game design. At the same time, IMDA is partnering companies to train for job roles to support the games industry and create new career opportunities for Singaporeans. One example is IMDA's partnership with SEA Group to train 500 Data/Business Analysts, Engineers, Product Managers and UI/UX Designers over the next two to three years."
2020-11-02-T-038-S-00857,2020-11-02-T-038,857,Leon Perera,asked the Deputy Prime Minister and Minister for Finance whether the Government will seek to use its influence as the shareholder of Temasek Holdings to require that SIA reviews its practice of fuel hedging.
2020-11-02-T-038-S-00858,2020-11-02-T-038,858,Heng Swee Keat,We have discussed the relationship between the Government and its investment entities many times in this House. Ms Sylvia Lim had a similar question earlier in October on whether the Government will use its shareholder influence to accomplish other objectives.
2020-11-02-T-038-S-00859,2020-11-02-T-038,859,Heng Swee Keat,Our answer remains unchanged. The Government maintains an arm’s-length relationship with its investment entities. We do not direct or influence their commercial or operational decisions. This principle applies likewise to their portfolio companies.
2020-11-02-T-039-S-00860,2020-11-02-T-039,860,Joan Pereira,"asked the Deputy Prime Minister and Minister for Finance in view of the many key schemes under the COVID-19 measures for individuals and households, whether the Ministry can send letters to all Singapore Citizens detailing what they will receive so as to prevent confusion amongst our elderly who may not be up to date with the news."
2020-11-02-T-039-S-00861,2020-11-02-T-039,861,Heng Swee Keat,"The Government shares the Member’s desire to inform Singaporeans about the various benefits and help schemes that they are eligible for, and has undertaken communication and outreach in various forms."
2020-11-02-T-039-S-00862,2020-11-02-T-039,862,Heng Swee Keat,"In July 2020, we distributed a Budget booklet to all households, describing the support measures announced at the Unity, Resilience, and Solidarity Budgets. For each scheme (like Workfare Special Payment, GST Voucher), customised letters are sent to each eligible citizen. For the Care and Support Package which has different components and payout timelines, letters to eligible beneficiaries provide information on what they can expect to receive. For GST Voucher – U-Save and the Solidarity Utilities Credit, we informed households of how much they would receive through additional inserts in their monthly utility bills from SP Services."
2020-11-02-T-039-S-00863,2020-11-02-T-039,863,Heng Swee Keat,"As some COVID-19 support measures are provided on an application basis, we stepped up our efforts to communicate these schemes so that those who needed additional support would be aware of how to apply for them. For instance, posters and infographics were put on the Digital Display Panels located within HDB estates."
2020-11-02-T-039-S-00864,2020-11-02-T-039,864,Heng Swee Keat,"Information on the various COVID-19 support schemes was consolidated on the ""Support Go Where"" website, with links to the various schemes’ application webpages, where relevant."
2020-11-02-T-039-S-00865,2020-11-02-T-039,865,Heng Swee Keat,"The Silver Generation Office (SGO) and its volunteers have also been actively reaching out to seniors, continuing over telephone during the Circuit Breaker period, to inform seniors of the support schemes available."
2020-11-02-T-039-S-00866,2020-11-02-T-039,866,Heng Swee Keat,We will continue to improve the ways we inform fellow citizens of the help available to them.
2020-11-02-T-040-S-00867,2020-11-02-T-040,867,Cheryl Chan Wei Ling,asked the Minister for Trade and Industry what are the plans for ASEAN to collectively move towards and support more renewable energy production in the region.
2020-11-02-T-040-S-00868,2020-11-02-T-040,868,Chan Chun Sing,"ASEAN energy cooperation is guided by the ASEAN Plan of Action for Energy Cooperation, or the APAEC. It sets out various capacity building initiatives and measures to advance regional energy cooperation. Currently in the fourth instalment, the APAEC 2016 to 2025 pursues the enhancement of energy connectivity and market integration in ASEAN to achieve energy security, accessibility, affordability, and sustainability for all ASEAN Member States. As part of this plan, ASEAN aspires to increase the proportion of renewable energy in its primary energy supply from 13.6% in 2015, to 23% by 2025."
2020-11-02-T-040-S-00869,2020-11-02-T-040,869,Chan Chun Sing,"The APAEC 2016-2025 comprises two phases. The first five-year phase comprises short to medium term goals to enhance energy security cooperation, connectivity and integration. On the renewables front, ASEAN published the first Renewable Energy Outlook for ASEAN, and organised capacity building programmes and energy policy dialogues on best practices and financing related to the deployment of renewables in the region. According to the fifth ASEAN Energy Outlook published in 2017, wind capacity in ASEAN is projected to increase from 0.6 gigawatt in 2015 to 6 gigawatts in 2025. Similarly, solar PVs are expected to increase its capacity from 1.3 gigawatt in 2015 to 10 gigawatts in 2025."
2020-11-02-T-040-S-00870,2020-11-02-T-040,870,Chan Chun Sing,"The next five-year phase of the APAEC seeks to accelerate energy transition and strengthen energy resilience through greater innovation and cooperation from 2021 to 2025. Renewable energy will continue to be a key focus. ASEAN plans to deepen cooperation with Dialogue Partners and International Organisations on renewable energy initiatives, including supporting biofuel and bioenergy development."
2020-11-02-T-040-S-00871,2020-11-02-T-040,871,Chan Chun Sing,"Singapore is also doing its part to promote renewable energy development in the region. During Singapore's Chairmanship of the ASEAN Ministers on Energy Meeting (AMEM) in 2018, the ASEAN and the International Renewable Energy Agency (IRENA) signed a Memorandum of Understanding (MOU) to establish dialogues and joint activities to promote renewable energy in the region. In August this year, the Energy Market Authority co-organised a Regional Training Programme on Sustainable Energy Policies in Smart Cities with the International Energy Agency. The Programme explored policies promoting energy efficiency and renewable energy sources in smart city planning. Singapore and the International Energy Agency also co-hosted the second Global Ministerial Conference on System Integration of Renewables during the Singapore International Energy Week, to promote dialogue in the acceleration of renewables integration."
2020-11-02-T-041-S-00872,2020-11-02-T-041,872,Leong Mun Wai,asked the Minister for Trade and Industry (a) what is the breakdown of the consumer electricity market share by retailers and SP Group; (b) what percentage of SP Group's electricity supply to consumers is covered by the vesting contracts; and (c) what is the expiration schedule of the vesting contracts by electricity production.
2020-11-02-T-041-S-00873,2020-11-02-T-041,873,Chan Chun Sing,"Forty-eight per cent of around 1.4 million household consumers and 46% of around 175,000 business consumers have switched to a retailer, as of end-September 2020. The remaining 52% of household consumers and 56% of business consumers remain with SP Group on the regulated tariff."
2020-11-02-T-041-S-00874,2020-11-02-T-041,874,Chan Chun Sing,The electricity that SP sells to consumers is covered by vesting contracts. SP acts as an intermediary – the payments for electricity are fully passed on to the generating companies with the vesting contracts.
2020-11-02-T-041-S-00875,2020-11-02-T-041,875,Chan Chun Sing,The vesting contracts will expire in June 2023. EMA is studying options for the regulated tariff after the expiry of the vesting contracts.
2020-11-02-T-042-S-00876,2020-11-02-T-042,876,Jamus Jerome Lim,asked the Minister for National Development (a) whether HDB will consider defects that are identified after the expiry of the defects liability period but which clearly result from systematic design or construction defects by a single sub-contractor to still fall within the scope of reasonable rectification action; and (b) whether HDB will consider availing funds under the Home Improvement Programme for cost-sharing between lessees that experience such systematic defects especially with demonstrated financial need.
2020-11-02-T-042-S-00877,2020-11-02-T-042,877,Desmond Lee,"It is not clear what the Member means by ""systematic"" design and construction defects. However let me explain the general approach to defects in HDB flats."
2020-11-02-T-042-S-00878,2020-11-02-T-042,878,Desmond Lee,Design and construction defects identified within one year of completion of the BTO flat will be repaired by the building contractor as part of their responsibility under the Defects Liability Period (DLP). This is a standard industry practice for both public and private housing.
2020-11-02-T-042-S-00879,2020-11-02-T-042,879,Desmond Lee,"For issues reported after the DLP, HDB will investigate the likely cause and advise flat owners on the follow-up action based on the specific circumstances of each case. If the reported issues are caused by wear and tear, or a lack of proper maintenance, the costs of repair should be borne by the flat owners, as it is their responsibility to maintain and repair the fixtures and fittings of their flat. Where it is clear from technical engineering assessments that the reported issue is attributable to the contractor’s workmanship or arises from a design issue, HDB will rectify the issue. In HDB’s experience, issues arising many years after the DLP tend to be the result of wear and tear over time, much of which could be mitigated through regular maintenance."
2020-11-02-T-042-S-00880,2020-11-02-T-042,880,Desmond Lee,"Even though it is the home owners' responsibility to maintain their flats, HDB introduced the Home Improvement Programme, or HIP, to help owners of older HDB flats to address common maintenance issues in such flats. Currently, HIP includes items such as the repair of spalling concrete, and the repair of vertical wastepipes within the toilets if required. This is why we have certain age norms for blocks to be scheduled for HIP – currently those completed up to 1997. HDB reviews the items included in the HIP periodically to ensure they remain relevant to the needs of residents."
2020-11-02-T-042-S-00881,2020-11-02-T-042,881,Desmond Lee,"The HIP programme is scoped and budgeted to meet the cost of the items provided under HIP. It is not intended to cover design or construction defects in general. As explained earlier, HDB has a separate process to deal with such issues."
2020-11-02-T-042-S-00882,2020-11-02-T-042,882,Desmond Lee,Flat owners who require financial assistance with household repairs can seek assistance from grassroots organisations and Community Development Councils.
2020-11-02-T-043-S-00883,2020-11-02-T-043,883,Foo Mee Har,asked the Minister for Manpower whether the favourable interest rates provided to CPF members amidst record low market interest rates will prevail to preserve retirement adequacy.
2020-11-02-T-043-S-00884,2020-11-02-T-043,884,Josephine Teo,"CPF interest rates are pegged to returns on investments of comparable risk and duration in the market. Hence, changes in the yields on market instruments such as Singapore Government Bonds and fixed deposits will automatically have an impact on CPF interest rates through the interest rate pegs."
2020-11-02-T-043-S-00885,2020-11-02-T-043,885,Josephine Teo,"Based on this interest rate peg formula, the current computed interest rate would be about 0.6% for the Ordinary Account (OA). However, CPF members currently enjoy a significantly higher rate of 2.5%, as this is the legislated minimum."
2020-11-02-T-043-S-00886,2020-11-02-T-043,886,Josephine Teo,"The legislated minimum of 2.5% also applies to the Special, MediSave, and Retirement Accounts (SMRA). On top of this, the Government has maintained a floor interest rate of 4% for the SMRA since 2008. This is considerably higher than the current computed interest rates of about 2.4% for the Special and MediSave Account (SA and MA), and 3.0% for the Retirement Account (RA). In September, the Government announced that the 4% floor would be extended till December 2021. In addition, to help further grow CPF savings, extra interest continues to be paid on the first $60,000 of a member’s combined balances (capped at $20,000 for the OA)."
2020-11-02-T-043-S-00887,2020-11-02-T-043,887,Josephine Teo,"The interest rates on the OA, SA and MA are reviewed quarterly while the interest rate on the RA is reviewed annually, taking into account market conditions."
2020-11-02-T-044-S-00888,2020-11-02-T-044,888,Tan Wu Meng,"asked the Minister for Health (a) whether the market for Integrated Shield Plan (IP) insurance products has been studied from a competition perspective and, if so what are the findings; and (b) whether such competition study has considered the situation of existing IP insured who wish to change their IP provider."
2020-11-02-T-044-S-00889,2020-11-02-T-044,889,Gan Kim Yong,"MediShield Life is a basic health insurance scheme that provides Singaporeans with universal and lifelong protection against large healthcare bills. Integrated Shield Plans (IPs) provide optional additional coverage on top of MediShield Life. The IP market currently has seven IP insurers, all of whom have a similar range of IP offerings. MOH publishes the comparison of insurers’ benefits, premiums, terms and conditions and claims processing duration, to improve transparency and help consumers make informed decisions, including the choice of an IP plan."
2020-11-02-T-044-S-00890,2020-11-02-T-044,890,Gan Kim Yong,"IP policies and premiums are determined by private insurers based on their own commercial and actuarial considerations, as well as competitive factors especially for new policy holders. As is the case with most private healthcare insurance, new policyholders may be subject to underwriting, and their policy offers may also be subject to exclusions or premium loading if they are found to have pre-existing medical conditions. This applies also to existing IP policyholders who wish to change insurers. Nevertheless, MediShield Life covers all Singaporeans, including any pre-existing conditions regardless of their IP plan or exclusions."
2020-11-02-T-045-S-00891,2020-11-02-T-045,891,Chua Kheng Wee Louis,"asked the Minister for National Development with regard to URA's announcement on the Restriction on Re-issue of Option to Purchase (OTP) for the Same Unit to Same Purchaser, what is (i) the total number of such cases over the last two years (ii) the average length of time taken to exercise OTPs for successful cases (iii) the number of cases that were eventually aborted (iv) the current number of cases outstanding and (v) the average number of weeks that developers have committed to purchasers for the re-issuance of OTPs."
2020-11-02-T-045-S-00892,2020-11-02-T-045,892,Desmond Lee,"Since January 2019, 5,500 private housing transactions had Options to Purchase (OTPs) for the same units re-issued to the same purchasers. Close to 70% of these re-issued OTPs have been exercised, on average less than six months from the date the first OTP was issued. Only about 1% of the re-issued OTPs eventually lapsed."
2020-11-02-T-045-S-00893,2020-11-02-T-045,893,Desmond Lee,"Given the current economic uncertainties, it is even more important for purchasers to be financially prudent and to secure the necessary financial resources before they commit to new property purchases. To reduce risk to purchasers, URA has, from 28 September, prohibited developers from (i) providing upfront agreement to purchasers to re-issue OTP, and (ii) re-issuing OTP to the same purchaser(s) for the same unit within 12 months after the expiry of the earlier OTP. Nevertheless, to minimise the impact on existing purchasers, URA will allow developers to honour their previous commitments to the purchasers, which were made prior to these changes."
2020-11-02-T-045-S-00894,2020-11-02-T-045,894,Desmond Lee,"For purchasers who require more time, such as to complete the sale of their existing property to finance the new property, URA is prepared to grant extensions of OTP validity, so there is no need for the developer to reissue the OTP."
2020-11-02-T-046-S-00895,2020-11-02-T-046,895,Shawn Huang Wei Zhong,"asked the Minister for Transport (a) whether there are plans to ensure that ride hailing and delivery platforms play an active role with their platform partners to strengthen and secure medical and accident protection of their partners, develop pathways to acquire skills and build up their platform partners' ability to retire; and (b) whether there are plans to ensure fair and reasonable access to the platform and sufficient protection of these platform partners from taking on unnecessary business risks."
2020-11-02-T-046-S-00896,2020-11-02-T-046,896,Ong Ye Kung,"The Government, the National Private Hire Vehicles’ Association (NPHVA) and ride-hail operators have been working together to ensure that drivers and riders are adequately covered by insurance, as a matter of good industry practice. Today, Grab and Gojek are providing their drivers with medical, accident and also  Prolonged Medical Leave insurance"
2020-11-02-T-046-S-00897,2020-11-02-T-046,897,Ong Ye Kung,"Regulations also play a part. From 1 December 2020, food delivery platform operators will be required by law to insure their riders using active mobility devices against third-party liability, to cover expenses arising from accidents that can occur in the course of work."
2020-11-02-T-046-S-00898,2020-11-02-T-046,898,Ong Ye Kung,"As part of our national SkillsFuture movement, ride-hail operators have also been supporting their drivers to pick up new skills. For example, Grab recently partnered Ngee Ann Polytechnic, the Employment and Employability Institute and the NPHVA to roll out training programmes. It has also developed a career portal to help drivers who wish to transition out of driving."
2020-11-02-T-046-S-00899,2020-11-02-T-046,899,Ong Ye Kung,"Under the new Point-to-Point Transport (P2P) regulatory framework, P2P operators are not allowed to impose exclusivity restrictions on their drivers. That way, drivers can work for multiple platforms at the same time. We will continue to strike a balance between providing flexibilities to drivers and ensuring that platform operators continue to have an incentive to innovate and differentiate themselves in providing good services to commuters."
2020-11-02-T-046-S-00900,2020-11-02-T-046,900,Ong Ye Kung,
2020-11-02-T-047-S-00901,2020-11-02-T-047,901,Louis Ng Kok Kwang,asked the Prime Minister (a) what is the Government's response to the Financial Action Task Force's (FATF) report on Money Laundering and the Illegal Wildlife Trade; and (b) what steps does the Government intend to take to address the findings in the report.
2020-11-02-T-047-S-00902,2020-11-02-T-047,902,Tharman Shanmugaratnam,"Illegal wildlife trade (IWT) is a transnational crime. As IWT generates criminal proceeds for their perpetrators, the Financial Action Task Force (FATF) report that Mr Louis Ng refers to does focus on combatting money laundering (ML) linked to IWT."
2020-11-02-T-047-S-00903,2020-11-02-T-047,903,Tharman Shanmugaratnam,Singapore was in fact a member of the project team for the report and supports its recommendations. We contributed case studies to support the FATF deliberations.
2020-11-02-T-047-S-00904,2020-11-02-T-047,904,Tharman Shanmugaratnam,"Our whole of government approach is consistent with the recommendations in the FATF report. Several agencies, including the Commercial Affairs Department, National Parks Board and the Monetary Authority of Singapore work together to combat ML linked to IWT. Let me elaborate."
2020-11-02-T-047-S-00905,2020-11-02-T-047,905,Tharman Shanmugaratnam,We have enacted laws and regulations that target IWT and associated ML.
2020-11-02-T-047-S-00906,2020-11-02-T-047,906,Tharman Shanmugaratnam,"a. Under the Endangered Species (Import and Export) Act (ESA) and the Wildlife Act (WA), it is an offence to trade wildlife without the requisite permits."
2020-11-02-T-047-S-00907,2020-11-02-T-047,907,Tharman Shanmugaratnam,"b. The laundering of proceeds for ESA and WA offences is an ML offence under the Corruption, Drug Trafficking and Other Serious Crimes (Confiscation of Benefits) Act."
2020-11-02-T-047-S-00908,2020-11-02-T-047,908,Tharman Shanmugaratnam,"Singapore enforces these laws robustly. The relevant agencies regularly exchange information, typologies and intelligence, and coordinate on joint operations and training. They have also formed close working relationships with foreign counterparts. Through this close collaboration, Singapore has intercepted shipments and achieved several successful seizures of illegal wildlife cargo. These actions have disrupted criminal syndicates and prevented them from benefitting from the proceeds of IWT."
2020-11-02-T-047-S-00909,2020-11-02-T-047,909,Tharman Shanmugaratnam,"Public-private partnerships also play an important role in our efforts to combat IWT and ML. We have enhanced the collective understanding of IWT risks by sharing case studies and red flag indicators with banks, traders, and agents that apply for trade permits. This has helped them to better detect and report suspicious fund flows linked to IWT."
2020-11-02-T-047-S-00910,2020-11-02-T-047,910,Tharman Shanmugaratnam,"While we have made a number of prosecutions for IWT over the years, there has been no indication that there are major IWT syndicates operating out of Singapore. In the investigations, we have also not found ML linked to IWT occurring in or connected to Singapore."
2020-11-02-T-047-S-00911,2020-11-02-T-047,911,Tharman Shanmugaratnam,"Notwithstanding, we will continue to be vigilant to the threat posed by IWT and related ML."
2020-11-02-T-048-S-00912,2020-11-02-T-048,912,Dennis Tan Lip Fong,asked the Minister for Sustainability and the Environment (a) what is the rationale for SFA's latest revised position on the maximum residue limits for ractopamine in pork and cattle imported into Singapore; (b) what are the known and possible health risks arising from consuming meat with such residue limits of ractopamine including risks for young people or any vulnerable group; and (c) whether SFA is concerned that ractopamine is banned in various other countries.
2020-11-02-T-048-S-00913,2020-11-02-T-048,913,Grace Fu Hai Yien,"Importers of meat and meat products are required to ensure that the food they import comply with the regulatory standards set by SFA, so as to ensure that the food is safe for consumption. These standards include the maximum residue limits for substances found in the food. When considering new regulatory standards or when reviewing existing regulatory standards, SFA takes reference from international standards-setting bodies such as the Codex Alimentarius Commission (Codex), which was established by the Food and Agriculture Organisation (FAO) and the World Health Organisation (WHO)."
