Topic_CID,Original_MP_Name,MP_Name,Text,Seq,Speech_Order,Speech_CID
2021-09-13-T-001,Tin Pei Ling,Ms Tin Pei Ling (MacPherson),Question No 1.,1,1,2021-09-13-T-001-S-00001
2021-09-13-T-001,S Iswaran,The Minister for Transport and Minister in-charge of Trade Relations (Mr S Iswaran) (for the Minister for Trade and Industry),"Mr Speaker, on behalf of Minister Gan Kim Yong. In August, MTI projected that the Singapore economy would expand by 6% to 7% in 2021, taking into account several developments.",1,2,2021-09-13-T-001-S-00002
2021-09-13-T-001,S Iswaran,The Minister for Transport and Minister in-charge of Trade Relations (Mr S Iswaran) (for the Minister for Trade and Industry),"One, the global economic recovery has remained largely on track, notwithstanding the risks posed by the pandemic. High vaccination rates in key advanced economies such as the US and Eurozone have allowed them to press on with reopening even amidst a rise in infections. While regional economies have had to reimpose tight restrictions to curb a resurgence in cases, they are also ramping up vaccination efforts, which should facilitate the resumption of economic activities in the coming quarters.",2,3,2021-09-13-T-001-S-00003
2021-09-13-T-001,S Iswaran,The Minister for Transport and Minister in-charge of Trade Relations (Mr S Iswaran) (for the Minister for Trade and Industry),"Two, Singapore's GDP growth in the first half of the year came in at a better-than-expected 7.7% on a year-on-year basis. In particular, the outward-oriented sectors continued to grow strongly, with the manufacturing and finance and insurance sectors achieving growth of 14.5% and 7.4% respectively during this period. At the same time, our vaccination programme has made good progress, which will allow for the progressive easing of domestic and border restrictions over the course of the year.",3,4,2021-09-13-T-001-S-00004
2021-09-13-T-001,S Iswaran,The Minister for Transport and Minister in-charge of Trade Relations (Mr S Iswaran) (for the Minister for Trade and Industry),"Barring a major setback in the global economy, the growth of outward-oriented sectors will remain healthy in the second half of the year. The progressive easing of domestic and border restrictions will also help to support the recovery of consumer-facing sectors such as food and beverage services, and alleviate labour shortages in sectors that are reliant on migrant workers such as construction. On the other hand, the tourism- and aviation-related sectors are likely to see a slow recovery due to ongoing global travel restrictions and weak travel demand.",4,5,2021-09-13-T-001-S-00005
2021-09-13-T-001,S Iswaran,The Minister for Transport and Minister in-charge of Trade Relations (Mr S Iswaran) (for the Minister for Trade and Industry),"Looking ahead to 2022, MTI expects the Singapore economy to continue to recover as global growth is projected to remain positive. MTI will announce Singapore's 2022 GDP growth forecast in November 2021.",5,6,2021-09-13-T-001-S-00006
2021-09-13-T-002,Vikram Nair,Mr Vikram Nair,asked the Minister for Foreign Affairs whether the current political situation in Malaysia has any implications for Singapore.,1,7,2021-09-13-T-002-S-00007
2021-09-13-T-002,Kwek Hian Chuan Henry,Mr Kwek Hian Chuan Henry,asked the Minister for Foreign Affairs in light of Malaysia’s recent change of government (a) whether he can provide an update on our bilateral ties with Malaysia; and (b) how the Government will move forward on the many bilateral partnerships with Malaysia such as the Johor Bahru-Singapore Rapid Transit System Link and COVID-19 border control measures.,1,8,2021-09-13-T-002-S-00008
2021-09-13-T-002,Vivian Balakrishnan,The Minister for Foreign Affairs (Dr Vivian Balakrishnan),"Mr Speaker, may I have your permission to take Question Nos 2 and 3 together?",1,9,2021-09-13-T-002-S-00009
2021-09-13-T-002,Speaker,Mr Speaker,Please do.,1,10,2021-09-13-T-002-S-00010
2021-09-13-T-002,Vivian Balakrishnan,Dr Vivian Balakrishnan,"Mr Speaker, Malaysia will always be our closest neighbour. This is a geographical fact. Our long-term relationship will always be bound by the ties of kinship, culture, history and economic interdependence. A stable and prosperous Malaysia is good for Singapore and indeed, good for our region. Naturally, the Singapore Government watches developments in Malaysia very closely.",1,11,2021-09-13-T-002-S-00011
2021-09-13-T-002,Vivian Balakrishnan,Dr Vivian Balakrishnan,"As Members of the House would be aware, there has been a change in leadership in Malaysia. Its new Cabinet, led by Prime Minister Ismail Sabri Yaakob, was sworn in on 21 August 2021. Prime Minister Lee spoke with Prime Minister Ismail Sabri the very next morning. Many Singapore Ministers have also established or renewed contact with their Malaysian counterparts. Singapore’s consistent position is to work with the government of the day.",2,12,2021-09-13-T-002-S-00012
2021-09-13-T-002,Vivian Balakrishnan,Dr Vivian Balakrishnan,"Mr Speaker, we have enjoyed good relations with successive Malaysian governments and leaders, and we have cooperated well with them across a wide range of areas. For example, we cooperated closely with the previous government led by former Prime Minister Muhyiddin Yassin to tackle the COVID-19 pandemic, including contributing medical supplies and test kits. We acted quickly in the early days of the pandemic to set up the Singapore-Malaysia Special Working Committee on COVID-19, which was co-chaired by Senior Minister and the Coordinating Minister for National Security Teo Chee Hean and then-Senior Minister and Minister of Defence of Malaysia Ismail Sabri, in order to coordinate both countries’ measures to respond to COVID-19, and minimise disruptions to our companies, workers and citizens. We also launched several travel arrangements, such as the safe movement of cargo trucks, the Periodic Commuting Arrangement for workers and a framework for Death and Critically Ill Emergency Visits. These travel arrangements will continue.",3,13,2021-09-13-T-002-S-00013
2021-09-13-T-002,Vivian Balakrishnan,Dr Vivian Balakrishnan,"Our leaders are familiar with Prime Minister Ismail Sabri and his Cabinet members. We have worked with them on many bilateral and regional issues. Prime Minister Ismail Sabri and I have known each other from the days when we were both the Ministers for Youth and Sports. That was some time ago. We also met during my more recent visit to Malaysia in March earlier this year, when we discussed COVID-19 safeguards and cross-border travel arrangements. My counterpart – Minister of Foreign Affairs Saifuddin Abdullah – is also a familiar face. We worked closely together when he held the Foreign Affairs portfolio between 2018 and 2020. Besides the political leadership, our respective civil service maintains good relations and communications with each other and officials on both sides are in regular contact.",4,14,2021-09-13-T-002-S-00014
2021-09-13-T-002,Vivian Balakrishnan,Dr Vivian Balakrishnan,"Singapore remains committed to maintaining a constructive and positive relationship with the current Malaysian government. We will also follow through with our commitments on bilateral projects and our partnerships on the Johor Bahru-Singapore Rapid Transit System (RTS) Link Project and COVID-19 border control measures. On the RTS Link Project, Singapore and Malaysia reached an agreement to resume the project in July last year. Construction has in fact commenced on both sides and there has been good progress. The RTS Link will be a game changer when it commences service at the end of 2026. We look forward to it significantly improving connectivity between Singapore and Johor Bahru, and easing congestion on the Causeway.",5,15,2021-09-13-T-002-S-00015
2021-09-13-T-002,Vivian Balakrishnan,Dr Vivian Balakrishnan,"We are continuing discussions with the Malaysian government on the safe and gradual resumption of cross-border movement of people as we enter the endemic phase. This will require mutually agreed public health protocols to preserve the public health and safety of residents on both sides, whilst taking into account the medical resources available. For example, both sides are currently working towards recognising each other’s vaccine certificates. These discussions have been fruitful and we hope that this can map our path forward for a safe and gradual reopening of our borders when the situation permits it.",6,16,2021-09-13-T-002-S-00016
2021-09-13-T-002,Vivian Balakrishnan,Dr Vivian Balakrishnan,Singapore and Malaysia will always be closely intertwined and interdependent. We are committed to engaging and cooperating with the new Malaysian government to seek win-win outcomes. This is especially important in order for both our countries to recover and emerge stronger together from the COVID-19 pandemic situation. And I am confident that our bilateral cooperation will continue to expand for the mutual benefit of citizens on both sides.,7,17,2021-09-13-T-002-S-00017
2021-09-13-T-003,Pritam Singh,Mr Pritam Singh,"asked the Minister for Finance (a) what action does the Government intend to take with respect to irregularities found in audited documents reported in the Report of the Auditor-General for FY2020/2021 where documents were altered, backdated, artificially created and falsified by officers across three Ministries and two Statutory Boards; (b) how many investigations have been undertaken arising from these irregularities; (c) how many individuals are involved for each Ministry and Statutory Board; and (d) what specific action has been taken against officers in cases where investigations have concluded.",1,18,2021-09-13-T-003-S-00018
2021-09-13-T-003,Yip Hon Weng,Mr Yip Hon Weng,"asked the Minister for Finance (a) in the past five years, what are the types of recurring themes for issues flagged out by the AGO; (b) which are the Ministries and agencies that are repeatedly flagged out by the AGO; (c) why do these lapses and violations keep recurring; and (d) what action is taken to prevent their recurrence.",1,19,2021-09-13-T-003-S-00019
2021-09-13-T-003,Indranee Rajah,The Second Minister for Finance (Ms Indranee Rajah),"Mr Speaker, Sir, Question Nos 4 to 11 are Parliamentary Questions (PQs) pertaining to the AGO report. May I ask for your permission to have those PQs taken as a bloc? The PQs will be answered by the Ministers from the relevant Ministry and thereafter, for supplementary PQs to be asked.",1,20,2021-09-13-T-003-S-00020
2021-09-13-T-003,Speaker,Mr Speaker,"Okay, you may. Please proceed.",1,21,2021-09-13-T-003-S-00021
2021-09-13-T-003,Indranee Rajah,Ms Indranee Rajah,"And with your permission, may I take Question Nos 4 and 5 together now?",1,22,2021-09-13-T-003-S-00022
2021-09-13-T-003,Speaker,Mr Speaker,Carry on.,1,23,2021-09-13-T-003-S-00023
2021-09-13-T-003,Indranee Rajah,Ms Indranee Rajah,"Members have asked questions about various lapses and irregularities highlighted in the AGO report. Let me first provide an overview, before I address the specific questions by Mr Singh and Mr Yip.",1,24,2021-09-13-T-003-S-00024
2021-09-13-T-003,Indranee Rajah,Ms Indranee Rajah,"The Government’s approach to governance is one of responsibility, transparency and accountability. To that end, we have put in place governance structures at the whole-of-Government (WOG) and agency levels to ensure proper accountability for the use of public funds.",2,25,2021-09-13-T-003-S-00025
2021-09-13-T-003,Indranee Rajah,Ms Indranee Rajah,"At the WOG level, we have rules and guidelines on financial controls for public agencies carrying out finance functions. Central agencies such as the Smart Nation and Digital Government Group (SNDGG) and Grants Governance Office in MOF oversee common functional areas and work with agencies to ensure robust internal controls. MOF has recently set up the Government Procurement Function Office. There are also ongoing efforts to review policies and processes and strengthen capabilities, particularly for more complex areas such as IT and construction.",3,26,2021-09-13-T-003-S-00026
2021-09-13-T-003,Indranee Rajah,Ms Indranee Rajah,"At the agency level, enterprise risk management and system controls are in place. Regular internal audits are conducted. The management of development projects and facility management are specialised areas requiring deeper technical expertise and experience. In addition to raising the capabilities of our officers, agencies are enhancing supervision of contractors and managing agents.",4,27,2021-09-13-T-003-S-00027
2021-09-13-T-003,Indranee Rajah,Ms Indranee Rajah,"The AGO is an important part of our system of checks to uncover weaknesses and shortcomings. AGO adopts a risk-based approach in determining which areas to cover in an audit. AGO takes into consideration factors such as materiality and potential impact. Areas selected for audit could include areas with higher value expenditure, higher volume of transactions and key IT systems that deal with financial transactions. For example, as part of AGO’s annual audit of the Government Financial Statements, it examines the controls in place for payments to government suppliers and also audits the key IT systems used to process financial transactions, including those administered by MOF.",5,28,2021-09-13-T-003-S-00028
2021-09-13-T-003,Indranee Rajah,Ms Indranee Rajah,"Given the scale and complexity of Government operations it would be unrealistic to expect zero lapses. With 150,000 officers in the Public Service handling hundreds of thousands of transactions each year and more than 2,000 Government IT systems built over the years by different vendors and using different technologies, human errors and process gaps will occur from time to time.",6,29,2021-09-13-T-003-S-00029
2021-09-13-T-003,Indranee Rajah,Ms Indranee Rajah,"Given this, what is important, therefore, is that we must have the means to pick up such lapses and address them in an upfront and transparent manner. The annual AGO report and other elements of our governance system outlined earlier function as regular “health checks” for the Public Service and allows it to take corrective and preventive actions as may be necessary.",7,30,2021-09-13-T-003-S-00030
2021-09-13-T-003,Indranee Rajah,Ms Indranee Rajah,"Mr Yip asked about the types of recurring lapses. These have typically been in the areas of procurement and contracts management, IT controls and grants management, which share common factors like the scale and complexity of operations, a constantly changing operating environment, high volume of transactions and multiple touchpoints.",8,31,2021-09-13-T-003-S-00031
2021-09-13-T-003,Indranee Rajah,Ms Indranee Rajah,"In the past five years, six agencies have been mentioned in the Auditor-General’s reports for recurring lapses, mainly in the areas of procurement and contract management, and IT controls. These are the Accounting and Corporate Regulatory Authority, MINDEF, MOE, MOF, MOH and the People’s Association (PA). The lapses arose from gaps in agency processes and human factors. Let me share the actions we are taking to improve our processes and our officers’ capabilities.",9,32,2021-09-13-T-003-S-00032
2021-09-13-T-003,Indranee Rajah,Ms Indranee Rajah,"First, on process improvements. To mitigate the risks associated with IT and our digitalisation efforts, we are deploying more central IT infrastructure and common services, which facilitate regular reviews at the WOG level. SNDGG is implementing central tools to automate agencies’ review of privileged users’ activities and management of user accounts. The former will be implemented for about 800 high priority systems by December 2022 and all applicable systems by December 2023, while the latter will be implemented for all applicable systems by December 2023.",10,33,2021-09-13-T-003-S-00033
2021-09-13-T-003,Indranee Rajah,Ms Indranee Rajah,"Agencies regularly review and strengthen their own processes and systems to mitigate agency-level risks. For example, the Accountant-General's Department has taken steps to enhance IT security and will be adopting the central tools to automate the review of privileged users' activities.",11,34,2021-09-13-T-003-S-00034
2021-09-13-T-003,Indranee Rajah,Ms Indranee Rajah,"Second, we are strengthening our officers' capabilities. For example, MOF has established the Finance and Procurement Academy, in partnership with the Civil Service College, to better equip public officers with relevant competencies. Officers involved in finance, procurement and contract management receive refreshers and updates on policies and practices. We will step up our efforts as the recent audit findings pertain to more complex types of procurement and contract management, particularly in the areas of IT and development projects.",12,35,2021-09-13-T-003-S-00035
2021-09-13-T-003,Indranee Rajah,Ms Indranee Rajah,Officers involved in IT roles are actively engaged on audit findings as well as learning points and ways to prevent lapses. Agencies have also stepped up the training of these officers to strengthen IT governance and security processes.,13,36,2021-09-13-T-003-S-00036
2021-09-13-T-003,Indranee Rajah,Ms Indranee Rajah,"Mr Singh asked what actions are being taken in respect of the irregularities in the records furnished for audit. The Government takes a serious view of such irregularities. Every case is thoroughly investigated. Public officers found guilty of misconduct face disciplinary actions, depending on the nature, extent and circumstances of the breaches.",14,37,2021-09-13-T-003-S-00037
2021-09-13-T-003,Indranee Rajah,Ms Indranee Rajah,"Five agencies were highlighted by AGO for possible irregularities in records furnished for audit. Public officers from two agencies, MCCY and PA, were investigated for the fabrication of records. MCCY's internal investigation has concluded. Two MCCY officers admitted to fabricating claims records for services rendered by external parties as the officers could not locate the records when requested by AGO. However, the investigation verified that the claims were valid and the services were in fact rendered. So, while the claims were real, the conduct of the officers in fabricating the claims records was wrong. The officers were issued official warnings and their performance assessments were affected.",15,38,2021-09-13-T-003-S-00038
2021-09-13-T-003,Indranee Rajah,Ms Indranee Rajah,"In the PA case, investigations are ongoing. The officers involved have been suspended from duties pending the outcome of the investigations.",16,39,2021-09-13-T-003-S-00039
2021-09-13-T-003,Indranee Rajah,Ms Indranee Rajah,"MHA had three cases of possible irregularities in records furnished by contractors. In two cases, Police reports were lodged and the investigations have been completed. One contractor was charged in Court and the other was given a 12-month conditional warning. In the third case, action has been taken against the contractor for non-compliance of contractual requirements. There was no fabrication of records by public officers in any of these three cases. However, two officers are undergoing internal investigations for the lack of due diligence.",17,40,2021-09-13-T-003-S-00040
2021-09-13-T-003,Indranee Rajah,Ms Indranee Rajah,"For the remaining two agencies, MOE and HDB, investigations are ongoing. Appropriate action will be taken depending on the outcome of the investigations.",18,41,2021-09-13-T-003-S-00041
2021-09-13-T-003,Indranee Rajah,Ms Indranee Rajah,Integrity is a core value of the Public Service. We will continue to uphold strict standards in ensuring accountability in the use of public funds.,19,42,2021-09-13-T-003-S-00042
2021-09-13-T-004,Pritam Singh,Mr Pritam Singh,"asked the Minister for Culture, Community and Youth with respect to the Report of the Auditor-General for FY 2020/2021 (a) why did the People's Association (PA) not adopt the Government's instruction to adopt full price fluctuation in construction contracts; (b) how long has the PA practised this incorrect methodology; and (c) what is the total value of the contracts that invoked this incorrect methodology over the last seven years.",1,43,2021-09-13-T-004-S-00043
2021-09-13-T-004,Pritam Singh,Mr Pritam Singh,"asked the Minister for Culture, Community and Youth with respect to the Report of the Auditor-General for FY2020/2021 (a) whether PA will undertake an extensive review, investigation or audit to ascertain the true extent of lapses in approvals found in more than 50% of PA's contract variations on a test-check basis; and (b) what is the facility referred to and who is the managing agent identified in paragraph 56 of the Report where out of 36 supporting documents for the project, 34 were suspected to have been falsified amongst other irregularities.",1,44,2021-09-13-T-004-S-00044
2021-09-13-T-004,Foo Mee Har,Ms Foo Mee Har,"asked the Minister for Culture, Community and Youth (a) what lessons are learnt from payment irregularities uncovered by the Auditor General's Office amounting to $1.17 million made by PA to two contractors; and (b) what control measures have been instituted to ensure such irregularities do not recur.",1,45,2021-09-13-T-004-S-00045
2021-09-13-T-004,Sitoh Yih Pin,Mr Sitoh Yih Pin,"asked the Minister for Culture, Community and Youth (a) whether, arising from the sampling of 36 payments conducted by the AGO, PA will conduct a thorough investigation into all payments made in relation to the management of its facility maintenance contracts; (b) what is the total estimate of all such payments; and (c) whether and what steps PA intends to take to recover these irregular payments made.",1,46,2021-09-13-T-004-S-00046
2021-09-13-T-004,Sitoh Yih Pin,Mr Sitoh Yih Pin,"asked the Minister for Culture, Community and Youth (a) whether PA’s internal audits have picked up on any of the lapses that have been raised by AGO; (b) if not, what are the reasons for the failure to do so; and (c) what is the scope and ambit of the external consultant in its review of PA's governance system and oversight functions in relation to contract management of all development projects.",1,47,2021-09-13-T-004-S-00047
2021-09-13-T-004,Edwin Tong Chun Fai,"The Minister for Culture, Community and Youth (Mr Edwin Tong Chun Fai)","Sir, with your permission, may I take Question Nos 6 to 10 together?",1,48,2021-09-13-T-004-S-00048
2021-09-13-T-004,Speaker,Mr Speaker,Yes.,1,49,2021-09-13-T-004-S-00049
2021-09-13-T-004,Edwin Tong Chun Fai,Mr Edwin Tong Chun Fai,"Mr Speaker, for the Financial Year 2020/2021, the Auditor-General’s Office (AGO) audited two development projects which are under the charge of the People’s Association (PA), namely, Our Tampines Hub (OTH) and Heartbeat @ Bedok (HBB). The findings by AGO relate to these two projects.",1,50,2021-09-13-T-004-S-00050
2021-09-13-T-004,Edwin Tong Chun Fai,Mr Edwin Tong Chun Fai,"I will address the questions from several Members of the House relating to three key findings by AGO. But before I go into the specific findings, let me provide some context and background to these projects.",2,51,2021-09-13-T-004-S-00051
2021-09-13-T-004,Edwin Tong Chun Fai,Mr Edwin Tong Chun Fai,"Sir, PA's mission is to foster social cohesion. It does this through a wide range of programmes that cater to residents of different profiles and interests. Community facilities play an important part in terms of providing the infrastructure that supports us in bringing people together.",3,52,2021-09-13-T-004-S-00052
2021-09-13-T-004,Edwin Tong Chun Fai,Mr Edwin Tong Chun Fai,"During times of crisis, in particular, these community nodes become critical points of support for our residents. For instance, in our fight against COVID-19, PA transformed its CCs and RC Centres into distribution networks. We were able to quickly give our residents much-needed masks, sanitisers, TraceTogether tokens, Antigen Rapid Test (ART) test kits and so on. Almost overnight, many CCs were also turned into Vaccination Centres, to support our nation-wide vaccination efforts.",4,53,2021-09-13-T-004-S-00053
2021-09-13-T-004,Edwin Tong Chun Fai,Mr Edwin Tong Chun Fai,"Today, PA manages a total of 788 community facilities which vary in size and offerings. These range from the CCs and RC Centres to specialist CCs such as PAssion WaVe and imPAct @ Hong Lim Green.",5,54,2021-09-13-T-004-S-00054
2021-09-13-T-004,Edwin Tong Chun Fai,Mr Edwin Tong Chun Fai,"PA also regularly upgrades its community facilities. At any given point in time, about 50 of its facilities would be undergoing development or redevelopments. These include construction of new facilities, upgrading works, cyclical maintenance or minor building works.",6,55,2021-09-13-T-004-S-00055
2021-09-13-T-004,Edwin Tong Chun Fai,Mr Edwin Tong Chun Fai,"In 2010, the Government embarked on plans to build integrated community hubs. The intention was to bring together Government services with community programming and other related businesses under one roof, to better and more conveniently serve residents.",7,56,2021-09-13-T-004-S-00056
2021-09-13-T-004,Edwin Tong Chun Fai,Mr Edwin Tong Chun Fai,"For each of our integrated community hubs, PA took on the responsibility as the lead agency to undertake its development, working closely with various Government agencies, industry stakeholders and also, professionals.",8,57,2021-09-13-T-004-S-00057
2021-09-13-T-004,Edwin Tong Chun Fai,Mr Edwin Tong Chun Fai,"In each of these two cases, external consultants such as quantity surveyors, architects, engineers, project managers and managing agents (MA) were engaged, to help advise on and manage the construction phase of the development and subsequently, upon its completion, the management and maintenance of the facility.",9,58,2021-09-13-T-004-S-00058
