speech_id,topic_id,speech_order,member_name,text
2021-11-03-T-017-S-00416,2021-11-03-T-017,416,Zhulkarnain Abdul Rahim,"Finally, I welcome the establishment of this Commission which can meet the needs of the community and address the challenges of more complex cases in the future for our country."
2021-11-03-T-017-S-00417,2021-11-03-T-017,417,Zhulkarnain Abdul Rahim,"(In English)  Mr Speaker, Sir, I support the Bill."
2021-11-03-T-017-S-00418,2021-11-03-T-017,418,Speaker,Mr Dennis Tan.
2021-11-03-T-017-S-00419,2021-11-03-T-017,419,Dennis Tan Lip Fong,"Thank you, Mr Speaker. Let me first start by declaring that I am a practising advocate and solicitor in the Supreme Court of Singapore. The Constitutional Amendment Bill and the Judicial Service (Miscellaneous Amendments) Bill before us today provide for the creation of a separate Judicial Service."
2021-11-03-T-017-S-00420,2021-11-03-T-017,420,Dennis Tan Lip Fong,"The call for a separate Judicial Service is not something new at all. There has been calls for separate Judicial Services over the past 35 years and indeed, from all sides of the House. The Workers' Party former Secretary General and former Member for Anson, the late Mr J. B. Jeyaretnam, called for a separate Judicial Service Commission back in 1986. Former Nominated Member of Parliament and President of the Law Society, Mr Chandra Mohan K Nair, called for it in 2004. In our manifesto for the 2011 General Election, the Workers' Party called for a separate Judicial Service. The hon Mr Murali Pillai proposed a separate Judicial Service Commission in November 2020, and again, in the Adjournment Motion in July this year together with the hon Mr Lim Biow Chuan and Mr Christopher de Souza."
2021-11-03-T-017-S-00421,2021-11-03-T-017,421,Dennis Tan Lip Fong,"In November 2020, following the Ms Parti Liyani saga, my colleagues, the hon Member for Aljunied, Ms Sylvia Lim and Ms He Ting Ru, the hon Member for Seng Kang, filed a Motion named ""Justice for All"". In my speech in the ""Justice for All"" Motion, I said that it might still be worthwhile for the proposed review then, to still consider whether we should have a more specialised or dedicated Judicial track at the State Court level encompassing Magistrates and District Judges, continuing inter-services posting or rotation with other branches of the legal service, particularly with the Attorney-General's Chambers (AGC)."
2021-11-03-T-017-S-00422,2021-11-03-T-017,422,Dennis Tan Lip Fong,"Today, I am heartened to see the Government taking the first step to set up a Judicial Service separate from the current legal service. The Workers' Party supports this move and indeed the Constitution of the Republic of Singapore (Amendment) Bill for these changes as this will among other things, promulgate even greater judicial independence. The Bills proposed the setting up of a Judicial Service Commission (JSC) separate from the existing Legal Service Commission (LSC). Currently, the Chief Justice (CJ) is the president of the LSC and the Attorney-General (AG) and the Public Service Commission (PSC) Chairman sit on the commission together with two other members, each nominated by the Attorney-General, the PSC chairman and the Prime Minister."
2021-11-03-T-017-S-00423,2021-11-03-T-017,423,Dennis Tan Lip Fong,"Under the new arrangements, pursuant to the Bills, the AG will take over as the president of the LSC and the PSC chairman assume the newly considered role of Vice President. The CJ shall be the President of the new JSC, while the PSC Chairman assumed the newly considered role of the Vice President, together with two other members, each nominated by the CJ, the PSC Chairman and the Prime Minister."
2021-11-03-T-017-S-00424,2021-11-03-T-017,424,Dennis Tan Lip Fong,"I assume that the reconstituted rows in the respective commissions intend that the AG and CJ cannot be nominated by anyone to be members of the JSC and the LSC respectively. And if my assumption is wrong here, I am happy for the Minister to clarify, but this must surely be the case as this would promote independence between the two commissions. And in the case of the AG, not taking a role in a JSC, it would demonstrate greater judiciary independence."
2021-11-03-T-017-S-00425,2021-11-03-T-017,425,Dennis Tan Lip Fong,"Mr Speaker, the Singapore High Court has always enjoyed a good reputation in the international community for its jurisprudence and effectiveness. In particular, it has always been well-regarded by many commercial lawyers elsewhere."
2021-11-03-T-017-S-00426,2021-11-03-T-017,426,Dennis Tan Lip Fong,"As a shipping lawyer, I can further attest to that also, because the cross-border nature of our shipping legal work, both contentious and non-contentious, require us to work with lawyers from different maritime jurisdictions. And the issue of finding jurisdiction for both the contracts we draft and the cases we do, often has to do with finding strategic, reliable and reputable jurisdictions, which we can persuade our clients and other stakeholders to accept."
2021-11-03-T-017-S-00427,2021-11-03-T-017,427,Dennis Tan Lip Fong,"With the new JSC being split from the current LSC, and the more dedicated judicial track, which must surely envisage more dedicated recruitment as well as Human Resources (HR) policies, even more attention to judicial training at all levels, especially lower to mid levels, as well as a more enhanced career progression plans for all judicial officers, it is hoped that the public will be able to see better access to justice, even better quality judgments at all levels, including the various tribunals, State Courts, the High Court and the Appellate Courts above, as well as the delivery of just outcomes for all litigants."
2021-11-03-T-017-S-00428,2021-11-03-T-017,428,Dennis Tan Lip Fong,"Mr Speaker, I believe that our current LSC is big enough for the split to take place. I believe that a separate JSC should be given optimum autonomy to plan its recruitment in human resource development, independent of the reconstituted LSC. Having a separate JSC will, hopefully, allow it to look at recruitment, professional and continuing training and retention of personnel with a new focus as it strives to work towards building a team of officers who are specialists in being judicial officers, not merely Legal Service Officers."
2021-11-03-T-017-S-00429,2021-11-03-T-017,429,Dennis Tan Lip Fong,"I hope that with the JSC, our Courts can continue to recruit and develop more specialists in different areas, be it technology, construction, finance, IP, so on and so forth. This should also not just be at the higher levels, such as in the High Court, but also in the State Courts. This will enable our Courts to maintain its high standing among judiciaries all over the world."
2021-11-03-T-017-S-00430,2021-11-03-T-017,430,Dennis Tan Lip Fong,"Mr Speaker, I have said in my speech during the ""Justice for All"" Motion that how an average Singaporean thinks of our judges is important. He or she must, of course, be learned in law, and also in the area of specialisation that he or she is known for, beyond pure commercial law and, particularly, in areas like criminal and family law. The ability of judges to understand and empathise with the different challenges faced by litigants of different socioeconomic backgrounds is critical. I hope and have confidence that, with a dedicated JSC, our Judiciary and judicial officers can continue to rise to these challenges."
2021-11-03-T-017-S-00431,2021-11-03-T-017,431,Dennis Tan Lip Fong,"Mr Speaker, next, according to The Straits Times article of 4 October on the present Bills in question, I read that secondments will be available on application to provide selected officers with experience across both services and permanent transfers may also be available subject to prevailing personnel rules."
2021-11-03-T-017-S-00432,2021-11-03-T-017,432,Dennis Tan Lip Fong,"I would like to ask the Minister, following the changes under the present Bills, what are the new changes in respect of (a) the career development for the officers under the proposed new LSC and JSC respectively, as well as (b) the changes in respect of inter-service postings between LSC and JSC that officers can expect after the restructuring. I know the Minister touched on some aspects of this earlier, but, essentially, I would like to know how different will the career tracks be after the restructuring, and how will the changes enhance the new and separate Judicial Service. Will there, for example, be a default career progression plan, planned under each of the Services' Commission and transfers across to the other will only be catered upon request by an officer, or by the management of either services?"
2021-11-03-T-017-S-00433,2021-11-03-T-017,433,Dennis Tan Lip Fong,"In my speech at that ""Justice for All"" Motion, I also said a specialised Judicial Service may be preferable to the current system to provide more distance between prosecutors and those working as magistrates and judges. For example, to avoid having AGC colleagues, some of them being more senior colleagues, arguing cases before them, knowing that they may be posted back to AGC again. I had asked what safeguards will be in place to encourage reasonable distance."
2021-11-03-T-017-S-00434,2021-11-03-T-017,434,Dennis Tan Lip Fong,"Next, I would also like to ask whether there are plans to differentiate the remuneration frameworks of the Judicial Service and the Legal Service tracks, to account for the differences in specialisation after the restructuring."
2021-11-03-T-017-S-00435,2021-11-03-T-017,435,Dennis Tan Lip Fong,"Finally, I would like to ask the Minister for an update on how MinLaw views the current caseloads in our Courts, given our current number of judicial officers and given the pace by which the cases are being managed, and whether it thinks that the current number of judicial officers is adequate across the Courts."
2021-11-03-T-017-S-00436,2021-11-03-T-017,436,Dennis Tan Lip Fong,"Mr Speaker, notwithstanding my clarification, the Workers' Party will vote in support of the Constitution of the Republic of Singapore (Amendment) Bill and the Judicial Service (Miscellaneous Amendments) Bill."
2021-11-03-T-017-S-00437,2021-11-03-T-017,437,Speaker,Mr Murali Pillai.
2021-11-03-T-017-S-00438,2021-11-03-T-017,438,Murali Pillai,"Mr Speaker, Sir, almost exactly a year ago in this House, I suggested that an independent Judicial Service Commission (JSC) be set up, amongst others, to deepen the competence of judicial officers."
2021-11-03-T-017-S-00439,2021-11-03-T-017,439,Murali Pillai,"This suggestion to set up the JSC is not mine alone. Several hon Members made the same suggestion in this House, both before and after me, and we have just heard from the hon Member Mr Dennis Tan an account of the other Members who have spoken in this House asking for the setting up of the JSC. All of us are aligned in the request but not necessarily aligned in relation to the reasons for asking for the setting up of the JSC."
2021-11-03-T-017-S-00440,2021-11-03-T-017,440,Murali Pillai,"The hon Minister for Law chose his words very carefully in replying to me. He said the way our service was structured ""is probably the best model for the time being""."
2021-11-03-T-017-S-00441,2021-11-03-T-017,441,Murali Pillai,"As hon Members know, time is elastic. If anyone were to have asked me then as to whether the Government would set up the JSC, my instinctive reply would have been, ""Please do not hold your breath!"""
2021-11-03-T-017-S-00442,2021-11-03-T-017,442,Murali Pillai,"Then, in July this year, hon Members Mr Christopher de Souza and Mr Lim Biow Chuan joined me in an Adjournment Motion to call on the Government to study the feasibility to set up a separate and independent JSC to allow for deeper specialisation and ensure that the Judiciary is properly positioned for the challenges of the future."
2021-11-03-T-017-S-00443,2021-11-03-T-017,443,Murali Pillai,The hon Minister for Law agreed broadly with the points we made and pithily put it as an issue of timing. The Second Minister for Law recounted this just earlier today as well.
2021-11-03-T-017-S-00444,2021-11-03-T-017,444,Murali Pillai,"Should we retain the current structure and make incremental changes as we go along, or should we split the services now to put our country on a better footing for the future?"
2021-11-03-T-017-S-00445,2021-11-03-T-017,445,Murali Pillai,"If the same person were to have repeated the question on whether the split would have happened after the Adjournment Motion, my response would likely be that I am hopeful it will happen sooner rather than later."
2021-11-03-T-017-S-00446,2021-11-03-T-017,446,Murali Pillai,"As it turned out, just three months later, we are now considering these amendments to the Constitution to create a separate JSC out of the current LSC. I am really glad to note from the hon Member Mr Dennis Tan's speech that it will enjoy bipartisan support as well. If these amendments are passed, the plan is to put them into effect in January 2022."
2021-11-03-T-017-S-00447,2021-11-03-T-017,447,Murali Pillai,I am highlighting this chronology as it is clear to me that the Government was already considering the merits of these changes for a while and decided that now is the time to make these changes in the interest of securing of country's future.
2021-11-03-T-017-S-00448,2021-11-03-T-017,448,Murali Pillai,"The Government's approach brings to my mind what Prime Minister Lee stated during his National Day Rally speech in 2016. He asked, and I quote, ""whether things could get better for Singapore after SG50. Can the best be yet to come? The answer was a resounding ""yes!"""
2021-11-03-T-017-S-00449,2021-11-03-T-017,449,Murali Pillai,"He went on to state that one thing we need, as a country, to ensure this is to be, and I quote, ""blessed with a divine discontent, always not quite satisfied with what we have, always driven to do better"". These amendments we are considering reflect the spirit of ""divine discontent"" and ""drive to do better""."
2021-11-03-T-017-S-00450,2021-11-03-T-017,450,Murali Pillai,It is also in keeping with the Motion on Singapore's Justice System passed in Parliament in November 2020 in which we affirmed the Government's continuous efforts to build a fair and just society.
2021-11-03-T-017-S-00451,2021-11-03-T-017,451,Murali Pillai,"Perhaps, this explains why Singapore did well in the Pew Research Centre Report dated 21 October 2021 which conducted research in 17 advanced economies, including Singapore, to identify whether citizens in these economies want significant changes to their political system."
2021-11-03-T-017-S-00452,2021-11-03-T-017,452,Murali Pillai,"Mr Speaker, Sir, may I be allowed to flash a slide of the table from the report on the screen, please?"
2021-11-03-T-017-S-00453,2021-11-03-T-017,453,Speaker,Please do. [
2021-11-03-T-017-S-00454,2021-11-03-T-017,454,Murali Pillai,"Obliged. Yes. Thankfully, it is clearer. But now it is not."
2021-11-03-T-017-S-00455,2021-11-03-T-017,455,Speaker,We should use slides that we can read.
2021-11-03-T-017-S-00456,2021-11-03-T-017,456,Murali Pillai,"The chart is entitled ""Those who want changes to their political system are not confident political system can be changed"". So, you do not want to be high up in the chart from the Pew Research Center that I am showing."
2021-11-03-T-017-S-00457,2021-11-03-T-017,457,Murali Pillai,"Italy is ranked at the top, meaning, amongst the 17 economies, its people are the least satisfied."
2021-11-03-T-017-S-00458,2021-11-03-T-017,458,Murali Pillai,"Singapore is right below, meaning her people are the most satisfied."
2021-11-03-T-017-S-00459,2021-11-03-T-017,459,Murali Pillai,"It is stated in the report that in every economy, except Singapore, there are larger shares of the public who want political reform but lack the confidence that reform can happen effectively as compared to those who are confident that change can occur."
2021-11-03-T-017-S-00460,2021-11-03-T-017,460,Murali Pillai,"Eighty-two percent of Singaporeans said that they are satisfied with the way democracy is working here, compared to an overall median of 57%. A key feature of our democracy is that real action is taken, to make changes essential to securing our future and keeping all of us united in purpose."
2021-11-03-T-017-S-00461,2021-11-03-T-017,461,Murali Pillai,"The significance of setting up a separate and independent JSC should not be lost on anyone in this House. Just last month, when this House was considering the FICA Bill, there were insinuations in some quarters, particularly outside this House, that the Government is bent on making itself more powerful to suppress legitimate free speech and expression amongst our people."
2021-11-03-T-017-S-00462,2021-11-03-T-017,462,Murali Pillai,"Since then, this Government has repealed the Sedition Act, which was introduced during the colonial times to rein in discontent against the Government and it is now moving these Constitutional amendments which will enjoy bipartisan support to create an independent JSC to oversee judicial service officers."
2021-11-03-T-017-S-00463,2021-11-03-T-017,463,Murali Pillai,"These are not the acts of a power-hungry government, hell-bent on entrenching itself and ignoring the wishes of the people. Fair-minded people decide not based on empty words, but on real action."
2021-11-03-T-017-S-00464,2021-11-03-T-017,464,Murali Pillai,The razor-sharp focus of our Government is on securing our people’s future against the backdrop of an ever more challenging global landscape.
2021-11-03-T-017-S-00465,2021-11-03-T-017,465,Murali Pillai,"For the remainder of my speech, I wish to focus on the proposed reconstituted LSC. In my speech during the Adjournment Motion, I had spoken about the indelible contributions of the current LSC, using the integrated model since 1959, for which, as a nation, we owe much thanks. I have also spoken about the highly-respected judicial system that we have in Singapore and how the JSC will serve to strengthen it even more under the proposed system."
2021-11-03-T-017-S-00466,2021-11-03-T-017,466,Murali Pillai,"Let me start off by acknowledging the quality of the officers in the Legal Branch of the LSC, past and present."
2021-11-03-T-017-S-00467,2021-11-03-T-017,467,Murali Pillai,"To illustrate this point, I need only ask hon Members, as the hon Second Minister for Law did just a few minutes ago, to recount their own legislative experience in this House."
2021-11-03-T-017-S-00468,2021-11-03-T-017,468,Murali Pillai,"In the course of the COVID-19 pandemic last year, we had to pass 12 wide-ranging Bills. Seven of these bills were urgent Bills which included the COVID-19 (Temporary Measures) Bill and its three subsequent amendment Bills, Supply Bills, Bills providing for Parliamentary elections and marriage solemnisation during COVID-19. Two hundred and twenty-seven pieces of COVID-19-related subsidiary legislation were also published."
2021-11-03-T-017-S-00469,2021-11-03-T-017,469,Murali Pillai,"We were able to do this because of, amongst others, a top-rate team in the legislative division of the Attorney-General's Chambers (AGC). They had to be creative but meticulous, be daring but keep an eye for the minutiae of details. And all is done, quoting the hon Second Minister for Law, at ""breakneck speed""."
2021-11-03-T-017-S-00470,2021-11-03-T-017,470,Murali Pillai,"I still recall the speech of the hon Minister for Law when he expressed his pride and appreciation for the work done by officers involved during the passing of the COVID-19 (Temporary Measures) Bill. Several hon Members, including myself, joined him to express our appreciation."
2021-11-03-T-017-S-00471,2021-11-03-T-017,471,Murali Pillai,"This speaks of the quality and dedication of the officers we have in the legislative division headed by the hon Deputy Solicitor-General, Mrs Owi Beng Ki."
2021-11-03-T-017-S-00472,2021-11-03-T-017,472,Murali Pillai,"The Legal Branch is replete with great examples of dedicated officers, past and present, with a strong sense of duty. I would like to mention some of them whom I have had the privilege of knowing."
2021-11-03-T-017-S-00473,2021-11-03-T-017,473,Murali Pillai,"The late Mr K S Rajah SC. He served in the Legal Service from 1963 to 1985. This included a stint as the longest-serving Director of the Legal Aid Bureau, which allows people of limited means with important access to civil and family justice."
2021-11-03-T-017-S-00474,2021-11-03-T-017,474,Murali Pillai,"The late Mr S Tiwari, who was in the Legal Service for 36 years from 1971 to 2007 when he retired. During his career, he headed MINDEF's Legal Department and AGC's Civil Division and later, its International Affairs Division. He was involved in numerous international negotiations representing Singapore."
2021-11-03-T-017-S-00475,2021-11-03-T-017,475,Murali Pillai,"Mr Daren Tang, who is currently the Director-General of the World Intellectual Property Organisation (WIPO). In fact, he is the first Singaporean to lead a UN Agency. The hon Minister Mr Edwin Tong described his appointment as, and I quote, ""a momentous occasion for Singapore"". Prior to that, he was the Chief Executive of the Intellectual Property Office of Singapore and held several positions in AGC."
2021-11-03-T-017-S-00476,2021-11-03-T-017,476,Murali Pillai,"Mr Mohamed Faizal Senior Counsel, Senior State Counsel of the Crime Division of AGC – he is an excellent example of how one mixes heavy duty responsibilities with regular volunteer work for our community. For his contributions to the legal profession and the community, he was awarded the Berita Harian Anugerah Jauhari 2020 award. He was also inducted as a Young Global Leader by the World Economic Forum in 2016."
2021-11-03-T-017-S-00477,2021-11-03-T-017,477,Murali Pillai,"I make these references for a purpose. We must ensure that with the split of the current LSC into a JSC and the reconstituted LSC, the reconstituted LSC should continue to attract and retain its fair share of top talent with the right set of values."
2021-11-03-T-017-S-00478,2021-11-03-T-017,478,Murali Pillai,The Legal Service Officers of the Legal Branch perform vital roles in providing legal advice to the Government and playing their role in the administration of justice and helping to uphold of the rule of law in Singapore.
2021-11-03-T-017-S-00479,2021-11-03-T-017,479,Murali Pillai,"With the reconstituted LSC, there is an opportunity to hasten the pace of specialisation of the LSOs to keep up with the demands of their respective jobs and the ever-rising expectations of Singaporeans. May I ask the hon Minister whether plans have been made to deal with this issue? If so, I would be grateful for an outline of the efforts that will be expended on this front."
2021-11-03-T-017-S-00480,2021-11-03-T-017,480,Murali Pillai,"Mr Speaker, Sir, laws are unwieldy creatures. The text of the laws passed can be so turgid and formal such that many people cannot help but describe it as ""gobbledegook"". But they are also such powerful forces. During the pandemic, for example, these laws make sure that workers get paid, our rents reduced and that the promises businesses made to one another can be modified easily without breaking trust. And all these, in an orderly, legitimate and predictable manner."
2021-11-03-T-017-S-00481,2021-11-03-T-017,481,Murali Pillai,"This could not have been done without the best legal minds at work in the public sector. This restructuring is needed, but we must do it with care. The reconstituted LSC must stand shoulder to shoulder with the JSC as twin pillars in attracting and developing the best human resource talent in the public legal sector that will continue to meet the high expectations of Singaporeans well into the future."
2021-11-03-T-017-S-00482,2021-11-03-T-017,482,Murali Pillai,"This will allow us to pursue our democratic dream, partnered with divine discontent, not mere dissatisfaction with the way things are, but the power to change them to the way they should be. I support the Bill."
2021-11-03-T-017-S-00483,2021-11-03-T-017,483,Speaker,Order. I propose to take a break now. I suspend the Sitting and will take the Chair at 4.55 pm.
2021-11-03-T-017-S-00484,2021-11-03-T-017,484,Speaker,Sitting accordingly suspended
2021-11-03-T-017-S-00485,2021-11-03-T-017,485,Speaker,at 4.32 pm until 4.55 pm.
2021-11-03-T-017-S-00486,2021-11-03-T-017,486,Speaker,Sitting resumed at 4.55 pm.
2021-11-03-T-017-S-00487,2021-11-03-T-017,487,Speaker,[(proc text) Debate resumed. (proc text)]
2021-11-03-T-017-S-00488,2021-11-03-T-017,488,Louis Ng Kok Kwang,"Sir, the Bill proposes to establish a Judicial Service Commission (JSC), separate from the Legal Service Commission (LSC). The restructuring will allow both the LSC and JSC to benefit from greater specialisation and flexibility. This is needed to tackle the increasing complexity of the legal landscape."
2021-11-03-T-017-S-00489,2021-11-03-T-017,489,Louis Ng Kok Kwang,Our legal system and judiciary are greatly respected for impartially and efficiently dispensing justice. The amendments will help us to maintain the good standing of our legal system.
2021-11-03-T-017-S-00490,2021-11-03-T-017,490,Louis Ng Kok Kwang,I have three points of clarification to make.
2021-11-03-T-017-S-00491,2021-11-03-T-017,491,Louis Ng Kok Kwang,"My first point is on the independence of the LSC, the Public Service Commission (PSC) and the JSC."
2021-11-03-T-017-S-00492,2021-11-03-T-017,492,Louis Ng Kok Kwang,"The public place great trust in our institutions. Results released in March this year from an IPS study showed that 81% of the public had a great deal or quite a lot of trust in the Government; 82% said this of the Courts, and 80% said this of the Civil Service."
