speech_id,topic_id,speech_order,member_name,text
2021-11-03-T-023-S-00728,2021-11-03-T-023,728,K Shanmugam,"Within Singapore, as of September 2021, there have been no reported cases of scams perpetrated through this integration. However, MHA is aware of at least one case taking place outside Singapore, where an e-commerce scam used the PayNow-PromptPay integration to have the money transferred to the scammer."
2021-11-03-T-023-S-00729,2021-11-03-T-023,729,K Shanmugam,"The same safeguards imposed for domestic PayNow transfers apply to cross-border transfers made via the PayNow-PromptPay linkage. These include the use of online banking credentials to access PayNow-PromptPay services, and customisable limits on daily transfer amounts. In addition, there is a system-imposed daily cap of S$1,000. Users are also able to check the identity of the recipient before making the transfer, after keying in the mobile phone number of the recipient."
2021-11-03-T-023-S-00730,2021-11-03-T-023,730,K Shanmugam,"As scammers based overseas may try to exploit advancements in cross-border integration of banking services to get their victims to directly transfer monies overseas, we urge users to practise healthy skepticism in verifying the authenticity of the transactions, make full use of the safeguards available, as well as to pause, check and confirm before effecting the transfer."
2021-11-03-T-024-S-00731,2021-11-03-T-024,731,Wan Rizal,asked the  Minister for Foreign Affairs
2021-11-03-T-024-S-00732,2021-11-03-T-024,732,Vivian Balakrishnan,"On part (a) of the query, we do not have statistics on the COVID-19 vaccination rates of Singaporean students who are based abroad."
2021-11-03-T-024-S-00733,2021-11-03-T-024,733,Vivian Balakrishnan,"The Singapore Government is mindful of the challenges faced by overseas Singaporeans, including our students based overseas, in the face of the COVID-19 pandemic. We have been urging all Singaporeans to get vaccinated. Those who are leaving for overseas studies this year would have had the opportunity to be vaccinated in Singapore before they depart. We understand that some Singaporeans prefer to or may find it difficult to return to Singapore to be vaccinated. We have therefore launched two dedicated vaccination channels recently to make it more convenient for overseas Singaporeans, including our Singaporean students studying abroad, to return to Singapore for vaccination while minimising the time they are required to spend in SHN. As of 31 October 2021, we have received close to 250 successful sign-ups from overseas Singaporeans."
2021-11-03-T-024-S-00734,2021-11-03-T-024,734,Vivian Balakrishnan,"Throughout the COVID-19 pandemic, our Overseas Missions have pro-actively and regularly engaged Singaporean student communities to address their COVID-19 concerns and provided consular assistance to them if required. Our Overseas Missions have provided support and guidance to students who have contracted COVID-19 abroad or had to self-isolate due to being close contacts or from travelling. Such support includes keeping their next-of-kin in Singapore updated of their situation, and connecting the affected individuals with relevant student support groups for the provision of meals and medical supplies."
2021-11-03-T-024-S-00735,2021-11-03-T-024,735,Vivian Balakrishnan,"These regular engagements with our overseas Singaporean student community enabled our Missions to address in a timely manner any concerns raised by our students overseas and keep them abreast of the latest COVID-19 information so that they could remain safe and informed of public health and safety requirements, as well as developments in both their resident countries and Singapore. In view of the pandemic, Missions and the Singapore Global Network have increasingly leveraged social media platforms such as Facebook, Twitter, Instagram and Whatsapp, as well as local social media platforms like Weibo, to address students’ COVID-19 concerns, including their queries related to travel and border measures. MFA will continue to prioritise such regular engagement and the provision of timely consular assistance and advice to Singaporean students abroad, to ensure their safety and well-being. Once again, we will urge all Singaporean students abroad to e-register with MFA if they have not already done so."
2021-11-03-T-025-S-00736,2021-11-03-T-025,736,Louis Ng Kok Kwang,asked the  Minister for National Development
2021-11-03-T-025-S-00737,2021-11-03-T-025,737,Desmond Lee,"Smoking in one’s flat may cause nuisance and health concerns to neighbours if cigarette smoke wafts into their homes. While this is covered by the covenant referred to by the Member, enforcing the breach of a covenant under the lease entails compulsory acquisition of the flat. This is a harsh measure that is not undertaken lightly. HDB exercises the right of compulsory acquisition sparingly and often as a last resort. Moreover, should a flat be compulsorily acquired, the flat owners and occupants of the flat, such as their family members, will need to relocate and find a home elsewhere. If the underlying issues are not resolved, the issue will just be brought over to another community."
2021-11-03-T-025-S-00738,2021-11-03-T-025,738,Desmond Lee,"Hence, the approach to manage disamenities and disputes between neighbours is for neighbours to come together to try to resolve the matter amicably. When residents provide feedback to agencies on second-hand tobacco smoke issues, HDB, together with Town Councils and the National Environment Agency, will first encourage neighbours to speak to each other to try to resolve the matter. Where necessary, a Joint Advisory on Smoking in Homes will be issued to the residential unit reported to be emitting second-hand smoke, encouraging considerate behaviour and emphasising the negative impact that second-hand smoke may have on their neighbours."
2021-11-03-T-025-S-00739,2021-11-03-T-025,739,Desmond Lee,"If this does not work, the agencies will advise the affected neighbour to seek mediation. In intractable cases, the affected neighbour may file a case with the Community Disputes Resolution Tribunal (CDRT). If the respondent is shown to have caused unreasonable interference to the affected neighbour, then the CDRT may make a range of orders against the respondent, including requiring the respondent to cease or refrain from carrying out certain acts."
2021-11-03-T-026-S-00740,2021-11-03-T-026,740,Cheryl Chan Wei Ling,asked the  Minister for Health
2021-11-03-T-026-S-00741,2021-11-03-T-026,741,Ong Ye Kung,"In a pandemic crisis, Government has extended full subsidies for nationally recommended vaccinations, including boosters, that offer protection against COVID-19. As we progressively transit to living with COVID-19 as an endemic disease, we will monitor the global and local situation, and periodically review the need for booster doses of COVID-19 vaccinations, and whether they should remain fully subsidised."
2021-11-03-T-027-S-00742,2021-11-03-T-027,742,Zhulkarnain Abdul Rahim,asked the  Minister for Home Affairs
2021-11-03-T-027-S-00743,2021-11-03-T-027,743,K Shanmugam,"The case mentioned by the Member involved an inmate who was assaulted by two other inmates at the Changi Prison Complex. The victim was waiting in the medical centre for his medical review. He was suddenly assaulted by two other inmates who were in the same room. A prison officer who was in the monitoring room saw the assault and responded with two other officers within 20 seconds, and stopped the assault. The two inmates who had assaulted the victim have been charged in Court. One has been sentenced, and the other is pending sentencing."
2021-11-03-T-027-S-00744,2021-11-03-T-027,744,K Shanmugam,"The Singapore Prison Service (SPS) has measures in place to try to prevent assault incidents from occurring, and to respond swiftly when they do."
2021-11-03-T-027-S-00745,2021-11-03-T-027,745,K Shanmugam,"First, Prison officers actively look out for signs of conflict between inmates. Inmates are also informed that they can approach staff if they encounter any issues or fear for their safety."
2021-11-03-T-027-S-00746,2021-11-03-T-027,746,K Shanmugam,"Second, inmates who are assessed to be of higher risk of violence undergo programmes to address their violent behaviours."
2021-11-03-T-027-S-00747,2021-11-03-T-027,747,K Shanmugam,"Third, SPS leverages technology to detect incidents and intervene swiftly. SPS is expanding its use of surveillance cameras to monitor all areas which inmates have access to. SPS is also using video analytics to detect abnormal or aggressive behaviours. When this capability is fully in place, officers can be alerted and respond to suspected fights, medical emergencies or suicidal behaviour, even quicker."
2021-11-03-T-027-S-00748,2021-11-03-T-027,748,K Shanmugam,"SPS takes incidents of assault very seriously, and will continue to review and enhance its operational capabilities to deter inmates from committing assault, and to be able to swiftly detect and respond."
2021-11-03-T-028-S-00749,2021-11-03-T-028,749,Mariam Jaafar,"asked the Minister for Social and Family Development in light of the increase in job losses among middle-income PMETs, whether the Ministry will review social assistance schemes, in particular the treatment of debt such as renovation loans and insurance payments as expenses."
2021-11-03-T-028-S-00750,2021-11-03-T-028,750,Masagos Zulkifli B M M,"The Government has introduced various measures to help Singaporeans cope with the impact of COVID-19. To protect workers and save jobs, we introduced the Jobs Support Scheme and Jobs Growth Incentive to help firms retain and hire Singaporeans, and the SGUnited Jobs and Skills Package to help them access job and training opportunities."
2021-11-03-T-028-S-00751,2021-11-03-T-028,751,Masagos Zulkifli B M M,"In addition, the COVID-19 Recovery Grant (CRG) supports lower- to middle-income resident employees and self-employed persons who, as a result of the economic impact of COVID-19, are involuntarily unemployed, or are experiencing involuntary no-pay leave or significant income loss for at least three consecutive months. The CRG assistance provides temporary support while these individuals actively search for new job or training opportunities."
2021-11-03-T-028-S-00752,2021-11-03-T-028,752,Masagos Zulkifli B M M,"Households facing financial difficulties can approach our Social Service Offices (SSOs), who will assess their needs and circumstances, and provide ComCare assistance if they meet the criteria. ComCare beneficiaries receive comprehensive support that includes cash assistance to help the family meet the income shortfall for their daily living expenses on basic needs, such as food, transport, and communications. Depending on the household’s needs, they may also receive free medical treatment at public healthcare institutions and be referred to relevant government agencies or our community partners for further support."
2021-11-03-T-028-S-00753,2021-11-03-T-028,753,Masagos Zulkifli B M M,"However, the ComCare cash assistance provided does not cover loans or instalment payments, which will vary depending on the household’s financial decisions and use of credit. Such payments also generally contribute towards the building of personal assets, which would not be appropriate for the Government to fund via public resources. Our social assistance schemes therefore prioritise support for daily living expenses instead."
2021-11-03-T-028-S-00754,2021-11-03-T-028,754,Masagos Zulkifli B M M,"Nonetheless we understand the pressures that families with debts face, and our SSOs will support ComCare beneficiaries with outstanding loans or instalment payments to take steps towards regaining financial stability. For instance, we will refer families with debts to relevant debt advisory services like Credit Counselling Singapore, where personal financial counsellors will guide them on the possible courses of action to manage and reduce their debts. Depending on their circumstances, the families may also receive further assistance to negotiate and/or restructure unsecured loans, so that they can make monthly repayments at reduced interest rates which they can afford. The families will also have access to financial literacy classes to equip themselves with financial planning skills such as budgeting, and support groups where they can seek peer advice."
2021-11-03-T-028-S-00755,2021-11-03-T-028,755,Masagos Zulkifli B M M,"The Government will continue to regularly review the coverage and support quantum of our various measures, to ensure that Singaporeans are supported in meeting their needs."
2021-11-03-T-029-S-00756,2021-11-03-T-029,756,Shawn Huang Wei Zhong,asked the  Minister for Trade and Industry
2021-11-03-T-029-S-00757,2021-11-03-T-029,757,Gan Kim Yong,"Manpower shortages in the construction sector have adversely affected the pace of construction activities and dampened output in the sector. In the first three quarters of 2021, the real value-added of the construction sector was 25 per cent below its pre-pandemic level in the same period of 2019."
2021-11-03-T-029-S-00758,2021-11-03-T-029,758,Gan Kim Yong,"Notwithstanding the resulting delays in construction projects, the overall economy has remained resilient. In the first three quarters of 2021, the real GDP of the Singapore economy had recovered to 0.6 per cent above its level in the same period of 2019, supported by the strong performance of outward-oriented sectors such as manufacturing, finance and insurance."
2021-11-03-T-029-S-00759,2021-11-03-T-029,759,Gan Kim Yong,"The Government recognises the challenges faced by the construction sector, and has implemented several measures to alleviate the tight manpower situation in the sector. These include making it easier for construction firms to retain their existing workers, and helping them to bring in new workers. Firms in the sector have also taken the lead to bring in more workers safely through a tightened end-to-end process. The Government remains committed to working with firms in the sector to meet the manpower needs of key ongoing projects."
2021-11-03-T-030-S-00760,2021-11-03-T-030,760,Mariam Jaafar,asked the  Minister for Sustainability and the Environment
2021-11-03-T-030-S-00761,2021-11-03-T-030,761,Grace Fu Hai Yien,"From October 2020 to September 2021, the National Environment Agency (NEA) received an average of 23 construction noise-related complaints each month from residents in Woodlands."
2021-11-03-T-030-S-00762,2021-11-03-T-030,762,Grace Fu Hai Yien,"NEA adopts an outcome-based approach in regulating construction noise. Construction sites must adhere to the regulatory noise limits, and noise meters are installed at the nearest affected premises to monitor compliance."
2021-11-03-T-030-S-00763,2021-11-03-T-030,763,Grace Fu Hai Yien,"Under the no-work rule, construction work on Sundays and public holidays is prohibited at sites located within 150 metres of any hospital, home for the aged sick or residential building. From 1 October 2022, contractors that have contravened the no-work rule will be required to install electronic video surveillance systems to ensure compliance and deter further violations."
2021-11-03-T-030-S-00764,2021-11-03-T-030,764,Grace Fu Hai Yien,"There are incentives to encourage the construction industry to adopt quieter construction equipment and methods, such as quieter piling and hacking equipment, noise barriers and enclosures. Since April 2014, NEA has disbursed a total of $8.3 million to help contractors adopt quieter construction equipment and methods."
2021-11-03-T-030-S-00765,2021-11-03-T-030,765,Grace Fu Hai Yien,"The Building and Construction Authority has been actively championing the adoption of Design for Manufacturing and Assembly technologies, which shifts as much on-site construction activities to off-site prefabrication as possible. Construction becomes faster, cleaner, quieter and of higher quality. Dis-amenities such as noise and dust pollution will be reduced, and construction time can be shortened."
2021-11-03-T-031-S-00766,2021-11-03-T-031,766,Louis Ng Kok Kwang,asked the  Minister for Health
2021-11-03-T-031-S-00767,2021-11-03-T-031,767,Ong Ye Kung,"The Ministry of Health (MOH) has received appeals from couples who were unable to continue their assisted reproduction (AR) treatment overseas due to the COVID-19 travel restrictions, and seeking to import their stored gametes or embryos for treatment in Singapore instead. To support these couples, the Ministry established a process for such appeals to be submitted by the AR practitioners on behalf of their patients. This allows MOH to review such requests expeditiously and facilitate the importation of the gametes/embryos where appropriate."
2021-11-03-T-031-S-00768,2021-11-03-T-031,768,Ong Ye Kung,"Fully vaccinated couples may use the Vaccinated Travel Lanes (VTLs) to travel overseas to continue their AR treatment in these countries. Couples travelling to countries where no VTL arrangement has been set up will be subject to the quarantine requirements both abroad and locally. Alternatively, they may write in to MOH for us to review their request to import their gametes/embryos and continue with treatment locally."
2021-11-03-T-032-S-00769,2021-11-03-T-032,769,Jamus Jerome Lim,asked the  Minister for Manpower
2021-11-03-T-032-S-00770,2021-11-03-T-032,770,Tan See Leng,"The Member may be aware that since he filed the question, the Ministry of Health (MOH) has lifted travel restrictions on several non-traditional source countries such as Bangladesh, India, Myanmar and Sri Lanka, where many of our migrant workers (MWs) in the Construction, Marine Shipyard and Process (CMP) sectors come from."
2021-11-03-T-032-S-00771,2021-11-03-T-032,771,Tan See Leng,"As I have mentioned in this House on 1 November 2021, we have resumed entry approvals for MWs from CMP sectors to enter Singapore in a safe and calibrated manner from 1 November 2021, on the condition that they must be fully vaccinated before arrival. Firms in the CMP sectors who need their workers urgently may consider on-going initiatives in their industries to bring in workers safely with tightened end-to-end safe management processes. Workers can enter without proof of vaccination provided they complete the full vaccination regime within two months after arrival."
2021-11-03-T-032-S-00772,2021-11-03-T-032,772,Tan See Leng,"Given the evolving nature of the regional COVID-19 situation, any changes to entry restrictions will depend on the prevailing situation."
2021-11-03-T-033-S-00773,2021-11-03-T-033,773,Louis Ng Kok Kwang,asked the  Minister for Education
2021-11-03-T-033-S-00774,2021-11-03-T-033,774,Chan Chun Sing,"MOE consciously ensures that we minimise loss of curriculum time and minimise inconvenience for parents without alternative caregiving arrangements. Aside from 12 weeks of school holidays per year, primary school students are notified in advance and do not report to school for another 12 days for PSLE marking, PSLE Oral and Listening Comprehension Examinations, school exam results processing and significant school events such as parent-teachers conference."
2021-11-03-T-033-S-00775,2021-11-03-T-033,775,Chan Chun Sing,Schools may dismiss students earlier on the eve of events such as National Day and Children’s Day. There are four such events in a year.
2021-11-03-T-033-S-00776,2021-11-03-T-033,776,Chan Chun Sing,"For all these days, school-based student care centres remain open for students."
2021-11-03-T-034-S-00777,2021-11-03-T-034,777,Cheryl Chan Wei Ling,asked the  Minister for Manpower
2021-11-03-T-034-S-00778,2021-11-03-T-034,778,Tan See Leng,The tripartite partners have issued an advisory on Mental Well-Being at Workplaces to help employers identify and implement initiatives to support their employees’ mental well-being.
2021-11-03-T-034-S-00779,2021-11-03-T-034,779,Tan See Leng,"Most of the recommendations in the advisory can be adopted at little to no cost. For example, companies are already required to undertake risk assessment. The advisory advises them to incorporate mental well-being in these regular risk assessments. iWorkHealth is an online, self-administered psychosocial health assessment tool to identify common workplace stressors. It is provided free. Other recommendations such as encouraging more open and regular conversations on mental well-being and form informal support networks amongst employees likewise do not cost much to the company, but still giving due attention to employees’ mental well-being in the workplace."
2021-11-03-T-034-S-00780,2021-11-03-T-034,780,Tan See Leng,"In addition, the Workplace Safety and Health (WSH) Council and Health Promotion Board (HPB) have outreach programmes that include mental well-being support. These too, are offered to SMEs free or at highly subsidised rates. Under the Total WSH Programme, providers work with companies to run interventions to address the safety and health gaps holistically, where mental well-being topics are included. Similarly, HPB’s Workplace Outreach Wellness (WOW) package includes mental well-being programmes that strengthen workplace support for employees and help employees manage stress as well as build mental resilience."
2021-11-03-T-034-S-00781,2021-11-03-T-034,781,Tan See Leng,"With the range of free or highly subsidised services, as well as the simplicity of the interventions themselves, there is really no reason for any firm, whether large or small, to wait for some metric or indicator of distress before attending to their employees’ mental wellness."
2021-11-03-T-035-S-00782,2021-11-03-T-035,782,Patrick Tay Teck Guan,"asked the Minister for Manpower from 2020 to 30 September 2021, what is the number of work injury claims for each year that were (i) filed (ii) paid compensations and (iii) rejected, where the employee sustained the injury whilst working from home."
2021-11-03-T-035-S-00783,2021-11-03-T-035,783,Tan See Leng,"Since the start of Circuit Breaker in April 2020, 53 work injury claims have been filed for injuries sustained by employees while working from home. Thirty-two have been admitted as work injuries and three are being assessed. The rest of the claims were not awarded compensation, for various reasons such as the injury being sustained while performing non-work activities at home."
2021-11-03-T-036-S-00784,2021-11-03-T-036,784,Mariam Jaafar,asked the  Minister for Education
2021-11-03-T-036-S-00785,2021-11-03-T-036,785,Chan Chun Sing,"Out of the total enrolment in our government and government-aided schools, around 9% are permanent residents and 4% are international students."
2021-11-03-T-036-S-00786,2021-11-03-T-036,786,Chan Chun Sing,"A very small minority of these students have at least one Singaporean parent. While these students, being non-citizens, do not have access to the MOE Financial Assistance Scheme, they can approach their schools for assistance if needed. MOE will assess their situation and extend support on a case-by-case basis. There are currently about 400 such students being provided with such support."
2021-11-03-T-037-S-00787,2021-11-03-T-037,787,Shahira Abdullah,asked the  Minister for Health
2021-11-03-T-037-S-00788,2021-11-03-T-037,788,Ong Ye Kung,"In all cases where Police have been notified of a death, including when the person is believed to have died by suicide, the Police will inform the deceased’s next-of-kin of the death as soon as reasonably practicable. When attending to death cases, the Police may activate relevant support personnel from Social Service Agencies such as Samaritans of Singapore (SOS) who will then reach out to next-of-kin or loved ones in providing emotional support to the grieving family. SOS may also arrange counselling support for next-of-kin who need and wish to receive additional support. In addition to SOS, individuals can also approach counselling centres and other support groups for support."
2021-11-03-T-037-S-00789,2021-11-03-T-037,789,Ong Ye Kung,"For suicide cases involving students in schools and Institutes of Higher Learning (IHLs), relevant trained school personnel will identify those who may be emotionally affected, and provide the appropriate support according to their needs. Teachers and staff will continue to monitor the well-being of students, and provide guidance and support. For students who require additional targeted support, they will be referred to the in-house counsellors and/or mental health professionals in the community and hospitals. Schools and IHLs also receive support by specialist teams from MOE and other agencies to render support to affected students and staff when needed."
2021-11-03-T-037-S-00790,2021-11-03-T-037,790,Ong Ye Kung,"The Interagency Taskforce on Mental Health and Well-being will be conducting a public consultation for the National Mental Health and Well-being Strategy that is being developed by the Taskforce, and could look into how the deceased’s next-of-kin may be better supported."
2021-11-03-T-038-S-00791,2021-11-03-T-038,791,Melvin Yong Yik Chye,asked the  Minister for Trade and Industry
2021-11-03-T-038-S-00792,2021-11-03-T-038,792,Gan Kim Yong,"Since the Competition and Consumer Commission of Singapore (CCCS) took on the function of administering the Consumer Protection (Fair Trading) Act in 2018, it has investigated an average of about five cases per year for alleged infringements of the Act."
2021-11-03-T-038-S-00793,2021-11-03-T-038,793,Gan Kim Yong,"The industry breakdown varies from year to year. Of the cases investigated since 2018, half were from the Beauty Services industry. A further 30% were retailers of consumer goods. The remaining 20% were from other industries including F&B, travel and medical consumables."
2021-11-03-T-039-S-00794,2021-11-03-T-039,794,Yip Hon Weng,asked the  Minister for Health
