speech_id,topic_id,speech_order,member_name,text
2021-11-03-T-015-S-00178,2021-11-03-T-015,178,Speaker,Mr Melvin Yong.
2021-11-03-T-015-S-00179,2021-11-03-T-015,179,Melvin Yong Yik Chye,"Thank you, Mr Speaker. I thank the Minister of State for his reply. I have two supplementary questions. First, can the Minister of State share what are the top three most frequent traffic violations committed by these heavy vehicles. According to MOM's mid-year workplace safety and health statistics, vehicular accidents were the top cause of workplace deaths for the first half of 2021."
2021-11-03-T-015-S-00180,2021-11-03-T-015,180,Melvin Yong Yik Chye,"In September, I filed a Parliamentary Question to ask about the yearly breakdown of the almost 20,000 speeding violations by lorries in the past five years and found that speeding cases were rising annually up until last year when COVID-19 resulted in a halt to many economic activities. Clearly, employers are putting their workers' lives at risk when ferrying them at the back of lorries especially when some of these lorry drivers have the propensity to speed and it could be down to just sheer luck that there has not been even more fatalities on our roots."
2021-11-03-T-015-S-00181,2021-11-03-T-015,181,Melvin Yong Yik Chye,"Therefore, I would like to ask whether MHA would reconsider some of my proposals to add a speed limiter to all lorries much as how we have already done in heavy vehicles today and whether there could be a review on having dedicated transport for workers instead of having the workers co-mingle with goods at the back of the lorries."
2021-11-03-T-015-S-00182,2021-11-03-T-015,182,Dr Muhammad Faishal Ibrahim,"Sir, I thank the Member for his supplementary questions. With regard to his suggestion about speed limiters as well as the lorries, the Government will bring this back and take a look at these suggestions."
2021-11-03-T-015-S-00183,2021-11-03-T-015,183,Dr Muhammad Faishal Ibrahim,"With regard to the breakdown of the top three most frequent traffic violation committed by heavy vehicles, indeed, number one is speeding, number two is red light running and number three is careless driving."
2021-11-03-T-015-S-00184,2021-11-03-T-015,184,Speaker,Order. End of Question Time. The Clerk will now proceed to read the Orders of the day.
2021-11-03-T-015-S-00185,2021-11-03-T-015,185,Speaker,"[Pursuant to Standing Order No 22(3), Written Answers to Question Nos 18-24, 26-31 and 33-50 on the Order Paper are reproduced in the Appendix. Question Nos 25 and 32 have been postponed to the next available sitting of Parliament.]"
2021-11-03-T-016-S-00186,2021-11-03-T-016,186,,[(proc text) Order for Second Reading read. (proc text)]
2021-11-03-T-016-S-00187,2021-11-03-T-016,187,Lawrence Wong,"Mr Speaker, I beg to move, ""That the Bill be now read a Second time""."
2021-11-03-T-016-S-00188,2021-11-03-T-016,188,Lawrence Wong,"Sir, earlier this year, this House debated and passed the Significant Infrastructure Government Loan Act, or SINGA for short, to reactivate Government borrowing for financing nationally significant infrastructure, subject to strict safeguards."
2021-11-03-T-016-S-00189,2021-11-03-T-016,189,Lawrence Wong,"The borrowings under SINGA are clearly distinguishable from a separate category of Government borrowing for non-spending purposes under the Local Treasury Bills Act, or LTBA, and the Government Securities Act, or the GSA."
2021-11-03-T-016-S-00190,2021-11-03-T-016,190,Lawrence Wong,"The LTBA and the GSA allow the Government to borrow, not for spending, but for specific purposes, such as market development and meeting the investment needs of the Central Provident Fund. To emphasise, the proceeds from such borrowings cannot be spent by the Government."
2021-11-03-T-016-S-00191,2021-11-03-T-016,191,Lawrence Wong,"So, to delineate between the two types of borrowing in legislation, the borrowings which are done under SINGA for SINGA projects and borrowings which cannot be spent, this Bill before the House seeks to merge the LTBA into the GSA, and to streamline our legislation on Government borrowings. This will help to provide better clarity on the profile of the Government's debt."
2021-11-03-T-016-S-00192,2021-11-03-T-016,192,Lawrence Wong,Let me share some background on the LTBA and the GSA.
2021-11-03-T-016-S-00193,2021-11-03-T-016,193,Lawrence Wong,"The LTBA authorises the issuance of Treasury Bills to develop the domestic short-term debt market and to meet market demand for short-term Government debt securities. The GSA authorises the issuance of longer-tenor securities, like the Singapore Government Securities, or SGS, to develop the domestic debt market and meet the investment needs of the Central Provident Fund."
2021-11-03-T-016-S-00194,2021-11-03-T-016,194,Lawrence Wong,"Both the LTBA and the GSA expressly provide that the proceeds of borrowings raised are to be paid into the Government Securities Fund. This is an important safeguard, because the monies in the Government Securities Fund can only be invested. This is why the monies raised under the LTBA and GSA cannot be used to finance the Government's spending needs."
2021-11-03-T-016-S-00195,2021-11-03-T-016,195,Lawrence Wong,"While the LTBA and GSA were introduced separately with different processes, the Government has gradually harmonised the treatment of Treasury Bills and SGS over the years."
2021-11-03-T-016-S-00196,2021-11-03-T-016,196,Lawrence Wong,"For example, the LTBA was amended in 1996 to account for the proceeds and expenditures of Treasury Bills under the Government Securities Fund, instead of the Consolidated Fund, similar to Government securities in the GSA."
2021-11-03-T-016-S-00197,2021-11-03-T-016,197,Lawrence Wong,"In 2001, the minimum denomination for Treasury Bills of $10,000 was revised downwards to $1,000 to facilitate greater retail participation, similar to that for tradable securities under the GSA."
2021-11-03-T-016-S-00198,2021-11-03-T-016,198,Lawrence Wong,"And in 2004, the GSA was amended to change the borrowing limit of Government securities issued from a gross to a net limit for a more meaningful measure of Government's liabilities, similar to that for Treasury Bills under the LTBA."
2021-11-03-T-016-S-00199,2021-11-03-T-016,199,Lawrence Wong,"So, given the overlaps in purpose and the harmonisation of treatment of securities under both Acts, this Bill is therefore introduced to merge the LTBA into the GSA."
2021-11-03-T-016-S-00200,2021-11-03-T-016,200,Lawrence Wong,"The Government Securities Act will be renamed as the Government Securities (Debt Market and Investment) Act, which I will refer to as the renamed GSA for short, to reflect this consolidation within the name of the Act."
2021-11-03-T-016-S-00201,2021-11-03-T-016,201,Lawrence Wong,The renamed GSA will provide for the issuance of Treasury Bills and the existing LTBA will be repealed.
2021-11-03-T-016-S-00202,2021-11-03-T-016,202,Lawrence Wong,The changes introduced through this Bill are largely administrative in nature with no change to the substance of the individual Acts.
2021-11-03-T-016-S-00203,2021-11-03-T-016,203,Lawrence Wong,"There is no change to the provision, limiting the use of monies in the Government Securities Fund from being used solely for investment purposes. Therefore, the monies raised under the Bill cannot be used for spending."
2021-11-03-T-016-S-00204,2021-11-03-T-016,204,Lawrence Wong,"With the merger of the Acts, the current borrowing limits under the LTBA and GSA, which are $105 billion and $960 billion respectively, will be combined to form a single borrowing limit of $1,065 billion under the renamed GSA. There is no change to the overall borrowing limit."
2021-11-03-T-016-S-00205,2021-11-03-T-016,205,Lawrence Wong,"As is the practice today, the Monetary Authority of Singapore (MAS) will continue to calibrate Treasury Bill and SGS issuances based on market development needs. And to ensure transparency, MAS will continue to publish the breakdown of outstanding SGS and Treasury Bills."
2021-11-03-T-016-S-00206,2021-11-03-T-016,206,Lawrence Wong,There is also no change to the existing features and outstanding issuances of Treasury Bills and Government Securities issued under the LTBA and the GSA. The outstanding Treasury Bills will be automatically subsumed under the renamed GSA.
2021-11-03-T-016-S-00207,2021-11-03-T-016,207,Lawrence Wong,"Besides the merging of LTBA into the GSA, this Bill will also repeal borrowing provisions in other Acts that are no longer necessary."
2021-11-03-T-016-S-00208,2021-11-03-T-016,208,Lawrence Wong,"Specifically, the Bill will repeal the External Loans Act and Treasury Deposit Receipts Act, as well as borrowing provisions in the Developmental Investment Fund Act."
2021-11-03-T-016-S-00209,2021-11-03-T-016,209,Lawrence Wong,"There are no outstanding borrowings under these Acts. So, with the SINGA and renamed GSA, the Government does not foresee the need to borrow under these Acts."
2021-11-03-T-016-S-00210,2021-11-03-T-016,210,Lawrence Wong,"The Constitution and other acts, such as the MAS Act will be amended to substitute references to LTBA and GSA with the renamed GSA, and remove references to the External Loans Act. The amendments to the Constitution will be raised by the Minister for Law after this."
2021-11-03-T-016-S-00211,2021-11-03-T-016,211,Lawrence Wong,"We have consulted the President on both this Bill and the amendments to the Constitution, as they provide for the raising of loans by the Government and a single borrowing limit for Government securities and Treasury Bills. The President is supportive of the Bills."
2021-11-03-T-016-S-00212,2021-11-03-T-016,212,Lawrence Wong,"Mr Speaker, let me conclude. This Bill consolidates various pieces of legislation on Government borrowings for specific non-spending purposes into a single legislation under the renamed GSA."
2021-11-03-T-016-S-00213,2021-11-03-T-016,213,Lawrence Wong,"Going forward, the Government will rely on the renamed GSA to borrow for specific non-spending purposes and the SINGA to borrow for spending on nationally significant infrastructure."
2021-11-03-T-016-S-00214,2021-11-03-T-016,214,Lawrence Wong,"We will ensure that the borrowings for spending and non-spending purposes are transparent and clearly differentiated in the processes for the issuances of securities, reporting and public communications. For example, the new SGS issued for infrastructure financing has been named as SGS(Infrastructure) bonds and the existing SGS bonds renamed as SGS(Market Development) bonds to reflect the different purposes of borrowing."
2021-11-03-T-016-S-00215,2021-11-03-T-016,215,Lawrence Wong,"And again, I would like to emphasise that the Singapore Government has a strong balance sheet with no net debt. Borrowings for non-spending purposes, which will be consolidated under the renamed GSA in this Bill, will continue to make up the majority of Singapore Government's borrowings. Through this Bill, we will provide greater clarity on the Government's debt profile. Sir, I beg to move."
2021-11-03-T-016-S-00216,2021-11-03-T-016,216,Lawrence Wong,[(proc text) Question proposed. (proc text)]
2021-11-03-T-016-S-00217,2021-11-03-T-016,217,Speaker,Mr Liang Eng Hwa.
2021-11-03-T-016-S-00218,2021-11-03-T-016,218,Liang Eng Hwa,"Mr Speaker, I wish to declare my interest that I work in a financial institution which trade and transaction in securities, including Government securities."
2021-11-03-T-016-S-00219,2021-11-03-T-016,219,Liang Eng Hwa,"Sir, the Government has issued more debts over the year, largely for investments, and also to develop the bond market and to manage the CPF monies."
2021-11-03-T-016-S-00220,2021-11-03-T-016,220,Liang Eng Hwa,"Earlier this year, the House has also passed the Significant Infrastructure Government Loan Act (SINGA) in which the proceeds raised can only be used to fund major and very long-term key infrastructures."
2021-11-03-T-016-S-00221,2021-11-03-T-016,221,Liang Eng Hwa,"So, the Government's balance sheet has indeed expanded and hence, it does make good sense do some ""housekeeping"" to the various Government borrowing legislations, and in particular, this Bill to consolidate the GSA and LTBA as well as make consequential amendments and repeals to the other Acts."
2021-11-03-T-016-S-00222,2021-11-03-T-016,222,Liang Eng Hwa,"Sir, notwithstanding my support, I have three questions for the Minister."
2021-11-03-T-016-S-00223,2021-11-03-T-016,223,Liang Eng Hwa,"Firstly, can I use this opportunity to seek an update on the outstanding amount of securities that the Government issued under the GSA and the LTBA?"
2021-11-03-T-016-S-00224,2021-11-03-T-016,224,Liang Eng Hwa,"Secondly, clause 14 of the Act merge the two borrowing limits, the GSA and the LBTA, into a single borrowing limit of $1.065 trillion. Can I ask the Minister for the basis of this change?"
2021-11-03-T-016-S-00225,2021-11-03-T-016,225,Liang Eng Hwa,The reasons for my question are as follows.
2021-11-03-T-016-S-00226,2021-11-03-T-016,226,Liang Eng Hwa,"Firstly, SGS are long-dated debts greater than one year, while the Treasury Bills tends to be just a few months to a year. Both debts come with different tenures, repayment obligations. The Treasury Bills tend to be more liquid in the trading markets because it is shorter dated. Hence, from the credit market standpoint, the two debts, say, the three-month Treasury Bill versus 20-year SGS would be accorded with different risk ratings."
2021-11-03-T-016-S-00227,2021-11-03-T-016,227,Liang Eng Hwa,Does MOF see the need to retain this separate borrowing limits for these two buckets of issuances given that they both have different risk profile?
2021-11-03-T-016-S-00228,2021-11-03-T-016,228,Liang Eng Hwa,"My third question is, the main bulk of the securities issued by the Government is the Special Singapore Government Securities (SSGS) which I believe account for about over 70% of the SGS. This is issued to CPF Board so that the Government can pay the bond coupon rates to the CPF members, which match the interest that CPF members receive. These bonds are not traded in the market and are directly placed with CPF. Hence, this is not for the purpose of creating high quality liquid assets for the financial institutions or to build a domestic risk-free yield curve, as opposed to the purpose of SGS."
2021-11-03-T-016-S-00229,2021-11-03-T-016,229,Liang Eng Hwa,"Because of its sheer size, this SSGS, and that it will continue to grow in tandem with higher wages and growth in our resident workforce, we can expect the SSGS to get even more sizeable as the CPF savings increase."
2021-11-03-T-016-S-00230,2021-11-03-T-016,230,Liang Eng Hwa,"As the SSGS is aggregated with the SGS, the overall debt level of the Government will come across as very high relative to our GDP and give the impression that a lot more SGS is issued or traded in the market."
2021-11-03-T-016-S-00231,2021-11-03-T-016,231,Liang Eng Hwa,"These CPF related issuances, the SSGS, are also not invested by external investors because it is hold by the CPF Board, and its size of issuance and coupon rates therefore do not have any impact on the Singapore bond market nor its liquidity."
2021-11-03-T-016-S-00232,2021-11-03-T-016,232,Liang Eng Hwa,"Hence, I would suggest that MOF consider classifying these private placed securities which it privately placed to CPF Board as CPF Bond rather than called it the SGS, and it should come under a separate borrowing limit and, of course, to be approved by Parliament and the President."
2021-11-03-T-016-S-00233,2021-11-03-T-016,233,Liang Eng Hwa,"These would give greater clarity to the market participants and analysts on the level of the borrowing by the Government. Sir, notwithstanding my queries, I support the technical amendments in this Bill."
2021-11-03-T-016-S-00234,2021-11-03-T-016,234,Speaker,Assoc Prof Jamus Lim.
2021-11-03-T-016-S-00235,2021-11-03-T-016,235,Jamus Jerome Lim,"Mr Speaker, I understand that the stipulations in the Government Borrowing (Miscellaneous Amendments) Bill, are of a largely technical nature, aiming to repeal various mostly spent acts, and to consolidate any borrowing by the Government across sectors. This is fairly obscure, so obscure, in fact, that I noticed that, initially, I was the only Member slated to speak on this but evidently, two others have since found this topic similarly irresistible."
2021-11-03-T-016-S-00236,2021-11-03-T-016,236,Jamus Jerome Lim,"I favour such simplification and I do not have substantive concerns about the specificities in the proposed amendments. I do wish, however, to make a few points that I think have more to do with potentially unintended consequences of the current iteration of the Bill. These have to do with the debt limit precluding the acceptance of advance deposits by the MAS for Treasury Bills and the lack of justification for rejecting sales."
2021-11-03-T-016-S-00237,2021-11-03-T-016,237,Jamus Jerome Lim,"The first point worth noting is that clause 14 with the Bill proposes to set the borrowing limit for Government loans at $1.065 trillion, which represents the combined limits of $960 billion for the Government securities and $105 billion Treasury Bills that currently exists under two separate Acts. This new limit may then be increased by Parliamentary resolution, which simplifies, since logically, all forms of debt, whether short-term or long-term should, of course, be treated as a component of the overall liability picture and, hence, subject to the same form of debt ceiling discipline."
2021-11-03-T-016-S-00238,2021-11-03-T-016,238,Jamus Jerome Lim,"Given this observation, would it not also make sense to enfold remaining instruments under Government borrowing, such as single bonds issued under the Significant Infrastructure Government Loan Act to the same limit? I understand, of course, as Minister Wong has mentioned that this is, in fact, a separate accounting convention."
2021-11-03-T-016-S-00239,2021-11-03-T-016,239,Jamus Jerome Lim,"This limit, to be clear, is relatively small, at $90 billion and there is a clear benefit through consolidating under one roof, which is that a consolidated limit would simplify monitoring and allow fiscal policy-makers to ultimately focus on the single figure."
2021-11-03-T-016-S-00240,2021-11-03-T-016,240,Jamus Jerome Lim,"So, the natural objection, of course, is this, is that the Government maintains these separate limits for debt that serve developmental objectives, such as infrastructure, which is the case for SINGA versus those issued under risk transfer and investment purposes for the purposes of CPF funds as mentioned earlier, or to fulfil liquidity and debt functions."
2021-11-03-T-016-S-00241,2021-11-03-T-016,241,Jamus Jerome Lim,"MOF has steadfastly held that all these require separate limit accounts. But from the perspective of understanding the underlying economics, all monies is ultimately fungible and it is unclear why debt issued under one type of accounting constraint cannot subsequently be redeployed to other functions so long as it is only a matter of protocol, rather than one entrenched in actual legislation that prevents subsequent transfer."
2021-11-03-T-016-S-00242,2021-11-03-T-016,242,Jamus Jerome Lim,"Of course, such deviations need not occur under this Government but it could easily occur under another perhaps more profligate one. Hence, even if we did wish to maintain separate debt ceilings for the purposes of accounting, perhaps it may be worth nevertheless incorporating these distinct limits into this Bill."
2021-11-03-T-016-S-00243,2021-11-03-T-016,243,Jamus Jerome Lim,"This is especially the case since insofar as financial markets are concerned, they view the consolidated Government balance sheet as a whole, as they should. Indeed, SINGA bonds do not appear to have affected the Singapore Government's overall credit rating, which is yet another economic reason to not hive off such limits for the instrument."
2021-11-03-T-016-S-00244,2021-11-03-T-016,244,Jamus Jerome Lim,"Concomitantly, it is also important to calibrate the frequency with which this limit is modified. While fiscal rules such as a reasonable debt limit have been used in many countries and can play an important role in ensuring the sustainability of fiscal affairs, a debt ceiling that is too frequently binding can wreak havoc on the efficient operation of government, as the experience of the United States, where bipartisan brinksmanship routinely plagues efforts to raise the debt ceiling, reminds us."
2021-11-03-T-016-S-00245,2021-11-03-T-016,245,Jamus Jerome Lim,"To this effect, may I inquire whether this Government has considered whether this limit is appropriate? What is the premise or justification behind the current debt limit ceiling amount of $1.065 trillion? Is there a body that routinely examines the veracity of this debt limit and how frequently should we expect to change this?"
2021-11-03-T-016-S-00246,2021-11-03-T-016,246,Jamus Jerome Lim,"The second point, Mr Speaker, I wish to raise has to do with how clause 20 of the Bill restricts the ability of other Government entities, in particular, MAS from accepting advance deposits in anticipation of raising loans by way of Treasury Bills."
2021-11-03-T-016-S-00247,2021-11-03-T-016,247,Jamus Jerome Lim,"While this may be a sound principle in practice, history is rife with examples of central banks that have gone ahead and monetised debt on behalf of a profligate sovereign, breeding inflation as a result."
2021-11-03-T-016-S-00248,2021-11-03-T-016,248,Jamus Jerome Lim,It is worth noting that two recent developments may yet necessitate additional flexibility for the monetary authority to act in an anticipatory manner.
2021-11-03-T-016-S-00249,2021-11-03-T-016,249,Jamus Jerome Lim,"The first such circumstance, as Members of this House would be aware of, has to do with the zero lower bound faced by nominal interest rates. Although Singapore has never quite faced this problem in the aftermath of the Global Financial Crisis of 2007/2008 and the MAS, unlike most central banks, targets the nominal exchange rate rather than the policy interest rate, it is nevertheless worth keeping in mind that one prescription to the problem of the zero lower bound is to allow for central banks to intervene directly in short-term money markets by issuing securities on their own account."
2021-11-03-T-016-S-00250,2021-11-03-T-016,250,Jamus Jerome Lim,The second situation is to do with the emerging central bank digital currency landscape (CBDC). Such CBDCs are likely to become a permanent part of the future of central banking worldwide and I understand that MAS is on the forefront of this and even commissioned the sandbox for studying the usage of such currencies.
2021-11-03-T-016-S-00251,2021-11-03-T-016,251,Jamus Jerome Lim,"While the detailed findings of this exercise have yet to be made public, it is reasonable to ask if the practical implementation of CBDCs may yet require flexibility for MAS to be able to accept such advance deposits for Treasury Bills and if this Bill would preclude such action."
2021-11-03-T-016-S-00252,2021-11-03-T-016,252,Jamus Jerome Lim,"Hence, while I accept that these two conditions are somewhat unusual, it is nevertheless worth asking if this particular clause in the Bill may unnecessarily tie the hands of the MAS to operate in a modern global macroeconomic environment."
2021-11-03-T-016-S-00253,2021-11-03-T-016,253,Jamus Jerome Lim,"Finally, clause 24 of the Bill explicitly states that the authority may, ""refuse any application to take up Government securities or Treasury Bills issued without assigning any reason."""
2021-11-03-T-016-S-00254,2021-11-03-T-016,254,Jamus Jerome Lim,"While I accept the prerogative of the Government to reserve the right to refuse the sale of his debt to any given entity, it is also surely reasonable, at least, for Singaporean purchases to be provided some form of explanation for why they are unable to purchase the debt of their own Government."
2021-11-03-T-016-S-00255,2021-11-03-T-016,255,Jamus Jerome Lim,"Notwithstanding these reservations and questions, Mr Speaker, I support the Bill."
2021-11-03-T-016-S-00256,2021-11-03-T-016,256,Speaker,Mr Louis Ng.
2021-11-03-T-016-S-00257,2021-11-03-T-016,257,Louis Ng Kok Kwang,"Sir, I support this Bill, which will bring about greater clarity by consolidating and harmonising the Government's borrowing powers."
2021-11-03-T-016-S-00258,2021-11-03-T-016,258,Louis Ng Kok Kwang,I have two points of clarification to make.
2021-11-03-T-016-S-00259,2021-11-03-T-016,259,Louis Ng Kok Kwang,My first point is on the merging of limits under the Government Securities Act and the Local Treasury Bills Act. The new section 11 of the Act will replace the separate borrowing limits for Government securities and Treasury Bills with a single borrowing limit.
2021-11-03-T-016-S-00260,2021-11-03-T-016,260,Louis Ng Kok Kwang,My concern is that we currently have a much higher borrowing limit for Government securities than for Treasury Bills – more than nine times as much. The Government had its rationale for maintaining this disparity.
2021-11-03-T-016-S-00261,2021-11-03-T-016,261,Louis Ng Kok Kwang,"As such, I have three related questions"
2021-11-03-T-016-S-00262,2021-11-03-T-016,262,Louis Ng Kok Kwang,"One, what was the initial intent of having a much higher borrowing limit for Government Securities and Treasury Bills? Does the Ministry see this initial intent as no longer relevant, given that this intent is no longer reflected in the combined borrowing limit?"
2021-11-03-T-016-S-00263,2021-11-03-T-016,263,Louis Ng Kok Kwang,"Two, will this combined limit now result in a greater reliance on Treasury Bills compared to Government securities?"
