speech_id,topic_id,speech_order,member_name,text
2021-11-03-T-001-S-00001,2021-11-03-T-001,1,Speaker,"Order. I wish to inform hon Members that pursuant to Standing Order No 100(7)(a)(ii), I have on 2 November 2021 nominated Mr Edwin Tong and Ms Rahayu Mahzam to the Committee of Privileges, to take the place of Mr K Shanmugam and Ms Indranee Rajah, on the matter of a complaint made against the Member of Sengkang GRC, Ms Raeesah Khan."
2021-11-03-T-001-S-00002,2021-11-03-T-001,2,Speaker,Mr Edwin Tong and Ms Rahayu Mahzam will serve as Members of the Committee until the Committee has reported upon the matter referred to it.
2021-11-03-T-001-S-00003,2021-11-03-T-001,3,Speaker,Order. Questions for Oral Answer.
2021-11-03-T-002-S-00004,2021-11-03-T-002,4,Lim Wee Kiak,asked the Prime Minister in light of the disclosures in the Pandora Papers (a) whether MAS will be looking into the Singapore-based financial institutions and Singaporeans/foreigners who are implicated in the report; (b) whether any individual or financial institution will be asked to issue a clarification as to their activities disclosed in the report; and (c) how does MAS ensure that offshore wealth management services in Singapore remain lawful and legitimate by international standards.
2021-11-03-T-002-S-00005,2021-11-03-T-002,5,Patrick Tay Teck Guan,asked the Prime Minister (a) whether Singapore is implicated in the Pandora Papers; and (b) whether the Government is investigating whether Singapore entities or individuals residing in Singapore are involved in the alleged practices.
2021-11-03-T-002-S-00006,2021-11-03-T-002,6,Lawrence Wong,"Mr Speaker, Sir, may I have your permission to answer all the Parliamentary Questions (PQs) related to the recent disclosure by the International Consortium of Investigative Journalists (ICIJ) of confidential information, dubbed the “Pandora Papers” together. This includes Question Nos 1 and 2 from Dr Lim Wee Kiak and Mr Patrick Tay filed for today’s Sitting, the Written PQ from Miss Cheryl Chan Wei Ling filed for today’s Sitting, and the Oral PQ from Mr Murali Pillai filed for yesterday’s Sitting."
2021-11-03-T-002-S-00007,2021-11-03-T-002,7,Speaker,Please do.
2021-11-03-T-002-S-00008,2021-11-03-T-002,8,Lawrence Wong,"Sir, as a global financial centre, Singapore intermediates a large volume of fund flows for investment or commercial purposes and also provides services in financial asset management. While the vast majority of these activities are carried out by law-abiding individuals and companies, we are constantly on guard against the risk of illicit financing activities."
2021-11-03-T-002-S-00009,2021-11-03-T-002,9,Lawrence Wong,"The Monetary Authority of Singapore (MAS) continually monitors and analyses information from a wide range of sources as part of its surveillance of money laundering and terrorism financing risks. This includes suspicious transactions reports filed by our financial institutions (FIs), information from intelligence sources, including those abroad and publicly available information such as from independent investigations and media reports. MAS therefore takes seriously the recent disclosures in the Pandora Papers."
2021-11-03-T-002-S-00010,2021-11-03-T-002,10,Lawrence Wong,"The ICIJ has reported that 336 prominent individuals from around the world had established offshore structures to hold assets, assisted by 14 service providers operating in at least 38 jurisdictions. Two of the 14 service providers are foreign-incorporated trust companies with subsidiaries in Singapore that are licensed and regulated by MAS. Some ICIJ media reports also mentioned that many of these individuals had foreign bank accounts linked to these structures, in various financial centres including Singapore."
2021-11-03-T-002-S-00011,2021-11-03-T-002,11,Lawrence Wong,"Based on MAS’ assessment and information available thus far, the Pandora Papers have not raised significant concerns over the money laundering and counter terrorism financing (AML/CFT) controls of our FIs. Nevertheless, MAS is engaging the relevant FIs to assess if tightening of controls are warranted."
2021-11-03-T-002-S-00012,2021-11-03-T-002,12,Lawrence Wong,"As ICIJ itself is careful to acknowledge, there are legitimate reasons to set up offshore structures, such as for investment and estate management. However, offshore structures often lack transparency and are thus vulnerable to abuse for illicit activities. Hence, MAS has clear requirements for FIs in Singapore to identify and verify the identities of persons who are beneficial owners or effective controllers of their customer accounts. FIs must understand the reasons for the use of such structures, take measures to ascertain that the assets held in these structures are not illicit and scrutinise any unusual transactions as part of their ongoing monitoring of the account."
2021-11-03-T-002-S-00013,2021-11-03-T-002,13,Lawrence Wong,"MAS also supervises the FIs to ensure that their boards and management have implemented robust controls against money laundering and terrorism financing. Where there are breaches of AML/CFT requirements, MAS has taken strong enforcement action."
2021-11-03-T-002-S-00014,2021-11-03-T-002,14,Lawrence Wong,"In fact, both the licensed trust companies in Singapore mentioned in the Pandora Papers have already been subject to MAS’ supervisory or enforcement actions. One of them, Asiaciti Trust (Singapore) Pte Ltd, paid a composition penalty of $1.1 million imposed by MAS in July last year for its failure to implement adequate AML/CFT policies and procedures. The other trust company, Trident Trust Company (Singapore) Pte Ltd, was directed by MAS in September last year to remediate weaknesses detected in its risk assessment controls during MAS’ supervisory surveillance. Both companies were under intensified scrutiny by MAS before they were mentioned in the Pandora Papers."
2021-11-03-T-002-S-00015,2021-11-03-T-002,15,Lawrence Wong,"Let me assure this House that Singapore takes the integrity of our financial sector very seriously. As a major international financial centre, Singapore will always face the risk of illicit financial flows. What is important is that we supervise our FIs well, and take strong enforcement actions where necessary to reduce this risk as much as possible. MAS has been doing this and will continue to do so."
2021-11-03-T-003-S-00016,2021-11-03-T-003,16,Yeo Wan Ling,"asked the Minister for Transport in light of the new COVID-19 protocols where patients waiting for their polymerase chain reaction test results should return home via private transport, what are the measures taken to protect our point-to-point drivers when they are ferrying such passengers."
2021-11-03-T-003-S-00017,2021-11-03-T-003,17,Liang Eng Hwa,asked the Minister for Transport (a) whether there are adequate taxis and private transport to ferry passengers to and return from Swab and Send Home (SASH) clinics; (b) whether the drivers are sufficiently protected; and (c) whether the vehicles are kept sanitised and safe.
2021-11-03-T-003-S-00018,2021-11-03-T-003,18,Amy Khor Lean Suan,"Speaker, may I have your permission to take Question Nos 3 and 4 together?"
2021-11-03-T-003-S-00019,2021-11-03-T-003,19,Speaker,"Yes, please."
2021-11-03-T-003-S-00020,2021-11-03-T-003,20,Amy Khor Lean Suan,"Thank you. Persons who feel unwell and are travelling to and from their polymerase chain reaction (PCR) test venue are required to commute via private transport, which includes taxis or private hire cars (PHCs). As these persons are taking regular taxis or PHCs, there is an adequate supply to meet their needs."
2021-11-03-T-003-S-00021,2021-11-03-T-003,21,Amy Khor Lean Suan,"These passengers should inform their taxi and PHC drivers about their health status so that the drivers may take appropriate precautions. Drivers have been advised to switch off the air-con when ferrying these passengers, wind down their windows during and after each trip, and clean their vehicles after the trips. Passengers should also sit at the back, diagonally from the drivers."
2021-11-03-T-003-S-00022,2021-11-03-T-003,22,Amy Khor Lean Suan,"MOH has assessed that these measures are sufficient to minimise the risk of in-vehicle transmission of the virus and there is no need for extra precautionary measures, such as having drivers put on full personal protective equipment. Furthermore, about 98% of our taxi and PHC drivers are fully vaccinated."
2021-11-03-T-003-S-00023,2021-11-03-T-003,23,Speaker,Ms Yeo Wan Ling.
2021-11-03-T-003-S-00024,2021-11-03-T-003,24,Yeo Wan Ling,"I thank the Senior Minister of State for the comprehensive and very empathetic answer. Our P2P drivers have been very supportive of our journey to the endemic phase and appreciates the Government's continued support of this industry during this period. Given that our P2P drivers will be ferrying more patients and passengers who are exposed to the virus, would the Government be putting in measures to have the taxis and platform companies put in clearer safety SOPs or protocols for drivers and their vehicles? And should our P2P drivers have to self-isolate, will there be additional support for them, given that they would have difficulties with the daily rentals of their vehicles during this isolation period?"
2021-11-03-T-003-S-00025,2021-11-03-T-003,25,Amy Khor Lean Suan,"I thank the Member for her supplementary questions. We note the concerns of the drivers. We have received the feedback from the drivers, the associations and NTUC about ferrying unwell or Ag+ passengers."
2021-11-03-T-003-S-00026,2021-11-03-T-003,26,Amy Khor Lean Suan,"We have worked with MOH who will remind the passengers to declare their health status to the drivers so that the drivers can take the necessary precautions to further minimise the risks of in-vehicle transmission of the virus. MOH has put this information up on their website in their FAQs on Health Protocols. So, this is already up. LTA will be putting it up on our website. LTA is also working with the operators and the associations to publicise this message to the drivers as well as the passengers."
2021-11-03-T-003-S-00027,2021-11-03-T-003,27,Amy Khor Lean Suan,"So, for instance, sending emails to the database of passengers to remind them to declare their health status so that the drivers can take action and also to remind the drivers of the additional precautions that they can take. We are also working with the operators to see if we can craft a message that can be printed out and the drivers can opt to display it in their vehicles to remind the passengers. This is what we are doing to give assurance to the drivers."
2021-11-03-T-003-S-00028,2021-11-03-T-003,28,Amy Khor Lean Suan,"With regard to support for the drivers, the operators have various measures to provide support to the drivers who either are tested positive for COVID-19 and cannot drive or they are required to self-isolate and therefore, cannot drive. All the taxi operators provide rental waivers for the drivers who cannot drive due to COVID-19 or if they have to self-isolate. The two biggest PHC operators – Grab and Gojek – provide prolonged medical leave insurance coverage for the drivers. This involves financial payouts if the drivers are not able to drive for these reasons."
2021-11-03-T-003-S-00029,2021-11-03-T-003,29,Amy Khor Lean Suan,"In addition to that, drivers who contract COVID-19 as a result of providing services in a heightened COVID-19 risk situation – for instance, ferrying Ag+ passengers for their PCR tests – they can apply for a one-time relief of $3,000 through The Courage Fund for frontliners that is administered by the National Council of Social Service."
2021-11-03-T-004-S-00030,2021-11-03-T-004,30,Liang Eng Hwa,asked the Minister for Trade and Industry (a) what is Singapore’s inflation outlook in the near and medium terms; (b) what are the causes of the rising inflationary pressures; (c) what is the assessment of the likely impact of these inflationary pressures on low and middle income households; and (d) whether there will be mitigating measures to reduce the impact of rising costs arising from these inflationary pressures on households and businesses.
2021-11-03-T-004-S-00031,2021-11-03-T-004,31,Saktiandi Supaat,"asked the Minister for Trade and Industry (a) whether the Ministry can provide an update on the risk of a sharp accumulation of external and domestic cost pressures affecting prices of goods and services in Singapore; and (b) other than tighter monetary policy, what steps can be taken to mitigate some of the effects of rising costs over the next 12 months."
2021-11-03-T-004-S-00032,2021-11-03-T-004,32,Alvin Tan,"Speaker, Sir, with your permission, can I take Question Nos 5 and 6 together, please?"
2021-11-03-T-004-S-00033,2021-11-03-T-004,33,Speaker,"Yes, please."
2021-11-03-T-004-S-00034,2021-11-03-T-004,34,Alvin Tan,"CPI-All Items inflation picked up to 2.5% on a year-on-year basis in Q32021, from 2.3% in Q2. The rise in domestic inflation came largely on the back of higher external inflation due to increases in global energy and food commodity prices, and persistent supply bottlenecks in key global industries and transport hubs."
2021-11-03-T-004-S-00035,2021-11-03-T-004,35,Alvin Tan,"On the energy front, crude oil prices have risen to above US$80 per barrel since early October on account of the decision by OPEC+ to keep supply increases modest, even as oil demand continues to pick up due to the global economic recovery and the rally in global natural gas prices. Higher oil and gas prices will translate to higher electricity prices domestically. And about 95% of our electricity is currently generated using natural gas. That is on the energy front."
2021-11-03-T-004-S-00036,2021-11-03-T-004,36,Alvin Tan,"On the food front, global prices for food commodities such as cereals and vegetable oil have risen due to supply constraints arising from weather-related disruptions, manpower and labour shortages and export restrictions in key food-producing countries, amidst rising global demand. Higher global food prices will in turn, naturally, exert upward pressure on domestic food prices."
2021-11-03-T-004-S-00037,2021-11-03-T-004,37,Alvin Tan,"Meanwhile, supply bottlenecks for goods such as semiconductors, and congestion at ports around the world, have contributed to a rise in the prices of imported consumer goods in Singapore."
2021-11-03-T-004-S-00038,2021-11-03-T-004,38,Alvin Tan,"Domestically, we expect labour costs to rise as the labour market continues to recover and border restrictions limit non-resident worker inflow. We also expect to see inflation in accommodation to persist due to strong rental demand for housing amidst construction delays caused by labour shortages in the construction sector. Against this backdrop, CPI-All Items inflation is projected to come in at around 2% this year and average 1.5% to 2.5% in 2022."
2021-11-03-T-004-S-00039,2021-11-03-T-004,39,,"But despite this rise in inflation, Singapore’s economic recovery for the year remains on track. Barring a major setback in the global economy, GDP growth is expected to come in between 6% and 7% for the full year, mainly supported by outward-oriented sectors, such as the manufacturing, finance and insurance, and information and communications sectors."
2021-11-03-T-004-S-00040,2021-11-03-T-004,40,,"The Government recognises that higher inflation is a cause of concern for Singaporeans, particularly those in lower-income households. To manage the cost of living pressures faced by Singaporeans, the Government adopts a multi-pronged approach."
2021-11-03-T-004-S-00041,2021-11-03-T-004,41,,"First, in view of the external and domestic cost pressures, MAS recently announced a shift towards an appreciating path for the trade-weighted Singapore dollar – the Singapore dollar nominal effective exchange rate. A strong Singapore dollar will help to mitigate imported inflation and temper domestic cost, to ensure price stability over the medium term. That is one."
2021-11-03-T-004-S-00042,2021-11-03-T-004,42,,"Second, the Government strives to maintain and manage domestic supply-side constraints, and these include the supply of industrial and commercial spaces to help moderate business cost increases, and reduce the knock-on impact on consumer prices. During the pandemic, the Government has also disbursed rental relief to help businesses cope with their rental costs. In addition, policy measures, such as the Wage Credit Scheme, Jobs Support Scheme and Jobs Growth Incentive Scheme, provide some support for businesses in terms of their manpower and labour costs."
2021-11-03-T-004-S-00043,2021-11-03-T-004,43,,"Third, to mitigate the impact of rising global food prices, the Government has diversified our food import sources to help ensure that the prices of our food supplies remain competitive."
2021-11-03-T-004-S-00044,2021-11-03-T-004,44,,"Fourth, we will continue to pay particular attention to Singaporeans from lower-income households who need support for their basic living expenses. The Government will continue to provide assistance through ComCare and the permanent GST Voucher scheme. From time to time, the Government also introduces one-off support measures, such as the Budget 2020 Grocery Vouchers Scheme. In addition, Singaporeans from lower- to middle-income households who have experienced involuntary job or income loss due to the economic impact of COVID-19 can apply for financial assistance provided through schemes, such as the COVID-19 Recovery Grant and the Courage Fund."
2021-11-03-T-004-S-00045,2021-11-03-T-004,45,,The Government will continue to monitor inflation and cost of living pressures closely and adjust our policies where necessary.
2021-11-03-T-004-S-00046,2021-11-03-T-004,46,Saktiandi Supaat,"Mr Speaker, I would like to thank the Minister of State for his detailed answers. I have just one supplementary question and somewhat related to Question No 5 as well. Beyond the mitigation measures that the Minister of State mentioned just now – we are thankful for the support for expenses and other mitigation measures – can he give an update on other pre-emptive efforts?"
2021-11-03-T-004-S-00047,2021-11-03-T-004,47,Saktiandi Supaat,"For example, the Retail Price Watch Group (RPWG). An update on that would be quite useful. Slightly more than a decade ago, we created that to keep a watch on retail prices and address concerns on any alleged profiteering and excessive pricing of daily necessities and food items. And the role of cooperation with retailers going forward, as a price stabiliser, I think that element of pre-emptive efforts might be useful at this point in time as we proceed into 2022. If we can have further updates from the Minister of State, please."
2021-11-03-T-004-S-00048,2021-11-03-T-004,48,Alvin Tan,"I thank the Member for his s upplementary question. The Government maintains a very strong vigilant stance on price increases and price fluctuations. The Retail Price Watch Group that the Member mentioned has stood down but we have other measures and ways of monitoring the price of goods. For daily necessities, consumers can make use of CASE's Price Kaki app to compare prices of groceries and hawker food to help them to make more informed purchasing decisions."
2021-11-03-T-004-S-00049,2021-11-03-T-004,49,Alvin Tan,"To also help Singaporeans cope with higher prices for their daily necessities, the Government continues to work with cooperatives, such as NTUC FairPrice and community support programmes, such as the price freezes on essential items under house brands over the period of March 2019 to December 2020."
2021-11-03-T-004-S-00050,2021-11-03-T-004,50,Alvin Tan,"But as I have mentioned earlier on, I wanted to just reinforce that it is a whole multi-prong approach, a broad and expansive approach that the Government is taking to tackle inflation."
2021-11-03-T-004-S-00051,2021-11-03-T-004,51,Alvin Tan,"We have mentioned earlier on MAS' monetary policy adjustments, the Government managing supply-site constraints, which is not unique to Singapore but globally. Third, is diversifying food import sources and energy sources over the long term, as we have debated in the House for the last two days. And of course, our particular focus and assistance to lower-income households, including, for example, U-Save vouchers for households living in for 4-room or smaller HDB flats to help them with utility bills."
2021-11-03-T-004-S-00052,2021-11-03-T-004,52,Alvin Tan,"So, our approach has been multi-pronged. Our approach has been wide and expansive and broad to help our people to cope with inflation."
2021-11-03-T-004-S-00053,2021-11-03-T-004,53,Speaker,Mr Liang Eng Hwa.
2021-11-03-T-004-S-00054,2021-11-03-T-004,54,Liang Eng Hwa,"Sir, the Minister of State mentioned about monetary policy as one of the very important tools to fight imported inflation. So, I would like to ask the Minister of State whether there is further scope for our strong Singapore dollar to mitigate imported inflation, given that it does impact our export competitiveness; whether, from our trade consideration standpoint, is there further room for that to be used to mitigate imported inflation?"
2021-11-03-T-004-S-00055,2021-11-03-T-004,55,Liang Eng Hwa,"Secondly, besides imported inflation, we are also faced with domestic cost pressures. The Minister of State also mentioned about the push for higher wages, the additional measures from the COVID-19-related safe management procedures that the businesses got to follow, the energy prices and others. My concern is whether all these upward pressures on cost will lead to businesses pricing in this anticipated increase in cost and, therefore, will create a spiral in inflation. So, I would like to ask the Minister of State how the Government is going to manage this, whether there will be interventions and also for items that are outside the CPI basket, how are we going to mitigate those cost increases as well."
2021-11-03-T-004-S-00056,2021-11-03-T-004,56,Alvin Tan,"I t hank the Member for his supplementary questions. As we all know, inflation is a clear and present issue confronting and vexing economists this week, as well as central bankers and policy-makers. If you look at it, US consumer price inflation is at 5.4%, the highest in 13 years. South Korea just announced that inflation hit a 10-year high in October."
2021-11-03-T-004-S-00057,2021-11-03-T-004,57,Alvin Tan,"As I earlier updated, MAS had already made a decisive move on 14 October by raising the slope of the Singapore dollar nominal effective exchange rate. It had also said that it would continue to track the growth and inflation trajectories over the next few quarters."
2021-11-03-T-004-S-00058,2021-11-03-T-004,58,Alvin Tan,"This is one tool in the toolbox; there are many others. And maybe I will just share with the Member how we are dealing with inflationary issues. If you look at the thing as a whole, this issue has been more acute because of two major challenges. The first is that the supply-side constraints and the second is an economic rebound."
2021-11-03-T-004-S-00059,2021-11-03-T-004,59,Alvin Tan,"The supply-side constraints have been in place, pre-COVID-19, but accentuated during COVID-19. The economic pick-up will lead to pent-up demand, economic rebounding, and so, you have huge demand but then, continued supply constraints. If you look at what is happening right now, despite all of these input prices, our exports have in fact seen a very strong recovery this year. Our non-oil domestic exports (NODX) increased 9.1% year-on-year in Q3 2021, following the 10.1% expansion in Q2 2021. This NODX growth in Q3 2021 was driven mainly by exports of non-electronic products such as specalised machinery, petrochemicals and pharmaceuticals."
2021-11-03-T-004-S-00060,2021-11-03-T-004,60,Alvin Tan,"When our export performance is strong, it means also that our exports remain competitive in international markets. And we must keep these markets open so that our goods can flow out. It also manages a hedge against other price increases, inbound. How do we do so? The Member knows that we have undertaken a whole slew and suite of major trade facilitation and multilateral frameworks, such as RCEP, CPTPP. These build upon our existing FTAs with major trade partners, representing 85% of global GDP."
2021-11-03-T-004-S-00061,2021-11-03-T-004,61,Alvin Tan,"At the same time, the other way to manage this is to ensure that our supply chains remain connected and that means diversifying our import and export markets. We have and are negotiating, and have successfully concluded negotiations on the Pacific Alliance Singapore Free Trade Agreement. It is another arrow in our quiver such that we can open up new markets for our imports to alleviate, again, inflationary pressures. We will also continue to support local enterprises so they can deepen their export capabilities in the global economy and ensure our exports remain relevant and competitive in the international market in the long term."
2021-11-03-T-004-S-00062,2021-11-03-T-004,62,Alvin Tan,"The other aspects to reduce inflationary pressures include also the supply of industrial and commercial spaces to help moderate business costs and reduce the knock-on impact on consumer prices. These also include measures such as disbursing rental relief to help businesses cope with their rental costs and, hopefully, have knock-on effects to consumers as well."
2021-11-03-T-005-S-00063,2021-11-03-T-005,63,Dennis Tan Lip Fong,asked the Minister for Social and Family Development whether the Government expects that ComCare cash assistance will remain elevated for the 2021 financial year.
