Topic_CID,Original_MP_Name,MP_Name,Text,Seq,Speech_Order,Speech_CID
2021-09-13-T-018,Yip Hon Weng,Mr Yip Hon Weng (Yio Chu Kang),"Currently, there is a proposed penalty of a composition sum of $5,000 for construction sites that break the no-work rule for the first time. Subsequent offences lead to a Court summons with a maximum fine of $40,000. If we are to meaningfully address noise pollution as a threat to public health and not just as a mere annoyance, would these penalties be too light? As a more effective deterrent, violation of the no-work regulation ought to bear heavier consequences on the contractor’s ability to succeed at the next tender bid. We should also require such offences to be highlighted, when they next bid for projects.",14,1093,2021-09-13-T-018-S-01093
2021-09-13-T-018,Yip Hon Weng,Mr Yip Hon Weng (Yio Chu Kang),"In conclusion, Mr Deputy Speaker, Sir, noise pollution is a real issue on the ground. I did a check in the Hansard. Issues relating to construction noise have been consistently brought up in Parliament on several occasions over the past 10 years, despite ongoing reviews to manage disamenities. Instead of having discrete and piecemeal recommendations, we need a multifaceted and holistic approach to tackle noise pollution. As mentioned in my speech, these include better feedback management, promoting greater public awareness of no-work days and having stronger guidelines on surveillance systems. We should also have greater clarity on the type of construction projects covered under the new amendments and have more enforcement bite.",15,1094,2021-09-13-T-018-S-01094
2021-09-13-T-018,Yip Hon Weng,Mr Yip Hon Weng (Yio Chu Kang),"I believe that these suggestions working together as a system, will make a difference on the ground. I support the Bill.",16,1095,2021-09-13-T-018-S-01095
2021-09-13-T-018,Deputy Speaker,Mr Deputy Speaker,Minister of State Desmond Tan.,1,1096,2021-09-13-T-018-S-01096
2021-09-13-T-018,Desmond Tan,Mr Desmond Tan,"Mr Deputy Speaker, first, I thank the Members for their support of the Bill. The thoughtful comments and suggestions that were raised reflect our collective commitment to climate action and to provide a quality living environment for Singaporeans.",1,1097,2021-09-13-T-018-S-01097
2021-09-13-T-018,Desmond Tan,Mr Desmond Tan,"I will first address Members’ questions on the measures to reduce HFC emissions from refrigeration and air-conditioning, or RAC, equipment.",2,1098,2021-09-13-T-018-S-01098
2021-09-13-T-018,Desmond Tan,Mr Desmond Tan,"HFC accounts for a sizeable share of Singapore’s greenhouse gas emissions. As Mr Louis Ng pointed out, there was a 30% increase in HFC emissions from 2014 to 2016 and this underscores the urgent need for action, which Mr Shawn Huang as well as Mr Louis Chua have also emphasised. The measures introduced today will deliver deep cuts in HFC emissions and bring us closer to our climate goals.",3,1099,2021-09-13-T-018-S-01099
2021-09-13-T-018,Desmond Tan,Mr Desmond Tan,Mr Don Wee suggested delaying the measures in view of the current economic conditions caused by the pandemic. I wish to clarify that the requirement to use low-GWP refrigerants applies only to new regulated equipment that is supplied from 1 October 2022. Companies can continue to use their existing equipment until the end of life for those equipment.,4,1100,2021-09-13-T-018-S-01100
2021-09-13-T-018,Desmond Tan,Mr Desmond Tan,"While low-GWP chillers may cost a little more, they are typically more energy and carbon efficient and offer net cost savings over their lifecycle. So, investing in them not only protects the climate, but also protects companies from being locked into the higher operating costs of less efficient chillers. For example, CapitaLand expects to reap lifecycle cost savings of $280,000 from its low-GWP chiller deployed in Funan.",5,1101,2021-09-13-T-018-S-01101
2021-09-13-T-018,Desmond Tan,Mr Desmond Tan,"Companies that are replacing their chillers in the immediate future can tap on the grant introduced in October 2020 to incentivise the early switch to low-GWP chillers, before the supply restriction comes into force in October 2022. So far, 10 projects have been approved or are under consideration. These projects are expected to collectively abate HFC emissions equivalent to 60 kilotonnes of carbon dioxide, comparable to taking around 18,000 cars off the road.",6,1102,2021-09-13-T-018-S-01102
2021-09-13-T-018,Desmond Tan,Mr Desmond Tan,"One grant recipient is Kaer Pte Ltd, an energy services company which provides ""Cooling as a Service"". With grant support, Kaer is replacing chillers at an industrial facility with climate-friendly ones that not only use low-GWP refrigerant, but will also improve the system’s energy efficiency by 35%.",7,1103,2021-09-13-T-018-S-01103
2021-09-13-T-018,Desmond Tan,Mr Desmond Tan,"As Mr Louis Ng has highlighted, proper refrigerant handling practices are important to minimise HFC emissions during servicing and maintenance of RAC equipment.",8,1104,2021-09-13-T-018-S-01104
2021-09-13-T-018,Desmond Tan,Mr Desmond Tan,We have worked closely with Temasek Polytechnic and industry partners to develop a training and certification programme for chiller technicians. This two-day programme has been designed to be practical and relevant to the industry and will cover the processes for handling and recovering refrigerants from chillers. Technicians will be re-certified every three years to keep up with advancements in technology.,9,1105,2021-09-13-T-018-S-01105
2021-09-13-T-018,Desmond Tan,Mr Desmond Tan,"Mr Louis Ng and Mr Gan Thiam Poh asked whether the course could be held in other languages aside from English. The course is designed to meet the needs of the technicians. It will be conducted in simple spoken English. Temasek Polytechnic has ample experience in conducting other similar technical courses and trainers will tailor their delivery to suit the language competency of the technicians. Trainers will also give practical demonstrations and conduct hands-on practice to enhance understanding. To be certified, technicians have to pass an open-book test comprising multiple choice questions and a simple practical assessment. In fact, during my visit to Temasek Polytechnic, I noticed that the course will be conducted, hands-on, by technicians for the technicians themselves. So, it will be done in a simple manner, using languages that the technicians can understand.",10,1106,2021-09-13-T-018-S-01106
2021-09-13-T-018,Desmond Tan,Mr Desmond Tan,"Mr Desmond Choo, Mr Louis Ng and Mr Gan Thiam Poh have asked if there would be financial support for these technicians. Singaporeans and PRs will be eligible for up to 90% subsidies under SkillsFuture SG and the balance of $85 can be paid for using their SkillsFuture credits.",11,1107,2021-09-13-T-018-S-01107
2021-09-13-T-018,Desmond Tan,Mr Desmond Tan,"We agree with Mr Desmond Choo that companies need time to develop internal processes and train their technicians. For this reason, we announced the requirements early in March last year. We have since been engaging the industry closely to develop these measures and will continue to do so to ensure a smooth transition.",12,1108,2021-09-13-T-018-S-01108
2021-09-13-T-018,Desmond Tan,Mr Desmond Tan,I am also pleased to inform Mr Desmond Choo that the register for registered suppliers and registered regulated goods will be made accessible online. This was a question that was asked by Mr Louis Chua as well.,13,1109,2021-09-13-T-018-S-01109
2021-09-13-T-018,Desmond Tan,Mr Desmond Tan,"Mr Desmond Choo also proposed stricter penalties for the offence of falsifying information or data under the new section 40X. The penalty of a fine not exceeding $5,000 or imprisonment for a term not exceeding three months, or both, is aligned to similar offences under the Energy Conservation Act. From our experience, this serves as sufficient deterrence and we will review the penalty level should data falsification become an issue of concern, going forward.",14,1110,2021-09-13-T-018-S-01110
2021-09-13-T-018,Desmond Tan,Mr Desmond Tan,"Mr Don Wee asked whether requiring spent refrigerants to be recovered and treated will add to business cost. This is unlikely, as most of the spent refrigerants can be treated for reuse and have commercial value. Today, even in the absence of regulation, there is already a market for them and facilities to treat spent refrigerants are already available.",15,1111,2021-09-13-T-018-S-01111
2021-09-13-T-018,Desmond Tan,Mr Desmond Tan,"Mr Louis Ng also asked about our plans to address HFC emissions beyond the current measures. We are studying the potential for other types of RAC equipment, such as commercial and industrial refrigeration units, to switch to low-GWP refrigerants. We will need to assess the feasibility of available technologies, balancing considerations such as fire safety, toxicity, energy efficiency and the cost of suitable substitutes. In response to Mr Louis Chua, we will consult and work closely with industries and businesses, and give sufficient lead time before implementing any measures.",16,1112,2021-09-13-T-018-S-01112
2021-09-13-T-018,Desmond Tan,Mr Desmond Tan,"I assure Mr Don Wee that we will carefully consider the cost impact on our cold chain needs when assessing any future measures on commercial and industrial refrigeration units. The measures introduced today have no impact on cold chain needs, as climate-friendly household refrigerators do not cost more.",17,1113,2021-09-13-T-018-S-01113
2021-09-13-T-018,Desmond Tan,Mr Desmond Tan,"Prof Hoon Hian Teck asked whether it would be better to price HFC emissions rather than regulate these. While pricing remains an option, there are merits in adopting regulations to reduce HFC emissions. Most jurisdictions also take this approach. HFC emissions arise mainly from ownership rather than the intensity of use of RAC equipment and are locked in by technology choices. Given technical complexity and the need to balance multiple considerations in the choice of refrigerants as highlighted earlier, it is difficult for end-users to make informed choices or to influence upstream supplier decisions. Regulation offers much greater outcome certainty in abating HFC emissions. In commercial chillers, for example, regulation will effect a switch to a new generation of refrigerants with GWP close to zero, bringing HFC emissions to negligible levels when the entire stock of chillers turns over.",18,1114,2021-09-13-T-018-S-01114
2021-09-13-T-018,Desmond Tan,Mr Desmond Tan,"Even if taxation were to be introduced, these considerations mean that regulations may still be needed. We would have to consider the cost effectiveness of the taxation regime, given the highly distributed sources of emissions. While the tax can be levied upstream on importers, this has to be coupled with the system of downstream rebates for spent refrigerants that are recovered. This could potentially result in higher administrative costs.",19,1115,2021-09-13-T-018-S-01115
2021-09-13-T-018,Desmond Tan,Mr Desmond Tan,"Mr Louis Chua also asked about the abatement potential and plans for the Kigali Amendment. The HFC mitigation measures introduced today are expected to reduce HFC emissions from the regulated equipment by around half by the year 2030. With regard to the Kigali Amendment, my Ministry has initiated a review and is consulting key stakeholders. We will update when ready.",20,1116,2021-09-13-T-018-S-01116
2021-09-13-T-018,Desmond Tan,Mr Desmond Tan,"I will now address Members’ questions on construction noise and the requirement for contractors, who have violated the no-work rule, to install, maintain and operate video surveillance at their construction sites.",21,1117,2021-09-13-T-018-S-01117
2021-09-13-T-018,Desmond Tan,Mr Desmond Tan,"First, let me address questions on the implementation of the requirement for video surveillance.",22,1118,2021-09-13-T-018-S-01118
2021-09-13-T-018,Desmond Tan,Mr Desmond Tan,"Mr Yip Hon Weng asked about the types of construction projects that are covered. The current regulations state that all construction sites located less than 150 metres from any hospital, home for the aged sick or residential building must comply with the no-work rule on Sundays and public holidays. The Bill does not change the no-work rule regulation or requirement. Under this Bill, the Director-General may now impose the requirement for video surveillance on any construction site that contravenes the no-work rule. So, the site has to contravene the rule first. The requirement applies to all public and private sector construction projects, regardless of the size, if they violate the no-work rule.",23,1119,2021-09-13-T-018-S-01119
2021-09-13-T-018,Desmond Tan,Mr Desmond Tan,"It is important to ensure the integrity and proper functioning of the video surveillance systems, as Mr Gan Thiam Poh, Mr Yip Hon Weng and Ms Joan Pereira have pointed out. NEA will carry out scheduled and surprise site inspections to ensure that the video surveillance systems are in good working condition and not tampered with.",24,1120,2021-09-13-T-018-S-01120
2021-09-13-T-018,Desmond Tan,Mr Desmond Tan,"The new section 28A empowers the Director-General to specify requirements for the video surveillance system, including ensuring that the system's security is not compromised. For example, contractors should implement robust digital identification (ID) and password controls and restrict access to the physical components of the system. The person required to install, to operate and to maintain the video surveillance system under the new section 28A must also take all reasonable steps to ensure that no person tampers with or does anything to compromise the proper functioning of the system or any image, sound or video recorded by the system.",25,1121,2021-09-13-T-018-S-01121
2021-09-13-T-018,Desmond Tan,Mr Desmond Tan,"Mr Don Wee asked whether phone video footages can be used to substantiate complaints on no-work rule violations in place of video surveillance. While phone video footages can be used as evidence for prosecution, they might not capture sufficient information on the construction activities being carried out to conclude that there was indeed an offence. Such footages received from the public might also not be timely enough to address ongoing construction noise infringements.",26,1122,2021-09-13-T-018-S-01122
2021-09-13-T-018,Desmond Tan,Mr Desmond Tan,"On the other hand, the installed video surveillance will allow NEA to remotely monitor construction worksites and deter repeat violations. It enhances NEA's efficiency and responsiveness, removing the need for officers to carry out repeated inspections to address recurring public feedback.",27,1123,2021-09-13-T-018-S-01123
2021-09-13-T-018,Desmond Tan,Mr Desmond Tan,"I assure Mr Don Wee and Mr Yip Hon Weng that we are mindful of the impact of the measures on the construction industry, which is facing challenging times. The requirement will only be imposed on the very small group of construction sites that have breached the no-work rule. This is around 150 out of the 5,800 construction sites a year, or about 3% of all active sites. It will not affect the vast majority of construction sites that comply with the no-work rule.",28,1124,2021-09-13-T-018-S-01124
2021-09-13-T-018,Desmond Tan,Mr Desmond Tan,"The cost of installing video surveillance stands at less than 1% of total construction project cost on average. One set of closed-circuit television (CCTV), for example, can cost about $5,000. Depending on the project size, a construction site that has violated the no-work rule may be required to install up to four CCTVs.",29,1125,2021-09-13-T-018-S-01125
2021-09-13-T-018,Desmond Tan,Mr Desmond Tan,"Mr Yip Hon Weng highlighted other complementary measures to strengthen compliance to the no-work rule, such as introducing higher penalties. The vast majority of construction sites comply with the no-work rule. NEA will monitor the effectiveness of these measures in this Bill to address the remaining small group of non-compliant contractors and consider further measures, if needed.",30,1126,2021-09-13-T-018-S-01126
2021-09-13-T-018,Desmond Tan,Mr Desmond Tan,Let me now address points raised by Members on managing construction noise in residential areas beyond the no-work rule.,31,1127,2021-09-13-T-018-S-01127
2021-09-13-T-018,Desmond Tan,Mr Desmond Tan,"We have to strike a careful balance between maintaining a conducive living environment and also allowing construction work to be completed within a reasonable duration and cost. We need to maintain a steady supply of public housing, continue expanding our public transport network and provide amenities such as hospitals and schools.",32,1128,2021-09-13-T-018-S-01128
2021-09-13-T-018,Desmond Tan,Mr Desmond Tan,"As Mr Yip Hon Weng pointed out, many projects have been significantly delayed due to the COVID-19 pandemic. This impacts end users such as families waiting to move into their Build-To-Order (BTO) flats.",33,1129,2021-09-13-T-018-S-01129
2021-09-13-T-018,Desmond Tan,Mr Desmond Tan,"Project delays not only affect the construction industry and end users, they also prolong the disamenities experienced by neighbouring residents.",34,1130,2021-09-13-T-018-S-01130
2021-09-13-T-018,Desmond Tan,Mr Desmond Tan,"Ms Joan Pereira also spoke about balancing the need to expedite projects that have been delayed while keeping disamenities to acceptable levels. This, in fact, is the balance that we need to strike.",35,1131,2021-09-13-T-018-S-01131
2021-09-13-T-018,Desmond Tan,Mr Desmond Tan,"Mr Louis Ng asked for an update on the review of construction noise limits. Given the significant impact of the COVID-19 pandemic on the construction industry, this is not the time to tighten construction noise limits which will affect the whole industry. We recognise that the construction sector faces serious manpower and supply shortages during these extraordinary times.",36,1132,2021-09-13-T-018-S-01132
2021-09-13-T-018,Desmond Tan,Mr Desmond Tan,"Nevertheless, I assure Mr Louis Ng that NEA will monitor the situation and continue to work with stakeholders to review construction noise limits, including the limits for construction work on Saturdays, taking into account the World Health Organization's guidelines and our local context.",37,1133,2021-09-13-T-018-S-01133
2021-09-13-T-018,Desmond Tan,Mr Desmond Tan,"Mr Yip Hon Weng gave useful suggestions to improve feedback management for residents, including having dedicated feedback channels, clear escalation protocols, standardising format for displaying communication channels and providing advance notice to residents. Many of these measures are already in place and we will see how to improve and enhance them.",38,1134,2021-09-13-T-018-S-01134
2021-09-13-T-018,Desmond Tan,Mr Desmond Tan,"For example, as part of construction works that require a BCA permit, the contractor must erect a project signboard of at least 1.8 metres in width and one metre in height before work can commence. The project signboard displays information of the project parties and their contact numbers as well as the hotline numbers of MOM, NEA and BCA. Residents can also submit their feedback through the NEA website and the myENV and OneService mobile applications.",39,1135,2021-09-13-T-018-S-01135
2021-09-13-T-018,Desmond Tan,Mr Desmond Tan,"Upon receiving feedback, NEA officers will investigate whether the construction site has generated noise levels exceeding the noise limits or violated the no-work rule and then, they take enforcement actions accordingly.",40,1136,2021-09-13-T-018-S-01136
2021-09-13-T-018,Desmond Tan,Mr Desmond Tan,"NEA has also been advising contractors to engage the nearby residents early to develop plans to minimise the impact of construction work on residents' daily lives. Contractors have also been encouraged to implement additional noise mitigation measures where possible, such as noise barriers for noisy works like hacking and drilling.",41,1137,2021-09-13-T-018-S-01137
2021-09-13-T-018,Desmond Tan,Mr Desmond Tan,We acknowledge Mr Yip Hon Weng and Ms Joan Pereira's suggestions on improving the public's awareness of the rules on construction noise.,42,1138,2021-09-13-T-018-S-01138
2021-09-13-T-018,Desmond Tan,Mr Desmond Tan,"Information on construction noise limits, permissible work hours and the no-work rule is published on NEA's website. Members of the public can reach out to NEA through various communication channels to find out if a particular construction site is permitted to carry out quieter works on Sunday and public holidays or if noise limits have been breached.",43,1139,2021-09-13-T-018-S-01139
2021-09-13-T-018,Desmond Tan,Mr Desmond Tan,NEA will explore raising public awareness on the no-work rule via social media channels.,44,1140,2021-09-13-T-018-S-01140
2021-09-13-T-018,Desmond Tan,Mr Desmond Tan,"On Mr Gan Thiam Poh's suggestion to improve the noise-insulating properties of HDB flats, HDB will continue to explore practical noise mitigation measures for the comfort and well-being of residents. Given our high-density environment and with HDB flats being designed for natural ventilation, some noise will inevitably make its way into flats through our open windows and doors.",45,1141,2021-09-13-T-018-S-01141
2021-09-13-T-018,Desmond Tan,Mr Desmond Tan,We will continue to work with stakeholders to better manage construction noise in order to maintain a conducive living environment while allowing projects to keep pace with providing infrastructure and amenities for our residents.,46,1142,2021-09-13-T-018-S-01142
2021-09-13-T-018,Desmond Tan,Mr Desmond Tan,"Mr Deputy Speaker, the amendments in the Bill help lay the foundations to achieve our climate ambitions. The early switch to low-GWP equipment and proper management of HFC refrigerants will ensure that the cooling needs and comfort of Singaporeans will not be compromised as we transit to a low-carbon future.",47,1143,2021-09-13-T-018-S-01143
2021-09-13-T-018,Desmond Tan,Mr Desmond Tan,"Imposing electronic video surveillance on construction sites which have violated the no-work rule is an important step and addition to our existing enforcement measures. We hope this requirement will improve compliance and help NEA to manage public feedback more effectively. Mr Deputy Speaker, I beg to move.",48,1144,2021-09-13-T-018-S-01144
2021-09-13-T-018,Desmond Tan,Mr Desmond Tan,"[(proc text) Question put, and agreed to. (proc text)]",49,1145,2021-09-13-T-018-S-01145
2021-09-13-T-018,Desmond Tan,Mr Desmond Tan,[(proc text) Bill accordingly read a Second time and committed to a Committee of the whole House. (proc text)],50,1146,2021-09-13-T-018-S-01146
2021-09-13-T-018,Desmond Tan,Mr Desmond Tan,[(proc text) The House immediately resolved itself into a Committee on the Bill. – [Mr Desmond Tan]. (proc text)],51,1147,2021-09-13-T-018-S-01147
2021-09-13-T-018,Desmond Tan,Mr Desmond Tan,[(proc text) Bill considered in Committee; reported without amendment; read a Third time and passed. (proc text)],52,1148,2021-09-13-T-018-S-01148
2021-09-13-T-019,,,[(proc text) Order for Second Reading read. (proc text)],1,1149,2021-09-13-T-019-S-01149
2021-09-13-T-019,Edwin Tong Chun Fai,The Second Minister for Law (Mr Edwin Tong Chun Fai),"Mr Deputy Speaker, I beg to move, that the Bill be now read a Second time.",1,1150,2021-09-13-T-019-S-01150
2021-09-13-T-019,Edwin Tong Chun Fai,The Second Minister for Law (Mr Edwin Tong Chun Fai),"Sir, Singapore is internationally recognised for having a justice system that is fair, transparent and effective. We have a world-class judiciary that is known for its competence, independence and utmost integrity.",2,1151,2021-09-13-T-019-S-01151
2021-09-13-T-019,Edwin Tong Chun Fai,The Second Minister for Law (Mr Edwin Tong Chun Fai),The sound justice system has brought about many tangible benefits to Singaporeans.,3,1152,2021-09-13-T-019-S-01152
2021-09-13-T-019,Edwin Tong Chun Fai,The Second Minister for Law (Mr Edwin Tong Chun Fai),The value of our legal industry and jobs in the legal sector have grown in tandem with our status as a legal hub. A reputation for being an efficient dispute resolution centre and respect for the rule of law have also enhanced Singapore's attractiveness as an investment destination.,4,1153,2021-09-13-T-019-S-01153
2021-09-13-T-019,Edwin Tong Chun Fai,The Second Minister for Law (Mr Edwin Tong Chun Fai),"But we cannot afford to rest on our laurels. We have to constantly look ahead and improve on what we have to stay relevant and competitive. So, this Bill represents the latest of our continual efforts to improve our justice system. Let me now take Members through the key aspects of this Bill.",5,1154,2021-09-13-T-019-S-01154
2021-09-13-T-019,Edwin Tong Chun Fai,The Second Minister for Law (Mr Edwin Tong Chun Fai),"First, I would like to touch on the digital transformation of the Courts.",6,1155,2021-09-13-T-019-S-01155
2021-09-13-T-019,Edwin Tong Chun Fai,The Second Minister for Law (Mr Edwin Tong Chun Fai),"As Members will appreciate, the COVID-19 pandemic has necessitated a reduction in the level of person-to-person contact.",7,1156,2021-09-13-T-019-S-01156
2021-09-13-T-019,Edwin Tong Chun Fai,The Second Minister for Law (Mr Edwin Tong Chun Fai),"In April 2020, we introduced a temporary remote hearing framework under the COVID-19 (Temporary Measures) Act to maintain access to justice amidst safe distancing measures. These measures have brought convenience to court users and also increased administrative efficiency. We are now looking to enact a permanent framework that will facilitate the use of technology in Court proceedings.",8,1157,2021-09-13-T-019-S-01157
