speech_id,topic_id,speech_order,member_name,text
2022-03-10-T-011-S-00686,2022-03-10-T-011,686,Zaqy Mohamad,"Sir, I thank the Member for his clarification and for acknowledging the hard work that MENDAKI has put in, to put some of our industry scholarships together. So, I am pleased that the GIC-MENDAKI scholarship has come about and we will announce more details in due course. Do keep watch for this because I am quite sure it will excite quite a number of prospective young graduates who are keen to join the financial sector."
2022-03-10-T-011-S-00687,2022-03-10-T-011,687,Zaqy Mohamad,"On postgraduate scholarships, generally, as a basis, if you look at where the Government is putting its resources today, we have made a lot of push with SkillsFuture to support individuals, regardless of where they are, to gain mastery of skills and master lifelong learning. It is not just about going for a Master's or postgraduate degree, but there are also other skills training and certificates you can go for postgraduate studies."
2022-03-10-T-011-S-00688,2022-03-10-T-011,688,Zaqy Mohamad,"But even today, there are schemes like the SkillsFuture Mid-career Enhanced subsidy and the SkillsFuture Work-Study degree. You can also go for the Work-Study degree that is open to all eligible Singaporeans, including the Malay/Muslim community. These are already available scholarships that are provided across nationally. Where MENDAKI comes in is, really, to augment the suite of existing financial assistance."
2022-03-10-T-011-S-00689,2022-03-10-T-011,689,Zaqy Mohamad,"But our intent, as Mr Saktiandi may note, is that we have already started with SIA, followed by MiRXES and now GIC. There is a certain trend that we are going to work towards to look for more like-minded corporate partners who could support the move of our Malay community. One, to enhance and to provide them with a pathway into growth sectors, but also more importantly for them, it also helps to build diversity and a strong Singaporean Core for PMETs in the various companies."
2022-03-10-T-011-S-00690,2022-03-10-T-011,690,Zaqy Mohamad,"We hope to announce more in future, but it is going to be hard work in the next coming months and years to make sure that we can expand this programme further."
2022-03-10-T-011-S-00691,2022-03-10-T-011,691,,Mr Zhulkarnain Abdul Rahim.
2022-03-10-T-011-S-00692,2022-03-10-T-011,692,Zhulkarnain Abdul Rahim,"Thank you, Chairman. I thank the Minister for the announcement on the update on the Singapore Community Wakaf. I think the bigger issue will be the general estate planning, future planning and retirement security of our community. So, I agree that public awareness is key."
2022-03-10-T-011-S-00693,2022-03-10-T-011,693,Zhulkarnain Abdul Rahim,"If I may ask, with the workgroup, will there be other efforts to be made to approach the community and engage the community through the community partners, preferably through M3 and other Malay/Muslim organisations to tailor-make the message, for example, just like ""Dadah Itu Haram"" campaign that is quite effective for the community."
2022-03-10-T-011-S-00694,2022-03-10-T-011,694,Zhulkarnain Abdul Rahim,"Secondly, what would be the framework of support that we would encourage the take-up of such strategies to plan for estate planning and wealth planning, including the recruitment of Wakaf and also the Lasting Power of Attorney. This could also include legislative amendments and the proposals that I suggested in terms of the Syariah court and MUIS' recommendations."
2022-03-10-T-011-S-00695,2022-03-10-T-011,695,Masagos Zulkifli B M M,"I would like to thank the Member for the clarification. For Wakaf Masyarakat Singapura (WMS), like the Member has pointed out, the last one was given almost 40 years ago. In fact, more than 40 years ago. This culture of bequeathing your property to benefit yourself for your religious needs – but more importantly, to benefit society for the long term – is a culture that we have had for 1,400 years and we have had it in Singapore when Muslim Singaporeans had become wealthy during the early days of our colonisation. And in bequeathing these properties and, actually, in enhancing these properties alone, we have managed to accumulate something like almost $800 billion worth of assets. That is wonderful."
2022-03-10-T-011-S-00696,2022-03-10-T-011,696,Masagos Zulkifli B M M,"Unfortunately, I would say there are some constraints on how the benefits of such bequeathed properties and trusts should be distributed. Sometimes, we have problems finding the village in a country that does not exist anymore or people whom we do not know whether they are still around to benefit from these assets and trusts. And, therefore, going forward, we have to look at how these problems do not get encountered again by us and future generations."
2022-03-10-T-011-S-00697,2022-03-10-T-011,697,Masagos Zulkifli B M M,"I also want to point out that in formulating WMS, it is beyond just calling the community to bequeath their assets; it is also calling them to prepare their children to be well-endowed through education, career and also to build their own wealth, so that they do not rely on their parents' wealth to live on in their life. And that their parents also do not feel guilty in giving away that wealth for the sake of the community, for the future of the community."
2022-03-10-T-011-S-00698,2022-03-10-T-011,698,Masagos Zulkifli B M M,"We are in a good place and time right now, because, as Members have heard from many of our speeches just now, the community is at that inflexion point of being better and acquiring wealth for themselves. And I am calling them  it is great that you are benefiting yourself and your children; just think about benefiting the community and for the future."
2022-03-10-T-011-S-00699,2022-03-10-T-011,699,,Dr Shahira Abdullah.
2022-03-10-T-011-S-00700,2022-03-10-T-011,700,Shahira Abdullah,"Thank you, Chairman. I have a few clarifications. I note that we are going to have a salary review of the asatizahs and I also realised that it was announced somewhere in early 2020. May I know what is the rough timeline and when we can expect the results of the review since it was announced in 2020?"
2022-03-10-T-011-S-00701,2022-03-10-T-011,701,Shahira Abdullah,"Secondly, I would like to say that the PCICS is a wonderful initiative. From what I see from the news recently, they were given a salary incentive of $100, but it was only offered to those working in mosques and madrasahs. May I know whether it will be extended or expanded to other asatizahs and whether this $100 is benchmarked against other sectors?"
2022-03-10-T-011-S-00702,2022-03-10-T-011,702,Masagos Zulkifli B M M,"For MUIS, we can only be in control of the sectors under our care and that have to do with our madrasahs and mosques. I am very thankful that the mosque community, the madrasah community have responded without us making it compulsory or mandated through MUIS' instructions. I call upon the other sectors to do the same – recognise our asatizahs, give them a meaningful salary scale, salary level, let them live a dignified life like everybody else, like the ones that we want for our own children."
2022-03-10-T-011-S-00703,2022-03-10-T-011,703,Masagos Zulkifli B M M,"I believe our community is very, very generous. We have not pulled ourselves back whenever we call for support for our friends in Palestine when some calamity has befallen them. In fact, in many circumstances, through the Rahmatan Lil Alamin Foundation (RLAF), when disasters happened around our area, we have been able to collect donations to help victims who are not Muslims, who do not live in Muslim countries. So, we have also given, regardless of race, language or religion."
2022-03-10-T-011-S-00704,2022-03-10-T-011,704,Masagos Zulkifli B M M,"Therefore, for our asatizahs, we should be more generous and not hold back this amount. There is no benchmark for this, but, over the long term, we hope that the review on the salaries will tell us exactly where we are, what the gaps are, and, more importantly, how to get the funds to fund this gap, and here is where we will need to rely on the wealth and generosity of our own community to fund our own religious needs."
2022-03-10-T-011-S-00705,2022-03-10-T-011,705,,Ms Nadia Samdin.
2022-03-10-T-011-S-00706,2022-03-10-T-011,706,Nadia Ahmad Samdin,"I would like to thank Minister Masagos Zulkifli and Second Minister Mohamad Maliki Osman. In Malay, please."
2022-03-10-T-011-S-00707,2022-03-10-T-011,707,Nadia Ahmad Samdin,"(In Malay)  [Please refer to  Vernacular Speech.] I would like to come back to my two questions on FITRAH, that is, if M3 will collaborate with the Malay/Muslim organisations, ComLink and other agencies. Are there plans to offer and coordinate support to the family of offenders, not just at the beginning or the end of their incarceration period, but throughout the sentence so that the offender's family can emerge stronger?"
2022-03-10-T-011-S-00708,2022-03-10-T-011,708,Nadia Ahmad Samdin,"Second, as the FITRAH programme requires the commitment and support from a rather large number of volunteers, how will the FITRAH structure be strengthened for the long term?"
2022-03-10-T-011-S-00709,2022-03-10-T-011,709,Mohamad Maliki Bin Osman,"Sir, I thank Ms Nadia Samdin for the supplementary question. She is absolutely right. When we work with families, like those under FITRAH, it is very complex. The structure of the families is very complex. Sometimes, you do have the father in prison, single mothers having to deal with very young children. Sometimes, you have both parents who are in prison, incarcerated and the children are under the care of grandparents, making it very complex."
2022-03-10-T-011-S-00710,2022-03-10-T-011,710,Mohamad Maliki Bin Osman,"When we started FITRAH, it was really looking at many different dimensions. One is to ensure that the needs of the children are supported primarily by family members who are outside, because it is the stability of the children, while the parents are incarcerated, that is very critical. And stability comes in the form of ensuring that they continue to be able to go to school, they are able to get support for their socio-emotional development and everything around that concept. And that is the first part of looking after the children – to understand their socio-emotional needs, and even their economic needs."
2022-03-10-T-011-S-00711,2022-03-10-T-011,711,Mohamad Maliki Bin Osman,"At the same time, we ensure that work with the inmates continue. That is very important. And the reason why we put the framework in place is to give a very strong message to the inmates that it is a time for reflection and rehabilitation for you, too, so that when you do come out and get released, that you do make every attempt to turn over a new leaf."
2022-03-10-T-011-S-00712,2022-03-10-T-011,712,Mohamad Maliki Bin Osman,"And this is very important because, sometimes, we do come across inmates who repeat the offences and they go back in and we want to make sure that FITRAH provides comprehensive support to prevent relapses amongst the inmates."
2022-03-10-T-011-S-00713,2022-03-10-T-011,713,Mohamad Maliki Bin Osman,"On collaboration and coordination of different programmes, I assure Ms Nadia Samdin that we continue to do so. Part of the effort of helping FITRAH families will be the effort of UPLIFT, part of the effort will be under ComLink. So, the coordination effort is being worked on and, certainly, we agree that it is not just while the inmate is incarcerated, support must continue to be given even after they have been released so that they see stabilisation has been achieved while they are incarcerated. Yet, at the same time, we work towards independence and self-reliance moving forward for the incarcerated individual and their families."
2022-03-10-T-011-S-00714,2022-03-10-T-011,714,Tin Pei Ling,"Chairman, community harmony is important to engender a sense of collective and shared destiny. But this can be undermined at times by misunderstandings and disputes. During our constituency work, we would have come across a range of community disputes – noise from neighbours, noise from groups playing at the basketball court downstairs, cigarette smell, incessant high-rise littering, irresponsible feeding, encroachment of common space and the list goes on. In these disputes, one party may be puzzled about why does the other party not understand or comply with the implicit and explicit ""rules""; the other party may think that there was nothing wrong with the behaviour and wonder why the complainant is making life difficult."
2022-03-10-T-011-S-00715,2022-03-10-T-011,715,Tin Pei Ling,"Small disagreements, if left unresolved, can fester into ill-feelings and anti-social behaviours with long-lasting effects. Our community is diverse, with people of different backgrounds. The idea of co-existence is important, though a delicate balance to strike. Community norms, therefore, play a critical role in keeping a certain order and harmony in the community."
2022-03-10-T-011-S-00716,2022-03-10-T-011,716,Tin Pei Ling,"As time passes or as environment changes, norms could shift. The pandemic has forced us to stay home more. We face one another more and things that used to not bother us can become difficult to bear. So, we need to review, re-establish and/or revise the norms needed in the community. To do so, we need more dialogues and engagements but, most importantly, is that the community must come to a common understanding on the priorities and acceptable behaviours within the community."
2022-03-10-T-011-S-00717,2022-03-10-T-011,717,Tin Pei Ling,"To this end, the Community Dispute Resolution Framework has been a useful and complementary tool to improve community dispute management. Therefore, I would like to ask how MCCY will continue to enhance the framework to effectively manage community disputes and relations, while partnering Singaporeans to co-create and establish community norms in their own neighbourhoods."
2022-03-10-T-011-S-00718,2022-03-10-T-011,718,Derrick Goh,"Mr Chairman, one major lifestyle change arising from COVID-19 has been about more residents working or learning from home."
2022-03-10-T-011-S-00719,2022-03-10-T-011,719,Derrick Goh,"Along with this trend, we are seeing a rise in the number of disputes within the community. For example, last year, HDB reported around 38,400 cases of noise-related feedback, a 25% increase from 2020, while the Community Dispute Resolution Tribunal (CDRT) also saw higher applications."
2022-03-10-T-011-S-00720,2022-03-10-T-011,720,Derrick Goh,"When community disputes arise, grassroots volunteers and on-the-ground agencies, such as HDB, Town Council or Police, are often the first responders to help engage the parties. Those of us who have helped to mediate a dispute will know that they are never easy. With the number of conflicts between neighbours on the rise, our first responders will be strained with more cases."
2022-03-10-T-011-S-00721,2022-03-10-T-011,721,Derrick Goh,"Given this, can the Minister share if MCCY will dedicate more resources, such as improving training for our first responders, to help our communities be more effective in managing such conflicts?"
2022-03-10-T-011-S-00722,2022-03-10-T-011,722,Derrick Goh,"The Community Mediation Centre (CMC) also plays an integral role in resolving neighbour disputes. Mediation at the CMC is an informal and voluntary process, conducted by professionally-trained mediators who are volunteers from all walks of life. Cases referred to the CMC have seen relative success. Can the Minister share more on CMC's effectiveness and will the Government consider mandating mediation for community disputes?"
2022-03-10-T-011-S-00723,2022-03-10-T-011,723,Derrick Goh,"Lastly, a legal avenue for resolving disputes is the CDRT. My constituents gave feedback that those who have engaged with the CDRT have not found it to be easy, as they faced long battles which are often adversarial in nature, usually as a result of counter parties raising evidence or allegations haphazardly during proceedings. The process may, therefore, result in more friction and deteriorate relationships further. Therefore, it is important to ensure that parties engaging in the legal process will be able to ensure quick and effective justice at a lower cost."
2022-03-10-T-011-S-00724,2022-03-10-T-011,724,Derrick Goh,"Experts and businesses have said that this hybrid model of working and learning from home is here to stay, even if the pandemic ends. I look forward to the Minister's plans on how the Government can strengthen existing solutions to counter the growth in community disputes, so as to preserve our social cohesion and harmony."
2022-03-10-T-011-S-00725,2022-03-10-T-011,725,Gerald Giam Yean Song,"I would like to seek the Minister's update on the review of the community dispute management framework, which commenced before last year's Committee of Supply. Can the Minister share who the members of the interagency committee conducting this review are and when the review will be completed? How many mediators does the Community Mediation Centre (CMC) currently have and is this sufficient to manage their workload?"
2022-03-10-T-011-S-00726,2022-03-10-T-011,726,Gerald Giam Yean Song,"I have met residents who have a vexing dispute with their neighbours but are unwilling to let me refer them for mediation because they know their neighbour will not turn up for the session. Of the average of 735 cases per year registered at the CMC, 70% did not progress to mediation, mainly because one or both parties declined or did not respond to the invitation to mediate. To improve the take-up rate of mediation, could the Ministry consider these suggestions?"
2022-03-10-T-011-S-00727,2022-03-10-T-011,727,Gerald Giam Yean Song,"First, once the CMC assesses a case to be suitable for mediation, can attendance of both parties be made compulsory? Second, if the dispute eventually goes to the Community Dispute Resolution Tribunal (CDRT), can the Tribunal be allowed to draw an adverse inference from their non-attendance? This potential penalty should be made clear to respondents when the invitation to the CMC is served."
2022-03-10-T-011-S-00728,2022-03-10-T-011,728,Gerald Giam Yean Song,"Next, I have received feedback from residents about the difficulty they face in filing CDRT evidence. For example, they need to save their audio or video recordings on a CD-ROM or DVD. Most people nowadays do not have a CD-ROM burner in their home. Can the CDRT update its processes to allow evidence to be uploaded on the web portal instead and to make the whole process more user-friendly for the layman?"
2022-03-10-T-011-S-00729,2022-03-10-T-011,729,Gan Thiam Poh,"Madam, disputes among neighbours are becoming increasingly common. Unfortunately, a significant number take a long time to resolve due to the uncooperative neighbours, some of whom are openly and persistently flouting the law. These cases include harassment, obstruction of passageways, dangerous placement of objects, fire hazard and noise pollution. Would the Ministry consider setting up a dedicated team for mediation and enforcement and a hotline for residents to contact for issues relating to neighbour disputes?"
2022-03-10-T-011-S-00730,2022-03-10-T-011,730,Patrick Tay Teck Guan,"Madam, I wish to ask MCCY how many Community Disputes Resolution Tribunal (CDRT) cases have been filed, heard, mediated and adjudicated on annually in the past five years."
2022-03-10-T-011-S-00731,2022-03-10-T-011,731,Patrick Tay Teck Guan,"Also, what actions, if any, have our Courts or complainants taken when offending parties, even after the tribunal order, still continue to perpetrate and breach the order?"
2022-03-10-T-011-S-00732,2022-03-10-T-011,732,Patrick Tay Teck Guan,"I wish to also ask MCCY to share if there are plans to better ensure the more effective and efficient resolution of CDRT complaints as there are more situations of work from home and resulting in more neighbourly disputes and some of these disputes cannot be resolved via the voluntary mediation route via community mediation and whether such mediation, moving forward, can be made compulsory?"
2022-03-10-T-011-S-00733,2022-03-10-T-011,733,,Ms Joan Pereira. Please take your two cuts together.
2022-03-10-T-011-S-00734,2022-03-10-T-011,734,Joan Pereira,"Madam, the COVID-19 pandemic ignited a spirit of ""gotong-royong"" in my division when the Bukit Merah View Market and Hawker Centre became a COVID-19 cluster last year. Many residents, community partners, religious organisations, private companies and strangers reached out to me and my community to volunteer and offer various forms of help, especially to the hawkers and the vulnerable in my division. It was very heartwarming and the community became even more closely-knit and resilient. With the pandemic placing restrictions on community events, which we used to organise in the past, we need to reorganise how we connect and strengthen ties among our neighbours. Building friendship and trust amongst our neighbours must still continue to be the focus."
2022-03-10-T-011-S-00735,2022-03-10-T-011,735,Joan Pereira,"However, we know that disputes still occur. What we observe sometimes is that relationships become so bad that neighbours do not talk to each other and, in some cases, even dragging in other neighbours into the dispute, creating a non-harmonious living environment. I hope that MCCY can empower our grassroots volunteers and staff with relevant skillsets to mediate disputes between neighbours. It is best when things can be settled and nipped in the bud at the local level without further straining relationships. How will MCCY empower our grassroots leaders and staff to build on this spirit of care and continue to strengthen community life at the local neighbourhood level?"
2022-03-10-T-011-S-00736,2022-03-10-T-011,736,Joan Pereira,"The mission of our Inter-racial and Religious Confidence Circles (IRCCs) is ever more important today as we face sharper fault lines and greater challenges to our racial and religious harmony. When there is conflict, especially when it involves potentially sensitive racial or religious issues, we must quickly seek to resolve and nip the problem in the bud. We should not ignore it and hope for it to blow over, thereby allowing the problem to fester and blow up into a bigger problem."
2022-03-10-T-011-S-00737,2022-03-10-T-011,737,Joan Pereira,"The best way, really, is through mediation, with trained personnel who have the necessary knowledge and skillsets for the problem at hand. With a mediator, whom all stakeholders can acknowledge and respect, the chances of resolving the problem is much higher. Would the Ministry elaborate on how it will bring disputing parties together to resolve such issues?"
2022-03-10-T-011-S-00738,2022-03-10-T-011,738,Joan Pereira,"We must also educate our people about the customs of different races and religions, so that we can be more mindful and avoid potentially offensive behaviour. We must be respectful of one another's differences and widen the common space. There are often complaints of noise disturbances or certain practices of religious or cultural events and festivities. As we approach the 20th anniversary of IRCCs in 2022, what are MCCY's plans to ensure that our IRCCs remain relevant and effective in maintaining racial and religious harmony and strengthening our social cohesion?"
2022-03-10-T-011-S-00739,2022-03-10-T-011,739,Cheng Li Hui,"Madam, over the past two years, we have weathered the challenges brought on by COVID-19, hand-in-hand, both the Government and people. As a result, we are in a much stronger position today even as we ride out the current Omicron wave and look forward to a better future."
2022-03-10-T-011-S-00740,2022-03-10-T-011,740,Cheng Li Hui,"I was reminded of it recently during the Tampines East Edusave Ceremony when this lady said ""Hi Miss Cheng, we finally meet"". It turns out that she is the chairlady of her company's CSR and she had mobilised the team to help out in our mask-making during the circuit breaker. We had only corresponded via emails and phone. I remembered then, Standard Chartered Bank also listed my email on their CSR portal and I would get dozens of emails daily asking ""How can I help?"" The logistics company, taxi driver and fabric supplier who helped, all declined payment. It was their way of contributing to fight the pandemic."
2022-03-10-T-011-S-00741,2022-03-10-T-011,741,Cheng Li Hui,"Many would have also heard of neighbours helping one another with grocery purchase, mask and sanitiser collection, especially for their elderly neighbours. Our cohesiveness as a nation has strengthened over the pandemic years."
2022-03-10-T-011-S-00742,2022-03-10-T-011,742,Cheng Li Hui,"Chairman, this cohesiveness among our people and the trust in the Government that we have in Singapore are precious. In many other parts of the world, we have seen how the pandemic had aggravated existing fault lines and even created tensions between the government and people, with anti-vaccination and anti-mask protests. These tensions made it more challenging to deal with the pandemic."
2022-03-10-T-011-S-00743,2022-03-10-T-011,743,Cheng Li Hui,Can the Ministry share how we can continue to build upon this spirit of care and strengthen community cohesiveness in Singapore? How can we make volunteerism and care a part of our lives and match like-minded people to the causes that they are interested in?
