speech_id,topic_id,speech_order,member_name,text
2022-03-10-T-010-S-00344,2022-03-10-T-010,344,Masagos Zulkifli B M M,"From MSF, through public education campaigns, such as Break the Silence, to raise awareness and encourage victims, regardless of nationality, marital status, gender, race, religion or even sexual orientation, to seek help early. We also urge the public to step forward to report violence and abuse where LGBT cases may be involved."
2022-03-10-T-010-S-00345,2022-03-10-T-010,345,Masagos Zulkifli B M M,"Concerns surrounding section 377A and its implication will still have the potential to polarise society. It is an issue that involves deeply-held beliefs and values and divergent societal views and goals. We thank the religious, sectoral, civil society and LGBT groups that have shown support for civil dialogue and respect for the values of others, even when different from their own."
2022-03-10-T-010-S-00346,2022-03-10-T-010,346,Masagos Zulkifli B M M,"We will continue to adopt the approach of civil dialogue, working with all, involving all stakeholders as we chart our own unique Singapore way forward, without creating sudden shifts and deep divisions in our society."
2022-03-10-T-010-S-00347,2022-03-10-T-010,347,,Minister of State Sun Xueling.
2022-03-10-T-010-S-00348,2022-03-10-T-010,348,Sun Xueling,"I thank the Member Mr Seah Kian Peng for his clarification. I have said this before and my views have not changed – I respect single parents, single unwed parents, for the love and care that they have for their children. And I fully recognise that it is not easy to bring up children, even more so single-handedly."
2022-03-10-T-010-S-00349,2022-03-10-T-010,349,Sun Xueling,"That is why in the Alliance for Action to Strengthen Marriages and Family Relationships (AFAM), we have a dedicated focal area on single parents. Specifically, for the areas which we are following up on in our dialogues and engagement sessions with single unwed parents, a few areas, a few pain points, have been highlighted to us."
2022-03-10-T-010-S-00350,2022-03-10-T-010,350,Sun Xueling,"Firstly, on childminding. That is why, in my main response earlier, I had talked about the childminding service pilot that MSF will be partnering a social service agency to provide childminding service beyond a regular childcare centre's operating hours. And this is important because we know that when we solve childminding issues and concerns of single parents, they then will have the capacity, the time and the energies to look into employment."
2022-03-10-T-010-S-00351,2022-03-10-T-010,351,Sun Xueling,"The second area – when it comes to employment support, we are having discussions with NTUC, with community partners, to see what are the areas we can assist our single unwed parents in, be it in training or finding local opportunities for these single parents to be able to re-enter the workforce and get on a sustainable path with their children."
2022-03-10-T-010-S-00352,2022-03-10-T-010,352,Sun Xueling,"The third pain point that has been highlighted to us has been around housing. In this particular area, I have had the opportunity to work with Member Mr Louis Ng for many years when we have discussed this in Parliament and in my time at the MND. Members will recall that Minister of State Faishal Ibrahim had recently shared in Parliament that, generally, single unwed parents can receive the outcome of their rental flat application within three weeks of submitting all required information, although additional time may be required for complex cases."
2022-03-10-T-010-S-00353,2022-03-10-T-010,353,Sun Xueling,"These three areas – childminding, employment support, housing – have been brought up as pain points and we are actively looking at how we can solve these pain points for our single unwed parents."
2022-03-10-T-010-S-00354,2022-03-10-T-010,354,Sun Xueling,"I also wanted to highlight that after the focus group discussion that my team at MSF and I had with the single unwed parents – and Members like Mr Louis Ng and other Members of Parliament had joined me for the session as well – my team had followed up individually with the single unwed parents to clarify any outstanding issues that they had raised, which sometimes also arises out of misunderstandings or miscommunications of Government policies in their interactions with Government agencies."
2022-03-10-T-010-S-00355,2022-03-10-T-010,355,,Parliamentary Secretary Eric Chua.
2022-03-10-T-010-S-00356,2022-03-10-T-010,356,Eric Chua,"Thank you, Mdm Chairman. I want to thank the Member for his clarification on ComLink and I also want to thank the Member for attributing the adjective ""success"" with ComLink at this point. But I do think it is a little bit premature."
2022-03-10-T-010-S-00357,2022-03-10-T-010,357,Eric Chua,"We started ComLink with four sites in 2019 – Jalan Kukoh, Boon Lay, Kembangan-Chai Chee as well as Marsiling. So, we have piloted that at four sites. We thought the model worked well and that is why we are going into a two-phased approach  11 towns last year, as well as 10 towns this year."
2022-03-10-T-010-S-00358,2022-03-10-T-010,358,Eric Chua,"What we are trying to achieve through ComLink is our promise in our Social Compact  to help our low-income families. This is really going for the long haul because if you look at the broad objectives of stability, self-reliance and social mobility we are talking about – and mostly, on social mobility – we are talking about long-term outcomes."
2022-03-10-T-010-S-00359,2022-03-10-T-010,359,Eric Chua,"Through ComLink, we are tracking various outcomes, indicators, not just in terms of immediate process indicators, but also perception. Finally, and most importantly, in my own opinion, outcome indicators – where do the families end up?"
2022-03-10-T-010-S-00360,2022-03-10-T-010,360,Eric Chua,"I want to stress the fact that, actually, time or speed might not be of the essence in this scenario. Because we are talking about having a very customised, very bespoke approach to going to each family, understanding them, both their challenges that they face, as well as the aspirations and dreams that they have; and then helping them to take away, remove or sidestep some of these challenges while, at the same time, working towards their longer-term goals, their aspirations."
2022-03-10-T-010-S-00361,2022-03-10-T-010,361,Eric Chua,"I do not think it is something that can be achieved overnight. You cannot get to Rome in one evening but we can most certainly do that if we adopt a whole-of-society approach – where the community, our social service agencies and the Government come together. Then, I think we have a fair chance at success for this programme."
2022-03-10-T-010-S-00362,2022-03-10-T-010,362,,"I see quite a few hands. So, I am going to ask Members to please ask your questions succinctly and for the replies to also be short. Mr Gerald Giam."
2022-03-10-T-010-S-00363,2022-03-10-T-010,363,Gerald Giam Yean Song,"Thank you, Madam. I have some questions on the adult disability care. Is the staff-client ratio of adult disability care facilities lower than that of the teacher-student ratio at SPED schools? If so, why is there this disparity between the two? Because this is what causes the cliff effect for those who are graduating from SPED schools. And lastly, does MSF have any plans to close this gap, given that most SPED school graduates will need to attend post-18 disability care facilities?"
2022-03-10-T-010-S-00364,2022-03-10-T-010,364,Eric Chua,"I thank the Member for his clarification. On the first question of whether the staff ratio for the adult disability care facilities is on par with the SPED schools, I do not have the numbers for the staff ratios for SPED schools on hand at the moment. So, I cannot give a fair comparison across these two types of facilities."
2022-03-10-T-010-S-00365,2022-03-10-T-010,365,Eric Chua,"On the second point about closing the gaps, I do think that what we are doing is journeying with our persons with disabilities and, as I mentioned earlier, what we have done is to, over time, where necessary, increase funding. For instance, I mentioned increased funding for our day activity centres by some 20% or $3 million last year and we have also increased funding for our adult disability homes by about 25% most recently as well."
2022-03-10-T-010-S-00366,2022-03-10-T-010,366,Eric Chua,"Our intention is really to make sure that we cater for the right amount as well as the right type of services that our persons with disabilities need within the community. In terms of closing the gap, that is definitely what we hope to do. That is why in the iterations of the three Enabling Masterplan (EMP) since 2007, we have been keeping at it. We have been working on the fourth edition. As Members know now, the results and findings of which will be made known in the later part of this year. I hope that Members can look out for the announcements that we make under EMP 2030."
2022-03-10-T-010-S-00367,2022-03-10-T-010,367,,Ms Denise Phua.
2022-03-10-T-010-S-00368,2022-03-10-T-010,368,Denise Phua Lay Peng,"I really appreciate Parliament Secretary Eric Chua's sincerity in working with us on the ground. I also appreciate Mr Gerald Giam's concern for persons with disabilities. My supplementary question is whether MSF would consider convening a very specific group – either you call it Alliance for Action (AfA) or any action group – that will look into the overall holistic needs of this community. Because to ask for, say, free transport or free schools is not complete. MOE, I computed, spends about $260 million a year – there are some more cohorts coming and there are a lot of adults who do not have services now. So, the amount for education alone is going to be a lot bigger. There are other needs."
2022-03-10-T-010-S-00369,2022-03-10-T-010,369,Denise Phua Lay Peng,"Rather than asking individually, I do think we need a holistic strategic study of the entire needs of the disabled, then prioritise them, cluster them, size it up, see what is needed and then look at how much can be supported by Government grants, how much can be supported by those who can afford a bit more, and those who are in the community – Temasek Foundation or Temasek Trust for that matter, which have been very helpful – and other foundations. So, look at it holistically, convene a group that will look at it as a whole, size it, compute how much is required and then see how we can actually operationalise the whole thing for sustainability and to meet the prioritised needs."
2022-03-10-T-010-S-00370,2022-03-10-T-010,370,,"Ms Denise Phua, please ask your question."
2022-03-10-T-010-S-00371,2022-03-10-T-010,371,Denise Phua Lay Peng,Thank you very much.
2022-03-10-T-010-S-00372,2022-03-10-T-010,372,,Parliamentary Secretary Eric Chua.
2022-03-10-T-010-S-00373,2022-03-10-T-010,373,Eric Chua,"Thanks, Mdm Chairman. Likewise, I want to thank Ms Denise Phua for her passion in this area of work, which I think is really infectious whenever she is at the EMP meetings where she brings with her great ideas as well."
2022-03-10-T-010-S-00374,2022-03-10-T-010,374,Eric Chua,"I want to keep this short. We will not shun away from our responsibilities on this. That is why the Disability Office, Social Policy and Services Group (SPSG) in MSF, is there, and that is why we will continually look at these issues in totality and not just look at them from our own vantage point, but to also look at them together with our partners in the community, the social service agencies. Which is why, in today's EMP 2030 Steering Committee, we have a whole range of representations from both the people, private and public sectors. I am co-chairing that with Mr Gan Seow Kee, Vice-Chairman of SBF, and I think that is a good example of how we hope to really make a difference in this disability space for good and in a sustained fashion."
2022-03-10-T-010-S-00375,2022-03-10-T-010,375,Eric Chua,"And in this latest EMP, one of the bold moves that we are making – and I am letting the cat out of the bag a little bit here – is to really fix some tangible goals for ourselves as to where we want to get to in the next few years leading up to 2030, where the endpoint of the Enabling Masterplan is. It is an endpoint, but it is, to me, just a checkpoint. Because what happens after 2030? It is the fourth, but, definitely, not the last masterplan that we will have. We will have to keep working at these issues because some of these things that we want to change in society pertain to mindsets, culture, how we maybe even react to persons with disabilities in our midst. So, there is a lot of work for us to do together and I want to give the Member the assurance that we will be keeping at this for the long haul."
2022-03-10-T-010-S-00376,2022-03-10-T-010,376,,"I like the passion in the room, but I would like to please remind everyone to be succinct. Ms Carrie Tan."
2022-03-10-T-010-S-00377,2022-03-10-T-010,377,Carrie Tan,"Thank you, Chairperson, I will try to keep it short. I appreciate the Ministry's efforts to increase the digitalisation efforts to make financial assistance more accessible. But given that many of the vulnerable communities are very low on their digital literacy, where they literally may not even know how to use Gmail on their phones, let alone to navigate Government portals, I would like to know what are the Ministry's efforts in trying to bridge this digital literacy gap and, if the befrienders from ComLink are meant to also support them on this front, then what are the ways that the Ministry might be looking at empowering befrienders and giving them the necessary access and safeguards around PDPA to support ComCare beneficiaries for their online applications?"
2022-03-10-T-010-S-00378,2022-03-10-T-010,378,Carrie Tan,"Secondly, given that the process of climbing out of poverty tends to be a long one and it is not a matter of bouncing back, will the Ministry consider automatic extension of ComCare to short-term financial assistance recipients, given that, right now, it presents a disincentive to some of them attaining jobs with the uncertainty and prospect that they may lose financial assistance upon getting a job? So, would that not be a way to reduce the administrative load of the Ministry and, at the same time, helping to reduce the bandwidth tax on applicants?"
2022-03-10-T-010-S-00379,2022-03-10-T-010,379,,Minister Desmond Lee.
2022-03-10-T-010-S-00380,2022-03-10-T-010,380,Desmond Lee,"Let me address the Member's first question. The SupportGoWhere portal provides a digital enabler to help families to navigate support schemes and to be able to make the applications digitally. But we are mindful that many of our clients, including seniors, are more comfortable face-to-face, maybe on the phone, and befrienders will be a big plus. And so, all that remains – in fact, that remains core – because, in this line of work, in social service delivery, it is high-touch, high-feel. It is really an emotional connection. But a digital platform adds another layer of support."
2022-03-10-T-010-S-00381,2022-03-10-T-010,381,Desmond Lee,"Even in the real-world space, I have described earlier streamlined action protocols, One Client View (OneCV) and Case Connect working in the backend to enable organisations to work around the client's needs and their families, even as the client approaches the Social Services Office (SSO) physically. And for clients who approach the SSO, way before COVID-19 or just before COVID-19, we had already put in place video conferencing capacities to enable a client of the SSO to communicate not just with the SSO officer physically, but virtually be able to link-up with the HDB officer and, of course, with other agencies as well. So, that remains an important way to support those who may not be so digitally-inclined to seek help that way."
2022-03-10-T-010-S-00382,2022-03-10-T-010,382,,Minister Masagos Zulkifli.
2022-03-10-T-010-S-00383,2022-03-10-T-010,383,Masagos Zulkifli B M M,"I just want to assure Ms Carrie Tan that we do not want a cliff effect and disincentivise someone from graduating. We are not there to kick people out of ComCare, or get them out of ComCare because we just do not want to give them support. We want to enable them and, as mentioned in my speech, if Ms Carrie Tan has heard carefully, the SSOs are given discretion to continue support even after the person has found, for example, a job, a better job, a better paying job, and not suffer this cliff effect that we may have, inadvertently, through our policy, done in the past. This is not how we are going to go forward."
2022-03-10-T-010-S-00384,2022-03-10-T-010,384,,Mr Don Wee.
2022-03-10-T-010-S-00385,2022-03-10-T-010,385,Don Wee,"Thank you, Mdm Chairman. I have three questions. Minister Masagos Zulkifli mentioned that, through ComLink, there will be a proactive approach to appear at deserving residents' doorsteps. So, I guess the lower-hanging fruits at this moment will be the existing clients in the SSO systems as well as there are also likely to be referrals from the Family Service Centres of ComCare recipients. So, my question is, can the potential pool of clients be expanded to beneficiaries of the MOE Financial Assistance Scheme (FAS), MediFund as well as the various self-help groups like SINDA, MENDAKI or CDAC? So, by doing so, their application process must have a housing type and identifier in the application process. And it will also mean that system requirements will be required."
2022-03-10-T-010-S-00386,2022-03-10-T-010,386,Don Wee,"Second question. Along the same vein, relating to the app which allows clients to apply for various schemes, I guess this is like the Municipal Services Office (MSO) OneService app equivalent for less-privileged Singaporeans. So, over time, I hope the app can also allow these clients to apply for schemes offered by the self-help groups and the ComChest accredited Voluntary Welfare Organisations (VWOs)."
2022-03-10-T-010-S-00387,2022-03-10-T-010,387,Don Wee,"Third question. I also welcome the various improvements, like OneClientView, the single means-testing approach, as well as the tele-counselling which expedites the application turnaround time. So, to improve the handshake process further, can we also explore co-locating SSOs as well as the Family Service Centres, or SSAs, in future because the newer rental precincts do not come with spacious void decks these days."
2022-03-10-T-010-S-00388,2022-03-10-T-010,388,Don Wee,"Lastly, I would also like to thank the —"
2022-03-10-T-010-S-00389,2022-03-10-T-010,389,,"Thank you, Mr Don Wee, you have asked quite a lot of questions. I want to leave time for others. Parliamentary Secretary Eric Chua."
2022-03-10-T-010-S-00390,2022-03-10-T-010,390,Eric Chua,"Thank you, Mdm Chairman. I also want to thank the Member for his three clarifications. First, on expanding beyond the existing pool that we have identified to include those from self-help groups, schools, FAS and whatnot, I am mindful that we already have 14,000 families identified for this year and the next. We do want to focus on them. I would say that let us focus on these 14,000 families because a bespoke and customised approach has to be had for each of these families. So, I do not think it is something that we want to take lightly. And once we are on a steady state with the existing 14,000 families, we will want to move on to as many other families that we can assist as possible. So, that is for first question."
2022-03-10-T-010-S-00391,2022-03-10-T-010,391,Eric Chua,"For the second question, the answer is we will take a look at that and we will, gradually, progressively, evolve what we can provide in the technology and in the app."
2022-03-10-T-010-S-00392,2022-03-10-T-010,392,Eric Chua,"The third question relates to the co-location of the different institutions, SSOs, FSCs and all that. We have piloted that at Kreta Ayer and Bukit Merah and we have co-located the SSO and FST. [Please refer to ""Clarification by Parliamentary Secretary to Minister for Social and Family Development"", Official Report, 10 March 2022, Vol 95, Issue No 58, Correction by Written Statement section.]"
2022-03-10-T-010-S-00393,2022-03-10-T-010,393,Eric Chua,"We have also co-located SSO and AIC in Bedok and also in Tampines Hub. So, these are some examples. As we evolve the delivery of social services, we can look at how we can actually co-locate some of our services as well."
2022-03-10-T-010-S-00394,2022-03-10-T-010,394,,Ms Joan Pereira. Please keep it short so that I can let the other two clarifications be asked.
2022-03-10-T-010-S-00395,2022-03-10-T-010,395,Joan Pereira,"Thanks, Mdm Chairman. I have two clarifications. On the topic of preschool accessibility, I am very glad that Sengkang and Punggol will have more preschool places. Dawson, which I serve, also has many young families. So, I hope and look forward to more preschool centres there."
2022-03-10-T-010-S-00396,2022-03-10-T-010,396,Joan Pereira,"Second clarification, can the Ministry consider my proposal to have active reach-outs to families which have been on the waiting list for about three to six months? I hope the Ministry can reach out to them, understand their needs and help them register in a nearby centre with a vacancy, because I know most parents and grandparents will want to put their charges at a centre near their homes."
2022-03-10-T-010-S-00397,2022-03-10-T-010,397,,Minister of State Sun Xueling.
2022-03-10-T-010-S-00398,2022-03-10-T-010,398,Sun Xueling,"I thank the Member for her clarification. With the injection of new BTOs in the Dawson area, Early Childhood Development Agency (ECDA) has planned new centres, as well as extension of existing centres, to increase preschool places to address the increase in demand. I also want to make a general point that, for other New Towns or some of the older estates where there are new insertions of BTOs, ECDA"
2022-03-10-T-010-S-00399,2022-03-10-T-010,399,Sun Xueling,"On the Member's second question, currently, parents may register their interest in a preschool via the Preschool Search Portal, which is an online self-help portal. On this portal, parents can actually search by proximity, understand more about which are the centres that are available, what is the waitlist situation like."
2022-03-10-T-010-S-00400,2022-03-10-T-010,400,Sun Xueling,"Every three months, the portal will inform the parents about the latest situation around the preschool places. And if the Member is aware of specific instances whereby the parent is still unable to locate a preschool which is suitable for the family and the child, to please highlight the situation to myself, to ECDA, and we will follow up closely to find a preschool which, hopefully, the parents can accept."
2022-03-10-T-010-S-00401,2022-03-10-T-010,401,Sun Xueling,"Sometimes, parents can have their specific requirements around specific preschools. They may sometimes want a specific preschool within a specific walking distance from home and we will try very much to accommodate. So, on a national level, in terms of preschool capacity, we have enough, but we recognise that, in localised areas, there may be areas with higher demand and, when that happens, ECDA will work closely with the parents and the advisor there to help those young families living in those areas."
2022-03-10-T-010-S-00402,2022-03-10-T-010,402,,Mr Leon Perera.
2022-03-10-T-010-S-00403,2022-03-10-T-010,403,Leon Perera,"Thank you, Mr Chairman, Sir. Just three clarifications for Minister Masagos Zulkifli. I will try and keep it short."
2022-03-10-T-010-S-00404,2022-03-10-T-010,404,Leon Perera,"Firstly, would the Ministry consider the proposal contained in my Budget speech to set a poverty line and measure the number of families, particularly, the number of children, who fall below this line every year so that we can measure how we are making an impact on the issue of poverty and transitioning people out of poverty? I note that some other countries do publish this data."
2022-03-10-T-010-S-00405,2022-03-10-T-010,405,Leon Perera,"Secondly, on the quantum of financial assistance, how often is this reviewed? When will the next review be and do these reviews take into consideration new research, such as the study by Prof Teo You Yenn and Dr Ng Kok Hoe that I referred to?"
2022-03-10-T-010-S-00406,2022-03-10-T-010,406,Leon Perera,"Lastly, a narrow clarification. The Minister referred to our intergenerational social mobility being better than North America and Europe, if I heard him correctly. Could the Minister reference what is the study that demonstrates that? Because I am not aware of that."
2022-03-10-T-010-S-00407,2022-03-10-T-010,407,Masagos Zulkifli B M M,I will try to answer that in three minutes.
2022-03-10-T-010-S-00408,2022-03-10-T-010,408,Masagos Zulkifli B M M,"Firstly, the data that talks about social mobility. This came from a study. The source is Chetty et al, 2014, and the authors are from the US, UK, Denmark; and our own estimates are updated by the authors using administrative data. The US is about 7.5% for the share of individuals who reach the top income quintile among those born to the bottom quintile. So, 7.5% and that is North America. For the UK, it is about 9%; Europe, 11%. In Singapore, it is maintained at about 14%, especially for those that we have estimated for the 1985 to 1989 cohorts. This is published, as I mentioned, by Chetty et al, from the US, UK, Denmark, Canada; the authors are from these countries."
