speech_id,topic_id,speech_order,member_name,text
2022-03-10-T-011-S-00958,2022-03-10-T-011,958,Edwin Tong Chun Fai,"Our youth athletes did extremely well, too. Colin Soon won four Gold medals at the Asian Youth Para Games for swimming; Maximilian Maeder won the Under-19 World Championships for kite foiling; and Izaac Quek, who is competing at the World Table Tennis (WTT) Singapore Smash, won the Under-15 Singles title for table tennis."
2022-03-10-T-011-S-00959,2022-03-10-T-011,959,Edwin Tong Chun Fai,"We will have a busy sporting calendar in 2022. We will have the Hanoi SEA Games in May, the Birmingham Commonwealth Games in July and August, the Hangzhou Asian Games and the Hangzhou Para Games in September and October, respectively."
2022-03-10-T-011-S-00960,2022-03-10-T-011,960,Edwin Tong Chun Fai,"I am confident that our TeamSG athletes will continue to fly our flag high and inspire us with their resilience, fortitude and solidarity, the very same qualities that will enable Singapore to progress and develop on multiple fronts."
2022-03-10-T-011-S-00961,2022-03-10-T-011,961,Edwin Tong Chun Fai,I have spoken at length in Parliament earlier this year and last year on the Government's support for high performance sports and our TeamSG athletes. We will continue to do so and enable each of our athletes to put their best foot forward in these competitions. We encourage all to support our TeamSG athletes.
2022-03-10-T-011-S-00962,2022-03-10-T-011,962,Edwin Tong Chun Fai,"Mdm Chairman, our transition out of the pandemic will not be without bumps and hurdles. Much of the impact that COVID-19 has on the sectors we care for is intangible and often latent. They are hidden. We have to ensure that we do not suffer a deficit in social resilience in our society, even as we strive to protect lives and livelihoods in this pandemic."
2022-03-10-T-011-S-00963,2022-03-10-T-011,963,Edwin Tong Chun Fai,"Madam, sports, culture, heritage – they hold a mirror to our society."
2022-03-10-T-011-S-00964,2022-03-10-T-011,964,Edwin Tong Chun Fai,"They show us who we are, how far we have come and what we cherish, value and aspire to. Resilience in defeat and grace in victory – these are qualities that are like a microcosm of our society. As our athletes and artists succeed, so does our nation."
2022-03-10-T-011-S-00965,2022-03-10-T-011,965,Edwin Tong Chun Fai,"More importantly, in sports, art, culture and heritage, we see that our diversity in race, colour and creed is, in fact, our strength. These distinctions do not divide us; they enable us, they make us stronger. Whether it is on the playing field or under the stage lights, our athletes and artists show us that what matters are what we bring to the table – our unique gifts, talents and experiences – and our shared dreams."
2022-03-10-T-011-S-00966,2022-03-10-T-011,966,Edwin Tong Chun Fai,"The qualities we see on the stage or on the pitch – grace under pressure, commitment to excellence, dedication to one another, to our team mates – are the very same ones we hold dear in society, that inspire in us pride, unity and courage, and the ability to dream even bigger together. They speak to the heart of Singapore."
2022-03-10-T-011-S-00967,2022-03-10-T-011,967,Edwin Tong Chun Fai,"On that note, Mdm Chairman, MCCY will ensure our arts, heritage and sports sectors will emerge from this pandemic stronger, better, faster and more vibrant, innovative and resilient. They will continue to inspire, unite and move us, as we continue to strengthen the heart of Singapore towards an even more caring, gracious and truly inclusive society. [Applause.]"
2022-03-10-T-011-S-00968,2022-03-10-T-011,968,,Minister of State Low Yen Ling.
2022-03-10-T-011-S-00969,2022-03-10-T-011,969,Low Yen Ling,"Mdm Chairman, in the last two years, MCCY, the National Arts Council (NAC) and the National Heritage Board (NHB) have rolled out wide-ranging measures to safeguard livelihoods, build capabilities and position our arts and culture sector for a strong recovery in the new normal. Kudos to our arts and culture organisations and practitioners – they have responded boldly and creatively to the challenges brought on by the pandemic. Through their craft and artistic contributions, they have provided soothing balm and comfort to us all in a difficult time like this. We are grateful for their resilience and perseverance."
2022-03-10-T-011-S-00970,2022-03-10-T-011,970,Low Yen Ling,"Looking ahead, for the year 2022, we will continue to work closely with our arts and culture community to chart our path towards recovery. We will enlarge our longer-term plans with the aims to foster in Singapore a resilient, sustainable and future-ready arts and culture ecosystem that  one, enriches and inspires lives; two, unites us as a nation, with pride in our shared heritage; and three, enhances Singapore's shine as a global city."
2022-03-10-T-011-S-00971,2022-03-10-T-011,971,Low Yen Ling,"Today, we look forward to our arts and culture sector recovering even stronger than before from the pandemic. Our practitioners have reached new audiences, created new experiences and enhanced existing capabilities while developing new ones in areas like digital showcases. This is the result of our collective resolve over the last two years as the arts and culture community collaborate and support one another."
2022-03-10-T-011-S-00972,2022-03-10-T-011,972,Low Yen Ling,"Mr Sitoh Yih Pin, Ms Tin Pei Ling and Mr Darryl David will be pleased to know that we will do even more to sustain the momentum and enable the sector to build on these gains. As shared earlier by Minister Edwin Tong, we will be injecting an additional $12 million to sustain good practices and learning points from COVID-19 after the end of the Arts and Culture Resilience Package (ACRP). Let me elaborate."
2022-03-10-T-011-S-00973,2022-03-10-T-011,973,Low Yen Ling,"As we continue to adapt and move towards a new normal, we will extend the Venue Hire Subsidy (VHS) for another three months from 1 April 2022 to 30 June 2022, at a stepped-down rate of 30%. This will continue to defray venue hire costs for our practitioners, as we progressively resume activities and welcome back larger audiences."
2022-03-10-T-011-S-00974,2022-03-10-T-011,974,Low Yen Ling,"Introduced last year as part of the ACRP, the Organisation Transformation Grant (OTG) has attracted keen interest from arts and culture organisations and practitioners."
2022-03-10-T-011-S-00975,2022-03-10-T-011,975,Low Yen Ling,"To sustain support for transformation, NHB will incorporate the OTG into its existing grants, such as the Heritage Research Grant, as well as the Minor and Major Project Grant. Heritage businesses and organisations will be able to benefit from an increased grant amount of up to $40,000, from $30,000 previously, to cater to larger-scale and longer-term projects. The grants will also be open to Business Associations to encourage transformation efforts in our historic districts."
2022-03-10-T-011-S-00976,2022-03-10-T-011,976,Low Yen Ling,"Similarly, NAC will launch a new Sector Transformation Fund (STF) to promote and sustain the transformation efforts of our arts and culture community. Projects previously supported under the ACRP OTG that have longer-term potential for further development, can tap on the STF to push ahead and transform."
2022-03-10-T-011-S-00977,2022-03-10-T-011,977,Low Yen Ling,"Let me now share how we will boost the sustainability of the arts and culture sector for diverse communities to enjoy, a point passionately highlighted by Ms Janet Ang. We will empower the sector to leverage digital technologies to pursue new artistic, cultural and business opportunities. Through digitalisation, the sector can enhance their existing revenue streams, as well as improve productivity and organisational effectiveness."
2022-03-10-T-011-S-00978,2022-03-10-T-011,978,Low Yen Ling,"We recently launched the Arts and Culture Digital Roadmap on 28 February to equip and enhance the digital journey of our arts and culture organisations and practitioners. They can use the Digital Roadmap, which has a self-assessment checklist, to gauge their level of digital readiness and learn about the range of digital solutions and funding schemes available to businesses, charities and individuals that can support such efforts."
2022-03-10-T-011-S-00979,2022-03-10-T-011,979,Low Yen Ling,"As Mr Mark Chay pointed out, we can showcase our unique culture to local, as well as overseas audiences by using more digital content. For instance, Ding Yi Music Company brought their triennial international composition festival called ""Composium"" online last year, which led to its musicians and the compositions of local composers, such as Cultural Medallion recipients Eric Watson and Law Wai Lun, reaching international audiences. In the coming months, MCCY, NAC and NHB will be engaging our arts and culture organisations and practitioners through roadshows and workshops to promote awareness of the Digital Roadmap. We will also provide tailored support to those who require assistance to digitalise. Details of these efforts will be made available on the websites of all three organisations, once they are ready."
2022-03-10-T-011-S-00980,2022-03-10-T-011,980,Low Yen Ling,"Madam, through the Self-Employed Person Grant (SEPG) introduced under the ACRP, Self-employed Persons (SEPs) have engaged in new collaborations. For instance, an independent producer, Ms Nurhafezhah Maznan, created a structured programme for eight young theatre directors to learn from 17 artists and other creatives on how to direct works in Malay and Tamil."
2022-03-10-T-011-S-00981,2022-03-10-T-011,981,Low Yen Ling,"We will continue to deepen our support for SEPs by incorporating the SEPG into NAC's existing Presentation and Participation (P&P) and Capability Development (CD) grants. Ms Tin Pei Ling will be glad to know that, through this move, priority will be given to grant applications initiated by or targeted at SEPs."
2022-03-10-T-011-S-00982,2022-03-10-T-011,982,Low Yen Ling,"In addition, we are committed to creating conditions in the arts and culture sector for livelihoods to thrive, with targeted support for SEPs."
2022-03-10-T-011-S-00983,2022-03-10-T-011,983,Low Yen Ling,"First, we will increase opportunities for capacity development for SEPs. To this end, NAC will raise greater awareness of the skills and competencies that our SEPs need to help them make informed choices for their career progression. NAC will also work with partners to mount training courses in new and emerging areas, such as e-pedagogy and digital arts education programme development, for arts instructors."
2022-03-10-T-011-S-00984,2022-03-10-T-011,984,Low Yen Ling,"Second, NAC will work with industry partners to ensure better protection and working conditions for our SEPs. NAC will promote the adoption of best practices amongst organisations which engage SEPs – from the signing of formal contracts to improving contractual obligations between the parties and recognising our SEPs for their skills and contributions. For example, our national cultural institutions have adopted the Tripartite Standards on Contracting with SEPs since 2018."
2022-03-10-T-011-S-00985,2022-03-10-T-011,985,Low Yen Ling,"Third, NAC will pilot new ways for SEPs to create value in the arts sector and beyond. NAC has observed some enterprising SEPs, especially in the last two years, developing artist-business partnership and testing new ways to work with enterprises working on sustainability solutions. NAC will support SEPs to push boundaries and contribute to the broader creative economy, as well as to collaborate with one another and new partners – such as local businesses – from other sectors in new and innovative ways."
2022-03-10-T-011-S-00986,2022-03-10-T-011,986,Low Yen Ling,"We encourage our SEPs to make full use of the available grants to sustain their practices, collaborate on new initiatives and develop new capabilities. We look forward to our SEPs' continued contribution to Singapore's arts and culture."
2022-03-10-T-011-S-00987,2022-03-10-T-011,987,Low Yen Ling,"Madam, besides developing our people, MCCY is also working closely with the sector to strengthen our cultural infrastructure for artists and creatives to incubate, to experiment and to collaborate."
2022-03-10-T-011-S-00988,2022-03-10-T-011,988,Low Yen Ling,"One of the newest additions to this growing pool is the Singapore Art Museum (SAM) at Tanjong Pagar Distripark (TPD). I visited SAM at TPD just two months ago with Minister Edwin Tong in January for the 10th edition of the Singapore Art Week (SAW) 2022 and we saw for ourselves how a former industrial warehouse was turned into a fascinating location for experimental exhibitions and programmes. The TPD welcomed more than 17,000 visitors during SAW 2022 and its unique large space allowed the public to be immersed in various arts and culture experiences in a very engaging manner."
2022-03-10-T-011-S-00989,2022-03-10-T-011,989,Low Yen Ling,Another exciting development is also taking place at Kampong Java. NAC is partnering the Singapore Land Authority (SLA) to refurbish and pilot arts and culture sandbox spaces at 52 to 56 Kampong Java. These venues that I have mentioned will offer our artists of various disciplines an affordable space to focus on their experimental and creative process. NAC will seek views from the arts community on the use of these spaces in the first half of this year.
2022-03-10-T-011-S-00990,2022-03-10-T-011,990,Low Yen Ling,"Madam, many of these cultural spaces are located at sites with a long history. Our built heritage connects us to the nation's past, like what Mr Sitoh Yih Pin mentioned, and forms a part of our cultural identity. Mr Sitoh Yih Pin will be glad to know that MCCY is continuing to safeguard and celebrate Singapore's shared heritage. One important aspect of this work involves the heritage impact assessment (HIA) framework, which Minister for National Development Mr Desmond Lee had shared earlier at MND's COS. MCCY and NHB will continue to support MND and URA in implementing the HIA framework. The framework further strengthens how public agencies must thoroughly evaluate the heritage significance of a site as an important consideration in the early stage of planning for development projects."
2022-03-10-T-011-S-00991,2022-03-10-T-011,991,Low Yen Ling,Our rich heritage is also a source of national pride. All Singaporeans celebrated when our hawker culture was inscribed on the UNESCO Representative List of Intangible Cultural Heritage in December 2020.
2022-03-10-T-011-S-00992,2022-03-10-T-011,992,Low Yen Ling,"Last year, at the COS, I shared that we would embark on consultations to identify possible elements for Singapore's second UNESCO intangible cultural heritage nomination. Between June 2021 and January 2022, NHB held Focus Group Discussions with approximately 170 participants, comprising intangible cultural heritage practitioners, heritage business owners, academics and youths, to hear their views and their thoughts and suggestions. Through these conversations, we heard a clear preference for our second nomination to be multicultural in nature and relatable to Singaporeans. A total of 10 possible elements have been suggested through these consultations. For example, our Chingay Parade, the Making and Sharing of Kueh, Peranakan Beadwork and Embroidery, Orchid Cultivation and Yusheng, just to name a few. NHB will broaden its consultations over the course of the coming months to engage more stakeholders, as well as the general public, before a final decision is made on the element to be nominated."
2022-03-10-T-011-S-00993,2022-03-10-T-011,993,Low Yen Ling,"Mdm Chairman, our museums showcase our valuable heritage and I am glad to update that, come this December, families and young children can look forward to a dynamic and engaging experience at the new Children's Museum Singapore (CMSG), in what used to be the Singapore Philatelic Museum."
2022-03-10-T-011-S-00994,2022-03-10-T-011,994,Low Yen Ling,"Ms Janet Ang spoke passionately about the importance of arts and culture for the young, and we agree with her. The CMSG will feature a range of topics, including Singapore's history and biodiversity, and help foster a stronger awareness of our shared values and national identity in our young children."
2022-03-10-T-011-S-00995,2022-03-10-T-011,995,Low Yen Ling,"In another development, following extensive consultations with the community, the Peranakan Museum will reopen in 2023, with an expanded curatorial focus on the rich cross-cultural traditions and distinctive arts of the Peranakan communities in Southeast Asia."
2022-03-10-T-011-S-00996,2022-03-10-T-011,996,Low Yen Ling,"Besides looking forward to the CMSG and Peranakan Museum, Singaporeans can all play a part in shaping an important reflection of our heritage – the Founders' Memorial. Next month, NHB will launch the Founders' Memorial ""Share Your Story, Shape Our Memorial"" Travelling Exhibition. Besides an update on the Memorial's architectural design, the travelling exhibition will provide the public a chance to share artefacts and stories related to key national policies or milestones, or their encounters with our founding leaders."
2022-03-10-T-011-S-00997,2022-03-10-T-011,997,Low Yen Ling,"For example, Mr Timothy de Souza is keen to share his personal mementoes as one of Singapore's first fighter pilots. We look forward to rich and interesting contributions from all Singaporeans."
2022-03-10-T-011-S-00998,2022-03-10-T-011,998,Low Yen Ling,"Madam, looking ahead, MCCY will build upon the foundation and progress made by Our SG Arts Plan in 2018. Mr Sitoh Yih Pin would be glad to know that, today, our arts sector includes diverse talents who collaborate and create new arts experiences for audiences in Singapore and beyond, including the under-reached groups mentioned by Ms Janet Ang and Mr Mark Chay. Through signature arts festival platforms, such as SAW, which I mentioned earlier, Singapore International Festival of Arts and the Singapore Writers Festival, we have brought together diverse players in the local arts ecosystem, grown a strong audience base and profiled Singapore arts globally."
2022-03-10-T-011-S-00999,2022-03-10-T-011,999,Low Yen Ling,"Community partnerships have been forged across 20 Arts and Culture nodes, bringing people of different backgrounds together through the arts."
2022-03-10-T-011-S-01000,2022-03-10-T-011,1000,Low Yen Ling,"Arts education has also been enhanced with experiential, cohort-based learning programmes to museums and concert halls, as well as digital content. Arts offerings are more inclusive than before, with support for quality arts experiences for our preschoolers, as well as students with special needs."
2022-03-10-T-011-S-01001,2022-03-10-T-011,1001,Low Yen Ling,"Since July 2021, NAC has held conversations with around 400 stakeholders in one-on-one interviews and also focus group discussions on the future of the arts for Singapore. Building on these insights, we are developing Our SG Arts Plan 2.0 to set the stage for the next phase of our arts development."
2022-03-10-T-011-S-01002,2022-03-10-T-011,1002,Low Yen Ling,"First, we will strengthen the role of the arts in the wider local and global creative economy; second, we will develop further ways for the arts to contribute to deepening our national identity, social cohesion and inclusivity; third, make the arts a distinctive factor that adds to Singapore's attractiveness as a global city."
2022-03-10-T-011-S-01003,2022-03-10-T-011,1003,Low Yen Ling,NAC welcomes feedback and ideas from the sector to refine Our SG Arts Plan 2.0. A public consultation will be conducted in the second part of this year.
2022-03-10-T-011-S-01004,2022-03-10-T-011,1004,Low Yen Ling,"Let me now turn to Our SG Heritage Plan which has, since 2018, enabled Singaporeans to rediscover and affirm our shared values and identity through diverse offerings and multiple touchpoints. Our museums are now more accessible through digital initiatives and offerings that reach out to a larger audience. Seniors can now enjoy age-friendly programmes under the Silver Hubs initiative, while programmes under HeritageCares also reach out to lower-income families, persons with disabilities, children with special needs as well as youths-at-risk."
2022-03-10-T-011-S-01005,2022-03-10-T-011,1005,Low Yen Ling,"Heritage is being infused into everyday spaces around us through the Street Corner Heritage Galleries scheme. Our Tampines Gallery, Kreta Ayer Heritage Gallery and Geylang Serai Heritage Gallery have all enlivened local communities."
2022-03-10-T-011-S-01006,2022-03-10-T-011,1006,Low Yen Ling,"Following NHB's consultations with a diverse range of stakeholders that include insights from our museum community, youth, creatives, heritage societies and heritage business owners, NHB is drawing up plans for Our SG Heritage Plan 2.0."
2022-03-10-T-011-S-01007,2022-03-10-T-011,1007,Low Yen Ling,"Firstly, we will support the heritage sector's digital adoption and develop capabilities to transform their operations and efforts in connecting Singaporeans to our heritage; second, we will also showcase Singapore's rich multicultural heritage beyond our shores to grow new audiences and markets for our heritage sector, while, at the same time, learning from the best in the world to develop our home talents; thirdly, we will work closely with our local communities as well as heritage enthusiasts and partners in the tech and creative industries to celebrate our unique local histories."
2022-03-10-T-011-S-01008,2022-03-10-T-011,1008,Low Yen Ling,"We invite all Singaporeans to share your views and feedback for Our SG Heritage Plan 2.0 when NHB launches the public call in the middle of this year. Mdm Chairman, in Mandarin, please."
2022-03-10-T-011-S-01009,2022-03-10-T-011,1009,Low Yen Ling,"(In Mandarin)  [Please refer to  Vernacular Speech.] Developing our local arts and heritage sectors enhances Singapore's vibrancy and attractiveness as a global city. Further, art pieces and heritage assets that resonate with Singaporeans will also strengthen our sense of belonging and help build a more cohesive and inclusive society. MCCY will strive to achieve these goals by continuing with our SG Arts and Heritage Plans."
2022-03-10-T-011-S-01010,2022-03-10-T-011,1010,Low Yen Ling,"Since the launch of Our SG Arts Plan in 2018, we have profiled Singapore arts through signature arts platforms, forged community partnerships and brought arts across 20 arts and cultural nodes. This strengthens community involvement, including preschoolers, students with special needs and the elderly, ensuring that our arts scene becomes more inclusive and benefits more people."
2022-03-10-T-011-S-01011,2022-03-10-T-011,1011,Low Yen Ling,"On the other hand, Our SG Heritage Plan, which was launched in 2018, has also allowed Singaporeans to rediscover and affirm their shared heritage. Preservation of more national monuments and the successful inscription of our hawker culture on the UNESCO Representative List of Intangible Cultural Heritage have also engendered greater public recognition of the value of heritage in our everyday lives."
2022-03-10-T-011-S-01012,2022-03-10-T-011,1012,Low Yen Ling,"As the next step, NAC and NHB will broaden their consultations this year and continue their conversations with Singaporeans and partners from various fields as we co-create the next editions of Our SG Arts and Heritage Plans, so as to contribute to the creative economy and safeguard and promote Singapore's multicultural heritage."
2022-03-10-T-011-S-01013,2022-03-10-T-011,1013,Low Yen Ling,"(In English)  Mdm Chairman, MCCY and our agencies remain committed to working with the arts and culture community to revitalise our arts and culture sector and chart its future directions. As we build on the gains that we have made together over the past two years, we will carve an exciting journey ahead towards a thriving and sustainable arts and culture ecosystem – one that enriches livelihoods, unites our people and enlivens our city. [Applause.]"
2022-03-10-T-011-S-01014,2022-03-10-T-011,1014,,Order. I propose to take the break now.
2022-03-10-T-011-S-01015,2022-03-10-T-011,1015,,[(proc text) Thereupon Mdm Deputy Speaker left the Chair of the Committee and took the Chair of the House. (proc text)]
2022-03-10-T-011-S-01016,2022-03-10-T-011,1016,Deputy Speaker,Order. I suspend the Sitting and will take the Chair at 5.45 pm.
2022-03-10-T-011-S-01017,2022-03-10-T-011,1017,Deputy Speaker,Sitting accordingly suspended
2022-03-10-T-011-S-01018,2022-03-10-T-011,1018,Deputy Speaker,at 5.24 pm until 5.45 pm.
2022-03-10-T-011-S-01019,2022-03-10-T-011,1019,Deputy Speaker,Sitting resumed at 5.45 pm.
2022-03-10-T-011-S-01020,2022-03-10-T-011,1020,Speaker in the Chair,
2022-03-10-T-011-S-01021,2022-03-10-T-011,1021,Speaker in the Chair,[(proc text) Debate in Committee of Supply resumed. (proc text)]
2022-03-10-T-011-S-01022,2022-03-10-T-011,1022,Speaker in the Chair,[(proc text) Head X (cont) – (proc text)]
2022-03-10-T-011-S-01023,2022-03-10-T-011,1023,Darryl David,"Chairman, many of us remember fondly the Kallang Roar, although I agree with Minister Edwin Tong when he said earlier that while it is great to revel in nostalgia, we should also look forward to the future of the bright talents that we have coming up through the Singapore football pipeline."
