speech_id,topic_id,speech_order,member_name,text
2022-03-10-T-001-S-00001,2022-03-10-T-001,1,Darryl David,asked the Minister for Transport (a) whether he can provide an update on the number of lifts installed at pedestrian overhead bridges across Singapore in 2021; (b) how does this number compare to the number of lifts installed in 2019 and 2020; and (c) what is the projected annual number of lifts that will be installed at pedestrian overhead bridges for the next three years.
2022-03-10-T-001-S-00002,2022-03-10-T-001,2,Baey Yam Keng,"As of end 2021, a total of 77 pedestrian overhead bridges (POBs) have been retrofitted with lifts as part of LTA's lift retrofitting programme. Of these, 26 and four POBs were retrofitted with lifts in 2021 and 2020 respectively."
2022-03-10-T-001-S-00003,2022-03-10-T-001,3,Baey Yam Keng,"In 2018, LTA completed Phase 2 of its lift retrofitting programme for 41 POBs, primarily near public transport nodes. LTA was preparing for Phase 3 of the lift retrofitting programme in 2019. Preparatory works, such as site investigations and technical studies, have to be done before commencing construction, hence, it takes about 14 to 22 months to retrofit lifts at POBs."
2022-03-10-T-001-S-00004,2022-03-10-T-001,4,Baey Yam Keng,"Phase 3 focuses on POBs near places, such as healthcare institutions, so that lifts installed will benefit a high number of seniors and commuters with mobility challenges. This phase, which started from 2020, will see around 60 POBs being retrofitted with lifts. The remaining 30 lifts will be installed progressively over the next three years."
2022-03-10-T-001-S-00005,2022-03-10-T-001,5,Deputy Speaker,Mr Darryl David.
2022-03-10-T-001-S-00006,2022-03-10-T-001,6,Darryl David,"Thank you, Madam. I would also like to thank the Senior Parliamentary Secretary for his reply. Just one supplementary question. I understand that perhaps with time, the cost of installation of the lifts would come down. I would like to enquire from the Senior Parliamentary Secretary if MOT explores other alternative technologies for this. For example, conventional lifts use a certain electrical motor and mechanism, but would hydraulic lifts, for example, be a possible solution if the cost of installation of the hydraulic lifts would be a bit more economical and, therefore, allow for the Budget to be better used to serve the same purpose?"
2022-03-10-T-001-S-00007,2022-03-10-T-001,7,Baey Yam Keng,"Madam, the Member had also asked a similar question in 2018. At that time, we shared that a pair of lifts at POBs can cost up to $4 million for installation and about $40,000 a year to maintain."
2022-03-10-T-001-S-00008,2022-03-10-T-001,8,Baey Yam Keng,"Indeed, over the years, we have explored different or better ways of providing such facilities. But, of course, we have to also consider the high usage and that it is cost-efficient to maintain. Currently, I am happy to share that, with experience and technologies, we have been able to bring down the cost. So, it now costs about $2 million to $3 million to install a pair of lifts. The costs also include site investigations and the technical things that need to be done, apart from the actual cost of the lift per se. Unfortunately, the maintenance has gone up from $40,000, as shared in 2018, to about $45,000 now, because of labour and other associated costs."
2022-03-10-T-001-S-00009,2022-03-10-T-001,9,Baey Yam Keng,LTA will continue to explore more cost-efficient ways to provide barrier-free access at our POBs when we retrofit them. I seek the public and Members' understanding that there is still a cost involved and priority will definitely be given to areas where we can benefit more commuters with such needs.
2022-03-10-T-002-S-00010,2022-03-10-T-002,10,Yip Hon Weng,asked the Minister for National Development (a) how many cases of stray animal abuse in the community are reported in the past three years; (b) whether the numbers are rising each year; (c) what are the common types of abuse and most common types of animals affected; and (d) what is the Ministry's approach towards deterring abuse of stray animals.
2022-03-10-T-002-S-00011,2022-03-10-T-002,11,Tan Kiat How,"Madam, from 2019 to 2021, NParks received 654 pieces of feedback about alleged stray animal abuse. Upon investigation, 12 cases of animal abuse could be substantiated with evidence and enforcement actions were taken against the offenders. Based on the data, we do not see a rising trend in stray animal abuse cases and there are no common types of abuse observed. Most of the cases reported involved stray cats."
2022-03-10-T-002-S-00012,2022-03-10-T-002,12,Tan Kiat How,"We take a serious view of all acts of animal abuse. NParks investigates all cases of feedback on animal abuse and will take enforcement action as appropriate. Individuals who are found guilty of animal abuse can be charged under the Animals and Birds Act. First-time offenders can face a maximum fine of $15,000, or a jail term of up to 18 months, or both."
2022-03-10-T-002-S-00013,2022-03-10-T-002,13,Tan Kiat How,"In addition, NParks works closely with stakeholders such as animal welfare groups and veterinarians, to promote responsible interactions with animals. For example, NParks conducts outreach at pet-related events and community walkabouts and develops educational resources and programmes as part of its efforts."
2022-03-10-T-002-S-00014,2022-03-10-T-002,14,Tan Kiat How,Safeguarding the welfare of animals is a shared responsibility. Members of the public can play their part by reporting suspected cases of animal abuse to NParks and providing information that might help to facilitate investigations.
2022-03-10-T-002-S-00015,2022-03-10-T-002,15,Deputy Speaker,Mr Yip Hon Weng.
2022-03-10-T-002-S-00016,2022-03-10-T-002,16,Yip Hon Weng,"Thank you, Madam. I thank the Minister of State for his reply. Out of the cases of stray animal abuse over the past three years, how many animal abusers were caught? How can we better educate and create better awareness amongst community feeders about animal abuse, especially about signs and symptoms of abuse?"
2022-03-10-T-002-S-00017,2022-03-10-T-002,17,Tan Kiat How,"Madam, of the 654 pieces of feedback, upon investigation, 12 cases could be substantiated. Enforcement actions were taken. To the Member's other query, most of the reported cases of stray animal abuse involve injured or dead animals that were found by members of the public. These injuries could have been caused by other circumstances, such as attacks by other animals, disease or accidents. For many of these reported cases, NParks was unable to find sufficient supporting evidence and proof that they were cases of animal abuse."
2022-03-10-T-002-S-00018,2022-03-10-T-002,18,Tan Kiat How,"So, for members of the public who come across such cases, please let NParks know. We have a 24-hour hotline at the animal response centre, 1800 476 1600, or go to the OneService app. And please include any information that might facilitate investigations."
2022-03-10-T-002-S-00019,2022-03-10-T-002,19,Deputy Speaker,Mr Louis Ng.
2022-03-10-T-002-S-00020,2022-03-10-T-002,20,Louis Ng Kok Kwang,"Thank you, Madam. I thank the Minister of State for the reply as well. Could I ask two clarifications? One, I understand we are reviewing the penalties for animal cruelty and abuse. Could I just check what is the time frame for this review and when we could expect amendments to the Animals and Birds Act? And two, whether MND is also considering to include mandatory treatment orders as part of the penalties under the review?"
2022-03-10-T-002-S-00021,2022-03-10-T-002,21,Tan Kiat How,"Mdm Deputy Speaker, I thank the Member for the two supplementary questions. Indeed, we are reviewing the Animals and Birds Act. We are consulting internally and will consult stakeholders when ready. We assure Members that we are working on it, including the penalty framework."
2022-03-10-T-002-S-00022,2022-03-10-T-002,22,Tan Kiat How,"The second question is around the mandatory treatment order. This is something that if the Member has views on, he can write to us with, as part of the consultation."
2022-03-10-T-003-S-00023,2022-03-10-T-003,23,Louis Ng Kok Kwang,"asked the Prime Minister whether the Government will (i) study the doubling of paternity leave by several multinational companies in Singapore to examine the effect on employability, productivity and family relationships of the employees in these companies and (ii) consider doubling the paternity leave for all fathers."
2022-03-10-T-003-S-00024,2022-03-10-T-003,24,Indranee Rajah,"Mdm Deputy Speaker, international research shows that paid parental leave, which includes paternity leave, benefits employers in terms of talent attraction, employee retention and productivity. Paternity leave is also associated with stronger relationships between fathers and their children, as well as with their wives."
2022-03-10-T-003-S-00025,2022-03-10-T-003,25,Indranee Rajah,"The Government has progressively enhanced parental leave schemes to better support parents and, particularly fathers, in playing a bigger role in raising their children. In 2017, we made the second week of Paternity Leave mandatory and increased Shared Parental Leave from one to four weeks. Fathers can now take up to eight weeks of leave in total in their child's first year, to bond with their newborns and care for their wives."
2022-03-10-T-003-S-00026,2022-03-10-T-003,26,Indranee Rajah,"However, supporting the caregiving needs of parents must be balanced with the manpower and operational needs of employers, as I had explained in my Committee of Supply (COS) speech last week. A more sustainable approach is for companies to develop a family-friendly culture. We are heartened that some companies in Singapore are leaning forward to offer additional paternity leave, on top of legislated provisions. There are also other ways to provide more flexible leave options for staff; many companies have signed up to the Tripartite Standards on Unpaid Leave for Unexpected Care Needs."
2022-03-10-T-003-S-00027,2022-03-10-T-003,27,Indranee Rajah,"We welcome these progressive companies to share their experiences and best practices with other companies. As the needs of companies vary, employers, in partnership with their employees, are best placed to assess and implement the family-friendly arrangements suited to the company's context. We will continue to work with tripartite partners to review the scope for more parental leave provisions and build a Singapore that is Made For Families."
2022-03-10-T-003-S-00028,2022-03-10-T-003,28,Deputy Speaker,Mr Louis Ng.
2022-03-10-T-003-S-00029,2022-03-10-T-003,29,Louis Ng Kok Kwang,"Thank you, Madam. I should first say we all welcome the Leader back to the House and we are glad she has recovered well. I have two clarifications. One is, I am just wondering whether the Government is going to review our parental leave policy, not immediately overnight, but, eventually, try to equalise it. I worry what message we are sending to our society when we say that mothers have 16 weeks of maternity leave and fathers have two weeks. Then, we are saying who is supposed to look after our children."
2022-03-10-T-003-S-00030,2022-03-10-T-003,30,Louis Ng Kok Kwang,"In line with that, the second clarification is, there are studies now that show that our policies reinforce the gender stereotypes. So, I hope the Government can study some of these studies that are out there and also do additional studies to see whether our policies really do reinforce the gender stereotypes."
2022-03-10-T-003-S-00031,2022-03-10-T-003,31,Indranee Rajah,"Mdm Deputy Speaker, I thank the Member for his clarifications. I would say that we agree that it is very important for fathers to be involved, especially at the early stage when the children are just born, for them to bond with the children and to be there for the wife and the family. As I had indicated at COS and earlier, we will continue to work with the tripartite partners to review the scope for more parental leave provisions."
2022-03-10-T-003-S-00032,2022-03-10-T-003,32,Indranee Rajah,"I think the key adjustment that we need to make is a mindset change. It is a mindset change partly on the part of fathers, partly on the part of employers. Employers are key. We have found, for example, if we look at the statistics for the taking of parental leave, that there has been an improvement, but it is still not where we want it to be. For example, in 2016, the take-up rate was 47%; in 2017, it was 53%; in 2018, it was 53%; in 2019, it was 55%. You can see that it is improving, but it is not where we would like it to be."
2022-03-10-T-003-S-00033,2022-03-10-T-003,33,Indranee Rajah,"Firstly, we hope that more and more fathers will see themselves playing a vital role when their children are born and take up the paternity leave. The second part of the equation is also how the employers respond. This is very important because if someone applies for paternity leave and you find that the supervisor is not supportive or the colleagues are not willing to cover, it makes it very difficult for the father to take that paternity leave as well."
2022-03-10-T-003-S-00034,2022-03-10-T-003,34,Indranee Rajah,"That mindset shift is something we are in transition because we see more fathers wanting to be involved; employers need to be on board. Which is why both at COS and now, I am reiterating, as indeed Mr Ng is, that it is actually better for your organisation if you are family-friendly. It is better for your organisation if you support fathers to take paternity leave, and, of course, mothers as well. This is something that we need to work with the tripartite partners on. Mr Louis Ng can be reassured that this is an area of work we will continue to look at."
2022-03-10-T-004-S-00035,2022-03-10-T-004,35,Leon Perera,"asked the Minister for Health, given the commitment to strengthen the Singaporean Core in the nursing profession, whether the Government will review the total compensation of Singaporean nurses to bring it more in line with nursing wages in developed countries."
2022-03-10-T-004-S-00036,2022-03-10-T-004,36,Koh Poh Koon,"In setting salaries of most occupations, the salient consideration is the conditions of the local market, while taking into consideration the international market, if relevant."
2022-03-10-T-004-S-00037,2022-03-10-T-004,37,Koh Poh Koon,"In this regard, MOH regularly reviews the salaries of nurses and other healthcare staff to ensure market competitiveness. Nurses' salaries take into account both local and global references."
2022-03-10-T-004-S-00038,2022-03-10-T-004,38,Koh Poh Koon,"As I mentioned yesterday in my Committee of Supply speech, in 2021, we enhanced nursing salaries in the public healthcare sector by 5% to 14%, to be implemented over two years, including one tranche that will be given out this year. We had also increased funding support to the community care sector to ensure that nurses' salaries in the community care sector remain competitive as well."
2022-03-10-T-004-S-00039,2022-03-10-T-004,39,Koh Poh Koon,"Beyond base salaries, nurses also receive the Nurse Special Payment (NSP) in December every year. The NSP quantum is reviewed annually to ensure that nursing pay remains attractive."
2022-03-10-T-004-S-00040,2022-03-10-T-004,40,Koh Poh Koon,"Through competitive salaries and non-monetary means, we will ensure that nursing remains a viable career prospect for Singaporeans."
2022-03-10-T-005-S-00041,2022-03-10-T-005,41,,The following question stood in the name of Dr Lim Wee Kiak –
2022-03-10-T-005-S-00042,2022-03-10-T-005,42,,5 To ask the Minister for Trade and Industry (a) what is the Ministry doing to ensure that increases in petrol prices are not profiteering; and (b) whether oil companies can claim a rise in crude oil prices as the basis for raising petrol prices just one day after the war broke out in Ukraine on 24 February 2022.
2022-03-10-T-005-S-00043,2022-03-10-T-005,43,Denise Phua Lay Peng,Question No 5.
2022-03-10-T-005-S-00044,2022-03-10-T-005,44,Tan See Leng,"Since the start of the year, global oil prices and domestic pump prices have been rising as a result of the Russia-Ukraine tension and retailers here have been adjusting their pump prices periodically. Soon after the war broke out, three retailers raised pump prices further on 24 to 25 February, while the remaining two retailers did not adjust prices. Overall, the increase in petrol and diesel prices reflect the rise in the price of crude oil over the past months."
2022-03-10-T-005-S-00045,2022-03-10-T-005,45,Tan See Leng,"While pump prices are set by the market, the Competition and Consumer Commission of Singapore (CCCS) keeps a close watch to ensure an open and competitive market. If there is evidence of anti-competitive behaviour, such as coordinated price increases, CCCS will investigate and take firm enforcement action under the Competition Act."
2022-03-10-T-005-S-00046,2022-03-10-T-005,46,Tan See Leng,"Well-informed consumers are also a key deterrent against unreasonable pricing. Fuel Kaki, a retail petrol price comparison website, which is developed by the Consumers Association of Singapore (CASE), empowers consumers to compare not just the retail pump prices, but also the effective price of petrol across retailers, based on the various discounts and rebates applicable to them."
2022-03-10-T-005-S-00047,2022-03-10-T-005,47,Tan See Leng,The Government will continue to monitor price movements in the retail petrol industry.
2022-03-10-T-005-S-00048,2022-03-10-T-005,48,Deputy Speaker,Leader of the Opposition.
2022-03-10-T-005-S-00049,2022-03-10-T-005,49,Pritam Singh,"Thank you, Deputy Speaker. Just one question for the Minister for Manpower. In view of the steep rise in the price of petrol and diesel, is the Government looking at the prospect of a support package for private hire drivers, taxi drivers, private hire bus drivers, not too dissimilar from the aviation support package announced at this year's Budget to alleviate the cost of work for them?"
2022-03-10-T-005-S-00050,2022-03-10-T-005,50,Tan See Leng,"I thank the Leader of the Opposition for his question. We are watching the situation very closely. Even as we speak, I think that there are a lot of developments today and volatility in terms of the pricing, looking also at the oil futures. These are all the various factors we take into consideration."
2022-03-10-T-005-S-00051,2022-03-10-T-005,51,Tan See Leng,"At this particular point in time, we think that the current slew of measures, the support packages and so on, appear to be having some impact in supporting them. As I have said in my previous Committee of Supply speech, we will not hesitate to roll out more. But at this particular point in time, we need to monitor the situation very, very closely."
2022-03-10-T-006-S-00052,2022-03-10-T-006,52,Carrie Tan,asked the Minister for National Development (a) how is the space allocation for heavy vehicle parking lots calculated and decided for each town; (b) how often is this reviewed to ensure that there are sufficient lots to meet residents' needs; and (c) whether the MOM and the companies in sectors that employ lorry drivers are included in the review process to shift heavy vehicle parking lots away from HDB housing estates.
2022-03-10-T-006-S-00053,2022-03-10-T-006,53,Tan Kiat How,"As of December 2021, there are about 42,100 Heavy Vehicle (HV) lots islandwide, and about 32,400 HVs registered under LTA's Vehicle Parking Certificate (VPC) scheme. Hence, there are sufficient lots for all HVs islandwide."
2022-03-10-T-006-S-00054,2022-03-10-T-006,54,Tan Kiat How,"We recognise that some HV drivers may prefer to park near where they reside. However, locating HV parks (HVPs) in or near residential areas comes at a high opportunity cost, as the land could otherwise cater to housing or other community needs. Residents have also raised noise and safety concerns due to heavy vehicle traffic arising from these HVPs. As the competition for land intensifies, it will be increasingly difficult to have HVPs in or near residential estates, where the tradeoffs are more acute. Today, the majority of HV lots are already located in industrial areas and privately operated."
2022-03-10-T-006-S-00055,2022-03-10-T-006,55,Tan Kiat How,"As the Member has also pointed out, we have been reviewing our plans to progressively reduce the number of public HVPs in or near residential areas, to free up land to meet other development needs. Any injection of public HVPs in or near residential areas will need to be considered carefully."
2022-03-10-T-006-S-00056,2022-03-10-T-006,56,Tan Kiat How,"HV drivers play an important role in our economy. We are, therefore, working closely with agencies like MTI, MOT, ESG and LTA, to ensure that there remain sufficient HV lots islandwide which are accessible to drivers, as we phase out some of our public HVPs in or near residential areas."
2022-03-10-T-006-S-00057,2022-03-10-T-006,57,Tan Kiat How,"As part of this process, we take into consideration feedback from industry stakeholders, like HVP operators and HV-operating businesses, to address business needs and possible constraints. We will continue our efforts to engage stakeholders from HV-operating sectors, like the private bus and logistics sectors."
2022-03-10-T-006-S-00058,2022-03-10-T-006,58,Carrie Tan,"Mdm Deputy Speaker, I thank the Minister of State for his reply. I would just like to clarify this  it looks like a multi-Ministry effort to review the allocation of space in Singapore for HVPs. And I am just wondering whether there is an expectation by the Ministries that employers need to be responsible for the cost of commute of the HV drivers to get to and from their residence to their parked vehicle, wherever that may be located, and whether this expectation of these commuting costs has been communicated to the employers of HV drivers."
2022-03-10-T-006-S-00059,2022-03-10-T-006,59,Tan Kiat How,"Madam, I thank the Member for her question and welcome her back to Parliament as well. Indeed, these are the issues that the various sector leads, the various Ministries and agencies, are discussing with their HV operating businesses. Some of these will be dependent on the specific sectors, for example, in the logistics sectors, buses for ferrying workers and passengers will be very different from sector to sector."
2022-03-10-T-006-S-00060,2022-03-10-T-006,60,Tan Kiat How,"And these are, indeed, the issues that we have been discussing with the different stakeholders. If there are specific issues or questions that the Member has encountered, please write to us. We would be happy to take a look at the specifics."
2022-03-10-T-007-S-00061,2022-03-10-T-007,61,Leon Perera,asked the Minister for Health (a) what is the Government's modelling for the expected hospital bed occupancy rates over the next five years; (b) what is the hospital bed occupancy rate it considers a safe upper limit; and (c) how does the Government derive this figure.
2022-03-10-T-007-S-00062,2022-03-10-T-007,62,Janil Puthucheary,"Mdm Deputy Speaker, based on MOH's modelling, the annual average public hospital Bed Occupancy Rate (BOR) over the next five years would be around 80%."
2022-03-10-T-007-S-00063,2022-03-10-T-007,63,Janil Puthucheary,"A sustained BOR of less than 85% in the hospitals is, generally, recommended by academic communities and the healthcare authorities, overseas and here, to ensure patient safety. Sustained BORs above the 85% threshold may increase the risk of poor clinical outcomes due to the reduced access to hospital care."
2022-03-10-T-007-S-00064,2022-03-10-T-007,64,Janil Puthucheary,"Based on our experience, operating with a BOR of less than 85% has allowed for hospitals to have sufficient bed capacity to respond to sudden increases in bed demands, for example, during mass casualty situations and pandemics."
2022-03-10-T-007-S-00065,2022-03-10-T-007,65,Janil Puthucheary,"While there may be temporary increases over the recommended annual average BOR of 85%, our public healthcare institutions (PHIs) have mitigated the risks by managing patient flows, introducing measures, such as the use of telehealth technologies, to reduce the need for in-person consultations and right-siting care into the community and ambulatory settings."
2022-03-10-T-007-S-00066,2022-03-10-T-007,66,Deputy Speaker,Mr Leon Perera.
2022-03-10-T-007-S-00067,2022-03-10-T-007,67,Leon Perera,"I thank the Senior Minister of State for his answer. Just one supplementary question. Given that that is the long-term planning parameter – 80% to 85% occupancy – is there a prescribed plan or series of steps from MOH to the hospitals as to what are the contingency plans when this 85% ceiling is breached? For example, setting up augmented facilities within the same building or transferring patients to the private sector, or any other types of steps when that happens."
2022-03-10-T-007-S-00068,2022-03-10-T-007,68,Janil Puthucheary,"Madam, yes, there is. There have been for many years and those plans have been activated a number of times, including in the COVID-19 pandemic."
2022-03-10-T-008-S-00069,2022-03-10-T-008,69,Darryl David,asked the Minister for Trade and Industry whether the Ministry has plans to help small and medium enterprises which may be adversely affected by significantly increased fuel and energy costs due to the conflict in Ukraine.
