speech_id,topic_id,speech_order,member_name,text
2023-09-19-T-020-S-00493,2023-09-19-T-020,493,Leong Mun Wai,"This means that the annual payout could be up to S$192,500 in terms of Member of Parliament allowances and it comes from the public coffers, and it is the taxpayers who are actually contributing to the public coffers. The Government has the responsibility to prudently use the taxpayers' money and it has the obligation to prevent taxpayers' money from being abused or misused rather. To that end, the PSP disagrees with the Motion from the Leader of the House and is unable to agree or accept that arrangement."
2023-09-19-T-020-S-00494,2023-09-19-T-020,494,Leong Mun Wai,"The PSP believes that if Minister Iswaran is eventually found to be not guilty of corruption, then taxpayers, due to the restrictions of the current laws, would not be able to recover or claw back the money that has been paid out. But if we do not claw it back, that means that taxpayers, during the period through which a person is being investigated of a corruption have, for no reason, paid a large sum of money to this person under corruption charges. We are talking about a sum of $16,000 per month. That is not a small amount. From the Ministry of Manpower, we can understand that there are so many Singaporeans who are working diligently and contributing their labour and effort, and, despite that, their household income is below that of $16,000."
2023-09-19-T-020-S-00495,2023-09-19-T-020,495,Leong Mun Wai,"Of course, the PSP also wants to seriously proclaim that we believe that before Minister Iswaran is proved to be guilty by the Court, he is innocent. Suspending his duties and allowance are but temporary. If he is found to be not guilty eventually, then we should, when the whole investigation is completed, repay him the Member of Parliament allowance."
2023-09-19-T-020-S-00496,2023-09-19-T-020,496,Leong Mun Wai,"The PSP would like to say that for taxpayers and Minister Iswaran, there should be a fair approach. And that is why we are tabling this Motion today to suspend his duties and Member of Parliament allowance for the time being."
2023-09-19-T-020-S-00497,2023-09-19-T-020,497,Leong Mun Wai,"The PSP would also like to urge Parliament to move or agree to the Motion tabled by Ms Hazel Poa and myself, and amend the 1962 Parliament (Privileges, Immunities and Powers) Act in order to ensure that Parliament has the right to back pay to Minister Iswaran while he is absolved and when he resumes his public duties."
2023-09-19-T-020-S-00498,2023-09-19-T-020,498,Leong Mun Wai,"The PSP has tabled this Motion for the for the amendment Bill because we truly want to improve our system, and this is valid, reasonable and in accordance with the laws. We hope that all Parliamentarians can understand our intention and provide full support."
2023-09-19-T-020-S-00499,2023-09-19-T-020,499,Leong Mun Wai,"(In English)  I support the Motion moved by Ms Hazel Poa. For country, for people."
2023-09-19-T-020-S-00500,2023-09-19-T-020,500,Speaker,Mr Pritam Singh.
2023-09-19-T-020-S-00501,2023-09-19-T-020,501,Pritam Singh,"Mr Speaker, I refer to the Motions filed by the Leader of the House on 14 September, precipitated by the Motion filed by PSP's Non-Constituency Member of Parliament (NCMP) Hazel Poa on 7 September calling for the suspension of Mr S Iswaran."
2023-09-19-T-020-S-00502,2023-09-19-T-020,502,Pritam Singh,"In my view, there are two key issues for Parliament to consider  first, whether it is fair and proper for a duly elected Member of Parliament (MP) to be suspended from responsibilities towards his or her constituents and legislative duties before due process is concluded; second, what Parliament ought to do when an MP has been effectively interdicted from MP duties arising from actions taken by his or her Party leader."
2023-09-19-T-020-S-00503,2023-09-19-T-020,503,Pritam Singh,"First, let me speak on the issue of fairness."
2023-09-19-T-020-S-00504,2023-09-19-T-020,504,Pritam Singh,"The hon Member Ms Hazel Poa's case is that a Member should be suspended from Parliament because he has been arrested and is being investigated for the serious offence of corruption. However, the centrality of the rule of law in Singapore renders the hon Member's suggested course of action premature, a point made all the more stark because we do not even know the details of what Mr S Iswaran is accused of. Parliament should be mindful of the dictum of presumption of innocence."
2023-09-19-T-020-S-00505,2023-09-19-T-020,505,Pritam Singh,"With respect, I would also request PSP colleagues in the House to consider the precedent their Motion would create should a future government decide to fix Opposition MPs by way of politically motivated investigations."
2023-09-19-T-020-S-00506,2023-09-19-T-020,506,Pritam Singh,"Sir, in some cases, those who have been investigated under the Prevention of Corruption Act have not been charged. In a few other cases, accused persons who have been brought to trial have been acquitted or the prosecution applies to withdraw the charges. In yet other cases, those convicted at first instance have seen their convictions overturned on appeal. Any of these scenarios could come to pass in Mr Iswaran's case."
2023-09-19-T-020-S-00507,2023-09-19-T-020,507,Pritam Singh,"In the Workers' Party (WP)'s view, the wheels of justice must be allowed to fully turn before Parliament decides what to do."
2023-09-19-T-020-S-00508,2023-09-19-T-020,508,Pritam Singh,"The WP cannot agree to the Motion filed by the PSP. It would not just be unfair and premature but, significantly, this House would be seeking to overturn the electoral mandate given to Mr Iswaran by the people through the ballot box by prematurely passing judgement on him."
2023-09-19-T-020-S-00509,2023-09-19-T-020,509,Pritam Singh,"This leads me to the second issue on how to deal with an MP who has been put by his party leader on indeterminate leave of absence from Parliament with full MP's allowance. While it may not be appropriate to suspend Mr Iswaran from Parliament, it may well be appropriate to suspend the payment of his MP allowance."
2023-09-19-T-020-S-00510,2023-09-19-T-020,510,Pritam Singh,WP MP Dennis Tan raised this matter of Mr Iswaran's MP allowance in Parliament last month.
2023-09-19-T-020-S-00511,2023-09-19-T-020,511,Pritam Singh,"Mr Speaker, there is disquiet among members of the public because he continues to collect his allowance. As far as I know, Mr Iswaran is neither performing duties in his constituency nor in Parliament and his likeness is not found on Town Council or People's Association banners in West Coast Group Representation Constituency (GRC)."
2023-09-19-T-020-S-00512,2023-09-19-T-020,512,Pritam Singh,"The Prime Minister said in this House last month that if Parliament wants to stop an MP's allowance, Parliament has to move to interdict the individual as an MP and Parliament has not done that and I quote, ""What has happened is that the MP has been on a leave of absence and, eventually, when the case is settled in one way or another, then consequences would follow."" What needs to be noted, however, is that the Prime Minister's act of interdicting Mr Iswaran as Minister appears to have effectively interdicted him as an MP as well."
2023-09-19-T-020-S-00513,2023-09-19-T-020,513,Pritam Singh,"For the WP to decide on whether to support the Leader's Motion, there are a few questions I would like to ask the Leader in order that this House can understand the full extent of the restrictions on Mr Iswaran as an MP."
2023-09-19-T-020-S-00514,2023-09-19-T-020,514,Pritam Singh,My first question is  can the Leader confirm whether Mr Iswaran's ban on entering Government buildings extends to Parliament House? Does Mr Iswaran have access to the Public Service Division's MP Appeal System and is he rendering assistance or expected to do so to his residents in his capacity as an MP?
2023-09-19-T-020-S-00515,2023-09-19-T-020,515,Pritam Singh,"My second question addresses the Prime Minister's comment that consequences will follow. It is unclear if those, I quote, ""consequences"" include a clawback of the MP allowance. I would advance that such a clawback for the period during which he has not performed MP's duties would be a reasonable expectation of the public. So, my second question is this  can the Leader tell us whether a clawback of Mr S Iswaran's MP allowance is within the PAP's contemplation in so far as clause (c) of the Leader's Motion is concerned? For completeness, it is this issue that forms the basis of my Parliamentary Question today and filed on 7 September about the duration Mr Iswaran is expected to be absent from Parliament."
2023-09-19-T-020-S-00516,2023-09-19-T-020,516,Pritam Singh,"My third question concerns para (c) of the Leader's Motion where it says that this House will consider this matter when the outcome of ongoing investigations is known. This contrasts with what the Prime Minister said during the clarifications of the Prime Minister's Ministerial Statement on Mr Iswaran last month. The Prime Minister said and, I quote, ""If there is a case, the case has not been heard, he has not been found guilty or acquitted or whatever."""
2023-09-19-T-020-S-00517,2023-09-19-T-020,517,Pritam Singh,"My third question is this  can the Leader clarify whether the word ""outcome"" in para (c) of the Leader's Motion means that this House will consider this matter once investigations are completed and a decision has been made on whether charges would be preferred against Mr Iswaran or if it means that this House will consider this matter only upon conclusion of the entire criminal justice process, including any possible appeal?"
2023-09-19-T-020-S-00518,2023-09-19-T-020,518,Pritam Singh,The WP's position on the Leader's Motion will turn on the responses to these three specific queries.
2023-09-19-T-020-S-00519,2023-09-19-T-020,519,Speaker,Mr Lim Biow Chuan.
2023-09-19-T-020-S-00520,2023-09-19-T-020,520,Lim Biow Chuan,"Sir, I was taken aback when I saw the Motion by the hon NCMP Ms Hazel Poa and Mr Leong Mun Wai."
2023-09-19-T-020-S-00521,2023-09-19-T-020,521,Lim Biow Chuan,"In their Motion, they asked that ""This House suspends Mr S Iswaran from the service of Parliament for the remainder of the current session of the Fourteenth Parliament."""
2023-09-19-T-020-S-00522,2023-09-19-T-020,522,Lim Biow Chuan,"In Ms Hazel Poa’s Facebook page, she said that she had filed the Motion so that Mr S Iswaran no longer receives his MP allowance while he has been requested by the Prime Minister to not perform any official duties during his investigation by the Corrupt Practices Investigation Bureau (CPIB)."
2023-09-19-T-020-S-00523,2023-09-19-T-020,523,Lim Biow Chuan,"Sir, it is a fundamental principle of law that any person who is accused of an offence is deemed innocent until proven guilty in a court of law. The burden of proof is placed on the prosecution, and the accused is assumed to be innocent until the prosecution can prove beyond reasonable doubt that the defendant is guilty of the crime that he has been charged with. The accused does not even need to prove his innocence. The burden of proof is on the prosecution."
2023-09-19-T-020-S-00524,2023-09-19-T-020,524,Lim Biow Chuan,"This principle is also enshrined in the United Nation's Universal Declaration of Human Rights. At Article 11, it says  ""Everyone charged with a penal offence has the right to be presumed innocent until proved guilty according to law in a public trial at which he has had all the guarantees necessary for his defence. No one shall be held guilty of any penal offence on account of any act or omission which did not constitute a penal offence, under national or international law, at the time when it was committed. Nor shall a heavier penalty be imposed than the one that was applicable at the time that the penal offence was committed."""
2023-09-19-T-020-S-00525,2023-09-19-T-020,525,Lim Biow Chuan,"Sir, to the best of my knowledge, Mr Iswaran is currently under investigation by CPIB. He has not been charged for an offence and neither has he been convicted in a court of law of any offence."
2023-09-19-T-020-S-00526,2023-09-19-T-020,526,Lim Biow Chuan,"In the statement made by Prime Minister on 2 August 2023, Prime Minister Lee said that ""while investigating a separate matter, CPIB came across some information concerning Minister Iswaran that merited investigation. CPIB would need to interview Minister Iswaran to take the investigation further and he sought my concurrence to open a formal investigation. Minister Iswaran was brought in by CPIB and subsequently released on bail. I instructed him to take leave of absence until the investigations were completed."""
2023-09-19-T-020-S-00527,2023-09-19-T-020,527,Lim Biow Chuan,"Sir, to this date, I am not aware of any other facts that have come out and the Prime Minister had said that CPIB investigations are still ongoing. He said, ""Details cannot be provided so as not to prejudice the investigations."""
2023-09-19-T-020-S-00528,2023-09-19-T-020,528,Lim Biow Chuan,"Thus, if Ms Hazel Poa of PSP is asking that Parliament suspend Mr S Iswaran simply because they feel that he does not warrant the MP’s allowance, then does this mean that they have already judged that Mr Iswaran had committed a wrongdoing even before the details of the investigations are out? Let me repeat that. They are judging that Mr Iswaran had committed a wrongdoing even before the details of the investigation are out. Surely, Mr Iswaran should be given due process and every opportunity to present his case before the court of law if ever CPIB decides to charge him. And this is the basic principle behind the rule of law."
2023-09-19-T-020-S-00529,2023-09-19-T-020,529,Lim Biow Chuan,"So, with the greatest respect, if PSP is advocating this principle, then it is a very dangerous principle. It means that if any member of the public lodges a Police report against Mr Leong or Ms Poa or, for that matter, any other MP and the Police decides to commence investigations against them, this House would similarly have to suspend them from the service of Parliament."
2023-09-19-T-020-S-00530,2023-09-19-T-020,530,Lim Biow Chuan,"If Ms Poa or Mr Leong feels that an MP ought to be suspended from service merely because he is under investigation, let us seek advice and I think the Leader of the House has said already that this principle would then have to be applicable to all MPs in this House."
2023-09-19-T-020-S-00531,2023-09-19-T-020,531,Lim Biow Chuan,"In the 2 August Sitting, I asked Mr Leong whether it is his position that the Leader of Opposition, Mr Pritam cannot receive his salary or cannot carry out his duties in Parliament merely because he has been referred to the Police for investigation. Mr Leong then replied that it only pertains to investigation by CPIB. But why only cases involving CPIB? As the Leader of the House said, ""Why not for other offences, other serious offences – molest, rape, murder "" or is it purely an arbitrary decision made by PSP?"
2023-09-19-T-020-S-00532,2023-09-19-T-020,532,Lim Biow Chuan,"So, allow me to ask Mr Leong again – if an MP is investigated for perjury, for lying under oath, is that not a serious offence, too? It involves an allegation of dishonest conduct, an allegation of lying under oath which means that we cannot trust that person who may lie at any opportunity. Is Ms Poa or Mr Leong saying that these offences are not serious?"
2023-09-19-T-020-S-00533,2023-09-19-T-020,533,Lim Biow Chuan,"Sir, allow me to clarify that I hold the Leader of the Opposition with great respect. While I may not agree with Mr Pritam Singh on some political matters, I will stand to defend his right to sit in Parliament unless he is convicted of an offence and, even then, the punishment levied must be such that it will disqualify him from serving as an MP under the Constitution, because not every punishment will result in disqualification as an MP under the Constitution."
2023-09-19-T-020-S-00534,2023-09-19-T-020,534,Lim Biow Chuan,"So, the fundamental question which I have for the two NCMPs is  what is their basis for asking for Mr Iswaran to be suspended from service when we do not even know what is the case against him? He has been placed on leave of absence and, hence, is not able to attend Parliament. So, I do not understand why this rush to suspend him. Why not allow the CPIB time to do its work? Does PSP say that every single Government officer who is under investigation for any offence also be suspended and the salary docked?"
2023-09-19-T-020-S-00535,2023-09-19-T-020,535,Lim Biow Chuan,"Why would PSP want Parliament to amend an Act of Parliament just simply to push for the suspension of salary of one particular MP? Is it their position that you punish first – suspend, cut his salary and then reimburse him later if he is found guilty? This goes against the rule of law."
2023-09-19-T-020-S-00536,2023-09-19-T-020,536,Lim Biow Chuan,"So, for that reason, I cannot support this Motion by Ms Poa and Mr Leong. I firmly believe that once the case against Mr Iswaran is concluded, the Government will do whatever is right to ensure that all parties are treated fairly. Hence, I support the Motion by the Leader of the House that we wait for the outcome of the investigations before considering any other action."
2023-09-19-T-020-S-00537,2023-09-19-T-020,537,Speaker,I think Mr Lim actually used the wrong word here. The reimbursement should be if the Member is found innocent.
2023-09-19-T-020-S-00538,2023-09-19-T-020,538,Lim Biow Chuan,"Yes. Yes, Mr Speaker."
2023-09-19-T-020-S-00539,2023-09-19-T-020,539,Speaker,Mr Raj Joshua Thomas.
2023-09-19-T-020-S-00540,2023-09-19-T-020,540,Raj Joshua Thomas,"Sir, there are two applicable principles that this House should look at when considering the Motions before us."
2023-09-19-T-020-S-00541,2023-09-19-T-020,541,Raj Joshua Thomas,"The first is the legal principle of the presumption of innocence, which have been mentioned by the Leader of the Opposition and Mr Lim. The second is the legal and democratic principle of tenure of office as provided in the Constitution."
2023-09-19-T-020-S-00542,2023-09-19-T-020,542,Raj Joshua Thomas,"The first is a simple, almost universal principle that where a person is being investigated or has been charged with an offence, he is to be presumed innocent until found guilty by a court of law. The Government's stated position is equivocal support for this principle."
2023-09-19-T-020-S-00543,2023-09-19-T-020,543,Raj Joshua Thomas,"As the hon Minister for Law said in response to the hon Member Christopher de Souza's Parliamentary Question on this in August 2008, I quote, ""Let there not be any doubt on this point. The presumption of innocence is an important and fundamental principle, and it is one of the foundations of our criminal justice system. The Government is absolutely committed to upholding the presumption of innocence as a core principle in our commitment to the rule of law."""
2023-09-19-T-020-S-00544,2023-09-19-T-020,544,Raj Joshua Thomas,"The principle is also applied by the Courts in Singapore. In a judgment by then Justice VK Raja, also in 2008, His Honour wrote, ""If the evidence is insufficient to support the prosecution's theory of guilt, the judge must acquit the accused... it simply has not been proved to the satisfaction of the law that the accused is guilty, and the presumption of innocence stands unrebutted."""
2023-09-19-T-020-S-00545,2023-09-19-T-020,545,Raj Joshua Thomas,"As it stands, Minister Iswaran is still under investigation. No charges have been brought at this point and no determination has been made by a Court. Therefore, the presumption of innocence continues to stand unrebutted."
2023-09-19-T-020-S-00546,2023-09-19-T-020,546,Raj Joshua Thomas,"The second principle is that of tenure of office. Article 46(1) of the Constitution provides that an MP will continue to be an MP from the time of election until the next dissolution of Parliament. The MP's seat would only become vacant under certain circumstances, which are enumerated in article 46(2). These include  (a) resigning; (b) failing to attend Sittings in two consecutive months without obtaining leave from the Speaker; and (c) becoming subject to the disqualifications from being a Member of Parliament like being convicted for an offence by a Court and sentenced to imprisonment for a term of not less than one year or to a fine of not less than $10,000."
2023-09-19-T-020-S-00547,2023-09-19-T-020,547,Raj Joshua Thomas,"The principle of tenure of an MP is important. It is a nod to the fact that MPs are elected by the people, who are the highest source of authority in a democracy and that they should therefore not be easily removable by any other authority in the land."
2023-09-19-T-020-S-00548,2023-09-19-T-020,548,Raj Joshua Thomas,This underlying reason should also apply to suspensions because the suspension is imposed by a body other than the people and prevents an MP from carrying out what he was elected to do. It should therefore not be a lever that is easily available and should only be used under very narrow circumstances.
2023-09-19-T-020-S-00549,2023-09-19-T-020,549,Raj Joshua Thomas,"Suspension is provided for in sections 21(1)C and 21(2) of the Parliament (Privileges, Immunities and Powers) Act 1962. The narrow circumstances in which it may be invoked is where the MP has displayed dishonourable conduct, abuse of privilege or contempt. Importantly, these circumstances must be proven."
2023-09-19-T-020-S-00550,2023-09-19-T-020,550,Raj Joshua Thomas,"As regard abuse of privilege, an MP must be first found guilty of abuse of privilege. As regards contempt, the MP must first have had to be found to have committed contempt by a Select Committee or found guilty in a court of law, pursuant to prosecution by the Public Prosecutor, or if an MP was summarily determined by Parliament to be guilty if the alleged offence was committed in the view of Parliament or where it was Sitting."
2023-09-19-T-020-S-00551,2023-09-19-T-020,551,Raj Joshua Thomas,The Standing Orders (SOs) also provide for suspension of a Member. SO59 provides that Parliament may suspend a Member but specifically so for the commission of the offences of disregarding the authority of the Chair or of persistently and wilfully obstructing the business of Parliament by abusing the rules of Parliament. Such a suspension requires that a vote be put to Parliament to determine whether such an offence had actually been committed.
2023-09-19-T-020-S-00552,2023-09-19-T-020,552,Raj Joshua Thomas,"Ms Poa referred to SO59(5). If I may read that out, ""Nothing in this Standing Order shall be taken to deprive Parliament of the power of proceeding against any Member according to any resolution of Parliament."""
2023-09-19-T-020-S-00553,2023-09-19-T-020,553,Raj Joshua Thomas,This does not mean that Parliament has the ability or the right to willy nilly decide to pass resolutions and to suspend Members for any reason. These resolutions must be pursuant to one of the provisions that I had mentioned earlier.
2023-09-19-T-020-S-00554,2023-09-19-T-020,554,Raj Joshua Thomas,"So, the common thread through all of these prescribed potential avenues for the suspension of an MP is that it must have been judged or determined in the manner provided that an offence had actually been committed."
2023-09-19-T-020-S-00555,2023-09-19-T-020,555,Raj Joshua Thomas,"In the current matter involving Minister Iswaran, the case is still under investigation. No judgment or determination has been arrived at."
2023-09-19-T-020-S-00556,2023-09-19-T-020,556,Raj Joshua Thomas,"I therefore come back to what I started with. In the current matter, the presumption of innocence continues to stand unrebutted and any move by Parliament to suspend the Minister as an MP is not only premature but does not have legal legs to stand on."
2023-09-19-T-020-S-00557,2023-09-19-T-020,557,Raj Joshua Thomas,"For completeness, there is also no mechanism to suspend merely an MP's salary."
2023-09-19-T-020-S-00558,2023-09-19-T-020,558,Raj Joshua Thomas,"In this regard, I cannot support the Motion by the hon NCMP. I will support the Motion by the hon Minister Indranee Rajah. Her Motion restates the standards that we expect our MPs to have. It affirms that they are to be treated fairly but firmly in the period after investigations are initiated, but before the presumption of innocence is rebutted, and resolves to deal with the matter at hand once the outcomes of investigations are known."
2023-09-19-T-020-S-00559,2023-09-19-T-020,559,Raj Joshua Thomas,"As a final point, Sir, I would like to confess that unlike Mr Lim, who was disturbed by it, when I first saw the Motion, as a graduate in both political science and law, I was quite titillated by this question of the circumstances in which an elected MP could be removed, suspended or otherwise prevented from exercising the mandate given to him by voters. I listened very carefully to Ms Poa's speech to identify the legal leg upon which her Motion would stand – but there was none."
2023-09-19-T-020-S-00560,2023-09-19-T-020,560,Raj Joshua Thomas,"In fact, Ms Poa even glossed over the basic requirement to invoke any of the avenues for suspension, which is that the presumption of innocence must first be rebutted."
2023-09-19-T-020-S-00561,2023-09-19-T-020,561,Raj Joshua Thomas,"The matter involving Minister Iswaran has understandably created anxiousness and some amount of consternation amongst the public. As a polity that prices transparency, fairness and incorruptibility, it is not unexpected that questions on egalitarian treatment or just or unjust remuneration have a reason in relation to this case. These matters invoke emotions in people."
