speech_id,topic_id,speech_order,member_name,text
2023-04-17-T-003-S-00500,2023-04-17-T-003,500,Desmond Choo,"Another group of vulnerable individuals comprise our self-employed persons (SEPs). We have seen the disproportionate impact COVID-19 had on SEPs. Through NTUC’s assistance in administering the Self-Employed Income Relief Scheme (SIRS), we are fully aware of the imperative to strengthen financial and career resilience for SEPs. Because of irregular contributions to CPF, it was also difficult to dispense loss of income support."
2023-04-17-T-003-S-00501,2023-04-17-T-003,501,Desmond Choo,"Of course, next, are our older workers. They not only face difficulties in landing new jobs but they also find it more difficult to acquire new skillsets. They also face the perennial and perhaps trickiest issue of workforce ageism, which requires addressing of mindsets."
2023-04-17-T-003-S-00502,2023-04-17-T-003,502,Desmond Choo,"As President Halimah also rightly highlighted, it is important for us to concentrate our efforts to improve social safety nets."
2023-04-17-T-003-S-00503,2023-04-17-T-003,503,Desmond Choo,"At this point, I was pondering about Assoc Prof Jamus Lim's observations and suggestions on support to our needy Singaporeans. I agree that we must continue to work our hardest to help our needy Singaporeans and work must not stop."
2023-04-17-T-003-S-00504,2023-04-17-T-003,504,Desmond Choo,"But the suggestion of having a single poverty line has inherent problems. It can have an unintended cliff effect where those below the line get the support but those above do not. The line also misses out on other issues that needy families face, for example, trying family circumstances, ill health and job readiness. It casts undue intention on just the financial circumstances of needy families. Experience from other countries has also shown that it is hard to simplify to just one figure and there is a tendency for people to want to stay below that figure; not too many of them, but certainly, there are."
2023-04-17-T-003-S-00505,2023-04-17-T-003,505,Desmond Choo,"I fully agree that our poor need extra help, and we can do better, and we must do better. Thus, our policies are shaped to give more to those who have less. Their needs are also complex. Therefore, we have many assistance schemes with different ways of helping for different outcomes. And there is also some sense to have separate criteria for different schemes. For example, ComCare is for poverty alleviation, supporting them in their needs versus Workfare, which is to help workers level up, tackling some inequality."
2023-04-17-T-003-S-00506,2023-04-17-T-003,506,Desmond Choo,"In my work as the Mayor of Northeast Community Development Council (CDC), I have often hoped to simplify the 60 schemes that the Northeast CDC run. But the more that we walk the ground, the more we realise that targeted solutions will work best and we cannot shine away from assessments. Not only does it reflect our prudence of responsibilities to public resources, it allows us to size the assistance to the needy appropriately. Therefore, an approach of providing support based on the varied needs of Singaporeans and their families might work better in a singular poverty line. It is rigorous in its assessment and flexible to the needs of Singaporeans."
2023-04-17-T-003-S-00507,2023-04-17-T-003,507,Desmond Choo,"I agree that documentation can be a burden. I struggle with that in my work in CDC too. And we must continue to make applications simpler. It is good for both Social Service Office (SSO) staff and applicants. With greater digitisation in the Government, we can already see the benefits of streamlining and we will, and I think, can do more on that front."
2023-04-17-T-003-S-00508,2023-04-17-T-003,508,Desmond Choo,"While we have different schemes with different criteria, what is most important is to make sure that while we streamline the application process, that the schemes are also effective. Our SSO officers work hard on the ground to do this, and I do feel, maybe I thought it incorrectly, but the way that Assoc Prof Jamus Lim characterised what they do might not be entirely fair. They seek not to take away the lifelines of the residents they serve."
2023-04-17-T-003-S-00509,2023-04-17-T-003,509,Desmond Choo,"Our SSO officers work hard to help our needy residents. I am extremely proud of them and knew a lot of them through the work in ComLink. In fact, many of them take on duties beyond what I required of them because of the multifaceted issues facing lower-income families. I certainly know my Tampines and Sengkang SSO officers. They built strong relationships with our ComLink families, testimony to the dedication and good work. But I acknowledge there will always be gaps in our schemes with the families or residents who need help in the Northeast District which includes Sengkang, I will do my best to help them as Mayor of Northeast CDC."
2023-04-17-T-003-S-00510,2023-04-17-T-003,510,Desmond Choo,"We must not also forget that helping more, which we must do, also requires that we earn more to pay for it. It is easy to say to do more, but it is much harder to pay more."
2023-04-17-T-003-S-00511,2023-04-17-T-003,511,Desmond Choo,"Good growth, good jobs and good wages are clearly important to helping needy residents better and more sustainably. In our new social compact and strategy, we hope to mobilise more support from all of community  corporates, charities, volunteers and philanthropists."
2023-04-17-T-003-S-00512,2023-04-17-T-003,512,Desmond Choo,"I have seen how donors, corporate donors, went from just pure financial support to volunteering personally to solve ground problems. Our Northeast CDC WeCare programme supports thousands of families, above the ComCare financial qualifying lines. It was funded by donations from religious organisations, temples, churches and mosques and funds from CDC. Only when we own the problems and solutions can we do more and build a stronger Singapore."
2023-04-17-T-003-S-00513,2023-04-17-T-003,513,Desmond Choo,"Next, I would like to suggest a couple of areas of focus to help Singaporeans to be able to rebound from tough times in two distinct phases  pre-loss of jobs and post-loss of jobs."
2023-04-17-T-003-S-00514,2023-04-17-T-003,514,Desmond Choo,"Firstly, on the pre-loss of jobs, we are experiencing a tight labour market now. With the tightness, actually, our median gross monthly income has increased in 2022 by more than $400. However, such a tight labour market also creates an environment whereby future-proofing opportunities may be put in the backseat. In this volatile economy, the key is to reskill to remain relevant in the workforce and to keep abreast of the changes."
2023-04-17-T-003-S-00515,2023-04-17-T-003,515,Desmond Choo,"The first suggestion I have is that we can help employers to allow workers to reskill while being gainfully employed. One of the ways is to increase absentee payroll funding and the overall $100,000 annual cap for companies. This will allow companies to send workers for training while being subsidised for such costs."
2023-04-17-T-003-S-00516,2023-04-17-T-003,516,Desmond Choo,"The costs of hiring temporary staff or replacement staff are increasing. The related costs of hiring and onboarding staff are also not insignificant. Hence, we can consider increasing absentee payroll funding support based on the age of employees, with older workers receiving greater support. Workers in vulnerable and sunset sectors can also be considered for enhanced absentee payroll support."
2023-04-17-T-003-S-00517,2023-04-17-T-003,517,Desmond Choo,"Currently, there is a fixed level of support for SSG-funded certifiable courses at $4.50 per hour. The organisation's cap is also limited to S$100,000 per calendar year. We should increase this cap, considering the increase in overall business costs. Companies sending a larger number of mature workers for training should also qualify for a higher cap. Companies will be incentivised to hire mature workers and our mature workers will be incentivised to train."
2023-04-17-T-003-S-00518,2023-04-17-T-003,518,Desmond Choo,"Next, on improving the post-loss of job support."
2023-04-17-T-003-S-00519,2023-04-17-T-003,519,Desmond Choo,"Firstly, we can introduce unemployment support for workers who are involuntarily forced to leave their jobs, such as retrenchment, something that my colleague, Member of Parliament, Mr Patrick Tay has mentioned. This support can be linked to training and job search to preserve the work ethos of the workforce. This builds on the principles behind our Workfare and COVID-19 Recovery Grant. These are important Singaporean policy characteristics. We must not forget that the longer one stays out of the workforce, the poorer employment outcomes will be. Thus, our system of unemployment support should taper off with time to ensure that individuals remain incentivised to re-enter the workforce."
2023-04-17-T-003-S-00520,2023-04-17-T-003,520,Desmond Choo,"Next, we can also enhance the Career Conversion Programmes (CCPs). We can increase allowance and income support during the conversion process as workers will still need to care for their families. We can also extend the enhanced CCPs to our SEPs. Many SEPs in the profession are in there because of their need for more discretionary income. Some of them do want to go on to other careers, hopefully, more permanent ones."
2023-04-17-T-003-S-00521,2023-04-17-T-003,521,Desmond Choo,"The next move is to extend career trials to SEPs as well. Currently, SEPs will not be eligible for career trials under the existing eligibility requirements. Could the Government look into expanding the eligibility and for those considering a job switch to undertake formal employment?"
2023-04-17-T-003-S-00522,2023-04-17-T-003,522,Desmond Choo,"While training and reskilling is an important feature of the nation's work ethos, it may be demoralising for workers to continually train but unable to secure employment. This is especially so for older workers whose runway is much shorter. While we cannot completely remove such risks, we can moderate the risk by having more Place-and-Train programmes. We can do so starting from the Public Service ecosystem, including the suppliers to the Public Service. More outreach efforts to potential host companies could be undertaken to increase the scope of such programmes and the Labour Movement stands ready to assist. Mr Speaker, please allow me to continue in Chinese."
2023-04-17-T-003-S-00523,2023-04-17-T-003,523,Desmond Choo,(In Mandarin)  [Please refer to  Vernacular Speech.] The working environment today is very different from what it used to be. The pace of economic transformation will be accelerated as geopolitical risks become more volatile. Our country and workforce will also be affected.
2023-04-17-T-003-S-00524,2023-04-17-T-003,524,Desmond Choo,We must actively strengthen the social safety net to give Singaporeans the confidence to move forward at every stage of their lives. We can promote and strengthen training programmes to ensure that Singaporeans have the skills that they need and capture job opportunities.
2023-04-17-T-003-S-00525,2023-04-17-T-003,525,Desmond Choo,"Workers and businesses that are relatively slow to respond to changes will be hardest hit. Therefore, we have to prepare for the work environment before and after job loss so that Singaporeans can bounce back quickly from the tough times and seize job opportunities."
2023-04-17-T-003-S-00526,2023-04-17-T-003,526,Desmond Choo,"For the unemployed, I hope that the Government will help them receive training during unemployment, such as the Career Conversation Programmes (CCPs). I also call on the Government to increase subsidies for the unemployed during this period."
2023-04-17-T-003-S-00527,2023-04-17-T-003,527,Desmond Choo,Job opportunities remain key to improving the quality of life for the people. The Government and the unions will do their best to help Singaporeans achieve this to ensure that all Singaporeans will not be left behind. Let us work together to create a better future.
2023-04-17-T-003-S-00528,2023-04-17-T-003,528,Desmond Choo,"(In English)  Mr Speaker, Sir, over the years, we have continued to strengthen our social safety nets. With an increasingly volatile global economy, we must help Singaporeans cope with the uncertainties and enable us to have the confidence to forge ahead."
2023-04-17-T-003-S-00529,2023-04-17-T-003,529,Desmond Choo,"Good growth, good jobs and strong social safety nets are key to helping Singaporeans navigate the vagaries and vicissitudes of a rapidly changing economy. I support the Motion."
2023-04-17-T-003-S-00530,2023-04-17-T-003,530,Speaker,Assoc Prof Jamus Lim.
2023-04-17-T-003-S-00531,2023-04-17-T-003,531,Jamus Jerome Lim,"Mr Speaker, with your indulgence, if I may clarify some points that the Member has just pointed out?"
2023-04-17-T-003-S-00532,2023-04-17-T-003,532,Speaker,Keep it to clarifications. Thank you.
2023-04-17-T-003-S-00533,2023-04-17-T-003,533,Jamus Jerome Lim,"Thank you. The first is the Member, Mr Desmond Choo, had pointed out that there is a cliff effect. But if I am not wrong, this applies to all lines already in place. And I wonder if the Member is suggesting that we should therefore encourage the Government, by the same token, to remove all thresholds that they currently have because of the same cliff effects?"
2023-04-17-T-003-S-00534,2023-04-17-T-003,534,Jamus Jerome Lim,"The Member also suggested that there were many schemes for many outcomes. And, of course, I agree with this specific tailoring. But still, it does not strike me as precluding a clear benchmark for which we can tag all these idiosyncratic needs to a clear benchmark line."
2023-04-17-T-003-S-00535,2023-04-17-T-003,535,Jamus Jerome Lim,"Just a third point, Mr Speaker, is that he mentioned that SSO officers have worked hard to support residents, including in Sengkang and, of course, I should clarify that I agree with this. But it is clear that they are constrained by the system. For example, the three- to six-month limit on short- and medium-term assistance is not decided by them but by MSF."
2023-04-17-T-003-S-00536,2023-04-17-T-003,536,Jamus Jerome Lim,"So, my question goes back to him. If the Member may clarify, how having an official poverty line makes it harder to provide tailored solutions? It is like saying that just because you seek this, you set a passing mark of 50%, but we cannot help a student to actually score higher than that —"
2023-04-17-T-003-S-00537,2023-04-17-T-003,537,Speaker,"Assoc Prof Lim, you can keep it more compact, please."
2023-04-17-T-003-S-00538,2023-04-17-T-003,538,Jamus Jerome Lim,I end here.
2023-04-17-T-003-S-00539,2023-04-17-T-003,539,Speaker,Mr Desmond Choo.
2023-04-17-T-003-S-00540,2023-04-17-T-003,540,Desmond Choo,"Mr Speaker, the Member, if I can recap, has three clarifications? I think what he meant, if I get him correctly, when he asked for a singular poverty line, that there is a line cutting across all schemes by which different schemes will be benchmarked too."
2023-04-17-T-003-S-00541,2023-04-17-T-003,541,Desmond Choo,"If not, then why would he be asking for a one singular poverty line rather than the current system that we have that will have different lines or different qualifying criteria for different purposes? And I think that, in our position, it is still better to adjust and be flexible to the needs of the ground, making sure that we size support appropriately for different schemes and not have a ""one-size-fits-all"" scheme."
2023-04-17-T-003-S-00542,2023-04-17-T-003,542,Desmond Choo,"I do agree with him that even if you have a singular line, it is not mutually exclusive. And I am glad that he agrees with that; regardless of whether you have a single line or not, you still must understand that the needs of the grounds are complex and you do need to have targeted schemes for targeted problems. That is one part that, first, I wish to clarify."
2023-04-17-T-003-S-00543,2023-04-17-T-003,543,Desmond Choo,"And the second one is whether they are constrained by the general policies. I cannot speak on behalf of MSF. But what I can speak on behalf is the schemes that CDC run. In the cases that I have seen, I have seen residents who have gotten support beyond three to six months, some even longer."
2023-04-17-T-003-S-00544,2023-04-17-T-003,544,Desmond Choo,"We have also provided our residents through schemes with CDC through our WeCare support. Many of them were from Sengkang. So, I think it is not true that the MSF scheme necessarily handicaps or that we constrain our officers in the help they can dispense. I also want to extend once again that if the Member has families in Sengkang that require assistance, I will be more than happy to assist them."
2023-04-17-T-003-S-00545,2023-04-17-T-003,545,Speaker,Assoc Prof Jamus Lim.
2023-04-17-T-003-S-00546,2023-04-17-T-003,546,Jamus Jerome Lim,"I promise to be brief. And just to quote exactly what I said in my speech, which was, I suggested and I quote, ""to peg all thresholds for Government assistance, especially ComCare to this line or higher but never lower."" So, the idea is that you would have a clear benchmark to map it to and you could have multiples to allow for these various tailored solutions."
2023-04-17-T-003-S-00547,2023-04-17-T-003,547,Speaker,Mr Ang Wei Neng.
2023-04-17-T-003-S-00548,2023-04-17-T-003,548,Ang Wei Neng,"Mr Speaker, Sir, in her address, President Halimah Yacob spoke about strengthening the social safety nets so that at every stage of life, Singaporeans can better cope with uncertainties and look forward with confidence. I totally agree that this is very important and we have to pay particular attention to low-income families, especially those with young children."
2023-04-17-T-003-S-00549,2023-04-17-T-003,549,Ang Wei Neng,"Last August, MSF announced that a one-person household on the ComCare Long Term Assistance scheme will receive a cash assistance of $640 per month or an increase of 6.25% from the previous cash amount of $600 per month. The qualifying criteria for Short Term Financial Assistance remain at a household income of not more than $1,900 per month or a per capita income of not more than $650 per month. There is no adjustment to the qualifying criteria despite a high inflation rate over the last two years."
2023-04-17-T-003-S-00550,2023-04-17-T-003,550,Ang Wei Neng,We understand that MSF has allocated about $601 million in its 2023 Budget to administer long-term and short-term financial assistance to vulnerable Singaporeans. But the question is whether this amount is sufficient?
2023-04-17-T-003-S-00551,2023-04-17-T-003,551,Ang Wei Neng,"To have a better comparison, we can look at how other advanced countries are providing cash benefits to assist vulnerable families. The Organization for Economic and Cooperation Development (OECD) countries spent about an average of 7% of their GDP on cash benefits. As Singapore is not a welfare state, it may not be fair to compare us with most of the OECD countries. Perhaps, we can look at those closer to home, such as South Korea. South Korea spent about 3% of its GDP on public social expenditure in cash benefits and how is it compared to Singapore?"
2023-04-17-T-003-S-00552,2023-04-17-T-003,552,Ang Wei Neng,"MSF will be spending $601 million on long- and short-term financial assistance, including the manpower costs to administer the ComCare Assistance. This represents about 0.6% of Singapore's 2023 Budget or only 0.1% of Singapore's GDP. Now, 0.1% of GDP appears small, compared to 3% of GDP South Korea spent on cash benefits for public social expenditure."
2023-04-17-T-003-S-00553,2023-04-17-T-003,553,Ang Wei Neng,"I am not advocating that we have to increase the ComCare expenditure by 30 times to match South Korea's. However, it is important that our support for low-income families keep pace with inflation. Singaporeans have been very much affected by the 14-year high inflation rate. We feel it every day as we buy our food, coffee, and groceries and pay our bills. According to an August 2022 study last year, it is the low-income households earning less than $2,500 a month which are the hardest hit, as they spend almost all their income every month."
2023-04-17-T-003-S-00554,2023-04-17-T-003,554,Ang Wei Neng,"Given the high inflation rate for the past two years and the expected slow economic growth this year, there is scope to help families cope by easing the qualifying criteria for help schemes across the board. For example, the qualifying criteria for ComCare short-term assistance can be revised by 10% so that applicants with per capita monthly household income of not more than $715 can qualify. Likewise, HDB rental flat qualifying criteria can also be eased by 10% so that applicants with less than $1,650 monthly income can apply."
2023-04-17-T-003-S-00555,2023-04-17-T-003,555,Ang Wei Neng,"Deputy Prime Minister Lawrence Wong has indicated that it is “almost a certainty” that inflation will be higher and longer. That is, high inflation will be the norm for quite some time. To better help the low-income families, I would like to suggest that all the Government assistance schemes could incorporate an inflation component so that both the qualifying criteria and the quantum of assistance rendered could be adjusted annually in tandem with inflation."
2023-04-17-T-003-S-00556,2023-04-17-T-003,556,Ang Wei Neng,"Mr Speaker, Sir, low-income families receiving financial assistance are living in much uncertainty, as described by Ms Cindy Ng in her article in The Straits Times last Saturday. We do not want inflation to add another layer of uncertainty for the lower-income families."
2023-04-17-T-003-S-00557,2023-04-17-T-003,557,Speaker,Mr Darryl David.
2023-04-17-T-003-S-00558,2023-04-17-T-003,558,Darryl David,"Mr Speaker, Sir, I rise in support of the Motion of Thanks to the President."
2023-04-17-T-003-S-00559,2023-04-17-T-003,559,Darryl David,"As Deputy Chair of the Government Parliamentary Committees (GPCs) for Education, and Culture, Community and Youth, I will be focusing my speech on these areas as covered in the President’s Address. I would also like to declare my interest as CEO of an educational organisation."
2023-04-17-T-003-S-00560,2023-04-17-T-003,560,Darryl David,"Mr Speaker, I become an educator more than 20 years ago because I believed, as I do strongly believe still, in the transformative power of education."
2023-04-17-T-003-S-00561,2023-04-17-T-003,561,Darryl David,"Education can unlock potential; it can allow a child to transcend his or her humble beginnings to achieve success; it can inspire a mid-career switch from discouragement to determination; and it can empower a generation to believe that there is nothing that they cannot do, on account of their gender or ethnicity."
2023-04-17-T-003-S-00562,2023-04-17-T-003,562,Darryl David,"Education, however, is more than just what is taught or learnt in formal, institutionalised settings. Indeed, as the writer Mark Twain once said, “Never let school interfere with your education.” For true education to be effective, we need to look at it from across all the multiple stakeholders in our society."
2023-04-17-T-003-S-00563,2023-04-17-T-003,563,Darryl David,"Families, employers, non-governmental organisations (NGOs), Voluntary Welfare Organisations (VWOs), social groups and communities all have their part to play, be it via advice and guidance you would give to your child or a policy that you would implement in your organisation."
2023-04-17-T-003-S-00564,2023-04-17-T-003,564,Darryl David,"So, I would argue, as we move forward into this post-COVID-19 era, an era that is probably as uncertain and unsure as any before it, that it will be the education of our society that will be crucial to Singapore’s next phase of development and that this education will not be a whole-of-Government, but rather a whole-of-community effort."
2023-04-17-T-003-S-00565,2023-04-17-T-003,565,Darryl David,"We live in an era where we are bombarded with information constantly and consistently. However, unless we have a way to process this information, it remains purely that – “information” that does not serve much use."
2023-04-17-T-003-S-00566,2023-04-17-T-003,566,Darryl David,"Education used to be about helping to turn that information into knowledge. So, if information was just random facts, education helped transform it into knowledge, that is, the information now made some sense and it was something that we could use."
2023-04-17-T-003-S-00567,2023-04-17-T-003,567,Darryl David,"However, the assumption then was that just because you knew something, you could put that knowledge to good use and actually do something. And, hence, it evolved into skills. So, now it was not so much about what you knew but what you could do."
2023-04-17-T-003-S-00568,2023-04-17-T-003,568,Darryl David,"So, I believe, indeed, that one of the key objectives of education should focus on what we can do rather than on what you know. There is no point amassing degrees and certificates if you ultimately cannot perform in terms of the skills that you need to deliver."
2023-04-17-T-003-S-00569,2023-04-17-T-003,569,Darryl David,"However, Mr Speaker, I would like to suggest that we should also aim to go beyond skills and to strive for the attainment of competencies as the ultimate end-goal of education. If skills are what you can do, then competencies are how you do it. And these are competencies that we should emphasise to ensure that our students, workers and people stay relevant for the future."
