speech_id,topic_id,speech_order,member_name,text
2023-04-17-T-001-S-00001,2023-04-17-T-001,1,Murali Pillai,"Mr Speaker, Sir, I beg to move, ""that the following Address in reply to the Speech of the President be agreed to  'We, the Parliament of the Republic of Singapore, express our thanks to the President for the Speech which she delivered on behalf of the Government at the Opening of the Second Session of this Parliament'."""
2023-04-17-T-001-S-00002,2023-04-17-T-001,2,Murali Pillai,"Sir, a week ago in this House, her Excellency Mdm Halimah Yacob, the President of the Republic of Singapore, delivered a speech on the priorities, policies and programmes of the Government for the remainder of the current term of office."
2023-04-17-T-001-S-00003,2023-04-17-T-001,3,Murali Pillai,"A plain review of the President’s speech and the 21 addenda issued by the respective Ministries and Prime Minister’s Office (PMO) since, reveals much more than that."
2023-04-17-T-001-S-00004,2023-04-17-T-001,4,Murali Pillai,"The plans go well beyond the remainder of the current term of this Government’s office. A good number of these plans, especially the ones dealing with the transformation of our defence capabilities, implementing our net zero ambition, developing our sustainable aviation and maritime hubs, transport systems and infrastructural capabilities and building an innovation economy will take decades to complete."
2023-04-17-T-001-S-00005,2023-04-17-T-001,5,Murali Pillai,These plans are not just incremental in nature. They are imaginative and involve stretch targets. They are aimed at delivering decisive advantages to Singaporeans of the future. And I fully support them.
2023-04-17-T-001-S-00006,2023-04-17-T-001,6,Murali Pillai,"They are not at all easy to achieve. To materialise these plans, we require the strong support of fellow Singaporeans. We also need highly competent and dedicated leaders at all levels of government, including the political leadership, to execute these plans."
2023-04-17-T-001-S-00007,2023-04-17-T-001,7,Murali Pillai,This is the defining characteristic of this People’s Action Party (PAP) Government.
2023-04-17-T-001-S-00008,2023-04-17-T-001,8,Murali Pillai,"It sees as its responsibility not just to take care of the current generation of Singaporeans for the near term. All our present-day advantages, hard won on the back of generations past are not considered, I quote, “a pinnacle of achievement, but as a base from which to scale new heights.”"
2023-04-17-T-001-S-00009,2023-04-17-T-001,9,Murali Pillai,"It sees as its bounden duty to lay strong foundations for future generations of Singaporeans. Indeed, this principle of steward leadership is specifically embedded in the concluding paragraph of the President’s speech. She urges us to, I quote, ""keep faith with future generations yet unborn and build a Singapore that thrives and endures for many years to come.”"
2023-04-17-T-001-S-00010,2023-04-17-T-001,10,Murali Pillai,The approach taken by the Government gives us in this House a unique opportunity.
2023-04-17-T-001-S-00011,2023-04-17-T-001,11,Murali Pillai,"It is my hope that hon Members who will be speaking during this debate will nail their colours to the mast and unequivocally state where they stand on the Government’s ambitious plans to build an enduring and thriving Singapore for now and years to come. By doing so, we will be able to explore building a consensus on these plans. This will include an agreement on funding the projects involved in the plans."
2023-04-17-T-001-S-00012,2023-04-17-T-001,12,Murali Pillai,We will also be able to avoid the polarising effect of these long-term plans becoming political “footballs” of populist politicians. What we cannot afford to do as a small country with no natural resources is to adopt a “stop/start” or “feast and famine” approach in funding these important plans. Such an approach will quickly deplete our precious resources and will almost certainly spell doom for Singapore.
2023-04-17-T-001-S-00013,2023-04-17-T-001,13,Murali Pillai,"Importantly, as I will be alluding to shortly in my speech, it is my belief that building consensus in this House on such key plans will help us retain trust and unity which the President has identified to be essential for the future of Singapore."
2023-04-17-T-001-S-00014,2023-04-17-T-001,14,Murali Pillai,"I start with the issue of trust. The President stated in her speech that as we emerged from the pandemic, trust in the Government has strengthened. The President also emphasised that trust and unity are key to dealing with our priorities that includes securing our place in the world, growing our economy and refreshing our social compact."
2023-04-17-T-001-S-00015,2023-04-17-T-001,15,Murali Pillai,"Indeed, today, Singapore is in a fortunate position to be a high trust country. I looked at the Edelman Trust Barometer 2023 that was reported on CNA on 15 March 2023. Trust in our Government as an institution was reported to be relatively high compared to a vast number of other countries. But we are not among the top three. So, we should not behave as though we have arrived."
2023-04-17-T-001-S-00016,2023-04-17-T-001,16,Murali Pillai,"The results of the survey are consistent with anecdotal experience. For example, during the COVID-19 pandemic, it is the strong trust between our people and our Government that led to higher levels of vaccination, which in turn ensured that we kept mortality rates low and allowed us to reopen our borders and rebuild our lives much faster than in many other countries."
2023-04-17-T-001-S-00017,2023-04-17-T-001,17,Murali Pillai,"We also know, though, that the trust built today can be easily lost tomorrow. This is the impermanent nature of this “being”. Trust cannot be assumed; it has to be conscientiously built and nurtured."
2023-04-17-T-001-S-00018,2023-04-17-T-001,18,Murali Pillai,The question I raise is how do we ensure that this strategic resource in the form of the reservoir of trust between our people and Government can be retained and even deepened as our nation navigates through an even more challenging socioeconomic environment?
2023-04-17-T-001-S-00019,2023-04-17-T-001,19,Murali Pillai,There are many facets to this. I wish to draw focus on three areas  (a) the work of our Public Service officers; (b) the work of our political leaders in this House; and at the end of my speech (c) the Forward Singapore exercise conducted by our 4G Team.
2023-04-17-T-001-S-00020,2023-04-17-T-001,20,Murali Pillai,"The Public Service plays a vital role in the maintenance of trust between our people and the Government. It will continue to play an important role in future. Sir, we are indeed fortunate to have very committed and hardworking public service officers dedicated to their respective organisational missions, the rule of law, securing Singapore’s national interests and improving the lives of Singaporeans. In my respectful view, the strong trust relationship that we enjoy today is attributable in a significant part to the blood, sweat and tears of our officers in discharging their solemn duties."
2023-04-17-T-001-S-00021,2023-04-17-T-001,21,Murali Pillai,"To underscore this point, Sir, please allow me to share that, not infrequently, I receive detailed email replies from public officers, especially from the Housing and Development Board (HDB), to my queries on behalf of my constituents in the wee hours of morning! I cannot help feeling bad for them as they obviously sacrificed their personal time with their families to deal with official work. These officers have a strong sense of duty. We owe them a huge debt of gratitude."
2023-04-17-T-001-S-00022,2023-04-17-T-001,22,Murali Pillai,"What I feel distinguishes our Public Service from others is that in both design and implementation, our officers have foremost in their minds the ordinary Singapore Citizen. In their roles, they serve to strike a balance between achieving policy objectives, exemplifying values such as compassion and fairness, accountability for the use of national resources and the desire to do justice in each and every case."
2023-04-17-T-001-S-00023,2023-04-17-T-001,23,Murali Pillai,Let me provide two examples by reference to my Meet-the-People Session (MPS) cases just on issues arising from Budget 2023 in the past few weeks.
2023-04-17-T-001-S-00024,2023-04-17-T-001,24,Murali Pillai,"Last month, I wrote an appeal on behalf of Mdm Zhu, who had just given birth to a baby girl, seeking the enhanced Baby Bonus cash gift as announced in Budget 2023. Her baby, Qi Yue, was born at 5.00 pm on 13 February 2023. This was seven hours too early as the enhanced Baby Bonus cash gift, which would have been disbursed seven to 10 days after registration of the baby’s birth, was meant for babies born on or after 14 February 2023."
2023-04-17-T-001-S-00025,2023-04-17-T-001,25,Murali Pillai,"Mdm Zhu mentioned that her baby was born earlier than expected. This turns out to be a significant ground of appeal. In fact, the Baby Bonus Cash Gift policy was designed to allow babies due to be born on or after 14 February 2023 but were delivered earlier to get enhanced cash gifts too. By being flexible and not mechanically applying the timeline, we managed to achieve a better balance between the policy intent and the legitimate expectation of the ordinary citizen."
2023-04-17-T-001-S-00026,2023-04-17-T-001,26,Murali Pillai,"My reward was that I got a photo of Baby Qi Yue who happened to lift her head for the first time on the day that the Government allowed Mdm Zhu’s appeal! So, maybe she approved too."
2023-04-17-T-001-S-00027,2023-04-17-T-001,27,Murali Pillai,"I now turn to my next example. In Budget 2023, an announcement was made on the GST Voucher - Cash (Seniors’ Bonus). The policy intent was to help lower-income senior Singapore Citizens aged 55 and above cope with the cost of living. To gauge the financial circumstances of the senior, the Government uses the income earned in 2021 as a proxy. It has to be less than $34,000."
2023-04-17-T-001-S-00028,2023-04-17-T-001,28,Murali Pillai,"I had a situation where my resident earned more than $34,000 in 2021 but had a significant drop in income in 2022 owing to personal circumstances. Technically, my resident did not qualify. However, having regard to the policy intent of the bonus, the Ministry of Finance (MOF), in its reply to the petition issued by me on behalf of my resident, was prepared to be flexible. It sought documents supporting my resident’s claim that his income dropped significantly in 2022 before assessing whether it is prepared to provide him with the bonus on a discretionary basis."
2023-04-17-T-001-S-00029,2023-04-17-T-001,29,Murali Pillai,"Again, this is an enlightened approach and there is much to commend the Public Service for exercising flexibility to ensure that the policy intent is met."
2023-04-17-T-001-S-00030,2023-04-17-T-001,30,Murali Pillai,"Sir, I do not mean to advocate that all appeals are automatically granted, regardless of merit. Far from it. What I am drawing attention to is the process."
2023-04-17-T-001-S-00031,2023-04-17-T-001,31,Murali Pillai,"Our citizens must feel that they were listened to, their views considered seriously and they received proper explanations in a respectful manner on the outcomes even if they may disagree with them. This approach will, in my view, deepen this strategic resource of trust between our people and the Government as an institution."
2023-04-17-T-001-S-00032,2023-04-17-T-001,32,Murali Pillai,Trust is the red thread running through the three points that the President made in her speech which made an impression on me.
2023-04-17-T-001-S-00033,2023-04-17-T-001,33,Murali Pillai,"First, the President highlighted the need for us, as a little red dot, to close ranks and stay united against global forces which will continue to try even harder to influence our domestic public opinion, so as to uphold Singapore’s vital interests."
2023-04-17-T-001-S-00034,2023-04-17-T-001,34,Murali Pillai,"Hon Members may recall the debate in this House on the Foreign Interference (Countermeasures) Bill that was passed in 2021 to deal with hostile information campaigns by foreign powers. What I thought significant then was the united view expressed by hon Members on both sides of the aisle that Singapore politics is for Singaporeans. As responsible politicians, we must continue to close ranks and hold the line on core issues of national importance."
2023-04-17-T-001-S-00035,2023-04-17-T-001,35,Murali Pillai,"Second, the President highlighted that this unity as a nation will be important as we aim to secure economic opportunities amid a global economic slowdown to strengthen our position as a trusted and reliable business hub adding value to the world."
2023-04-17-T-001-S-00036,2023-04-17-T-001,36,Murali Pillai,"On this, it may be useful to emphasise one important takeaway from this year’s Budget debate. The raison d’etre behind our economic objectives was never economic growth for its own sake. Rather, growth is a means to achieve our broader objectives of advancing the well-being of every Singaporean."
2023-04-17-T-001-S-00037,2023-04-17-T-001,37,Murali Pillai,We are already facing strong economic headwinds. The Ministry of Trade and Industry (MTI) reported last Friday that our economy grew by only 0.1 % in the first quarter of 2023. This affects our prospects for growth this year with inflation still running high. Economists are predicting a technical recession.
2023-04-17-T-001-S-00038,2023-04-17-T-001,38,Murali Pillai,The challenge facing us is clear. It seems to me what the President advocated in her speech about making sure Singapore is united in the context of a global economic slowdown has become all the more important now.
2023-04-17-T-001-S-00039,2023-04-17-T-001,39,Murali Pillai,"Third, the President emphasised the need to strengthen our social compact through programmes aimed at uplifting the disadvantaged and vulnerable and to keep us as one united people. The President identified this effort as a priority of the 4G team which is engaging Singaporeans through the Forward Singapore exercise to renew and update our social compact. I will talk more on the Forward Singapore exercise later in my speech."
2023-04-17-T-001-S-00040,2023-04-17-T-001,40,Murali Pillai,"The President also laid down the Government’s four key priorities to strengthen our social compact  (a) expanding opportunities for all, (b) strengthening social safety nets, (c) building a smart and liveable city and (d) deepening Singaporean’s sense of shared identity. In particular, the President stated that the Government will look into ensuring that advantages and privileges that may come with meritocracy does not become entrenched such that it weakens our society."
2023-04-17-T-001-S-00041,2023-04-17-T-001,41,Murali Pillai,"This point about the need to re-examine meritocracy was probably the most quoted point by my residents about the President’s speech whom I engaged with before drafting this speech. All of them expressed wholehearted agreement with the President. They agreed with the Government’s call to devote more resources to our children who start out with less. The support, however, is not just a question of fact, but a matter of degree too in order that we can make a tangible difference for these children."
2023-04-17-T-001-S-00042,2023-04-17-T-001,42,Murali Pillai,"The Government has already made substantial investments in our children from humble backgrounds, particularly at rental flats through programmes like the Kindergarten Fee Assistance Scheme (KiFAS) and the Community Link (ComLink)."
2023-04-17-T-001-S-00043,2023-04-17-T-001,43,Murali Pillai,"One other area of potential support that the Government should consider is to address the housing environment of children living in overcrowded flats. This is a point that I have raised several times; the last being at the Ministry of National Development (MND)'s Committee of Supply (COS) 2023 debate during my speech on strengthening inclusivity in housing. In my speech, I said “each child is precious, and we must do our utmost to ensure that they grow up in more conducive housing environment”."
2023-04-17-T-001-S-00044,2023-04-17-T-001,44,Murali Pillai,"To be fair, based on statistics provided by HDB, there are not many such cases, but I have come across a few."
2023-04-17-T-001-S-00045,2023-04-17-T-001,45,Murali Pillai,"One possible way that can be considered is to provide for Social Service Agencies to run study centres for these children near rental flats that are open after school. In this way, our children will be able to study in a more conducive environment after school. In Bukit Batok, we have one example in the form of Tava by Talent Beacon, which is a non-profit organisation that sets up a study centre specially for children living in our rental flats, with the support of MND and HDB. Tava even provides study support and mentoring for these children."
2023-04-17-T-001-S-00046,2023-04-17-T-001,46,Murali Pillai,"At the same time, the President emphasised the need for a stronger network of stakeholders to help provide opportunities for all, participate in nation building and build unity. This is not just the Government’s responsibility. I agree and I believe that all hon Members feel the same way too. The question is how can we achieve this? How do we get more committed stakeholders?"
2023-04-17-T-001-S-00047,2023-04-17-T-001,47,Murali Pillai,"During the Ministry of Social and Family Development (MSF)'s COS debate this year, I highlighted that over the past five years between FY2016 and FY2020, the amount of tax-deductible donations per year remained more or less stable at $1 billion."
2023-04-17-T-001-S-00048,2023-04-17-T-001,48,Murali Pillai,I said then that we need to do something more fundamental to move this needle. I suggested that successful organisations and individuals must feel more invested in the lives of the less fortunate. They must know that we are bound together in one common destiny. We sink or swim together.
2023-04-17-T-001-S-00049,2023-04-17-T-001,49,Murali Pillai,This is clearly not an easy ask but we must quite clearly put in as much effort as possible to realise this objective. One area where stakeholders can help is to level the playing field when it comes to giving our children sporting experiences which are perceived to be within the exclusive domain of the well-to-do.
2023-04-17-T-001-S-00050,2023-04-17-T-001,50,Murali Pillai,"Let me make my point through an example. I am not a golfer, but I have certainly read about the amazing story of Mr Mardan Mahmat, who was Singapore’s number one golfer for more than 10 years."
2023-04-17-T-001-S-00051,2023-04-17-T-001,51,Murali Pillai,"His is a rags-to-riches story. He dropped out of primary school at the age of 12. A year later, he became a caddie at Jurong Country Club. As a teenager, Mardan frequently snuck into the club’s golf course when no one was looking and, by himself, learned how to play the game. He obviously had loads of talent because he managed to hone it by himself. Long story short, he became Singapore’s number one golfer."
2023-04-17-T-001-S-00052,2023-04-17-T-001,52,Murali Pillai,"Mardan’s story is exceptional. The reality now is that children from low- or middle-income backgrounds will find it difficult to gain access to more expensive sports, such as golf."
2023-04-17-T-001-S-00053,2023-04-17-T-001,53,Murali Pillai,"I do think though that something can be done through stakeholders with the appropriate resources to organise efforts to reach out to interested children, give them the sporting experience, suss out from among them the next Mardan Mahmat whom they can help to nurture to be a Singapore golf champion."
2023-04-17-T-001-S-00054,2023-04-17-T-001,54,Murali Pillai,"I am aware that many of these stakeholders already do wonderful charity work. I do hope though that they can consider this as a worthwhile extension of their efforts. The idea here is to provide children with the requisite talent and drive, regardless of their background, with opportunities to pursue their sporting dreams and become national athletes."
2023-04-17-T-001-S-00055,2023-04-17-T-001,55,Murali Pillai,I now turn to the work of political leaders in this House.
2023-04-17-T-001-S-00056,2023-04-17-T-001,56,Murali Pillai,The President stated in her speech that the trust between the political leadership and the people is a key strength that we must continue to nurture.
2023-04-17-T-001-S-00057,2023-04-17-T-001,57,Murali Pillai,"The President gave important guidance in this regard. She advised that our interactions as politicians be anchored on mutual respect and the shared goal of advancing the larger public interest. We should work through our differences, enlarge our common ground and draw strength from our diverse perspectives."
2023-04-17-T-001-S-00058,2023-04-17-T-001,58,Murali Pillai,"I fully agree. We, politicians, are at our best when we present our arguments in a measured way, recognise the inherent trade-offs in each of the policy suggestions that we make and present cogent arguments as to why we feel the balance should be struck one way or another."
2023-04-17-T-001-S-00059,2023-04-17-T-001,59,Murali Pillai,What the President stated brought to my mind the speech that I made during the opening of the 14th Parliament when I advocated several proposals for Parliamentary reform of our evolving democracy.
2023-04-17-T-001-S-00060,2023-04-17-T-001,60,Murali Pillai,"I said then that building consensus in this House is an important outcome of our work here. I described consensus as a process of contestation, persuasion and resolution. Equally important is that such engagement will enable Singaporeans outside this House to have a better opportunity to understand the points of agreement, points of disagreement raised by their elected representatives and, through that, they will be able to better appreciate how these points impact on the ordinary lives of Singaporeans."
2023-04-17-T-001-S-00061,2023-04-17-T-001,61,Murali Pillai,"This is a form of accountability, too. Singapore has always preferred an undramatic approach to problem solving. This is our political heritage from the first generation of our political pioneers. Some of you may have recognised that I quoted a line from Dr Goh Keng Swee at the start of my speech – that we must consider our starting today merely as a base to build tomorrow."
2023-04-17-T-001-S-00062,2023-04-17-T-001,62,Murali Pillai,"Dr Goh was one of our deepest policy thinkers. He said, and I quote, “Deciding on policy and determining a line of action is different from engaging in a debate. Cabinet government is not a debating society or an academic seminar. These are intellectual exercises. Views are aired and, if done with style and elegance, the participants go home happy. In Government, you have to live with the consequences of your decision. If you make a mistake, the results are painful. In political life, there is no alibi for failure.”"
2023-04-17-T-001-S-00063,2023-04-17-T-001,63,Murali Pillai,"I feel that we, in Parliament, should bear this in mind. When we deal with the real issues in this House, we know that they often matter to millions of lives. When we say that we are not “ideological” about something, it means that we are not wedded to whether the idea is from the left or the right, from the PAP or the Opposition, we are not wedded to repeating yesterday’s solutions tomorrow."
2023-04-17-T-001-S-00064,2023-04-17-T-001,64,Murali Pillai,"We should be disinterested in merely sounding good. On their own, they do not serve the interests of Singaporeans."
2023-04-17-T-001-S-00065,2023-04-17-T-001,65,Murali Pillai,"It is against this background that I argue the need for constructive politics in Parliamentary proceedings. Here, it may be useful to recount the debate that we had in this House on the Foreign Interference (Countermeasures) Bill."
2023-04-17-T-001-S-00066,2023-04-17-T-001,66,Murali Pillai,"Before the Second Reading of the Bill in this Parliament, there were concerns within certain quarters about the broad language of the Bill and perceived lack of judicial oversight. My hon friends across the aisle proposed amendments to the Bill to address, among others, these points. Hence, even before the hon Minister for Home Affairs delivered his Second Reading speech, lines were already drawn. This led to the hon Minister making a plea in this House to hon Members not to use Parliament as a forum to read out prepared speeches based on lines that were already drawn before he rendered his speech."
2023-04-17-T-001-S-00067,2023-04-17-T-001,67,Murali Pillai,"When I rose to speak on the Bill, I highlighted that whilst there were important differences between the views of the hon Members from both sides of the aisle, they were few, compared to the substantive areas of agreement between them. I do not remember a single journalist covering this point in his or her article."
2023-04-17-T-001-S-00068,2023-04-17-T-001,68,Murali Pillai,"I am not surprised. In my speech on building consensus in Parliament, I said that, and I quote “agreement, collegiality, friendliness, all these make for poor headlines”. Contestation sells, not consensus. As a result, the public perceived that there was a wide chasm between the hon Members of the governing and opposition parties on Foreign Interference (Countermeasures) Act (FICA) than what was, in fact, the case."
