speech_id,topic_id,speech_order,member_name,text
2023-04-17-T-001-S-00317,2023-04-17-T-001,317,Zhulkarnain Abdul Rahim,"We must unlock our collective spirit to help one another. This is the principle of social solidarity where the people, through its government, bear equally the responsibility and burden for helping fellow citizens. The task of helping the underprivileged or vulnerable in our society does not fall on the shoulders of the Government or civil society alone but on all of us."
2023-04-17-T-001-S-00318,2023-04-17-T-001,318,Zhulkarnain Abdul Rahim,"But how do we maintain such social cohesion and solidarity? Just like the Lego bricks, we need to strengthen the interlocking connections that bind us and guard against threats and external forces that seek to divide us and undermining our painstakingly built level of trust in the institutions of our nation and society."
2023-04-17-T-001-S-00319,2023-04-17-T-001,319,Zhulkarnain Abdul Rahim,"During the first half of this Parliament term, this House has debated and passed various pieces of legislation to further put us in better stead to withstand against such potential external forces through amendments to the Online Safety Act, enactment of the Foreign Interference (Countermeasures) Act and the formation of the Digital and Intelligence Service of the SAF."
2023-04-17-T-001-S-00320,2023-04-17-T-001,320,Zhulkarnain Abdul Rahim,"Externally, we must continue to remain vigilant and ensure our laws keep up to date with global trends, threats and developments. Internally, we must remain steadfast and committed to our Singaporean values of living in an open but multiracial and multi-religious society. The pandemic has laid bare the vulnerabilities of societies all over the world. Global studies have found that there is a correlation between the pandemic and explicit xenophobic and racial prejudices."
2023-04-17-T-001-S-00321,2023-04-17-T-001,321,Zhulkarnain Abdul Rahim,Anti-discrimination or legislative guards against hate speech go some way but we also need a softer approach for a more enduring harmony. I look forward to the Government's plans to ensure that our laws remain relevant in maintaining our social and racial harmony.
2023-04-17-T-001-S-00322,2023-04-17-T-001,322,Zhulkarnain Abdul Rahim,"In particular, I am looking forward to the full implementation of the Maintenance of Racial Harmony Act, first announced by Prime Minister Lee Hsien Loong during the 2021 National Day Rally speech. This will complement the existing Maintenance of Religious Harmony Act passed since 1990."
2023-04-17-T-001-S-00323,2023-04-17-T-001,323,Zhulkarnain Abdul Rahim,The new law is meant to consolidate all current legal powers dispersed across the Penal Code and Sedition Act to ensure the maintenance of racial harmony in Singapore. It will not only provide the powers to restrain someone from committing an offence regarding racism but also compel them to learn more about the other race. This understanding and appreciation of one another's values and cultures is the key towards breaking the cycle of ignorance and racism.
2023-04-17-T-001-S-00324,2023-04-17-T-001,324,Zhulkarnain Abdul Rahim,I hope that the law will also offer protection to whistle-blowers who report such instances of racial prejudices and unfair employment practices.
2023-04-17-T-001-S-00325,2023-04-17-T-001,325,Zhulkarnain Abdul Rahim,"Besides protection and safeguards on our social cohesion, we also need ways to promote social solidarity. I agree with the President that as we strive for success and progress for our nation, we must not allow our society to stratify into those who have and those who are left behind. We need to build a sense of collective responsibility among us."
2023-04-17-T-001-S-00326,2023-04-17-T-001,326,Zhulkarnain Abdul Rahim,"We must appreciate the interdependence between people in our society. We must make Singaporeans feel that they can improve the lives of others and, in the same process, uplift their own lives in a meaningful way."
2023-04-17-T-001-S-00327,2023-04-17-T-001,327,Zhulkarnain Abdul Rahim,"This begins with our young. As such, I welcome the changes to our education system to promote greater social mixing and competency-based subject learning and the infusion of value-based interactions and engagements in our children's educational journey."
2023-04-17-T-001-S-00328,2023-04-17-T-001,328,Zhulkarnain Abdul Rahim,"In adulthood and working life, we see more businesses – both employers and employees – dedicate more pro bono hours towards corporate social responsibility activities on various causes that are beneficial to Singaporeans. We must continue to promote and incentivise this ""paying it forward"" as part of our working culture here in Singapore and truly understand that there is no contradiction between doing what is best for the company and doing what is good for the community and nation."
2023-04-17-T-001-S-00329,2023-04-17-T-001,329,Zhulkarnain Abdul Rahim,"The President also emphasised that in paying it forward, we must help one another to stand tall with dignity and pride. This means that it is not patronising from the perspective of the person receiving."
2023-04-17-T-001-S-00330,2023-04-17-T-001,330,Zhulkarnain Abdul Rahim,"In this regard, I am glad that we have provided various uplifting measures that allow those who need a helping hand to get the boost they need to upgrade and upskill themselves in the path towards social mobility. This is a work in progress and we must continue to refine the approach and solutions in a targeted yet dignified and respectful manner without converting the social mobility ladder into a crutch of help that will be both belittling and debilitating."
2023-04-17-T-001-S-00331,2023-04-17-T-001,331,Zhulkarnain Abdul Rahim,"The last term of our Parliament session has also seen the Government afford more help through housing, healthcare and social welfare policies, passing legislation to form the Public Defender's Office to allow greater access to criminal justice and changes to the Misuse of Drugs Act, which affords greater vigilance against the scourge of drug abuse, especially on the vulnerable segments of our society."
2023-04-17-T-001-S-00332,2023-04-17-T-001,332,Zhulkarnain Abdul Rahim,"We must continue to keep a close eye on areas that will affect the social harmony and justice for the vulnerable groups in our society. Sir, in Malay, please."
2023-04-17-T-001-S-00333,2023-04-17-T-001,333,Zhulkarnain Abdul Rahim,"(In Malay)  [Please refer to  Vernacular Speech.] In my view, President Halimah's speech not only lays out the Government's priorities and future plans, but it also acknowledges how we managed to overcome the pandemic together as one people. At the same time, however, the President's speech recognised that the key challenge is to ensure that there was continued trust between the political leadership and our people and between Singaporeans."
2023-04-17-T-001-S-00334,2023-04-17-T-001,334,Zhulkarnain Abdul Rahim,"Our pillars of strength are peace and unity in diversity regardless of race, religion or political views. I agree that the approach and discussion of issues that concern our people and community should be discussed respectfully, responsibly, factually and judiciously. I agree that generally, for issues that are important to our country, many of us place national interests above individual rights. However, this is not always guaranteed and the critical challenge for all of us is to prioritise social cohesion and our country’s progress in an ever-changing post-pandemic world."
2023-04-17-T-001-S-00335,2023-04-17-T-001,335,Zhulkarnain Abdul Rahim,"Let us respond to the call for unity to ensure that while we achieve progress for our people and country, we do not overlook those who are in greater need so that they are not engulfed in the tide of modernity and change. We should not leave them behind because if everyone does not experience happiness and progress, our social fabric will be incomplete and imperfect – as the Malay proverb goes, it will be like an unfinished dress because the thread ran out and the needle broke."
2023-04-17-T-001-S-00336,2023-04-17-T-001,336,Zhulkarnain Abdul Rahim,"(In English)  Mr Speaker, Sir, as our society grows through decades of nation-building, we have built a sense of identity and belonging as Singaporeans. However, who qualifies as a member of our society should not be narrowly defined and we should not be quick to succumb to the othering phenomenon and the pitting of ""us"" versus ""them"" – whatever ""us"" and ""them"" mean."
2023-04-17-T-001-S-00337,2023-04-17-T-001,337,Zhulkarnain Abdul Rahim,"The fault lines in our society can be easily exploited, knowingly or unknowingly, through the differences in how we look, where we come from, whether or not we can speak a certain language, whether we belong to the same social standing or whether we agree or disagree on a particular policy. We cannot allow these to seep into the language of our politics and divide us."
2023-04-17-T-001-S-00338,2023-04-17-T-001,338,Zhulkarnain Abdul Rahim,"I concur with the President's call for all of us to close ranks and stand united regardless of race, religion or political affiliation, especially when it comes to core national interests."
2023-04-17-T-001-S-00339,2023-04-17-T-001,339,Zhulkarnain Abdul Rahim,"SG50, SG Together, SGUnited, SG Cares – all of these campaigns are reminders of what we can achieve when we remain united in our hearts and minds. Let us continue to stand with one another. I stand in support of the Motion."
2023-04-17-T-001-S-00340,2023-04-17-T-001,340,Speaker,Deputy Prime Minister Lawrence Wong.
2023-04-17-T-001-S-00341,2023-04-17-T-001,341,Lawrence Wong,"Mr Speaker, as the President highlighted in her speech, this new session of Parliament is happening at an important milestone of our history, indeed, of world history."
2023-04-17-T-001-S-00342,2023-04-17-T-001,342,Lawrence Wong,"After three years of the COVID-19 crisis, we now confront other formidable challenges. But as we have seen again and again in our history, we can find opportunities in every crisis and move quickly to take advantage of them."
2023-04-17-T-001-S-00343,2023-04-17-T-001,343,Lawrence Wong,"There are stark realities facing Singapore and the wider world. From the war in Europe to deepening big power rivalry in our part of the world, we all feel a palpable sense of danger – danger not just to the economy, but also to an open and stable global order."
2023-04-17-T-001-S-00344,2023-04-17-T-001,344,Lawrence Wong,"We will continue to be afflicted by these external headwinds. I know many Singaporeans worry about the unexpected twists and turns that may lie ahead. They see interest rates, prices and bills going up and impacting their livelihoods."
2023-04-17-T-001-S-00345,2023-04-17-T-001,345,Lawrence Wong,That is why I had implemented comprehensive support measures in this year's Budget. These measures will help to cover the inflation-induced increase in spending for lower- and middle-income households.
2023-04-17-T-001-S-00346,2023-04-17-T-001,346,Lawrence Wong,"Some of the support has been given out, while others will be rolled out progressively over the year. We have and will continue to do everything we can to address the stresses and strains that people feel on the ground."
2023-04-17-T-001-S-00347,2023-04-17-T-001,347,Lawrence Wong,"Besides tackling the cost of living, sustaining growth will be more challenging in this new environment. We will have to redouble our efforts to attract investments and talent, and create good jobs and opportunities for Singaporeans. We will have to intensify the pace of restructuring and transformation to stay ahead of the competition."
2023-04-17-T-001-S-00348,2023-04-17-T-001,348,Lawrence Wong,"All this will not be easy, but COVID-19 has shown that Singaporeans have what it takes – the grit and resolve to overcome tough challenges. The odds may appear stacked against us, but we can turn challenges into opportunity. With pride in our history and strength from our unity, we can forge ahead with confidence. So, I say – do not fear. Never lose heart."
2023-04-17-T-001-S-00349,2023-04-17-T-001,349,Lawrence Wong,"We will build on our strong foundations, but we must also have the courage to change where change is needed. This is what my colleagues and I have set out to do with Forward Singapore. Through this exercise, we are reviewing our policies across all areas. We will ensure that the broad middle of society and their children see continued improvements in their lives, and that we close the gaps for the more disadvantaged groups."
2023-04-17-T-001-S-00350,2023-04-17-T-001,350,Lawrence Wong,"We have heard from Singaporeans over the past months – your views, aspirations and ideas. The many conversations and partnerships have yielded fresh insights on what we can do differently in our next stage of nation-building."
2023-04-17-T-001-S-00351,2023-04-17-T-001,351,Lawrence Wong,"Today, I will share some of the key shifts that we will embark on as part of our new social compact  a new approach on skills; a new definition of success; a new approach for social support; a new approach to caring for our seniors; and a renewed commitment to one another – less about ""I"" and ""me"", more about ""us"" and ""we""."
2023-04-17-T-001-S-00352,2023-04-17-T-001,352,Lawrence Wong,"If we succeed in effecting these shifts, we can secure a stronger social compact and not just among ourselves, but between this generation and future generations to come."
2023-04-17-T-001-S-00353,2023-04-17-T-001,353,Lawrence Wong,"Let me start with our new approach on skills, for skills are the lynchpin to lifelong success."
2023-04-17-T-001-S-00354,2023-04-17-T-001,354,Lawrence Wong,"The skills journey begins early in life. We want every child to have a strong foundation that can propel them forward through life. We know that the first few years matter greatly in shaping a child's potential. So, we are scaling up the KidSTART programme nationwide to reach out to more lower-income parents and to close the early gaps in our children's lives."
2023-04-17-T-001-S-00355,2023-04-17-T-001,355,Lawrence Wong,"Beyond the age of three, we are stepping up the provision of MOE Kindergartens and Government-funded preschools. Enrolment in preschool at ages five to six is already near universal, but the attendance rate of children from lower-income families can still be improved. At ages three to four especially, more children from such families can also benefit from enrolling in preschool. We will study how to strengthen their participation in these early years of development, so that we can give the children in these families the best possible start in life."
2023-04-17-T-001-S-00356,2023-04-17-T-001,356,Lawrence Wong,"Once our children enter the school system, there is a comprehensive system in place to help them develop and grow. We already provide more resources in our schools to support children with greater learning needs. And we will continue to do more on this front, so that every child can realise his or her full potential."
2023-04-17-T-001-S-00357,2023-04-17-T-001,357,Lawrence Wong,"But there is a deeper challenge in our education system  our concept of meritocracy remains too narrow. Many feel caught in a rat race from a young age – under pressure to get the best grades, get into what they perceive to be the best schools so that they can get the best university places."
2023-04-17-T-001-S-00358,2023-04-17-T-001,358,Lawrence Wong,"Many parents, too, are anxious about their children's future. Some go to great lengths to maximise their children's chances to get into perceived brand name schools, even preschools."
2023-04-17-T-001-S-00359,2023-04-17-T-001,359,Lawrence Wong,"A decade ago, Deputy Prime Minister Heng Swee Keat said that ""Every school is a good school”. I fully agree with this. Because in Singapore, everyone can be assured that, no matter which schools their children are admitted into, they will receive a good education, and they will be well supported by their teachers."
2023-04-17-T-001-S-00360,2023-04-17-T-001,360,Lawrence Wong,That was my lived experience too. I went to the primary and secondary schools near my home and reaped the full benefits of learning in those schools.
2023-04-17-T-001-S-00361,2023-04-17-T-001,361,Lawrence Wong,"That was decades ago. And the quality of our schools and teachers has improved dramatically since. These days, our teachers do not just focus on content and knowledge. They help our children to think independently and instil in them qualities and values that contribute to lasting success in life."
2023-04-17-T-001-S-00362,2023-04-17-T-001,362,Lawrence Wong,"Remember, at the end of the day, we are more than our grades. We are more than the schools we go to."
2023-04-17-T-001-S-00363,2023-04-17-T-001,363,Lawrence Wong,"This is an aspiration Singaporeans have voiced for some time now, from when we held Our Singapore Conversation a decade ago. Since then, we have made significant moves and slayed some sacred cows."
2023-04-17-T-001-S-00364,2023-04-17-T-001,364,Lawrence Wong,"Today, PSLE T-scores are a thing of the past. So will be the labels of Normal (Technical), Normal (Academic) and Express streams. In their place, there is full Subject-based Banding (SBB)."
2023-04-17-T-001-S-00365,2023-04-17-T-001,365,Lawrence Wong,"We hope these moves will go some way to remove the stressors in our education system. But more importantly, we hope they will signal to all in society that we are serious about refreshing our system."
2023-04-17-T-001-S-00366,2023-04-17-T-001,366,Lawrence Wong,"I hope that our society too – every man, woman and child, young and old, rich or poor – all of us will be serious about refreshing our mindsets about schools and grades. It is not possible to change something that has become so ingrained in our nature by government decree. We must be the change we want to see in our society. Every Singaporean must want to give themselves and their children more breathing space to discover and develop their diverse talents and to maximise their potential."
2023-04-17-T-001-S-00367,2023-04-17-T-001,367,Lawrence Wong,How do we achieve this?
2023-04-17-T-001-S-00368,2023-04-17-T-001,368,Lawrence Wong,"A key mindset shift is to recognise that formal education early in life is not the endpoint of our meritocracy. Far from it. Our refreshed meritocracy must be a continuous one, with learning opportunities, milestones and ladders at multiple junctures. All must have the chance to try again, do better and move forward in life, years after leaving school."
2023-04-17-T-001-S-00369,2023-04-17-T-001,369,Lawrence Wong,"So, the skills journey begins in schools but it does not end with schools. Our new approach on skills must include a fresh commitment to making continuous learning, reskilling and upskilling a way of life."
2023-04-17-T-001-S-00370,2023-04-17-T-001,370,Lawrence Wong,"In fact, this will become more important with slower economic growth, rapid technological disruptions and greater job churn. To remain an upwardly mobile society, lifelong learning will be key – not just upskilling once and being done with it, but multiple times, to become more adaptable and resilient, well-equipped and confident to face the future."
2023-04-17-T-001-S-00371,2023-04-17-T-001,371,Lawrence Wong,"To get there, education cannot be confined to the first 25 years of our lives. Learning must be a lifelong journey for the whole of our lives."
2023-04-17-T-001-S-00372,2023-04-17-T-001,372,Lawrence Wong,"We launched SkillsFuture in 2015. We have made some headway since then, but there is still much more to be done. We are therefore looking at major changes to strengthen SkillsFuture."
2023-04-17-T-001-S-00373,2023-04-17-T-001,373,Lawrence Wong,"We aim to reduce the costs and lower the barriers to training. We will work with industry partners to come up with effective training programmes, including work-based learning options. These courses will have to be better curated and vetted so that they translate into meaningful employment outcomes. We will discuss with tripartite partners how we can support workers to take time off to train. This will help the workers individually, but it will help businesses too."
2023-04-17-T-001-S-00374,2023-04-17-T-001,374,Lawrence Wong,"At the same time, businesses must shift their emphasis from hiring credentials to hiring skills and invest in the development of their employees. And Singaporeans themselves must be open to change."
2023-04-17-T-001-S-00375,2023-04-17-T-001,375,Lawrence Wong,"Sir, let me share with you the story of Afifah. Nur Afifah Bte Rakif graduated with a Diploma in Communication and Information Design 11 years ago, when she was 22. She later chose to teach in a preschool in 2013, took up various early childhood education programmes to reskill and upskill, and became the Deputy Centre Lead of the NTUC First Campus. To strengthen her skillsets, she is now pursuing a degree under the Singapore University of Social Science (SUSS) Work-Study Programme and will graduate later this year. Afifah exemplifies the spirit of lifelong learning and the value of reskilling and upskilling in pursuing one's passions. And I salute her."
2023-04-17-T-001-S-00376,2023-04-17-T-001,376,Lawrence Wong,"With this new approach on skills, how well you did in school should not define the opportunities you can unlock nor should it determine your entire life. You are not stuck at your highest formal educational level attained; you can update your skillsets, pivot to new careers, seize new opportunities and keep moving forward in life."
2023-04-17-T-001-S-00377,2023-04-17-T-001,377,Lawrence Wong,Some other nations aspire to create a welfare society from cradle to grave. We will aspire to create in Singapore a full-fledged learning society – from cradle to grave. [Applause.]
2023-04-17-T-001-S-00378,2023-04-17-T-001,378,Lawrence Wong,That is how we will become a people ready for the future and equipped to succeed.
2023-04-17-T-001-S-00379,2023-04-17-T-001,379,Lawrence Wong,"But what does success mean? Naturally, it means different things to different people, in different places. Yet somehow, as a society, we tend to converge around a few material definitions – the size of the paycheck or the property we own."
2023-04-17-T-001-S-00380,2023-04-17-T-001,380,Lawrence Wong,"How can we shift our lens and collectively adopt and embrace wider definitions of success? After all, success is really for each one of us to define. There is no model answer to follow. We should not feel pressured to compare with others or to conform to preconceived notions. The Japanese talk about discovering your ""ikigai"" – something that gives you a sense of purpose and joy. We should strive to be a meritocracy where everyone can be the best possible version of themselves and where there are many ways for diverse talents to contribute and earn respect in our society."
2023-04-17-T-001-S-00381,2023-04-17-T-001,381,Lawrence Wong,"Mindset shifts are necessary, but I do not think mindset shifts alone will effect societal change. It is not enough to say we will celebrate a variety of professions. Our economic structures, remuneration and career prospects in various professions must also be consistent with what we value."
2023-04-17-T-001-S-00382,2023-04-17-T-001,382,Lawrence Wong,"So, we will consider ways to tilt the scales and narrow the wage gap across professions. One specific way is to further professionalise skilled trades, like electricians and plumbers. Why not enable them to attain accreditation for their skills and set a clearer progression ladder as they take on greater responsibilities? We can ascribe the right values to such forms of labour and grant such workers greater remuneration as professionals."
2023-04-17-T-001-S-00383,2023-04-17-T-001,383,Lawrence Wong,"More broadly, we also want to give Singaporeans who graduate from ITE and polytechnics stronger assurance; that their wages and career prospects will not be too far below their university-going peers and will not be permanently conscribed to be below. So, they do not have to succumb to a paper chase to secure a good salary and a viable career path. They can excel in the professions that they have trained in and have the aptitude for, be it hospitality, infocomm, social services or others. There are many ways to make a difference, many talents to nurture and many forms of contributions to reward."
2023-04-17-T-001-S-00384,2023-04-17-T-001,384,Lawrence Wong,"Take lower-wage workers for example. Many of them serve in essential services, like security, lift maintenance and cleaning. We have been doing much to uplift lower-wage workers through Workfare and the PWM, and we will continue to do so  increase wages, set out a skills ladder, and provide opportunities to upgrade. We cannot close the gap altogether between lower-wage and median workers, but we can certainly stop their wages from diverging too far."
2023-04-17-T-001-S-00385,2023-04-17-T-001,385,Lawrence Wong,"Here, I have a plea to everyone  for a new definition of success to become a reality, all of us – as consumers – must be willing to bear a higher cost for the goods and services we consume. We must recognise the important work that our fellow citizens undertake to keep our society going and do our part to uplift them and boost their wage prospects."
