speech_id,topic_id,speech_order,member_name,text
2023-03-02-T-007-S-00754,2023-03-02-T-007,754,Desmond Lee,"First-timers are also given two ballots, compared to one for second-timers."
2023-03-02-T-007-S-00755,2023-03-02-T-007,755,Desmond Lee,"But first-timers are a diverse group, as they include all eligible Singaporeans who have not enjoyed a housing subsidy before. There are some who may have owned private property, some who had purchased a resale flat without taking housing grants and subsidies, as well as couples who are planning to get married."
2023-03-02-T-007-S-00756,2023-03-02-T-007,756,Desmond Lee,"Among this diverse group, we need to give stronger support to younger married couples and parents. Indeed, one of the participants in our Forward Singapore Housing Conversations told us that, ""It is hard to feel like a family or think about having kids if you don't have your own home."""
2023-03-02-T-007-S-00757,2023-03-02-T-007,757,Desmond Lee,"We fully recognise this. Having a home of their own will provide a stable environment for newly married couples to set up their families, and parents want to give their young children a conducive environment. These young married couples and parents also probably have shorter work experience, so they might not have sufficient savings to afford other housing options at the time."
2023-03-02-T-007-S-00758,2023-03-02-T-007,758,Desmond Lee,"So, we will introduce a new category  First-Timer (Parents and Married Couples), who will enjoy enhanced support when they apply for a new HDB flat."
2023-03-02-T-007-S-00759,2023-03-02-T-007,759,Desmond Lee,"Who will be in this group? First-timer families with children aged 18 and below, as well as young married couples aged 40 and below, who are embarking on their homeownership journey. They must also not have owned or sold any residential property before, nor had the chance to book a flat in the past five years."
2023-03-02-T-007-S-00760,2023-03-02-T-007,760,Desmond Lee,This is so that we can provide more targeted support for families who want to secure their first home quickly and settle down.
2023-03-02-T-007-S-00761,2023-03-02-T-007,761,Desmond Lee,"That said, HDB may exercise flexibility on a case-by-case basis, if there are extenuating circumstances. For example, I have met adult children who have added themselves as co-owners to their parents' flat so that they could help their parents cope with the mortgage to keep their homes. They tend to come from lower-income families. When they apply for a new flat and set up their own families, HDB may consider allowing them to qualify for this priority category."
2023-03-02-T-007-S-00762,2023-03-02-T-007,762,Desmond Lee,"In total, about 10% of all first-timer families will be considered first-timer parents and married couples for this sub-category."
2023-03-02-T-007-S-00763,2023-03-02-T-007,763,Desmond Lee,"Some Members – Mr Zhulkarnain, Mr Seah Kian Peng, Ms Foo Mee Har and others – have asked us how we will improve their chances of securing a flat. We will do so in three ways."
2023-03-02-T-007-S-00764,2023-03-02-T-007,764,Desmond Lee,"First, as Deputy Prime Minister Lawrence Wong had announced during his Budget speech, first-timer parents and married couples will get one additional ballot when they apply for a new HDB flat."
2023-03-02-T-007-S-00765,2023-03-02-T-007,765,Desmond Lee,"So, three ballots in total, up from the two that first-timers currently get, when they apply for any flat type in any estate – mature estates, non-mature estates or prime location housing."
2023-03-02-T-007-S-00766,2023-03-02-T-007,766,Desmond Lee,"Second, we will adjust an existing scheme – the Parenthood Priority Scheme – so that all First-Timer Parents and Married Couples also qualify for this scheme."
2023-03-02-T-007-S-00767,2023-03-02-T-007,767,Desmond Lee,"The current Parenthood Priority Scheme supports first-timer married couples who have children or who are expecting children. Under the scheme, up to 30% of the BTO flat supply and 50% of the supply of balance flats will be set aside for eligible applicants."
2023-03-02-T-007-S-00768,2023-03-02-T-007,768,Desmond Lee,We will now expand the scheme to cover First-Timer Parents and Married Couples too. That means that young married couples who do not yet have children can also qualify.
2023-03-02-T-007-S-00769,2023-03-02-T-007,769,Desmond Lee,"To reflect this expansion, we will rename it as the Family and Parenthood Priority Scheme."
2023-03-02-T-007-S-00770,2023-03-02-T-007,770,Desmond Lee,"And with more families qualifying, we will further increase the flat supply that we set aside for them – up to 40% of the BTO flat supply and 60% of the Sale of Balance Flats (SBF) flat supply, in all launches in mature estates, non-mature estates and prime location housing."
2023-03-02-T-007-S-00771,2023-03-02-T-007,771,Desmond Lee,"Third, for BTO launches in non-mature estates, we will give First-Timer Parents and Married Couples first priority under the Family and Parenthood Priority Scheme if they apply for a 4-room or smaller flat."
2023-03-02-T-007-S-00772,2023-03-02-T-007,772,Desmond Lee,"This means that they will be shortlisted ahead of all other applicants who are eligible for the Family and Parenthood Priority Scheme, and stand a higher chance of being invited to select a flat."
2023-03-02-T-007-S-00773,2023-03-02-T-007,773,Desmond Lee,"Take a young couple, say 26 or 27 years old, who have just ROM-ed (Registry of Marriages) recently. They will be considered a first-timer in this enhanced sub-category when they apply for a flat later this year. Let us say they are considering a 4-room BTO flat in Yishun or Tampines to live near either set of parents."
2023-03-02-T-007-S-00774,2023-03-02-T-007,774,Desmond Lee,"Regardless which one they choose, they will get three ballot chances from the get-go. They will also qualify for the Family and Parenthood Priority Scheme and the Married Child Priority Scheme, which set aside flats for eligible applicants."
2023-03-02-T-007-S-00775,2023-03-02-T-007,775,Desmond Lee,"And if they choose a 4-room flat in Yishun, which is a non-mature estate, they will be among the first to be shortlisted, across all eligible applicants for the Family and Parenthood Priority Scheme. So, their chances of being invited to select a flat will be substantially higher."
2023-03-02-T-007-S-00776,2023-03-02-T-007,776,Desmond Lee,"So far, we have observed that virtually all first-timer families have been invited to select a flat within three tries, when they apply for a BTO flat in non-mature estates."
2023-03-02-T-007-S-00777,2023-03-02-T-007,777,Desmond Lee,"With these new changes, first-timer parents and married couples should be able to select a flat within fewer attempts, especially if they apply for a 4-room or smaller BTO flat in non-mature estates where demand tends to be more moderate."
2023-03-02-T-007-S-00778,2023-03-02-T-007,778,Desmond Lee,"Some have asked if fiancé-fiancée couples can receive some extra help too. We understand that they also hope to settle down quickly, similar to young married couples and families with young children. But with the tight supply now, even as we are ramping up new supply, let us first help those who are already married or have children, but have yet to secure their first home."
2023-03-02-T-007-S-00779,2023-03-02-T-007,779,Desmond Lee,"As first-timers, fiancé-fiancée couples will still continue to receive two ballots when they apply for a new HDB flat. They will also continue to benefit from the large majority of flats that are set aside for first-timers. When they get married or ROM, they will similarly receive extra support to help them secure a flat more quickly."
2023-03-02-T-007-S-00780,2023-03-02-T-007,780,Desmond Lee,"Sir, even as we give more help to first-timer parents and married couples, we also need to enhance the efficiency of our system, so that flats go to those who need them, as quickly as possible."
2023-03-02-T-007-S-00781,2023-03-02-T-007,781,Desmond Lee,"Currently, 40% of BTO flat applicants who are invited to select a flat decide not to take up the offer."
2023-03-02-T-007-S-00782,2023-03-02-T-007,782,Desmond Lee,"When I shared this during our Forward Singapore Housing Conversations, participants were surprised. It seemed at odds with what they had heard about strong housing demand. They thought that some applicants might be trying their luck, hoping for a good ballot number, for an attractive location. My HDB colleagues have also shared that some applicants may be rather selective, wanting only flats, say, on higher floors."
2023-03-02-T-007-S-00783,2023-03-02-T-007,783,Desmond Lee,"There is probably a range of reasons. For some, the remaining flats may be out of budget. For others, they might be considering other housing options, or prefer flats with specific attributes for specific reasons. Understandably, some would rather give up the opportunity to select a flat now and wait longer for a better flat. But whatever the reason, such applicants do crowd out other home buyers who may have more pressing needs."
2023-03-02-T-007-S-00784,2023-03-02-T-007,784,Desmond Lee,"This is why we encourage applicants to apply for flats only if they really intend to purchase one because there are other homebuyers who want to buy those flats. To reinforce this, our current practice is to issue what we term a ""non-selection count"", when applicants are invited to book a flat but do not take up the offer."
2023-03-02-T-007-S-00785,2023-03-02-T-007,785,Desmond Lee,"After receiving two non-selection counts, first-timers will be considered second-timers for one year when they ballot for a flat. They can still apply for a new HDB flat, but the flat allocation quota for second-timers is lower. As for second-timers who chalk up two non-selection counts, they will not be allowed to participate in HDB sales exercises for a year."
2023-03-02-T-007-S-00786,2023-03-02-T-007,786,Desmond Lee,"I have heard various suggestions during our Forward Singapore Housing Conversations to bring down the non-selection rate further. Some suggested removing privileges for two years. Some suggested raising the BTO application rate from $10 as it is today to $1,000 or more or imposing a financial penalty if applicants do not select a flat and do not have a good reason."
2023-03-02-T-007-S-00787,2023-03-02-T-007,787,Desmond Lee,"After careful consideration, we have decided for now to tighten the rules for non-selection. We will consider first-timers as second-timers for a year when they ballot for a flat, after they receive one non-selection count, down from the two counts today. Similarly, second-timers will not be allowed to participate in HDB sales exercises for one year, after they receive one non-selection count. So, this is more stringent than what we have in place today."
2023-03-02-T-007-S-00788,2023-03-02-T-007,788,Desmond Lee,"But, at the same time, we understand that some applicants may have genuine reasons for not selecting a home. So, we want to strike a right balance, because buying a home is a large financial decision. We want to be fair to applicants who have very limited options, when they are invited to select their flat. Therefore, HDB will not issue a non-selection count if BTO flat applicants have 10 or fewer flats left to choose from. For Sale of Balanced Flat (SBF) exercises, where the flat supply is much smaller to begin with, we will use a lower threshold of five flats."
2023-03-02-T-007-S-00789,2023-03-02-T-007,789,Desmond Lee,"Some applicants may also turn down the offer to select a flat because their circumstances have changed unexpectedly since they applied for the flat. Where there are extenuating circumstances, HDB may exercise flexibility to waive the non-selection count, not issue it in the first place."
2023-03-02-T-007-S-00790,2023-03-02-T-007,790,Desmond Lee,The moves that I have just announced will take effect from this year's August BTO exercise. We are announcing them early to give everyone some time to understand how these changes may affect them. And HDB will also need some time to stress-test and implement the system changes needed for all these moves.
2023-03-02-T-007-S-00791,2023-03-02-T-007,791,Desmond Lee,Let me now move on to our support for first-timers in the resale market.
2023-03-02-T-007-S-00792,2023-03-02-T-007,792,Desmond Lee,"As Deputy Prime Minister Wong has announced recently during his Budget speech, we have increased the CPF Housing Grant for first-timer families, to enhance housing affordability in the resale market. Some first-timers prefer resale flats because they want to live near their parents or start raising families sooner."
2023-03-02-T-007-S-00793,2023-03-02-T-007,793,Desmond Lee,"So, we have increased the CPF Housing Grant by $30,000 for those who purchase a 4-room or smaller resale flat, and by $10,000 for those who purchase a 5-room or larger resale flat. Altogether, eligible first-timer families can now receive up to $190,000 when they buy a resale flat."
2023-03-02-T-007-S-00794,2023-03-02-T-007,794,Desmond Lee,"To make it easier for buyers who had not completed their resale transaction before this announcement was made, we have extended the enhanced grants to them, so that they would not have to cancel their application and re-apply to qualify for the increased grants. This is unlike grants that are applicable to new BTO flats, which are tied to the prevailing policy at the point of BTO sales launch."
2023-03-02-T-007-S-00795,2023-03-02-T-007,795,Desmond Lee,"This grant increase was helpful to Mr Zulkhairi, a warehouse logistics trainer and his family of three. They recently bought a 3-room resale flat and will receive a total of $130,000 in housing grants. Mr Zulkhairi shared with us that this will help to lower the monthly mortgage repayments for him and his family."
2023-03-02-T-007-S-00796,2023-03-02-T-007,796,Desmond Lee,"Some Members, such as Mr Xie Yao Quan, Assoc Prof Jamus Lim, Ms Hazel Poa, Ms Mariam Jaafar and others, voiced concern that this grant may increase resale prices even further. As Deputy Prime Minister Wong had explained during Budget debate, this was a move that we considered very carefully. We are aware that whenever we increase grants, especially in a buoyant resale environment, there is always this risk. We decided to move on this, given the current context."
2023-03-02-T-007-S-00797,2023-03-02-T-007,797,Desmond Lee,"First, as I mentioned earlier, we have significantly ramped up supply of new BTO flats to meet strong housing demand."
2023-03-02-T-007-S-00798,2023-03-02-T-007,798,Desmond Lee,"Second, to manage demand and encourage financial prudence, we had introduced two rounds of property cooling measures, which are working their way through the market."
2023-03-02-T-007-S-00799,2023-03-02-T-007,799,Desmond Lee,"Third, the outlook for the broader economic environment remains extremely uncertain. The global economy may experience a shallow downturn this year, some analysts say. Mortgage interest rates have increased and could rise further in the coming months from already elevated levels. Some households will be stretched."
2023-03-02-T-007-S-00800,2023-03-02-T-007,800,Desmond Lee,"With these in mind, we made a considered decision to increase the CPF Housing Grant and give targeted support to eligible first-timers, who made up about one-third of all resale flat buyers in the past two years. It does not apply universally to the entire resale market, but only a very specific group. In this economic climate, buyers are growing increasingly price sensitive, so sellers who raise their asking prices run the risk of pricing themselves out of the market."
2023-03-02-T-007-S-00801,2023-03-02-T-007,801,Desmond Lee,We hope these moves give first-timers greater assurance about buying their first homes and you can count on our support to set up and raise strong families.
2023-03-02-T-007-S-00802,2023-03-02-T-007,802,Desmond Lee,"Next, let me share what we are doing to help singles. Many Members, both present and past spoke about this, like Miss Cheryl Chan, Ms Carrie Tan, Mr Louis Chua, Mr Xie Yao Quan, Ms Heng Ting Ru, Ms Joan Pereira, Miss Rachel Ong and many others."
2023-03-02-T-007-S-00803,2023-03-02-T-007,803,Desmond Lee,"While we support families strongly, we recognise that society continues to change. More Singaporeans want to live apart from their parents before settling down. There are also singles who help to take care of their ageing parents but hope to have a place of their own. Others are caregivers of older parents and want to have their own space."
2023-03-02-T-007-S-00804,2023-03-02-T-007,804,Desmond Lee,Their housing aspirations and needs are important too. And we have been making changes to better support them over the years.
2023-03-02-T-007-S-00805,2023-03-02-T-007,805,Desmond Lee,"We first introduced the Single Singapore Citizen Scheme in 1991, when singles could purchase HDB resale flats. From 2013, singles could also apply for a new 2-room Flexi flat. Then, in 2018, we increased the Proximity Housing Grant for singles who wanted to buy a resale flat to live with their parents. We also extended it to singles who wanted to buy a resale flat of their own, but remain near their parents, instead of living with their parents, often for caregiving reasons. In August last year, we increased the allocation quota for singles buying 2-room Flexi flats from 50% to 65%, to improve their chances of securing a home."
2023-03-02-T-007-S-00806,2023-03-02-T-007,806,Desmond Lee,"Eligible first-timer singles can also enjoy the recently increased CPF Housing Grant announced during Budget. We have increased it from $25,000 to $40,000 for singles buying 2- to 4-room resale flats and from $20,000 to $25,000 for 5-room resale flats."
2023-03-02-T-007-S-00807,2023-03-02-T-007,807,Desmond Lee,"We are glad to know that this provides more help to singles, like Ms Cheryll Yeo, to purchase flats of their own. Ms Yeo recently bought a 3-room resale flat in Serangoon and will receive the increased CPF Housing Grant of $40,000. Her new home is near her parents' place in Hougang, so she will receive the $10,000 Proximity Housing Grant too."
2023-03-02-T-007-S-00808,2023-03-02-T-007,808,Desmond Lee,"During our Forward Singapore Housing Conversations, many singles, young and older, shared their challenges, perspectives and suggestions with us. We are closely studying what they have told us, to see how else we can support their housing aspirations, including through co-living models or other types of housing arrangements as Ms Carrie Tan and Mr Xie Yao Quan have suggested."
2023-03-02-T-007-S-00809,2023-03-02-T-007,809,Desmond Lee,"Let me now speak about our housing support for seniors, whom several Members have touched on."
2023-03-02-T-007-S-00810,2023-03-02-T-007,810,Desmond Lee,"Many of our seniors are homeowners. Over the years, we have introduced various upgrading programmes to help them age-in-place."
2023-03-02-T-007-S-00811,2023-03-02-T-007,811,Desmond Lee,"To go a step further, MND, MOH and HDB have jointly developed a new housing type, the Community Care Apartment, or CCA. This is a fairly new housing-plus-care option for seniors. We have launched two pilots, at Bukit Batok and at Queenstown, which were well-subscribed. We also received valuable feedback from seniors, who were keen to apply and who wanted us to build more."
2023-03-02-T-007-S-00812,2023-03-02-T-007,812,Desmond Lee,"So, I am happy to announce that we will launch a third Community Care Apartment project in Bedok later this year, for our seniors."
2023-03-02-T-007-S-00813,2023-03-02-T-007,813,Desmond Lee,"Given the positive response so far, we are developing a pipeline of Community Care Apartments in different locations across Singapore. We are working out the details and will share more later this year. We will also continue to refine the Community Care Apartment model as we gain experience, especially after our first residents move in next year. My colleague, Minister of State Faishal Ibrahim will elaborate more on our efforts to help seniors age-in-place later."
2023-03-02-T-007-S-00814,2023-03-02-T-007,814,Desmond Lee,"Finally, let me touch on how we will better assist lower-income families with housing options."
2023-03-02-T-007-S-00815,2023-03-02-T-007,815,Desmond Lee,"About 85% of our low-income households in Singapore own their homes. We achieve this high rate of ownership by pricing our flats so that lower-income households can afford them too. We also adopt a progressive approach, with more housing grants to support those with lower incomes."
2023-03-02-T-007-S-00816,2023-03-02-T-007,816,Desmond Lee,"For example, in the ongoing BTO exercise, the typical selling price for a 3-room flat in Jurong West Crystal is $220,000. A household with a monthly income of $2,500 can receive $70,000 in housing grants, which will further reduce the price of the flat to $150,000. This household will need to use about 19% of their monthly income to pay for their mortgage instalments, which means that they can service their mortgage fully using their monthly CPF contributions, with zero cash outlay."
2023-03-02-T-007-S-00817,2023-03-02-T-007,817,Desmond Lee,"For those who are not yet ready for home ownership, we provide highly subsidised rental flats as a social safety net. We recognise that some of these households may face other complex, interlocking challenges. So, we pair rental housing with social support, to make sure that tenants receive the support that they need to achieve stability, self-reliance and social mobility."
2023-03-02-T-007-S-00818,2023-03-02-T-007,818,Desmond Lee,"Many Members have asked about our efforts to support and uplift our rental tenants, and Minister of State Faishal will share more later."
2023-03-02-T-007-S-00819,2023-03-02-T-007,819,Desmond Lee,"As I have said before, our public housing system is not perfect. We must learn from our experiences, continually improve and enhance our system for Singaporeans, and I thank Members for their thoughtful suggestions. For example, we used to have the Registration for Flats System, or RFS. This was basically a queue system – HDB built flats based on the number of applicants in the queue and flats were allocated on a first-come, first-served basis."
2023-03-02-T-007-S-00820,2023-03-02-T-007,820,Desmond Lee,"At the height of the property boom in the mid-1990s, there were as many as 150,000 flat buyers in the queue, and the wait for a flat could be as long as seven years. But when the Asian Financial Crisis hit in 1997, housing demand plummeted. The queue disappeared, leaving HDB with 31,000 unsold flats which took many years to sell. It had a very serious impact on the value of existing homes in the resale market, affecting existing home owners."
2023-03-02-T-007-S-00821,2023-03-02-T-007,821,Desmond Lee,"So, the challenges with the RFS were plain to see then. We acknowledge then that it could not cope with sharp and sudden shifts in demand. So, in 2002, we decided to replace it with the Build-To-Order (BTO) model, but we did not stop there. Over the years, we continued to refine our system. Today, we have a more comprehensive model, which is still developing, comprising of BTO flats, Shorter Waiting Time flats, Sale of Balance flats (SBF) and flats that are offered under open booking. This combination allows us to more dynamically adjust our building plans in response to demand."
2023-03-02-T-007-S-00822,2023-03-02-T-007,822,Desmond Lee,"If demand surges, including suddenly like now during a crisis, we ramp up our main BTO pipeline and tap on our Shorter Waiting Time flat pipeline to meet immediate needs. And with a greater number of Shorter Waiting Time flats in future, this will be a more effective buffer."
2023-03-02-T-007-S-00823,2023-03-02-T-007,823,Desmond Lee,"If demand falls, we can scale back the BTO pipeline responsively and allow homebuyers to book unselected flats from earlier launches through SBF or through open booking exercises, to minimise the potential for oversupply."
2023-03-02-T-007-S-00824,2023-03-02-T-007,824,Desmond Lee,"We have also fine-tuned our current system with priority schemes and ballot chances, so that we can provide additional support to specific groups of buyers, like the First-Timer Parents and Married Couples we talked about earlier. In comparison, the allocation of flats under RFS was much more basic."
2023-03-02-T-007-S-00825,2023-03-02-T-007,825,Desmond Lee,"The current system may not always work perfectly, and we will continue to adjust and calibrate along the way. But it does seek to strike a reasonable balance across multiple objectives – fairness and efficiency in allocating flats, fiscal prudence and responsiveness to demand. Compared to its predecessors, the pure BTO model and the RFS model, I think it is a clear improvement."
2023-03-02-T-007-S-00826,2023-03-02-T-007,826,Desmond Lee,"Now, on the affordability of flats and fiscal sustainability. Let me assure Members once again that we aim to strike a good balance between the two. We set prices for BTO flats with affordability in mind. When incomes and prices go up together, flats will remain affordable and we may not need to increase market discounts or subsidies so much."
2023-03-02-T-007-S-00827,2023-03-02-T-007,827,Desmond Lee,"We also keep our market discounts and subsidies targeted for first-timers as well as households with lower incomes. And we are open to new approaches, like the Prime Location Public Housing Model, which we put in place after lots of engagement, which prevents flat buyers from benefiting from higher market discounts which later translate into excessive windfall gains."
