speech_id,topic_id,speech_order,member_name,text
2023-04-17-T-001-S-00134,2023-04-17-T-001,134,Jamus Jerome Lim,"This may seem especially unfair, since the less well-off were often our essential workers and had to continue on in the frontlines, even as the rest of us sheltered comfortably at home. Unfortunately, the poor did not find much relief after the pandemic. Inflation hit hard, reaching peaks of 7.5% in August and September last year. While this has come down, inflation, in excess of 6%, continues to eat away at incomes."
2023-04-17-T-001-S-00135,2023-04-17-T-001,135,Jamus Jerome Lim,"A more recent survey by DBS found that wage increases have failed to keep up with inflation and for the lowest income group, expenses have grown close to five-and-a-half times faster than their salaries. Even by the Government's own statistics, household real wages decreased in 2020 and 2021, and the small increase last year does not fully make up for the losses."
2023-04-17-T-001-S-00136,2023-04-17-T-001,136,Jamus Jerome Lim,"In contrast, there are those of us who have been lucky enough to have sufficient savings to invest and, in some cases, have been able to tap on higher interest rates offered by the market to shore up our finances. But such discrepancies only serve to further exacerbate the discrepancy between the wealthy and the rest."
2023-04-17-T-001-S-00137,2023-04-17-T-001,137,Jamus Jerome Lim,"Researchers who have devoted their lives to studying poverty tend to believe that its causes may be broadly defined into two groups. The first argues that low incomes constrain the ability of the poor to save, eat well and pursue educational opportunities. Since poverty causes poverty, the solution is to offer one-off transfers that help the poor extricate themselves from their plight. A second group believes that the poor are limited by their God-given abilities, talents or motivation, and they will always be among us and the solution is to provide small, but repeated, income support."
2023-04-17-T-001-S-00138,2023-04-17-T-001,138,Jamus Jerome Lim,"I believe that there is merit to both these perspectives on poverty. Inasmuch as we want to offer opportunities for those of us to escape the poverty trap, the basis of most of the Government's anti-poverty policies, there are those that happen to be endowed with less potential, stricken by physical or mental disability, or who face persistent discrimination, and hence, require the support of society-at-large. And in a rich, advanced economy, I believe that doing so is the correct and compassionate thing to do."
2023-04-17-T-001-S-00139,2023-04-17-T-001,139,Jamus Jerome Lim,"Regardless of which school of thought one subscribes to, the fact remains that if we are to help the poor, we must know who they are. But in Singapore, we have yet to establish an official poverty line. This is both puzzling and exasperating. We take pride in ourselves as people who are quantitatively sophisticated and highly efficient; we make and meet KPIs. Targeting the poor is impossible, or at least, imperfect, without an official, transparent benchmark."
2023-04-17-T-001-S-00140,2023-04-17-T-001,140,Jamus Jerome Lim,"We have, instead, a confusing mishmash of thresholds that have been applied by different agencies at different times. We sometimes see reports for the lowest quartile, or quintile, being treated as the poor, or simply the halving of median household incomes. The HDB income threshold for rental happens to be $1,500, while the ComCare threshold is closer to $1,900. The Department of Statistics instead pegs the Average Household Expenditure on Basic Needs at $1,250, albeit this low figure was from two surveys ago and the calculation does not seem to have been updated."
2023-04-17-T-001-S-00141,2023-04-17-T-001,141,Jamus Jerome Lim,"Other unofficial lines, based on ensuring social inclusion or allowing for relative, not just absolute, poverty would suggest higher amounts. These range from $2,500, to as much as $6,400. One may quibble with these numbers and this Government has certainly done so, by arguing that the high-end estimates overstate what are needs versus wants in the household."
2023-04-17-T-001-S-00142,2023-04-17-T-001,142,Jamus Jerome Lim,"A poverty line is defined as the lowest income level that would be deemed adequate in a given country. This leaves a tremendous amount of latitude in terms of what is ""adequate"". What may be regarded as an absolute minimum necessary to purchase goods and services for basic needs in a poor country may be shockingly low, when set against expectations of needs in a rich country. Indeed, there is clear evidence that as countries get richer, the value of what is conventionally regarded as a basic need changes."
2023-04-17-T-001-S-00143,2023-04-17-T-001,143,Jamus Jerome Lim,"And the fact is, we are no longer a developing country. The sort of things that we need to be as a full participant in Singaporean society has changed. Smartphones may seem like an unnecessary perk to some, but without one, many basic Government services become increasingly difficult to access. A holiday may strike others as a luxury, but for large families cooped up in tiny apartments, a brief getaway to Malaysia offers an important respite that can ensure the mental health of parents."
2023-04-17-T-001-S-00144,2023-04-17-T-001,144,Jamus Jerome Lim,"And money spent on ""ang pows"" and gifts and celebrations are not just frivolous spending; they represent rites of passage and acts of reciprocity that speak to a moral economy and societal norm, which cannot be reduced to dollars and cents."
2023-04-17-T-001-S-00145,2023-04-17-T-001,145,Jamus Jerome Lim,"It is, in my view, an insult to suggest to a family that the supplemental tuition that their struggling kids need to stay afloat in our overcrowded classrooms is not sufficiently ""basic."" Or that spending on deodorant in our hot and humid climate, particularly before an interview or a big date, is truly ""discretionary""."
2023-04-17-T-001-S-00146,2023-04-17-T-001,146,Jamus Jerome Lim,"Part of the problem is a disconnect between what this Government has claimed to be basic, versus what Singaporeans themselves perceive as necessary for human flourishing. But if we can all agree that a good life includes opportunities to education and decent healthcare, employment with work-life balance and a sense of inclusion when one participates in social, cultural and religious activities, then why do we not extend these to the most economically vulnerable in our midst? Life is not just about making it day-to-day, but about thriving, as all humans, poor or not, have aspirations."
2023-04-17-T-001-S-00147,2023-04-17-T-001,147,Jamus Jerome Lim,"It is time for an official poverty line. This line should be established based on components that go beyond just the crude, ""basic"" needs of housing, food and clothing. Set up a committee, with representatives, from not just MSF, but also leaders from civil society and experts from academia, to figure out what this should be. Then, peg all thresholds for Government assistance, especially ComCare, to this line or higher, but never lower. The Local Qualifying Salary, effectively our minimum wage for Singaporeans should likewise be tied to this line."
2023-04-17-T-001-S-00148,2023-04-17-T-001,148,Jamus Jerome Lim,"Even after we have established a new threshold for ComCare, we need to recognise that the system can stand to be refined. At this year's COS debate, I suggested that the ComCare approval process can be intrusive, onerous and demeaning. While I agree with the general principle of being responsible with public monies, we should not become overzealous in the opposite direction."
2023-04-17-T-001-S-00149,2023-04-17-T-001,149,Jamus Jerome Lim,"It is tempting to design a public welfare system that attempts to sieve out only those that we deem ""worthy"" of support. So-called ""welfare kings or queens"" should be excluded as such individuals undeniably exist. We may even have some ""regulars"" in our Meet-the-People Sessions, but they are few and far between."
2023-04-17-T-001-S-00150,2023-04-17-T-001,150,Jamus Jerome Lim,"Most of my residents possess a lot of self respect and feel uncomfortable seeking help from the state, even when they are going through a tough situation not of their own making. A system that is stingy about financial assistance to the eight or nine folks that just want a little bit of support in a particularly trying time, just to deny the one or two abusers, strikes me as excessive and especially since all that effort translates only to a modest payout."
2023-04-17-T-001-S-00151,2023-04-17-T-001,151,Jamus Jerome Lim,"Furthermore, support is often granted for an unbearably short time – three to six months in the first instance. With precious few exceptions, how can someone's lot improve in just three months? Even when we make appeals and reappeals to agencies, such as the Immigration and Checkpoints Authority (ICA), we are often told that we should wait for six months before trying again, since life circumstances are unlikely to change much in the interim. And even if they did, providing some additional months of support would help those who are in need partially fill up the hole that they find themselves in."
2023-04-17-T-001-S-00152,2023-04-17-T-001,152,Jamus Jerome Lim,"As my hon friend Mr Leon Perera has argued in this House, poverty imposes a non-trivial ""bandwidth tax""  the cognitive burden of poverty, in and of itself. Being in dire financial straits not only imposes mental stress as one searches for job opportunities; it can affect our handling of all-important job interviews, or our performance in a job during the probation period. It steals mental resources that are better spent on improving our situation or providing care for our dependants. It even reduces the little pleasure we receive from what we are able to consume."
2023-04-17-T-001-S-00153,2023-04-17-T-001,153,Jamus Jerome Lim,"Think back on the last time when you had a tight budget before your next paycheck came in and how you had to worry about whether you could make the rent or the mortgage, pay for your meals next week or clear bills that would keep the lights on. Play out that exercise every single day and week, and you will sense what it is like to be poor. Layer on that, the need to ""prove"" that you are indeed poor every few months to a Social Service Office (SSO) officer, who has the power to snatch away the fragile lifeline that you have."
2023-04-17-T-001-S-00154,2023-04-17-T-001,154,Jamus Jerome Lim,"We can reduce the need for such burdensome and intrusive pre-approval scrutiny by obtaining many documents directly from our public and semi-public agencies, such as rental or utilities. We can deploy conditional cash transfers (CCTs) in exchange for desired behaviour, such as supplementary educational expenses or preventative healthcare spending, and use the fulfilment of the condition as sufficient evidence to qualify for support."
2023-04-17-T-001-S-00155,2023-04-17-T-001,155,Jamus Jerome Lim,"We could set the default that automatically qualifies all Singaporeans in rental flats for an extended period in the Fresh Start home ownership programme, as recently suggested by a local social sector leader."
2023-04-17-T-001-S-00156,2023-04-17-T-001,156,Jamus Jerome Lim,"The Government might argue that beyond ComCare, there is the Workfare Income Supplement (WIS), our other key anti-poverty programme, that is also aligned with incentives. But, as I suggested before, not everyone who is poor is able to work and even when they can, circumstances might constrain how much they can."
2023-04-17-T-001-S-00157,2023-04-17-T-001,157,Jamus Jerome Lim,"The WIS is based on an earned income tax credit (EITC) which, in turn, is a refinement of the negative income tax. Without going into technical details, it is sufficient to note that our scheme tends to be viewed more as a grudgingly offered financial supplement, conditional on one putting in sufficient work hours, rather than a genuine anti-poverty tool aimed at helping provide additional support to our low-income earners."
2023-04-17-T-001-S-00158,2023-04-17-T-001,158,Jamus Jerome Lim,"This is in part because the amounts offered by the WIS are paltry, majority of which is not even accessible for meeting daily needs, since most of it goes straight to the Central Provident Fund (CPF). Even with the most recent revision, topped-up amounts come to $350 a month at best, and can be as little as half that."
2023-04-17-T-001-S-00159,2023-04-17-T-001,159,Jamus Jerome Lim,"While any additional help is undoubtedly welcome, I have had many residents share that the support hardly makes a dent in high cost Singapore. This is exacerbated by our low-income thresholds – $3,000 a year – before one is disqualified. In contrast, the maximum income for the US programme is closer to twice that."
2023-04-17-T-001-S-00160,2023-04-17-T-001,160,Jamus Jerome Lim,"The $500 minimum monthly income requirement introduced last year may also inadvertently exclude workers who are most in need of the flexibility afforded by our part-time employment. While the ostensible reason for the requirement is to exclude some of the more well-off families from benefiting from the programme, it seems like the more tried and tested tool – total household or spousal income or the annual value (AV) of one's residential property – would be sufficient to rule out the non-poor."
2023-04-17-T-001-S-00161,2023-04-17-T-001,161,Jamus Jerome Lim,"Indeed, while we are reassured that those who are already on ComCare would automatically receive Workfare, I am sure that we are aware of many poor families, who for various reasons, are not on ComCare – perhaps because of the onerous documentary criteria I mentioned earlier or if they happen to have an estranged child who is also a high-income earner."
2023-04-17-T-001-S-00162,2023-04-17-T-001,162,Jamus Jerome Lim,"Were these individuals to work only limited hours, perhaps due to health or age, the limited additional support Workfare promises would nevertheless not be available to them."
2023-04-17-T-001-S-00163,2023-04-17-T-001,163,Jamus Jerome Lim,"Workfare also seems to be blind to the differential needs of parents with children. The WIS, to put it bluntly, is independent of dependants. This is in contrast to the approach in other jurisdictions where support is significantly higher if the household has one or more children. This approach makes absolute sense, since parents not only have more dependants to support, they also need to make arrangements for childcare were they to enter into the workforce formally."
2023-04-17-T-001-S-00164,2023-04-17-T-001,164,Jamus Jerome Lim,"Finally, Sir, it is worth pointing out that there are age conditions associated with the WIS, where those who are younger receive less support than the elderly. But this is curious. Why would the youthful poor necessarily need less money than the elderly?"
2023-04-17-T-001-S-00165,2023-04-17-T-001,165,Jamus Jerome Lim,This becomes more odd when —
2023-04-17-T-001-S-00166,2023-04-17-T-001,166,Speaker,"Mr Lim, you have half a minute left."
2023-04-17-T-001-S-00167,2023-04-17-T-001,167,Jamus Jerome Lim,— how Silver Support is available only to those aged 65 and above.
2023-04-17-T-001-S-00168,2023-04-17-T-001,168,Jamus Jerome Lim,"Mr Speaker, we have been remarkably recalcitrant in our willingness to support our poor. We can do more, much more – if we want to truly call ourselves a first-world nation. Indeed, we surely must."
2023-04-17-T-001-S-00169,2023-04-17-T-001,169,Speaker,Mr Vikram Nair.
2023-04-17-T-001-S-00170,2023-04-17-T-001,170,Vikram Nair,"Mr Speaker, Singapore’s Independence was a product of the post-war decolonialisation wave, that started in the late 1940s with the independence of India. That was also the period that saw the birth of the United Nations (UN), the International Monetary Fund (IMF), the World Bank (WB) and, in later years, the World Trade Organization (WTO)."
2023-04-17-T-001-S-00171,2023-04-17-T-001,171,Vikram Nair,These organisations formed the backbone of the modern multilateral world we live in. Common values recognised in international law included the recognition of the sovereignty of nations and the prohibition against the use of force except in self defence.
2023-04-17-T-001-S-00172,2023-04-17-T-001,172,Vikram Nair,"With the General Agreement on Tariffs and Trade (GATT) and the WTO, trade among nations grew and the world became more interconnected. This was a backdrop that was conducive to Singapore’s growth as a small nation since the rule of law is especially important for protecting the small and the vulnerable."
2023-04-17-T-001-S-00173,2023-04-17-T-001,173,Vikram Nair,"The last few years have seen an unprecedented retreat from multilateralism. Russia’s attack on Ukraine was a breach of the UN Charter and the prohibition against the use of force. However, Russia, through its predecessor state, the USSR, is also a charter member of the UN with a veto in the security council. The breach of the UN Charter by a charter member is worrying for the rule of law and it is important for the rest of the world to take a firm stand on this if we intend to maintain the rule of law."
2023-04-17-T-001-S-00174,2023-04-17-T-001,174,Vikram Nair,"Two of the biggest beneficiaries of the liberalisation of trade following GATT and the WTO are the US and China. They are now the two biggest economies in the world. Yet, the rivalry between the two is now threatening the system on which both prospered. Other countries are also taking their cue from the superpowers, and we see increasing calls for protectionism from different countries. In the long run, this is likely to create more silos and a divided world."
2023-04-17-T-001-S-00175,2023-04-17-T-001,175,Vikram Nair,"The multilateral system is not dead, but I think it is important for those that believe in its importance to continue to speak up for it and help bring in those who are sceptical. The source of the scepticism is that free trade has sometimes exaggerated the differences between the rich and the poor in different countries. As jobs and roles move to different countries, there will inevitably be winners and losers at home. For those who believe in multilateralism, I think it is important for us to acknowledge some of these side effects and then have domestic policies that correct for this."
2023-04-17-T-001-S-00176,2023-04-17-T-001,176,Vikram Nair,"I think the multilateral system has benefits for everyone, not least of which is greater security. And in this testing time, we need to win back as many of the sceptics as we can."
2023-04-17-T-001-S-00177,2023-04-17-T-001,177,Vikram Nair,"Singapore itself has not been immune to some of these effects and this leads me to the second area I wish to address in my speech. The President’s Address acknowledged the importance of Singapore continuing to grow, but that these opportunities must be shared equitably."
2023-04-17-T-001-S-00178,2023-04-17-T-001,178,Vikram Nair,I believe this is fundamental to preserving our society where everyone has opportunities.
2023-04-17-T-001-S-00179,2023-04-17-T-001,179,Vikram Nair,"Singapore’s growth over the years has been remarkable and, as we moved from third world to first, the living standards of almost all our people improved dramatically. However, now that we are a developed country and our GDP per capita is among the highest in the world, continuing to be a growing high-income country is more difficult. We need to find better, higher-paying jobs for our citizens."
2023-04-17-T-001-S-00180,2023-04-17-T-001,180,Vikram Nair,"At the same time, with higher incomes all round, the cost of living is generally higher as higher incomes for citizens translates into higher costs for wages for businesses and higher rentals as people pay more and compete for the real estate. Additionally, global inflationary pressures and higher interest rates also add to pressures in the cost of living for Singaporeans."
2023-04-17-T-001-S-00181,2023-04-17-T-001,181,Vikram Nair,"Against this backdrop, I think the measures in the President’s Address to ensure that Singaporeans continue to have opportunities to train and get employment throughout their working lives is vital. I would also suggest that this be coupled with income support while people undergo training. This should be enough to tide them over temporary rough patches."
2023-04-17-T-001-S-00182,2023-04-17-T-001,182,Vikram Nair,"Going to an earlier stage, I think it is important for our schools to remain the great leveller for education. In the past, children would attend school and learn things like the alphabet from there. I recall entering Primary 1 without any knowledge of how to read or write Tamil, but it was still possible to learn from scratch."
2023-04-17-T-001-S-00183,2023-04-17-T-001,183,Vikram Nair,"Now, with most children having preschool education, the entry benchmark has risen and basic literacy and numeracy is required for children attending Primary 1, failing which, more may fall behind. This means those who miss preschool, who are predominantly from lower-income families, will start off on the back foot. It is therefore even more important to ensure that preschool is attended by all children and either make this compulsory or have strong measures in place to encourage universal attendance."
2023-04-17-T-001-S-00184,2023-04-17-T-001,184,Vikram Nair,"The next matter, which I think has been alluded to by some of the earlier speakers, is the proliferation of tuition, even after children attend school. Parents across all income groups try their best to supplement what their children learn in school with tuition. In HDB heartland malls, an increasingly larger footprint is being used for such services."
2023-04-17-T-001-S-00185,2023-04-17-T-001,185,Vikram Nair,"While such services are helpful for children, there is a concern by parents who cannot afford such services that their children may lose out. I have some parents who come to MPS to seek assistance when they are going through a rough patch and they often indicate their children’s tuition expenses are part of their normal monthly expenditures. Of course, MSF rarely gives financial assistance to cope with such expenses."
2023-04-17-T-001-S-00186,2023-04-17-T-001,186,Vikram Nair,There are other self-help groups that come in to provide support for this but it will be good if we can develop a system that places less emphasis on tuition. Education in our schools is highly affordable and of a very high quality. It is important that parents believe such education is adequate for their children and that children who are unable to attend or afford tuition and enrichment classes do not get left behind. This is an important part of keeping our playing field open for children of all backgrounds to thrive.
2023-04-17-T-001-S-00187,2023-04-17-T-001,187,Vikram Nair,"(In Tamil)  [Please refer to  Vernacular Speech.] The reopening of Parliament this time coincides with the Tamil Language Festival. This year there are 42 events being organised by a range of different organisations. This event receives strong but quiet support from the Government, which through the Tamil Language Council, provides grants for the organisation of events at this festival."
2023-04-17-T-001-S-00188,2023-04-17-T-001,188,Vikram Nair,I am grateful to the Government for its strong support for the Tamil language in Singapore. The Tamil speaking community makes up around 5% of our population and it is one of Singapore’s official languages. The Government supports the language in many ways.
2023-04-17-T-001-S-00189,2023-04-17-T-001,189,Vikram Nair,The Tamil Language Council supports the Tamil Language Festival.
2023-04-17-T-001-S-00190,2023-04-17-T-001,190,Vikram Nair,"Another committee, the Tamil Language Learning and Promotion Committee, otherwise known as TLLPC – which I have chaired for several years – offers support for the learning of Tamil outside of classrooms. The TLLPC team organises events and supports activities throughout the year to make the use and learning of Tamil language fun."
2023-04-17-T-001-S-00191,2023-04-17-T-001,191,Vikram Nair,"Grants are also given for the production of local Tamil content by the Infocomm Media Development Authority (IMDA) under its Public Service Broadcast Programme and this allows for the creation of good quality local content, which is monitored by the Indian Programme Advisory Committee."
2023-04-17-T-001-S-00192,2023-04-17-T-001,192,Vikram Nair,This support is commendable and has helped the Tamil language remain a vibrant language in Singapore.
2023-04-17-T-001-S-00193,2023-04-17-T-001,193,Vikram Nair,"Tamil is now also widely offered across more schools. When I was in preschool in the 1980s, it would have been very difficult to find preschools offering Tamil as a second language. When my father was in primary school in the 1950s, he started studying Tamil in Primary 1, but had to drop it in Primary 3 when his teacher passed away and no replacement could be found. He then had to switch to the Malay language. We have come a long way from those days, with Tamil now available across many preschools and government schools."
2023-04-17-T-001-S-00194,2023-04-17-T-001,194,Vikram Nair,"One issue that has arisen now though is the shortage of Tamil teachers in schools. As the number of Tamil students are small, there are fewer Tamil teachers than for other Mother Tongue languages. However, even though the number of children is small, the Tamil children in schools still have a variety of different needs, including children across different age groups and with different subject-based banding."
