speech_id,topic_id,speech_order,member_name,text
2023-09-18-T-011-S-00419,2023-09-18-T-011,419,Murali Pillai,"There are several offences provided in the Immigration Act that are subject to caning, for which the upper limit under section 319 of the CPC applies. And to illustrate that, if you were to look at section 9 of the Act as it currently stands, which deals with an immigration offender who has already been issued with a Prohibition Order. If he were to come into Singapore again, then, he may face an imprisonment term of not less then two years or not more than five years, and shall also be liable to be fined and caned."
2023-09-18-T-011-S-00420,2023-09-18-T-011,420,Murali Pillai,"As was mentioned by the hon Minister, if he is not medically fit to take caning, then the Court can replace the caning sentence with an imprisonment term of not more than 12 months. But with the replacement of the caning with a fine sentence, by applying section 319, because the punishment is more than two years, the upper limit of the scale would apply; in which case the default imprisonment term can go up to two and a half years – which is more than the 12-month period for not receiving a caning sentence."
2023-09-18-T-011-S-00421,2023-09-18-T-011,421,Murali Pillai,"In my respectful view, a simple provision in the amendment Bill would have taken care of this – spelling out that a shorter imprisonment period, or the lower limit under section 319 of the CPC may be imposed in situations where fines, imposed in lieu of caning, are not paid."
2023-09-18-T-011-S-00422,2023-09-18-T-011,422,Murali Pillai,May I ask the hon Minister why is it not felt necessary to make this explicit in this amendment Bill?
2023-09-18-T-011-S-00423,2023-09-18-T-011,423,Murali Pillai,I now turn to the next area. I would term this as an issue of fairness in dealing with foreigners.
2023-09-18-T-011-S-00424,2023-09-18-T-011,424,Murali Pillai,"In explaining this provision, I note the hon Minister's point  entry into Singapore is really the prerogative of the government. I have no quarrel with that proposition."
2023-09-18-T-011-S-00425,2023-09-18-T-011,425,Murali Pillai,"In addition, it is proposed that current section 8(4A), which requires the Controller to inform a person the class of prohibited immigrants of which, in the opinion of the Controller, the person is a member of, be also repealed too."
2023-09-18-T-011-S-00426,2023-09-18-T-011,426,Murali Pillai,"For the benefit of hon Members, there are 15 classes in the Immigration Act, ranging from a person who is believed to have no means of supporting himself or herself, or believed to be a prostitute or believed to be a person who advocates the overthrow of the government by violence."
2023-09-18-T-011-S-00427,2023-09-18-T-011,427,Murali Pillai,"Also, under the proposed section 39B of the Act, it is provided that the Controller is not required to give any person, who may be affected by his decision, an opportunity to be heard. Respectfully, I am concerned about these proposals for the following reasons."
2023-09-18-T-011-S-00428,2023-09-18-T-011,428,Murali Pillai,"First, from a values perspective, I disagree with the view that just because we are dealing with foreigners who should not expect the right of entry or stay in Singapore, we should deal with them summarily."
2023-09-18-T-011-S-00429,2023-09-18-T-011,429,Murali Pillai,"In my respectful view, our immigration system should reflect the values we stand for as a nation. Granted, we do not owe non-Singaporeans the same duties and obligations we owe to ourselves. But foreigners should have the same recourse to justice, as a matter of principle, and in this case, we owe them two specific duties as members of a common humanity."
2023-09-18-T-011-S-00430,2023-09-18-T-011,430,Murali Pillai,"First, a duty to treat them fairly. To mandate that they need not be told why they are labelled as prohibited immigrants, nor offer them an avenue to provide explanation does not, in my respectful view, fulfil this duty."
2023-09-18-T-011-S-00431,2023-09-18-T-011,431,Murali Pillai,"Also, we must be mindful that a good number of foreigners who may be subject of action by the Controller have spousal or familial relations with Singaporeans. Such affected Singaporeans would certainly expect that the system operates fairly for their spouses or relatives in dealing with immigration matters."
2023-09-18-T-011-S-00432,2023-09-18-T-011,432,Murali Pillai,"As I said on point of fairness, sauce for the goose is sauce for the gander. I would imagine if the roles were reversed, Singaporeans who are immigrants in other countries would expect to be dealt with fairly by foreign immigration authorities too."
2023-09-18-T-011-S-00433,2023-09-18-T-011,433,Murali Pillai,"Second, a duty of due process. The current appeal process to the Minister ensures that there will be no single point of failure; from a system perspective."
2023-09-18-T-011-S-00434,2023-09-18-T-011,434,Murali Pillai,"We should be mindful it is proposed in this Bill that the Controller be vested with even more powers. As was explained by the hon Minister, one example is the No Boarding Directive to deny foreigners from boarding from places of embarkation, even as transit travellers."
2023-09-18-T-011-S-00435,2023-09-18-T-011,435,Murali Pillai,"Just by having an appeal process alone, we will ensure, system-wise, that the Controller will use his powers carefully and with circumspection. By having an appeal process, the Minister would be able to have access to all relevant facts of the case to make his own decision on the merits of the case. This is as opposed to a mere administrative review by the Minister on the basis that ICA comes under his charge. He is well capable of handling sensitive factors and information too."
2023-09-18-T-011-S-00436,2023-09-18-T-011,436,Murali Pillai,"In fact, this is the rationale for providing the statutory appeal to the Minister instead of to the Court which is ordinarily be accessible by members of public and the press."
2023-09-18-T-011-S-00437,2023-09-18-T-011,437,Murali Pillai,"Finally, I am not privy to any information that suggests that the current system is broken. I do appreciate that the Government must be pragmatic in dealing with immigration matters. However, unlike some countries which deal with immigration matters through the judicial system and have a backlog of cases to handle, I do not think a similar situation exists in Singapore. Hence, the question arises, if it ain’t broken, why fix it?"
2023-09-18-T-011-S-00438,2023-09-18-T-011,438,Murali Pillai,"I would also like to point out that, as a matter of comparative law, countries such as Malaysia and Brunei which have similar history and similar pieces of legislation as our Immigration Act, still retain the statutory appeal to the equivalent of our Minister. I would be grateful for the hon Minister’s explanation to my concerns."
2023-09-18-T-011-S-00439,2023-09-18-T-011,439,Murali Pillai,"Finally, I turn to my last area – operational matters. For this area, I wish to raise two points."
2023-09-18-T-011-S-00440,2023-09-18-T-011,440,Murali Pillai,"First, on the proposal to allow immigration officers to collect Advance Passenger Information (API), I would like to enquire if it is proposed that public transport operators such as the operator of the Rapid Transit System (RTS) Link that is due to be commissioned in about three years’ time or SBS Transit that operates service no 170 will have the obligation to collect API or would they be exempt?"
2023-09-18-T-011-S-00441,2023-09-18-T-011,441,Murali Pillai,"The provisions in the Bill, as they stand, are to be wide enough to include public transport operators. Should they apply, however, this may create practical problems and bottlenecks having regard to the huge number of train and bus commuters that the operators will have to handle on a daily basis."
2023-09-18-T-011-S-00442,2023-09-18-T-011,442,Murali Pillai,"Second and finally, I note that it is proposed that the Controller be vested with the power to temporarily restrain a child from leaving Singapore in compliance with the court order until the child’s parent or legal guardian collects him or her."
2023-09-18-T-011-S-00443,2023-09-18-T-011,443,Murali Pillai,I support the proposal. I would like to make a suggestion in this regard.
2023-09-18-T-011-S-00444,2023-09-18-T-011,444,Murali Pillai,"I understand from my professional colleagues who practise family law that, in the usual case, the Family Court would order that a child be allowed to leave Singapore where the other parent provides his or her written consent. Such orders would then be served on ICA. ICA will then have to take on the obligation to operationalise the order by checking to see if the ""suitable person"" wanting to bring the child out of Singapore has the requisite written consent. I wonder if there is scope to digitalise the entire process. They should cover both the notification of Court orders as well as the lodgement of written consent with ICA. In this way, I believe we will gain more efficiency and reduce the risk of making mistakes, too."
2023-09-18-T-011-S-00445,2023-09-18-T-011,445,Murali Pillai,"Sir, in conclusion, let me iterate my support once again for the provisions in this Bill aimed at equipping our men and women of the ICA with the necessary legal tools and teeth to effectively deal with the growing challenges that they face in carrying out their important task of securing our country's borders."
2023-09-18-T-011-S-00446,2023-09-18-T-011,446,Murali Pillai,"I have carefully reviewed the proposed amendments in the Bill dealing with sentencing policy in the Immigration Act. I do not believe they represent a derogation from our uncompromising stance against immigration offenders as well as traffickers and harbourers of illegal and prohibited immigrants, that the law will deal with them firmly by imprisonment, caning or fine."
2023-09-18-T-011-S-00447,2023-09-18-T-011,447,Murali Pillai,"It is important to maintain this tough stance so that we do not backslide to the situation several decades ago when we had a serious illegal immigrant problem that affected Singaporeans' safety and security. Mr Speaker, Sir, notwithstanding my concerns that I expressed in my speech, I support the Bill."
2023-09-18-T-011-S-00448,2023-09-18-T-011,448,Speaker,Mr Gerald Giam.
2023-09-18-T-011-S-00449,2023-09-18-T-011,449,Gerald Giam Yean Song,"Mr Speaker, Sir, I would be addressing two areas of amendments in the Immigration (Amendment) Bill, namely, digitalising and automating immigration processes and the administration of immigration passes and permits."
2023-09-18-T-011-S-00450,2023-09-18-T-011,450,Gerald Giam Yean Song,The Bill will introduce provisions to support ICA's new clearance concept to further automate immigration clearance. I appreciate that ICA is in the forefront of immigration technology. But I have three concerns to highlight regarding the rollout of the NCC.
2023-09-18-T-011-S-00451,2023-09-18-T-011,451,Gerald Giam Yean Song,"First, Minister of State Faishal told the House on 21 April that under the NCC, all manual counters and automated lanes will be replaced in phases with the next generation automated border clearance system gates. Does this mean that once the NCC is fully rolled out, the use of manual counters will no longer be an option for Singaporean travellers?"
2023-09-18-T-011-S-00452,2023-09-18-T-011,452,Gerald Giam Yean Song,"Some categories of travellers frequently face difficulties in the process of clearing immigration. For example, some elderly citizens are unable to provide usable fingerprints due to their dry skin. Wheelchair users may have difficulty getting their irises scanned due to the height and angle of the scanners. Iris recognition systems could become prone to error as people's irises change with age or after cataract surgery and the biometrics of young children are still developing and may change over time."
2023-09-18-T-011-S-00453,2023-09-18-T-011,453,Gerald Giam Yean Song,"Will the NCC include reasonable accommodations, like wider gates for wheelchair users and adjustable scanners that can capture biometrics from travellers who cannot hold their head up for long?"
2023-09-18-T-011-S-00454,2023-09-18-T-011,454,Gerald Giam Yean Song,"Most importantly, will special assistance lanes which are manned by ICA officers continue to be provided at the passenger halls of Changi Airport and all land and sea checkpoints and will they be easily accessible by all travellers with special needs?"
2023-09-18-T-011-S-00455,2023-09-18-T-011,455,Gerald Giam Yean Song,"Second, I note that the Bill empowers the Minister to authorise the disclosure of passenger information to the airport operator for specific uses. Does this airport operator refer to only the Changi Airport operator or also operators of foreign airports? Do the specific uses include sharing of Singaporeans' biometric data? What enhanced safeguards are in place to ensure data security, particularly if Singaporeans' data will be shared with third-party vendors or foreign governments over which we have little control?"
2023-09-18-T-011-S-00456,2023-09-18-T-011,456,Gerald Giam Yean Song,"And third, I note that Singapore is one of the first countries in the world to implement NCC-type capabilities. As shared by Minister of State Faishal in April, some of these capabilities will be implemented in a form and manner not used or tested elsewhere. I also recall that the four-and-a-half-hour disruption to immigration systems on 31 March was caused by a failed upgrade to the multimodal biometric system (MMBS). May I ask the MMBS has since been fully upgraded? What additional contingency plans will ICA put in place to ensure that the upgrade to the NCC will not cause immigration disruptions of that scale or worse?"
2023-09-18-T-011-S-00457,2023-09-18-T-011,457,Gerald Giam Yean Song,"Another key area of amendments in the Bill is to enable ICA to more efficiently administer immigration passes and permits issued to foreigners and PRs. Cross-national marriages between a Singaporean and a foreigner make up about a quarter of all marriages in Singapore. Foreign spouses face many challenges settling down in Singapore, the chief of which is obtaining permission from the Government to remain in Singapore for a long term. This can be achieved first through securing a Long-Term Visit Pass or LTVP and, subsequently, a PR."
2023-09-18-T-011-S-00458,2023-09-18-T-011,458,Gerald Giam Yean Song,"For foreign spouses who hold university degrees and draw high salaries, obtaining a LTVP, PR and even citizenship is usually not difficult since their income and skills add great weight to their applications. But those with low educational qualifications and incomes face far greater challenges in obtaining long-term residency."
2023-09-18-T-011-S-00459,2023-09-18-T-011,459,Gerald Giam Yean Song,"At my Meet-the-People Sessions, which are attended mainly by residents in the lower-income groups, about a fifth of cases involve immigration matters. The Singaporean residents who approached me are usually disappointed that their foreign spouses' LTVP or PR applications were unsuccessful and want me to make appeals for them. Some shared with me their deep longing to start a family but their hesitation due to their spouses' uncertain immigration status. Most do not understand why the applications were rejected because no reasons are provided by ICA."
2023-09-18-T-011-S-00460,2023-09-18-T-011,460,Gerald Giam Yean Song,"During a 2012 parliamentary exchange between Ms Indranee Rajah and the then-Minister of State Mr Masago Zulkifli, Ms Rajah highlighted three cases of Singaporeans with prior convictions who are facing difficulties getting their foreign spouses' LTVP approved."
2023-09-18-T-011-S-00461,2023-09-18-T-011,461,Gerald Giam Yean Song,"Mr Masagos agreed with Ms Rajah that families are the pillar of support for ex-offenders but clarified that family, in this case, referred to an existing family unit, not a new family unit formed when an ex-offender got married soon after his release. He added that an offender just out of prison has many issues to deal with and an environment he is not familiar with anymore. He further stated that should a marriage not work out or the husband re-offend, the spouse, who is a foreigner, will not have relatives in Singapore to turn to nor jobs to sustain herself or her children as many are, generally, low-skilled."
2023-09-18-T-011-S-00462,2023-09-18-T-011,462,Gerald Giam Yean Song,"Sir, parents and siblings are not the only pillar of support for ex-offenders. Many may be estranged from their existing families or may have suffered divorce while incarcerated and are starting anew. In fact, having a spouse provides stability and an added incentive for them to remain crime-free. We should not deny ex-offenders who have served out their prison sentence the right to get married to anyone they choose to."
2023-09-18-T-011-S-00463,2023-09-18-T-011,463,Gerald Giam Yean Song,"Similarly, once they are married, it would be most unfair for the state to deny or delay a foreign spouse's long-term residency on account of the ex-offender's past conviction. This could put a strain on their marriage and finances and keep the ex-offender ""locked"" in a second prison."
2023-09-18-T-011-S-00464,2023-09-18-T-011,464,Gerald Giam Yean Song,The Government should not make it difficult for a married couple to stay together by denying an LTVP to a foreign spouse or child of a Singaporean. Family formation is one of the core social values in Singapore and our immigration policy must support it.
2023-09-18-T-011-S-00465,2023-09-18-T-011,465,Gerald Giam Yean Song,"In 2015, ICA introduced the Pre-Marriage Long-Term Visit Pass Assessment or PMLA to give prospective cross-national couples an indication that the foreign spouse is likely to qualify for an LTVP after the marriage. However, since the PMLA was introduced, out of an annual average of 7,200 LTVP applications, only 3,000 applicants or less than half had completed the PMLA prior to applying for the LTVP, according to a reply by the Minister to my question last month."
2023-09-18-T-011-S-00466,2023-09-18-T-011,466,Gerald Giam Yean Song,"In my conversations with residents who face difficulty getting an LTVP for their foreign spouses, most were unaware of the PMLA before they tied the knot. Does the Registry of Marriages (ROM) and the Registry of Muslim Marriages advise cross-national couples to complete the PMLA before getting married? I am aware that the ROM website advises them to undergo a PMLA. However, is this highlighted to the couple in person before the marriage registration process, keeping in mind that many of these couples may not be proficient in reading English? Furthermore, even passing the PMLA is not a guarantee of obtaining an LTVP after marriage."
2023-09-18-T-011-S-00467,2023-09-18-T-011,467,Gerald Giam Yean Song,"In another reply to me last month, the Minister revealed that only 1,900, out of the 3,000 foreigners issued with letters of LTVP eligibility, were eventually granted LTVP or LTVP-Plus status, which means 37% were not. The Minister explained that not every person who has obtained a letter of LTVP eligibility goes on to apply for an LTVP. But it is unclear if this fully accounts for the 37% gap."
2023-09-18-T-011-S-00468,2023-09-18-T-011,468,Gerald Giam Yean Song,"The Minister has stated in this House that ICA generally does not disclose the reasons for unsuccessful applications for immigration facilities. This lack of transparency is out of step with the practices in some other developed countries. In Canada, for spouse sponsorship applications that are refused, their government provides reasons for refusal in writing. Similarly, Australia's Department of Home Affairs explicitly states that if a partner's visa application is refused, the department will provide information on why the visa was refused."
2023-09-18-T-011-S-00469,2023-09-18-T-011,469,Gerald Giam Yean Song,I wish to propose four approaches that could improve ICA's immigration process for the immediate family members of Singaporeans.
2023-09-18-T-011-S-00470,2023-09-18-T-011,470,Gerald Giam Yean Song,"First, there should be disclosure of the broad reasons for rejection of LTVP, PR and citizenship applications by foreign spouses, children and parents of Singaporeans."
2023-09-18-T-011-S-00471,2023-09-18-T-011,471,Gerald Giam Yean Song,"Singapore does not permit dual citizenship. So, this is our citizens' only homeland. They do not have an easy option to settle in another country if their spouse is not given permission to live with them in Singapore for the long term, especially if they are from a lower-income group. When rejections happen without a reason, the Singaporean spouse can feel disconnected from their own nation. I have seen this in the eyes of my constituents who sought appeals for immigration applications for their spouses."
2023-09-18-T-011-S-00472,2023-09-18-T-011,472,Gerald Giam Yean Song,"Second, where mitigation paths for future applications can be furnished, ICA should do so. For example, if an applicant was rejected because their economic contributions were not deemed sufficient, they should be informed of this so that they can take steps to enter the workforce, upskill themselves and strive to perform better at work so as to earn promotions and salary increments. This is preferable over an opaque dead end."
2023-09-18-T-011-S-00473,2023-09-18-T-011,473,Gerald Giam Yean Song,"Third, ICA should provide more criteria transparency in the immigration framework similar to the Complementarity Assessment (COMPASS) framework for employment passes. Previous answers by Ministers in this House have revealed the range of factors that are considered for LTVP, PR and citizenship applications. Why not list all these criteria clearly on the ICA website and on application forms instead of expecting applicants to comb through the Parliament Hansard? Applicants meeting these criteria should get fast-track approval with discretionary rejections allowed on a case-by-case basis."
2023-09-18-T-011-S-00474,2023-09-18-T-011,474,Gerald Giam Yean Song,The Minister told this House in 2018 that ICA does not share the specific criteria or grounds for rejecting applications due to concerns that information about detailed assessment criteria can be abused to inflate an undeserving applicant's chances of success and that some people could then try to game the system.
2023-09-18-T-011-S-00475,2023-09-18-T-011,475,Gerald Giam Yean Song,"However, in presenting the COMPASS framework, which is used to evaluate foreigners' employment passes and went live this month, the Government emphasised that it brings benefits like transparency, clarity and predictability for businesses."
2023-09-18-T-011-S-00476,2023-09-18-T-011,476,Gerald Giam Yean Song,"COMPASS provides a points system, specific benchmarks for salaries and diversity and employs objective data so that firms can actually assess where they stand. Indeed, the COMPASS criteria spell out in no uncertain terms how many points are awarded for various factors, like salary, qualifications and improving diversity."
2023-09-18-T-011-S-00477,2023-09-18-T-011,477,Gerald Giam Yean Song,"If the Ministry of Manpower (MOM) is comfortable with the disclosure and transparency in the COMPASS framework in order to provide businesses with clarity and predictability for manpower planning, then surely, ICA can also extend these same principles to Singaporeans and their foreign spouses, children or parents who need the same clarity and predictability for their family planning."
2023-09-18-T-011-S-00478,2023-09-18-T-011,478,Gerald Giam Yean Song,"The Minister also said that the reasons for rejection may be used to arouse negative sentiments in other countries and that this may create bilateral sensitivities and is not in Singapore's interest. Sir, it is a universally accepted principle that countries have the right to make their own decisions on immigration. In any case, ICA does not need to tell the applicant that they were rejected because they were from a particular country or a particular race. If there are reasons for rejection that may conceivably cause diplomatic friction, those need not be shared with the applicant. However, the vast majority of reasons for immigration rejections are not going to sour relations with other country. Let us not throw out the baby with the bath water."
2023-09-18-T-011-S-00479,2023-09-18-T-011,479,Gerald Giam Yean Song,"Lastly, ICA should provide clearer channels for immigration appeals. The Bill removes the statutory right of appeal to the Minister on the decisions made by ICA on granting, revoking and varying conditions attached to PRs' permits. I have no objection to the removal of this right. I agree that foreigners have no right to demand to enter or stay in Singapore. And I note from MHA's statement that PR applicants and PRs may seek ICA's reconsideration of its decisions, particularly if there are new facts that were not previously submitted to ICA."
