speech_id,topic_id,speech_order,member_name,text
2023-09-18-T-025-S-01207,2023-09-18-T-025,1207,Desmond Lee,"The Housing and Development Board works closely with the Ministry of Social and Family Development and selected Family Service Centres (FSCs) to assist large families with children to access 3-room rental flats on a case-by-case basis. In particular, we focus on large families who do not have family support and have no alternative housing options. These families are also supported by social workers from the FSCs, who work closely with the families to holistically address the challenges they face."
2023-09-18-T-025-S-01208,2023-09-18-T-025,1208,Desmond Lee,"For families staying in public rental, our goal is to uplift them so that they can build up their finances and buy their own flat eventually. This is why we have paired rental housing with social support via the ComLink programme, where agencies provide holistic support to rental families to address their needs and aspirations. When the families are ready for home ownership, we provide substantial grants and one-to-one guidance to help them buy a flat."
2023-09-18-T-026-S-01209,2023-09-18-T-026,1209,Kwek Hian Chuan Henry,"asked the Minister for Home Affairs whether Traffic Police will investigate, upon request, vehicular accidents without injuries, in case some parties involved in the accidents deliberately choose not to cooperate in the insurance claims process."
2023-09-18-T-026-S-01210,2023-09-18-T-026,1210,K Shanmugam,Police resources are very tight and need to be focused on investigating criminal offences and ensuring law and order. They should not be asked to deal with civil matters like insurance claim disputes where there are no injuries.
2023-09-18-T-027-S-01211,2023-09-18-T-027,1211,Ong Hua Han,"asked the Minister for Transport in light of the refurbishment of over 600 public buses nearing their 10th year of operation, whether LTA will consider (i) re-evaluating automated ramps on these buses for easier boarding and alighting for commuters with mobility devices and (ii) addressing the challenges identified in the trial conducted from September 2017 to March 2018."
2023-09-18-T-027-S-01212,2023-09-18-T-027,1212,Chee Hong Tat,"The Land Transport Authority (LTA) conducted a trial of automated ramps from September 2017 to March 2018. During the trial, LTA observed operational issues, such as longer stopping times at bus stops as more time was needed to safely deploy the automated ramp, and disruptions to bus service when the automated ramp failed to properly deploy. Given these issues and the high cost of retrofitting existing buses with automated ramps, LTA has no plans to do so on public buses due for midlife refurbishment. These buses will continue to be equipped with manual ramps, which can be deployed by bus captains to facilitate boarding and alighting by commuters on mobility devices."
2023-09-18-T-027-S-01213,2023-09-18-T-027,1213,Chee Hong Tat,"Nevertheless, we recognise that technology will improve over time and we are open to new solutions. LTA has included an option for automated ramps in its latest electric bus tender and we will assess the proposals to see if there are feasible options that can be implemented on our new buses."
2023-09-18-T-028-S-01214,2023-09-18-T-028,1214,Sharael Taha,asked the Minister for Trade and Industry with increasing electricity demand from new investments in energy-intensive sectors and the retiring of older power generation plants (a) what is the plan to ensure grid reliability and to generate above the required reserve margin of 27%; (b) whether older power generation plants will be considered for continual operation if the newer plants are not ready; and (c) whether such consideration will put our transition to low- or zero-carbon power generation plans at risk and its impact to our environment.
2023-09-18-T-028-S-01215,2023-09-18-T-028,1215,Gan Kim Yong,"The reserve margin, which provides for planned and unplanned outages of generating units to safeguard the reliability of our power system, is currently in excess of 30% today, which is above the 27% required reserve margin (RRM). While we expect the reserve margin to decrease over the next few years due to increasing demand, there will be sufficient generation capacity to meet the RRM of 27%."
2023-09-18-T-028-S-01216,2023-09-18-T-028,1216,Gan Kim Yong,"To ensure sufficient generation capacity, the Energy Market Authority (EMA) has introduced a new Centralised Process to launch a Request for Proposal when additional generation capacity is needed in our power system. Only companies awarded a licence under this process may plant new generation capacity. EMA launched the first RFP in July 2023 for new generation capacity needed in 2028. This process strikes a balance between ensuring sufficient capacity for grid security and reliability while minimising the risk of overcapacity. EMA has also been working with Singapore Power to upgrade our grid. These upgrades are planned in tandem with EMA’s Centralised Process."
2023-09-18-T-028-S-01217,2023-09-18-T-028,1217,Gan Kim Yong,"To mitigate potential delays to new generation capacity coming online, EMA is working with the generation companies on measures, such as the installation of temporary generation units and reviewing the retirement plans of the older generation plants."
2023-09-18-T-028-S-01218,2023-09-18-T-028,1218,Gan Kim Yong,"We are also continuing with our plans to decarbonise the power sector by 2050, by maximising solar deployment, importing low-carbon electricity and exploring low-carbon alternatives, such as hydrogen. To improve plant efficiency, EMA will also be introducing emission standards by end-2023."
2023-09-18-T-029-S-01219,2023-09-18-T-029,1219,Jessica Tan Soon Neo,"asked the Minister for Health (a) whether the Ministry will consider investigating the case of the delay of urgent treatment by a doctor who paid two ambulance services a commission for taking patients to him at his clinic resulting in the death of one of the patients; and (b) whether the practice of doctors and clinics giving such referral fees to ambulance services is a widespread practice and, if so, why is this allowed."
2023-09-18-T-029-S-01220,2023-09-18-T-029,1220,Ong Ye Kung,"The case of delayed urgent treatment by a doctor who paid two ambulance services a commission for taking patients to his clinic is already under investigation for professional misconduct by the Singapore Medical Council (SMC) since August 2021, after complaints against the doctor were filed."
2023-09-18-T-029-S-01221,2023-09-18-T-029,1221,Ong Ye Kung,"There are currently no other cases involving the making of gratuitous payments to private ambulance operators that have been reported to the Ministry of Health or the SMC. SMC’s Ethical Code and Ethical Guidelines disallow such practices, and also doctors participating in fee splitting or sharing by offering gratuitous payments, gifts or other rewards in exchange for patient referrals. Doctors must always act in the best interests of patients. Failure to do so constitutes a breach of the Ethical Code and Ethical Guidelines and will be subjected to the SMC disciplinary process, including being removed from the professional register."
2023-09-18-T-030-S-01222,2023-09-18-T-030,1222,Saktiandi Supaat,"asked the Minister for National Development (a) to date, how many HDB estates have had an HDB flat obtaining a resale price exceeding $1 million; (b) where are these HDB estates located; (c) at the locations of these HDB estates, how many new HDB estates have been launched, announced or planned since 2021 under (i) the Prime Location Public Housing (PLH) model and (ii) non-PLH model respectively."
2023-09-18-T-030-S-01223,2023-09-18-T-030,1223,Desmond Lee,"As of 22 July 2023, 21 Housing and Development Board (HDB) towns and estates have resale transactions registered with a resale price of $1 million or more. They are Ang Mo Kio, Bedok, Bishan, Bukit Batok, Bukit Merah, Bukit Timah, Central Area, Clementi, Geylang, Hougang, Jurong East, Kallang Whampoa, Marine Parade, Pasir Ris, Punggol, Queenstown, Serangoon, Tampines, Toa Payoh, Woodlands and Yishun."
2023-09-18-T-030-S-01224,2023-09-18-T-030,1224,Desmond Lee,"HDB resale flats that have been sold for $1 million or more form a very small minority, at around 1% of total resale transactions in 2021 and 2022. These flats tend to be in very favourable locations or come with larger floor areas."
2023-09-18-T-030-S-01225,2023-09-18-T-030,1225,Desmond Lee,"Among these 21 towns and estates, between 2021 and the first half of 2023, HDB offered 13 BTO projects under the Prime Location Public Housing (PLH) model in Bukit Merah, Central Area, Kallang Whampoa and Queenstown. HDB has also launched 36 non-PLH BTO projects across several of the 21 towns and estates."
2023-09-18-T-030-S-01226,2023-09-18-T-030,1226,Desmond Lee,"Since 2021, we have launched about 50,000 flats and are on track to launch 100,000 flats by 2025."
2023-09-18-T-031-S-01227,2023-09-18-T-031,1227,Wan Rizal,"asked the Minister for Education considering the recent changes to the Grade Point Average (GPA) requirements for progression from ITE to polytechnics (a) whether there are plans to expand this approach to polytechnic students who wish to join universities upon graduation, whereby students with a GPA of 3.5 and above will be guaranteed admission into universities; and (b) if not, whether the Ministry can elaborate on the considerations behind this decision."
2023-09-18-T-031-S-01228,2023-09-18-T-031,1228,Chan Chun Sing,"There are no plans to introduce guaranteed admission to the Autonomous Universities (AUs) for polytechnic students based on Grade Point Average (GPA). The AUs administer their own admissions exercise. Admissions criteria vary across the AUs and across courses, and the admissions process may include interviews and other forms of assessment."
2023-09-18-T-031-S-01229,2023-09-18-T-031,1229,Chan Chun Sing,"Admission is based on merit, and the AUs assess all applicants fairly and objectively based on their demonstrated abilities and interests.  Polytechnic graduates who gain admission to the AUs may be granted credit exemptions if they apply to related courses."
2023-09-18-T-032-S-01230,2023-09-18-T-032,1230,Don Wee,asked the Minister for Sustainability and the Environment (a) how does the Singapore Food Agency (SFA) check on all farms from which Singapore imports eggs; and (b) how does SFA strike a balance between food security and food safety.
2023-09-18-T-032-S-01231,2023-09-18-T-032,1231,Grace Fu Hai Yien,"The Singapore Food Agency (SFA) adopts a science-based approach to assess and manage food safety risks, including for eggs, and does so through its regulatory regimes as well as consumer education."
2023-09-18-T-032-S-01232,2023-09-18-T-032,1232,Grace Fu Hai Yien,"SFA accredits and approves all overseas farms before they can export eggs to Singapore. The farms need to meet SFA’s food safety and animal health requirements, including being free of Salmonella Enteritidis. At import, eggs are subject to SFA’s inspection and testing regime to ensure food safety. Inspected consignments that fail will not be allowed for sale in Singapore."
2023-09-18-T-032-S-01233,2023-09-18-T-032,1233,Grace Fu Hai Yien,"Food safety remains paramount even as we enhance Singapore’s food security. Even as we diversify our sources of meat and eggs, we ensure that all new sources are subjected to a robust regulatory regime."
2023-09-18-T-033-S-01234,2023-09-18-T-033,1234,Louis Ng Kok Kwang,"asked the Minister for Manpower based on the Ministry’s regular inspections of workers who are provided with catered food, whether the timings for workers’ (i) lunch and (ii) dinner breaks are within four hours from the time that the catered food was cooked at the caterer’s kitchen."
2023-09-18-T-033-S-01235,2023-09-18-T-033,1235,Tan See Leng,"The Ministry of Manpower (MOM) conducts regular inspections on licensed dormitories to ensure that dormitory operators meet with regulatory requirements, including putting in place food safety measures, such as setting up proper food storage and collection points. Dormitory operators must ensure that food is also protected from contamination until it is collected by residents."
2023-09-18-T-033-S-01236,2023-09-18-T-033,1236,Tan See Leng,"So far, we have not received specific complaints from workers about not being able to consume food within reasonable time of preparation. Workers with food-related issues should approach MOM’s Forward Assurance and Support Team (FAST) officers or report the issues via FWMOMCare mobile application. MOM will follow up with the relevant dormitory operator or employer to rectify the issues. In serious cases, MOM will take appropriate enforcement action. If there is an issue with food safety and hygiene, we will refer the matter to Singapore Food Agency."
2023-09-18-T-034-S-01237,2023-09-18-T-034,1237,Gan Thiam Poh,asked the Deputy Prime Minister and Minister for Finance what are the further sustainable measures and support that can be given to lower- and middle-income workers who face stagnant wages to cope with inflation in the long run.
2023-09-18-T-034-S-01238,2023-09-18-T-034,1238,Lawrence Wong,"The most effective way to help lower- and middle-income workers cope with inflation is to enable them to increase their real wages over time. The Government will strive to achieve this by growing the economy, creating good jobs and supporting Singaporeans to take on these jobs through continuing education and training."
2023-09-18-T-034-S-01239,2023-09-18-T-034,1239,Lawrence Wong,"We have made continuing education and training more affordable for workers through significant course fee subsidies and the SkillsFuture Credit. We are getting companies to be more involved in SkillsFuture to ensure that the training leads to industry-relevant skills. Initiatives like the Company Training Committees, led by the National Trades Union Congress, as well as the Jobs-Skills Integrators, announced in this year’s Budget, will also help to achieve more effective training, job placement and employment outcomes."
2023-09-18-T-034-S-01240,2023-09-18-T-034,1240,Lawrence Wong,"In addition, we will press on with efforts to uplift the wages of lower-income workers. We recently enhanced Workfare to cover more lower-wage workers and increase the support they receive. We have also expanded the Progressive Wage Model, and the Government co-shares the cost of wage increases with employers through the Progressive Wage Credit Scheme. Today, up to nine in 10 lower-wage workers are covered by Progressive Wage measures."
2023-09-18-T-034-S-01241,2023-09-18-T-034,1241,Lawrence Wong,"These moves have helped our workers increase their earnings. From 2017 to 2022, real median income grew at 1.8% per annum1. Real income for lower-wage workers grew at a higher 2.9% per annum2. We are not just supporting the broad middle, but also uplifting the lower-income groups and reducing our wage gaps."
2023-09-18-T-034-S-01242,2023-09-18-T-034,1242,Lawrence Wong,"Through the Forward Singapore exercise, the Government is considering further moves to strengthen our support for workers so that they have the skills to take on better jobs and earn higher wages over time."
2023-09-18-T-035-S-01243,2023-09-18-T-035,1243,Kwek Hian Chuan Henry,asked the Minister for National Development (a) what is the Ministry’s outlook for the pricing level of the home rental market; and (b) what more can the Ministry do to moderate or reverse escalating rental cost to help tenants manage their cost of living.
2023-09-18-T-035-S-01244,2023-09-18-T-035,1244,Desmond Lee,"Private and public housing rents are showing signs of stabilising. In the second quarter of 2023, the increase in private and public housing rents moderated to 2.8% and 3% respectively, compared to 7.2% and 4.4% in the previous quarter. This was the third and second consecutive quarter of moderation, for private and public housing rents respectively."
2023-09-18-T-035-S-01245,2023-09-18-T-035,1245,Desmond Lee,"In the coming quarters, we expect rental pressures to further ease, as a significant number of residential units are completed. Close to 100,000 public and private residential units are expected to be completed from 2023 to 2025, adding to the rental supply. This will also reduce the immediate rental demand, as households temporarily renting move into their new homes."
2023-09-18-T-035-S-01246,2023-09-18-T-035,1246,Desmond Lee,"To support Singaporeans who need to rent, the Housing and Development Board (HDB) offers schemes, such as the Public Rental Scheme for low-income Singaporeans with no family support and no other housing options, and the Parenthood Provisional Housing Scheme, for eligible families who need interim housing while waiting for the completion of their BTO flat."
2023-09-18-T-035-S-01247,2023-09-18-T-035,1247,Desmond Lee,We are watching the rental situation closely and will adjust our policies as necessary.
2023-09-18-T-036-S-01248,2023-09-18-T-036,1248,Zhulkarnain Abdul Rahim,asked the Minister for Social and Family Development and Minister-in-charge of Muslim Affairs in relation to the suspicious zakat transactions detected recently at Al-Istiqamah mosque involving cash payments made by members of the public (a) how were the suspicious transactions detected; (b) what is the number of transactions and total quantum involved; and (c) what are the steps already in place or the interim measures now being put in place to ensure the proper accounting of zakat payments in the mosque and all other zakat collection centres accepting cash payments.
2023-09-18-T-036-S-01249,2023-09-18-T-036,1249,Masagos Zulkifli B M M,"On 19 June 2023, Majlis Ugama Islam Singapura (MUIS) detected several suspicious transactions involving zakat payments paid in cash at Masjid Al-Istiqamah. As Police investigations are ongoing, MUIS is unable to disclose more information."
2023-09-18-T-036-S-01250,2023-09-18-T-036,1250,Masagos Zulkifli B M M,"Governance requirements and standard operating procedures for handling cash and digital zakat payments are in place and regularly reviewed. MUIS’ zakat officers and supervisors are trained on how to operate the zakat collection system and on the standard operating procedures (SOPs). Regular audits are also performed to ensure adherence to proper procedures and can surface suspicious transactions, as was the case at Masjid Al-Istiqamah."
2023-09-18-T-036-S-01251,2023-09-18-T-036,1251,Masagos Zulkifli B M M,"Masjid Al-Istiqamah has temporarily suspended all zakat collections over the counter. Pending the outcome of the Police investigations, MUIS will review the current SOP and implement any necessary measures to further strengthen the zakat system and processes. MUIS encourages zakat payers to go cashless, where possible."
2023-09-18-T-037-S-01252,2023-09-18-T-037,1252,Edward Chia Bing Hui,asked the Minister for Trade and Industry (a) what are the reasons for the lower demand for SME grants in FY2022/2023; (b) whether there are barriers encountered by potential beneficiaries in accessing and utilising these grants; and (c) what is the impact of this under-utilisation on the intended outcomes and effectiveness of the grant schemes.
2023-09-18-T-037-S-01253,2023-09-18-T-037,1253,Gan Kim Yong,"The amount of support extended to small and medium enterprises (SMEs) through capability-building grants like the Productivity Solutions Grant, the Enterprise Development Grant and the Market Readiness Assistance Grant has doubled between 2019 and 2022. We have also seen a large number of applications in 2023 thus far. The number received in 2023 to date has already exceeded the number of applications received in 2019 over the same period of time."
2023-09-18-T-037-S-01254,2023-09-18-T-037,1254,Gan Kim Yong,"We are glad that businesses are investing in capability development, innovation and internationalisation and will continue to support them in their transformation journey."
2023-09-18-T-038-S-01255,2023-09-18-T-038,1255,Gerald Giam Yean Song,"asked the Prime Minister aside from redeeming the Reserves Management Government Securities, what are the other mechanisms in place for MAS to quickly avail itself of the reserves managed by GIC."
2023-09-18-T-038-S-01256,2023-09-18-T-038,1256,Lawrence Wong,The Monetary Authority of Singapore (MAS) holds Official Foreign Reserves (OFR) for the conduct of monetary policy. It has assessed that the amount of OFR needed to ensure confidence in the Singapore dollar in the event of a severe crisis in the global economy and financial markets is between 65% to 75% of gross domestic product (GDP).
2023-09-18-T-038-S-01257,2023-09-18-T-038,1257,Lawrence Wong,"MAS’ OFR has been sufficient to manage any impact on the Singapore dollar arising from past crises. These include the Asian Financial Crisis, Dot-com crash, SARS, the Global Financial Crisis, the Eurozone sovereign debt crisis and the COVID-19 pandemic. Separately, the foreign reserves MAS accumulates in excess of its needs have been transferred to the Government for investment by GIC for higher returns. In return, the Government issues Reserves Management Government Securities (RMGS) to MAS."
2023-09-18-T-038-S-01258,2023-09-18-T-038,1258,Lawrence Wong,"MAS’ current OFR stands at S$455.5 billion and 70% of GDP, well within the optimal range. Nonetheless, in unlikely tail-risk scenarios where MAS’ OFR buffer might prove insufficient, MAS will be able to redeem its RMGS holdings from the Government in exchange for OFR. Today, MAS’ RMGS holdings amount to S$237.6 billion, or 52% of current OFR. If MAS redeems this, it would bring the level of OFR up to 106% of GDP."
2023-09-18-T-038-S-01259,2023-09-18-T-038,1259,Lawrence Wong,"Should a crisis of unprecedented scale emerge that causes MAS’ OFR requirements to exceed what RMGS redemptions can provide, MAS can approach the Government for further support. The Government, as owner of the assets that GIC manages, will then decide how best to meet MAS’ need for additional OFR in a timely manner."
2023-09-18-T-039-S-01260,2023-09-18-T-039,1260,Murali Pillai,asked the Minister for Health (a) whether there is a system of regular audits done in relation to the responsiveness of the emergency monitoring and response service at HDB's 2-room flexi flats for seniors; (b) what steps are being taken to ensure the reliability of this service; and (c) whether the service may be upgraded to the level for that in community care apartments.
2023-09-18-T-039-S-01261,2023-09-18-T-039,1261,Ong Ye Kung,"We understand that the Member has encountered a case where an elderly resident sounded the alarm at night, but the response from the neighbours only came an hour later. We are reviewing the response mechanism. Proper maintenance of hardware and prompt response will likely require various parties, such as the Housing and Development Board, Town Councils, Agency for Integrated Care, Active Ageing Centres and responders, such as the Police, Singapore Civil Defence Force, CISCO and neighbours, to come together."
2023-09-18-T-040-S-01262,2023-09-18-T-040,1262,Edward Chia Bing Hui,"asked the Minister for Health (a) whether the Ministry has considered building dedicated active ageing centres for men, akin to Men's Sheds in the United Kingdom and Australia which have demonstrated increased participation rates in activities conducted for elderly men."
2023-09-18-T-040-S-01263,2023-09-18-T-040,1263,Ong Ye Kung,"We agree with the need to increase participation rates of male seniors. Elderly men are generally more driven by specific interests when deciding whether to take part in activities and we also observed that they prefer activities that give them agency. Thus, some AAC providers have organised programmes, such as pool table games, guitar playing, and having dedicated timeslots for ""Uncles’ Time"" or ""Men’s Club"" where they can participate in activities like breakfast and walks as a group."
2023-09-18-T-040-S-01264,2023-09-18-T-040,1264,Ong Ye Kung,"While there are no plans to build dedicated Active Ageing Centres (AACs) for men, AAC providers are encouraged to conduct a range of activities that meet the interests of both elderly men and women, to ensure that AACs can remain as inclusive spaces for all seniors."
2023-09-18-T-041-S-01265,2023-09-18-T-041,1265,Gan Thiam Poh,asked the Minister for National Development whether the Ministry will review the guidelines for keeping pets at home to ensure harmonious living among neighbours.
2023-09-18-T-041-S-01266,2023-09-18-T-041,1266,Desmond Lee,"The National Parks Board (NParks) and the Housing and Development Board (HDB) have put in place guidelines and regulations for the keeping of pets, which aim to safeguard animal welfare and minimise inconvenience to neighbours. For example, NParks has developed a Code of Animal Welfare for pet owners which sets out standards for pet housing, management and care, while HDB maintains a list of approved dog breeds that are suitable to be kept in HDB flats."
2023-09-18-T-041-S-01267,2023-09-18-T-041,1267,Desmond Lee,"NParks also works with community partners, such as animal welfare groups (AWGs), to promote responsible pet ownership. For example, NParks engages the public on best practices for pet care through community events and webinars."
2023-09-18-T-041-S-01268,2023-09-18-T-041,1268,Desmond Lee,"If a resident’s pet is causing inconvenience to neighbours, the pet owner will be advised to take the necessary measures to reduce the inconvenience. The parties concerned may also be advised to attend mediation, where necessary, to resolve the issue amicably."
