speech_id,topic_id,speech_order,member_name,text
2023-09-19-T-016-S-00264,2023-09-19-T-016,264,Wan Rizal,"Firstly, the extension of the Government-Paid Paternity Leave from two weeks to four is a commendable move. This allows fathers to play a more active role in the early stages of their child's life and also underscores the importance of shared parental responsibilities. Furthermore, the introduction of the Shared Parental Leave, allowing parents to share up to eight weeks of maternity leave, is a progressive step. It provides flexibility and choice, allowing families to decide what arrangement works best for them."
2023-09-19-T-016-S-00265,2023-09-19-T-016,265,Wan Rizal,"I am aware that stigma towards utilising family leave is present in our society. Therefore, we must ensure that we have a public awareness campaign to emphasise the importance of shared responsibility."
2023-09-19-T-016-S-00266,2023-09-19-T-016,266,Wan Rizal,"In conclusion, this amendment is a significant step forward in our commitment to supporting families. It recognises the needs of modern families that is constantly evolving and provides the much-needed support. But in line with this progress, let us remember that policies alone are not enough. We need a paradigm shift in our societal values, where we give priority to holistic development and foster a strong sense of community."
2023-09-19-T-016-S-00267,2023-09-19-T-016,267,Wan Rizal,"(In English)  Sir, in conclusion, this Bill is a significant step forward in our commitment to supporting families. It recognises the evolving needs of modern families and provides the necessary support. This Bill is not just a piece of legislation. It is a reflection of our values, our aspirations and our commitment to our future."
2023-09-19-T-016-S-00268,2023-09-19-T-016,268,Wan Rizal,"But as we move forward, let us remember that policies alone are not enough. We need a paradigm shift in our societal values where we prioritise holistic development and foster a strong sense of community."
2023-09-19-T-016-S-00269,2023-09-19-T-016,269,Wan Rizal,"While we must address the concerns raised, they should not deter us from the primary objective of this Bill – to support and nurture Singaporean families. I commend the Ministry for introducing this Bill and hope to see its successful implementation, ensuring a more supportive future for all Singaporeans."
2023-09-19-T-016-S-00270,2023-09-19-T-016,270,Speaker,Mr Don Wee.
2023-09-19-T-016-S-00271,2023-09-19-T-016,271,Don Wee,"Mr Speaker, Sir, I rise in support of the Bill which will assist and support couples in raising children. The amendments will help them to better balance their work responsibilities and the critical task of bringing up the next generation."
2023-09-19-T-016-S-00272,2023-09-19-T-016,272,Don Wee,One of the most noteworthy provisions of this Bill is the expansion of parental leave options.
2023-09-19-T-016-S-00273,2023-09-19-T-016,273,Don Wee,"The Bill proposes to increase Unpaid Infant Care Leave for Singaporean parents with infants under two by six days per parent per year for the first two years, with amendments requiring companies to offer this additional time off to all qualified Singaporean parents who have worked for at least three months."
2023-09-19-T-016-S-00274,2023-09-19-T-016,274,Don Wee,"Longer parental leave periods not only foster stronger parent-child bonds but also contribute to healthier emotional development in children. By extending the duration of paid leave, we empower parents to be present during those crucial early stages of their child's life."
2023-09-19-T-016-S-00275,2023-09-19-T-016,275,Don Wee,"Furthermore, this Bill addresses the need for fathers to be more involved in the care and nurturing of their children. Research has shown that the greater involvement of fathers is beneficial for children, contributing positively to their children's physical and cognitive developments."
2023-09-19-T-016-S-00276,2023-09-19-T-016,276,Don Wee,The enhancement of the Government-Paid Paternity Leave and Government-Paid Paternity Benefit schemes are much welcomed. More shared parental responsibilities will also support mothers who need to juggle work and household tasks in addition to childcare.
2023-09-19-T-016-S-00277,2023-09-19-T-016,277,Don Wee,"I urge the Ministry to continue to study the effects of these policy reforms on child development, parental well-being and worker productivity. This information will be used to drive future legislative changes. For more effective implementation, tighter and more comprehensive collaboration amongst Government agencies, educational institutions and the commercial sector is needed in order to develop a complete support network for families."
2023-09-19-T-016-S-00278,2023-09-19-T-016,278,Don Wee,"I would like to take this opportunity to urge the Ministry to launch a public awareness campaign to enlighten parents about their rights and advantages with this Bill, ensuring that all eligible families may benefit from its provisions. Mr Speaker, Sir, in Mandarin."
2023-09-19-T-016-S-00279,2023-09-19-T-016,279,Don Wee,"(In Mandarin)  [Please refer to  Vernacular Speech.] Lastly, like what Nominated Member of Parliament Mr Mark Lee had mentioned yesterday, we need to be mindful of the challenges that small- and medium-sized enterprises (SMEs) face when dealing with additional parental leave even if it is unpaid leave. These challenges include staffing gaps, business continuity issues and increased operational costs."
2023-09-19-T-016-S-00280,2023-09-19-T-016,280,Don Wee,"SMEs often operate with smaller workforces compared with larger corporations. When employees take extended paternity leave or additional unpaid infant care leave, it can result in significant staffing gaps."
2023-09-19-T-016-S-00281,2023-09-19-T-016,281,Don Wee,"Relative to large corporations, SMEs are more vulnerable to the impact of employee absenteeism. The absence of even one key employee can disrupt the day-to-day operations and put added pressure on the remaining staff."
2023-09-19-T-016-S-00282,2023-09-19-T-016,282,Don Wee,"To manage staffing gaps during extended leaves, SMEs may need to hire part-time or temporary staff. This can lead to increased operational expenses, which can be especially strenuous in sectors like retail and F&B, where staffing needs are often instantaneous. The cost of recruiting, training and paying temporary staff can strain the SME's cashflow momentarily. Can the relevant Ministry explore the possibility of reimbursing and recognising these SMEs which are supportive towards their employees?"
2023-09-19-T-016-S-00283,2023-09-19-T-016,283,Speaker,"Minister of State, Ms Sun Xueling."
2023-09-19-T-016-S-00284,2023-09-19-T-016,284,Sun Xueling,"Sir, I thank Members for their general support for the Bill. I am heartened that most of us agree that a collective, whole-of-society effort is needed to build a conducive environment that values and supports families on their parenthood journey."
2023-09-19-T-016-S-00285,2023-09-19-T-016,285,Sun Xueling,Let me now respond to the questions and suggestions that Members have raised.
2023-09-19-T-016-S-00286,2023-09-19-T-016,286,Sun Xueling,Mr Shawn Huang has shared in his speech that the use of paternity leave among the Organisation of Economic Cooperation and Development (OECD) countries is increasing overall. We have observed a similar trend in Singapore.
2023-09-19-T-016-S-00287,2023-09-19-T-016,287,Sun Xueling,"To Mr Desmond Choo and Assoc Prof Razwana Begum's question, since the introduction of Government-Paid Paternity Leave, take-up rates have increased from about 25% in 2013 to 53% in 2021."
2023-09-19-T-016-S-00288,2023-09-19-T-016,288,Sun Xueling,"Assoc Prof Razwana Begum asked if there is research on the role taken by those fathers who utilise their paternity leave entitlements. From the Marriage and Parenthood Survey 2021, 97% of the married respondents agreed that paternity leave allowed fathers to play a bigger role in their newborn's life. Our research also showed that fathers found paternity leave useful to support their wives after birth and to settle into the role of fatherhood."
2023-09-19-T-016-S-00289,2023-09-19-T-016,289,Sun Xueling,"To Ms He Ting Ru's question, we do survey the reasons why fathers do not fully consume their paternity leave. A key factor affecting fathers' utilisation of paternity leave is workplace support. This includes whether supervisors are adequately assuring that using paternity leave will not affect fathers' career prospects and that colleagues are willing to cover fathers' duties in their absence. We will continue to explore ways to encourage employers to support all fathers to use their paternity leave such as by raising awareness of the benefits of providing a family-friendly workplace culture."
2023-09-19-T-016-S-00290,2023-09-19-T-016,290,Sun Xueling,Ms He Ting Ru also expressed concern on the gap in support for self-employed fathers and those without full-time employment. Ms See Jinli Jean further asked if the Government can consider providing paid paternity leave for the full four-week period of lost income to a self-employed father who stopped working for seven days a week for four weeks.
2023-09-19-T-016-S-00291,2023-09-19-T-016,291,Sun Xueling,"The weekly index of six days takes reference from the Employment Act, which stipulates one rest day per week. This makes for a common base of reference to employees who receive Government-Paid Paternity Leave. For fathers who are not eligible for Government-Paid Paternity Leave, such as those on short-term contracts, they may receive the Government-Paid Paternity Benefit, which is a comparable cash benefit in lieu of the paternity leave."
2023-09-19-T-016-S-00292,2023-09-19-T-016,292,Sun Xueling,"Mr Desmond Choo asked if we could allow parents to use Unpaid Infant Care Leave flexibly during the child's first two years and whether the number of leave days can be increased based on the number of children. I would like to clarify that parents can take 12 days of Unpaid Infant Care Leave flexibly as agreed with their employers during the initial 12-month period, following which they will be entitled to another 12 days of Unpaid Infant Care Leave in the second 12-month period in which the child remains under two years old. Employees may discuss their leave plans with their employers to see how best to meet their needs."
2023-09-19-T-016-S-00293,2023-09-19-T-016,293,Sun Xueling,Mr Louis Ng and Ms Mariam Jaafar asked if childcare leave can be increased. I think many of us as employees would like childcare leave to be increased. I fully empathise with the challenges that Ms Jaafar had shared that her residents face.
2023-09-19-T-016-S-00294,2023-09-19-T-016,294,Sun Xueling,"The difficulty is not so much the cost to Government but rather the difficulties faced by employers and businesses who are impacted when leave is made compulsory. Already, based on the current set of proposals to increase paid paternity leave and unpaid infant care leave, Members in this House have highlighted concerns from employers that the increased leave provisions will adversely impact their manpower costs and operations."
2023-09-19-T-016-S-00295,2023-09-19-T-016,295,Sun Xueling,"Nominated Member Mark Lee in his speech yesterday said, ""the introduction of GPPL and UICL enhancements may pose significant challenges for certain businesses, particularly small and medium-sized enterprises with streamlined workforces where each employee's role is crucial to daily operations. Frontline service-oriented industries may need to recruit temporary personnel to cover for employees taking extended leaves."""
2023-09-19-T-016-S-00296,2023-09-19-T-016,296,Sun Xueling,"Mr Yip Hon Weng also shared in his speech yesterday, I quote, ""appealing for more leave is not a viable solution. As a small, competitive nation, we must weigh these advancements against its potential effects on businesses, ensuring a balanced approach. We must vigilantly track the impact of these policies to discern whether they truly move the needle in the desired direction."""
2023-09-19-T-016-S-00297,2023-09-19-T-016,297,Sun Xueling,These seemingly divergent views show that we need to strike a practical balance between supporting parents in their caregiving responsibilities and meeting employers' manpower needs. Our leave provisions need to take into account not only the roles of parents as caregivers but also the roles parents play in workplaces as employees.
2023-09-19-T-016-S-00298,2023-09-19-T-016,298,Sun Xueling,"I understand that parents with more children will require more leave to take care of their children, should they fall ill."
2023-09-19-T-016-S-00299,2023-09-19-T-016,299,Sun Xueling,"Currently, the Civil Service provides childcare sick leave on a per child basis. Based on the latest available survey data from 2020, 27% of private companies voluntarily provided additional paid childcare sick leave to employees."
2023-09-19-T-016-S-00300,2023-09-19-T-016,300,Sun Xueling,"I would like to encourage private sector employers to consider providing childcare sick leave, which is available in the Public Sector on a per child basis. This can greatly alleviate parental stress from taking care of more children."
2023-09-19-T-016-S-00301,2023-09-19-T-016,301,Sun Xueling,"To Ms Mariam Jaafar's suggestion, we will look at means, such as surveys, to gauge the take-up rate of unpaid infant care leave."
2023-09-19-T-016-S-00302,2023-09-19-T-016,302,Sun Xueling,Mr Louis Ng and Ms Mariam Jaafar asked for the equalisation of parental leave. Mr Melvin Yong asked the Ministry to consider providing adoptive and foster parents with more Government-Paid Paternity Leave and Unpaid Infant Care Leave.
2023-09-19-T-016-S-00303,2023-09-19-T-016,303,Sun Xueling,"Let me clarify that the current leave provisions are differentiated to meet the needs of the respective parents. Maternity leave is provided for mothers to recuperate physically from childbirth and care for and bond with their newborn. Hence, it is longer than paternity leave, which allows for fathers to care for their wives and bond with their newborn child. This is also why maternity leave is longer than adoption leave."
2023-09-19-T-016-S-00304,2023-09-19-T-016,304,Sun Xueling,Couples who wish to have the father spend more time with their newborns can have the father tap on Shared Parental Leave for up to four weeks from their wife's Government-Paid Maternity Leave or Adoption Leave.
2023-09-19-T-016-S-00305,2023-09-19-T-016,305,Sun Xueling,"To Ms Hany Soh's query, we currently do not intend to change the Shared Parental Leave provision under this Bill."
2023-09-19-T-016-S-00306,2023-09-19-T-016,306,Sun Xueling,"I would like to assure Members that the Government is on the same page as Members in wanting to encourage shared parenting. This is why beyond the minimal stipulations for maternity leave and paternity leave, any additional leave that the Government may consider in future will likely be of a shared nature, as per our move on shared parental leave in 2013."
2023-09-19-T-016-S-00307,2023-09-19-T-016,307,Sun Xueling,"On fostering, unlike adoption, fostering is a temporary care arrangement. Hence, foster parents are not eligible for Government-Paid Maternity or Paternity Leave. However, they are entitled to the same quantum of childcare leave and Unpaid Infant Care Leave as biological or adoptive parents."
2023-09-19-T-016-S-00308,2023-09-19-T-016,308,Sun Xueling,"To better support adoptive and foster parents, the Ministry of Social and Family Development (MSF) and our community partners offer a range of services to meet their needs. All new foster parents are also trained by the Social Service Institute to care for foster children and can receive advice from more experienced foster parents through peer support networks."
2023-09-19-T-016-S-00309,2023-09-19-T-016,309,Sun Xueling,"To defray the costs of caring for a foster child, MSF provides a monthly fostering allowance as well as childcare and medical subsidies for foster children."
2023-09-19-T-016-S-00310,2023-09-19-T-016,310,Sun Xueling,"Mr Desmond Choo expressed concern that some self-employed fathers may not qualify for Government-Paid Paternity Leave, if they take time off from work to support their wives in the pre-delivery phase. Let me clarify that in such cases, self-employed fathers remain eligible for the Government-Paid Paternity Leave as long as they have been carrying on their trade, business, profession or vocation for a continuous period of at least three months prior to the childbirth. They will not be disqualified simply because they took some time off work during this period."
2023-09-19-T-016-S-00311,2023-09-19-T-016,311,Sun Xueling,"Ms See Jinli Jean has asked the Government to consider disbursing a self-employed person’s claim for lost income at the start of his or her leave period rather than after it has concluded. I wish to clarify that claims for leave or income lost are processed on a reimbursement basis to ensure that the leave has been taken as intended first before payment is made. This also helps with the computation of the actual amount of income lost to be reimbursed, which would not be possible to ascertain until the leave has been taken."
2023-09-19-T-016-S-00312,2023-09-19-T-016,312,Sun Xueling,"Ms Hany Soh asked if flexibility could be exercised to allow expectant mothers to consume their maternity leave earlier in their final trimester. The primary intent of maternity leave is to provide mothers with time to recover from childbirth and to care for their newborns. We allow flexibility for mothers to start their maternity leave earlier, up to 28 days before delivery, but the bulk of their maternity leave should still be used for post-confinement. Expectant mothers who need to absent themselves from work earlier than 28 days before can tap on their sick leave or hospitalisation leave if they feel unwell, for example, if they suffer from severe nausea in the first trimester."
2023-09-19-T-016-S-00313,2023-09-19-T-016,313,Sun Xueling,"Members such as Mr Yip Hon Weng, Dr Wan Rizal, Mr Don Wee and Assoc Prof Razwana Begum, have asked about the Government’s efforts in encouraging fathers to utilise paternity leave, as well as to normalise paternity leave and the importance of shared parental responsibilities."
2023-09-19-T-016-S-00314,2023-09-19-T-016,314,Sun Xueling,"As Ms Yeo Wan Ling has stated, societal norms must be considered in the discussion of encouraging take-up of parental leave. It is important that the society adopts a mindset that embraces paternal involvement from the onset. To promote active fatherhood and the importance of shared parental responsibilities, we have been working with community partners such as the Families for Life Council and the Centre for Fathering on three key family movements in Singapore – the Families for Life, Dads for Life and Mums for Life movements. These movements look at strengthening family ties and resilience with the aim of increasing marriage stability as well as advocating the importance of shared parenting and household responsibilities between mothers and fathers. For example, the Centre for Fathering runs several campaigns throughout the year to reinforce and signal the importance of fathers’ active involvement in their child’s development. One of the campaigns is the Great Companies for Dads Awards, which engages and recognises companies that nurture a family-friendly work culture through their policies and initiatives."
2023-09-19-T-016-S-00315,2023-09-19-T-016,315,Sun Xueling,"The attitudes and mindsets of supervisors and colleagues also make a big difference in helping fathers feel assured that they are not being discriminated for using their leave. We also hope to encourage self-employed persons to recognise the benefits of parental leave and how the Government tries to support them through the provision of Government-paid paternity benefits, Government-paid paternity and maternity leave. To Ms Hany Soh’s questions, we had indeed sought employers’ views and feedback on the leave enhancements through our consultations with the tripartite partners."
2023-09-19-T-016-S-00316,2023-09-19-T-016,316,Sun Xueling,"We will continue working with our tripartite partners to encourage employers to foster family-friendly workplace cultures that will better support parents in managing their work and family responsibilities. We also encourage employers to be supportive and understanding when fathers take paternity leave. This would help employees be more motivated, like what Ms Yeo Wan Ling has shared. In the long run, progressive employers can stand to benefit from better talent attraction and retention."
2023-09-19-T-016-S-00317,2023-09-19-T-016,317,Sun Xueling,"To Mr Melvin Yong's suggestion to conduct a local study to examine companies that offer the best work-life balance, we will look at best practices today to identify what other companies can adopt."
2023-09-19-T-016-S-00318,2023-09-19-T-016,318,Sun Xueling,"Assoc Prof Razwana Begum asked whether gig workers would benefit from the increase in Government-Paid Paternity Leave, and if not, what support is available to compensate them. Dr Wan Rizal stated that it is crucial to ensure gig workers can also benefit from these leave provisions. I would like to clarify that working parents who do not qualify for Government-paid leave schemes due to their employment arrangements, such as those on short-term contract and gig workers, may be eligible for equivalent parenthood benefits in the form of Government-paid benefit schemes – that is the intent of Government-paid paternity benefit and Government-paid maternity benefit. These are cash benefits granted in lieu of the Government-paid portion of paid leave."
2023-09-19-T-016-S-00319,2023-09-19-T-016,319,Sun Xueling,"Mr Don Wee suggested launching a public awareness campaign so that more parents are aware of their leave entitlements. Mr Desmond Choo also asked if the Government could broaden its work with the trade associations and chambers (TACs) and the Labour Movement to spread awareness of the enhanced Government-Paid Paternity Leave, especially among the self-employed."
2023-09-19-T-016-S-00320,2023-09-19-T-016,320,Sun Xueling,"We thank Members for the suggestions. The Government will work closely with our tripartite partners to raise awareness of these benefits among employees, the self-employed, including gig workers, to encourage them to utilise their leave or benefits. For example, we have developed an infographic and produced a video on parental leave targeted at raising awareness among self-employed persons. The infographic was disseminated through our tripartite partners’ networks. We will continue to build on these efforts and look for ways to further raise awareness and encourage parents to utilise their leave benefits."
2023-09-19-T-016-S-00321,2023-09-19-T-016,321,Sun Xueling,"Dr Wan Rizal and Mr Don Wee asked if we will consider conducting a review to assess the impact of leave enhancements. As Mr Shawn Huang and Ms Usha Chandradas have said, it is a continuous process to review our policies to meet the evolving needs of parents and to make our society more family friendly. We will monitor the impact of our leave enhancements."
2023-09-19-T-016-S-00322,2023-09-19-T-016,322,Sun Xueling,Mr Mark Lee suggested revising the reimbursement schedule of the Government-Paid Maternity Leave and Paternity Leave to more frequent intervals to alleviate cash flow strain on SMEs. I would like to clarify that claims for reimbursement can be submitted for any part of the Government-Paid portion of the leave that has been taken and are not restricted to only after the last day of leave has been fully utilised. This applies to self-employed persons too.
2023-09-19-T-016-S-00323,2023-09-19-T-016,323,Sun Xueling,"We recognise that some employers may have concerns with parents taking additional parental leave, due to the nature of the work and challenge of finding covering arrangements. Mr Don Wee, Mr Mark Lee, Mr Yip Hon Weng and Dr Wan Rizal have highlighted that companies, especially SMEs who have fewer employees, may face operational challenges, and have suggested providing additional support for them. We have introduced the additional two weeks of Government-Paid Paternity Leave on a voluntary basis, so that employers have some time to make adjustments according to their manpower and operational needs. We intend to make this provision mandatory in due course and we will be conducting the necessary stakeholder consultations with tripartite partners before any such move."
2023-09-19-T-016-S-00324,2023-09-19-T-016,324,Sun Xueling,"In the meantime, employers and employees may exercise flexibility in the parents’ utilisation of parental leave, such as by taking the leave in more than one period within their child’s first year, to minimise disruptions to business operations. Parents should also play their part by discussing their leave arrangements with their employers in advance, so that their employers can plan for the necessary covering arrangements and any additional resources that they may require. I also thank Mr Desmond Choo for sharing that the National Trades Union Congress (NTUC) is ready to help our SMEs to develop policies that will better support parents."
