Date,MP_Name,Original_MP_Name,Attendance
2012-09-11,Cedric Foo Chee Keng,Mr Cedric Foo Chee Keng (Pioneer).,False
2012-09-11,Goh Chok Tong,Mr Goh Chok Tong (Marine Parade).,False
2012-09-11,Halimah Yacob,"Mdm Halimah Yacob (Jurong), Minister of State for Community Development, Youth and Sports.",False
2012-09-11,Hawazi Daipi,"Mr Hawazi Daipi (Sembawang), Senior Parliamentary Secretary to the Minister for Education and Acting Minister for Manpower.",False
2012-09-11,Heng Swee Keat,"Mr Heng Swee Keat (Tampines), Minister for Education.",False
2012-09-11,Indranee Rajah,Ms Indranee Rajah (Tanjong Pagar).,False
2012-09-11,S Iswaran,"Mr S Iswaran (West Coast), Minister, Prime Minister's Office, Second Minister for Home Affairs and Second Minister for Trade and Industry.",False
2012-09-11,Janice Koh,Ms Janice Koh (Nominated Member).,False
2012-09-11,Lam Pin Min,Dr Lam Pin Min (Sengkang West).,False
2012-09-11,Lee Kuan Yew,Mr Lee Kuan Yew (Tanjong Pagar).,False
2012-09-11,Laurence Lien,Mr Laurence Lien (Nominated Member).,False
2012-09-11,Raymond Lim Siang Keat,Mr Raymond Lim Siang Keat (East Coast).,False
2012-09-11,Penny Low,Miss Penny Low (Pasir Ris-Punggol).,False
2012-09-11,Mah Bow Tan,Mr Mah Bow Tan (Tampines).,False
2012-09-11,Ng Eng Hen,"Dr Ng Eng Hen (Bishan-Toa Payoh), Minister for Defence and Leader of the House.",False
2012-09-11,Irene Ng Phek Hoong,Ms Irene Ng Phek Hoong (Tampines).,False
2012-09-11,K Shanmugam,"Mr K Shanmugam (Nee Soon), Minister for Foreign Affairs and Minister for Law.",False
2012-09-11,Sam Tan Chin Siong,"Mr Sam Tan Chin Siong (Radin Mas), Senior Parliamentary Secretary to the Minister for Foreign Affairs and Acting Minister for Community Development, Youth and Sports.",False
2012-09-11,Teo Ser Luck,"Mr Teo Ser Luck (Pasir Ris-Punggol), Minister of State for Trade and Industry.",False
2012-09-11,Yee Jenn Jong,Mr Yee Jenn Jong (Non-Constituency Member).,False
2012-09-11,Alvin Yeo,Mr Alvin Yeo (Chua Chu Kang).,False
2012-09-11,Michael Palmer,Mr SPEAKER (Mr Michael Palmer (Punggol East)). ,True
2012-09-11,Ang Hin Kee,Mr Ang Hin Kee (Ang Mo Kio). ,True
2012-09-11,Ang Wei Neng,Mr Ang Wei Neng (Jurong). ,True
2012-09-11,Baey Yam Keng,Mr Baey Yam Keng (Tampines). ,True
2012-09-11,Chan Chun Sing,"Mr Chan Chun Sing (Tanjong Pagar), Acting Minister for Community Development, Youth and Sports and Senior Minister of State for Defence. ",True
2012-09-11,Chen Show Mao,Mr Chen Show Mao (Aljunied). ,True
2012-09-11,Chia Shi-Lu,Dr Chia Shi-Lu (Tanjong Pagar). ,True
2012-09-11,Lina Chiam,Mrs Lina Chiam (Non-Constituency Member). ,True
2012-09-11,Charles Chong,"Mr Charles Chong (Joo Chiat), Deputy Speaker. ",True
2012-09-11,Christopher de Souza,Mr Christopher de Souza (Holland-Bukit Timah). ,True
2012-09-11,R Dhinakaran,Mr R Dhinakaran (Nominated Member). ,True
2012-09-11,Faizah Jamal,Ms Faizah Jamal (Nominated Member). ,True
2012-09-11,Nicholas Fang,Mr Nicholas Fang (Nominated Member). ,True
2012-09-11,Fatimah Lateef,Assoc Prof Fatimah Lateef (Marine Parade). ,True
2012-09-11,Arthur Fong,Mr Arthur Fong (West Coast). ,True
2012-09-11,Foo Mee Har,Ms Foo Mee Har (West Coast). ,True
2012-09-11,Grace Fu Hai Yien,"Ms Grace Fu Hai Yien (Yuhua), Minister, Prime Minister's Office, Second Minister for the Environment and Water Resources and Second Minister for Foreign Affairs. ",True
2012-09-11,Gan Kim Yong,"Mr Gan Kim Yong (Chua Chu Kang), Minister for Health and Government Whip. ",True
2012-09-11,Gan Thiam Poh,Mr Gan Thiam Poh (Pasir Ris-Punggol). ,True
2012-09-11,Gerald Giam Yean Song,Mr Gerald Giam Yean Song (Non-Constituency Member). ,True
2012-09-11,Heng Chee How,"Mr Heng Chee How (Whampoa), Senior Minister of State, Prime Minister's Office and Deputy Leader of the House. ",True
2012-09-11,Hri Kumar Nair,Mr Hri Kumar Nair (Bishan-Toa Payoh). ,True
2012-09-11,Inderjit Singh,Mr Inderjit Singh (Ang Mo Kio). ,True
2012-09-11,Intan Azura Mokhtar,Dr Intan Azura Mokhtar (Ang Mo Kio). ,True
2012-09-11,Janil Puthucheary,Dr Janil Puthucheary (Pasir Ris-Punggol). ,True
2012-09-11,Khaw Boon Wan,"Mr Khaw Boon Wan (Sembawang), Minister for National Development. ",True
2012-09-11,Amy Khor Lean Suan,"Dr Amy Khor Lean Suan (Hong Kah North), Minister of State for Health and Manpower and Deputy Government Whip. ",True
2012-09-11,Lee Bee Wah,Er Dr Lee Bee Wah (Nee Soon). ,True
2012-09-11,Desmond Lee,Mr Desmond Lee (Jurong). ,True
2012-09-11,Ellen Lee,Ms Ellen Lee (Sembawang). ,True
2012-09-11,Lee Hsien Loong,"Mr Lee Hsien Loong (Ang Mo Kio), Prime Minister. ",True
2012-09-11,Lee Yi Shyan,"Mr Lee Yi Shyan (East Coast), Senior Minister of State for National Development and Trade and Industry. ",True
2012-09-11,Liang Eng Hwa,Mr Liang Eng Hwa (Holland-Bukit Timah). ,True
2012-09-11,Mary Liew,Ms Mary Liew (Nominated Member). ,True
2012-09-11,Lim Biow Chuan,Mr Lim Biow Chuan (Mountbatten). ,True
2012-09-11,Lim Hng Kiang,"Mr Lim Hng Kiang (West Coast), Minister for Trade and Industry. ",True
2012-09-11,Lim Swee Say,"Mr Lim Swee Say (East Coast), Minister, Prime Minister's Office. ",True
2012-09-11,Sylvia Lim,Ms Sylvia Lim (Aljunied). ,True
2012-09-11,Lim Wee Kiak,Dr Lim Wee Kiak (Nee Soon). ,True
2012-09-11,Low Thia Khiang,Mr Low Thia Khiang (Aljunied). ,True
2012-09-11,Low Yen Ling,Ms Low Yen Ling (Chua Chu Kang). ,True
2012-09-11,Lui Tuck Yew,"Mr Lui Tuck Yew (Moulmein-Kallang), Minister for Transport ",True
2012-09-11,Masagos Zulkifli B M M,"Mr Masagos Zulkifli B M M (Tampines), Senior Minister of State for Home Affairs and Foreign Affairs. ",True
2012-09-11,Mohamad Maliki Bin Osman,"Dr Mohamad Maliki Bin Osman (East Coast), Senior Parliamentary Secretary to the Minister for Defence and Minister for National Development. ",True
2012-09-11,Muhamad Faisal Bin Abdul Manap,Mr Muhamad Faisal Bin Abdul Manap (Aljunied). ,True
2012-09-11,Dr Muhammad Faishal Ibrahim,"Assoc Prof Dr Muhammad Faishal Ibrahim (Nee Soon), Parliamentary Secretary to the Minister for Health and Minister for Transport. ",True
2012-09-11,Lily Neo,Dr Lily Neo (Tanjong Pagar). ,True
2012-09-11,David Ong,Mr David Ong (Jurong). ,True
2012-09-11,Ong Teng Koon,Mr Ong Teng Koon (Sembawang). ,True
2012-09-11,Denise Phua Lay Peng,Ms Denise Phua Lay Peng (Moulmein-Kallang). ,True
2012-09-11,Png Eng Huat,Mr Png Eng Huat (Hougang). ,True
2012-09-11,Pritam Singh,Mr Pritam Singh (Aljunied). ,True
2012-09-11,Seah Kian Peng,"Mr Seah Kian Peng (Marine Parade), Deputy Speaker. ",True
2012-09-11,Seng Han Thong,Mr Seng Han Thong (Ang Mo Kio). ,True
2012-09-11,Sim Ann,"Ms Sim Ann (Holland-Bukit Timah), Senior Parliamentary Secretary to the Minister for Education and Minister for Law. ",True
2012-09-11,Sitoh Yih Pin,Mr Sitoh Yih Pin (Potong Pasir). ,True
2012-09-11,Tan Chuan-Jin,"Mr Tan Chuan-Jin (Marine Parade), Acting Minister for Manpower and Senior Minister of State for National Development. ",True
2012-09-11,Tan Kheng Boon Eugene,Asst Prof Tan Kheng Boon Eugene (Nominated Member). ,True
2012-09-11,Jessica Tan Soon Neo,Ms Jessica Tan Soon Neo (East Coast). ,True
2012-09-11,Tan Su Shan,Ms Tan Su Shan (Nominated Member). ,True
2012-09-11,Patrick Tay Teck Guan,Mr Patrick Tay Teck Guan (Nee Soon). ,True
2012-09-11,Teo Chee Hean,"Mr Teo Chee Hean (Pasir Ris-Punggol), Deputy Prime Minister and Coordinating Minister for National Security and Minister for Home Affairs. ",True
2012-09-11,Teo Ho Pin,"Dr Teo Ho Pin (Bukit Panjang), Deputy Government Whip. ",True
2012-09-11,Josephine Teo,"Mrs Josephine Teo (Bishan-Toa Payoh), Minister of State for Finance and Transport. ",True
2012-09-11,Teo Siong Seng,Mr Teo Siong Seng (Nominated Member). ,True
2012-09-11,Tharman Shanmugaratnam,"Mr Tharman Shanmugaratnam (Jurong), Deputy Prime Minister and Minister for Finance. ",True
2012-09-11,Tin Pei Ling,Ms Tin Pei Ling (Marine Parade). ,True
2012-09-11,Edwin Tong Chun Fai,Mr Edwin Tong Chun Fai (Moulmein-Kallang). ,True
2012-09-11,Vikram Nair,Mr Vikram Nair (Sembawang). ,True
2012-09-11,Vivian Balakrishnan,"Dr Vivian Balakrishnan (Holland-Bukit Timah), Minister for the Environment and Water Resources. ",True
2012-09-11,Wong Kan Seng,Mr Wong Kan Seng (Bishan-Toa Payoh). ,True
2012-09-11,Lawrence Wong,"Mr Lawrence Wong (West Coast), Senior Minister of State for Education and Information, Communications and the Arts. ",True
2012-09-11,Dr Yaacob Ibrahim,"Assoc Prof Dr Yaacob Ibrahim (Moulmein-Kallang), Minister for Information, Communications and the Arts and Minister-in-charge of Muslim Affairs. ",True
2012-09-11,Alex Yam,Mr Alex Yam (Chua Chu Kang). ,True
2012-09-11,Yeo Guat Kwang,Mr Yeo Guat Kwang (Ang Mo Kio). ,True
2012-09-11,Zainal Sapari,Mr Zainal Sapari (Pasir Ris-Punggol). ,True
2012-09-11,Zainudin Nordin,Mr Zainudin Nordin (Bishan-Toa Payoh). ,True
2012-09-11,Zaqy Mohamad,Mr Zaqy Mohamad (Chua Chu Kang). ,True
